"message_id","message","message_utc","from_id","date","time"
"12170","O que essa imagem diz para você?","2023-01-15 12:07:50","1894753720.0","2023-01-15","12:07:50"
"12175","Lista das Audiências de Custódia que ocorrerão hoje (domingo) a tarde!!!!","2023-01-15 15:17:22","1894753720.0","2023-01-15","15:17:22"
"12176","Localizem seus parentes aqui e INFORMEM A SALA DE CADA UM. Mandem mensagem no 83993091000","2023-01-15 15:17:42","1894753720.0","2023-01-15","15:17:42"
"12178","Será que terroristas permitiram serem presos assim?
Será que algum meliante estava entre nossos irmãos patriotas?
☹️","2023-01-15 17:45:22","1894753720.0","2023-01-15","17:45:22"
"12179","Essa é a globo lixo que presta péssimo serviço ao Brasil!!

✅ Acompanhe tudo pelo TELEGRAM: @admsosrj","2023-01-15 23:09:31","1894753720.0","2023-01-15","23:09:31"
"12180","Live agora Ao vivo no Instagram 

INSTAGRAN:* https://www.instagram.com/","2023-01-15 23:32:53","1894753720.0","2023-01-15","23:32:53"
