"message_id","message","message_utc","from_id","date","time"
"11929","🚨 URGENTE ‼️ 

Assista até o fim e entenda porque precisamos nos manter unidos para as próximas batalhas!

Compartilhem ao máximo!!

Siga o nosso canal: https://t.me/movimentoliberdadebrasil","2022-12-27 02:13:40","1894753720.0","2022-12-27","02:13:40"
"11932","Semana decisiva, precisamos estar nas ruas em frente dos quartéis!!

Faltam 4 dias!

Vai acontecer e precisamos de todos patriotas blindados porque os grupos de WhatsApp estão cheios de infiltrados!

Compartilhe ao máximo e envie para 5 patriotas o link do nosso grupo!

https://t.me/movimentoliberdadebrasil","2022-12-27 12:34:36","1894753720.0","2022-12-27","12:34:36"
"11933","O que falar dessa mulher, @kiscassia, uma patriota de coragem que desde o primeiro dia esteve aqui no CML dando força para todos os patriotas! Não é segredo o local onde ela trabalha e que poderia sofrer retalhações mas como diz nosso hino OU VIVER A PATRIA LIVRE OU MORRER PELO BRASIL!

Obrigado pelas sábias palavras pelo carinho de sempre!!
 TMJ ATÉ DEPOIS DO FIM!!!

Acompanhe novidades em nosso canal: https://t.me/movimentoliberdadebrasil","2022-12-27 14:30:58","1894753720.0","2022-12-27","14:30:58"
"11934","Hoje no CML 27/12/22","2022-12-27 17:14:54","1894753720.0","2022-12-27","17:14:54"
