"message_id","message","message_utc","from_id","date","time"
"891097","Alan infelizmente deu mole!","2022-12-13 02:08:03","1305327979","2022-12-13","02:08:03"
"892776","Mano, generais se escreve com G, não com j 😎","2022-12-13 14:47:37","891527310","2022-12-13","14:47:37"
"892792","Pô... Já falei...postou no grupo...aberto para todos","2022-12-13 14:53:43","891527310","2022-12-13","14:53:43"
"892793","Ela que disse pra continuarmos nos QJs... Kkkkkkkkkkkkkkkkkkk","2022-12-13 14:53:46","5839834243","2022-12-13","14:53:46"
"892807","Sou seu irmão não! Não tenho irmão charlatão e ladrão","2022-12-13 14:56:53","1699647612","2022-12-13","14:56:53"
"892808","Qualquer coisa é melhor que ser um frouxo que posar de malandro.","2022-12-13 14:57:08","1445550597","2022-12-13","14:57:08"
"892809","Somos todos irmãos perante Deus","2022-12-13 14:57:08","5839834243","2022-12-13","14:57:08"
"892810","O final é vcs todos na cadeia","2022-12-13 14:57:21","1699647612","2022-12-13","14:57:21"
"892811","Do pó viemos e ao pó tornaremos","2022-12-13 14:57:30","5839834243","2022-12-13","14:57:30"
"892930","Já estão jogando a toalha patriotas","2022-12-13 16:05:56","1046804411","2022-12-13","16:05:56"
"892949","Estão sempre aguardando kkkkkkkk bando de bunda mole","2022-12-13 16:10:45","5905693559","2022-12-13","16:10:45"
"892950","Vai tomar no cu na Venezuela otario","2022-12-13 16:10:47","716624625","2022-12-13","16:10:47"
"892951","Vc respeita sua mãe? Então me respeita.","2022-12-13 16:11:12","1521323063","2022-12-13","16:11:12"
"892968","Vagabundos e vc de esquerda em grupo de direita.","2022-12-13 16:15:20","716624625","2022-12-13","16:15:20"
"892969","https://youtu.be/M_xx0mP-iUw","2022-12-13 16:15:54","2047583694","2022-12-13","16:15:54"
"893008","Normal, os bandidos não gostar de nós !","2022-12-13 16:29:56","1305327979","2022-12-13","16:29:56"
"893009","Se bolsonaro representa a honra, vc é um lixo","2022-12-13 16:29:58","5572421046","2022-12-13","16:29:58"
"893016","Já estão na mira","2022-12-13 16:30:41","1305327979","2022-12-13","16:30:41"
"893050","Todo nosso Brasil já sabem quem são os terroristas","2022-12-13 16:34:47","1305327979","2022-12-13","16:34:47"
"893051","🥱 parole parole parole","2022-12-13 16:34:58","1320768071","2022-12-13","16:34:58"
"893233","Peraí!! Ah tá","2022-12-13 18:24:09","1537522569","2022-12-13","18:24:09"
"893235","Muito top","2022-12-13 18:24:34","1446346680","2022-12-13","18:24:34"
"893252","A máscara dele já está começando a cair","2022-12-13 18:35:07","1664892263","2022-12-13","18:35:07"
"893272","Falta fé pra esse povo desse canal é muito mimimi","2022-12-13 18:46:51","940994148","2022-12-13","18:46:51"
"893273","Kkkk eu vou rir tanto da cara de vocês no dia 1","2022-12-13 18:47:22","1887221931","2022-12-13","18:47:22"
"893364","🤦🏻🤦🏻🤦🏻","2022-12-13 19:29:50","2081043185","2022-12-13","19:29:50"
"893404","Já que o Bolsonaro não manda nada o Lula vai mandar","2022-12-13 19:59:52","1320768071","2022-12-13","19:59:52"
"893421","Esses caras nao vão deixar 1 de pé se prepara para chumbo grosso.","2022-12-13 20:12:51","1420303006","2022-12-13","20:12:51"
"893477","Ele deveria se preocupar em escolher o companheiro de cela","2022-12-13 20:42:45","246412672","2022-12-13","20:42:45"
"893478","Vai ser uma farra com o nosso dinheiro","2022-12-13 20:42:45","1504869664","2022-12-13","20:42:45"
"893479","O dono deste canal é traíra.","2022-12-13 20:43:21","1935014846","2022-12-13","20:43:21"
"893487","Passam o dia fumando maconha na frente dos quartéis","2022-12-13 20:45:29","106846755","2022-12-13","20:45:29"
"893494","Ditadura vivemos hj quando o Xandão acusa julga condena e legisla","2022-12-13 20:48:23","772689071","2022-12-13","20:48:23"
"893867","OS POUCOS QUE ASSIM O FIZEREM, SERÃO PERSSEGUIDOS E CALADOS.","2022-12-13 23:59:32","1568046359","2022-12-13","23:59:32"
"893868","#SomosTodosPavinatto","2022-12-13 23:59:46","1586584068","2022-12-13","23:59:46"
"889907","vai tomar no cu. Quem é vc seu fdp pra falar comigo assim","2022-12-13 00:05:38","1456325836","2022-12-13","00:05:38"
"889933","Mas repercussão Mundial contra o Ministro dono do mundo ???.","2022-12-13 00:11:22","1305327979","2022-12-13","00:11:22"
"889953","É um bêbado ladrão condenado.
Vai voltar pro Xilindró.","2022-12-13 00:17:54","1525518285","2022-12-13","00:17:54"
"889954","Ei, bolsoasno quando tu for chorar manda áudio!!! Kkkkkk","2022-12-13 00:18:35","657461562","2022-12-13","00:18:35"
"889955","Isso ė 2014","2022-12-13 00:18:50","961798442","2022-12-13","00:18:50"
"889956","Assista a ""CONFISSÃO"" no YouTube
https://youtu.be/E2FY6oUfwR0","2022-12-13 00:19:00","5745404352","2022-12-13","00:19:00"
"890093","Eu sou o verdadeiro Laercio","2022-12-13 00:35:59","5839834243","2022-12-13","00:35:59"
"890094","Eu sou a verdadeira Laecia, kkkkkk","2022-12-13 00:36:25","657461562","2022-12-13","00:36:25"
"890095","Cu frouxoooooo","2022-12-13 00:36:26","5839834243","2022-12-13","00:36:26"
"890103","Vc com seus parceiros Bolsoafetivos","2022-12-13 00:37:23","657461562","2022-12-13","00:37:23"
"890104","Sou Laercio e sinto muito prazer anal","2022-12-13 00:37:46","5839834243","2022-12-13","00:37:46"
"890105","Prazer anal patriota.","2022-12-13 00:37:57","5839834243","2022-12-13","00:37:57"
"890780","Isso é mentira","2022-12-13 01:24:21","556346839","2022-12-13","01:24:21"
"890781","Olha aí os petistas","2022-12-13 01:24:35","5745404352","2022-12-13","01:24:35"
"890788","Shitzu, senta!","2022-12-13 01:25:50","5839834243","2022-12-13","01:25:50"
"890803","Quer ver o biquinho da teta?","2022-12-13 01:27:53","5839834243","2022-12-13","01:27:53"
"890804","Esse lixo cantar o hino!!! Amigo acorda!!","2022-12-13 01:28:00","1164000755","2022-12-13","01:28:00"
"890819","Cara, que fetiche é esse que você tem com Osasco?","2022-12-13 01:29:28","5839834243","2022-12-13","01:29:28"
"890826","Que Deus tenha misericórdia da sua alma","2022-12-13 01:30:04","1068300725","2022-12-13","01:30:04"
"890827","O jagunço","2022-12-13 01:30:09","1535724461","2022-12-13","01:30:09"
"890834","É vender estatais patria e família seu Nazista","2022-12-13 01:31:38","896279167","2022-12-13","01:31:38"
"890835","Se liga, Zé. Nem te conheço.","2022-12-13 01:31:49","5839834243","2022-12-13","01:31:49"
"890836","Eu também, pois a sua nem o demônio quer","2022-12-13 01:31:55","1445550597","2022-12-13","01:31:55"
"890837","Voce tem quanto de pau?","2022-12-13 01:32:04","896279167","2022-12-13","01:32:04"
"890838","Tá repreendido  em nome de Jesus cai por terra suas palavras","2022-12-13 01:32:37","1068300725","2022-12-13","01:32:37"
"890845","Vamos para o culto de Baal?","2022-12-13 01:34:06","896279167","2022-12-13","01:34:06"
"890853","Ditadura do judiciário.  Tem os q ajudam.....os capachos.","2022-12-13 01:35:01","940814631","2022-12-13","01:35:01"
"890888","É quando estamos fascinados por algo ou alguém","2022-12-13 01:39:50","896279167","2022-12-13","01:39:50"
"890896","Não sou COMUNISTA","2022-12-13 01:41:11","1149710829","2022-12-13","01:41:11"
"890897","Vai tomar no seu cu, seu merda","2022-12-13 01:41:12","5839834243","2022-12-13","01:41:12"
"890898","Mostra esse pinto logo","2022-12-13 01:41:14","896279167","2022-12-13","01:41:14"
"890913","Não parece nos vídeos","2022-12-13 01:42:11","5839834243","2022-12-13","01:42:11"
"890941","Ele estava fazendo uma live. E caiu não voltou mais","2022-12-13 01:43:53","5011303157","2022-12-13","01:43:53"
"890942","Vai se fuder, petralha","2022-12-13 01:43:54","5839834243","2022-12-13","01:43:54"
"890943","Infelizmente","2022-12-13 01:44:04","1149710829","2022-12-13","01:44:04"
"890952","Some daqui, comunista de bosta","2022-12-13 01:45:09","5839834243","2022-12-13","01:45:09"
"890953","Não vou experimentar, órgão excretor é para cagar","2022-12-13 01:45:10","1524844227","2022-12-13","01:45:10"
"890954","Tô começando achar que vc é mortadela pra agi dessa forma","2022-12-13 01:45:24","1149710829","2022-12-13","01:45:24"
"890955","Também não sou comunista.","2022-12-13 01:45:33","1235109615","2022-12-13","01:45:33"
"890996","Fabiano Patriota tá querendo dar o cu","2022-12-13 01:51:10","1046804411","2022-12-13","01:51:10"
"891005","Vc é o homem gostoso da foto?","2022-12-13 01:52:02","896279167","2022-12-13","01:52:02"
"891006","Eu curto um patriota de amarelo. Sinto tesão.","2022-12-13 01:52:13","5839834243","2022-12-13","01:52:13"
"891007","Rala seu verme","2022-12-13 01:52:18","1131053153","2022-12-13","01:52:18"
"891008","Boiola","2022-12-13 01:52:23","1046804411","2022-12-13","01:52:23"
"891009","Vi sua mãe no puteiro","2022-12-13 01:52:44","1131053153","2022-12-13","01:52:44"
"891010","Irmão de cú é rola","2022-12-13 01:53:10","1131053153","2022-12-13","01:53:10"
"891018","Não concordo com o vandalismo","2022-12-13 01:54:37","2031629027","2022-12-13","01:54:37"
"891031","Valeu","2022-12-13 01:56:39","5839834243","2022-12-13","01:56:39"
"891032","085.331.740-20","2022-12-13 01:57:24","1046804411","2022-12-13","01:57:24"
"891033","Ativistas de direita desconfiam que existam infiltrados nas manisfestações de hoje em Brasília.

https://vistapatria.com.br/ativistas-de-direita-desconfiam-que-existam-infiltrados-nas-manisfestacoes-de-hoje-em-brasilia/","2022-12-13 01:59:17","1280090114","2022-12-13","01:59:17"
"891034","Desconfiam !!!!!! Quando tiverem certeza avisa","2022-12-13 01:59:49","1606746232","2022-12-13","01:59:49"
"891035","Kkkkk","2022-12-13 01:59:51","1606746232","2022-12-13","01:59:51"
"891053","Se você não falasse eu nem iria reparar","2022-12-13 02:01:49","1024384484","2022-12-13","02:01:49"
"891054","Esquerda quer o causar pânico pra liderar com mão de ferro","2022-12-13 02:01:52","963634706","2022-12-13","02:01:52"
"891055","Com certeza,  incentivar a todos manterem o foco.","2022-12-13 02:01:53","1561912512","2022-12-13","02:01:53"
"891069","Certeza que são esquerdistas! Gente do MST e PCC!","2022-12-13 02:03:44","1546453535","2022-12-13","02:03:44"
"891077","Com certeza havia","2022-12-13 02:05:08","1952906877","2022-12-13","02:05:08"
"891090","Certeza que tem infiltrados.","2022-12-13 02:07:23","1524193865","2022-12-13","02:07:23"
"891098","Eai burrão, o que é fascismo?","2022-12-13 02:08:12","1445550597","2022-12-13","02:08:12"
"891099","Marginal da laia do careca.","2022-12-13 02:08:19","2117536049","2022-12-13","02:08:19"
"891100","Quando alguém é fascinado por algo","2022-12-13 02:08:36","896279167","2022-12-13","02:08:36"
"891106","Vc deve ser linda","2022-12-13 02:09:29","896279167","2022-12-13","02:09:29"
"891125","Bala de borracha nos bozolóides já","2022-12-13 02:15:34","5740300842","2022-12-13","02:15:34"
"891166","Com certeza é o MST a mando do PT pra desestabilizar os acampamentos.","2022-12-13 02:26:55","1011361739","2022-12-13","02:26:55"
"891172","São de esquerda","2022-12-13 02:32:24","1075083449","2022-12-13","02:32:24"
"891173","Teu rabo","2022-12-13 02:32:47","5839834243","2022-12-13","02:32:47"
"891174","É EITA EM CIMA DE EITA ...😡","2022-12-13 02:32:51","986621562","2022-12-13","02:32:51"
"891175","Infiltrados 😡","2022-12-13 02:32:52","1947341084","2022-12-13","02:32:52"
"891219","Isso é coisa de black blocks","2022-12-13 02:40:56","1523294721","2022-12-13","02:40:56"
"891220","Esquerdalha achando que todo mundo é otário","2022-12-13 02:41:22","1523294721","2022-12-13","02:41:22"
"891244","MAIS UM CIRCO DO NOVE DEDOS","2022-12-13 02:44:51","2067541241","2022-12-13","02:44:51"
"891267","Chamarei o LADRÃO de Dom RATÃO O LARÁPIO","2022-12-13 02:50:03","753231305","2022-12-13","02:50:03"
"891268","Certeza que tem....","2022-12-13 02:50:12","2143525738","2022-12-13","02:50:12"
"891350","O medo nos afasta de Jesus, irmão.","2022-12-13 03:13:52","5839834243","2022-12-13","03:13:52"
"891361","Cara para com isso de quartéis, isso não resolve nada","2022-12-13 03:14:20","1787483498","2022-12-13","03:14:20"
"891362","Olha eles ai PF Brasília","2022-12-13 03:14:23","1305327979","2022-12-13","03:14:23"
"891363","Vai pra cubaaaaa","2022-12-13 03:14:34","1305327979","2022-12-13","03:14:34"
"891364","Não lá só tem comunista e muitos estão infiltrados aqui","2022-12-13 03:15:11","1787483498","2022-12-13","03:15:11"
"891365","Pau mandado de quem ??","2022-12-13 03:15:13","1305327979","2022-12-13","03:15:13"
"891366","kkk","2022-12-13 03:15:14","1787483498","2022-12-13","03:15:14"
"891367","Alan vaciolou feio dessa vez","2022-12-13 03:15:27","1523294721","2022-12-13","03:15:27"
"891368","Cuida da sua vida","2022-12-13 03:15:31","1305327979","2022-12-13","03:15:31"
"891376","São todos esquerdistas!","2022-12-13 03:16:32","5745404352","2022-12-13","03:16:32"
"891413","Toda autoridade é dada por Deus.","2022-12-13 03:20:27","5839834243","2022-12-13","03:20:27"
"891422","Deus te abençoe, meu filho. E evite fazer julgamentos precipitados.","2022-12-13 03:23:25","5839834243","2022-12-13","03:23:25"
"891423","Não julgo ninguém só Deus julga","2022-12-13 03:23:48","1787483498","2022-12-13","03:23:48"
"891429","Que live foi aquela no meio dos black blocks?","2022-12-13 03:24:30","180492087","2022-12-13","03:24:30"
"891483","O que fazer agora? Essa é a pergunta.","2022-12-13 03:40:32","1550742326","2022-12-13","03:40:32"
"891504","Maicon é nome de gay","2022-12-13 03:53:44","2019690215","2022-12-13","03:53:44"
"891519","A verdade é como o sol e a lua sempre aparece graças a Deus","2022-12-13 04:03:20","2047583694","2022-12-13","04:03:20"
"891520","Narrativa sendo criada para criminalizar o PR 🇧🇷","2022-12-13 04:04:24","5745404352","2022-12-13","04:04:24"
"891526","Onde a bozolandia chegou","2022-12-13 04:10:34","1881716550","2022-12-13","04:10:34"
"891527","E antes de falar do Alexandre de Moraes foi a PGR que pediu a prisão","2022-12-13 04:10:57","1881716550","2022-12-13","04:10:57"
"891528","https://fb.watch/hnJbBdWkB9/","2022-12-13 04:10:58","1219634002","2022-12-13","04:10:58"
"891529","PGR essa indicada por Bolsonaro com Augusto Aras","2022-12-13 04:11:51","1881716550","2022-12-13","04:11:51"
"891530","https://youtu.be/rAo_7VfLyjQ","2022-12-13 04:12:23","2047583694","2022-12-13","04:12:23"
"891581","gente, acho melhor sair daqui. O Alan só sabe pedir pix","2022-12-13 04:50:08","1591850475","2022-12-13","04:50:08"
"891582","Depois chamam a esquerda de vândalos","2022-12-13 04:50:21","1683724030","2022-12-13","04:50:21"
"891583","Bando de picareta essa direita br","2022-12-13 04:50:30","1683724030","2022-12-13","04:50:30"
"891670","A memória é boa","2022-12-13 06:05:53","1881716550","2022-12-13","06:05:53"
"891671","Votaram no ladrão que só não tá preso pq tem foro priveligiado","2022-12-13 06:06:15","1881716550","2022-12-13","06:06:15"
"891793","Vocês são uma seita","2022-12-13 10:27:37","1887221931","2022-12-13","10:27:37"
"891794","Nem deviam falar em Deus","2022-12-13 10:27:43","1887221931","2022-12-13","10:27:43"
"891795","Porque são uma seita","2022-12-13 10:27:49","1887221931","2022-12-13","10:27:49"
"891796","Idolatrando uma homem","2022-12-13 10:27:53","1887221931","2022-12-13","10:27:53"
"891797","Um bezerro de ouro","2022-12-13 10:27:58","1887221931","2022-12-13","10:27:58"
"891807","Fica esperto sr flordelis, fica esperto","2022-12-13 10:34:57","5572421046","2022-12-13","10:34:57"
"891808","Bandidos, vagabundos, TERRORISTAS!!!","2022-12-13 10:35:17","1699647612","2022-12-13","10:35:17"
"891809","Adorei, Flordelis é perfeito pro sanguessuga","2022-12-13 10:35:41","1699647612","2022-12-13","10:35:41"
"891810","Kkkkk vem cá tenyar a sorte, cusao","2022-12-13 10:35:50","5572421046","2022-12-13","10:35:50"
"891811","Hahahahaha inocência","2022-12-13 10:36:04","5839834243","2022-12-13","10:36:04"
"891825","Estou aqui pela palavra de Deus, irmão","2022-12-13 10:40:11","5839834243","2022-12-13","10:40:11"
"891826","Tudo cusao, por isso defendem arma. Tudo cusao","2022-12-13 10:40:17","5572421046","2022-12-13","10:40:17"
"891841","Pesquisem","2022-12-13 10:43:09","5572421046","2022-12-13","10:43:09"
"891842","Ex gay? Kkkkkkkkkkkk
Isso não existe","2022-12-13 10:43:35","1699647612","2022-12-13","10:43:35"
"891849","Infiltrados o caralho!","2022-12-13 10:45:33","1699647612","2022-12-13","10:45:33"
"891850","Infiltrado foi seu anus","2022-12-13 10:45:34","5572421046","2022-12-13","10:45:34"
"891851","Kkkkkkkkk","2022-12-13 10:46:05","5572421046","2022-12-13","10:46:05"
"891852","Filho, obviamente isso não foi trabalho da esquerda.","2022-12-13 10:46:06","5839834243","2022-12-13","10:46:06"
"891853","Assuma, o nosso lado tem extremistas demais.","2022-12-13 10:46:25","5839834243","2022-12-13","10:46:25"
"891854","Seu ânus foi infiltrado, irmão patriota?","2022-12-13 10:47:00","5839834243","2022-12-13","10:47:00"
"891855","Deus não se agrada disso","2022-12-13 10:47:11","5839834243","2022-12-13","10:47:11"
"891880","Fala por vc eu falo por mim não boto minha mão no fogo por ninguém","2022-12-13 10:52:50","1152655054","2022-12-13","10:52:50"
"891944","Um enviado dos céus.","2022-12-13 11:26:38","5839834243","2022-12-13","11:26:38"
"891953","estão pedindo guerra faz 2 meses fantasiados de milico","2022-12-13 11:29:29","1046804411","2022-12-13","11:29:29"
"891954","Assista a ""Deus Não Mexe no Livre Arbítrio. Pão 🍞 Nosso de Cada Dia"" no YouTube
https://youtu.be/BrkqBHlu0qQ","2022-12-13 11:29:31","5745404352","2022-12-13","11:29:31"
"891955","e agora correm igual meninas assustadas","2022-12-13 11:29:37","1046804411","2022-12-13","11:29:37"
"891956","e a culpa é de terceiro","2022-12-13 11:29:40","1046804411","2022-12-13","11:29:40"
"891957","bando de covarde","2022-12-13 11:29:46","1046804411","2022-12-13","11:29:46"
"891958","aprenderam com o bolsonaro a como serem covardes e medrosos","2022-12-13 11:30:03","1046804411","2022-12-13","11:30:03"
"891959","Alan. Explica aquela live de ontem?","2022-12-13 11:30:15","5011303157","2022-12-13","11:30:15"
"891960","Sensacionalista Oficial (Instagram)

O presidente Lula e o vice Alckmin podem ficar sem diploma hoje por conta dos cortes de Bolsonaro na educação pública.

A falta de recursos é tão grande que o diploma de presidente pode ter que ser impresso numa lan house e a cerimônia realizada no cercadinho do Alvorada, já que Bolsonaro não usa mais.

Seria a terceira vez que Lula receberia o diploma de presidente, o que o faria pedir uma música no Fantástico. Mas quem vai escolher a música é a Janja.","2022-12-13 11:30:17","1281521690","2022-12-13","11:30:17"
"891962","Safado e covarde","2022-12-13 11:30:55","5615266972","2022-12-13","11:30:55"
"891970","A esquerda criminosa  que não é nem investiga ! Vergonha desse país","2022-12-13 11:33:23","1642917566","2022-12-13","11:33:23"
"891979","seu covardão","2022-12-13 11:35:26","1046804411","2022-12-13","11:35:26"
"891980","cagão","2022-12-13 11:35:27","1046804411","2022-12-13","11:35:27"
"891981","cade os dopuetados incluindo oss esquerdistas tb","2022-12-13 11:35:31","1609091311","2022-12-13","11:35:31"
"891999","Bolsonaro demora pra agir 🤷‍♀","2022-12-13 11:45:12","758429591","2022-12-13","11:45:12"
"892013","👏👏👏👏👏","2022-12-13 11:51:04","796546071","2022-12-13","11:51:04"
"892108","Lixo é tua mãe que deu pra um mendigo e te fez kkkkkkkk","2022-12-13 12:14:49","1046804411","2022-12-13","12:14:49"
"892109","Calma...","2022-12-13 12:14:51","1506893576","2022-12-13","12:14:51"
"892129","Vai lavar a louça velhota","2022-12-13 12:20:06","1046804411","2022-12-13","12:20:06"
"892130","O VAGABUNDO, CANALHA, ZÉ B*C&T@ DE MERDA, DIFAMADOR DE GENERAIS, VESTE UMA ROUPA CAMUFLADA PARA COLOCAR ESSA NA CONTA DOS INTERVENCIONISTAS. SEMPRE FEZ JOGO DUPLO NA DIREITA. SEMPRE COLOCANDO O POVO CONTRA OS GENERAIS. PETISTA DE MERDA!!!
ELE APAGOU DO YOUTUBE DELE MAS NÓS BAIXAMOS. VOU DEIXAR AQUI O REGISTRO.
ELES ESTÃO LIMPANDO OS RASTROS DAS REDES.","2022-12-13 12:21:20","5839834243","2022-12-13","12:21:20"
"892131","Alan você  é  um vagabundo!","2022-12-13 12:21:24","1535774420","2022-12-13","12:21:24"
"892132","Safado","2022-12-13 12:21:39","1535774420","2022-12-13","12:21:39"
"892218","Bom dia, irmão. Paz do senhor","2022-12-13 12:32:55","5839834243","2022-12-13","12:32:55"
"892224","Com certeza vai pegar os Comunistas, já tem vídeos a vontade","2022-12-13 12:33:16","1305327979","2022-12-13","12:33:16"
"892233","https://t.me/+jtygz1lm-UBiMjFh","2022-12-13 12:34:57","2034193417","2022-12-13","12:34:57"
"892241","Olha aí a prova cabal","2022-12-13 12:35:40","1305327979","2022-12-13","12:35:40"
"892242","Bem no começo","2022-12-13 12:35:53","610398206","2022-12-13","12:35:53"
"892243","Ahammm.... faltando 17 dias... acredito.","2022-12-13 12:36:20","922154901","2022-12-13","12:36:20"
"892244","FORAM COMMUNIST4 $$... SAFADO $$.... COMO É USUAL🤔","2022-12-13 12:36:25","5126825983","2022-12-13","12:36:25"
"892251","FORAM COMMUNIST4 $$.... ÓBVIO 🤔","2022-12-13 12:37:25","5126825983","2022-12-13","12:37:25"
"892252","Ela é mas macho do que vocês Comunistas","2022-12-13 12:37:27","1305327979","2022-12-13","12:37:27"
"892320","Falou tudo pastor. Pessoas fracas!","2022-12-13 12:46:47","796546071","2022-12-13","12:46:47"
"892321","Lixo vermelho","2022-12-13 12:47:03","1305327979","2022-12-13","12:47:03"
"892334","😂","2022-12-13 12:48:32","1305327979","2022-12-13","12:48:32"
"892335","🚔","2022-12-13 12:48:38","1305327979","2022-12-13","12:48:38"
"892361","Claro, está infestado de ratos Comunistas","2022-12-13 12:53:23","1305327979","2022-12-13","12:53:23"
"892367","Centenas","2022-12-13 12:54:21","1305327979","2022-12-13","12:54:21"
"892374","Esse fala fino está com ciúmes da primeira dama.","2022-12-13 12:54:55","2117536049","2022-12-13","12:54:55"
"892375","Conto com o senhor pra ajudar. Só falar os nomes e eu expulso","2022-12-13 12:55:00","5839834243","2022-12-13","12:55:00"
"892381","Vc tá em guerra contra quem?","2022-12-13 12:57:29","891527310","2022-12-13","12:57:29"
"892414","A putas do Bolsorabo estão ouriçadas","2022-12-13 13:01:05","916136743","2022-12-13","13:01:05"
"892551","Filhote de alemão","2022-12-13 13:21:02","1305327979","2022-12-13","13:21:02"
"892552","Polícia federal? Qual polícia federal? A do Xandão?","2022-12-13 13:21:07","1009900380","2022-12-13","13:21:07"
"892563","Vivem em um mundo paralelo","2022-12-13 13:23:58","1046804411","2022-12-13","13:23:58"
"892564","VC É UM INFILTRADO","2022-12-13 13:24:18","854232959","2022-12-13","13:24:18"
"892576","Graças a Deus sou do bem não saio da minha casa pra procurar baderna","2022-12-13 13:27:14","1152655054","2022-12-13","13:27:14"
"892775","https://t.me/DeuspatriafamilialiberdadeBrasil","2022-12-13 14:46:48","1773578798","2022-12-13","14:46:48"
"889916","Iha","2022-12-13 00:08:23","5839834243","2022-12-13","00:08:23"
"889947","Tudo marginal","2022-12-13 00:16:07","657461562","2022-12-13","00:16:07"
"890090","Fake","2022-12-13 00:35:44","5839834243","2022-12-13","00:35:44"
"891004","Lamentável","2022-12-13 01:51:51","748133897","2022-12-13","01:51:51"
"890087","Para de me imitar, seu viado","2022-12-13 00:35:25","657461562","2022-12-13","00:35:25"
"890091","Cú Frouxoooooo","2022-12-13 00:35:46","1525518285","2022-12-13","00:35:46"
"890092","Cú Frouxoooooo","2022-12-13 00:35:51","1525518285","2022-12-13","00:35:51"
"890132","Delícia","2022-12-13 00:39:38","5839834243","2022-12-13","00:39:38"
"890728","Sua esposa gosta de menage?","2022-12-13 01:11:36","896279167","2022-12-13","01:11:36"
"890729","Usa calcinha","2022-12-13 01:11:36","1046804411","2022-12-13","01:11:36"
"890730","Sabia","2022-12-13 01:11:38","1046804411","2022-12-13","01:11:38"
"890731","Cachaça","2022-12-13 01:11:52","956180496","2022-12-13","01:11:52"
"890732","😱🤓","2022-12-13 01:12:10","5360782157","2022-12-13","01:12:10"
"890747","Uhum","2022-12-13 01:14:17","5716286044","2022-12-13","01:14:17"
"891017","Sou eu, pq?","2022-12-13 01:54:25","5839834243","2022-12-13","01:54:25"
"891324","Concerteza","2022-12-13 03:09:46","547951819","2022-12-13","03:09:46"
"890779","Vagabundos GOLPISTAS","2022-12-13 01:24:02","556346839","2022-12-13","01:24:02"
"889903","Vendo aqui na CNN o pau tá comendo cacete e gaz de pimenta neles","2022-12-13 00:04:27","1152655054","2022-12-13","00:04:27"
"889904","a onça vai estorar de tanta agua q ta bebendo...","2022-12-13 00:04:53","158906661","2022-12-13","00:04:53"
"889905","Foi preso  não.  Desmentiram.","2022-12-13 00:05:22","1842889339","2022-12-13","00:05:22"
"889906","A onça já se afogou com tanta água","2022-12-13 00:05:31","1068300725","2022-12-13","00:05:31"
"889901","MECHEU NO VESPEIRO...MR.🥚","2022-12-13 00:01:58","5126825983","2022-12-13","00:01:58"
"889908","FOI AGREDIDO , DESACORDADO E PRESO...SIM.   ...
PS. SEU FILHO 1O ANOS, FOI AGREDIDO TB...FATO","2022-12-13 00:06:31","5126825983","2022-12-13","00:06:31"
"889909","Sugada*","2022-12-13 00:06:33","5839834243","2022-12-13","00:06:33"
"889911","Bolsonaro espera tanto que dorme no ponto","2022-12-13 00:07:19","5360782157","2022-12-13","00:07:19"
"889913","Papinha besta de ""capitólio""","2022-12-13 00:07:36","5360782157","2022-12-13","00:07:36"
"889914","Engraçado chamar o eleito de ladrão é crime, mas chamar o atual presidente de genocida, não é croma. Dois pesos, duas medidas. Grrrrr 😡","2022-12-13 00:07:41","1551881982","2022-12-13","00:07:41"
"889915","Gostaria de saber porque o Presidente sancionou a lei que substitui a lei de segurança nacional? Abriu precedentes para esses absurdos.","2022-12-13 00:07:55","1138981114","2022-12-13","00:07:55"
"889917","Daniel, pelo jeito que você fala parece ter um quadro avançado de lambimia. Procure um médico.","2022-12-13 00:08:23","5839834243","2022-12-13","00:08:23"
"889925","Ultimamente YouTube  tem muita mentira e fakenew","2022-12-13 00:09:15","961798442","2022-12-13","00:09:15"
