"message_id","message","message_utc","from_id","date","time"
"892159","A última palavra vem de Deus.
Os Conservadores estavam nos Quartéis e na casa do Presidente, o Alan Frutuoso é quem tem que explicar o que aconteceu?
Afinal ele gravou um vídeo dizendo que era guerra, aí depois apagou, o que ele estava fazendo junto com os terrorista vermelhos?","2022-12-13 12:27:00","1305327979","2022-12-13","12:27:00"
"892161","O tempo de reação já passou tem uns 3 anos. Quando viu que a guerra política não era uma guia pra pintar com cal, ele, como um bom militar brasileiro, preferiu se aliar ao inimigo e dar uma de vítima.","2022-12-13 12:27:01","1054285425","2022-12-13","12:27:01"
"892162","Terrorista de Luladrao","2022-12-13 12:27:20","1305327979","2022-12-13","12:27:20"
"892163","🧐👉ONDE FOI MESMO,  MOMENTO EM Q O ÍNDIO FOI PRESO, OBSERVE QUE SEU FILHO ESTÁ AO LADO. 
SE ESTIVESSE NO QG NÃO SERIA
SE ESTIVESSE NO ALVORADA NÃO SERIA,
POR SUA CONTA É RISCO RESOLVEU ARRISCAR,
POIS FOI AVISADO.
👇🧐👇🤨👇🤔","2022-12-13 12:27:28","1249580026","2022-12-13","12:27:28"
"892164","Só sua opinião","2022-12-13 12:27:40","1305327979","2022-12-13","12:27:40"
"892165","Chupa meu pau seu otário","2022-12-13 12:27:53","1046804411","2022-12-13","12:27:53"
"892166","COM CERTEZA, ESSES ATOS FORAM FEITOS PELA ESQUERDA....LEIA SE...PT MST E OUTRAS BOST💩$$$🚩","2022-12-13 12:27:56","5126825983","2022-12-13","12:27:56"
"892168","Sim. Tipo a minha opinião quanto ao fogo queimar.","2022-12-13 12:28:17","1054285425","2022-12-13","12:28:17"
"892169","O índio foi só o estrumento festa trama mau sucedida cavada pelos inimigos do nosso Brasil, porquê sabem o que vai acontecer com eles.","2022-12-13 12:28:44","1305327979","2022-12-13","12:28:44"
"892204","Vão todos pra cadeia","2022-12-13 12:31:46","1699647612","2022-12-13","12:31:46"
"892171","A sua bandeira já te indentifica !","2022-12-13 12:29:12","1305327979","2022-12-13","12:29:12"
"892172","LULA LADRÃO e você TB é","2022-12-13 12:29:39","784019936","2022-12-13","12:29:39"
"892173","Uau! O cara também é um dcifrador de códigos subliminares.","2022-12-13 12:29:48","1054285425","2022-12-13","12:29:48"
"892174","A PF Nacional não tem nada a ver com a polícia do Xandão.","2022-12-13 12:29:58","1305327979","2022-12-13","12:29:58"
"892176","Estrumento de novo? Já ensinei, é instrumento! É burro demais!!!","2022-12-13 12:30:16","1699647612","2022-12-13","12:30:16"
"892177","Tadinho","2022-12-13 12:30:16","1305327979","2022-12-13","12:30:16"
"892180","Te entendo, meu filho. Realmente é difícil não responder às provocações do inimigo. Mas você tem isso dentro de você. Não deixe o inimigo te vencer verbalmente. O que ele quer é trocar chumbo mesmo.","2022-12-13 12:30:29","5839834243","2022-12-13","12:30:29"
"892181","água não ,ele entrou e já bebeu a pinga ele e alcoólico","2022-12-13 12:30:29","784019936","2022-12-13","12:30:29"
"892182","Comana","2022-12-13 12:30:29","1305327979","2022-12-13","12:30:29"
"892206","Ler comuna","2022-12-13 12:32:07","1305327979","2022-12-13","12:32:07"
"892188","Vocês","2022-12-13 12:30:45","1305327979","2022-12-13","12:30:45"
"892192","Vocês","2022-12-13 12:30:56","1305327979","2022-12-13","12:30:56"
"892194","Terrorista bolsonarista","2022-12-13 12:31:04","1699647612","2022-12-13","12:31:04"
"892195","É muita esquizofrenia nesse chat... Divertido demais!","2022-12-13 12:31:11","1054285425","2022-12-13","12:31:11"
"892196","Acuse eles do que vocês são 
Não vai colar","2022-12-13 12:31:16","1305327979","2022-12-13","12:31:16"
"892197","Terrorista bolsonarista","2022-12-13 12:31:17","1699647612","2022-12-13","12:31:17"
"892198","Terrorista bolsonarista","2022-12-13 12:31:26","1699647612","2022-12-13","12:31:26"
"892199","Lulistas","2022-12-13 12:31:28","1305327979","2022-12-13","12:31:28"
"892201","Terrorista bolsonarista","2022-12-13 12:31:36","1699647612","2022-12-13","12:31:36"
"892209","Olha vocês ai","2022-12-13 12:32:18","1305327979","2022-12-13","12:32:18"
"892212","Olha vocês ai","2022-12-13 12:32:30","1305327979","2022-12-13","12:32:30"
"892215","“Tudo será apurado e esclarecido”, diz Torres sobre protestos em Brasília.

https://vistapatria.com.br/tudo-sera-apurado-e-esclarecido-diz-torres-sobre-protestos-em-brasilia/","2022-12-13 12:32:46","1280090114","2022-12-13","12:32:46"
"892217","Com certeza a PF Brasília já tem as imagens","2022-12-13 12:32:51","1305327979","2022-12-13","12:32:51"
"892220","Não aceitam a mentira de que eram ""bolsonaristas"".","2022-12-13 12:33:12","610398206","2022-12-13","12:33:12"
"892221","Já divulgaram?","2022-12-13 12:33:12","5839834243","2022-12-13","12:33:12"
"892226","Comunistas","2022-12-13 12:33:30","1305327979","2022-12-13","12:33:30"
"892227","Kkk","2022-12-13 12:34:01","1229937492","2022-12-13","12:34:01"
"892228","uma pergunta qual polícia Federal pois precisam se identificar ,em quem acreditamos na.pokicia federal não mais","2022-12-13 12:34:07","784019936","2022-12-13","12:34:07"
"892229","Eles sabiam que os brasileiros e brasileiras de bem estavam seguros no acampamento e na casa do Presidente, aí entraram em Pânico, aí montaram o plano do dissispero, não é Alan Flutuoso?","2022-12-13 12:34:27","1305327979","2022-12-13","12:34:27"
"892230","Não consegui ouvir bem o ""Fora, Bolsonaro""","2022-12-13 12:34:46","5839834243","2022-12-13","12:34:46"
"892231","Óbvio que são infiltrados. 43 dias em ordem e, de repente, isso?","2022-12-13 12:34:52","1649949759","2022-12-13","12:34:52"
"892236","Este é o motivo","2022-12-13 12:35:19","1305327979","2022-12-13","12:35:19"
"892237","Do dissispero","2022-12-13 12:35:25","1305327979","2022-12-13","12:35:25"
"892239","Alan tá correndo da polícia ainda galera calma, ele tá procurando quem tá com fuzil pra matar os esquerdista! Já já passa o efeito e ele aparece, vários tiros em Brasília ontem segundo ele!","2022-12-13 12:35:33","5658179099","2022-12-13","12:35:33"
"892246","Ele filmou e apagou  !
A pergunta de um bilhão de dólares, o que ele estava fazendo lá ?","2022-12-13 12:36:43","1305327979","2022-12-13","12:36:43"
"892247","Top dezzzzzzzzzz","2022-12-13 12:36:47","1305327979","2022-12-13","12:36:47"
"892249","Pega ele aí !","2022-12-13 12:37:00","1305327979","2022-12-13","12:37:00"
"892250","Ela bota a cara, vocês escondem a cara!","2022-12-13 12:37:15","1305327979","2022-12-13","12:37:15"
"892253","Não apuraram, em 4 anos, nem quem mandou matar Bolsonaro ... é piada dizer que vão apurar isso aí em 17 dias.","2022-12-13 12:37:41","922154901","2022-12-13","12:37:41"
"892254","A espanhola?","2022-12-13 12:37:48","2062242976","2022-12-13","12:37:48"
"892256","Olha eles ai gente os terrorista vermelhos contratos da rede Globo","2022-12-13 12:38:07","1305327979","2022-12-13","12:38:07"
"892257","Esse aí é um que não confio mesmo, as prisões ilegais ele deixa?","2022-12-13 12:38:24","5397103008","2022-12-13","12:38:24"
"892258","MÁSCARA DE ""BLACK. BLOCKS"".... COMMUNIST4 $$...TB🤔","2022-12-13 12:38:28","5126825983","2022-12-13","12:38:28"
"892273","Não vai conseguir,vão todos em cana","2022-12-13 12:39:42","1305327979","2022-12-13","12:39:42"
"892294","👏👏👏👏","2022-12-13 12:41:46","796546071","2022-12-13","12:41:46"
"892265","Vocês","2022-12-13 12:38:56","1305327979","2022-12-13","12:38:56"
"892266","Cabra macho","2022-12-13 12:39:09","1305327979","2022-12-13","12:39:09"
"892267","FATO🤔","2022-12-13 12:39:09","5126825983","2022-12-13","12:39:09"
"892280","Pilantra, vc foi um q incentivou o povo a sair dos quartéis, desconfiem destes q ficam pedindo dinheiro toda hora p financiar sua cobertura em Brasília.","2022-12-13 12:41:01","1935014846","2022-12-13","12:41:01"
"892269","Chiiiiiiiii","2022-12-13 12:39:21","1305327979","2022-12-13","12:39:21"
"892275","A verdade é tremenda","2022-12-13 12:40:09","1305327979","2022-12-13","12:40:09"
"892276","Isso ai, se vc tiver é só de enfeite pq vc como comunista e tb como todo mundo já sabe.... vcs gostam de queimar a rosca. Kkkkkkkk me erra Lixo! Lixo, faz um favor..  volta para o lixo e cala essa boca cheia de 💩💩💩💩 kkkkkk Lixo.","2022-12-13 12:40:45","796546071","2022-12-13","12:40:45"
"892277","ALAN ALAN ALAN ALAN TU CAGOU NO PAU DO PALHAÇO COM AQUELA ENCENAÇAO EM BRASÍLIA DIZENDO QUE ESTAVA TENDO GUERRA... VOCÊ NÃO SERVE PRA ATOR TA JOGANDO A SUA HONRA NA LATA DE LIXO SE É QUE TINHA... CAGOU MAS CAGOU FEIO NO PAU DO PALHAÇO VIU, REVEJA OS SEUS CONCEITOS... ... NINGUÉM CONFIA... EM VOCÊS MAIS... ...","2022-12-13 12:40:47","361548333","2022-12-13","12:40:47"
"892278","Fez merda em frutuoso, isso estava armado e vc caiu que nem um franguinho","2022-12-13 12:40:56","234636294","2022-12-13","12:40:56"
"892279","Temos evidências de que a violência partiu da direita, irmão.","2022-12-13 12:40:57","5839834243","2022-12-13","12:40:57"
"893722","Aceitem","2022-12-13 22:51:35","1887221931","2022-12-13","22:51:35"
"892300","Deus é mais","2022-12-13 12:44:21","5839834243","2022-12-13","12:44:21"
"892295","Pior que tem vídeo seu junto com os caras. Vai dar merda. Vc foi identificado","2022-12-13 12:42:07","234636294","2022-12-13","12:42:07"
"892297","https://t.me/EndireitaBRA","2022-12-13 12:42:44","5722697467","2022-12-13","12:42:44"
"892298","Pastor, você me salvou desse lixo. Parei!! 🙏","2022-12-13 12:43:03","796546071","2022-12-13","12:43:03"
"892299","https://t.me/EndireitaBRA","2022-12-13 12:43:04","5722697467","2022-12-13","12:43:04"
"892301","Deixa de ser trouxa .


Lula só tem maioria nas urnas abestado.


Sempre na história,quem tem maioria nas ruas tem maioria dos votos.


Explicar fatos simples a petista burro é complicado.","2022-12-13 12:44:27","1507359086","2022-12-13","12:44:27"
"892302","Sempre.","2022-12-13 12:44:50","796546071","2022-12-13","12:44:50"
"892303","A casa caiu Frutuoso.

É jôio no trigo","2022-12-13 12:45:02","1396915154","2022-12-13","12:45:02"
"892304","Venderam a alma para satanás","2022-12-13 12:45:03","1305327979","2022-12-13","12:45:03"
"892306","Já está na superintendência da PF Brasília","2022-12-13 12:45:25","1305327979","2022-12-13","12:45:25"
"892307","Estamos há  mais  de 2 anos aguardando JB tomar providências.  Até  quando?","2022-12-13 12:45:28","1374489227","2022-12-13","12:45:28"
"892308","Será que td será apurado???
E esse GORDINHO ai no meio da bagunça???
ALGUEM CONHECE????","2022-12-13 12:45:30","641025481","2022-12-13","12:45:30"
"892310","https://t.me/BRLiberto/2436","2022-12-13 12:45:36","5776374378","2022-12-13","12:45:36"
"892311","Vai puxar a corda de 🦀","2022-12-13 12:45:38","1305327979","2022-12-13","12:45:38"
"892312","Macaco de circo","2022-12-13 12:45:39","1046804411","2022-12-13","12:45:39"
"892319","o que a bolsa de valores tem a ver com sua vida?","2022-12-13 12:46:46","891527310","2022-12-13","12:46:46"
"892314","Verdade","2022-12-13 12:45:56","1305327979","2022-12-13","12:45:56"
"892316","O inimigo usa pessoas frágeis para nos desviar. Cabe a nós não entrar no mesmo barco.","2022-12-13 12:46:14","5839834243","2022-12-13","12:46:14"
"892317","Estamos aguardando  há  mais de  2 anos  JB tomar as providências.  Até  quando?","2022-12-13 12:46:33","1374489227","2022-12-13","12:46:33"
"892318","Não passa de um Zé Pix.","2022-12-13 12:46:36","1396915154","2022-12-13","12:46:36"
"892322","Vc brasileiro de bem pense bem antes de atender esses chamados desses influênciadodores digitais que ficam inflamando o povo convocando pra ir pra Brasília pense bem quando a casa cai eles tiram o deles da reta e vcs se ferrão","2022-12-13 12:47:04","1152655054","2022-12-13","12:47:04"
"892323","O patriota homossexual já tá doido pra dar o cu pro pastor gay","2022-12-13 12:47:12","1046804411","2022-12-13","12:47:12"
"892324","Até acreditava nesse cara","2022-12-13 12:47:19","5776374378","2022-12-13","12:47:19"
"892326","Aqueles que tem o altíssimo como guia, não se deixam levar por palavras.","2022-12-13 12:47:29","5839834243","2022-12-13","12:47:29"
"892328","COMO QUE PATRIOTAS VÃO GRITAR FORA BOLSONARO BOLSONARO FILHO DA PUTA... .... COMO COMO ???????????????

SÃO OS BANDIDOS ESQUERDISTAS COMUNISTAS QUE ARMARAM TUDO ISSO... ... ANTFFAS BLACK BLOCK... AS BANDIDAGENS COMUNISTAS...","2022-12-13 12:47:38","361548333","2022-12-13","12:47:38"
"892330","Uai.... Claro que são 🤣🤣","2022-12-13 12:47:59","891527310","2022-12-13","12:47:59"
"892331","Pois é","2022-12-13 12:48:07","1229937492","2022-12-13","12:48:07"
"892332","Alan Flutuoso responde !","2022-12-13 12:48:08","1305327979","2022-12-13","12:48:08"
"892338","Para os amigos dininho","2022-12-13 12:49:06","1305327979","2022-12-13","12:49:06"
"892339","Filé, este é o motivo deste dissispero","2022-12-13 12:49:31","1305327979","2022-12-13","12:49:31"
"892353","2 anos não. No final de 2019, Bolsonaro se rendeu ao sistema e começou a trabalhar para tornar o Brasil um país socialista de fato. Ele fez mais para a esquerda em 3 anos que o Lula e a Dilma em seus mandatos.","2022-12-13 12:51:38","1054285425","2022-12-13","12:51:38"
"892342","Chora gado.... Toma cloroquina e chora 🤣🤣🤣🤣","2022-12-13 12:49:51","891527310","2022-12-13","12:49:51"
"892343","Ouve petralhas","2022-12-13 12:49:55","1305327979","2022-12-13","12:49:55"
"892344","OVO + PF + INFILTRADOS: CAOS EM BRASÍLIA!
https://youtu.be/n9WbUp10H1s","2022-12-13 12:50:09","5144775361","2022-12-13","12:50:09"
"892345","Não ele falou ontem !","2022-12-13 12:50:29","1305327979","2022-12-13","12:50:29"
"892360","hehehehe","2022-12-13 12:53:20","1054285425","2022-12-13","12:53:20"
"892346","A prisão e confusão foi na frente da PF. As pessoas tem que se informar antes de acusar A ou B. Sabemos que foi tudo montado para ocorrer a confusão. Mesmo que ninguém da manifestação estivesse ali, iriam fazer do mesmo jeito. Não caio narrativa de esquerdista infiltrado e nem de gente desinformada. Já tem diversos vídeos e fotos circulando, inclusive que identificam pessoas deixando claro sua participação. Estou nem aí para a mídia, sempre mentiu, não vai fazer diferente agora.","2022-12-13 12:50:31","5563893199","2022-12-13","12:50:31"
"892347","Não vem não","2022-12-13 12:50:35","1305327979","2022-12-13","12:50:35"
"892348","Assista a """"MISSÃO DADA É MISSÃO CUMPRIDA"". O CA0S NO BRASIL TEM NOME!"" no YouTube
https://youtu.be/g4FCL_7HvwI","2022-12-13 12:50:46","1773578798","2022-12-13","12:50:46"
"892349","MANDA ESSA BICHA ESCROTA PROCURAR UMA ROLA","2022-12-13 12:51:01","1520085194","2022-12-13","12:51:01"
"892350","Isso","2022-12-13 12:51:01","1305327979","2022-12-13","12:51:01"
"892352","https://t.me/DeuspatriafamilialiberdadeBrasil","2022-12-13 12:51:25","1773578798","2022-12-13","12:51:25"
"892355","Real","2022-12-13 12:51:49","1305327979","2022-12-13","12:51:49"
"892356","Caramba, eu fico uns dias fora e esse chat vira essa bagunça","2022-12-13 12:52:16","5839834243","2022-12-13","12:52:16"
"892357","Sua opinião não procede, sua postagem e Fake News.
Assinado a agência de checagem de direita !","2022-12-13 12:52:43","1305327979","2022-12-13","12:52:43"
"892358","Mais de 100 mil mensagens.","2022-12-13 12:52:51","5839834243","2022-12-13","12:52:51"
"892359","O jornal Metrópoles tem provas que foram ""bolsonaristas""?

https://twitter.com/Metropoles/status/1602481388028149760?t=1STuWsiJ0XCXzJFF-B2DKw&s=19","2022-12-13 12:52:53","809131641","2022-12-13","12:52:53"
"892364","Pode me identificar alguns, pastor? Já vou fazer um limpa.","2022-12-13 12:53:58","5839834243","2022-12-13","12:53:58"
"892368","Saiu da tumba, o ministro da justiça, por um momento achei que era o professor ""Klump"" Flávio Dinossauro.","2022-12-13 12:54:26","1250200013","2022-12-13","12:54:26"
"892369","Imprensa brasileira:","2022-12-13 12:54:27","809131641","2022-12-13","12:54:27"
"892370","Você basta ver as falas deles","2022-12-13 12:54:32","1305327979","2022-12-13","12:54:32"
"892372","E faz diferença??? O povo continua acreditando em fofoca.","2022-12-13 12:54:44","1536235718","2022-12-13","12:54:44"
"892373","Olha os terrorista vermelhos contratos da rede Globo","2022-12-13 12:54:54","1305327979","2022-12-13","12:54:54"
"892377","O controle é de vocês !
Se fosse meu, zero chance para eles !
Estamos em guerra !","2022-12-13 12:55:43","1305327979","2022-12-13","12:55:43"
"892380","Mas o senhor espera que eu leia mais de 100 mil mensagens pra identificar todos?","2022-12-13 12:56:14","5839834243","2022-12-13","12:56:14"
"892383","Como assim ninguém foi preso ontem???? Como assim os bombeiros não atuaram pra apagar os ônibus em chama??? Tudo orquestrado, tudo organizado!!! Tem método, era previsível e aconteceu. Até onde vai isso??","2022-12-13 12:58:04","1680087281","2022-12-13","12:58:04"
"892384","Deveriam incluir a mães desse traste por ter parido algo tão abjeto!!!","2022-12-13 12:58:16","1048984641","2022-12-13","12:58:16"
"892387","Assista a ""MUNDO PAROU DIPLOMAÇÃO DO BARBA 12/12/2022"" no YouTube
https://youtu.be/CBL8Lv_JT1U","2022-12-13 12:59:28","5745404352","2022-12-13","12:59:28"
"892388","https://www.instagram.com/reel/CmGRG_cASCm/?igshid=YmRhOGE0MWQ=","2022-12-13 12:59:31","1305327979","2022-12-13","12:59:31"
"892389","A putas do Bolsorabo estão ouriçadas","2022-12-13 12:59:51","916136743","2022-12-13","12:59:51"
"892391","A putas do Bolsorabo estão ouriçadas","2022-12-13 12:59:53","916136743","2022-12-13","12:59:53"
"892392","A putas do Bolsorabo estão ouriçadas","2022-12-13 12:59:56","916136743","2022-12-13","12:59:56"
"892393","A putas do Bolsorabo estão ouriçadas","2022-12-13 12:59:59","916136743","2022-12-13","12:59:59"
"892394","A putas do Bolsorabo estão ouriçadas","2022-12-13 13:00:01","916136743","2022-12-13","13:00:01"
"892396","A putas do Bolsorabo estão ouriçadas","2022-12-13 13:00:03","916136743","2022-12-13","13:00:03"
"892397","A putas do Bolsorabo estão ouriçadas","2022-12-13 13:00:05","916136743","2022-12-13","13:00:05"
"892399","A putas do Bolsorabo estão ouriçadas","2022-12-13 13:00:08","916136743","2022-12-13","13:00:08"
"892401","A putas do Bolsorabo estão ouriçadas","2022-12-13 13:00:10","916136743","2022-12-13","13:00:10"
"892426","""A democracia só tem sentido, e será defendida pelo povo, na medida em que promover, de fato, a igualdade de direitos e oportunidades para todos e todas, independentemente de classe social, cor, crença religiosa ou orientação sexual.

É com o compromisso de construir um verdadeiro Estado democrático, garantir a normalidade institucional e lutar contra todas as formas de injustiça, que recebo pela terceira vez este diploma de presidente eleito do Brasil – em nome da liberdade, da dignidade e da felicidade do povo brasileiro."" Lula, 12/12/2022.","2022-12-13 13:02:07","891527310","2022-12-13","13:02:07"
"892404","A putas do Bolsorabo estão ouriçadas","2022-12-13 13:00:21","916136743","2022-12-13","13:00:21"
"892405","A putas do Bolsorabo estão ouriçadas","2022-12-13 13:00:23","916136743","2022-12-13","13:00:23"
"892406","A putas do Bolsorabo estão ouriçadas","2022-12-13 13:00:25","916136743","2022-12-13","13:00:25"
"892407","Olha vocês ai gente","2022-12-13 13:00:26","1305327979","2022-12-13","13:00:26"
"892413","Vcs são muito feios kkkkkkkk","2022-12-13 13:01:03","916136743","2022-12-13","13:01:03"
"892415","☝🏻 O TRAÍRA","2022-12-13 13:01:08","5268146184","2022-12-13","13:01:08"
"892416","A putas do Bolsorabo estão ouriçadas","2022-12-13 13:01:08","916136743","2022-12-13","13:01:08"
"892417","A putas do Bolsorabo estão ouriçadas","2022-12-13 13:01:11","916136743","2022-12-13","13:01:11"
"892418","O Alan estava com o demônio!!!! Se tudo for apurado realmente ele vái ser preso pra curar os demônios na cadeia.","2022-12-13 13:01:13","1196703072","2022-12-13","13:01:13"
"892419","https://www.instagram.com/reel/CmGRG_cASCm/?igshid=YmRhOGE0MWQ=","2022-12-13 13:01:19","1305327979","2022-12-13","13:01:19"
"892420","Chiiiiiiiii","2022-12-13 13:01:25","1305327979","2022-12-13","13:01:25"
"892447","MAIS PARCERIA? O STF JÁ ESTÁ CONTRA O POVO E O BRASIL FAZ TEMPO.","2022-12-13 13:04:46","5763077962","2022-12-13","13:04:46"
"892422","No alvo","2022-12-13 13:01:35","1305327979","2022-12-13","13:01:35"
"892423","☝🏻 O TRAÍRA","2022-12-13 13:01:45","5268146184","2022-12-13","13:01:45"
"892425","https://youtu.be/UV0OgPyhdtM","2022-12-13 13:02:04","809131641","2022-12-13","13:02:04"
"892427","☝🏻 O TRAÍRA","2022-12-13 13:02:08","5268146184","2022-12-13","13:02:08"
"892429","Assista a ""#AoVivo: Cerimônia alusiva ao Dia do Marinheiro"" no YouTube
https://youtu.be/LtY2fIsX5L8","2022-12-13 13:02:18","5745404352","2022-12-13","13:02:18"
"892550","Top dezzzzzzzzzz","2022-12-13 13:20:49","1305327979","2022-12-13","13:20:49"
"892431","☝🏻 O TRAÍRA","2022-12-13 13:02:46","5268146184","2022-12-13","13:02:46"
"892435","Verdade que estava tudo armado, por analogia era para acontecer na hora da posse, mas o presidente abre as portas do Alvorada e consegue abafar até a hora do ocorrido por volta do começo da noite, quando os infiltrados agiram colocando fogo em ônibus e tentando invadir a PF, vídeos acima provam o "" Índios que montaram em ônibus e afirmam que (não sabemos onde vamos)"", o excesso de invadir Shopping, aeroporto e porta de Hotel onde estava o Ladrão, já era esperado só foi retardado por conta da ação do Presidente Bolsonaro.
Simples assim.","2022-12-13 13:03:13","1165602459","2022-12-13","13:03:13"
"892436","SE BOLSONARO HONRASSE SUAS CALÇAS E ACIONASSE O ART.142 E AS FFAA NENHUM ESQUEMA DE SEGURANÇA SALVARIA ESSES BANDIDOS, SERIAM TODOS CERCADOS E IRIAM PRESOS TODOS JUNTOS E MISTURADOS.","2022-12-13 13:03:17","5763077962","2022-12-13","13:03:17"
"892437","☝🏻 O TRAÍRA","2022-12-13 13:03:44","5268146184","2022-12-13","13:03:44"
"892448","A direita já venceu e ""eles"" sabem o que vem pela frente🪖🪖🪖. Por isso essas cenas pra botarem o terror. Já foi esse tempo que isso funcionava.","2022-12-13 13:04:46","1521323063","2022-12-13","13:04:46"
"892441","☝🏻 O TRAÍRA","2022-12-13 13:04:03","5268146184","2022-12-13","13:04:03"
"892444","☝🏻 O TRAÍRA","2022-12-13 13:04:22","5268146184","2022-12-13","13:04:22"
"892449","☝🏻 O TRAÍRA","2022-12-13 13:05:12","5268146184","2022-12-13","13:05:12"
"892450","Bolsonaro, vão FUDER tua mulher também. Eu já venho disendo isso faz tempo","2022-12-13 13:05:15","5075799869","2022-12-13","13:05:15"
"892455","VCS SÃO TERRORISTAS!
E VÃO TODOS PRA CADEIA!!!","2022-12-13 13:05:58","1699647612","2022-12-13","13:05:58"
"892456","Chiiiiiiiii","2022-12-13 13:06:01","1305327979","2022-12-13","13:06:01"
"892457","Vocês","2022-12-13 13:06:08","1305327979","2022-12-13","13:06:08"
"892458","☝🏻 O TRAÍRA","2022-12-13 13:06:12","5268146184","2022-12-13","13:06:12"
"892461","INFILTRADO É O CARALHO!!!","2022-12-13 13:06:19","1699647612","2022-12-13","13:06:19"
"892463","Vai vim tudo para luz","2022-12-13 13:06:35","1305327979","2022-12-13","13:06:35"
"892464","☝🏻 O TRAÍRA","2022-12-13 13:06:48","5268146184","2022-12-13","13:06:48"
"892467","As nossa Forças Armadas Brasileiras vão intervir eles sabem disto !","2022-12-13 13:07:02","1305327979","2022-12-13","13:07:02"
"892468","Por falar em infiltrado, vamos combinar aqui tem mediador?","2022-12-13 13:07:08","1165602459","2022-12-13","13:07:08"
"892469","Ouçam","2022-12-13 13:07:30","1305327979","2022-12-13","13:07:30"
"892470","☝🏻 O TRAÍRA","2022-12-13 13:07:36","5268146184","2022-12-13","13:07:36"
"892471","Ouçam","2022-12-13 13:07:38","1305327979","2022-12-13","13:07:38"
"892473","Eu acho que é um só cala boca, pra enganar os trouxas ..","2022-12-13 13:07:49","1511846310","2022-12-13","13:07:49"
"892475","☝🏻 O TRAÍRA","2022-12-13 13:08:13","5268146184","2022-12-13","13:08:13"
"892476","Foto de Reims","2022-12-13 13:08:15","809131641","2022-12-13","13:08:15"
"892477","ACHO QUE O GAZELINHA DO AMAPÁ DEMOROU DEMAIS A PARTIR PRA CIMA DA MICHELE, GAZELAS ODEIAM MULHERES PORQUE ELES NÃO TEM O QUE ELAS TÊM ENTRE AS PERNAS.","2022-12-13 13:08:17","5763077962","2022-12-13","13:08:17"
"892480","Petistas planejaram tudo com antecedência!","2022-12-13 13:08:55","1835062427","2022-12-13","13:08:55"
"892481","☝🏻 O TRAÍRA","2022-12-13 13:08:55","5268146184","2022-12-13","13:08:55"
"892482","Existem duas formas de socialistas totalitários se manterem no poder:

1) Comprando a ""felicidade geral da nação"".

2) Repressão, quando não há mais dinheiro para distribuir.

O ex-presidiário fez o seu primeiro governo no modo 1.

Agora, já opera no modo 2.","2022-12-13 13:09:03","809131641","2022-12-13","13:09:03"
"892514","Tudo tem o tempo certo .... 😉","2022-12-13 13:16:26","1521323063","2022-12-13","13:16:26"
"892485","PALAVAS Ñ SÃO MINHAS MAS ESTA CORRETO.    ""O VAGABUNDO, CANALHA, ZÉ B*C&T@ DE MERDA, DIFAMADOR DE GENERAIS, VESTE UMA ROUPA CAMUFLADA PARA COLOCAR ESSA NA CONTA DOS INTERVENCIONISTAS. SEMPRE FEZ JOGO DUPLO NA DIREITA. SEMPRE COLOCANDO O POVO CONTRA OS GENERAIS. PETISTA DE MERDA!!!
ELE APAGOU DO YOUTUBE DELE MAS NÓS BAIXAMOS. VOU DEIXAR AQUI O REGISTRO.
ELES ESTÃO LIMPANDO OS RASTROS DAS REDES.""","2022-12-13 13:09:35","1249580026","2022-12-13","13:09:35"
"892486","Já pode começa prendendo o chefe deles: Togado Dickhead","2022-12-13 13:09:45","1721389301","2022-12-13","13:09:45"
"892487","🔥@selvaeaco⚡⚡
 🇧🇷B🇷🇺R🇮🇳I🇨🇳C🇿🇦S
.","2022-12-13 13:09:45","809131641","2022-12-13","13:09:45"
"892488","☝🏻 O TRAÍRA","2022-12-13 13:09:57","5268146184","2022-12-13","13:09:57"
"892491","13 de dezembro | Confira a mensagem do Ministro da Defesa em homenagem ao #DiaDoMarinheiro! 🚢⚓️","2022-12-13 13:10:05","5745404352","2022-12-13","13:10:05"
"892492","☝🏻 O TRAÍRA","2022-12-13 13:10:24","5268146184","2022-12-13","13:10:24"
