"message_id","message","message_utc","from_id","date","time"
"891234","Por isso que foi bom ter saído de lá do QG, porque seria pior.
Os militares iriam atacar os manifestantes de direita.
Já estava tudo armado.
Teve gente lá que passou essa informação Alan.
Só esperaram o dia da diplomação do ladrão. 🤬😡","2022-12-13 02:42:41","1519150550","2022-12-13","02:42:41"
"891235","🌩

🇧🇷💥🙈💥💥💥🙈

Brasília","2022-12-13 02:42:52","1097752113","2022-12-13","02:42:52"
"891239","Temos informações que exército está defendendo os manifestantes estão QG a vão continuar","2022-12-13 02:43:36","1097752113","2022-12-13","02:43:36"
"891247","Povo burro, caiu na armadilha preparada pelo TSE e os antifas. Foi avisado pra não sair da frente dos quartéis","2022-12-13 02:45:29","996650487","2022-12-13","02:45:29"
"891248","Pode ter CERTEZA","2022-12-13 02:46:38","2047583694","2022-12-13","02:46:38"
"891249","21 - Vila Velha - ES, igreja maranata","2022-12-13 02:47:12","270369691","2022-12-13","02:47:12"
"891255","Teu rabo","2022-12-13 02:48:09","5839834243","2022-12-13","02:48:09"
"891250","Vídeo de Pastor Paulo De Tarso","2022-12-13 02:47:27","1305327979","2022-12-13","02:47:27"
"891253","https://twitter.com/PauloMello/status/1602467037070106629?t=tlYiiGv03QTQv_otWs3TpA&s=19","2022-12-13 02:47:46","5192049579","2022-12-13","02:47:46"
"891254","Moraes incentivou isso tudo","2022-12-13 02:48:01","5192049579","2022-12-13","02:48:01"
"891256","Gente com certeza os pau mandados do molusco e do cabeça de ovo tocando o terror pra culpar os patriotas .
Vcs querem saber? Nem um desses infiltrados vão ser preso vai mandar prender patriotas vcs vão ver só desgraçado desse cabeça de ovo até quando vai ficar de pé","2022-12-13 02:48:29","1732224384","2022-12-13","02:48:29"
"891257","Vídeo de Pastor Paulo De Tarso","2022-12-13 02:48:30","1305327979","2022-12-13","02:48:30"
"891258","Foto de Reims","2022-12-13 02:48:50","809131641","2022-12-13","02:48:50"
"891259","Olha os Comunistas aí que quebraram tudo a mando da rede Globo","2022-12-13 02:48:50","1305327979","2022-12-13","02:48:50"
"891260","Dobre tua língua pra falar comigo","2022-12-13 02:48:54","5839834243","2022-12-13","02:48:54"
"891266","A verdade 👆","2022-12-13 02:49:53","2047583694","2022-12-13","02:49:53"
"891263","https://youtu.be/Jh4kMyDZLGk","2022-12-13 02:49:36","2047583694","2022-12-13","02:49:36"
"891264","Tem vídeos de grupos de homens de preto idade 20-30 anos fazendo o caos","2022-12-13 02:49:41","5192049579","2022-12-13","02:49:41"
"891265","https://twitter.com/viniciuscfp82/status/1602481437441228801?t=-F7j2_EoZMMgp7IhdUxj3w&s=19","2022-12-13 02:49:48","5192049579","2022-12-13","02:49:48"
"891269","Screenshot (12 de dez. de 2022 23:50:25)","2022-12-13 02:50:40","1305327979","2022-12-13","02:50:40"
"891270","isso é atitude do MST, PT são infiltrados!","2022-12-13 02:51:40","5280755539","2022-12-13","02:51:40"
"891271","Comunistas","2022-12-13 02:51:42","1305327979","2022-12-13","02:51:42"
"891272","estamos nas ruas a tempo e nada de confusão","2022-12-13 02:52:08","5280755539","2022-12-13","02:52:08"
"891273","São os Black blocks","2022-12-13 02:54:13","5192049579","2022-12-13","02:54:13"
"891274","Tática de guerrilha","2022-12-13 02:54:17","5192049579","2022-12-13","02:54:17"
"891275","Molotov, cercar ônibus, depredar tudo","2022-12-13 02:54:41","5192049579","2022-12-13","02:54:41"
"891276","Ao vivo 

https://youtu.be/MPzUtg7MOJc","2022-12-13 02:55:06","809131641","2022-12-13","02:55:06"
"891277","Atenção Patriotas!!!🚨🚨🚨📣⏰
publicar aqui, quem sabe tem algum advogado militar da reserva no grupo, algum juiz, desembargador,  aposentado, que sua ação não interfira na sua remuneração mensal do seu sustento .
Um País com mais de 60 milhões de Brasileiros de direita, só tem um cidadão para entrar com processo no STM???
Tinha que ter uma enxurrada de processos lá!!!
Tínhamos que fazer que nem a esquerda que judicializou quase tudo contra o governo nesses últimos 4 anos.
Os conhecedores do direito, copiem a base da peça da ação e entrem com centenas ou milhares  de ações no STM Urgente!!!!
Cadê os Patriotas do direito???
🙏🙏🙏","2022-12-13 02:55:06","717757564","2022-12-13","02:55:06"
"891278","Este pé de cana ladrão não sabe nem cantar o hino","2022-12-13 02:55:35","1209946167","2022-12-13","02:55:35"
"891280","Basicamente o Cacique fez essa ação de petição e foi preso","2022-12-13 02:56:15","5192049579","2022-12-13","02:56:15"
"891281","PETISTAS ESTÃO POR TRÁS DOS INCÊNDIOS

🇨🇳🐀🐀🐀👺🔥

Vários carros foram ince disse em Brasília. A ação terrorista foi planejada por politicos do PT e privavelmevte com a participação de ministros do TSE/STF.

🇨🇳🐀🐀🐀⚖👺🔥","2022-12-13 02:56:21","1097752113","2022-12-13","02:56:21"
"891285","Todo mundo avisou que isso ia acontecer e o Futuoso insistiu em querer tirar o pessoal da frente dos quartéis... PARABENS BABACA!","2022-12-13 02:57:03","1189999292","2022-12-13","02:57:03"
"891288","Eu me pergunto qual a verdadeira intençao de Moraes mandar prender um índio logo hoje e com tanta violência pela polícia.Tudo armado, patriotas não queimam ônibus nem carros.Moraes é um terrorista disfarçado de ministro e vai piorar","2022-12-13 02:57:56","864043855","2022-12-13","02:57:56"
"891290","Depois que fez a merda, vestido de roupa camuflada, aí foi correndo de volta pro acampamento no qg..","2022-12-13 02:58:10","1189999292","2022-12-13","02:58:10"
"891291","Kika","2022-12-13 02:58:10","5192049579","2022-12-13","02:58:10"
"891303","Em nome de Jesus, tão amarrados.","2022-12-13 03:03:49","5839834243","2022-12-13","03:03:49"
"891294","Incentivar manifestações violentas","2022-12-13 02:58:36","5192049579","2022-12-13","02:58:36"
"891295","Denunciem o babaca por pornografia que ele é quicado do canal","2022-12-13 02:58:47","1189999292","2022-12-13","02:58:47"
"891298","PARABÉNS AO FRUTUOSO PELA CAGADA DE TIRAR MANIFESTANTES DO QG! DEPOIS QUE FEZ A MERDA, CORREU DE VOLTA PRO QG...","2022-12-13 02:59:44","1189999292","2022-12-13","02:59:44"
"891299","Petistas infiltrados","2022-12-13 03:00:06","1566602452","2022-12-13","03:00:06"
"891300","N acredito nessa materia simples assim","2022-12-13 03:02:52","1148118631","2022-12-13","03:02:52"
"891302","Totalmente","2022-12-13 03:03:34","5839834243","2022-12-13","03:03:34"
"891317","Filhos do demônio","2022-12-13 03:05:54","5839834243","2022-12-13","03:05:54"
"891318","Mais um indício de esquerda","2022-12-13 03:07:59","1450762438","2022-12-13","03:07:59"
"891316","Comunistas","2022-12-13 03:05:18","1305327979","2022-12-13","03:05:18"
"891319","Me mostre onde existe na Constituição Federal o golpe da intervenção militar.","2022-12-13 03:08:12","1428154406","2022-12-13","03:08:12"
"891320","Esse cara tem que ser fuzilado em praça publica junto os a corja dele togados e o molusco 😒","2022-12-13 03:08:23","1148118631","2022-12-13","03:08:23"
"891321","“Tática antifa” desconfiam bolsonarista sobre tensão em Brasília.

https://vistapatria.com.br/tatica-antifa-desconfiam-bolsonarista-sobre-tensao-em-brasilia/","2022-12-13 03:08:48","1280090114","2022-12-13","03:08:48"
"891322","A direita é pacifica e não age assim. Estamos a 42 dias acampados e não teve nenhima confusão. Só agora aparece esses criminosos para falar que é a direita. Conta outra. Coisa de 5 série","2022-12-13 03:09:15","1523294721","2022-12-13","03:09:15"
"891325","Calma, irmão. Sei que a ira nos toma, mas Jesus pregou o amor e o respeito ao próximo. O castigo desse senhor virá pelas mãos do Altíssimo, não pelas nossas.","2022-12-13 03:09:51","5839834243","2022-12-13","03:09:51"
"891326","Vamos acordar para a vida gente","2022-12-13 03:09:52","1523294721","2022-12-13","03:09:52"
"891328","Cair nessa patifaria é ser muito otário","2022-12-13 03:10:15","1523294721","2022-12-13","03:10:15"
"891329","Hooooo machãooooo ai gentem cade os homis pra se pronunciarem sobre isso 😂🙊muito machoooo","2022-12-13 03:10:19","1148118631","2022-12-13","03:10:19"
"891334","Está bem pra lá da desconfiança.  Quem é q não respeita propriedade e vida? Essa turma do caos é parte do conglomerado esquerdista.","2022-12-13 03:11:04","851065252","2022-12-13","03:11:04"
"891342","É o pessoal do mst  os patriotas estão vários dias lá  e não fizeram nada só  protestaram, agora do nada começa isso kkk só idiota acredita kkkk","2022-12-13 03:12:29","1787483498","2022-12-13","03:12:29"
"891336","Não foi por falta de aviso. Vagabundo ia agir.","2022-12-13 03:11:54","1235109615","2022-12-13","03:11:54"
"891337","Com certeza tinha e foi uns 15 ou mais um pouco.","2022-12-13 03:11:55","1435728938","2022-12-13","03:11:55"
"891338","Dúvidas?","2022-12-13 03:12:02","5250340045","2022-12-13","03:12:02"
"891339","O Alan apagou o vídeo. Lamento que ele tenha sido click bait nos últimos dias. Assim, acaba perdendo a credibilidade.","2022-12-13 03:12:13","1587243572","2022-12-13","03:12:13"
"891340","Jogo de cartas marcadas","2022-12-13 03:12:17","1523294721","2022-12-13","03:12:17"
"891341","👍🏻👍🏻","2022-12-13 03:12:28","1435728938","2022-12-13","03:12:28"
"891343","Os Comunistas e Socialistas genocidas, criaram este pequeno tumulto a mando de quem está se pelando de medo das nossas Forças Armadas Brasileiras!","2022-12-13 03:12:31","1305327979","2022-12-13","03:12:31"
"891344","Tem que ser muito ingênuo para acreditar que isso é ato da direita","2022-12-13 03:13:08","1523294721","2022-12-13","03:13:08"
"891345","Alan GORDINHO, coloca seu vídeo escroto correndo gritando Guerra.
Preciso rir um pouco","2022-12-13 03:13:20","641025481","2022-12-13","03:13:20"
"891346","Com certeza e toda essa canalhada desses petralha são como as praga la no egito q devem ter escapado e sobrevivido porq n tem outra definição ,pragas pior q ratos 🤮🤮🤮🤢🤢🤢🤢🤢 gente acefala","2022-12-13 03:13:26","1148118631","2022-12-13","03:13:26"
"891347","Verdade","2022-12-13 03:13:34","1787483498","2022-12-13","03:13:34"
"891348","Tudo orquestrado pela esquerdalha igualzinho nos EUA","2022-12-13 03:13:40","1523294721","2022-12-13","03:13:40"
"891349","Culpa de vocês que estão tirando o povo da frente dos quartéis, bando de pilantras","2022-12-13 03:13:41","1482002560","2022-12-13","03:13:41"
"891355","São todos esquerdistas!","2022-12-13 03:13:54","5745404352","2022-12-13","03:13:54"
"891356","Eles sabem que serão todos presos, aí criaram este pequeno tumulto de amador, para confundir !
Não mudará nada do que está programado para a destruição deles.","2022-12-13 03:13:55","1305327979","2022-12-13","03:13:55"
"891357","Temos um rosto","2022-12-13 03:14:04","5204215329","2022-12-13","03:14:04"
"891358","@Alan,.o João  Salas pede que entre em contato com ele","2022-12-13 03:14:12","1593734645","2022-12-13","03:14:12"
"891359","Desconfiam?","2022-12-13 03:14:12","1053583470","2022-12-13","03:14:12"
"891369","Irmão, estás sendo deveras apocalíptico. Este momento pede amor, não ódio.","2022-12-13 03:15:35","5839834243","2022-12-13","03:15:35"
"891370","Alan vacilou feio","2022-12-13 03:15:41","1523294721","2022-12-13","03:15:41"
"891371","Eu cuido vc que cuida dos outros kkk","2022-12-13 03:15:49","1787483498","2022-12-13","03:15:49"
"891372","É um patriota de bem, mas vacilou feio","2022-12-13 03:15:55","1523294721","2022-12-13","03:15:55"
"891373","Cumplicidade total no evento dos comunistas.","2022-12-13 03:15:56","1305327979","2022-12-13","03:15:56"
"891374","FOI UMA CILADA ARMADA PELA ESQUERDA SIM! EM CONLUIO COM UM CERTO IMOrAES QUE PRIMEIRO INCENTIVOU OS PATRIOTAS A SAÍREM DA AREA DOS QGs. OS INFILTRADOS EMPURRARAM OS INGÊNUOS INDIOS NA FRENTE COMO BOI DE PIRANHA!!! A ESPOSA DO CACIQUE CONTOU TUDO! DEIXARAM O MARIDO DELA SOZINHO E DEPOIS FORAM ATERRORIZAR! ESTAVAM PREPARADOS COM BOMBAS, COMBUSTIVEL E MÁSCARAS ANTI-GÁS!!!  CILADA ARMADA FORA DO QGEX!!!","2022-12-13 03:16:12","1071726249","2022-12-13","03:16:12"
"891375","São Black blocks","2022-12-13 03:16:29","1155744183","2022-12-13","03:16:29"
"891378","Também penso a mesma coisa","2022-12-13 03:16:42","1787483498","2022-12-13","03:16:42"
"891379","De ninguém, SÓ vim aqui pra achar o vídeo dele gritando igual um babaca que era guerra......kkkkk
Preciso mandar nos outros grupos aqui pra desmascarar esse pilantra.","2022-12-13 03:16:48","641025481","2022-12-13","03:16:48"
"891380","Qual lado você está ?
Vermelho
Amarelo?","2022-12-13 03:16:48","1305327979","2022-12-13","03:16:48"
"891381","🤢🤢🤢🤢🤢🤢🤢🤮🤮🤮🤮🤮🤮","2022-12-13 03:16:50","1148118631","2022-12-13","03:16:50"
"891382","É obvio","2022-12-13 03:17:09","1523294721","2022-12-13","03:17:09"
"891390","O cara é patriota sim","2022-12-13 03:18:00","1523294721","2022-12-13","03:18:00"
"891384","Desejo uma sociedade mais harmônica, apenas. Estou do lado da paz.","2022-12-13 03:17:18","5839834243","2022-12-13","03:17:18"
"891385","Vi ele apagou como um covarde, pois sabe que deixou rastros !","2022-12-13 03:17:25","1305327979","2022-12-13","03:17:25"
"891386","Acho que o Alan surtou","2022-12-13 03:17:26","1523294721","2022-12-13","03:17:26"
"891387","Estresse violento","2022-12-13 03:17:36","1523294721","2022-12-13","03:17:36"
"891388","Só isso","2022-12-13 03:17:53","1523294721","2022-12-13","03:17:53"
"891389","Então fica do lado certo.
Não estamos de brincadeira, estamos em guerra !","2022-12-13 03:17:55","1305327979","2022-12-13","03:17:55"
"891392","Se não foi editado pode ter deixado, mais e se foi não não vi o video","2022-12-13 03:18:04","1787483498","2022-12-13","03:18:04"
"891393","Mas vacilou feio","2022-12-13 03:18:06","1523294721","2022-12-13","03:18:06"
"891394","Ai ai ai.... Tá todo mundo de saco cheio. Vocês realmente acham que a galera não ia explodir em algum momento. Praticamente sequestraram o cacique na frente de um ônibus cheio de gente indo pra casa do presidente, o que achavam que ia acontecer. Se foi planejado ou não, se foi direita ou esquerda uma coisa é certa, isso só vai piorar e não adianta tentar apaziguar","2022-12-13 03:18:07","1550742326","2022-12-13","03:18:07"
"891421","Acho que é são do mst","2022-12-13 03:23:03","1787483498","2022-12-13","03:23:03"
"891396","Tinha até achado, mais acho que o pilantra apagou.
Msm assim dei um print pra alertar a galera","2022-12-13 03:18:09","641025481","2022-12-13","03:18:09"
"891397","Esquerdalha maldita eles infiltrados fizeram isso esses aruaceiros 🤮🤮🤢😡","2022-12-13 03:18:16","1148118631","2022-12-13","03:18:16"
"891398","Mas como líder religioso, devo orientar as pessoas à prudência e não incitar o ódio.","2022-12-13 03:18:28","5839834243","2022-12-13","03:18:28"
"891399","Isso para mim é print até eu faço melhor no paint","2022-12-13 03:18:34","1787483498","2022-12-13","03:18:34"
"891400","Tse não vigiar cai nas pegadinhas deles, ou aprende ou vira otários","2022-12-13 03:18:52","1305327979","2022-12-13","03:18:52"
"891405","Lógico que é print!!!
É só ler oque eu escrevi.","2022-12-13 03:19:14","641025481","2022-12-13","03:19:14"
"891406","Tudo montado","2022-12-13 03:19:14","1305327979","2022-12-13","03:19:14"
"891412","eu li mais não me convence","2022-12-13 03:20:18","1787483498","2022-12-13","03:20:18"
"891409","PORQUE CANTARIA? ELE TEM SEU HINO PRÓPRIO QUE SERÁ O DA NAÇÃO TAMBÉM. ELE É UM COMUNISTA , NÃO É UM PATRIOTA.🫣","2022-12-13 03:19:33","986621562","2022-12-13","03:19:33"
"891411","😂","2022-12-13 03:19:50","1305327979","2022-12-13","03:19:50"
"891414","Eis aí motivo de não terem saído da frente do quartel, era isso que a esquerda queria, tirar o pessoal da frente do quartel para com seus infiltrados começarem o caus e a mídia já prontinha pra espalhar a narrativa que são todos bolsonaristas violentos.","2022-12-13 03:20:27","1356364075","2022-12-13","03:20:27"
"891415","Você tá muito estranho com essa sigla pt","2022-12-13 03:20:59","1787483498","2022-12-13","03:20:59"
"891416","kkk","2022-12-13 03:21:02","1787483498","2022-12-13","03:21:02"
"891417","Os de direita parecendo de esquerda. Quando a esquerda faz merda hoje ela coloca a culpa na direita e quando a direita faz merda coloca culpa na esquerda.","2022-12-13 03:21:44","1550742326","2022-12-13","03:21:44"
"891418","Assaz divertida essa ironia, não?","2022-12-13 03:21:53","5839834243","2022-12-13","03:21:53"
"891419","Pois  é né kkk. Bom vou indo nessa e o pessoal que pos fogo é do mst ou são antifas","2022-12-13 03:22:45","1787483498","2022-12-13","03:22:45"
"891420","Falta de aviso não foi,  falamos e falamos, permaneçam na frente dos quartéis, não saíam, agora tai o resultado.","2022-12-13 03:23:02","1356364075","2022-12-13","03:23:02"
"891424","Divulguem bastante,  porque esse vídeo mostra que não foram os  bolsonaristas que fizeram o quebra-quebra.","2022-12-13 03:23:56","292098119","2022-12-13","03:23:56"
"891425","Par com isso, se quisessem fazer assim eles não precisariam que ninguém saísse dos QGs. Pode ter um ou outro infiltrado, pode, mas não foi só isso","2022-12-13 03:23:56","1550742326","2022-12-13","03:23:56"
"891426","Pode ficar tranquilo","2022-12-13 03:23:57","1787483498","2022-12-13","03:23:57"
"891427","Divulguem bastante,  porque esse vídeo mostra que não foram os  bolsonaristas que fizeram o quebra-quebra.","2022-12-13 03:24:10","292098119","2022-12-13","03:24:10"
"891428","Divulguem bastante,  porque esse vídeo mostra que não foram os  bolsonaristas que fizeram o quebra-quebra.","2022-12-13 03:24:24","292098119","2022-12-13","03:24:24"
"891430","Divulguem bastante,  porque esse vídeo mostra que não foram os  bolsonaristas que fizeram o quebra-quebra.","2022-12-13 03:24:41","292098119","2022-12-13","03:24:41"
"891431","Tá na cara isso.","2022-12-13 03:25:30","1313432849","2022-12-13","03:25:30"
"891432","QUEM TÁ MENTINDO NESSA HISTÓRIA????

EU TÔ PERGUNTANDO PORQUE TODOS OS ENVOLVIDOS, INCLUSIVE O QUE ESTÁ AÍ NO VÍDEO SE DIZEM DE DIREITA. E AGORA???","2022-12-13 03:25:56","5745404352","2022-12-13","03:25:56"
"891433","O ministro do TSE do tapinha na cara, disse ao Xandao, missão dada é missão cumprida?
Será a senha para as ações dos comunistas atacarem Brasília?","2022-12-13 03:26:08","1305327979","2022-12-13","03:26:08"
"891446","kkkkkk","2022-12-13 03:31:12","908287357","2022-12-13","03:31:12"
"891437","Prova real que foi os Comunistas cumprindo ordens do Luladrao","2022-12-13 03:26:55","1305327979","2022-12-13","03:26:55"
"891439","Então não acuse o MST sem saber, meu irmão","2022-12-13 03:29:03","5839834243","2022-12-13","03:29:03"
"891461","Apagou até o video","2022-12-13 03:34:04","1305327979","2022-12-13","03:34:04"
"891440","Não vejo assim. Tem muita gente de saco cheio. E não é porque seja contra o que está acontecendo que é conservador, de direita e bonzinho. O Brasil está um barril de pólvora, vai explodir mais cedo ou mais tarde. Isso é só o prenúncio, certamente vai piorar. A repressão a partir de amanhã será absurda.
Infelizmente, só rompendo a ordem que algo poderá acontecer, não é o melhor caminho mas já era previsível que aconteceria, seja pela direita ou seja pela esquerda.","2022-12-13 03:29:05","1550742326","2022-12-13","03:29:05"
"891441","Desconfia o escambau. 42 dias de QG e nem um copo quebrado. Um belo dia, no dia em que o molusco toma posse e tem um monte de gente em trânsito pela esplanada (retornando pro QG do palácio da alvorada) uma armadilha da esquerda é implantada. Bah, precisa ser muito trouxa ou desinformado pra acreditar nisso. E o pior é que TEVE GENTE QUE PEDIU PRA TURMA SAIR DO QG E IR PRA ESPLANADA. sABE QUEM FOI?!","2022-12-13 03:29:31","908287357","2022-12-13","03:29:31"
"891442","Não será o nosso caminho, nosso caminho será sob as ordens das nossas Forças Armadas Brasileiras e seu Comandante SUPREMO.","2022-12-13 03:30:21","1305327979","2022-12-13","03:30:21"
"891443","Alan Flutuoso","2022-12-13 03:30:51","1305327979","2022-12-13","03:30:51"
"891444","Cadeirante","2022-12-13 03:30:58","1305327979","2022-12-13","03:30:58"
"891445","Cadeirante","2022-12-13 03:31:09","1305327979","2022-12-13","03:31:09"
"891449","Pq apagou tua live ? Ze pix é foda  sensacionalista  do  caramba  fico com medo da merda que falou na live","2022-12-13 03:32:14","1589911463","2022-12-13","03:32:14"
"891450","O medo deles é que o nosso Presidente Bolsonaro vai tomar o comando deles !","2022-12-13 03:32:18","1305327979","2022-12-13","03:32:18"
"891452","Estamos no caminho certo","2022-12-13 03:32:25","1305327979","2022-12-13","03:32:25"
"891453","Bando de criminoso","2022-12-13 03:32:33","657461562","2022-12-13","03:32:33"
"891454","Vocês falam como se a esquerda tivesse uma estratégia fantástica. Sério? Kkkkkk
Eles não precisam de nada disso, e pior, só vai trazer mais publicidade, e não existe publicidade boa ou ruim, só publicidade.
Ele iam ficar quietinhos até dia primeiro e aí sim, botar pra quebrar com o super TF. 
Isso aí foi o povo de saco cheio e que culminou com praticamente um sequestro do cacique na frente de um ônibus cheio de manifestante.","2022-12-13 03:32:36","1550742326","2022-12-13","03:32:36"
"891455","Allan Frutuoso cabra macho","2022-12-13 03:33:29","1320768071","2022-12-13","03:33:29"
"891457","Não bate !
Você é muito fraco de informação e contra informações!
Ou não quer ver as ações dos comunistas.","2022-12-13 03:33:39","1305327979","2022-12-13","03:33:39"
"891458","COBRADOR DO ÔNIBUS FOI EXPULSO SEM AO MENOS PODER PEGAR SUA MUCHILA COM OS PERTENCES. OS AGENTES DO CAOS INCENDIARAM O ÔNIBUS NA SEQUÊNCIA.","2022-12-13 03:33:42","5745404352","2022-12-13","03:33:42"
"891460","Machinho","2022-12-13 03:33:55","1305327979","2022-12-13","03:33:55"
"891465","Terrorismo","2022-12-13 03:34:33","1305327979","2022-12-13","03:34:33"
"891466","Ilan Szapiro Ben Avram
37.696 visualizações  Estreou em 17 de nov. de 2022
DOCUMENTÁRIO Quem mandou matar Jair Bolsonaro  “Investigação Paralela”, da Brasil Paralelo
https://www.youtube.com/watch?v=3o__gQpCtJUl","2022-12-13 03:34:55","292098119","2022-12-13","03:34:55"
"891467","São bandidos com medo das ações dos Militares que vai vim aí varrendo eles !","2022-12-13 03:34:58","1305327979","2022-12-13","03:34:58"
"891468","Ilan Szapiro Ben Avram
37.696 visualizações  Estreou em 17 de nov. de 2022
DOCUMENTÁRIO Quem mandou matar Jair Bolsonaro  “Investigação Paralela”, da Brasil Paralelo
https://www.youtube.com/watch?v=3o__gQpCtJU","2022-12-13 03:35:14","292098119","2022-12-13","03:35:14"
"891469","Muito pelo contrário, eles estão ganhando todas até agora e sem uma briga, sem violência, sem um tiro. Aparelharam todo o estado, desde a educação até o judiciário. Não precisam mais que isso.
Eles partirem para um confronto ou mesmo gerar notícia? Eles estão torcendo para que tudo seja abafado, isso sim","2022-12-13 03:35:21","1550742326","2022-12-13","03:35:21"
"891470","Ilan Szapiro Ben Avram
37.696 visualizações  Estreou em 17 de nov. de 2022
DOCUMENTÁRIO Quem mandou matar Jair Bolsonaro  “Investigação Paralela”, da Brasil Paralelo
https://www.youtube.com/watch?v=3o__gQpCtJU","2022-12-13 03:35:28","292098119","2022-12-13","03:35:28"
"891476","Que pastor eim...","2022-12-13 03:37:13","1320768071","2022-12-13","03:37:13"
"891471","Ilan Szapiro Ben Avram
37.696 visualizações  Estreou em 17 de nov. de 2022
DOCUMENTÁRIO Quem mandou matar Jair Bolsonaro  “Investigação Paralela”, da Brasil Paralelo
https://www.youtube.com/watch?v=3o__gQpCtJU","2022-12-13 03:35:40","292098119","2022-12-13","03:35:40"
"891472","Ilan Szapiro Ben Avram
37.696 visualizações  Estreou em 17 de nov. de 2022
DOCUMENTÁRIO Quem mandou matar Jair Bolsonaro  “Investigação Paralela”, da Brasil Paralelo
https://www.youtube.com/watch?v=3o__gQpCtJU","2022-12-13 03:35:53","292098119","2022-12-13","03:35:53"
"891473","🇧🇷 — Comunicações internas dizem que não há possibilidade de esses ataques terem ocorrido por meio de integrantes presentes no Palácio da Alvorada anteriormente, pois todos que entraram tiveram suas malas e mochilas vistoriadas na entrada.

Fonte: O informante

📱Canal: @LIBERTADBRASILL

🗣Chat e Chat de voz @VLBRASIL","2022-12-13 03:36:26","5745404352","2022-12-13","03:36:26"
"891474","https://youtube.com/shorts/Z3XgTxFcrcc?feature=share","2022-12-13 03:37:04","1305327979","2022-12-13","03:37:04"
"891475","No alvo","2022-12-13 03:37:10","1305327979","2022-12-13","03:37:10"
"891477","OVO + PF + INFILTRADOS: CAOS EM BRASÍLIA!
https://youtu.be/n9WbUp10H1s","2022-12-13 03:37:41","5144775361","2022-12-13","03:37:41"
"891478","PRA MIM ISSO FOI UMA GRD ARMADILHA DOS PTRALHAS E STF.. AS PESSOAS QUE ESTÃO LÁ A 40 DIAS ATÉ HJ FORAM ORDEIROS.. ISSO FOI INFILTRADOS TRAVESTIDOS DE PATRIOTAS COM CAMISETAS VERDE E AMARELO PRA PARECER A DIREITA QUE FEZ TD AQUELE VANDALISMO ISSO É A CARA DOS PTRALHAS..GALERA NÃO CAIAM MAIS NESSAS ARMADILHAS","2022-12-13 03:37:59","1072478134","2022-12-13","03:37:59"
"891479","Mas uma coisa é estranha, o povo que queimou os carros. Esses aí é certo que não foram com boas intenções, até porque ninguém anda com ""gasolina no bolso""","2022-12-13 03:38:07","1550742326","2022-12-13","03:38:07"
"891480","Só uma ideia!","2022-12-13 03:38:15","1305327979","2022-12-13","03:38:15"
"891481","Bandidos do Luladrao","2022-12-13 03:38:33","1305327979","2022-12-13","03:38:33"
"891482","E outra visão: ok, foram infiltrados, e agora? Acabou! Vão colar a narrativa na galera do bem e ponto final.
Isso nunca vai ser ganho com beijinhos, abracinhos, cartinhas....
Eles jogam pesado e tem uma mídia monstruosa para ajudá-los.","2022-12-13 03:40:05","1550742326","2022-12-13","03:40:05"
