"message_id","message","message_utc","from_id","date","time"
"26322","BOA TARDE GIL! ACREDITO QUE DEVEMOS USAR AS ARMAS DA ESQUERDA.  ALGUÉM TEM QUE FAZER IGUAL AO SALTITANTE. CADA VEZ QUE ELES ENTRAM COM UMA LEI OU REVOGAÇÃO ABDURDA, ALGUÉM REVIDA","2023-01-06 20:53:47","566413654","2023-01-06","20:53:47"
"26319","Comunista Fabiano achando que ninguém nunca estuda janela de overton. Algo entre canalha e cruel: nunca foi doença sempre foi crime- a prática que a doutrinação corrupta acadêmica fez calar por décadas. 
Achei o título curto pra tanto sofrimento.","2023-01-06 20:24:57","834410012","2023-01-06","20:24:57"
"26323","https://m.youtube.com/watch?v=kVHaVr9Q4Dk

Estaremos ao vivo daqui a pouco 👍🏻 😉","2023-01-06 21:50:47","1407012989","2023-01-06","21:50:47"
