"message_id","message","message_utc","from_id","date","time"
"12125","Ficou combinado:

✅Convocar os patriotas para o grupo;
✅ Não entrar na pilha do terror que abesourada está fazendo
✅ Separar e-mails dos deputados e senadores da direita","2023-01-12 00:28:05","","2023-01-12","00:28:05"
"12126","META CHEGAR 20 K  ( Patriotas RJ)
Missão de hoje patriotas:

Convocar para participar do grupo do TELEGRAM pelo menos 5 patriotas!

Vamos lá! Assim que concluir curte essa postagem!

Compartilhem o nosso grupos:

https://t.me/admsosrj","2023-01-12 00:28:38","1894753720.0","2023-01-12","00:28:38"
"12128","Precisamos convocar o povo do Rio de Janeiro!!!","2023-01-12 01:17:26","1894753720.0","2023-01-12","01:17:26"
"12129","PORQUE OS POLÍTICOS DO RIO DE JANEIRO NÃO ESTÃO FAZENDO NADA?

RESPOSTA: CULPA DO POVO DO RJ

VAMOS AGRUPAR PARA COBRAR OS POLÍTICOS DO
RJ

✅ Acompanhe tudo pelo TELEGRAM: @admsosrj","2023-01-12 01:23:44","1894753720.0","2023-01-12","01:23:44"
"12130","Mostra para seu amigo indeciso e não escolheu a direita e agora vai sentir no bolso!!

PORQUE OS POLÍTICOS DO RIO DE JANEIRO NÃO ESTÃO FAZENDO NADA?

✅ Acompanhe tudo pelo TELEGRAM: @admsosrj","2023-01-12 03:12:11","1894753720.0","2023-01-12","03:12:11"
"12138","🚨URGENTE ‼️","2023-01-12 18:08:57","1894753720.0","2023-01-12","18:08:57"
"12141","2 listagem","2023-01-12 18:19:31","1894753720.0","2023-01-12","18:19:31"
"12142","✅ Acompanhe tudo pelo TELEGRAM: @admsosrj","2023-01-12 18:39:45","1894753720.0","2023-01-12","18:39:45"
"12143","Verifique se tem alguém do Rio de Janeiro para eu pedir para o Advogada acompanhar a audiência!’

✅ Acompanhe tudo pelo TELEGRAM: @admsosrj","2023-01-12 18:39:45","1894753720.0","2023-01-12","18:39:45"
"12144","Localizem seus parentes aqui e INFORMEM A SALA DE CADA UM. Mandem mensagem no 83993091000","2023-01-12 18:48:01","1894753720.0","2023-01-12","18:48:01"
"12145","Qualquer coisa fala meu nome, com Prof Dr João Alberto!!!","2023-01-12 18:50:34","1894753720.0","2023-01-12","18:50:34"
"12146","Lembrando que ele é todos nós não apoiamos os que depredaram! Esses nem eu apoio nem eles irão defender segundo palavras do advogado!","2023-01-12 18:51:32","1894753720.0","2023-01-12","18:51:32"
"12147","✅ Acompanhe tudo pelo TELEGRAM: @admsosrj","2023-01-12 19:10:18","1894753720.0","2023-01-12","19:10:18"
"12149","LISTA ATUALIZADA COM 1167 PESSOAS😭","2023-01-12 19:15:39","1894753720.0","2023-01-12","19:15:39"
"12150","Infelizmente é essa a realidade que enfrentamos...
Cristofobia?

✅ Acompanhe tudo pelo TELEGRAM: @admsosrj","2023-01-12 19:33:53","1894753720.0","2023-01-12","19:33:53"
"12152","Boa noite a todos,
Conforme decisão do STF, as audiências de custódia NÃO PERMITE QUE O JUIZ RELAXE A PRISÃO. 
Vejam a parte final da decisão que está grifada. 
Vamos iniciar o protocolo do habeas corpus!!!","2023-01-12 21:43:18","1894753720.0","2023-01-12","21:43:18"
"12153","O advogada que está cuidando dos presos em Brasília acabou de enviar!!!","2023-01-12 21:43:18","1894753720.0","2023-01-12","21:43:18"
"12155","Apocalipse 21:8 – “Mas os covardes, os incrédulos, os depravados, os assassinos, os que cometem imoralidade sexual, os que praticam feitiçaria, os idólatras e todos os mentirosos – o lugar deles será no lago de fogo que arde com enxofre. Esta é a segunda morte”.","2023-01-12 22:17:17","1894753720.0","2023-01-12","22:17:17"
"12156","A direita precisa agir como oposição e parar de ser extremista e ouvir esses loucos que falam só o que não presta podemos ter uma direita conservadora de verdade!

Acorda podo!","2023-01-12 22:22:03","1894753720.0","2023-01-12","22:22:03"
"12157","Como é que é deputado? Foi um erro ou uma constatação?

✅ Acompanhe tudo pelo TELEGRAM: @admsosrj","2023-01-12 22:31:45","1894753720.0","2023-01-12","22:31:45"
"12133","Infiltrados gravam acampamentos do rio de janeiro para 8 documentário do globo play
https://www.instagram.com/reel/CnUcwfPKUdJ/?igshid=MDJmNzVkMjY=","2023-01-12 17:21:53","1894753720.0","2023-01-12","17:21:53"
"12131","Pessoal chegou a hora de agrupar!
Estou vendo várias tipos de pessoas falando em manifestações o que não é para ser feito agora!

Agora é hora de agrupar e iremos marcar reunião com os deputados e senadores para eles sim tomar a frente e buscar soluções que nós estamos lutando!

E horas das ruas vazias e os grupos cheios!

Chegou a hora de cobrar os Senadores, Deputados, vereadores e Governador do nosso estado!

Ruas vazias grupos cheios para o dia que vamos fazer esse encontro para COBRAR os políticos principalmente uma postura deles!

Isso inclui os que foram presos injustamente e todas as atrocidades que estamos vendo!

Nesse dia iremos adotar a nossa pauta de reivindicações!

RESPONDA A ENQUETE ABAIXO O Q VOCÊ ACHA?👇","2023-01-12 15:51:01","1894753720.0","2023-01-12","15:51:01"
"12135","Aquela pilantra que vivia entrando nos acampamentos, alegando que era do povo e ninguem podia impedir, fazia vídeos dizendo ""Estamos aqui há x dias""..... Só aparecia pra fazer vídeos  não ajudava a passar uma manteiga no pão. 
Agora olhem aí, a safado tava fazendo imagens para vender pra Globo.
Foi até encontrado um microfone de lapela sem fio no chão do rancho do acampamento 01, que provavelmente foi colocado ali escondido ligado pra tentar pegar alguma conversa. Agora sabemos quem foi.
Infiltrada profissional.
Depois que foi posta pra correr do acampamento 01 pela Angela, nunca mais voltou pq percebeu que já tinha sido explanada.
Pilastra essa Rosangela Peçanha.
Hj está metendo o pé para os EUA.","2023-01-12 17:27:54","1894753720.0","2023-01-12","17:27:54"
