"message_id","message","message_utc","from_id","date","time"
"1712","Divulguem essa carta para que chegue até Michele Bolsonaro a vontade do povo que está nas ruas há 55 dias para que se cumpra a lei da justiça ⚖️.  Força,  honra presidente e coragem para decidir.","2022-12-23 11:13:07","1730334817.0","2022-12-23","11:13:07"
"1713","Não duvidem amados irmãos patriotas, que nosso herói nacional, Presidente Bolsonaro, não deixará o Brasil ser assaltado por esses mafiosos comunistas! Façamos a nossa parte, continuemos firmes na missão em frente aos quartéis e estejamos ainda mais conscientes, na missão do pós intervenção, onde se precisará ter uma presença ainda mais marcante do povo junto aos agentes do Estado, para impedir que algum espertinho infiltrado, possa de alguma forma adulterar os rumos da devida justiça, que deverá ser aplicada com absoluta isonomia, amplitude e rigor encima de todos os traidores da pátria.

Força e Honra - Fé e Coragem

Não nos deixemos baixar a guarda, agora é hora de aquecer a temperatura, com uma maior coesão do povo e a vitória virá!

Deus está no Comando!","2022-12-23 12:21:24","161215470.0","2022-12-23","12:21:24"
