"message_id","message","message_utc","from_id","date","time"
"1475","Um país onde só os bandidos estão armados

cadê os Ministros para mandar prender este senhor?? cadê a Polícia Federal? PGR ? 

Um país onde os Supremos protegem as milícias das favelas, protegem os traficantes dos morros, não deixam a polícia subir, entrar nem sobrevoar as comunidades, 
um país onde os Sinistros soltam os chefes do narcotráfico
um país onde marginais estão armados até os dentes

mas o povo de bem é desarmado, as pessoas que trabalham não podem se proteger, são caladas, perseguidas, tem suas contas bloqueadas, suas redes sociais derrubadas

BANDIDOS DEFENDENDO BANDIDOS!

SOCORRO FORÇAS ARMADAS SALVEM O BRASIL","2022-11-22 01:53:48","410650001.0","2022-11-22","01:53:48"
"1477","Compartilhem esta oração especial, feita exatamente para estes momentos atuais - para fortalecer a Destra de nossas Forças Armadas e a todos os Patriotas, diante deste combate frontal contra as forças mal!

Orem e compartilhem - compareçam nas manifestações!

Oração ao Senhor dos Exércitos de Deus

Avante Soldados de Cristo!

Nesta guerra espiritual, no fim das contas, a luz sempre vence o mal. Não nos omitiremos diante do perigo, não desistiremos de lutar por Justiça e Liberdade - na defesa da família, do evangelho de Cristo e de nossa amada nação brasileira....

Brasil acima de todos!
DEUS acima de TUDO!","2022-11-22 02:24:08","410650001.0","2022-11-22","02:24:08"
