"message_id","message","message_utc","from_id","date","time"
"19166","26. sou eu que confirmo a palavra do meu servo, e cumpro o conselho dos meus mensageiros; que digo de Jerusalém: Ela será habitada; e das cidades de Judá: Elas serão edificadas, e eu levantarei as suas ruínas;
(Isaías, 44)
Essa mensagem bíblica serve para o contexto atual político do Brasil que enfrentamos.","2022-12-01 00:44:38","1572579620.0","2022-12-01","00:44:38"
"19167","Veja o video de um pastor de Moçambique profetizando o que aconteceria no Brasil em 2022.
O vídeo foi editado em 2021👇👇","2022-12-01 00:44:38","1572579620.0","2022-12-01","00:44:38"
"19169","Gustavo Gayer faz um resumão do que está ocorrendo e traz para reflexão algo inimaginável. A Barbara, dona de casa, está pedindo para ter os mesmos direitos de um traficante ou de um corrupto. Isso seria necessário se estivéssemos vivendo numa democracia?","2022-12-01 00:50:54","1227772279.0","2022-12-01","00:50:54"
"19170","🚨ALERTA MÁXIMO!🚨

ACAMPAMENTO DO MST SE PASSANDO POR PATRIOTAS!!!

CAVALO DE TRÓIA DA ESQUERDA!!!! ESSE ACAMPAMENTO QUE ESTÁ SENDO MONTADO EM FRENTE AO CONGRESSO NÃO É PATRIOTA!!! SÃO TODOS VERMELHOS!!!! PASSEM ESSE ALERTA NACIONAL!!! ELES VÃO SAIR DAÍ EM POUCO TEMPO E INVADIR O CONGRESSO E O STF COM O APOIO SA SEGURANÇA PRA TENTAR INCRIMINAR O PRESIDENTE E ACUSÁ-LO DE GOLPE!!! 
COMPARTILHEM URGENTE!!!","2022-12-01 01:05:54","1227772279.0","2022-12-01","01:05:54"
"19171","Ora se os patriotas estão sabendo dessa manobra estratégica da esquerda com apoio das próprias casas legislativas através de suas segurança então que falta para comunicar diretamente e responsabilizando os seus presidentes por qualquer acontecimento de violência e destruição do patrimônio público? Afinal desde que o General de exército, através de sua carta autorizando o povo permanecer na área militar federal dos quartéis das FFAA ou seja quem estiver fora dessa jurisdição DEVE SER IDENTIFICADOS","2022-12-01 01:13:26","1572579620.0","2022-12-01","01:13:26"
"19173","Afinal a polícia Militar do DF bem como a segurança das casas legislativas federal disponhoe de reconhecimento facial. Então quem estiver fora do perímetro da área dos quartéis das FFAA deverão ser identificados e responsabilizados se por ventura houver depredação do patrimônio público Federal.","2022-12-01 01:35:54","1572579620.0","2022-12-01","01:35:54"
"19174","Twitter
https://mobile.twitter.com/shadownetworkpp/status/1597423967694118913","2022-12-01 01:43:47","1227772279.0","2022-12-01","01:43:47"
"19175","Vocês acham que os governantes se preocuparam com essas cenas? Ao invés disso levaria consigo uns dois ou três juntos para o inferno.","2022-12-01 01:49:00","1572579620.0","2022-12-01","01:49:00"
"19177","GOOOOOOOLPE!!!
GOOOOOOOLPE!!!
GOOOOOOOLPE!!!
INTEGRANTES DO MST, VESTIDOS COM CAMISAS DO BRASIL, FORAM CONVIDADOS A ENTRAR NO SENADO BRASILEIRO, SEM NENHUMA RESISTÊNCIA POR PARTE DA SEGURANÇA. 
CAVALO DE TRÓIA COMUNISTA!!!
ESSE POVO NÃO É PATRIOTA!!!
INTEGRANTES DO MST SE FAZENDO DE CORDEIROS E DEPOIS ELES VÃO QUEBRAR TUDO E COLOCAR NA CONTA DO PRESIDENTE, ACUSANDO ELE DE GOLPE!!! ESTÃO TENTANDO DE TUDO PARA PRENDER O PRESIDENTE E ACUSÁ-LO MUNDIALMENTE DE GOLPE!!!
COMPARTILHEM!!!
COMPARTILHEM!!!
COMPARTILHEM!!!","2022-12-01 02:28:40","1227772279.0","2022-12-01","02:28:40"
"19180","JÁ PASSOU DA HORA DOS PATRIOTAS NO ACAMPAMENTO DO QG EM BRASÍLIA EXPULSAR ESSES PETISTAS DAÍ!!!!
VOCÊS ESTÃO ESPERANDO O QUE, PORRA?????!!!!!
ESSE EUSTÁQUIO É PETISTA, ESSE PODCAST DELE AÍ É UM CAVALO DE TROIA PETISTA NO MEIO DOS PATRIOTAS!!!
CHEGA PORRA!!!
TÁ NA HORA DE DAR UM BASTA NISSO AÍ!!!!
ESSES CARAS NÃO CLAMAM POR INTERVENÇÃO,  SÃO FINANCIADOS POR POLÍTICOS!!!
VOCÊS AÍ DO QG EM BRASÍLIA ESTÃO SENDO FEITOS DE TROUXAS!!!! BASTA!!!!","2022-12-01 03:58:16","1227772279.0","2022-12-01","03:58:16"
"19185","Qualquer comunista pode usar a camisa da seleção brasileira de futebol até porque o próprio técnico Tite é declarado Petista então partindo desse princípio não pode associar que as pessoas que foram convidadas estarem no salão do senado são patriotas e conservadores até porque os que são realmente patriotas estão nas frentes dos quartéis das FFAA.","2022-12-01 10:08:28","1572579620.0","2022-12-01","10:08:28"
"19186","Vamos alertar todos os nossos contatos","2022-12-01 12:32:18","1227772279.0","2022-12-01","12:32:18"
"19189","Que Deus nos livre da ESQUERDA comandando o BRASIL.  Fariam a mesma coisa aqui no Brasil!","2022-12-01 12:50:28","1227772279.0","2022-12-01","12:50:28"
"19191","Não é sobre Covid, é sobre controle.","2022-12-01 13:57:25","1227772279.0","2022-12-01","13:57:25"
"19193","Jaja Brasil adota isso","2022-12-01 14:29:45","1227772279.0","2022-12-01","14:29:45"
"19195","TODOS AOS QUARTEIS CONTRA ESSA CORJA!","2022-12-01 15:39:14","1227772279.0","2022-12-01","15:39:14"
"19197","Eles não querem, porque deflagrada uma intervenção federal, o Congresso Nacional passará por uma faxina nunca antes vista. Só voltarão a ser eleitos -- quando voltar em as eleições em papel -- aqueles que realmente merecerem a confiança do Povo muito mais maduro e livre. Deputados e Senadores perderão seus mandatos com uma intervenção militar. Por isso não nos ajudam quando pedimos diante dos Quartéis SOS FORÇAS ARMADAS. 

Por isso temos que ir cada vez em maior número e gritando mais alto, para a frente dos Quartéis!","2022-12-01 16:55:09","1227772279.0","2022-12-01","16:55:09"
"19198","Detalhe cada um com seu fuzil de assalto","2022-12-01 17:09:37","1572579620.0","2022-12-01","17:09:37"
"19199","Olha aí fazendo o L
2x","2022-12-01 17:10:36","1227772279.0","2022-12-01","17:10:36"
"19200","🇧🇷💪🇧🇷🧐🇧🇷🧐@GeFazioBreakingNews🇧🇷","2022-12-01 17:29:56","1227772279.0","2022-12-01","17:29:56"
"19202","30NOV2022 - E - 33 - COM1DN.pdf","2022-12-01 20:56:07","1462790843.0","2022-12-01","20:56:07"
"19203","Presídio de Bangu 1, em dia de visitação. 
Já que os ""semi-deuses"" do STF proibiram a revista  para não ""constranger os inocentes visitantes"", a Administração do presídio usou um cão farejador.
Vejam o resultado!
 VIRALIZEM.
 REPASSEM.","2022-12-01 21:06:53","1227772279.0","2022-12-01","21:06:53"
"19204","🇧🇷🤝🇵🇹

Portugal seguindo o exemplo do BRASIL e também não quer a NOM! 🇧🇷🤝🇵🇹🤝🇧🇷🤝🇵🇹

@MaxwellSmartAgente86
@CanalLivreExpressao","2022-12-01 21:47:32","1227772279.0","2022-12-01","21:47:32"
"19205","Começa a mobilização necessária para aumentar o efetivo das FFAA","2022-12-01 21:57:02","1572579620.0","2022-12-01","21:57:02"
"19206","A resistência civil é muito forte!
Por isso a esquerda sempre se esforça para desarmar a população. Incrível como tem gente que não enxerga o óbvio...","2022-12-01 22:48:45","1227772279.0","2022-12-01","22:48:45"
"19207","Na Suécia toda pessoa que termina seu tempo de serviço obrigatório as FFAA por 2 anos, após o término tem direito levar consigo o fuzil de assalto mais 500 munições. E a população é convocada a cada 3 anos para ir aos stands de tiro para se aperfeiçoar no treinamento do tiro.","2022-12-01 22:52:06","1572579620.0","2022-12-01","22:52:06"
"19208","https://youtube.com/shorts/zIUZwaQHswI?feature=share","2022-12-01 22:58:29","1572579620.0","2022-12-01","22:58:29"
"19209","Na china tah suave, estuprando as pessoas pra fazer teste de covid na bunda","2022-12-01 23:05:13","1227772279.0","2022-12-01","23:05:13"
"19210","Como funciona a punição para ladrão no mundo islâmico.

https://t.me/osistemaefodaparceiro","2022-12-01 23:30:46","1227772279.0","2022-12-01","23:30:46"
