"message_id","message","message_utc","from_id","date","time"
"8630","TUITAÇO - HADDAD NO RODA VIVA!  
  
Hoje, o professor mais querido de SP vai estar no Roda Viva! 👨‍🏫 Haddad habla mesmo e não foge das perguntas 🗣    
  
Então, bora participar do tuitaço e colocar a hashtag # do Haddad em 1º lugar dos assuntos mais comentados do Twitter!   
  
⏱ O tuitaço vai começar às 21h30  
🎤 O programa começa às 22h  
🔗 Banco de tuítes: bit.ly/tuiteshaddad  
🗂 Banco de conteúdos: bit.ly/BancoDeConteudos","2022-10-18 00:21:04","1214595045.0","2022-10-18","00:21:04"
"8631","🌚👉🏼🌃 Missão da noite:📣

Nosso governador Fernando Haddad estará no Roda Viva, na Tv Cultura hoje às 22h (horario de Brasília).
Bora assistir o professor e subir nas redes as hashtags?

#HaddadNoRodaViva #Haddad13 #HaddadGovernador

Link Cultura aovivo: https://youtu.be/fNbgIvaEBPI","2022-10-18 00:22:48","1738156693.0","2022-10-18","00:22:48"
"8639","👆🏻 Vídeo do Tarcísio no twitter do Leonardo Rossato aí em cima, pessoal","2022-10-18 00:47:54","93261439.0","2022-10-18","00:47:54"
"8615","Valeu, pessoal! Vou procurar mais coisas, mas isso já ajuda ❤️","2022-10-18 00:01:56","1388856293.0","2022-10-18","00:01:56"
"8618","Olha lá meu povo🔥🔥","2022-10-18 00:08:06","1738156693.0","2022-10-18","00:08:06"
"8692","Ridículo demais!","2022-10-18 01:51:56","1874693807.0","2022-10-18","01:51:56"
"8619","📣 Ei, comunicador ou comunicadora, quer ter um encontro com o presidente Lula? 😍

🗳 Chegamos na reta final para eleger #LulaPresidente13! Nesta terça-feira, 18 de outubro, às 9h30, acontece o Encontro virtual de Comunicadores e Comunicadoras com Lula. E teremos as presenças confirmadas de Gleisi Hoffmann, Geraldo Alckmin, Simone Tebet, Manuela D'Avila, Guilherme Boulos, Carlos Lupi, Randolfe Rodrigues e André Janones.

📝 Faça seu cadastro aqui: https://lula.com.br/inscreva-se-no-encontro-com-lula/

✅ Não esquece e anota na agenda:
📅 Terça-feira | 18/10 | ⏰ 9h30","2022-10-18 00:08:06","1738156693.0","2022-10-18","00:08:06"
"8620","Escolha a sua arte e bora levantar a #13DiasParaVotar13","2022-10-18 00:09:12","5273156285.0","2022-10-18","00:09:12"
"8622","#13DiasParaVotar13","2022-10-18 00:09:59","5273156285.0","2022-10-18","00:09:59"
"8628","Galera, daqui a pouco tem Haddad no roda viva, bora assistir e comentar nas redes","2022-10-18 00:13:05","1214595045.0","2022-10-18","00:13:05"
"8627","Acabei de receber esse vídeo por wsap. Achei muito bom","2022-10-18 00:11:43","1241230703.0","2022-10-18","00:11:43"
"8629","Galera, só para reforçar. O Janones criou um canal aqui no telegram ""André Janones Telegram"" e o Lula tbm irá usar esse msm canal para enviar alguns áudios sobre essa última etapa da campanha. Quem quiser se inscrever lá para ajudar a bater 40k.","2022-10-18 00:21:01","2098769893.0","2022-10-18","00:21:01"
"8632","Vamos começar com esse galera!!

Pra quem ainda não decidiu em quem votar, recomendo assistir ao #HaddadNoRodaViva !!

 #VoteHaddad13 #HaddadGovernadorSP","2022-10-18 00:29:15","5273156285.0","2022-10-18","00:29:15"
"8633","Verdade que o Tarcísio voltou atrás e disse que não foi um atentado?","2022-10-18 00:38:27","1038697534.0","2022-10-18","00:38:27"
"8634","Muito lindo!","2022-10-18 00:39:47","1708781356.0","2022-10-18","00:39:47"
"8635","Ele nunca disse que foi. Utilizaram essa tática aqui que o Gil do Vigor explicou no BBB:","2022-10-18 00:41:15","1708781356.0","2022-10-18","00:41:15"
"8636","https://twitter.com/GilDoVigor/status/1582090039982718976?t=lYOHxNslDjOk8kz9Oi-4fw&s=19","2022-10-18 00:42:10","1708781356.0","2022-10-18","00:42:10"
"8637","https://twitter.com/nadanovonofront/status/1582094673912680448?s=20&t=7HQvVCiYTs89QLSJpRVwQQ","2022-10-18 00:46:53","93261439.0","2022-10-18","00:46:53"
"8641","Aqui ó: https://twitter.com/francefootball/status/1582082676018012160?t=GtE3h5TXwc-978EsFzS8qA&s=19","2022-10-18 00:54:44","5743398383.0","2022-10-18","00:54:44"
"8643","Felipe Neto virou um patrimônio. ❤️😊","2022-10-18 00:57:56","1226492310.0","2022-10-18","00:57:56"
"8644","Vai começar o Haddad no Roda viva","2022-10-18 01:00:29","5737264740.0","2022-10-18","01:00:29"
"8660","Tenho esse mesmo pensamento","2022-10-18 01:29:15","1319512820.0","2022-10-18","01:29:15"
"8645","Haddad mandando a letra do ""ataque"" de hoje","2022-10-18 01:04:33","1038697534.0","2022-10-18","01:04:33"
"8646","🚨Tem banco de tuítes galera!!🚨

 Bora pro tuitaço!!","2022-10-18 01:04:41","5273156285.0","2022-10-18","01:04:41"
"8648","esses videos sao muito bom pra mandar nos grupos da familia trabalho etc","2022-10-18 01:19:42","1242545199.0","2022-10-18","01:19:42"
"8713","Se o Haddad é poste, o Tarcísio é o quê?","2022-10-18 02:00:26","1874693807.0","2022-10-18","02:00:26"
"8650","Gente, a entrevista é com o Haddad, mas os caras só querem falar do psdb...","2022-10-18 01:22:26","1038697534.0","2022-10-18","01:22:26"
"8651","ENGAJEMMMMM

https://twitter.com/lucawhitecastle/status/1582180698328535040?t=5PL2gKOgn_ye3gEQZycC7A&s=19","2022-10-18 01:24:35","5753566768.0","2022-10-18","01:24:35"
"8652","O sEnHoR é a FaVoR dA rEduçãO da MaIoRidAdE pEnAl, mds as perguntas kkk","2022-10-18 01:26:28","998379531.0","2022-10-18","01:26:28"
"8653","Que resposta MARAVILHOSA","2022-10-18 01:26:33","1874693807.0","2022-10-18","01:26:33"
"8654","O cara é bacharel em direito, professor de ciência política da USP. Faz favor, né?","2022-10-18 01:27:14","1874693807.0","2022-10-18","01:27:14"
"8655","Cara, perdi esse bloco, entrei agora e peguei Haddad macetando!!!!!!","2022-10-18 01:27:17","1388856293.0","2022-10-18","01:27:17"
"8656","Como uma pessoa olha para o Haddad e não sente vontade de votar nele?","2022-10-18 01:27:24","540200328.0","2022-10-18","01:27:24"
"8657","É assim que combate a Vera: com argumento","2022-10-18 01:27:51","1388856293.0","2022-10-18","01:27:51"
"8658","Precisamos de muitos cortes da fala dele sobre o Tarcísio e essa questão, falando que ele induz as pessoas ao erro.","2022-10-18 01:28:46","1388856293.0","2022-10-18","01:28:46"
"8659","ele foi muito perspicaz, já quero esse corte","2022-10-18 01:28:47","5307734936.0","2022-10-18","01:28:47"
"8661","Pessoal, é importante que os cortes tenham até 30 segundos, coisas muito longas as pessoas não ficam assistindo. E 1 minuto já é longo pro povo","2022-10-18 01:29:45","5346472771.0","2022-10-18","01:29:45"
"8662","Eu também","2022-10-18 01:29:46","5273156285.0","2022-10-18","01:29:46"
"8663","Gastaram tempo do programa com isso","2022-10-18 01:30:49","1226492310.0","2022-10-18","01:30:49"
"8664","Aí Haddad cuidado","2022-10-18 01:32:02","40454454.0","2022-10-18","01:32:02"
"8665","Gente, tem umas artes de ataque ao tarcisio aqui https://drive.google.com/drive/folders/1-2SMFq_HPQjcqUPnInTES4a9DJfT5nfq dependendo doq for pautado no debate dá pra usar pra ir postando junto com as hashtags tb","2022-10-18 01:32:12","1214595045.0","2022-10-18","01:32:12"
"8666","Nossa, néee","2022-10-18 01:33:20","1038697534.0","2022-10-18","01:33:20"
"8668","Boa noite meu povo, um vídeo ungido para compartilhar no grupo da família","2022-10-18 01:36:17","5721438433.0","2022-10-18","01:36:17"
"8669","Nada de novo no front, TV Cultura, né?","2022-10-18 01:37:19","1874693807.0","2022-10-18","01:37:19"
"8670","Deu uma carteirada de leves na Vera Rosa agora","2022-10-18 01:41:55","1874693807.0","2022-10-18","01:41:55"
"8671","Os jornalistas tão querendo colocar coisa na boca do Haddad a qualquer custo né","2022-10-18 01:41:58","1038697534.0","2022-10-18","01:41:58"
"8672","Haddad maravilhoso demais. Já as perguntas... 🧐","2022-10-18 01:42:04","970243103.0","2022-10-18","01:42:04"
"8673","Eae pessoal boa noite, não sei se vcs estão sabendo o Janones criou um grupo no telegram para meio que ajudar na divulgação do Lula, quem quiser entrar é só pesquisar pelo nome dele, já são mais de 40 mil pessoas por lá, vamos juntos ❤️🙏🏻","2022-10-18 01:42:11","1383828578.0","2022-10-18","01:42:11"
"8674","No fundo, no fundo, eu achei foi é pouco hahahaha","2022-10-18 01:42:43","1038697534.0","2022-10-18","01:42:43"
"8675","""Você está falando com uma pessoa com conhecimento jurídico, estou te dizendo""","2022-10-18 01:43:44","1874693807.0","2022-10-18","01:43:44"
"8676","Pisou com classe","2022-10-18 01:44:43","1038697534.0","2022-10-18","01:44:43"
"8677","Bacharel em direito, mestre em economia, doutor em filosofia. Professor de ciência política da USP. Experiente em gestão pública. Gente, QUAL A DÚVIDA?","2022-10-18 01:45:25","1874693807.0","2022-10-18","01:45:25"
"8678","Tinha que fazer um card comparando os currículos","2022-10-18 01:45:59","1874693807.0","2022-10-18","01:45:59"
"8679","Ótima ideia!","2022-10-18 01:46:20","970243103.0","2022-10-18","01:46:20"
"8681","uMa EsCoLhA mUiTo DiFíCiL","2022-10-18 01:47:00","1038697534.0","2022-10-18","01:47:00"
"8682","Ou um vídeo, tipo: ""quem você contrataria?""","2022-10-18 01:47:12","1874693807.0","2022-10-18","01:47:12"
"8683","Parte 2","2022-10-18 01:47:31","1038697534.0","2022-10-18","01:47:31"
"8684","Ele manja demais, outro nível de discussão.","2022-10-18 01:49:14","14862870.0","2022-10-18","01:49:14"
"8690","Odeio o argumento das pessoas ""ele é muito inteligente, mas escolheu o partido errado"" 😑😑😑","2022-10-18 01:51:35","1388856293.0","2022-10-18","01:51:35"
"8685","O cara é brilhante! Imaginar qur poderia ter sido ele nosso presidente. Puta merda...","2022-10-18 01:49:57","1388856293.0","2022-10-18","01:49:57"
"8686","Haddad teria dado aula na pandemia, sinceramente","2022-10-18 01:50:48","1388856293.0","2022-10-18","01:50:48"
"8687","Não tem um só dia desde 2018 que eu não pense nisso. Principalmente depois que começou a pandemia","2022-10-18 01:50:49","1874693807.0","2022-10-18","01:50:49"
"8688","Dá uma tristeza, né?? Imagina onde a gente estaria hoje","2022-10-18 01:51:05","1038697534.0","2022-10-18","01:51:05"
"8689","Esse ponto aí dele ter acabado com a inspeção veicular é bom hein","2022-10-18 01:51:10","14862870.0","2022-10-18","01:51:10"
"8691","Queria ver o Tarcísio debatendo com ele, seria um bozo 2.0","2022-10-18 01:51:40","1214595045.0","2022-10-18","01:51:40"
"8693","É muito triste, pq com certeza teria morrido menos gente. Qualquer candidato de 2018 teria sido mais razoável.","2022-10-18 01:52:04","14862870.0","2022-10-18","01:52:04"
"8694","O cara é muito bom... Fala de tudo sem gaguejar","2022-10-18 01:52:27","1038697534.0","2022-10-18","01:52:27"
"8695","Total! Mas tb penso que Haddad teria sido brilhante, de verdade. Ele é muito competente.","2022-10-18 01:52:42","1388856293.0","2022-10-18","01:52:42"
"8697","Mano, olha essa resposta do Haddad! Que aula","2022-10-18 01:54:23","1038697534.0","2022-10-18","01:54:23"
"8698","Dá uma tristeza ver o que poderia ter sido né","2022-10-18 01:54:58","5345493331.0","2022-10-18","01:54:58"
"8699","E aí votam no outro que nem partido tem direito...","2022-10-18 01:55:11","970243103.0","2022-10-18","01:55:11"
"8700","Com certeza. É o tal ""Saudades do que a gente não viveu""","2022-10-18 01:55:45","1874693807.0","2022-10-18","01:55:45"
"8701","Haddad dá aula","2022-10-18 01:56:13","1241230703.0","2022-10-18","01:56:13"
"8702","Muito bom ele nessa sabatina","2022-10-18 01:56:45","1241230703.0","2022-10-18","01:56:45"
"8703","Gente, vocês viram a entrevista dele pro Caetano, na Midia Ninja? É sobre o livro dele, de ficar de boca aberta","2022-10-18 01:57:12","970243103.0","2022-10-18","01:57:12"
"8704","Ele com o Safatle tb é muito bom","2022-10-18 01:57:28","1241230703.0","2022-10-18","01:57:28"
"8705","Vou verrrr","2022-10-18 01:57:34","1388856293.0","2022-10-18","01:57:34"
"8706","Ainda não vi com o Caetano, quero ver","2022-10-18 01:57:59","1241230703.0","2022-10-18","01:57:59"
"8714","Se for, vai só pra ser jantado pelo Haddad","2022-10-18 02:00:40","1038697534.0","2022-10-18","02:00:40"
"8707","O Safatle tive aula com ele e tenho birra pessoal, mas como intelectual é maravilhoso também. hahaha","2022-10-18 01:58:02","970243103.0","2022-10-18","01:58:02"
"8708","O Tarcísio vai no debate da Globo? Pena que é de véspera, porque o tombo dele vai ser grande","2022-10-18 01:58:13","1388856293.0","2022-10-18","01:58:13"
"8709","Será que Tarcisio tem coragem? Queria ver isso","2022-10-18 01:58:36","970243103.0","2022-10-18","01:58:36"
"8710","Oi gente! Alguém tem o vídeo do RAI falando no palco da FIFA, com a foto do Sócrates no fundo e fazendo o L de Lula??? Falando que está do lado de Lula?","2022-10-18 01:59:08","5728402475.0","2022-10-18","01:59:08"
"8711","E a minha prima que chamou ele de poste... E ela é uma advogada bem meia boca. Eu ja falei para ela (por causa do Bozo também) que se pudesse escolher família, ela certamente não seria minha escolha....  Que, sendo assim, ela não é bem vinda na minha casa.... Nunca mais. 😄","2022-10-18 01:59:21","1226492310.0","2022-10-18","01:59:21"
"8712","Vai nada. Depois que foi jantado no primeiro resolveu não ir em nenhum","2022-10-18 01:59:34","1874693807.0","2022-10-18","01:59:34"
"8715","Ah, Vera...mas neeeeem se compara, né?","2022-10-18 02:00:57","1874693807.0","2022-10-18","02:00:57"
"8716","Kali Acabei de ver aqui, só não sei baixar 
https://twitter.com/abonmatti/status/1582082610695917575","2022-10-18 02:03:38","970243103.0","2022-10-18","02:03:38"
"8717","Pois veja... Não dá nem para dizer que é enfeite porque lhe falta beleza para tal... Ai gente, desculpa, são fatos. Kkkk","2022-10-18 02:04:58","1226492310.0","2022-10-18","02:04:58"
"8718","""nós vamos perder um debate aqui pra tratar desses assuntos...."" 🙄","2022-10-18 02:05:08","970243103.0","2022-10-18","02:05:08"
"8719","O cara tem a chance de debater proposta pra sp e quer falar disso","2022-10-18 02:05:41","1038697534.0","2022-10-18","02:05:41"
"8720","Que homem asqueroso","2022-10-18 02:06:15","1038697534.0","2022-10-18","02:06:15"
"8721","Que merda foi essa?","2022-10-18 02:06:31","1241230703.0","2022-10-18","02:06:31"
"8722","Vergonhoso, da mesma forma que acho vergonhoso perguntar sobre a Dilma pro Lula 🤡","2022-10-18 02:07:07","1388856293.0","2022-10-18","02:07:07"
"8723","Jornalista que se informa pelo zap. Ele não sabia nem do que ele estava falando…","2022-10-18 02:07:13","540200328.0","2022-10-18","02:07:13"
"8724","É ridículo um profissional de imprensa se prestar a um papel de escada a quem nem esta no debate. E falo como jornalista.","2022-10-18 02:08:00","1226492310.0","2022-10-18","02:08:00"
"8726","""Não sou eu que to falando, é o cientista da Columbia University""","2022-10-18 02:08:15","1038697534.0","2022-10-18","02:08:15"
"8733","Quem são estes caras, pelo amor de Deus!","2022-10-18 02:12:50","1226492310.0","2022-10-18","02:12:50"
"8727","https://twitter.com/heldermaldonado/status/1434871953446391817?t=RZW1E4XpBJMekFp0ARhOXA&s=19

Feio demais","2022-10-18 02:08:52","5345493331.0","2022-10-18","02:08:52"
"8728","Ai gente, é cada pergunta...","2022-10-18 02:09:14","1214595045.0","2022-10-18","02:09:14"
"8729","Facada 2.0","2022-10-18 02:10:02","1038697534.0","2022-10-18","02:10:02"
"8730","Afff, cada uma! Inacreditável","2022-10-18 02:10:13","551180971.0","2022-10-18","02:10:13"
"8731","A direita usando esse corte pra falar em censura em 3, 2...","2022-10-18 02:10:41","1388856293.0","2022-10-18","02:10:41"
"8732","Haddad trabalhando pra dar cortes pra gente ❤️","2022-10-18 02:12:16","1388856293.0","2022-10-18","02:12:16"
"8734","EU SEI O QUE É A USP, A UNESP, A UNICAMP, A VACINA","2022-10-18 02:13:33","970243103.0","2022-10-18","02:13:33"
"8735","Só dá orgulho","2022-10-18 02:13:49","1388856293.0","2022-10-18","02:13:49"
"8736","on fire🔥","2022-10-18 02:13:52","1642019694.0","2022-10-18","02:13:52"
"8737","O homem tá com sangue nos olhosssss ✊✊✊✊✊","2022-10-18 02:14:21","1388856293.0","2022-10-18","02:14:21"
"8738","Que homem, gente","2022-10-18 02:14:23","1038697534.0","2022-10-18","02:14:23"
"8739","E a gente também mmm 💫💫💫 bora trabalhar pra ele ganhar ❤️","2022-10-18 02:14:56","1388856293.0","2022-10-18","02:14:56"
"8740","UHU! Incrível. Corte lindo também","2022-10-18 02:14:57","970243103.0","2022-10-18","02:14:57"
"8741","Sem medo de dizer as verdades","2022-10-18 02:15:09","1038697534.0","2022-10-18","02:15:09"
"8742","Bora!!! Tá dando até mais gás de ir pra rua.","2022-10-18 02:15:54","970243103.0","2022-10-18","02:15:54"
"8743","Ele ta muito mais empolgado que pra presidencia em 2018 hahaha ele gosta muito de SP.
E a gnt gosta muuito do professor ❤️❤️","2022-10-18 02:18:47","130872481.0","2022-10-18","02:18:47"
"8744","Hahahaha verdade","2022-10-18 02:20:05","970243103.0","2022-10-18","02:20:05"
"8747","Gente, podem mandar de novo o arquivo dos Padres e religiosos com o Lula?","2022-10-18 02:24:07","1590590600.0","2022-10-18","02:24:07"
"8748","Haddad acabou de virar o voto da jornalista do estadão","2022-10-18 02:24:47","1038697534.0","2022-10-18","02:24:47"
"8749","isso aqui é bom pra mandar pras pessoas religiosas","2022-10-18 02:24:53","1242545199.0","2022-10-18","02:24:53"
"8750","Sim, mas eu preciso daquele texto que saiu hoje, pra mandar pra umas pessoas aqui","2022-10-18 02:25:46","1590590600.0","2022-10-18","02:25:46"
"8751","Tá no canal do Vira Voto geral","2022-10-18 02:26:48","1874693807.0","2022-10-18","02:26:48"
"8752","Inclusive, nos comentários lá tem o link da gravação do evento e tem o corte do vídeo do padre lendo a carta","2022-10-18 02:28:06","1874693807.0","2022-10-18","02:28:06"
"8753","Blz. Vou ver la","2022-10-18 02:29:53","1590590600.0","2022-10-18","02:29:53"
"8754","Isso que ele falou do astronauta é muito real. Hoje verificando as buscas, o que tava em alta no período da votação era ""astronauta número"", ""senador astronauta"", ""candidato do Bolsonaro senador"". É triste e bizarro.","2022-10-18 02:33:35","1388856293.0","2022-10-18","02:33:35"
"8755","O voto do Tarcísio é bem sensível. A gente consegue virar, mas precisa alcançar as pessoas.","2022-10-18 02:34:27","1388856293.0","2022-10-18","02:34:27"
"8756","Eu fico indignada com isso...","2022-10-18 02:35:58","1226492310.0","2022-10-18","02:35:58"
"8757","Sensacional!!! É exatamente como me sinto","2022-10-18 02:36:46","1708781356.0","2022-10-18","02:36:46"
"8759","#centrao","2022-10-18 02:38:32","14862870.0","2022-10-18","02:38:32"
"8760","Genial essa resposta dos impostos","2022-10-18 02:41:29","1874693807.0","2022-10-18","02:41:29"
"8761","Tudoooooo. É impressionante!!!","2022-10-18 02:42:55","1708781356.0","2022-10-18","02:42:55"
"8762","A resposta de segurança pública foi muito boa também!","2022-10-18 02:43:45","1038697534.0","2022-10-18","02:43:45"
"8763","Vamo continuar engajando nas redes 🔥","2022-10-18 02:45:32","1214595045.0","2022-10-18","02:45:32"
"8764","Essa história do Tarcísio querer se senador por Goiás rende para nós","2022-10-18 02:50:17","1226492310.0","2022-10-18","02:50:17"
"8765","Haddad foi tão beem que os jornalistas não queriam terminar","2022-10-18 02:50:19","1038697534.0","2022-10-18","02:50:19"
"8766","Deu até gosto de assistir ❤️","2022-10-18 02:50:39","5273156285.0","2022-10-18","02:50:39"
"8767","Sim!","2022-10-18 02:50:50","1214595045.0","2022-10-18","02:50:50"
"8768","Verdade, dá material isso","2022-10-18 02:51:02","1874693807.0","2022-10-18","02:51:02"
"8810","o problema é que o interior de SP é muito direitista, é do PSDB","2022-10-18 12:08:38","5656766395.0","2022-10-18","12:08:38"
"8769","Essa frase foi emocionante demais!!","2022-10-18 02:52:36","1708781356.0","2022-10-18","02:52:36"
"8770","De verdade, se Tarcísio fosse minimamente honesto, depois desse tapa na cara que Haddad deu com muita elegância, eu entregaria pro Haddad hahahaha","2022-10-18 02:54:30","1388856293.0","2022-10-18","02:54:30"
"8771","https://noticias.uol.com.br/politica/ultimas-noticias/2021/09/11/tarcisio-admite-que-pode-se-candidatar-ao-senado-e-cita-opcoes-de-estado.htm","2022-10-18 02:54:30","1226492310.0","2022-10-18","02:54:30"
"8773","Tarcísio fantoche de miliciano","2022-10-18 02:58:44","130872481.0","2022-10-18","02:58:44"
"8774","Olá, pessoal!

Para evitarmos ataques, o grupo fecha todos os dias às 00h e retorna às 08h (horário de Brasília).
Até amanhã!

E Lula 13!⭐️","2022-10-18 03:00:50","5662608456.0","2022-10-18","03:00:50"
"8778","*VIRA VOTO FEMINISTA*

#PANFLETAGEM 

*Terça - 18/10*

🚩 Metrô Vl Madalena - das 07:00 - 10:00

🚩 Metrô Vl Madalena - das 16:00 - 20h00

🚩 Metrô Faria Lima/Lg da Batata - das 16:30 - 20:00

🚩Feira da Rua Santo Antônio com a rua São Vicente - das 11:30 às 14:00

🚩Praça do Forró - das 08:00 às 12:00

🚩Bandeiraço no cruzamento da Av. Arthur da No a com Nitroquímica - 14:00

🚩Metro Marechal - das 17:00 às 19:00

🚩Metrô Santa Cruz - das 8h às 9h30 e das 12:30 às 18:30h.

🚩Avenida Paulista esq com Augusta - 13:00 às 19h.

🚩Zona Sul/Metrô Capão - 15:00 às 19:00h.

🚩Zona Noroeste/Terminal Pirituba - 7:00 às 11:00h.

🚩 Pirituba/Perus - Feita do Satélite (Concentração em frente ao supermercado Barbosa)
 10:00 - 13:00 

🚩 Estação Lapa - 16:00 - 19:00
         
🚩Santa Cecília - rua Francisco Estácio Fortes, 60 - 9:00 às 19:00h. (Comitê para retirada de material)

🚩Osasco - calçadão - 13 àbs 17h

🚩 Mauá - em frente ao torra torra das 12:00 às 17:00","2022-10-18 09:47:00","678645382.0","2022-10-18","09:47:00"
"8779","ATENÇÃO, PRESIDENTE PRUDENTE! É HOJE! 

Envie essa imagem para um amigo da região.","2022-10-18 10:05:16","678645382.0","2022-10-18","10:05:16"
"8780","(Eu aqui li PRESIDENTE HADDAD e chega me deu um quentinho no coração 🤣❤️)

Bora engajar postagens com os cortes do Roda Viva Hoje. Não se esqueçam de colocar a # ENGAJAMENTO em suas postagens e vamo que são 12 dias para invadir as redes e as ruas","2022-10-18 10:06:55","678645382.0","2022-10-18","10:06:55"
"8781","#ENGAJAMENTO 🤩","2022-10-18 10:08:57","678645382.0","2022-10-18","10:08:57"
"8811","Meu sonho é separar a capital e a grande são Paulo do interior kkkk","2022-10-18 12:10:43","667393980.0","2022-10-18","12:10:43"
"8784","Olá, pessoal!

Para evitarmos ataques, o grupo fecha todos os dias às 00h e retorna às 08h (horário de Brasília).
Bom dia!

E Lula 13!⭐️","2022-10-18 11:00:49","5662608456.0","2022-10-18","11:00:49"
"8787","#engajamento 🤩","2022-10-18 11:04:41","678645382.0","2022-10-18","11:04:41"
"8788","https://twitter.com/pontejornalismo/status/1582061564034617350?t=yYY-2i4zuSWoeDwTu4z0Kw&s=19","2022-10-18 11:08:53","1738156693.0","2022-10-18","11:08:53"
"8818","Você tem algumas cidades do interior com outro cenário - como Araraquara, São Carlos - mas as mais miúdas, principalmente as mais inacessíveis, são pela hora da morte","2022-10-18 12:18:10","627715574.0","2022-10-18","12:18:10"
"8795","#engajamento 🔥","2022-10-18 11:31:58","678645382.0","2022-10-18","11:31:58"
"8796","JÁ VIROU UM VOTO HOJE? Chega naquele amigo indeciso, fala das propostas do professor 👨‍🏫 para o nosso estado e vem fazer parte dessa virada gostosa! 
 
Aqui você encontra as propostas que vão mudar SP:

📲 http://haddadoficial.com.br/propostas","2022-10-18 11:31:58","678645382.0","2022-10-18","11:31:58"
"8798","Ah sim, mas o desanimo é que estamos em um buraco sem fundo. Esse povo além de ser mentiroso são ruim demais","2022-10-18 11:47:32","667393980.0","2022-10-18","11:47:32"
"8799","Pessoal bom dia!
Sobre o tiroteio ontem na Parsisópolis o Chavoso da USP postou conversar com pessoas de lá, seguem prints","2022-10-18 11:48:01","1697383665.0","2022-10-18","11:48:01"
"8803","Olha eu compreendo. 
Mas acho que é ok o cansaço. Ok uma mulher preta estar de saco cheio de ter que lutar o tempo todo. As vezes a gente só quer ser a Lana Piovani e poder postar foto de biquini kkkkkkk","2022-10-18 11:48:36","667393980.0","2022-10-18","11:48:36"
"8804","Estratégia bastante usada pelos nazistas. Procurem sobre . Fazer um terror artificial pras pessoas se desesperarem","2022-10-18 11:53:01","1299668862.0","2022-10-18","11:53:01"
"8837","Vcs acham que isso aqui podia render uns materiais mais conpartilhaveis?","2022-10-18 13:21:42","14862870.0","2022-10-18","13:21:42"
"8805","Com toda certeza. É uma existência exaustiva e literalmente não tem um momento de paz.","2022-10-18 11:55:25","627715574.0","2022-10-18","11:55:25"
"8806","Ontem em uma discussão vi um dado interessante: Haddad ganhou na cidade de sao paulo e isso pode ser usado contra o argumento de ""pior prefeito"" que adoram usar. 
Em SP haddad ficou 12% a frente do carioca paraquedista. 

Quando dei essa informação ficaram meio sem reação, porque a logica nao fecha!","2022-10-18 12:00:23","130872481.0","2022-10-18","12:00:23"
"8807","Fora que ele ganhou diversos prêmios enquanto prefeito.","2022-10-18 12:06:29","540200328.0","2022-10-18","12:06:29"
"8808","Oi gente! 
Tava aqui pensando... Faz parte o cansaço, principalmente se a gente faz parte das minorias sociais que são diretamente atacadas por essa conjuntura. Acho positivo se permitir cansar também, se cuidar, buscar ombro amigo de suporte. 
Lembrar do que a Sabrina falou lá no treinamento, militância é corrida de revezamento, não maratona. 
A gente descansa, toma um ar, renova as forças e volta!","2022-10-18 12:06:33","970243103.0","2022-10-18","12:06:33"
"8809","Haddad levou Sao Paulo, São Bernardo, Santo Andre, Maua, Carapicuiba. Ainda nao vi o resto, mas da regiao metropolitana ja sao esses","2022-10-18 12:06:51","130872481.0","2022-10-18","12:06:51"
"8812","Essa imagem, não sei se convence, mas acho que vale #tarcisio #atentado","2022-10-18 12:11:39","667393980.0","2022-10-18","12:11:39"
"8813","Bora pra cima!!","2022-10-18 12:12:35","5285130733.0","2022-10-18","12:12:35"
