"message_id","message","message_utc","from_id","date","time"
"4500","https://www.jornaldacidadeonline.com.br/noticias/45386/perfidia-acao-que-e-condenada-ate-em-guerra-foi-usada-contra-manifestantes-em-brasilia-veja-o-video","2023-01-15 15:43:55","161215470.0","2023-01-15","15:43:55"
"4501","<<Relato de um policial federal: “Acordei agora, estava desde anteontem na Academia da PF, convocado para apoiar os procedimentos. 
Resultado, 1230 novos presos políticos no Brasil. 
""Crimes"" com penas de 15 anos ou mais. Todos de uma vez só, nos mesmos artigos, sem investigação, sem provas e sem individualização de conduta, ou seja, de ""quem fez o quê"".
Em sua grande maioria pessoas humildes decentes, familias inteiras cujo ""crime real"" foi apenas estarem acampados em frente ao QG do exército, acreditando estarem protegidos por ele, se manifestando por liberdade. 
Mas foram traídos e ""entregues"" exatamente por ""judas fardados"" que eles acreditavam os estarem protegendo.
Acusados por crimes que, em sua enorme maioria, foram cometidos POR OUTRAS PESSOAS.
Gostaria que cada  brasileiro que apoia esse expurgo ideológico pudesse encarar o olhar de desespero e súplica nas faces dessas pessoas simples.

Pergunta-se: qual ‘lei’ e qual ‘ordem’ a instituição das FFAA está guardando no Brasil de hoje?","2023-01-15 23:12:20","161215470.0","2023-01-15","23:12:20"
