"message_id","message","message_utc","from_id","date","time"
"498126","Vou falar uma coisa ou nós começamos  a mostrar nossa indignação  contra este pessoal  na frente dos quartéis ou iremos  deixar eles conseguirem  o que eles querem. 

Eu toda vez que passo  por eles eu grito vai trabalhar  bando de vagabundos.

Se todos  que são contrar mostrarem  que são contra  os militares  tbm vão entender  que tem pessoas  contra o golpe.","2022-12-26 20:37:12","5667586986","2022-12-26","20:37:12"
"498127","Vou falar uma coisa ou nós começamos  a mostrar nossa indignação  contra este pessoal  na frente dos quartéis ou iremos  deixar eles conseguirem  o que eles querem. 

Eu toda vez que passo  por eles eu grito vai trabalhar  bando de vagabundos.

Se todos  que são contrar mostrarem  que são contra  os militares  tbm vão entender  que tem pessoas  contra o golpe.","2022-12-26 21:05:21","5245669217","2022-12-26","21:05:21"
"498128","Vou falar uma coisa ou nós começamos  a mostrar nossa indignação  contra este pessoal  na frente dos quartéis ou iremos  deixar eles conseguirem  o que eles querem. 

Eu toda vez que passo  por eles eu grito vai trabalhar  bando de vagabundos.

Se todos  que são contrar mostrarem  que são contra  os militares  tbm vão entender  que tem pessoas  contra o golpe.","2022-12-26 21:21:53","1235275534","2022-12-26","21:21:53"
