"message_id","message","message_utc","from_id","date","time"
"5876","Crime fins eleitoreiro canalhas mil vezes canalhas. Ananideua Pará","2022-10-26 00:50:49","1667736363","2022-10-26","00:50:49"
"5878","Eleições 2022: ao vivo, Metrópoles Entrevista Jair Bolsonaro, candidato à reeleição 
https://www.youtube.com/watch?v=_juEB_fha4Q

https://youtu.be/_juEB_fha4Q

Eu sei que o jornal Metrópoles é descaradamente de esquerda, mas nesse caso devemos dar engajamento à entrevista, Bolsonaro foi muito bem mesmo com todas as pegadinhas. Sendo jornal de outras bolhas e até conhecido, pode alcançar público diferente. Ao menos ver e interagir com o vídeo, sugiro apenas não se inscrever no canal do Metrópoles.","2022-10-26 01:31:44","1667736363","2022-10-26","01:31:44"
"5879","Inacreditável! TSE ameaça punir Bolsonaro por crime eleitoral 
https://www.youtube.com/watch?v=zfkvm5zAZUQ

https://youtu.be/zfkvm5zAZUQ

Não deixe o consórcio de imprensa abafar isso como está tentando, espalha para todo lado, levante esse assunto. E não deixe a pauta da censura perder força também, siga levantando isso e escancarando o absurdo.

Pelo canal Gazeta do Povo:

""O ministro das Comunicações, Fábio Faria, convocou entrevista coletiva na noite de ontem (24) para fazer uma denúncia: a campanha de Bolsonaro estaria sendo prejudicada com a não-inserção de publicidade em rádios do interior, sobretudo no nordeste. Como o TSE reagiu a isso? Com desprezo, truculência e ameaçando o denunciante, ou seja, Jair Bolsonaro""","2022-10-26 02:02:32","1667736363","2022-10-26","02:02:32"
"5880","POSSÍVEL FRAUDE CONTRA A PROPAGANDA DE RÁDIO DE BOLSONARO JOGA INCERTEZA SOBRE A ELEIÇÃO 
https://www.youtube.com/watch?v=S4Z_JPHRJQA

https://youtu.be/S4Z_JPHRJQA

Preste atenção ao conselho de botar a boca no trombone sobre isso enquanto mantém a questão da censura, o esforço para abafar esse caso do prejuízo da campanha pelo interior principalmente do Nordeste é muito. A explicação da mecânica de como isso funciona foi bem didática. Peço que ajudem o canal do Paulo Moura em sua meta chamando pessoas para se inscreverem, vale mais do que a pena.

Pelo canal Dextra by Paulo Moura:

""Comentário político 25/10/2022 - A denúncia sobre a violação de lei da propaganda eleitoral em prejuízo do presidente Bolsonaro é gravíssima, pois pode ter adulterado o resultado do 1° turno e estar comprometendo o resultado do 2° turno. Comprovada a denúncia, é caso de segurança nacional.""","2022-10-26 02:21:38","1667736363","2022-10-26","02:21:38"
"5881","This channel can’t be displayed because it violated local laws.","2022-10-26 02:37:25","1667736363","2022-10-26","02:37:25"
"5887","Isso aí Gustavo Lima, essa é a única verdade possível!  

Diante da ameaça de um governo socialista no Brasil, que trabalhará para promover o aborto, as drogas, a ideologia de gênero nas escolas, a desconstrução da família e todos os antivalores, cante como o Gustavo Lima: ""Maria, passa na frente e pisa na cabeça da serpente...""!","2022-10-26 02:55:04","1667736363","2022-10-26","02:55:04"
"5882","Inserção na rádio, pela campanha de Lula.

“Bolsonaro não vai dar aumento real no salário mínimo”

“Bolsonaro vai acabar com as férias”

“Bolsonaro vai acabar com auxílio emergencial de 600 reais”

Como que o TSEjusbr permite isso?

Quando o L não está mentindo , ele está Roubando …","2022-10-26 02:40:12","1667736363","2022-10-26","02:40:12"
"5884","Opinião de Lula sobre aborto, 6 meses atrás","2022-10-26 02:47:07","1667736363","2022-10-26","02:47:07"
"5885","Nesse segundo episódio da nossa série ""PT e Lula: 30 anos defendendo o ab0rt0"", confrontamos mais uma vez Lula e seu Partido das Trevas com um conteúdo preparado minuciosamente para desmascarar suas mentiras. 

Compartilhe a Verdade nua e crua sobre a cultura da morte na era PT e acompanhe aqui, nas nossas redes, os próximos capítulos! 

Você sabia desse envolvimento do PT com o aborto?","2022-10-26 02:48:49","1667736363","2022-10-26","02:48:49"
"5886","Só Bolsonaro superou a marca de 400 mil títulos de propriedades emitidos para produtores rurais.

Somente este ano foram entregues 124.954 documentos as famílias do campo.

Com Bolsonaro o pobre não é instrumentalizado para manter a funcionalidade de um sistema caótico, como fez o PT em seus anos de desgoverno.

Vote certo! 

Vote 2⃣2⃣","2022-10-26 02:51:05","1667736363","2022-10-26","02:51:05"
"5888","This community was blocked in Brazil following a decision of the Superior Electoral Court (TSE).","2022-10-26 02:56:28","1667736363","2022-10-26","02:56:28"
"5889","Diferente da manchete do UOL dá a entender às 23:58 hs de 25\10, Ana Paula Henkel e Fiuza não foram afastados pela JP, eles se afastaram espontaneamente enquanto Augusto Nunes é afastado a pedido do PT. 

https://revistaoeste.com/politica/eleicoes-2022/augusto-nunes-e-suspenso-da-jovem-pan/","2022-10-26 03:02:10","1667736363","2022-10-26","03:02:10"
"5890","AUGUSTO NUNES fala as PALAVRAS PROIBIDAS porque o TSE disse que NÃO HAVIA CENSURA e acaba CENSURADO 
https://www.youtube.com/watch?v=jR4FB2tBkRY

https://youtu.be/jR4FB2tBkRY

Peter só esqueceu de mencionar o Fiuza que também tomou a mesma atitude da Ana Paula, ao mostrar como Augusto provou a censura. E o próprio Peter quis convidar o Augusto para entrevistá-lo no canal em solidariedade. 

Depois de mostrar repercussões dessas coisas recentes, deixou um recado ao final aos indecisos, aos abstinentes e principalmente para quem se opõe aos dois candidatos e não gosta de ambos.","2022-10-26 03:38:53","1667736363","2022-10-26","03:38:53"
"5891","BRASIL acertou TUDO na GESTÃO ECONÔMICA e HOJE virou o PREFERIDO de INVESTIDORES 
https://www.youtube.com/watch?v=muUFzb7v5eU

https://youtu.be/muUFzb7v5eU

Até a Bloomberg chama o Brasil de refúgio. Repare no que falou a revista especializada dos maiores resultados brasileiros nisso em 13 anos (ou seja, desde os últimos anos do governo Lula) e na comparação com a situação dos outros países, não apenas vizinhos. E principalmente, repare no aviso da necessidade dessa estabilidade atual num mundo rumando para problemas em todos os continentes!","2022-10-26 03:51:10","1667736363","2022-10-26","03:51:10"
"5892","ITALIANOS discutem COMO CHAMAR um PRESIDENTE do CONSELHO mulher, ""IL PRESIDENTE"" ou ""LA PRESIDENTE"" 
https://www.youtube.com/watch?v=2vTKucFjjIc

https://youtu.be/2vTKucFjjIc

Por acaso uma recente mandatária brasileira, a sábia, a ""mulher sapiens"" Dilma Rousseff tem a solução para o grande problema, como sempre tinha. hehehe 

Legal mesmo é o que ele reparou nos identitários sobre mudar coisas na linguagem neutra, como tudo mais,  conforme a conveniência. Não que o assunto da italiana tenha chegado a esse tema lá, aparentemente.","2022-10-26 04:16:30","1667736363","2022-10-26","04:16:30"
"5893","QUE SURRA 👏👏👏🤣🤣🤣

RIO GRANDE DO SUL É ONYX","2022-10-26 04:19:22","1667736363","2022-10-26","04:19:22"
"5894","GOVERNO aponta EMISSORAS e HORÁRIOS em que mais de 154 mil INSERÇÕES foram ROUBADAS de BOLSONARO 
https://www.youtube.com/watch?v=7WTQ6a0Mbvo

https://youtu.be/7WTQ6a0Mbvo

Peter destrinchou o caso todo do fato novo, incluindo a reação da esquerda estranhamente forçada para tentar ludibriar. Ou a reação do próprio TSE exigindo provas que acaba servindo à campanha e possíveis consequências. 

A exigência de provas do denunciante desse jeito até rendeu conversa, teve inscrito nos comentários que lembrou até: ""para mandar federal na casa de empresários só precisou de prints. E não tinha nada demais no print por sinal."" 

Façamos esse assunto estourar tanto na internet como fora, a imprensa tenta largar isso!!! É sério!!!","2022-10-26 04:44:09","1667736363","2022-10-26","04:44:09"
"5895","Inacreditável! TSE ameaça punir Bolsonaro por crime eleitoral 

Não deixe o consórcio de imprensa abafar isso como está tentando, espalha para todo lado, levante esse assunto. E não deixe a pauta da censura perder força também, siga levantando isso e escancarando o absurdo.

Pelo canal Gazeta do Povo:

""O ministro das Comunicações, Fábio Faria, convocou entrevista coletiva na noite de ontem (24) para fazer uma denúncia: a campanha de Bolsonaro estaria sendo prejudicada com a não-inserção de publicidade em rádios do interior, sobretudo no nordeste. Como o TSE reagiu a isso? Com desprezo, truculência e ameaçando o denunciante, ou seja, Jair Bolsonaro""","2022-10-26 04:48:41","1667736363","2022-10-26","04:48:41"
"5896","Neste domingo, mais de 156 milhões de eleitores irão às urnas decidir o futuro do nosso Brasil. 

Infelizmente, muitos ainda não perceberam o risco que nossa pátria corre, caso o candidato do PT seja vitorioso.

É nossa missão, nesses últimos dias, convencer os eleitores indecisos, e virar os votos brancos e nulos para o 2️⃣2️⃣! 

A hora é agora! É Jair ou já era!","2022-10-26 04:50:48","1667736363","2022-10-26","04:50:48"
"5897","https://twitter.com/ErikaMo09331313/status/1585134935345868803?t=vDyVTe_oRAPTHbO83hgJ2A&s=09","2022-10-26 12:43:34","1760994429","2022-10-26","12:43:34"
"5898","https://twitter.com/somosalianca/status/1585023449906282499?t=5tcukbL1wSsTw7anfSjCNw&s=09","2022-10-26 12:48:52","1760994429","2022-10-26","12:48:52"
"5899","https://twitter.com/andrevaladao/status/1585094856015499264?t=zF1KnMHc_Mxbw-bHHiqVpA&s=09","2022-10-26 12:53:27","1760994429","2022-10-26","12:53:27"
"5900","https://twitter.com/lilianbscosta22/status/1585210238256676864?t=nu5CmoUOvrLiqQvCFN__JQ&s=09","2022-10-26 14:59:31","1760994429","2022-10-26","14:59:31"
"5901","https://twitter.com/somosalianca/status/1585031427569389568?s=09","2022-10-26 16:42:58","1760994429","2022-10-26","16:42:58"
