"message_id","message","message_utc","from_id","date","time"
"760521","🚨🚨🚨🚨🚨🚨🚨🚨🚨

Pessoal!

A questão principal (e o objetivo) urgente é termos uma *medida provisória (MP) a ser assinada pelo Presidente Bolsonaro que garanta eleições limpas, com  CÉDULAS PREVIAMENTE IMPRESSAS e CONTAGEM PÚBLICA DOS VOTOS.*

O Procurador Felipe Gimenez, do Mato Grosso do Sul, estuda este assunto há cerca de quatro anos e elaborou dois textos, inclusive com a sugestão de minuta da medida provisória. Assistam a live onde ele explica o assunto de forma clara e inequívoca: 

https://rumble.com/v1msyy0-quem-decide-o-voto-live-com-dr.-felipe-gimenez.html

*O sistema atual de urnas eletrônicas, totalmente ILEGAL uma vez que a urna conta os nossos votos (e não há possibilidade de comprovar a contagem que ela fez...), FERE O ARTIGO 37 DA CONSTITUIÇÃO FEDERAL* O voto precisa ser palpável e isso acontece por meio de *CÉDULAS físicas*,  que são a *PROVA da materialidade do nosso voto*.

*Tudo indica que a eleição de governadores, senadores e deputados da Direita foi uma armadilha bem pensada e estratégica para impedir a anulação do 1o. turno*, utilizando a *VAIDADE dos eleitos* para ajudar a validar o resultado da eleição presidencial (Lula na frente de Bolsonaro ???!!!) e garantir a ocorrência do 2o. turno, quando *a manipulação dos números acontecerá novamente*,  reconduzido o PT ao poder. E aí será o inferno na terra para os brasileiros de bem !

Várias lideranças da Direita estão estimulando que não se fale em fraude e que se busque converter os votos de indecisos,  nulos e ausentes. Isso é o mesmo que tentar encher um balde furado em várias partes com mais água...ou seja, não vai funcionar, simplesmente porque o sistema das urnas eletrônicas não é íntegro e não é auditável, além de ele mesmo contar os votos, quando esta *contagem necessariamente deve ser PÚBLICA!*

*O PR Bolsonaro PRECISA  fazer essa MP o quanto antes, que permita e GARANTA eleições limpas*, de forma que tenhamos eleições confiáveis e possamos *ter a certeza de que nosso país continue livre do comunismo e da corja  de desonestos sedentos de poder, que não terão escrúpulos em eliminar qualquer um que se oponha ao projeto de dominação e escravização dos brasileiros.*

*Medida provisória JÁ!*
*Voto impresso em células JÁ!*
*Contagem pública dos votos JÁ!*

🗳️🗳️🗳️🗳️🗳️🗳️🗳️🗳️🗳️","2022-10-08 01:52:31","2136438604.0","2022-10-08","01:52:31"
"760522","TB acho..
Igual ao sete de setembro....","2022-10-08 01:53:42","1925277640.0","2022-10-08","01:53:42"
"760524","Vacina e depois em caso de reação adversa ou qualquer problema processa o reitor.","2022-10-08 01:55:18","2132459828.0","2022-10-08","01:55:18"
"760525","""Quem manda em casa são os maridos"". Fonte: Ipec/Datafolha","2022-10-08 01:55:40","5621750840.0","2022-10-08","01:55:40"
"760527","Deep state ruindo...💣","2022-10-08 01:56:17","2097230229.0","2022-10-08","01:56:17"
"760528","Tem uma terapeuta naturopata, Flávia Molokay, será que ajudaria?","2022-10-08 01:58:41","909777319.0","2022-10-08","01:58:41"
"760529","E os aidéticos  e drogados ? podem entrar lá e ""contaminar"" os outros? A maior pandemia de todas é a de burrice e hipocrisia.","2022-10-08 01:59:55","2132459828.0","2022-10-08","01:59:55"
"760530","O canal da Flávia Molokay aqui no Telegram é Conversando com a Alma","2022-10-08 02:00:46","909777319.0","2022-10-08","02:00:46"
"760531","Bem isso.","2022-10-08 02:01:41","2132459828.0","2022-10-08","02:01:41"
"760532","https://youtu.be/ggdW_t2RFR0

Video explicando por que devemos nos preparar para a volta de Jesus Cristo.","2022-10-08 02:03:26","2044667980.0","2022-10-08","02:03:26"
"760533","https://youtu.be/ggdW_t2RFR0

Video explicando por que devemos nos preparar para a volta de Jesus Cristo.","2022-10-08 02:03:42","2044667980.0","2022-10-08","02:03:42"
"760534","É porque está escrito. Não precisa de vídeo explicando o óbvio.","2022-10-08 02:06:07","5621750840.0","2022-10-08","02:06:07"
"760535","Artigo: O custo social da gestão de rejeitos https://diretonoticias.com.br/2022/10/07/artigo-o-custo-social-da-gestao-de-rejeitos/","2022-10-08 02:07:15","1416636456.0","2022-10-08","02:07:15"
"760536","Amigo, nem todos lêem a Bíblia. Precisamos pregar o evangelho todos os dias. Obrigado pela atenção.","2022-10-08 02:08:12","2044667980.0","2022-10-08","02:08:12"
"760538","O cara que fala no vídeo leu, não entendeu e está querendo ensinar. Obrigado pela atenção.","2022-10-08 02:11:40","5621750840.0","2022-10-08","02:11:40"
"760539","psicologo serve p ajudar a vc entender sobre sua doença ,sobre o q vc ta passando ; organizar as ideias ; respeitar opnioes e fazer amizades em sessoes , pois o psiquiatra com seus remedios só servem p evitar o surto , mas pode nao ser o suficiente. qd a pessoa chora nao precisa de psicologo se ela entende td q está passando é só uma fase do processo adoecer .","2022-10-08 02:14:10","1128413618.0","2022-10-08","02:14:10"
"760540","Maravilha 👋👋👋","2022-10-08 02:15:34","1284969732.0","2022-10-08","02:15:34"
"760541","A depressão está relacionada ao hipofuncionamento bioquímico da atividade de certos neurotransmissores. 

Não fale bobagem","2022-10-08 02:16:03","5621750840.0","2022-10-08","02:16:03"
"760542","sao"" fermentos""(mediadores) diante do distress","2022-10-08 02:16:35","1128413618.0","2022-10-08","02:16:35"
"760544","Não confunda depressão conta tristeza. Observador.","2022-10-08 02:17:41","5621750840.0","2022-10-08","02:17:41"
"760546","Depressão se trata com remédio e terapia. E você não concorda com isso de acordo com sua experiência. Sugiro que escreva um artigo científico sobre seu caso e publique em uma revista para avaliação e apreciação dos pareceristas. Pode ser algo inédito.","2022-10-08 02:23:01","5621750840.0","2022-10-08","02:23:01"
"760547","Busque à Deus..Ele já nos curou ..","2022-10-08 02:23:21","1138143425.0","2022-10-08","02:23:21"
"760556","Isso eu concordo com vc, ele não voltará em carne e sim aquilo que ele plantou retornará no coração de cada um. Porém eu respeito quem pensa o contrário, posso não aceitar, mas é meu dever respeitar.","2022-10-08 02:32:03","2097230229.0","2022-10-08","02:32:03"
"760549","Até um relógio está certo duas vezes ao dia, porque você não estaria, não é?","2022-10-08 02:25:32","5621750840.0","2022-10-08","02:25:32"
"760550","Esse mundo tá difícil hora de Jesus voltar","2022-10-08 02:26:10","139118485.0","2022-10-08","02:26:10"
"760551","Eu tomo desde de 2011,","2022-10-08 02:28:04","1623201427.0","2022-10-08","02:28:04"
"760553","Sou de Vitória de santos antao Pernambuco votei no Bolsonaro  e não apareceu meu voto .😂😂😂","2022-10-08 02:31:00","1798899306.0","2022-10-08","02:31:00"
"760554","Esse remédios de depressão e ansiedade são lixos na realidade","2022-10-08 02:31:20","5229334264.0","2022-10-08","02:31:20"
"760555","Detona com o corpo","2022-10-08 02:31:33","5229334264.0","2022-10-08","02:31:33"
"760558","Com certeza isso mesmo","2022-10-08 02:32:38","5229334264.0","2022-10-08","02:32:38"
"760559","Já tomei paroxentina e Rivotril durante 6 meses","2022-10-08 02:33:16","5229334264.0","2022-10-08","02:33:16"
"760560","Pessoa fica dopada por causa do Rivotril complicado a situação","2022-10-08 02:34:01","5229334264.0","2022-10-08","02:34:01"
"760561","E depois que você acostumar com Rivotril pra para e difícil os médicos não liga","2022-10-08 02:34:43","5229334264.0","2022-10-08","02:34:43"
"760562","Parei sozinho","2022-10-08 02:34:56","5229334264.0","2022-10-08","02:34:56"
"760563","Percebi que era pior que sentir os sintomas e superar sozinho com alimentação saudável e suplementos","2022-10-08 02:35:39","5229334264.0","2022-10-08","02:35:39"
"760565","Eu não vejo a hora","2022-10-08 02:37:47","782853620.0","2022-10-08","02:37:47"
"760567","E aí galera boa noite eu sei que aqui é um grupo sério por isso estou me arriscando a perguntar isso?estou precisando de um cartão da vacina que esteja dentro do sistema conect sua tudo bem certinho alguém pode me indicar alguém seguro que possa fazer isso que não seja um preço exagerado de alto pw aqui somos pessoas simples é pq realmente estamos precisando,não sou a favor dessa vacina sei dos riscos para saúde por isso preciso do cartão e com acesso ao conect sus o app? Alguém me ajuda pfvr","2022-10-08 02:40:21","1695704827.0","2022-10-08","02:40:21"
"760568","E aí galera boa noite eu sei que aqui é um grupo sério por isso estou me arriscando a perguntar isso?estou precisando de um cartão da vacina que esteja dentro do sistema conect sua tudo bem certinho alguém pode me indicar alguém seguro que possa fazer isso que não seja um preço exagerado de alto pw aqui somos pessoas simples é pq realmente estamos precisando,não sou a favor dessa vacina sei dos riscos para saúde por isso preciso do cartão e com acesso ao conect sus o app? Alguém me ajuda pfvr","2022-10-08 02:40:37","1695704827.0","2022-10-08","02:40:37"
"760569","Eh bricandeira 10 20 anos e quando vc parar não conseguir dormir mais não kkkk demorei uma semana pra começar dormir de novo fiz desmame diminuindo em pedacinhos e usei 5htp triptofano isso mil ajudou e magnésio com 6 meses foi difícil agora imagina 20 anos pra parar 🤔","2022-10-08 02:40:41","5229334264.0","2022-10-08","02:40:41"
"760570","E aí galera boa noite eu sei que aqui é um grupo sério por isso estou me arriscando a perguntar isso?estou precisando de um cartão da vacina que esteja dentro do sistema conect sua tudo bem certinho alguém pode me indicar alguém seguro que possa fazer isso que não seja um preço exagerado de alto pw aqui somos pessoas simples é pq realmente estamos precisando,não sou a favor dessa vacina sei dos riscos para saúde por isso preciso do cartão e com acesso ao conect sus o app? Alguém me ajuda pfvr","2022-10-08 02:40:56","1695704827.0","2022-10-08","02:40:56"
"760571","E aí galera boa noite eu sei que aqui é um grupo sério por isso estou me arriscando a perguntar isso?estou precisando de um cartão da vacina que esteja dentro do sistema conect sua tudo bem certinho alguém pode me indicar alguém seguro que possa fazer isso que não seja um preço exagerado de alto pw aqui somos pessoas simples é pq realmente estamos precisando,não sou a favor dessa vacina sei dos riscos para saúde por isso preciso do cartão e com acesso ao conect sus o app? Alguém me ajuda pfvr","2022-10-08 02:41:21","1695704827.0","2022-10-08","02:41:21"
"760572","E aí galera boa noite eu sei que aqui é um grupo sério por isso estou me arriscando a perguntar isso?estou precisando de um cartão da vacina que esteja dentro do sistema conect sua tudo bem certinho alguém pode me indicar alguém seguro que possa fazer isso que não seja um preço exagerado de alto pw aqui somos pessoas simples é pq realmente estamos precisando,não sou a favor dessa vacina sei dos riscos para saúde por isso preciso do cartão e com acesso ao conect sus o app? Alguém me ajuda pfvr","2022-10-08 02:41:32","1695704827.0","2022-10-08","02:41:32"
"760573","Personagens famosos de todos os âmbitos estão se manifestando contra as vacinas assassinas, entre eles Rob Schneider, Hugh Grant, Stefan Cuvelier Fernando López-Mirones, Zaz e outros. Eles alertam sobre os danos da vacina assassina e insistem para que ninguém a tome mais.

https://www.bitchute.com/video/jp0Db7myWi9w/","2022-10-08 02:41:33","1759431814.0","2022-10-08","02:41:33"
"760575","Que eu faço com a família? Mando tomar mais vacina ou no cú?","2022-10-08 02:43:05","1529010126.0","2022-10-08","02:43:05"
"760621","Mulher....que horas vc entrou aqui?","2022-10-08 04:35:35","2097230229.0","2022-10-08","04:35:35"
"760576","E aí galera boa noite eu sei que aqui é um grupo sério por isso estou me arriscando a perguntar isso?estou precisando de um cartão da vacina que esteja dentro do sistema conect sua tudo bem certinho alguém pode me indicar alguém seguro que possa fazer isso que não seja um preço exagerado de alto pw aqui somos pessoas simples é pq realmente estamos precisando,não sou a favor dessa vacina sei dos riscos para saúde por isso preciso do cartão e com acesso ao conect sus o app? Alguém me ajuda pfvr","2022-10-08 02:43:25","1695704827.0","2022-10-08","02:43:25"
"760577","E aí galera boa noite eu sei que aqui é um grupo sério por isso estou me arriscando a perguntar isso?estou precisando de um cartão da vacina que esteja dentro do sistema conect sua tudo bem certinho alguém pode me indicar alguém seguro que possa fazer isso que não seja um preço exagerado de alto pw aqui somos pessoas simples é pq realmente estamos precisando,não sou a favor dessa vacina sei dos riscos para saúde por isso preciso do cartão e com acesso ao conect sus o app? Alguém me ajuda pfvr","2022-10-08 02:43:41","1695704827.0","2022-10-08","02:43:41"
"760578","E aí galera boa noite eu sei que aqui é um grupo sério por isso estou me arriscando a perguntar isso?estou precisando de um cartão da vacina que esteja dentro do sistema conect sua tudo bem certinho alguém pode me indicar alguém seguro que possa fazer isso que não seja um preço exagerado de alto pw aqui somos pessoas simples é pq realmente estamos precisando,não sou a favor dessa vacina sei dos riscos para saúde por isso preciso do cartão e com acesso ao conect sus o app? Alguém me ajuda pfvr","2022-10-08 02:43:52","1695704827.0","2022-10-08","02:43:52"
"760579","Verdade nessa geração acho que nem compensa mais fazer faculdades pq ninguém tem garantia nenhuma de emprego e quem não se vacinou pior ainda melhor empreender isso já ganha tempo que vai perde na faculdade trabalhador como autônomo","2022-10-08 02:45:21","5229334264.0","2022-10-08","02:45:21"
"760623","Só te vi agora","2022-10-08 04:36:01","2097230229.0","2022-10-08","04:36:01"
"760580","Te chamei no privado..","2022-10-08 02:46:12","1129077053.0","2022-10-08","02:46:12"
"760582","O único alento para a minha ansiedade em relação à provável fraude no segundo turno é que provavelmente os ""frouxos"" que votam só por obrigação (já teve absenção de 30%), não vão comparecer no segundo turno devido ao suplício que foi a demora causada pela maldita biometria que é inútil e deixou eleitores nas filas por horas! Os patriotas, de dirreita, que lutam pela sua pátria, certamente irão !!!","2022-10-08 02:48:27","228779873.0","2022-10-08","02:48:27"
"760583","https://www.youtube.com/watch?v=V3ZMOMHSVW0&ab_channel=LeandroRuschel","2022-10-08 02:51:12","413045024.0","2022-10-08","02:51:12"
"760584","Com certeza vão sim.. 👏👏","2022-10-08 02:54:37","1129077053.0","2022-10-08","02:54:37"
"760585","Os que voltam 22..","2022-10-08 02:54:51","1129077053.0","2022-10-08","02:54:51"
"760586","Eu sou um !!","2022-10-08 02:55:02","1129077053.0","2022-10-08","02:55:02"
"760587","Enquanto eles não reduzirem a quantidade desejada não vão parar com isso!","2022-10-08 02:58:14","678667599.0","2022-10-08","02:58:14"
"760588","Esperem que as forças armadas vão agir em defesa do povo kkkkkkkkkkkkkkkkkkkkkkkkkkkkkkkkkkkkkkkkkkkkkkkkkkkkkkkkkkkkkkkkkkkkkkkkkkkkkkkkkkkkkkkkkkkkkkkkkkkkkkkkkkkkkkkkkkkkkkkkkkkkkkkkkkkkkkkkkkkkkkkkkkkkkkkkkkkkkkkkkkkkkkkkkkkkkk","2022-10-08 02:59:53","1071831960.0","2022-10-08","02:59:53"
"760589","Calma gato....não fica eufórico que cai da janela....kkkkkkkkkkk","2022-10-08 03:05:02","2097230229.0","2022-10-08","03:05:02"
"760590","Estamos juntos!","2022-10-08 03:05:11","678667599.0","2022-10-08","03:05:11"
"760591","Disse tudo!","2022-10-08 03:11:20","678667599.0","2022-10-08","03:11:20"
"760592","Sem dúvida!","2022-10-08 03:17:04","1653674892.0","2022-10-08","03:17:04"
"760593","O Facebook está bloquando vários posts...não deixa compartilhar.
Simplesmente mostra a palavra ,""erro"" e quando clica em voltar o post não aparece.
Tem que entrar no perfil da pessoa e procurar o post.","2022-10-08 03:25:33","714967889.0","2022-10-08","03:25:33"
"760594","https://youtu.be/BSaU6i_tSV8","2022-10-08 03:30:16","5151454221.0","2022-10-08","03:30:16"
"760597","ESSE POVO DA ESQUERDA SÃO UNS...FDPTAS...USUFRUI DOS BENEFÍCIOS DO GOVERNO...E AINDA CHAMA O PRESIDENTE DE FASCISTA...DE TUDO QUANTO É...ISTA!","2022-10-08 03:58:13","1413687421.0","2022-10-08","03:58:13"
"760598","Senador Ron Johnson:

OS MEIOS DE COMUNICAÇÃO SÃO RESPONSÁVEIS PELAS MORTES DE CENTENAS DE MILHARES DE PESSOAS

https://www.bitchute.com/video/COx9XHSrcZ8V/","2022-10-08 03:58:41","844665190.0","2022-10-08","03:58:41"
"760599","URGENTE
O Presidente do Senado Rodrigo Pacheco acatou o projeto do ""Voto Auditável"" e foi colocado no Site do Senado para Consulta Pública, porém não está sendo Divulgado e a Esquerda está votando para parecer que o Povo Brasileiro não quer isso para continuar a Manipulação dos Resultados das Eleições. Precisamos Urgentemente mostrar a nossa vontade votando *""SIM""* e vamos desmascarar essa Farsa. 

https://www12.senado.leg.br/ecidadania/visualizacaomateria?id=132598

Obs: O Voto Impresso tá perdendo... O Placar tá 1.410.860 contra e 1.300.616 a favor da proposição do voto impresso.

VAMOS VIRAR PESSOAL !!! DIVULGUE AO MÁXIMO SE NÃO QUISER PERMITIR A MANIPULAÇÃO DE SEU VOTO NAS ELEIÇÕES (QUALQUER QUE SEJA)!!","2022-10-08 03:58:45","1547744992.0","2022-10-08","03:58:45"
"760600","https://m.facebook.com/watch/?v=496995072037159&notif_t=group_highlights&notif_id=1665201137779141&ref=m_notif&paipv=0&eav=Afbw6zHTQluBPRcK2hNxtstCLULsfh7i1FuVYh-vEHotrlRvu96w29nXlPkJ7sL4tg0","2022-10-08 04:01:50","714967889.0","2022-10-08","04:01:50"
"760601","Link acima da resposta da Brasil Paralelo.","2022-10-08 04:02:40","714967889.0","2022-10-08","04:02:40"
"760602","Ótimo esse canal.","2022-10-08 04:03:07","2097230229.0","2022-10-08","04:03:07"
"760603","Quero que vocês assistam no Instagram dessa mulher que é Brasileira que morou um tempo na Venezuela , ela conta em detalhes o que é socialismo na pele o que ela passou é chocante, por isso não voto no LULA , link abaixo👇👇👇

https://www.instagram.com/tv/Cja0bWFvK9_/?igshid=NzQ2OTdkOGI=","2022-10-08 04:15:20","950509524.0","2022-10-08","04:15:20"
"760607","https://www.bitchute.com/video/u9N2PVAhdvo2/","2022-10-08 04:21:13","5120986506.0","2022-10-08","04:21:13"
"760608","ALCYON PLÊIADES 144: ORIGEM PEDRAS PRECIOSAS-JOIAS AMALDIÇOADAS DIAM. HOPE, SANCY, KOH-I-NOOR, ORLOV","2022-10-08 04:21:26","5120986506.0","2022-10-08","04:21:26"
"760609","Falar de pedras preciosas é falar do mistério do planeta. A beleza, a cor e a luz dos cristais, quartzos, minerais, gemas, pedras preciosas como as ametistas, ágatas, esmeraldas, turmalinas, granadas, rubis, safiras, diamantes e muitas outras, assim como o ouro, a prata, o cobre... todos eles têm sua origem e uma relação direta com a Terra Oca, e foram um presente dos seres de Agharti.
Joias preciosas que foram forjadas com esforço e os elementos ao longo de milhões de anos. Minerais com grandes propriedades e vibração extraordinária que acompanharam os momentos mais importantes da história e seus personagens; elas têm sido utilizadas por diferentes culturas e povos da história para proteção, cura e remédio para a longevidade e evolução espiritual. Existem muitos talismãs que foram usados por personagens famosos da história.
Mas elas também foram cobiçadas por muitos que as roubaram ou adquiriram desonestamente. Fruto da ambição dos homens, das invasões, guerras e lutas entre povos, o domínio e a escravidão de uns sobre outros, grandes desgraças e infortúnios sobrevieram àqueles que as roubaram, sendo marcados pela dor e maldição até hoje, como foi o caso do que aconteceu com o diamante Hope, o Sancy, o Koh-i-noor, o Black Orlov, a Safira púrpura de Deli e outras gemas com as quais seus donos sofreram todo tipo de tragédias e mortes horríveis ao longo de gerações.

Vídeo realizado por Alcyon Plêiades","2022-10-08 04:21:40","5120986506.0","2022-10-08","04:21:40"
"760611","Voltou pra cavar um ban?kkkkkkkkkkk","2022-10-08 04:29:33","2097230229.0","2022-10-08","04:29:33"
"760615","Só te vi agora, que horas vc entrou?","2022-10-08 04:30:30","2097230229.0","2022-10-08","04:30:30"
"760625","Dani, que horas vc entrou?","2022-10-08 04:36:15","2097230229.0","2022-10-08","04:36:15"
"760628","Então mulher, não foi apagado nada.","2022-10-08 04:36:56","2097230229.0","2022-10-08","04:36:56"
"760631","Não estão, tá tudo aí, rola pra cima.","2022-10-08 04:37:29","2097230229.0","2022-10-08","04:37:29"
"760633","😮‍💨","2022-10-08 04:37:43","2097230229.0","2022-10-08","04:37:43"
"760637","Perdi minha irmã no início da flaudemia. Ela aspirava o alimento no esôfago se alimentava por sonda. Matatam ela com a injeção Eutanásia. Alegando que era covide19. Se nem fiseram o teste.","2022-10-08 04:39:13","1508376709.0","2022-10-08","04:39:13"
"760638","Meu irmão após a vacina morreu de choque Cardiogenico.","2022-10-08 04:39:56","1508376709.0","2022-10-08","04:39:56"
"760639","Dani Para e vai olhar, vc recebeu as boas vindas e a partir daqui tudo que vc escreveu tá aí.","2022-10-08 04:40:19","2097230229.0","2022-10-08","04:40:19"
"760641","Então não sei, mas não faz sentido umas serem apagadas e outras não.","2022-10-08 04:41:23","2097230229.0","2022-10-08","04:41:23"
"760644","Eu não tomei nem tomarei vacina de espécie nenhuma. Muito menos experimental. Desde 2011 quando vacinei pra gripe. Quase entro em óbito. Fui socorrida 3 vezes no pronto Socorro. Os médicos falaram que era reação da vacina. Falei pra os médicos. Nunca mais tomo vacina.","2022-10-08 04:43:32","1508376709.0","2022-10-08","04:43:32"
"760655","Eu tava até pensando em compartilha um vídeo com vocês porém o vídeo têm imagem fortes e talvez pôde até ter pessoas sensíveis então achei melhor não compartilhar com vocês. Basicamente o vídeo têm pessoas mortas em algum lugar hospital ou coalquer coisa corpos espalhados depois que tomaram a vacinas com os órgãos para fora ou retirados esse é o vídeo com o áudio dê uma pessoa falando sobre os planos deles tudo isso vai ser revelado nó capitólio para todo mundo ver claro Quem estiver vivos porque as pessoas vão se transformar em zumbi as quem  tomaram a vacina parece coisa dó jogo RESIDENT EVIL mais não é. Se a esquerda ganhar pôde ter certeza que esse Brasil vai virá um caos não o Brasil mais isso é internacional tipo uma PANDEMIA MUNDIAL dê zumbis.

Mais quem quiser ver o vídeo ou posso enviar nó PV","2022-10-08 05:45:13","5411816142.0","2022-10-08","05:45:13"
"760658","Eu achei q o Alexandre tinha saído tb, mas na verdade não. Ministro substituto é um cargo dentro do TSE. Não substitui o presidente.","2022-10-08 06:06:48","1368339604.0","2022-10-08","06:06:48"
"760659","Pois é ,espero que aqueles que estão reclamando disso ,que e uma ilegalidade, não tenham dado seu voto par a Lula .Se derem o voto para Lula no segundo turno preparem-se pois virão coisas muito piores por aí.Acordem ,sejam coerentes ,caso contrário assumam e não reclamem.","2022-10-08 06:07:56","1533859632.0","2022-10-08","06:07:56"
"760666","_Um auxílio para estes tempos, o Santo Rosário!_

Nossa Senhora vem em auxílio dos seus filhos que clamam por sua intercessão, junto a nossa nação!

Apresente neste Santo Rosário as graças que mais necessita, e confie na poderosa intercessão de Nossa Senhora!

Clica no link e reze conosco!

https://youtu.be/kL8ScMTKkkU","2022-10-08 07:08:41","1015956925.0","2022-10-08","07:08:41"
"760667","https://youtu.be/rXxCwQv-wRk","2022-10-08 07:09:47","1015956925.0","2022-10-08","07:09:47"
"760668","https://youtu.be/zjfunpR2Ijc","2022-10-08 07:10:21","1015956925.0","2022-10-08","07:10:21"
"760669","Acho que ela está representando. Foi no programa","2022-10-08 07:13:36","1235426919.0","2022-10-08","07:13:36"
"760670","Ela de naquele dia careca e ele pediu pra ela repetir a cena e fezde boa.","2022-10-08 07:16:43","1235426919.0","2022-10-08","07:16:43"
"760672","😤","2022-10-08 08:04:24","5282570717.0","2022-10-08","08:04:24"
"760699","https://youtu.be/F9i4uAcwbFQ","2022-10-08 10:13:16","520940536.0","2022-10-08","10:13:16"
"760674","Ninguem precisa de negativismo !

Ja era coisa nenhuma ! Voce eh louco ?

Nem aconteceu o 2o turno ainda !

Todos ja sabem que foi fraude  ...

TEM MUITOS brasileiros de olho no que esta acontecendo ...

SE voce realmente esta querendo ajudar , deve convencer a todos a votar no Bolsonaro , em massa , no 2o turno ! 

🔥","2022-10-08 08:25:39","1805321017.0","2022-10-08","08:25:39"
"760675","Atencao !!!

TODOS devem ir votar , em massa , no 2o turno !

Devemos convencer a todos a votar ! 🤠

Houve grande numero de abstencoes : mais de 30 milhoes de votos ! 😳😱

NAO acreditem em negativismo !

NAO acreditem em quem diz pra voces que ja era e que nao eh pra votar !

Isso eh tatica da esquerda e foi assim que aconteceu na Argentina , Chile , etc ...

O Brasil eh especial ! 🙂

Deus esta ao lado do Brasil ! 🙏

Vamos fazer nossa parte !","2022-10-08 08:29:23","1805321017.0","2022-10-08","08:29:23"
"760676","Pesquisa eleitoral para presidente da República em 2022. Vote ⤵


VOTA NO 22 E COMPARTILHE TA EMPATADO!!! 

https://www.creditoparacartao.com/enquete/","2022-10-08 08:35:25","694198099.0","2022-10-08","08:35:25"
"760677","Isso sim é que é manipulação.
Uma vergonha.","2022-10-08 08:43:25","1131148194.0","2022-10-08","08:43:25"
"760678","Gente o que vocês acham disso?","2022-10-08 08:45:56","5065191841.0","2022-10-08","08:45:56"
"760714","Por isso o TSE está com Toffoli","2022-10-08 10:44:08","5221103683.0","2022-10-08","10:44:08"
