"message_id","message","message_utc","from_id","date","time"
"760934","https://youtu.be/-rD3fU3cGMI

Muitas das profecias feitas pelas religiões ortodoxas estão se concretizando, assim como as previsões feitas por Nostradamus e as transmitidas por diversas culturas, como a do Peru e a da Coreia. Alguns textos proféticos foram surpreendentemente precisos em relação a acontecimentos da história chinesa, desde a dinastia Han até a dinastia Ming. 

Essas profecias nos revelam a importante verdade de que a história não é um processo por meio do qual os fatos acontecem por mera casualidade, mas um drama no qual uma sequência de grandes eventos já foi preestabelecida. No final dos tempos, que também pode ser o prenúncio de um novo ciclo histórico, todas as religiões do mundo estão aguardando o mesmo evento: a chegada do Criador no reino humano.

Todo drama tem um clímax. Embora o diabo tenha feito os seus planos para destruir a humanidade, o Todo-Poderoso Criador tem os seus meios de despertar as pessoas, ajudá-las a escaparem do cativeiro do diabo e oferecer-lhes a salvação. Hoje, no período final que precede a aparição do Criador, trava-se a batalha final entre o bem e o mal.

Religiões ortodoxas do mundo inteiro predisseram que o mundo estaria repleto de demônios, abominações e coisas nefastas na época do retorno do Criador, porque a humanidade teria perdido seus limites morais. Este é exatamente o mundo de hoje.

O estado de degeneração que enfrentamos atualmente vem sendo produzido há muito tempo. Começou há centenas de anos, com a ascensão da sua principal força motriz: o ateísmo e o uso de artimanhas para enganar a humanidade. Foi Karl Marx quem criou uma ideologia que se valeu de todo tipo de artimanha, astúcia e falsidade, e foi Vladimir Lenin quem aplicou brutalmente a teoria na prática.

Marx, no entanto, não era ateu. Ele prestou culto ao diabo e se tornou o demônio cuja missão era impedir que o ser humano reconhecesse o seu Criador no fim dos tempos.","2022-10-08 17:14:14","1459053793.0","2022-10-08","17:14:14"
"760935","Parte 2 do Documentário sobre o Comunismo ☝️","2022-10-08 17:14:43","1459053793.0","2022-10-08","17:14:43"
"760937","🇧🇷🗳 

Alvo de investigação da PF e de CPI, Ipec e Datafolha receberam R$ 37,6 milhões por pesquisas ☛ https://terrabrasilnoticias.com/2022/10/alvo-de-investigacao-da-pf-e-de-cpi-ipec-e-datafolha-receberam-r-376-milhoes-por-pesquisas/","2022-10-08 17:17:13","","2022-10-08","17:17:13"
"760938","Ótimo vídeo, parabéns! Me inscrevi, rs.","2022-10-08 17:19:17","573137927.0","2022-10-08","17:19:17"
"760939","O PT tem seus eleitores cativos sim. Muitas pessoas votam e acreditam que Lula e sua trupe foram injustiçados, como assim? Pois é, infelizmente tem pessoas comuns que não lucram com o PT no poder acreditando que ele foi um bom Presidente.","2022-10-08 17:19:20","","2022-10-08","17:19:20"
"760940","👍obrigado","2022-10-08 17:20:22","715521387.0","2022-10-08","17:20:22"
"760941","👍🤝🤝🤝","2022-10-08 17:20:52","573137927.0","2022-10-08","17:20:52"
"760942","Glaucio , eu acredito que se fosse informado em cadeia nacional , seria uma caos sem precedentes. 

Imagine a quantidade de depredações,  roubos e invasões a lojas e supermercados.   

Segue o link para quem quiser acreditar.
  https://youtu.be/hB-au_2GmyU

Pela discrepância que houve dos candidatos do presidente no senado e na Câmara,  faz todo o sentido.","2022-10-08 17:29:51","1430070679.0","2022-10-08","17:29:51"
"760943","PT - Partido do Tinhoso
Vamos horar","2022-10-08 17:29:55","1029522119.0","2022-10-08","17:29:55"
"760945","ESSE É O NOSSO PRESIDENTE ATÉ 2O26🇧🇷","2022-10-08 17:31:20","","2022-10-08","17:31:20"
"760947","https://www.youtube.com/watch?v=gf5_ABMC7QQ&ab_channel=Poder360","2022-10-08 17:31:34","413045024.0","2022-10-08","17:31:34"
"760950","https://www.abravac.info/sobre-n%C3%B3s","2022-10-08 17:32:37","911291888.0","2022-10-08","17:32:37"
"760951","🔸️O CRIADOR ACIMA DE TODAS AS COISAS
🔸️O sistema é Bruto 
🔸️Grupo contra a esquerda mundial 
🔸️Respeito em primeiro lugar 
🔸️evitem figurinhas
🔸️Proibido propaganda 
🔸️evitem link de grupos
🔸️evitem fake news
🔸️grupo com debate e interação
🔸️os mais ativos serão promovidos a administradores 
🔸️liberdade para expor suas idéias 
🔸️manerem nos áudios 👍

Finalidade de compartilhamento do conhecimento político, ESTRATÉGIA E PREPARAÇÃO!
Quem se sentir incomodado com algo ou alguma atitude de alguém , favor chamar um dos ADM","2022-10-08 17:32:42","5745869598.0","2022-10-08","17:32:42"
"760955","Que Deus tenha misericórdia de nós ✋","2022-10-08 17:36:33","5027268168.0","2022-10-08","17:36:33"
"760956","É só o começo da opressão, esquerdalha maldita..","2022-10-08 17:38:13","5027268168.0","2022-10-08","17:38:13"
"760962","Pessoas de direita? Eu diria que são pessoas sem conhecimento algum do que estão propagando.","2022-10-08 17:42:38","","2022-10-08","17:42:38"
"760965","🚨🚨🚨⚠️ Está rolando pôster de paralisação no dia 10/10

ACORDA DIREITA! Isso é tática da Esquerda infiltrado para insulfrar bagunça!

EVITEM fazer isso antes da eleição. Vai prejudicar o Pr Bolsonaro na economia! 

Esquerda quer atacar a economia!  Nada de paralisação ou broqueio.

Quer se manifestar, mudem a chamada para manifestacao!

FOCO NA MISSÃO  que PR Bolsonaro pediu! Buscar voto útil, corpo a corpo, com parentes, amigos, conhecidos e pessoas na sua cidade, falando dos feitos e combatendo as fakes da mídia. 

TEMOS QUE VIRAR + 32 MILHÕES DE ABSTENÇÕES. VAMOS MANTER O FOCO!

Atenção Admin dos grupos de direita, não devemos tolerar esse tipo de postagem

Avisem a quem está promovendo isso que é ARMADILHA DA ESQUERDA. Compartilhem!","2022-10-08 17:46:43","1717529340.0","2022-10-08","17:46:43"
"760966","1O.1O é segunda agora, ou seja, nós de direita cumprimos nossas responsabilidades durante a semana . Só pelo dia da semana já da pra saber que é coisa  da esquerda vagabunda...kkkkkkk","2022-10-08 17:48:11","","2022-10-08","17:48:11"
"760977","nao entendi","2022-10-08 18:21:17","1071831960.0","2022-10-08","18:21:17"
"760967","Penso que por mais quee precusemos de um pediatra, a decisão é nossa pois sabemos o que as pessoas que se dizem medicos edtão fazendo. Se vendendo aos laboratório","2022-10-08 17:49:04","5042430067.0","2022-10-08","17:49:04"
"760968","Vídeo de hj da Bárbara do Te Atualizei. https://youtu.be/GGLd4Sd_k5M","2022-10-08 17:54:28","","2022-10-08","17:54:28"
"760969","Postagem que está sendo espalhada é direcionada aos caminhoneiros que vão parar apartir de 00horas de domingo para segunda. Isso é tática da esquerda infiltrada. Temos que alertar os patriotas nao cairem nessa armadilha plantada.","2022-10-08 17:55:28","1717529340.0","2022-10-08","17:55:28"
"760972","https://www.youtube.com/watch?v=b-WvXbyYPZw&ab_channel=TVBrasilCentral","2022-10-08 18:12:55","413045024.0","2022-10-08","18:12:55"
"760976","Entregou nada, ele de todo o esquema..","2022-10-08 18:20:04","1129077053.0","2022-10-08","18:20:04"
"760978","Nos diga, o que ele deveria fazer?","2022-10-08 18:21:31","","2022-10-08","18:21:31"
"760979","Vamos vencer, em nome de Jesus!","2022-10-08 18:22:55","1286650133.0","2022-10-08","18:22:55"
"760980","nao sei, como ele é Presidente, e tem os acessores dele, espero que ele faça alguma coisa, que faça de tudo para que a verdade prevaleça. E que tome as medidas que a eleição q vem ahi seja justo, o que deveria ter sido igual na primeira.","2022-10-08 18:23:25","1071831960.0","2022-10-08","18:23:25"
"760985","Sugiro assistirem a última live do Dr. Jackson Martins, advogado em Natal e que já tem pr0c3ss0 no S..T..F.. por falar a verdade é que mostra claramente o que está acontecendo sobre as xUrn@as e o terror que está já acontecendo em Natal…","2022-10-08 18:25:00","1117971828.0","2022-10-08","18:25:00"
"760987","Então, apague seu comentário anterior, pois ele não faz jus ao que vc realmente espera do Bolsonaro.","2022-10-08 18:25:11","","2022-10-08","18:25:11"
"760988","Vamos manter o nível elevado?","2022-10-08 18:25:35","","2022-10-08","18:25:35"
"760990","so espero que ele faça alguma coisa e nao entregue o país","2022-10-08 18:27:07","1071831960.0","2022-10-08","18:27:07"
"760991","Não temos médicos de plantão no canal, temos membros que são da área da saúde que em certos momentos compartilham seus conhecimentos por aqui. Precisa de alguma ajuda?","2022-10-08 18:27:44","","2022-10-08","18:27:44"
"760994","Respire fundo, acompanhe as postagens e pronunciamentos dele, a resposta está aí.","2022-10-08 18:29:27","","2022-10-08","18:29:27"
"760996","VAMOS LÁ, AVISO GERAL : Todo e qualquer material postado no canal que inclui fotos, vídeos, live, links e etc., pode ser facilmente encontrado clicando no nome do grupo. Assim que clicar, aparecerá TODO CONTEÚDO COMPARTILHADO.PS: Caso não encontre aqui, faça o mesmo no Canal Médicos pela Vida.","2022-10-08 18:31:05","","2022-10-08","18:31:05"
"760997","O mesmo tempo que ela está arquivada onde te falei. Boa sorte.","2022-10-08 18:31:40","","2022-10-08","18:31:40"
"761000","Que tal iniciarmos um movimento para todos votarmos com nariz de palhaço?","2022-10-08 18:32:42","916904880.0","2022-10-08","18:32:42"
"761012","👀","2022-10-08 18:40:53","","2022-10-08","18:40:53"
"761003","Procure melhor!","2022-10-08 18:34:38","","2022-10-08","18:34:38"
"761005","Respondo a pessoa da mesma maneira que ela se dirige ao grupo.😉","2022-10-08 18:36:28","","2022-10-08","18:36:28"
"761006","Sem gracinhas ok?","2022-10-08 18:36:38","","2022-10-08","18:36:38"
"761007","https://www.youtube.com/watch?v=q8KoFaNDI8c","2022-10-08 18:37:16","413045024.0","2022-10-08","18:37:16"
"761009","Ele não cansa a de avisar, arriscou até a própria vida. 

Isso é uma missão 
Não tenho dúvidas.

https://www.instagram.com/reel/CjbP336ph63/?igshid=MDJmNzVkMjY=","2022-10-08 18:40:11","1548186496.0","2022-10-08","18:40:11"
"761016","procura medico integrativo","2022-10-08 18:42:31","1071831960.0","2022-10-08","18:42:31"
"761018","eles geralmente pensame mais corretamente, pq vao na causa e nao tratam somente os sintomas","2022-10-08 18:43:07","1071831960.0","2022-10-08","18:43:07"
"761020","oloco","2022-10-08 18:43:52","1071831960.0","2022-10-08","18:43:52"
"761021","Bom trocadilho....🤪","2022-10-08 18:44:38","","2022-10-08","18:44:38"
"761023","https://www.youtube.com/watch?v=CAznamhDmYE&ab_channel=CNNGospelTo","2022-10-08 18:45:19","413045024.0","2022-10-08","18:45:19"
"761090","Não entendi","2022-10-08 19:01:50","5240897515.0","2022-10-08","19:01:50"
"761025","Eu nao vou não, nem morto. Tinha que botar os politicos para ir na guerra","2022-10-08 18:45:36","1071831960.0","2022-10-08","18:45:36"
"761027","kkkkkkkk","2022-10-08 18:45:57","1071831960.0","2022-10-08","18:45:57"
"761029","sim kkkk","2022-10-08 18:46:22","1071831960.0","2022-10-08","18:46:22"
"761031","Talarico tb","2022-10-08 18:46:45","1071831960.0","2022-10-08","18:46:45"
"761032","So deus","2022-10-08 18:46:54","5420240992.0","2022-10-08","18:46:54"
"761045","Hoje chego a pensar que as vacinas foram criadas para nos deixar doentes e, assim, ficarmos dependentes da Ind. Farmacêutica. Foi uma forma de prender a humanidade a eles. Não e à tôa,  que é uma indústria bilionária. Eles chegaram com tudo muito bonitinho, propagandas de que vacinas salvam vidas e ainda por cima a maioria gratuitas. Pronto. A humanidade caiu. Mas não há nada oculto que um dia não venha à tona. Qq vacina é insegura e prejudicial. Basta ver o que contém nelas.","2022-10-08 18:52:14","1215386080.0","2022-10-08","18:52:14"
"761100","Exatamente, como pode? Pode pq a massa de manobra acredita piamente em pesquisas e no que a Globo fala.","2022-10-08 19:05:48","","2022-10-08","19:05:48"
"761048","Comportem-se , vou ali e já volto! 👀","2022-10-08 18:53:09","","2022-10-08","18:53:09"
"761055","Ontem a igreja católica de Quatro Marcos, vizinha de Mirassol, foi fechada pela justiça eleitoral pois as pessoas foram proibidas de fazer uma vigília de oração pelo Brasil, alegaram que a vigília podia favorecer a direita. Já começou a perseguição religiosa.","2022-10-08 18:54:42","766832754.0","2022-10-08","18:54:42"
"761064","Qual delas?","2022-10-08 18:56:42","","2022-10-08","18:56:42"
"761070","Boa tarde, alguém tem um video em que o nine fala que Bolsonaro foi o primeiro a ser chamado de mito, porém no mesmo vídeo ele chama Fidel de mito qdo era presidente","2022-10-08 18:57:25","5240897515.0","2022-10-08","18:57:25"
"761072","?","2022-10-08 18:57:39","5240897515.0","2022-10-08","18:57:39"
"761073","Preciso desse vídeo, pfvor","2022-10-08 18:57:50","5240897515.0","2022-10-08","18:57:50"
"761089","ESSA USP DEVE SER DESRATIZADA E OS NAZISTAS CREMADOS!","2022-10-08 19:01:08","1024945496.0","2022-10-08","19:01:08"
"761074","Uhmmmm, se a guerra é civil e eu sendo menina, posso ficar de boa em casa? Então to sim....kkkkkkkkk","2022-10-08 18:57:50","","2022-10-08","18:57:50"
"761075","Salva ele nas suas mensagens.","2022-10-08 18:58:29","","2022-10-08","18:58:29"
"761076","PRIVATIZAÇÃO DAS ESTATAIS, JUSTUS? ISSO SEMPRE FOI PAPO DE JUDEUS IANQUES!! E QUE GETÚLIO E OS GOVERNOS MILITARES NÃO DERAM A MÍNIMA! AINDA BEM!","2022-10-08 18:58:45","1024945496.0","2022-10-08","18:58:45"
"761079","Concordo!!!👏🏻👏🏻👏🏻👏🏻","2022-10-08 18:59:30","","2022-10-08","18:59:30"
"761084","Mas rapaz, tem a da Rússia, a da China, a do Irã....guerra hj em dia tá na moda.....kkkkkkkkkkkk","2022-10-08 19:00:03","","2022-10-08","19:00:03"
"761086","Eu estou com o coração partido, passo a vez.🤣🤣🤣🤣🤣","2022-10-08 19:00:33","","2022-10-08","19:00:33"
"761092","Não entro nessa pilha de jeito nenhum. Sou bem adestrada e sigo oq JB manda fazer, até o momento ele não deu nem um sinalzinho sequer que devemos tomar partido. Pelo contrário, ele disse dia 3 que : não é o povo que deve temer.","2022-10-08 19:02:22","","2022-10-08","19:02:22"
"761094","Militares já estao cuidando disso. 

Foco agora é na missão que Pr Bolsonaro pediu para fazer! Buscar voto util para virar os 32 milhoes de abstençãoes.

Convencer familiares, amigos, conhecidos, vizinhanças ou multirões corpo a corpo para mostrar os feitos do governo e combater as fakes da midia.

Deixem essa questão eleitoral com militares, vamos convencer todos votarem em massa. Assim, conseguiremos sobressair quaisquer tentativa de manipulação. FOCO!

Esse repeteco sobre esse assunto prejudica os indecisos, pois desestimula a ir votar.","2022-10-08 19:03:18","1717529340.0","2022-10-08","19:03:18"
"761096","https://youtu.be/TgKBYClFUjI","2022-10-08 19:04:07","731964015.0","2022-10-08","19:04:07"
"761097","🫡","2022-10-08 19:04:21","","2022-10-08","19:04:21"
"761098","Como pode?

De acordo com um levantamento feito pela CNN, Jair Bolsonaro (PL) é o candidato à Presidência da República que acumula mais seguidores nas redes sociais, com um total de 51,36 milhões — somando os perfis de Facebook, Instagram, Twitter, YouTube e TikTok. Na sequência, está Luiz Inácio Lula da Silva (PT), com 19,13 milhões de seguidores.
  
E o lurapio Nem sai já rua","2022-10-08 19:05:01","1548186496.0","2022-10-08","19:05:01"
"761101","Pois é!
Bando de alienados","2022-10-08 19:06:18","1548186496.0","2022-10-08","19:06:18"
"761102","mais ele nao tinha sofrido impechmeant ?","2022-10-08 19:06:54","1071831960.0","2022-10-08","19:06:54"
"761103","Pensar pra quê? Se a mídia já me traz tudo mastigado? O povo perece por falta de conhecimento.","2022-10-08 19:07:01","","2022-10-08","19:07:01"
"761105","Qual deles? Todos estão na mão dos senadores corruptos, tudo engavetado.","2022-10-08 19:07:27","","2022-10-08","19:07:27"
"761107","Acho q vc é infiltrado ou precisa de férias. Vá descansar, relaxe. Confie no Capitão e em Deus.

Vamos sim!! Todos!! Continuar firmes para o 2° turno.

Desistir é para os fracos...

#BolsonaroPresidente

Esta é a hora de remar! Estamos lutando por nossa liberdade. Pelas nossa vida. Vida de meus filhos e netos.
Vamos é chamar todo mundo pra votar Bolsonaro no 2° turno e nos candidatos do grupo q tiverem 2° turno tbém

Agora é a hora! Não existe um depois nesta situação!","2022-10-08 19:10:58","1002793316.0","2022-10-08","19:10:58"
"761109","Militares já estao cuidando disso. 

Foco agora é na missão que Pr Bolsonaro pediu para fazer! Buscar voto util para virar os 32 milhoes de abstençãoes.

Convencer familiares, amigos, conhecidos, vizinhanças ou multirões corpo a corpo para mostrar os feitos do governo e combater as fakes da midia.

Deixem essa questão eleitoral com militares, vamos convencer todos votarem em massa. Assim, conseguiremos sobressair quaisquer tentativa de manipulação. FOCO!

Esse repeteco sobre esse assunto prejudica os indecisos, pois desestimula a ir votar.","2022-10-08 19:11:37","1717529340.0","2022-10-08","19:11:37"
"761112","Querem um chat pra falarem ao invés de escreverem que fica mais fácil?kkkkkkkkkk","2022-10-08 19:12:30","","2022-10-08","19:12:30"
"761118","https://www.instagram.com/p/CjdYwm4NycC/?igshid=MDJmNzVkMjY=","2022-10-08 19:15:56","1478610030.0","2022-10-08","19:15:56"
"761121","OS ESTILOS DE GOVERNAR DO GRANDE LÍDER GETÚLIO VARGAS E DOS GOVERNOS MILITARES DEVEM FUNDIR-SE NO PRÓXIMO ESTILO DE GOVERNAR A PÁTRIA PORQUE NÃO HÁ OUTRA SAÍDA!!! E QUE ASSIM SEJA!","2022-10-08 19:16:50","1024945496.0","2022-10-08","19:16:50"
"761123","Diz que tem q usar pulseira de cobre","2022-10-08 19:19:34","1071831960.0","2022-10-08","19:19:34"
"761129","Capitão disse pra nós o povo aguardarmos. Que ele já sabe como resolver. Nós confiamos e seguimos a orientação. 
Fazemos nossa parte, motivamos os indecisos, tentamos convencer os esquerdistas amigos.

Ficamos calmos e civilizados. 
Confia.
Na hora certa saberemos.
Calma, prece, vá votar no 2° turno. 👍🇧🇷","2022-10-08 19:26:14","1002793316.0","2022-10-08","19:26:14"
"761130","Tenho essa mesma percepção. As pessoas parece que estão entorpecidas, com o olhar vago, frias, sem esboçar reação a nada. É deprimente. E vai piorar muito quando o 5g estiver funcionando em todo lugar. Vacinas + 5g = controle mental.","2022-10-08 19:27:04","1377422341.0","2022-10-08","19:27:04"
"761131","Kkkkkkkkkkkk","2022-10-08 19:27:31","917817467.0","2022-10-08","19:27:31"
"761132","Militares já estao cuidando disso. 

Foco agora é na missão que Pr Bolsonaro pediu para fazer! Buscar voto util para virar os 32 milhoes de abstençãoes.

Convencer familiares, amigos, conhecidos, vizinhanças ou multirões corpo a corpo para mostrar os feitos do governo e combater as fakes da midia.

Deixem essa questão eleitoral com militares, vamos convencer todos votarem em massa. Assim, conseguiremos sobressair quaisquer tentativa de manipulação. FOCO!

Esse repeteco sobre esse assunto prejudica os indecisos, pois desestimula a ir votar.","2022-10-08 19:27:34","1717529340.0","2022-10-08","19:27:34"
"761138","Tem que depositar essa raiva cobrando os mesarios e demais por nao relatar junto ao juiz eleitoral as falhas.. teve sessão  que teve mais voto para o MULA que votantes na sessão","2022-10-08 19:33:31","194379113.0","2022-10-08","19:33:31"
"761140","Quem ver irregularidade  tem que apontar","2022-10-08 19:33:55","194379113.0","2022-10-08","19:33:55"
"761182","Uau...aí sim o mundo será mais inteligente !!!","2022-10-08 19:50:54","","2022-10-08","19:50:54"
"761169","Gostaria de saber se a dra Maria Emilia foi eleita deputada federal!
Alguém sabe informar?🇧🇷🇧🇷","2022-10-08 19:44:41","1548397707.0","2022-10-08","19:44:41"
"761175","Que pena!
Sou de Vila Velha/ES, mas torci por ela!🇧🇷🇧🇷","2022-10-08 19:45:45","1548397707.0","2022-10-08","19:45:45"
"761176","Obrigada!😥😥","2022-10-08 19:46:13","1548397707.0","2022-10-08","19:46:13"
"761179","Não tomo aspirina...oq acontece?","2022-10-08 19:49:01","","2022-10-08","19:49:01"
"761181","https://twitter.com/originalismobr/status/1578801036256415744?t=z9d1hRd4rD9vbHzY4vL4qw&s=35","2022-10-08 19:50:39","1084985594.0","2022-10-08","19:50:39"
"761188","É proposital. Pessoa comum não conseguirá comprar. Começa a era dos carros por assinatura... Nem aluguel é. É a Agenda da ONU aos poucos implantada nos países. Dizem alguns estudiosos historiadores... Que tanto faz como tanto fez... Votar em um ou outro candidato... Mas... Sabemos que os candidatos apoiados por quase toda a mídia... É o preferido para implantar a agenda rapidamente... Agenda do líder do Fórum Econômico Mundial, Sr. Klaus Schwab que diz: ""Você não terá nada, e será feliz"".","2022-10-08 19:53:18","1176783906.0","2022-10-08","19:53:18"
"761190","🇧🇷📺💥💥💥💥


BRASIL: Record, Cultura e SBT sofrem ataque hacker. Não há noticiais da extensão, mas a Record teve que tirar sua programação ao vivo do ar. Segundo alguns canais especializados, os servidores das emissoras sofreram um “sequestro” e os criminosos cobram resgates milionários.","2022-10-08 19:53:21","","2022-10-08","19:53:21"
"761195","A opção afetiva de um adulto não interfere em seu caráter. Precisamos parar de julgar os homossexuais por esse esteriótipos fabricados para confundir as crianças e os jovens.","2022-10-08 19:54:41","","2022-10-08","19:54:41"
"761198","https://youtu.be/WWQZw1WMRFw","2022-10-08 19:55:20","1519363887.0","2022-10-08","19:55:20"
"761201","Foi oq eu disse, fabricam esteriótipos para deturpar o homossexualismo.","2022-10-08 19:56:22","","2022-10-08","19:56:22"
"761210","Concordo, deturpam e tem quem aplaude.","2022-10-08 19:58:23","","2022-10-08","19:58:23"
"761230","10 - (10x10) + 10 = 10 -100 +10
= 20 - 100 = -80.","2022-10-08 20:04:19","1483063230.0","2022-10-08","20:04:19"
"761232","Rosário pelo Brasil
https://rosariopelobrasil.com.br/","2022-10-08 20:04:53","1573545829.0","2022-10-08","20:04:53"
"761234","32 milhões que não foram. Esses outros 6 pelo menos foram lá né?","2022-10-08 20:05:52","1663507859.0","2022-10-08","20:05:52"
"761240","https://youtu.be/feiLNuDequA","2022-10-08 20:09:45","1225861651.0","2022-10-08","20:09:45"
"761242","URGENTE
O Presidente do Senado Rodrigo Pacheco acatou o projeto do ""Voto Auditável"" e foi colocado no Site do Senado para Consulta Pública, porém não está sendo Divulgado e a Esquerda está votando para parecer que o Povo Brasileiro não quer isso para continuar a Manipulação dos Resultados das Eleições. Precisamos Urgentemente mostrar a nossa vontade votando *""SIM""* e vamos desmascarar essa Farsa.https://www12.senado.leg.br/ecidadania/visualizacaomateria?id=132598","2022-10-08 20:10:33","1467729491.0","2022-10-08","20:10:33"
"761243","tomara que seja verdade","2022-10-08 20:11:40","1467729491.0","2022-10-08","20:11:40"
"761298","eu vi 1 video, ao que parece sim. E se for verdade mesmo, ja é noticia boa","2022-10-08 21:27:24","1071831960.0","2022-10-08","21:27:24"
"761244","Rezar às 5h da manhã tem mais eficácia do q rezar às 15h???
Me poupe, né!","2022-10-08 20:12:02","1565835222.0","2022-10-08","20:12:02"
"761245","Toda hora a oração tem eficácia.  Reze com o coração, reze conseriedade. Eleve-se para Deus","2022-10-08 20:15:18","1537633765.0","2022-10-08","20:15:18"
"761246","Não generalize.o verdadeiro Cristão é fiel e não foge a luta. Está sempre de prontidão","2022-10-08 20:16:35","1537633765.0","2022-10-08","20:16:35"
"761247","Não observei, mas pode ter lógica","2022-10-08 20:18:25","1537633765.0","2022-10-08","20:18:25"
"761248","😳Por que votar em 
🚩Lula NÃO É uma opção para os cristãos? 

Veja os principais motivos | https://www.instagram.com/p/Cjbhv9IJKn1/

https://m.youtube.com/watch?v=8iM5YSF708E","2022-10-08 20:22:23","5708168713.0","2022-10-08","20:22:23"
"761250","A soja altera os hormônios, causa CA e diabete.
Pois tem soja transgênica","2022-10-08 20:26:39","1548186496.0","2022-10-08","20:26:39"
"761257","Sim!
Gosto de pipoca e parei de consumir.","2022-10-08 20:30:53","1548186496.0","2022-10-08","20:30:53"
"761258","Não é atoa que tem só 20.000      MÉDICOS PELA VIDA no mundo.","2022-10-08 20:30:53","1766082346.0","2022-10-08","20:30:53"
"761262","Ainda não encontrei, mas vou procurar","2022-10-08 20:32:07","1548186496.0","2022-10-08","20:32:07"
"761263","Boa tarde","2022-10-08 20:32:37","5552055980.0","2022-10-08","20:32:37"
"761265","Envia pra mim no pv por gentileza.","2022-10-08 20:36:39","1558965709.0","2022-10-08","20:36:39"
"761268","Já enviei 🕵️‍♂️","2022-10-08 20:40:31","5411816142.0","2022-10-08","20:40:31"
"761271","Não ouve esse abstenções isso foi provocado pelos mesários e funcionária das regionais eleitorais os quais são da mesma quadrilha que  roubou o Voto do povo  , FF oi assim nos estados unidos e em toda América do Sul , só um idiota  com coco no celebro acredita a nestas urnas eletronicas  e se forem as mesmas seremos roubados novamente tem que haver um levante popular e rápido, e punir todos esses marginais  com a lei das ruas","2022-10-08 20:47:28","1373145817.0","2022-10-08","20:47:28"
"761272","Obrigado!","2022-10-08 20:51:47","1558965709.0","2022-10-08","20:51:47"
"761273","Sem problemas","2022-10-08 20:54:53","5411816142.0","2022-10-08","20:54:53"
"761274","O exército vai fazer a contagem dos votos nao é ?","2022-10-08 21:01:32","1071831960.0","2022-10-08","21:01:32"
