"message_id","message","message_utc","from_id","date","time"
"761110","o Alexandre","2022-10-08 19:11:54","1071831960.0","2022-10-08","19:11:54"
"761218","oloco","2022-10-08 20:00:17","1071831960.0","2022-10-08","20:00:17"
"761343","❤️","2022-10-08 22:01:52","5172890302.0","2022-10-08","22:01:52"
"761014","Ta bem atenta","2022-10-08 18:41:14","1071831960.0","2022-10-08","18:41:14"
"760369","SEXTOUUUUUU🥳 TEREMOS CHAT?","2022-10-08 00:02:45","2097230229.0","2022-10-08","00:02:45"
"760370","Fechado  com Bolsonaro...","2022-10-08 00:02:59","1582760921.0","2022-10-08","00:02:59"
"760371","Deus queira que sim 🙌🏼","2022-10-08 00:03:43","1048863568.0","2022-10-08","00:03:43"
"760372","UM AMIGO ME PERGUNTOU EM QUEM Q EU VOTEI , RESPONDI Q FOI NO BOLSONARO , ELE ME PERGUNTOU SE EU GOSTO DELE (BOLSONARO), RESPONDI Q NÃO,  QUE GOSTO É DE MIM MESMO 

GOSTO DE TER LIBERDADE 

GOSTO DE EMITIR MINHA OPINIÃO 

GOSTO DE SER CRISTÃO E TER MINHA FÉ 

GOSTO DA MINHA FAMÍLIA 

GOSTO DA VIDA

GOSTO DE IMPRENSA LIVRE 

GOSTO DE SEGURANÇA PÚBLICA ,BANDIDO PRESO 

GOSTO DE TER OPÇÃO DE ME DEFENDER

GOSTO DE BOA EDUCAÇÃO 

GOSTO DE BOA SAÚDE 

GOSTO DE ESCOLA SEM DOUTRINAÇÃO 

GOSTO QUE O IMPOSTO QUE EU PAGO SEJA INVESTIDO NO MEU PAÍS (saneamento básico, rodovias, metrôs ,escolas,hospitais,etc…) E NÃO INVESTIDO EM OUTROS PAÍSES 

GOSTO DO MEU PAÍS

CONCLUSÃO:
NÃO PRECISA GOSTAR DO PRESIDENTE 
GOSTE DE VOCÊ MESMO

SIMPLES ASSIM......","2022-10-08 00:04:00","1717529340.0","2022-10-08","00:04:00"
"760374","O pecado imperdoável é a completa rejeição da Graça de Cristo. A Graça repousa sobre toda a humanidade, estando o Eterno a conscientizar a cada um, em suas próprias consciências, suas convicções de estado de pecado, e a própria natureza testemunhando da Glória de Deus. Por isso, a condenção eterna - o estado eterno de separação eterna da alma humana de seu Criador será sem volta, pois o preço pago, foi o mais caro - o sangue do Senhor Jesus, encarnado, feito homem, em Graça, para morrer em pagamento dos pecados (rebeldia e consumação do erro, no hebraico) de toda a humanidade. Se desembarca em apenas doias lados, como em uma eleição. Um lado correto, o outro, Lago que arde com fogo e enxofre, preparado, não para os seres humanos, mas para o Diabo e seus anjos, mas infelizmente, destino eterno de quem O rejeita.","2022-10-08 00:05:30","5058957778.0","2022-10-08","00:05:30"
"760376","Perdão","2022-10-08 00:11:07","1536941531.0","2022-10-08","00:11:07"
"760379","Ola Boa noite","2022-10-08 00:17:55","5580619228.0","2022-10-08","00:17:55"
"760382","Algum médico aqui sabe me dizer se a vacina da meningite em crianças é confiável?","2022-10-08 00:18:22","5580619228.0","2022-10-08","00:18:22"
"760384","Pessoal, o que vcs acham sobre a poliomielite estar de volta no Brasil?","2022-10-08 00:20:42","917817467.0","2022-10-08","00:20:42"
"760385","Boa noite","2022-10-08 00:22:20","2097230229.0","2022-10-08","00:22:20"
"760387","Obrigada!","2022-10-08 00:22:56","917817467.0","2022-10-08","00:22:56"
"760388","Não sou médica, mas, leia o livro ""Teoria do germe"", eu particularmente em nenhuma vacina mais.","2022-10-08 00:23:05","1445184828.0","2022-10-08","00:23:05"
"760389","Vc leu sobre a vacina da poliomielite TB?","2022-10-08 00:23:41","917817467.0","2022-10-08","00:23:41"
"760390","Não confio em nenhuma","2022-10-08 00:23:42","1445184828.0","2022-10-08","00:23:42"
"760391","Praticamente, todas tem substâncias tóxicas, o autor do livro defende a imunidade natural.","2022-10-08 00:25:25","1445184828.0","2022-10-08","00:25:25"
"760392","🇧🇷🇧🇷🇧🇷🇧🇷🇧🇷🇧🇷🇧🇷😎

https://terrabrasilnoticias.com/2022/10/urgente-ex-diretor-geral-da-datafolha-diz-que-possibilidade-de-virada-de-bolsonaro-e-real/

Terra Brasil Notícias
URGENTE: Ex diretor geral da Datafolha diz que possibilidade de virada de Bolsonaro é real - Terra Brasil Notícias","2022-10-08 00:25:38","2097230229.0","2022-10-08","00:25:38"
"760393","Estou pesquisando sobre a vacina da poliomielite, mas contra é difícil encontrar,eu TB não tomo mais nada","2022-10-08 00:25:55","917817467.0","2022-10-08","00:25:55"
"760394","https://clouthub.com/p/tlNfKIw1 TERÇA LIVRE AO VIVO","2022-10-08 00:27:33","270702910.0","2022-10-08","00:27:33"
"760395","Terreno biológico das pessoas ruim. Falta de vitamina D. Desnutrição","2022-10-08 00:28:11","898404960.0","2022-10-08","00:28:11"
"760399","https://rumble.com/v1msyy0-quem-decide-o-voto-live-com-dr.-felipe-gimenez.html","2022-10-08 00:37:18","1251880676.0","2022-10-08","00:37:18"
"760400","A arte da guerra é saber a hora certa de agir. Eu confio no JB.","2022-10-08 00:37:40","2097230229.0","2022-10-08","00:37:40"
"760402","O método é o mesmo:As vacinas contra o C-19 são seguras e é enganoso afirmar que não. As urnas também são seguras e é enganoso afirmar que não.Vítimas das vacinas se tornaram invisiveis para o sistema assim como os eleitores.O transumanismo já está entre nós,ser humano é enganoso.","2022-10-08 00:38:23","1475779966.0","2022-10-08","00:38:23"
"760403","Já foi confirmada e estamos aguardando a vitória do JB dia 3O para aí sim tudo ser revelado.","2022-10-08 00:38:49","2097230229.0","2022-10-08","00:38:49"
"760404","Jesus","2022-10-08 00:38:59","1536941531.0","2022-10-08","00:38:59"
"760406","Terça Livre TV (Ao Vivo)

https://app.clouthub.com/#/videos/videos/7d81a993-5e30-4c49-8092-056772ec468c","2022-10-08 00:39:46","356198223.0","2022-10-08","00:39:46"
"760407","Verdade crua!!!","2022-10-08 00:40:08","1455913345.0","2022-10-08","00:40:08"
"760408","D I S T O P I A, seja bem vindo.","2022-10-08 00:40:10","1619113936.0","2022-10-08","00:40:10"
"760410","Bom, como não tenho bola de cristal, não sei...kkkkkkkkkk.Porém tenho olhos pra ver, ouvidos pra ouvir e cérebro pra raciocinar e sei que não terá fraude no 2 turno.","2022-10-08 00:41:49","2097230229.0","2022-10-08","00:41:49"
"760413","🔍🇮🇩🇮🇩🇮🇩🔍🇮🇩🇮🇩🇮🇩🔍

INDONÉSIA QUER SE JUNTAR AO BRICS

A Indonésia é de particular interesse por causa de sua presidência rotativa do G20, que tem grande potencial econômico e demográfico"".

Argentina e Irã se inscreveram para ingressar no BRICS, enquanto Turquia, Egito e Arábia Saudita podem ingressar no bloco ""muito em breve"".","2022-10-08 00:44:51","2097230229.0","2022-10-08","00:44:51"
"760415","https://youtu.be/8WCmSTpY-ew","2022-10-08 00:45:55","779862184.0","2022-10-08","00:45:55"
"760416","Exatamente !","2022-10-08 00:46:22","5241453173.0","2022-10-08","00:46:22"
"760417","Confie no “Grande Irmão” ?!","2022-10-08 00:46:42","1102647953.0","2022-10-08","00:46:42"
"760418","Está nos trends da Austrália a hashtag #averdadesobreasvacinasdeMRNA. O documentário: ""Segura e Eficaz: Uma segunda opinião"", traz um quadro absolutamente aterrador, segundo o documentário, do complô entre médicos e mídia para ocultar a verdade sobre o que muitos diziam se tratar de não uma vacina, mas um editor de Genes. O documentário está ainda disponível no YT: https://www.youtube.com/watch?v=dIVZ5ssWB-o","2022-10-08 00:47:04","207800359.0","2022-10-08","00:47:04"
"760420","Estou aguardando pronunciamento das forças armadas referente as urnas eletrônicas. Forças armadas com apoio da população, aliás, foi o argumento usado pelas forças armadas para poderem ter acesso a parte técnica das urnas eletrônicas e processamento dos votos.  As Forças armadas é membro dos grupos de pessoas e entidades na avaliação das urnas eletrônicas. Até o presente momento não houve nenhum pronunciamento se as urnas eletrônicas s]ao ou não seguras.","2022-10-08 00:47:20","1132115351.0","2022-10-08","00:47:20"
"760421","Está em inglês mas dá para ativar legendas automáticas em português","2022-10-08 00:47:55","207800359.0","2022-10-08","00:47:55"
"760422","Como as POLÍTICAS de bem-estar SOCIAL corrompem a FAMÍLIA? (vídeo)
https://tierrapura.org/br/2022/10/07/como-as-politicas-de-bem-estar-social-corrompem-a-familia-video/
🔔Siga TierraPura em português em: 
Odysee: https://bit.ly/3toU0oe
Telegram: http://bit.ly/2M2adh6
Safechat: http://bit.ly/2LL4ZGM
Facebook: http://bit.ly/3oXba8Y
Instagram: https://bit.ly/35U4S2i
Rumble: https://bit.ly/3zlV3GA","2022-10-08 00:48:18","1288950459.0","2022-10-08","00:48:18"
"760424","Depois do 2 turno! Foco é buscar voto a voto com familiares, amigos, colegas, vizinhos, conhecidos.

Boca a Boca! Melhor convencimento.

O Pr Bolsonaro ja disse no twitter dele. Não é o povo que tem a temer. Matenha o foco!!! Buscar voto util e ir votar em massa. Deus cuidará do resto.","2022-10-08 00:49:07","1717529340.0","2022-10-08","00:49:07"
"760425","Perfeito 👏👏👏","2022-10-08 00:49:20","1648802604.0","2022-10-08","00:49:20"
"760428","Eles não farão nada … esquece","2022-10-08 00:49:59","1102647953.0","2022-10-08","00:49:59"
"760429","Ouça o canal Pátria e Defesa … o Moisés trás boas informações para quem entende o recado.","2022-10-08 00:50:45","1102647953.0","2022-10-08","00:50:45"
"760447","Só vê quem fábrica a tranqueira","2022-10-08 00:59:47","1247928018.0","2022-10-08","00:59:47"
"760430","MINHA OPINIÃO. Para mim está bem claro que o mais importante é quem conta os votos e não quem vota. NA MINHA OPINIÃO Bolsonaro se elegeu no primeiro turno.","2022-10-08 00:50:50","1132115351.0","2022-10-08","00:50:50"
"760431","Minha opinião completamente otimista é que nao vai haver pronunciamento algum, mas que a fraude foi pega e jogada na cara dos culpados, e com isso estão impossibilitados de fazer a mesma coisa no segundo turno. Por isso, bolsonaro disse no twiter que já tem tudo que precisa para libertar o pais, e por isso devemos sim todos irmos votarem, pois se não formos e essa tese for verdadeira o outro lado irá ganhar sem a ajuda do algoritmos.","2022-10-08 00:51:12","207800359.0","2022-10-08","00:51:12"
"760432","Para embasar essa minha tese basta perceber o desespero da esquerda correndo atras se votos, coisa q nao fizeram no primeiro turno.","2022-10-08 00:52:00","207800359.0","2022-10-08","00:52:00"
"760434","Tanto que o chefe deles até fez vídeo se dizendo contra o aborto, coisa que a uma semana ele dizia o contrário.","2022-10-08 00:52:32","207800359.0","2022-10-08","00:52:32"
"760448","Só democracia, já notou?","2022-10-08 00:59:48","595256441.0","2022-10-08","00:59:48"
"760435","Pq ele faria isso se já tivesse tudo ganho para eles?","2022-10-08 00:52:58","207800359.0","2022-10-08","00:52:58"
"760436","O telefone celular é seguro?
O computador é seguro?
O banco é seguro?
Ou existe possibilidade da segurança ser ultrapassada e o aparelho ou o banco sofrer uma perda de integridade ou dados ou ativos? 
A urna não é segura, assim como nenhum sistema humano é.","2022-10-08 00:54:34","1526680350.0","2022-10-08","00:54:34"
"760437","Vamos pensar friamente, oq bolsonaro ganharia em vir a publico e mostrar ao mundo a fraude sendo que a direita foi muito bem nas eleicoes e ele ainda tem o segundo turno para vencer?","2022-10-08 00:55:14","207800359.0","2022-10-08","00:55:14"
"760438","Hoje vi o presidente nervoso, esbravejando, parecia agoniado com algo. Comecei a refletir sobre isso. Muita gente espera que ele faça algo para salvar o país, que coloque sua pele e de sua família em risco para salvar a nação. E se Bolsonaro não tiver apoio dos militares, ""perder"" as eleições, não houver reação, passar o cargo em janeiro, ser perseguido num inquérito inconstitucional e preso. O que vc que exige do presidente está disposto a fazer por ele? Será que vc merece o presidente que tem?","2022-10-08 00:55:47","595256441.0","2022-10-08","00:55:47"
"760449","Ela pediu o impeachment do PR em plena fraudemia!!!! Esquerdopata disfarçada!!!😡","2022-10-08 01:00:51","1123168183.0","2022-10-08","01:00:51"
"760439","Mas ao contrário muitos sairiam dizendo q ele estaria querendo dar um golpe e só geraria mais confusão no brasil.","2022-10-08 00:56:00","207800359.0","2022-10-08","00:56:00"
"760440","Ou seja, é melhor deixar tudo como está e ir para o segundo turno sem o tal algoritmo ligado doque arrumar uma briga dessa agora.","2022-10-08 00:56:36","207800359.0","2022-10-08","00:56:36"
"760441","Logicamente isso tudo que falei é puramente achismo otimista da minha parte, mas conclui isso com base no desespero da esquerda nessa semana.

Comecem a prestar atenção a diferença da campanha da esquerda antes do primeiro turno e agora.

Estão tão seguros que iam ganhar q até reservaram a paulista, e o presidente da Argentina até já tinha pedido autorização do espaço aéreo pra vir pra cá participar da comemoração, mas nao foi dessa vez, e depois disso perceberam q não vai ser facil.","2022-10-08 00:57:46","207800359.0","2022-10-08","00:57:46"
"760443","Especialistas: onde vivem?
Oq comem ?
Veja no globo repórter.","2022-10-08 00:59:05","1398380687.0","2022-10-08","00:59:05"
"760445","Ela faz discursos ambíguos pra confundir a opinião pública sobre de q lado ela milita! Não confio nela!!!!🤔","2022-10-08 00:59:22","1123168183.0","2022-10-08","00:59:22"
"760451","Usei o porém....faz toda a diferença.","2022-10-08 01:01:11","2097230229.0","2022-10-08","01:01:11"
"760452","Então como é já que manja de algoritmos?kkkkk","2022-10-08 01:01:48","2097230229.0","2022-10-08","01:01:48"
"760453","Sai desgraça!. Essa nação e o povo pertence a Deus. Vamos orar. Em nome de Jesus Cristo, vamos vencer essa guerra.","2022-10-08 01:03:10","2069568236.0","2022-10-08","01:03:10"
"760455","Todo mundo precisa trabalhar! Cada um escolheu pagar o preço pela decisão q tomou. O sistema não garante nada pro cidadão, de toda forma é ele quem se ferr4!!!!!🤔","2022-10-08 01:04:13","1123168183.0","2022-10-08","01:04:13"
"760456","Especialistas em eleições = petistas safados","2022-10-08 01:04:20","1522776343.0","2022-10-08","01:04:20"
"760459","Tema: Fungos de Unhas (Thomas Zahnd)

https://www.youtube.com/watch?v=yK52qOaWQ6E","2022-10-08 01:05:51","844665190.0","2022-10-08","01:05:51"
"760477",".","2022-10-08 01:21:30","917817467.0","2022-10-08","01:21:30"
"760460","Acho q o algoritmo só operou nos votos de presidente, ou específicamente em algumas regioes eleitorais como nordeste.","2022-10-08 01:05:58","207800359.0","2022-10-08","01:05:58"
"760464","Ele vai combater a doutrinação comunista nas escolas? O Foro de São Paulo? O assassinato de criança no ventre da mãe? O ensino de homossexualismo para crianças de 5 anos nas escolas? Quando é que as pessoas vão entender que não precisamos só de um bom administrador, mas de alguem que combata essas ideologias que visam destruir a família, a sociedade é a pátria?","2022-10-08 01:06:56","595256441.0","2022-10-08","01:06:56"
"760465","Sim, como eu disse, pode ter operado apenas nos estados do nordeste, tanto que a contagem de lá ficou para depois.","2022-10-08 01:07:23","207800359.0","2022-10-08","01:07:23"
"760466","Mas acho q foram enquadrados e esquece algoritmo no segundo turno.","2022-10-08 01:07:54","207800359.0","2022-10-08","01:07:54"
"760467","Em algoritmo tudo é possível. Até mesmo vários programas rodando com case switch separando por zona, e seção.","2022-10-08 01:08:50","595256441.0","2022-10-08","01:08:50"
"760468","Participei de outro grupo e depois começaram a falar que tinha sido criado por petista. Saí.
Eu penso se cada um conseguir levar informação para os seus próximos é o meio mais seguro","2022-10-08 01:08:55","5098923910.0","2022-10-08","01:08:55"
"760469","Então vai vc Glaucio2026","2022-10-08 01:09:05","875344308.0","2022-10-08","01:09:05"
"760470","Não, sou incompetente para isso, mas aprendi a selecionar gente competente. Vc nem isso.","2022-10-08 01:10:13","595256441.0","2022-10-08","01:10:13"
"760471","A ordem executiva dês 12/set/22 do bife libera experiências genéticas e transhumanismo na cara dura.","2022-10-08 01:10:27","1366588261.0","2022-10-08","01:10:27"
"760474","Que bênção de Deus 🙏","2022-10-08 01:12:34","1956790201.0","2022-10-08","01:12:34"
"760475","1° Simpósio de Direito Natural: transumanismo.
08/10/2022
Evento presencial (São Paulo) ou on-line.
Inscrições no endereço abaixo:
https://forms.gle/xkUXtipEpa9qSBRy7","2022-10-08 01:15:59","1556537019.0","2022-10-08","01:15:59"
"760476","Uhmmmmm","2022-10-08 01:18:31","2097230229.0","2022-10-08","01:18:31"
"760478","Minha familia é da bahia e posso te garantir que vc está completamente errado, nordestino é um povo honesto e trabalhador, e tanto lá quanto no sudeste existem pessoas informadas e pessoas desinformadas. Não caiam nessa historia de culpar o nordeste, pois veja araraquara que é uma das 10 maiores cidade do estado de são paulo, muito evoluida, e em araraquara o mais votado foi o barba. Então não caiam nessa historia de culpar os nordestinos que é uma grande farsa.

Existem algumas pessoas que  entram nos grupos não para unir e sim para criar separação, intrigas e ódio, e muitos petistas estão invadindo todos os grupos apenas para gerar bagunça. Peço a todos do grupo que não caiam nessas histórias e foquem no segundo turno, esqueçam a questão da fraude pois se quem confiamos nosso voto está tranquilo e confiante pq nós não deveríamos também estar?","2022-10-08 01:22:19","207800359.0","2022-10-08","01:22:19"
"760479","Ainda estão com essa marmota?","2022-10-08 01:24:57","1117559117.0","2022-10-08","01:24:57"
"760480","Com certeza, eu tbm penso assim, o STF não deixou publicar .","2022-10-08 01:28:05","1117559117.0","2022-10-08","01:28:05"
"760482","👏👏👏👏👏👏👏","2022-10-08 01:29:41","1129077053.0","2022-10-08","01:29:41"
"760483","Colaborando com o Robinson. SDe","2022-10-08 01:30:02","1132115351.0","2022-10-08","01:30:02"
"760485","Maconha medicinal? Até onde eu sei , cannabis que é o ""oleo"" extraido da folha que é medicinal.","2022-10-08 01:32:10","2097230229.0","2022-10-08","01:32:10"
"760486","Então bora fumar, Tiago 23 liberou...kkkkkkkkkkkkk","2022-10-08 01:32:29","2097230229.0","2022-10-08","01:32:29"
"760487","o povo nordestino é sim um povo Brasileiro, pessoas do bem. Como coloquei minha opinião, A eleição primeiro turno foi uma fraude e a maior fraude foi no nordeste. A esquerda precisa de conflito, precisa dividir para enfraquecer. O objetivo deles é mesmo esse, colocar o país contra o nordeste.","2022-10-08 01:32:48","1132115351.0","2022-10-08","01:32:48"
"760489","Confiou no 1 turno e deu no que deu ... Fraude escancarada e o Brasil teve que engolir.

Agora no segundo turno se a fraude continuar aí acontece igual ao Trump fica 4 anos falando q tem prova q ganhou e ninguém fez nada, só q o regaço já foi feito não tem como 'voltar' 4 anos.

Difícil acreditar na política do nosso país e do mundo ... Depois da fraudemia mundial chamada covid 19 , só se sabe que 'eles' sempre estão juntos... E o povo se lascando.","2022-10-08 01:33:13","836831288.0","2022-10-08","01:33:13"
"760490","Faz assim, pegue suas opiniões e guarde pra si, não vem aqui defender liberação de drogas ilícitas. Pergnte a mãe de um drogado oq ela acha de suas idéias.","2022-10-08 01:33:48","2097230229.0","2022-10-08","01:33:48"
"760492","VC não sabe de nada, maconha é só a porta de entrada para o crack, então não venha com esse papo mole não.","2022-10-08 01:34:30","2097230229.0","2022-10-08","01:34:30"
"760493","Eu penso e muito , por isso rebato todas as suas baboseiras.","2022-10-08 01:34:50","2097230229.0","2022-10-08","01:34:50"
"760495","Filhão, tenho 46 anos , tudo que vc fala é primário pra mim.","2022-10-08 01:35:46","2097230229.0","2022-10-08","01:35:46"
"760496","Tb quero saber0","2022-10-08 01:35:50","1022484221.0","2022-10-08","01:35:50"
"760497","Verdade!","2022-10-08 01:36:14","902958874.0","2022-10-08","01:36:14"
"760499","Repito, muitos petistas estão invadindo os grupos para tentar fazer os eleitores de bolsonaro deixarem de ir votar no segundo turno, e sempre com essa conversa de que ""nao adianta fazer nada"" e ""que está tudo perdido"", ""dificil acreditar na política"", ""estou desanimado que nem vou votar"" e bla bla bla... 

Não caiam nessa história.","2022-10-08 01:36:43","207800359.0","2022-10-08","01:36:43"
"760500","Filhão, repito, tenho 46 anos e uso meu cérebro, não é vc que vai tentar me rebaixar.","2022-10-08 01:37:17","2097230229.0","2022-10-08","01:37:17"
"760501","⚠️🚨 Inutilidade e malefícios da mamografia - Dra. Lucy Kerr ⬇️⬇️⬇️⬇️

https://youtu.be/eURk5dEiTrY","2022-10-08 01:37:36","5214665338.0","2022-10-08","01:37:36"
"760502","Também nunca vi de alguém que morreu da AIDS, mas das suas consequências.","2022-10-08 01:38:06","5621750840.0","2022-10-08","01:38:06"
"760515","Retardada, das trevas","2022-10-08 01:49:06","5294020759.0","2022-10-08","01:49:06"
"760503","😂😂😂","2022-10-08 01:40:39","1129077053.0","2022-10-08","01:40:39"
"760504","Acusar o PT de publicar fakenews pra mim é pleonasmo.","2022-10-08 01:40:42","5621750840.0","2022-10-08","01:40:42"
"760505","Maconha causa esquizofrenia.

https://youtu.be/sCRKR5tigqE","2022-10-08 01:40:44","595256441.0","2022-10-08","01:40:44"
"760506","É o que temos, infelizmente. A maioria já escolheu a estas loucuras.","2022-10-08 01:40:52","1029427066.0","2022-10-08","01:40:52"
"760507","É fake, ele disse que é medicinal, estão querendo difamar a maconha...kkkkkkkkkkkkkkkkkkk","2022-10-08 01:41:43","2097230229.0","2022-10-08","01:41:43"
"760508","Não. mas de pessoas mortas por maconheiros já vi.","2022-10-08 01:43:00","1138143425.0","2022-10-08","01:43:00"
"760509","Ou melhor, vc que não entendeu , a maconha reverte a esquizofrenia....🤣🤣🤣🤣","2022-10-08 01:43:34","2097230229.0","2022-10-08","01:43:34"
"760510","Foi plantada pelo PT, essa mac...téria aí.","2022-10-08 01:44:28","5621750840.0","2022-10-08","01:44:28"
"760512","Ou melhor, nóia roubando e matando pra comprar sua erva medicinal.","2022-10-08 01:45:15","2097230229.0","2022-10-08","01:45:15"
"760513","Se eu não soubesse que as emissoras de televisão estão envolvidas nos esquemas de corrupção tanto quanto os politicos e empresário empreiteiros eu acreditaria nessa história de urnas seguras.","2022-10-08 01:48:38","1425061326.0","2022-10-08","01:48:38"
"760514","Devria existir uma CPI dos especialistas.","2022-10-08 01:48:57","1584254299.0","2022-10-08","01:48:57"
"760516","Todos envolvidos nos envios de dinheiro para paraisos viscais. Entra presidente e sai presidente o que eles fazem e continuar entregando o país aos americanos.","2022-10-08 01:51:03","1425061326.0","2022-10-08","01:51:03"
"760517","Rouba da mãe da esposa...do adolescente..em fim..","2022-10-08 01:51:56","1138143425.0","2022-10-08","01:51:56"
"760518","Isso tudo vai acabar. Muito rapido. Vcs nem vao acreditar.","2022-10-08 01:52:00","918751391.0","2022-10-08","01:52:00"
"760519","Entregando toda a nossa riqueza e a maior riqueza é o povo!","2022-10-08 01:52:04","1425061326.0","2022-10-08","01:52:04"
"760520","🚨🚨🚨🚨🚨🚨🚨🚨🚨

Pessoal!

A questão principal (e o objetivo) urgente é termos uma *medida provisória (MP) a ser assinada pelo Presidente Bolsonaro que garanta eleições limpas, com  CÉDULAS PREVIAMENTE IMPRESSAS e CONTAGEM PÚBLICA DOS VOTOS.*

O Procurador Felipe Gimenez, do Mato Grosso do Sul, estuda este assunto há cerca de quatro anos e elaborou dois textos, inclusive com a sugestão de minuta da medida provisória. Assistam a live onde ele explica o assunto de forma clara e inequívoca: 

https://rumble.com/v1msyy0-quem-decide-o-voto-live-com-dr.-felipe-gimenez.html

*O sistema atual de urnas eletrônicas, totalmente ILEGAL uma vez que a urna conta os nossos votos (e não há possibilidade de comprovar a contagem que ela fez...), FERE O ARTIGO 37 DA CONSTITUIÇÃO FEDERAL* O voto precisa ser palpável e isso acontece por meio de *CÉDULAS físicas*,  que são a *PROVA da materialidade do nosso voto*.

*Tudo indica que a eleição de governadores, senadores e deputados da Direita foi uma armadilha bem pensada e estratégica para impedir a anulação do 1o. turno*, utilizando a *VAIDADE dos eleitos* para ajudar a validar o resultado da eleição presidencial (Lula na frente de Bolsonaro ???!!!) e garantir a ocorrência do 2o. turno, quando *a manipulação dos números acontecerá novamente*,  reconduzido o PT ao poder. E aí será o inferno na terra para os brasileiros de bem !

Várias lideranças da Direita estão estimulando que não se fale em fraude e que se busque converter os votos de indecisos,  nulos e ausentes. Isso é o mesmo que tentar encher um balde furado em várias partes com mais água...ou seja, não vai funcionar, simplesmente porque o sistema das urnas eletrônicas não é íntegro e não é auditável, além de ele mesmo contar os votos, quando esta *contagem necessariamente deve ser PÚBLICA!*

*O PR Bolsonaro PRECISA  fazer essa MP o quanto antes, que permita e GARANTA eleições limpas*, de forma que tenhamos eleições confiáveis e possamos *ter a certeza de que nosso país continue livre do comunismo e da corja  de desonestos sedentos de poder, que não terão escrúpulos em eliminar qualquer um que se oponha ao projeto de dominação e escravização dos brasileiros.*

*Medida provisória JÁ!*
*Voto impresso em células JÁ!*
*Contagem pública dos votos JÁ!*

🗳️🗳️🗳️🗳️🗳️🗳️🗳️🗳️🗳️","2022-10-08 01:52:14","2136438604.0","2022-10-08","01:52:14"
