"message_id","message","message_utc","from_id","date","time"
"4919","não","2022-10-04 17:12:31","876916700.0","2022-10-04","17:12:31"
"4970","Fato","2022-10-04 17:20:15","5661829481.0","2022-10-04","17:20:15"
"5057","Aiai kkkk","2022-10-04 21:33:05","5661829481.0","2022-10-04","21:33:05"
"4776","Galerinha","2022-10-04 02:31:40","2057501078.0","2022-10-04","02:31:40"
"4777","“só qm realmente apoia o nosso atual presidente da república vai votar no desenho 1, já qm vota no ex presidiário vai votar no 2”","2022-10-04 02:31:46","2057501078.0","2022-10-04","02:31:46"
"4779","Nanda [2057501078] enviou um 🔗 Link sem autorização. 
Ação: Banido 🚷","2022-10-04 02:32:01","5634308347.0","2022-10-04","02:32:01"
"4789","Rapaz os petistas estão desesperados mesmo","2022-10-04 15:44:33","5052742284.0","2022-10-04","15:44:33"
"4793","E vc acredita em papai Noel tbm?","2022-10-04 16:01:36","5052742284.0","2022-10-04","16:01:36"
"4805","A bandeira do Brasil, nunca será vermelha","2022-10-04 16:21:03","5661829481.0","2022-10-04","16:21:03"
"4807","O cara foi negociar","2022-10-04 16:21:26","5661829481.0","2022-10-04","16:21:26"
"4809","Igual negociou fertilizantes com a Rússia pra vocês não ficarem sem alimentos jumentos","2022-10-04 16:21:56","5661829481.0","2022-10-04","16:21:56"
"4818","Então vota no PT porra","2022-10-04 16:22:23","5661829481.0","2022-10-04","16:22:23"
"4821","Você não precisa conversar porcos a escolher pérolas 
Eles sempre irão preferir lavagem","2022-10-04 16:23:13","5661829481.0","2022-10-04","16:23:13"
"4823","Pesquisa oque ele foi fazer lá, se foi negociar ou apoiar","2022-10-04 16:23:36","5661829481.0","2022-10-04","16:23:36"
"4829","Fake news","2022-10-04 16:24:05","5661829481.0","2022-10-04","16:24:05"
"4835","E mentira mulher","2022-10-04 16:24:35","5300041184.0","2022-10-04","16:24:35"
"4837","Estão apelando","2022-10-04 16:24:40","5300041184.0","2022-10-04","16:24:40"
"4838","Manda o link da publicação no pv","2022-10-04 16:24:46","5661829481.0","2022-10-04","16:24:46"
"4843","Okkkk","2022-10-04 16:25:20","5661829481.0","2022-10-04","16:25:20"
"4844","Vou mandar um print pra vocês de um comprovante pix, e vocês me passa o dinheiro em mãos","2022-10-04 16:25:50","5661829481.0","2022-10-04","16:25:50"
"4845","Tem que pesquisar rapaziada","2022-10-04 16:25:57","5661829481.0","2022-10-04","16:25:57"
"4847","O povo manda imagem pra vocês e acreditam no que está venda
Pode ser até montagem  

Por isso eu disse pra pesquisar","2022-10-04 16:27:43","5661829481.0","2022-10-04","16:27:43"
"4849","Se ele apoia, então pq apagou?","2022-10-04 16:30:07","5661829481.0","2022-10-04","16:30:07"
"4850","desculpa nem 10s meu tempo e meu arrrasta pra cima ta caro","2022-10-04 16:30:44","876916700.0","2022-10-04","16:30:44"
"4853","Tu é cristã e vai votar no Lula então?","2022-10-04 16:32:43","5661829481.0","2022-10-04","16:32:43"
"4854","Cristão nenhum vota da boca pra fora
Pois sabem onde vai se meter
Ou seja, você não é cristã","2022-10-04 16:33:20","5661829481.0","2022-10-04","16:33:20"
"4855","22","2022-10-04 16:33:48","876916700.0","2022-10-04","16:33:48"
"4856","DEUS ACIMA DE TODOS!","2022-10-04 16:34:06","876916700.0","2022-10-04","16:34:06"
"4857","Na sua casa se você aceitar será, a do Brasil não","2022-10-04 16:34:35","5661829481.0","2022-10-04","16:34:35"
"4862","Pessoal, só temos 2 opções 
Não existe esse negócio de votar em branco","2022-10-04 16:35:57","5661829481.0","2022-10-04","16:35:57"
"4865","Não existe 3° via","2022-10-04 16:36:23","5661829481.0","2022-10-04","16:36:23"
"4866","Vota 22","2022-10-04 16:36:28","876916700.0","2022-10-04","16:36:28"
"4867","A igreja somos nós minha querida","2022-10-04 16:36:57","5661829481.0","2022-10-04","16:36:57"
"4868","tem muita fake news contra o bolsonaro devido apoiadores e força querendo tirar votos de cristãos","2022-10-04 16:37:02","876916700.0","2022-10-04","16:37:02"
"4869","exato!","2022-10-04 16:37:18","876916700.0","2022-10-04","16:37:18"
"4870","o lugar que frequentamos é o templo","2022-10-04 16:37:28","876916700.0","2022-10-04","16:37:28"
"4871","Eu sou cristão e votarei consciente 
Só Deus muda meu voto","2022-10-04 16:37:31","5661829481.0","2022-10-04","16:37:31"
"4874","@bolsomito2026 [5572025188] usado uma palavra proibida. 
Ação: Banido 🚷","2022-10-04 16:37:46","5634308347.0","2022-10-04","16:37:46"
"4875","Disse que não era cristã kkk","2022-10-04 16:37:47","5661829481.0","2022-10-04","16:37:47"
"4877","Kkk","2022-10-04 16:38:19","1781735894.0","2022-10-04","16:38:19"
"4881","Você nunca foi cristã, foi enviado pra embaralhar as mentes","2022-10-04 16:38:38","5661829481.0","2022-10-04","16:38:38"
"4883","quer matar crianças?","2022-10-04 16:38:52","5661829481.0","2022-10-04","16:38:52"
"4884","mano, cês acham msm que o biroliro se importam com vcs cristãos kkkk","2022-10-04 16:39:16","1781735894.0","2022-10-04","16:39:16"
"4885","É muito ignuidade","2022-10-04 16:39:25","1781735894.0","2022-10-04","16:39:25"
"4892","agora então vou com argumento falar isso, minha mãe recebeu o 1 primeiro paciente e enfrentou linha de frente na serra catarinense como técnica de enfermagem na UTI, viu pessoas falecerem, eu estagiei 1 ano pós pandemia e academico de fisioterapia vivi estudos de covid, e ela vota bolsonaro porque a culpa não é dele e foram supervalorizados na pandemia! não faltou materiais nas utis aqui o que falaram muitos comentários falsos que faltou coisas, tinha escasses mas era em tudo tanto que se tinha material a mais em outro hospital era super dividido pelo bem da população porque era crise de saude mundial. O medo em nossa familia era gigante quando ela falou tudo! eu sabia cada paciente que estava em estatística ela falava que via o processo de morte! enquanto tu estava em casa e eu estava em casa, o lula estava em casa ela estava cuidando do seu país e ela vota 22 tbm eu sou 22 tbm","2022-10-04 17:04:26","876916700.0","2022-10-04","17:04:26"
"4893","espero que compreenda e deixe de fanatismo","2022-10-04 17:04:43","876916700.0","2022-10-04","17:04:43"
"4894","vamos com fatos reais e sem mentiras pois quem faz o país e a economia é o proprio povo","2022-10-04 17:05:11","876916700.0","2022-10-04","17:05:11"
"4895","dúvido ela ler isso!","2022-10-04 17:06:54","876916700.0","2022-10-04","17:06:54"
"4896","Ela nao é cristã 
Lobo com pele de ovelha","2022-10-04 17:07:23","5661829481.0","2022-10-04","17:07:23"
"4897","complicado","2022-10-04 17:07:32","876916700.0","2022-10-04","17:07:32"
"4898","22 neles","2022-10-04 17:07:58","876916700.0","2022-10-04","17:07:58"
"4899","Irruuuu","2022-10-04 17:08:11","5661829481.0","2022-10-04","17:08:11"
"4902","se funcionarios da saude que viveram a pandemia de perto são 22 e não chamam bolsonaro de genocida o que tu me diz renara","2022-10-04 17:09:12","876916700.0","2022-10-04","17:09:12"
"4903","responda a pergunta","2022-10-04 17:09:21","876916700.0","2022-10-04","17:09:21"
"4904","""Não nos responsabilizamos por danos colaterais""","2022-10-04 17:09:33","5661829481.0","2022-10-04","17:09:33"
"4905","ai posso mudar meu voto pois eu sou mente aberta sou investidor","2022-10-04 17:09:39","876916700.0","2022-10-04","17:09:39"
"4906","Oque dizia na bula aí","2022-10-04 17:10:23","5661829481.0","2022-10-04","17:10:23"
"4911","eu penso em todo mundo","2022-10-04 17:11:41","876916700.0","2022-10-04","17:11:41"
"4912","tenho uma comunidade que ajudo pessoas","2022-10-04 17:11:50","876916700.0","2022-10-04","17:11:50"
"4914","a ganharem dinheiro","2022-10-04 17:11:55","876916700.0","2022-10-04","17:11:55"
"4915","o brasil tbm tem que partir de nós","2022-10-04 17:12:10","876916700.0","2022-10-04","17:12:10"
"4916","mas 22 é a melhor opção","2022-10-04 17:12:21","876916700.0","2022-10-04","17:12:21"
"4923","eu com 10 anos de idade o dinheiro era contado e pagamos o preço de eu com 13 anos trabalhando até as 2am e acordando as 5 6 am pra estudar","2022-10-04 17:13:09","876916700.0","2022-10-04","17:13:09"
"4924","e era serviço braçal","2022-10-04 17:13:26","876916700.0","2022-10-04","17:13:26"
"4925","Todos tem oportunidade","2022-10-04 17:13:31","5661829481.0","2022-10-04","17:13:31"
"4926","só correr a traz que vem a meritocracia","2022-10-04 17:13:43","876916700.0","2022-10-04","17:13:43"
"4927","ficar a fiuza de comida na mesa se não trabalhar não vem","2022-10-04 17:14:00","876916700.0","2022-10-04","17:14:00"
"4928","mais um ponto que apoio bolsoaro","2022-10-04 17:14:09","876916700.0","2022-10-04","17:14:09"
"4929","outro que comando vermelho apoia lula","2022-10-04 17:14:19","876916700.0","2022-10-04","17:14:19"
"4930","A maioria quer ter uma vida tranquila dependendo do auxílio","2022-10-04 17:14:38","5661829481.0","2022-10-04","17:14:38"
"4931","já contradiz que a milicia n~~ao tem nada haver com bolsonaro","2022-10-04 17:14:41","876916700.0","2022-10-04","17:14:41"
"4932","Para com isso gente","2022-10-04 17:14:43","5661829481.0","2022-10-04","17:14:43"
"4934","Oportunidade só vai acabar quando estiver no último suspiro","2022-10-04 17:15:03","5661829481.0","2022-10-04","17:15:03"
"4935","minha mãe ganha meio salario minimo","2022-10-04 17:15:16","876916700.0","2022-10-04","17:15:16"
"4937","eu 10 anos de idade","2022-10-04 17:15:24","876916700.0","2022-10-04","17:15:24"
"4938","Continuo dizendo, todos tem oportunidade","2022-10-04 17:15:27","5661829481.0","2022-10-04","17:15:27"
"4939","o que muda é a atitude e você fazer por merecer","2022-10-04 17:15:34","876916700.0","2022-10-04","17:15:34"
"4941","ganhava*","2022-10-04 17:15:49","876916700.0","2022-10-04","17:15:49"
"4942","concordo","2022-10-04 17:15:57","876916700.0","2022-10-04","17:15:57"
"4943","Tu poderia trocar por menos pior , pq nenhuma das duas opções presta, pô, sério, acreditar que alguns dos dois é santo é demais","2022-10-04 17:16:02","1781735894.0","2022-10-04","17:16:02"
"4944","É oque a maioria quer, receber sem trabalhar e ter vida tranquila","2022-10-04 17:16:11","5661829481.0","2022-10-04","17:16:11"
"4946","Não vão votar","2022-10-04 17:16:25","5661829481.0","2022-10-04","17:16:25"
"4947","não disse que é santo mas melhor opção espero ter lido o texto que mandei ali","2022-10-04 17:16:32","876916700.0","2022-10-04","17:16:32"
"4949","eu vivi mais que muitos aqui","2022-10-04 17:16:57","876916700.0","2022-10-04","17:16:57"
"4959","eu falei mais acima sobre fanatismo","2022-10-04 17:18:34","876916700.0","2022-10-04","17:18:34"
"4950","Eu vou só ignorar, quem entrar ou continuar vai dar no msm, apenas usam discursos antagônicos, mas no final, são iguais","2022-10-04 17:16:57","1781735894.0","2022-10-04","17:16:57"
"4952","Provas?","2022-10-04 17:17:01","5661829481.0","2022-10-04","17:17:01"
"4953","é complicado muita falácia da esquerda","2022-10-04 17:17:29","876916700.0","2022-10-04","17:17:29"
"4954","Vota no Lula","2022-10-04 17:17:35","5661829481.0","2022-10-04","17:17:35"
"4955","viram que o ratinho foi totalmente imparcial na entrevista com lula da pra ver o carater dele","2022-10-04 17:17:49","876916700.0","2022-10-04","17:17:49"
"4957","só o fato de usar o termo melhor opção, já fiz muita coisa, tem gente que se enche de orgulho e bate no peito que vota no lula ou no Bolsonaro, pqp mano, esse Brasil é foda","2022-10-04 17:18:12","1781735894.0","2022-10-04","17:18:12"
"4958","Um diz que cortou, o outro diz que foi menos da metade","2022-10-04 17:18:29","5661829481.0","2022-10-04","17:18:29"
"4960","Sites de esquerda, mídia suja","2022-10-04 17:18:41","5661829481.0","2022-10-04","17:18:41"
"4961","já condiz que é mentira dados não batem só ser um pouco racional","2022-10-04 17:18:58","876916700.0","2022-10-04","17:18:58"
"4964","O povo é engano por que não conhece a vdd","2022-10-04 17:19:29","5661829481.0","2022-10-04","17:19:29"
"4965","Kkkk","2022-10-04 17:19:35","5661829481.0","2022-10-04","17:19:35"
"4966","Falar que não é fanático não quer dizer que não seja","2022-10-04 17:19:41","1781735894.0","2022-10-04","17:19:41"
"4967","Jornalismo tem que ser serio","2022-10-04 17:19:42","5661829481.0","2022-10-04","17:19:42"
"4968","a globo é um lixo entrevistando e falta do atual presidente","2022-10-04 17:20:04","876916700.0","2022-10-04","17:20:04"
"4969","cortaram a torneira","2022-10-04 17:20:15","876916700.0","2022-10-04","17:20:15"
"4971","falta de respeito com presidente da republica","2022-10-04 17:20:29","876916700.0","2022-10-04","17:20:29"
"4972","pensam só no dinheiro deles","2022-10-04 17:20:40","876916700.0","2022-10-04","17:20:40"
"4973","porque ratinho que é independente vota no bolsonaro","2022-10-04 17:20:54","876916700.0","2022-10-04","17:20:54"
"4974","porque gustavo lima vota no bolsonaro que é independente?","2022-10-04 17:21:10","876916700.0","2022-10-04","17:21:10"
"4975","temos de analisar tudo isso","2022-10-04 17:21:18","876916700.0","2022-10-04","17:21:18"
"4976","mst é uma vergonha","2022-10-04 17:21:26","876916700.0","2022-10-04","17:21:26"
"4977","terras de propriedade privada devem ser de quem comprou","2022-10-04 17:21:48","876916700.0","2022-10-04","17:21:48"
"4978","A Globolixo é a mídia da vergonha brasileira","2022-10-04 17:22:00","5661829481.0","2022-10-04","17:22:00"
"4980","da um ralo danado pra financiar uma casa e pagar 3x sobre o valor ainda vem malucos  preguiçosos e tiram seus direitos pelo mst","2022-10-04 17:22:36","876916700.0","2022-10-04","17:22:36"
"4981","Penso que os de esquerda deveriam dar uma parte de suas terras para o mst","2022-10-04 17:22:48","5661829481.0","2022-10-04","17:22:48"
"4982","claro lá tinha a pressão","2022-10-04 17:22:49","876916700.0","2022-10-04","17:22:49"
"4985","O governo bolsonaro foi oque vai beneficiou as mulheres","2022-10-04 17:23:15","5661829481.0","2022-10-04","17:23:15"
"4987","tem uma publicação de vários projetos de lei a favor dos direitos das mulheres","2022-10-04 17:23:32","876916700.0","2022-10-04","17:23:32"
"4988","O auxílio
As posses de terras","2022-10-04 17:23:34","5661829481.0","2022-10-04","17:23:34"
"4989","o financiamento para mmulheres é mais facilitado","2022-10-04 17:23:53","876916700.0","2022-10-04","17:23:53"
"4991","Mães solteira ganharam 1200","2022-10-04 17:23:59","5661829481.0","2022-10-04","17:23:59"
"4992","emprestimos tbm","2022-10-04 17:24:01","876916700.0","2022-10-04","17:24:01"
"4993","Porque não pesquisou querida","2022-10-04 17:24:10","5661829481.0","2022-10-04","17:24:10"
"4996","isso é verdade","2022-10-04 17:24:19","876916700.0","2022-10-04","17:24:19"
"4998","na pandemia durante 3 ou 6 meses não lembro o prazo","2022-10-04 17:24:33","876916700.0","2022-10-04","17:24:33"
"5000","Kkkkk","2022-10-04 17:24:42","5661829481.0","2022-10-04","17:24:42"
"5001","Pesquisem gente","2022-10-04 17:25:09","5661829481.0","2022-10-04","17:25:09"
"5004","exato eu falei somente dados verídicos","2022-10-04 17:25:54","876916700.0","2022-10-04","17:25:54"
"5005","Cuidado com a mídia de esquerda","2022-10-04 17:26:37","5661829481.0","2022-10-04","17:26:37"
"5006","A turma do ""mas""","2022-10-04 17:26:43","5661829481.0","2022-10-04","17:26:43"
"5007","Das titulações de terra do governo bolsonaro 80% foram para as mulheres","2022-10-04 17:27:55","5661829481.0","2022-10-04","17:27:55"
"5009","apagando em 3...2...1... video me dá nojo","2022-10-04 17:47:32","876916700.0","2022-10-04","17:47:32"
"5010","renara sou batizado na igreja evangelica e sou 22 vamos juntos essa é a jogada pra dividir o país","2022-10-04 17:48:07","876916700.0","2022-10-04","17:48:07"
"5011","se mantenha firme que vai ser o melhor fé em Deus que vai dar tudo certo","2022-10-04 17:49:03","876916700.0","2022-10-04","17:49:03"
"5014","A picanha que vocês tanto falam que comiam","2022-10-04 17:59:24","5661829481.0","2022-10-04","17:59:24"
"5016","Pessoal, boa tarde. acabei de receber uma informação de um participante direto da maçonaria paulista, no qual, o informante diz que Bolsonaro está a um passo de se
tornar Furher máximo da maçonaria e entregar o Brasil nas mãos dos grandes burgueses mundo afora. Todos tem pacto com o satan. Tomem cuidado.","2022-10-04 17:59:56","1533763066.0","2022-10-04","17:59:56"
"5017","🫡🫡👏👏👏","2022-10-04 18:00:08","5029583686.0","2022-10-04","18:00:08"
"5018","Fake News","2022-10-04 18:00:39","5661829481.0","2022-10-04","18:00:39"
"5019",".","2022-10-04 18:00:45","5661829481.0","2022-10-04","18:00:45"
"5020","tem vídeo dele e tudo rodando pela Internet","2022-10-04 18:01:26","1533763066.0","2022-10-04","18:01:26"
"5021","Olha o vídeo ai","2022-10-04 18:01:54","5661829481.0","2022-10-04","18:01:54"
"5022","Isso é fake, todo mundo que nasceu na década de 90 sabe que esse negócio de Wicka é mentira pra vender brinquedo. Desde quando opinao de um desalmado desse tem lugar pra gente? Nossa campanha não precisa de gente tatuada no rosto não","2022-10-04 18:03:36","5029583686.0","2022-10-04","18:03:36"
"5023","Mas não é estranho? Visto que o Mourão é maçom e a Carla Zambelli é casada com um? Vc mesmo disse que tem muita gente das forças armadas metida com maçonaria? Isso me deixa com dúvidas","2022-10-04 18:06:02","766582723.0","2022-10-04","18:06:02"
"5029","Nada ver tio 
Cada um tem direito de fazer o que quiser da vida","2022-10-04 18:30:15","323650150.0","2022-10-04","18:30:15"
"5030","Quem conhece a Maçonaria 
Não comenta o que acontece lá 
Então tudo o que falam não foi deles que saiu","2022-10-04 18:31:33","323650150.0","2022-10-04","18:31:33"
"5031","eu comi picanha depois que larguei clt e comecei a cuidar da minha vida","2022-10-04 18:33:03","876916700.0","2022-10-04","18:33:03"
"5036","* [5528190655] enviou um 🔗 Link sem autorização. 
Ação: Banido 🚷","2022-10-04 19:15:34","5634308347.0","2022-10-04","19:15:34"
"5039","Esquerdista tem síndrome de Estocolmo. Não tem outra definição.","2022-10-04 19:52:14","1683818131.0","2022-10-04","19:52:14"
"5040","Lula envolvido até o talo com o candomblé, kimbamda, e não falam nada. 
Esquerdista é igual a mulher de malandro, gosta de apanhar e pedir mais.","2022-10-04 19:53:36","1683818131.0","2022-10-04","19:53:36"
"5043","Marlon [2056359961] enviou uma mensagem de spam. 
Ação: Banido 🚷","2022-10-04 20:30:19","5634308347.0","2022-10-04","20:30:19"
"5046","Decepção","2022-10-04 20:43:54","5764824654.0","2022-10-04","20:43:54"
"5051","mds cara para de posta fake news","2022-10-04 21:19:58","1326917603.0","2022-10-04","21:19:58"
"5053","Manda o link","2022-10-04 21:32:25","5661829481.0","2022-10-04","21:32:25"
"5054","Fake News","2022-10-04 21:32:40","5661829481.0","2022-10-04","21:32:40"
"5055","Fake News","2022-10-04 21:32:52","5661829481.0","2022-10-04","21:32:52"
"5058","Foi excluído, mas deu pra tirar print","2022-10-04 21:33:18","5661829481.0","2022-10-04","21:33:18"
"5061","Quando foi isso?","2022-10-04 21:37:03","5661829481.0","2022-10-04","21:37:03"
"5062","Pesquisaram pra ver oque foi isso aí?","2022-10-04 21:37:13","5661829481.0","2022-10-04","21:37:13"
"5063","Sem dúvidas não, vocês são petistas e estão espalhando fake News 

A esquerda sendo esquerda","2022-10-04 21:37:43","5661829481.0","2022-10-04","21:37:43"
"5065","Antunes [68798554] enviou um 🔗 Link sem autorização. 
Ação: Banido 🚷","2022-10-04 21:39:57","5634308347.0","2022-10-04","21:39:57"
"5067","Primeiro que eu não sou seu amigo

E em segundo, você não está se mostrando ser patriota camarada","2022-10-04 21:40:55","5661829481.0","2022-10-04","21:40:55"
"5069","Viiii
Agora vi coisa","2022-10-04 21:41:53","5661829481.0","2022-10-04","21:41:53"
"5070","Henrique, por gentileza. *Faça a moderação do nosso chat*.
Estou no chat Bolsonaro 22 desde o início, sou militante desde o PEN e sua conversão para PATRIOTA. Saí da sigla e hoje estou acompanhando as reuniões do PTB e nosso guerreiro Roberto Jeferson.
Não podemos cair nas falácias da esquerda","2022-10-04 22:33:05","5029583686.0","2022-10-04","22:33:05"
"5071","Daqui a pouco vão começar a postar foto de Falha de São Paulo, Globolixo e outras da imprensa suja","2022-10-04 22:33:30","5029583686.0","2022-10-04","22:33:30"
"5072","esquece isso ele é cristão","2022-10-04 22:54:02","876916700.0","2022-10-04","22:54:02"
"5073","fake! olhem o numero de curtidas ali! se fosse no perfil oficial seriam milhares","2022-10-04 22:54:53","876916700.0","2022-10-04","22:54:53"
"5074","vá ver as fontes 2 informação sem fonte! que você posta","2022-10-04 22:56:06","876916700.0","2022-10-04","22:56:06"
"5075","fora que publicação excluída não iria aparecer para tirar print escrito excluída","2022-10-04 22:58:11","876916700.0","2022-10-04","22:58:11"
"5077","montagem na cara dura segundo especialista em designer","2022-10-04 22:58:46","876916700.0","2022-10-04","22:58:46"
"5079","não! veja vídeos completos e não cortados zap zap tem muita falácia veja 2 ou mais fontes confiaveis! bolsonaro presidente ihuuu","2022-10-04 22:59:38","876916700.0","2022-10-04","22:59:38"
"5081","Meus votos","2022-10-04 23:00:05","876916700.0","2022-10-04","23:00:05"
"5083","22","2022-10-04 23:00:07","876916700.0","2022-10-04","23:00:07"
"5084","22123","2022-10-04 23:00:19","876916700.0","2022-10-04","23:00:19"
"5085","222","2022-10-04 23:00:23","876916700.0","2022-10-04","23:00:23"
"5086","22","2022-10-04 23:00:29","876916700.0","2022-10-04","23:00:29"
"5088","2222","2022-10-04 23:00:33","876916700.0","2022-10-04","23:00:33"
"5090","tenho uma live com investidores agora fuui","2022-10-04 23:01:16","876916700.0","2022-10-04","23:01:16"
"5091","90% dos investidores são 22","2022-10-04 23:01:31","876916700.0","2022-10-04","23:01:31"
"5093","porque será que as pessoas que mais entendem de economia votam no bolsonaro?","2022-10-04 23:02:01","876916700.0","2022-10-04","23:02:01"
"5094","tu é da esquerda infiltrada sai sai aqui é do MITO!","2022-10-04 23:02:39","876916700.0","2022-10-04","23:02:39"
"5095","conhecimento liberta","2022-10-04 23:03:06","876916700.0","2022-10-04","23:03:06"
"5096","beijo no coração e muita paz","2022-10-04 23:03:16","876916700.0","2022-10-04","23:03:16"
"5098","Patriotas, eu tenho um pedido á todos vocês, peço a vocês por favor, ao invés de votar, orem, a fraude já está feita, oq nos resta agora é orar para as urnas travaram e assim termos voto impresso","2022-10-04 23:48:56","5726828050.0","2022-10-04","23:48:56"
"5099","Já montei uma corrente de oração para o segundo turno","2022-10-04 23:49:06","5726828050.0","2022-10-04","23:49:06"
