"message_id","message","message_utc","from_id","date","time"
"3967","XRP, Cardano, Dogecoin e Polygon podem colapsar, afirma Jim Cramer

O apresentador da CNBC Jim Cramer acredita que os investidores de criptoativos deveriam se desfazer imediatamente de suas posições antes que os preços caiam ainda mais. 

A personalidade de televisão afirma que os investidores ainda têm tempo de vender suas participações e não devem se deixar enganar pelos valores do…

https://gazetalibertaria.news/xrp-cardano-dogecoin-e-polygon-podem-colapsar-afirma-jim-cramer/","2022-12-07 23:59:10","572665388","2022-12-07","23:59:10"
"3966","Como a desobediência civil fez a ditadura sanitária recuar na China

As duras restrições sanitárias impostas pela China para combater a covid finalmente começarem a recuar. Depois de vários protestos que vinham implodindo pelo país, o governo chinês percebeu que o controle tirânico que estava impondo já não podia mais ser sustentado. Isso mostra a importância e eficácia ds desobediência civil…

https://gazetalibertaria.news/como-a-desobediencia-civil-fez-a-ditadura-sanitaria-recuar-na-china/","2022-12-07 00:28:05","572665388","2022-12-07","00:28:05"
