"message_id","message","message_utc","from_id","date","time"
"2619","Não podemos dar poder para ele","2022-12-15 19:11:02","1819027269.0","2022-12-15","19:11:02"
"2621","Valdemar manda um recado.","2022-12-15 19:14:10","5362271992.0","2022-12-15","19:14:10"
"2626","Ele é Narcisista e Prepotentes pessoal ficam dando ibope para ele","2022-12-15 19:25:45","1819027269.0","2022-12-15","19:25:45"
"2627","O ego dele se alimenta do nosso medo","2022-12-15 19:25:45","1819027269.0","2022-12-15","19:25:45"
"2628","Medo do quê","2022-12-15 19:25:45","1819027269.0","2022-12-15","19:25:45"
"2629","Começam a chamar ele de palhaço quero ver aonde vai o lado Narcisista dele","2022-12-15 19:25:45","1819027269.0","2022-12-15","19:25:45"
"2644","Por isso, vivemos numa sociedade cujos valores são invertidos. Esse é o motivo pelo qual dizemos: : "" antigamente, era tudo diferente. ""","2022-12-15 19:40:12","1884964595.0","2022-12-15","19:40:12"
"2630","Em todos os grupos está cheio de infiltrados dele","2022-12-15 19:25:45","1819027269.0","2022-12-15","19:25:45"
"2631","Menos ibope pessoal","2022-12-15 19:25:45","1819027269.0","2022-12-15","19:25:45"
"2632","Coloquem para fazermos cadastro familiar","2022-12-15 19:25:45","1819027269.0","2022-12-15","19:25:45"
"2633","Vai todo mundo preso","2022-12-15 19:25:45","1819027269.0","2022-12-15","19:25:45"
"2634","Passaremos o Natal ajudando o Natal Solidário do XANDÃO","2022-12-15 19:25:45","1819027269.0","2022-12-15","19:25:45"
"2635","PALHAÇO SE TRATA ASSIM","2022-12-15 19:25:45","1819027269.0","2022-12-15","19:25:45"
"2646","🚨ALERTEM, AVISEM TODOS DO AGRO, DOS PRODUTORES FAMILIARES, GRANDED EXPORTADORES, AGRICULTURA, PECUARIA, CRIADORES CAVALOS,     VAMOS TODOS FRENTES  DOS QUARTÉIS ATE NOSSA VITORIA!!! INTERVENÇÃO MILITAR COM BOLSONARO NO PODER!!!!🚨🇧🇷🚜🇧🇷🚛🇧🇷🪳🐔🐴🐖🐑🦮🐓🐇🌴🌱🌷🌾🚌🚜🚍🚤","2022-12-15 19:44:52","2071611904.0","2022-12-15","19:44:52"
"2642","NM","2022-12-15 19:36:45","1884964595.0","2022-12-15","19:36:45"
"2643","ATENÇÃO PATRIOTAS 

É DE SUMA IMPORTÂNCIA QUE TODOS ASSISTAM A ESSE VÍDEO PARA ENTENDEREM COM CLAREZA O QUE REALMENTE ESTAMOS ENFRENTANDO. 

👁","2022-12-15 19:36:45","1884964595.0","2022-12-15","19:36:45"
"2648","Pra mim é simples assim","2022-12-15 20:11:40","1819027269.0","2022-12-15","20:11:40"
"2651","Gente observa perto da sobrancelha direito o verdadeiro tem uma verruga e está foto não tem","2022-12-15 20:47:10","5718572739.0","2022-12-15","20:47:10"
"2652","Acabei de mandar para a polícia Federal","2022-12-15 21:00:07","1819027269.0","2022-12-15","21:00:07"
"2653","🚨🚨🚨🚨ATENÇÃO ISSO PRECISA SER REPASSADO🚨🚨🚨🚨
Raciocinem comigo: porque Cabeça de Ovo adiantou somente a diplomação do Mula??? Primeiro disseram que é porque ele está doente e estavam com medo de ele morrer, mas na diplomação o Mula não aparentou nem um pouco mal de saúde, com medo e cansado sim mas saúde um tanto quanto normal... é visível q ele aguentaria ate dia 19, não foi por esse motivo então....  

Também disseram que seria por medo de algo acontecer e não conseguirem diplomar o bandido no entanto já ficou claro para todos que a diplomação não é tão importante assim, pode ser anulada e enfim... adiantar a diplomação do dia 19 para o dia 12 não zera nenhum risco do ladrão não subir a rampa... continua correndo alto risco de não subir a rampa...

Então porque então adiantar em uma semana SOMENTE A DIPLOMAÇÃO DO LADRÃO e não dos demais cargos eleitos Governadores, Senadores e Deputados Federais????
Hora, *PORQUE O CABEÇA DE OVO ESTA USANDO OS DEMAIS CARGOS COMO ESCUDO*... 
Vamos Explicar o JOGO DE XADRES... Cabeça de Ovo sabe que a diplomação consuma seu crime e sabe o alto risco de ser preso imediatamente ou no dia seguinte da diplomação... por isso ele diplomou somente o Mula, na tentativa de fazer “Bolsonaro se precipitar”, pois se o cabeça de ovo for preso entre os dias 13 e 18 quem irá diplomar os demais cargos???? 
Imagina se prendem o O CABEÇA DE OVO hoje... quem vai diplomar os demais cargos eleitos no dia 19???? vai virar uma bagunça e o PR Jair Bolsonaro ficaria muito exposto a revolta de toda classe politica eleita nessa situação..... você quer TODA CLASSE POLÍTICA SE OPONDO A BOLSONARO NUMA EMINÊNCIA DE GUERRA??? SE VOCÊ QUER ISSO VC NÃO É PATRIOTA, VOCÊ QUER ELE TRAÍDO E MORTO EM MENOS DE 1 MÊS... VÃO DIZER QUE ELE TROUXE O CAOS, E QUE ELE TROUXE A GUERRA PARA A NAÇÃO E AÍ???? COMO RESOLVE ISSO??? PENSA POVO... PENSA....
Imaginou a bagunça e a revolta dos outros políticos contra Bolsonaro??? A mais apoio não importa.. APOIO IMPORTA SIM MEU CARO, BOTE A MÃO NA CONSCIÊNCIA, QUALQUER COISA QUE FOR FEITA PRECISA SER CIRÚRGICA E CONTAR COM APOIO POR SER FEITO... BOLSONARO DEMONSTRA TOTAL RESPEITO A TODA CLASSE POLÍTICA AO SER PACIENTE E AGUARDAR SEREM DIPLOMADOS PARA DEPOIS AGIR NÃO SENDO ASSIM EGOÍSTA E BAGUNÇANDO TODA ESTRUTURA DOS PODERES CAUSANDO MAIS BAGUNÇA AINDA...
*Cabeça de ovo antecipou a diplomação somente do lula como quem usa de escudo todos os politicos demais eleitos para se proteger*... ontem ele demonstrou isso prendendo serere e tentando fazer pressão para que Bolsonaro se precipite, aja e se exponha a ser refutado por todos os demais políticos... vamos raciocinar povo...
E TAMBÉM, Cabeça de ovo adiantou a diplomação do Mula justamente para gerar essa pressão da população em cima do Bolsonaro *PARA ELE SE PRECIPITAR*.... raciocinem.. se o bolsonaro fizer algo cai por terra não somente ele mas todos os outros cargos eleitos e isso iria gerar uma revolta de muitos da classe politica pra com ele... *XADRES É UM JOGO DE PACIÊNCIA* 
Enfim... olhando como analista.... Ele vai agir mas somente depois de diplomados também os governadores senadores e deputados eleitos... assim ele isola as consequencias das prisões dos bandidos somente para somente a chapa da presidência... depois da diplomação dos demais cargos Prisão de Mula, Picolé de chuchu, cabeça de ovo e demais filhos do capeta não trará nenhuma revolta sobre o Presidente... 

Repassem e olho no STM (Superior Tribunal Militar), há 2 processos rodando, só esperando o tempo certo:

Nº do Processo: 7000839-44.2022.7.00.0000
Nº do Processo: 7000861-05.2022.7.00.0000

*”NÃO PARAR, NÃO PRECIPITAR e NÃO RETROCEDER”*","2022-12-15 21:05:11","5741847737.0","2022-12-15","21:05:11"
"2656","Verdade sim","2022-12-15 21:17:02","1819027269.0","2022-12-15","21:17:02"
"2657","Se todo mundo fizer isso é metade do povo brasileiro nas prisões. Seremos custeados com a arrecadação tributos pagos pelos Petistas.","2022-12-15 21:17:56","1819027269.0","2022-12-15","21:17:56"
"2658","Pronto","2022-12-15 21:17:59","1819027269.0","2022-12-15","21:17:59"
"2659","Quero ver sobrar dinheiro para bancar 4 países","2022-12-15 21:18:13","1819027269.0","2022-12-15","21:18:13"
"2660","Pessoal não teremos mais dívidas","2022-12-15 21:18:24","1819027269.0","2022-12-15","21:18:24"
"2661","Alguém terá que jos bancar e será o Estado.","2022-12-15 21:18:55","1819027269.0","2022-12-15","21:18:55"
"2663","Sério q esse é o assunto ? Essa é a ideia ? Digam q estão zuando e q é retórico pfv kkk","2022-12-15 21:23:33","1839178644.0","2022-12-15","21:23:33"
"2664","⚡⚡⚡⚡⚡🆘🆘🆘

Atenção admins

A partir de agora está proibido falar com qualquer um no PV

Ordem do Alto Comando🇧🇷🇧🇷🇧🇷

Isto é para suas seguranças pessoais e familiar

Continuem as batalhas nos grupos!


Mais jamais repassem dados de vocês, endereços etc... A ninguém!

Se tua mãe te chamar no PV, não confie ligue para ela em linha fixa e confirme. Os hackers Infiltrados irão de enganar se tu na vigiar.

Contagem regressiva

🇧🇷🇧🇷🇧🇷","2022-12-15 21:24:55","5638551242.0","2022-12-15","21:24:55"
"2665","🇧🇷GRUPO PATRIOTAS CABO FRIO E REGIÃO 🇧🇷 https://t.me/+aFK5PjkRj6dhZDkx","2022-12-15 21:26:47","1470297524.0","2022-12-15","21:26:47"
"2666","Reta final estamos na fase 3 indo pra 4 e a 4 finaliza tudo INT n vamos cair no último momento, vamos vigiar e orar ! E vamos entregar nossa ansiedade e desespero nas mãos do todo PODEROSO pois ele sabe oq acontecerá","2022-12-15 21:26:59","1839178644.0","2022-12-15","21:26:59"
"2667","https://www.instagram.com/reel/CmLGVwugvJk/?igshid=NTFlZDUzZmM=","2022-12-15 21:29:14","5554412231.0","2022-12-15","21:29:14"
"2668","Tá dando certo kkkkkk falta 700 dias pra criar coragem","2022-12-15 21:30:17","239999807.0","2022-12-15","21:30:17"
"2673","Um cara e do outro lado o poder executivo com as forças","2022-12-15 21:34:49","239999807.0","2022-12-15","21:34:49"
"2674","Da ideia n pq tem muita gente de direita que n pensa e vai fzr isso kkkkkk gente parem de dar bola pra mídia plmrds PAREM de dar bola pras mídias pq qnt mais oxigênio dão mais o fogo aumenta SIMPLES","2022-12-15 21:35:35","1839178644.0","2022-12-15","21:35:35"
"2712","Concordo
 F u z i l a m e n t o","2022-12-15 22:33:34","5629543497.0","2022-12-15","22:33:34"
"2678","Vao no yt e escutem o resumo do livro ""a arte da guerra"" e veram q esse momento de AGR está lá como estratégias de derrotar o inimigo, INT lembre-se q até o Trump elogiou Bolsonaro pelo ótimo estrategista que ele é, INT até ele cair e as FFAA n agir ainda temos esperança e como disse aquele senhorzinho simpático no Qg TODA esperança!","2022-12-15 21:38:25","1839178644.0","2022-12-15","21:38:25"
"2679","Com certeza merecem fuzilamento em praça pública, pois colocam um país em risco","2022-12-15 21:38:46","1111747315.0","2022-12-15","21:38:46"
"2680","Beleza vou lá ver","2022-12-15 21:39:06","239999807.0","2022-12-15","21:39:06"
"2681","Segundo a constituição do supremo eles merecem uma medalha e cargos","2022-12-15 21:40:06","239999807.0","2022-12-15","21:40:06"
"2696","olha ae modus operantis criminoso da esquerda","2022-12-15 22:03:55","","2022-12-15","22:03:55"
"2684","Tá errado isso tão te enganando

Isso é desinformação

Te pergunto porque é golpe?

Mas vou te responder!

Só é golpe militar quando os militares tentam tomar o poder porque querem....

Se o povo amparado pelo artigo 1 pede a intervenção militar com Bolsonaro não é golpe nem com ele nem sem ele

Porque o povo tá pedindo...","2022-12-15 21:52:54","","2022-12-15","21:52:54"
"2686","Tic tac tic tac 🛑 todo cuidado é pouco !!! Isso é guerra e vence essa porra quem se prepara 🚨","2022-12-15 21:56:32","1839178644.0","2022-12-15","21:56:32"
"2687","https://youtu.be/qQgvUXtiiUQ","2022-12-15 21:56:44","1163168792.0","2022-12-15","21:56:44"
"2688","https://youtu.be/HCVNU-GR95U","2022-12-15 21:56:47","1163168792.0","2022-12-15","21:56:47"
"2689","Mas e se as ffaa fizer uma limpeza e depois entregar o governo pro executivo já q é o único poder q estar funcionando, ñ seria melhor?","2022-12-15 21:57:55","1163168792.0","2022-12-15","21:57:55"
"2690","Daí Bolsonaro poderia governar tranquilo já q ñ teria a esquerda pra atrapalhar","2022-12-15 21:58:25","1163168792.0","2022-12-15","21:58:25"
"2692","Se os militares apenas assumirem... Não terá executivo nenhum.... Militares que comandarão...","2022-12-15 21:59:04","","2022-12-15","21:59:04"
"2693","Mas depois eles vão entregar o poder ,no caso pro executivo/Bolsonaro","2022-12-15 21:59:39","1163168792.0","2022-12-15","21:59:39"
"2694","Se as coisas continuarem como estão, a esquerda continuar no poder,vai ser questão de tempo até prenderem o Bolsonaro.","2022-12-15 22:00:24","1163168792.0","2022-12-15","22:00:24"
"2695","Não....

É recriado o Estado

Nova constituição
Novas leis
Novo tudo","2022-12-15 22:00:27","","2022-12-15","22:00:27"
"2709","Se for prender tds que o amam, não vai sobrar ninguém.","2022-12-15 22:31:24","5629543497.0","2022-12-15","22:31:24"
"2698","Mas essa pra vê se o povo aprende a ficar na QG apenas","2022-12-15 22:04:27","","2022-12-15","22:04:27"
"2699","Só parte da constituição q vai  ser suspensa. 
Depois da limpeza, as ffaa entrega o poder pro Bolsonaro, Bolsonaro convoca novas eleições, e Com certeza será eleito.","2022-12-15 22:04:46","1163168792.0","2022-12-15","22:04:46"
"2700","Já te falei.... É recriado o Estado... 
Só entra Bolsonaro se o povo pedir na intervenção pra ele ficar...

Se for só intervenção militar

Vai ser como em 64...

Eu confioas no Bolsonaro que em certos generais","2022-12-15 22:06:26","","2022-12-15","22:06:26"
"2702","Gideão 15/12

1. Militares e seus deveres.
2. As FFAA tem culpa por não ter combatido as mentiras da esquerda?  Não.  
3. Tipos de Intervenção Militar .

Continua no áudio 02","2022-12-15 22:10:53","1610165191.0","2022-12-15","22:10:53"
"2710","O TRE-SP retotalizou PELA 3ª VEZ o resultado das Eleições 2022 p/ dep. estadual. Com a NOVA CONTAGEM DE VOTOS, Antônio Dirceu Dalben foi eleito, e Edson Giriboni perdeu a vaga. É isso mesmo que você leu: o TSE MUDOU O RESULTADO em SP, mas não se pode falar nisso a nível Federal.","2022-12-15 22:31:49","","2022-12-15","22:31:49"
"2703","Gideão áudio 02 - 15/12
Continuação...

4. Decretos. 

Ouça também o áudio 01","2022-12-15 22:10:54","1610165191.0","2022-12-15","22:10:54"
"2704","Tudo sob controle","2022-12-15 22:17:53","5629543497.0","2022-12-15","22:17:53"
"2705","🇧🇷💪🇧🇷🧐🇧🇷
VENCEREMOS ❗️❗️❗️
@GeFazioBreakingNews🇧🇷","2022-12-15 22:23:05","1610165191.0","2022-12-15","22:23:05"
"2706","Nós temos que EXIGIR das FFAA a intervenção militar. Deixando clara a manutenção do Bolsonaro no poder e que seja dissolvida a câmara, o senado e o STF.
Se Bolsonaro está aguardando a diplomação dos novos deputados, senadores e governadores para isso, não entendo qual é a estratégia dele.","2022-12-15 22:26:17","5741847737.0","2022-12-15","22:26:17"
"2707","Quem é o personagem ?","2022-12-15 22:28:33","5629543497.0","2022-12-15","22:28:33"
"2708","Eu não contribuo. Pra Ele, não. Não mesmo.","2022-12-15 22:30:08","5629543497.0","2022-12-15","22:30:08"
"2719","Medalha que penetra peito adentro é cilíndrica e compridinha","2022-12-15 22:40:43","5629543497.0","2022-12-15","22:40:43"
"2720","O caminhão foi o da mudança da Dilma
A notícia da Laurinha é antiga","2022-12-15 22:41:06","2071611904.0","2022-12-15","22:41:06"
"2721","Não se iludam com NENHUMA notícia que seja negativa, que te deixe com medo ou informações que tirem sua confiança nas FFAA e no Capitão Bolsonaro _ 99% delas são FALSAS quando não são criminosas, este é UM dos motivos que estou aqui em Brasília: Pra desmascarar fake News e infiltrados em TEMPO REAL junto com vocês! 🫡","2022-12-15 22:41:54","5796901579.0","2022-12-15","22:41:54"
"2722","VID_20221215_181820_121.mp4","2022-12-15 22:43:25","5554412231.0","2022-12-15","22:43:25"
"2723","A gente vota de novo e reelege o Capitão","2022-12-15 22:43:35","5629543497.0","2022-12-15","22:43:35"
"2724","Vão soltar todos os bandidos e prender todos os patriotas... é isso que querem...","2022-12-15 22:46:25","2071611904.0","2022-12-15","22:46:25"
"2728","Brasil

Pilotos de avião aprovam greve nacional; paralisação começa na próxima segunda","2022-12-15 22:48:34","5796901579.0","2022-12-15","22:48:34"
"2729","Isso mesmo","2022-12-15 22:48:55","5629543497.0","2022-12-15","22:48:55"
"2730","😭😭😭","2022-12-15 22:51:31","5294867128.0","2022-12-15","22:51:31"
"2731","é FAKENEWS SIM de 2018
VEJA A DATA DA POSTAGEM. E VEJA O VIDEO DELA NESSE LINK:
https://www.facebook.com/zoemartinezoficial/posts/uhhuu/581408798868286/","2022-12-15 22:54:27","1558126353.0","2022-12-15","22:54:27"
"2736","Essa doida pessoal tem que dá nem bola.... 

E focar nas QGs","2022-12-15 23:02:55","","2022-12-15","23:02:55"
"2738","🏓","2022-12-15 23:04:14","","2022-12-15","23:04:14"
"2740","Mudança fake","2022-12-15 23:16:34","1590700814.0","2022-12-15","23:16:34"
"2741","Segue o jogo","2022-12-15 23:16:40","1590700814.0","2022-12-15","23:16:40"
"2742","... total.
👊🏼🇧🇷🌼😉","2022-12-15 23:20:39","1609093306.0","2022-12-15","23:20:39"
"2743","Pessoal vamos dar uma força aos patriotas no QG de Brasília entrem no Instagram saleluzdf está ao vivo agora","2022-12-15 23:23:26","1295066390.0","2022-12-15","23:23:26"
"2745","Vídeo ANTIGO.....","2022-12-15 23:33:10","5700956615.0","2022-12-15","23:33:10"
"2746","Tenha responsabilidade nas postagens, pesquise o vídeo antes de repostar","2022-12-15 23:36:09","759025937.0","2022-12-15","23:36:09"
"2750","Ele acabou de postar ..ou seja,  tudo igual *A VITÓRIA JÁ É NOSSA* , *DEUS É FIEL*","2022-12-15 23:38:03","207258228.0","2022-12-15","23:38:03"
"2751","Foto de L.T.O","2022-12-15 23:41:03","1665441653.0","2022-12-15","23:41:03"
"2753","...🤔
De onde tirou este post...
Do whats...?

Não dá para trazer posts do whats para cá sem verificar...
Tem muitos aloprados ansiosos.
Ficam horas futucando Foice, Insta... e repassam muuuito lixo informacional.
😬","2022-12-15 23:47:48","1609093306.0","2022-12-15","23:47:48"
