"message_id","message","message_utc","from_id","date","time"
"847","Povo precisa a aprender ... Ainda","2022-12-13 20:11:30","","2022-12-13","20:11:30"
"575","Vc tem problema meu amigo ..","2022-12-13 12:18:23","5471697431.0","2022-12-13","12:18:23"
"576","@adm","2022-12-13 12:18:35","5471697431.0","2022-12-13","12:18:35"
"542","Agora é com o PR! Por enquanto tudo igual nos EUA Biden está até hoje","2022-12-13 10:39:53","1137243074.0","2022-12-13","10:39:53"
"880","Feras","2022-12-13 20:34:38","1192299295.0","2022-12-13","20:34:38"
"790","⚡️🇧🇷⚡️ Compartilhem Pessoal!

Quando a Gente pensa que a esquerdalha não poderia ser mais burra!

Voi là! 🤦🏻‍♀️

😂😅🤣

Tá para nascer “bixos” mais sem noção.

A burrice não tem limites mesmo por ali… 🙈🙉🙊

Ha Ha Ha

Rir para não chorar. 😎","2022-12-13 18:43:40","5796901579.0","2022-12-13","18:43:40"
"792","O FALSO CADEIRANTE DA CUT E OS NAZISTA HIPÓCRITAS, FORAM AO PALÁCIO TOMAR UMA ENRABADA METEÓRICA E UM ULTIMATO AFINAL, INCONTÁVEIS PATRIOTAS AINDA ESTÃO SENDO ENGANADOS POR ESSES EMBUSTEIROS MERCENÁRIOS INFILTRADOS NA DIREITA E QUE ARMARAM FEIO PRA CIMA DO GOVERNO DO BRASIL. SIMPLES ASSIM. É SÓ OLHAR BEM NA CARA DO MELIANTE E CONSTATAR O CAGAÇO.","2022-12-13 18:43:40","5796901579.0","2022-12-13","18:43:40"
"794","Celso Sodré Souza de Cardoso de MS
Identificado o nome de um dos terroristas que praticou vandalismo em Brasília.

Compartilhem até ele ser preso.","2022-12-13 18:43:41","5796901579.0","2022-12-13","18:43:41"
"795","Vídeo de Dr Marcelo Frazao","2022-12-13 18:43:41","5796901579.0","2022-12-13","18:43:41"
"796","🌩

🇧🇷🇧🇷🇧🇷👏👏💪💪","2022-12-13 18:43:41","5796901579.0","2022-12-13","18:43:41"
"798","🌩

🇧🇷💥💥💥💥💥

Resumo dos acontecimentos","2022-12-13 18:43:41","5796901579.0","2022-12-13","18:43:41"
"799","🌩

🇧🇷🇧🇷🇧🇷🇧🇷🇧🇷🇧🇷🙌

Padre Genesio (Padre que apareceu com bolsonaro)

Convocando todos para Brasília!

Hoje 13/12/2002 no QG Brasília","2022-12-13 18:43:41","5796901579.0","2022-12-13","18:43:41"
"800","General Freire Gomes, apoiadores direto do presidente dizem que esse é homem no qual devemos pedir ajuda nesse momento.

https://twitter.com/generalfreirego?t=9yjeRqGl0LOz_krw1Pg1Sw&s=09","2022-12-13 18:43:41","5796901579.0","2022-12-13","18:43:41"
"803","🤔🤔😲😲😲","2022-12-13 18:44:15","1435728938.0","2022-12-13","18:44:15"
"808","Eles vão mata todo mundo. Polícia vai chegar, desculpa a palavra, metendo porrada. A esquerda vai entrar no meio fazendo bagunça","2022-12-13 19:08:33","937453321.0","2022-12-13","19:08:33"
"809","Intervencionista Fabio Rodrigues Pardinho: Intervenção Militar. Por que ainda não aconteceu? Entenda.","2022-12-13 19:10:30","1229978866.0","2022-12-13","19:10:30"
"812","Patriotas, boa tarde!
Eu, minha esposa e filha estamos procurando caravana que parte de São Paulo rumo ao QG de Brasília. Alguém saberia informar qual disponibilidade e local para irmos?
Obrigado","2022-12-13 19:13:57","5923384851.0","2022-12-13","19:13:57"
"815","Que safado de novo o grupinho do Eustáquio inventando porcaria pra pegar bobos","2022-12-13 19:19:03","","2022-12-13","19:19:03"
"822","Povo precisa acordar meu pai do céu","2022-12-13 19:36:02","","2022-12-13","19:36:02"
"816","O PRESIDENTE CONVOCOU TODOS NO ALVORADA (ONTEM)CHEGAMOS LÁ, É ESTANDO LÁ NÃO DISSE NADA.
GENTE ESTA NA CARA QUE ELE ESTAVA PROTEGENDO TODOS NÓS. 
PESSOAL ACALMEM OS CORAÇÕES ELE JAIR MESSIAS BOLSONARO ,VULGO CAPITÃO TEM UM PLANO. 
OQUE TEMOS QUE FAZER?
NÃO SAIAM DA FRENTE DOS QUARTÉIS.","2022-12-13 19:19:13","5758023434.0","2022-12-13","19:19:13"
"817","Gente tenham consciência","2022-12-13 19:19:14","","2022-12-13","19:19:14"
"818","Povo deve deixar pelo amor de Deus a burrice

Só a poha do cacique ficou falando com o presidente ali no Alvorada e ainda pediu GLO

Que merda","2022-12-13 19:21:54","","2022-12-13","19:21:54"
"819","Não percebem que eles sempreanopulam todos","2022-12-13 19:22:07","","2022-12-13","19:22:07"
"820","Povo nunca t voz é sempre um Infiltrado que fica a frente tomando a pauta que ele quer","2022-12-13 19:22:32","","2022-12-13","19:22:32"
"821","A","2022-12-13 19:24:47","956396236.0","2022-12-13","19:24:47"
"823","DR MARCELO FRAZÃO - 13/12/2022","2022-12-13 19:38:13","","2022-12-13","19:38:13"
"824","Leiam","2022-12-13 19:42:34","5758023434.0","2022-12-13","19:42:34"
"825","Acham que estão preocupados com impugnação?","2022-12-13 19:44:54","1884964595.0","2022-12-13","19:44:54"
"829","Na sua opinião","2022-12-13 19:55:55","239999807.0","2022-12-13","19:55:55"
"831","https://t.me/patriotasos/7987","2022-12-13 19:56:16","1137243074.0","2022-12-13","19:56:16"
"834","#Eleições2022 #Diplomação #Presidência #TSE

✅ Na última segunda-feira, 12, o presidente do TSE, ministro Alexandre de Moraes, entregou os diplomas de presidente e vice-presidente a Luiz Inácio Lula da Silva e Geraldo Alckmin, respectivamente, para o mandato entre os anos de 2023 e 2026. 

A diplomação habilita os candidatos eleitos a tomarem posse nos cargos em 1° de janeiro e marca o encerramento do ciclo das Eleições 2022. A partir de agora, a Justiça Eleitoral começa a se preparar para o próximo pleito, municipal, marcado para outubro de 2024.

🤳🏼 Siga o TSE no Telegram. Convide os amigos a participarem do canal. Basta copiar e enviar o link aos seus contatos.","2022-12-13 20:01:40","","2022-12-13","20:01:40"
"840","Olhem que os Infiltrados já estão espalhando não sei qual a dificuldade dos adm em banirem esse pessoal de cada dia a novidade

Meu medo daqui a pouco pedirem pro povo clamar para o Batman","2022-12-13 20:05:12","","2022-12-13","20:05:12"
"841","Kkkkk bem isso mesmo","2022-12-13 20:05:48","239999807.0","2022-12-13","20:05:48"
"846","Vai vendo.","2022-12-13 20:11:04","","2022-12-13","20:11:04"
"850","E um corajoso","2022-12-13 20:16:06","239999807.0","2022-12-13","20:16:06"
"852","👍🏻👍🏻","2022-12-13 20:16:46","1435728938.0","2022-12-13","20:16:46"
"853","🙏🙏🙏🇧🇷🇧🇷🇧🇷💪🪖💪","2022-12-13 20:17:46","5030928610.0","2022-12-13","20:17:46"
"861","Tem um grupo aqui que banir e exclui qualquer um. Que pensar em colocar algo dessa mulher Priscila..","2022-12-13 20:22:54","1207904247.0","2022-12-13","20:22:54"
"859","O aleijado tá curado","2022-12-13 20:22:05","239999807.0","2022-12-13","20:22:05"
"879","Voce sao Fe ras","2022-12-13 20:34:35","1192299295.0","2022-12-13","20:34:35"
"864","Exclui e bani.. qualquer um que colocar..coisas dessa Priscila","2022-12-13 20:24:12","1207904247.0","2022-12-13","20:24:12"
"865","Exato","2022-12-13 20:24:19","548970790.0","2022-12-13","20:24:19"
"866","Isso mesmo.","2022-12-13 20:24:35","1207904247.0","2022-12-13","20:24:35"
"906","Vídeo de Ralfo","2022-12-13 21:06:06","1137243074.0","2022-12-13","21:06:06"
"907","Só que o grande problema é que a Zambelli e turma estão levando o povo a caminhos errados a tempos

Só isso já prova a intenção desses caras

O sonho da Zambelli é ela ser a líder da direita no Brasil

Pra isso Jair Bolsonaro precisa sair de cena....

Foi esses covardes que levaram o povoe pra Esplanada....
Aqui no Brasil são falsa direita

O que eles querem é criar uma direita ao molde da narrativa e pauta deles","2022-12-13 21:10:21","","2022-12-13","21:10:21"
"908","Esse é o sonho de muitos que colam na imagem do presidente.","2022-12-13 21:12:01","548970790.0","2022-12-13","21:12:01"
"909","Sim
....todas ele são falsa direita...

Lembram da Joice Halssemann?","2022-12-13 21:12:28","","2022-12-13","21:12:28"
"910","Todos esses vagabundos enganam o povo

Sempre começa com levantar uma bandeira certa pra Depois enfiar a faca","2022-12-13 21:13:02","","2022-12-13","21:13:02"
"911","Frota, Joyce, Weitraunb's, MBL, Amoedo etc.","2022-12-13 21:13:03","548970790.0","2022-12-13","21:13:03"
"913","Vídeo de Solange","2022-12-13 21:13:32","5552299178.0","2022-12-13","21:13:32"
"914","Amoedo nem vingou","2022-12-13 21:13:34","","2022-12-13","21:13:34"
"917","FIQUEM TRANQUILOS … FFAA TEM NOMES DOS PRINCIPAIS INFILTRADOS DA MANIFESTAÇÃO . 

Prestem muita atenção a esse áudio.

@MaxwellSmartAgente86
@CanalLivreExpressao","2022-12-13 21:17:52","548970790.0","2022-12-13","21:17:52"
"919","Está é a única saída rápida dessa situação que estamos hoje! Parar o país geral como diz primeira dama","2022-12-13 21:18:08","1111747315.0","2022-12-13","21:18:08"
"923","processos no STM do WILSON ISSAO KORESSAWA","2022-12-13 21:22:43","548970790.0","2022-12-13","21:22:43"
"924","Se o país parar geral sem quebrar nada tudo acabar mas prateleiras, combustível nos postos, com certeza resolve tudo isso muito rápido","2022-12-13 21:23:28","1111747315.0","2022-12-13","21:23:28"
"925","Quem vai prender? O que disse missão dada missão cumprida.....a federal que cumpre ordem ilegal?a militar que obedecer ao governador ....o cabeça se cabelo que tem contrato com o PCC?....isso é guerra. ...bandido não prende bandido. ..😔😔😔😔😔😔😔😔😔😔😔😔😔😔😔😔😔😔😔😔😔","2022-12-13 21:23:35","5509612221.0","2022-12-13","21:23:35"
"928","🌩

🇧🇷⚠️⚠️⚠️⚠️⚠️⚠️

🚫 CUIDADO COM OS HIPÓCRITAS! Eles estão aí para te pegar na distração!
13 / 12 / 2022","2022-12-13 21:25:05","937453321.0","2022-12-13","21:25:05"
"932","Podem ter certeza disso","2022-12-13 21:26:48","548970790.0","2022-12-13","21:26:48"
"933","processos no STM do WILSON ISSAO KORESSAWA","2022-12-13 21:26:56","1636215505.0","2022-12-13","21:26:56"
"936","A gente soube há pouco tempo. Vamos dar o troco.","2022-12-13 21:30:53","5629543497.0","2022-12-13","21:30:53"
"939","Pior ...a guerra nunca foi uma boa opção pra acabar conflitos!!! Talvez a metodologia de Gandhi possa nos ajudar???? Se toda nação cruzasse os braços, desligasse as tv os wi-fi, parasse de alimentar o sistema.... acredito eu que ele iria colapsar por si só!!! A maior desobediência civil é mostrar pro sistema q a gente não depende deles","2022-12-13 21:37:06","5254524688.0","2022-12-13","21:37:06"
"942","Será que o vídeo é ele mesmo pq é só a voz","2022-12-13 21:49:31","1361148397.0","2022-12-13","21:49:31"
"946","Olha o ditador Xandão falando mal de Lula e agora se aliou a ele","2022-12-13 21:55:59","1963832406.0","2022-12-13","21:55:59"
"947","Gente vão falando que já conecto a internet aqui tô na rua","2022-12-13 21:57:53","","2022-12-13","21:57:53"
"950","Cintia Fiaes","2022-12-13 22:08:31","","2022-12-13","22:08:31"
"953","Estou em alguns grupos falando diretamente para os ADM terem qualidade das pessoas que ali estão e irem tirando selecionando a sair com pessoas que vierem defendendo a turma dos hipocritas, jornalistas, deputags, Eustáquio e turma da esplanada","2022-12-13 22:13:44","1137243074.0","2022-12-13","22:13:44"
"954","Espero que surta efeito","2022-12-13 22:13:51","1137243074.0","2022-12-13","22:13:51"
"956","Acabaram de me tirar de um grupo por conta disso","2022-12-13 22:15:16","1137243074.0","2022-12-13","22:15:16"
"957","Tranquilo","2022-12-13 22:15:41","1207904247.0","2022-12-13","22:15:41"
"958","Mais um milagre no meio dos manifestantes! 🤡🤡

Será que é amigo do Eustáquio?
Será que receberam a mesma cura? 🤣😂","2022-12-13 22:16:26","1610165191.0","2022-12-13","22:16:26"
"959","Esse vídeo é fake , fui checar , ele é militar não  poderia falar nada    Tudo nas FFAA é sigiloso","2022-12-13 22:16:32","1361148397.0","2022-12-13","22:16:32"
"960","Só pode falar se for da reserva, mas essa voz não é do Tarcísio","2022-12-13 22:17:53","548970790.0","2022-12-13","22:17:53"
"961","Ele tá em cima do muro","2022-12-13 22:18:07","548970790.0","2022-12-13","22:18:07"
"962","Pra mim ele não tá sobre o muro não, pra mim ele tá é bem infiltrado, isso sim","2022-12-13 22:18:40","5608818384.0","2022-12-13","22:18:40"
"963","Já disse senana passada q nunca foi bolsonarista raiz","2022-12-13 22:18:42","548970790.0","2022-12-13","22:18:42"
"967","Digo mais, eu acredito que tem alguns políticos que ficaram infiltrados durante muito tempo nos governos do PT que tbm aparecerão na hora certa, pois agora seria loucura em auto nível, papo para outra hora, não é o momento","2022-12-13 22:23:15","5608818384.0","2022-12-13","22:23:15"
"969","Antigo, já tem uns 3, 4 dias","2022-12-13 22:24:42","5608818384.0","2022-12-13","22:24:42"
"971","Ele disse, já carimbei meu passaporte, apontou o Brasil no globo, assinou a ordem e acionou seu exército em apoio ao Brasil e ao presidente Bolsonaro. Tic tac

PRECISA MAIS ???

Putin avisa Vou riscar do mapa os inimigos do Bolsonaro Brasil Já estou com meu Passaporte Carimbado e pronto - o Botão Vermelho das Bombas e Mísseis já está na mão!

⚡⚡⚡⚡⚡🆘","2022-12-13 22:27:48","1006466751.0","2022-12-13","22:27:48"
"972","Isso é só um filtro do Putin, soube q ele avisou apenas a Venezuela pra n interferir","2022-12-13 22:29:34","1839178644.0","2022-12-13","22:29:34"
"973","A mensagem está correta, porém não é o Tarcisio, quem montou esse vídeo não acertou em colocar a foto dele … 
Ouvi esse áudio também, no telegram do Geopolítico Marcelo Rossi","2022-12-13 22:30:11","947686987.0","2022-12-13","22:30:11"
"974","Áudio de Marcelo Rossi","2022-12-13 22:32:04","5796901579.0","2022-12-13","22:32:04"
"981","ATENÇÃO 🚨🚨🚨🚨

Pessoal, quem viu a live do Bismark agora?
Pra mim, ESCLARECEU TUDO!
Bismark é o repórter do Hipócritas que quase foi preso ontem mas o capitão botou ele pra dentro do Palácio da Alvorada (junto com o Oswaldo Eustaquio) pra evitar a prisão. O danado jantou com o presidente ontem (pensem).
Ele, que já era suuuuper bem informado, nunca posta fakenews e sempre cantou todas as pedras certinhas até hoje, imagina depois do jantar de ontem...
Ele não pode falar tudo (obviamente) mas basicamente ele deixou 4  RECADOS EXTREMEMENTE IMPORTANTES:
1 O Capitão NÃO ESTÁ PARADO e a decisão já foi tomada. Ele está ""preparando o terreno"".
2 O nome da vez é o GENERAL FREIRE GOMES. Concentrem-se nele. E ele está do nosso lado. Não critiquem!
3 O que pedir nas manifestações?
R: Intervenção Constitucional, art. 142! *NÃO É PRA PEDIR INTERVENÇÃO MILITAR! Isso é ilegal*. E o capitão quer a vitória dentro das 4 linhas.
4 Deu a GARANTIA de que estaremos comemorando dentro de poucos dias! É só continuar na frente dos QGs!

PRA MIM, NÃO PRECISO SABER MAIS NADA ALÉM DISSO VINDO DA FONTE QUE VEIO!
ENTÃO BORA PRO QUARTEL ATÉ O DIA QUE O CAPITÃO MANDAR!","2022-12-13 22:40:10","5608818384.0","2022-12-13","22:40:10"
"982","Foi um golpe de mestre do Bolsonaro","2022-12-13 22:40:30","2034596508.0","2022-12-13","22:40:30"
"983","Tá respondida a pergunta que todos gostariam de saber.","2022-12-13 22:43:07","1262565021.0","2022-12-13","22:43:07"
"984","Boa noite posso esta sendo ignorante mas ainda pedi por intervenção institucional onde já sabemos que esas instruções estão falidas. Acredito que pedir 142.. intervenção militar ou como poste acima. Calar se o PR sabe que faz. Ele falou o fim último do comunismo são as FAS.","2022-12-13 22:47:27","1207904247.0","2022-12-13","22:47:27"
"985","Instituições *","2022-12-13 22:47:42","1207904247.0","2022-12-13","22:47:42"
"988","Vou partilhar","2022-12-13 22:49:54","1207904247.0","2022-12-13","22:49:54"
"989","Eu concordo totalmente com vc","2022-12-13 22:52:01","1246002087.0","2022-12-13","22:52:01"
"994","https://m.facebook.com/story.php?story_fbid=pfbid02ahbeGrqPDqa8FypNxWN6ogT5z1j3NoFFyJyBT8h6ULm43k7o7Si2pCZRVrhBHgd6l&id=100029155980401&sfnsn=wiwspmo&mibextid=RUbZ1f","2022-12-13 23:12:14","5739692216.0","2022-12-13","23:12:14"
"995","Alguém me manda no PV por favor que não está abrindo aqui !!!","2022-12-13 23:12:36","1839178644.0","2022-12-13","23:12:36"
"999","Esse ""momento certo"" escuto desde novembro, mas seguimos firmes e com esperança 💚💙 confiamos em Deus em primeiro lugar e dps no nosso PR e nas FFAA, como dizia sunt Zu ""o bom general vence a guerra antesepiarno api de batalha"" confiamos no SENHOR DOS EXERCITOS e no nosso PR","2022-12-13 23:16:21","1839178644.0","2022-12-13","23:16:21"
"1001","Não havia nenhum mandato de prisão contra eles, o próprio Eustáquio desmentiu...
O que se passa nos bastidores sobre possível intervenção não é vazado pra ninguém, muito menos pra YOUTUBERS..
Acho mesmo que foram chamados pra levar um pito de presidente...
Queriam levar os manifestantes para uma praça de guerra, o presidente sabendo disso chamou o povo pro Alvorada para protege-los","2022-12-13 23:17:59","2071611904.0","2022-12-13","23:17:59"
"1003","https://t.me/patriotasos","2022-12-13 23:20:32","5758023434.0","2022-12-13","23:20:32"
"1004","Profecia de ontem (12/12/22) Rev. Rolim.","2022-12-13 23:23:37","986947133.0","2022-12-13","23:23:37"
"1005","Ela não se identifica.","2022-12-13 23:24:26","1497774926.0","2022-12-13","23:24:26"
"1006","Tem mais dias.. Ha dias ouvir esse audio em alguns grupos","2022-12-13 23:25:30","1207904247.0","2022-12-13","23:25:30"
"1011","Não pode!🤔","2022-12-13 23:33:48","986947133.0","2022-12-13","23:33:48"
"1014","Viajou aqui. Fora o tanto q é histérica","2022-12-13 23:38:42","5584376506.0","2022-12-13","23:38:42"
"1015","Né","2022-12-13 23:38:53","5584376506.0","2022-12-13","23:38:53"
"1016","Já faz dias esse áudio","2022-12-13 23:39:29","1207904247.0","2022-12-13","23:39:29"
"1023","https://vm.tiktok.com/ZMFpcYnwu/","2022-12-13 23:46:15","1636215505.0","2022-12-13","23:46:15"
"1033","https://twitter.com/CarlosBolsonaro/status/1602639666746122247?s=20&t=LFG7K9rLTiZx2JskD3_rbA","2022-12-13 23:51:43","986947133.0","2022-12-13","23:51:43"
"1035","Olha o que tá rolando galera.....","2022-12-13 23:54:58","2071611904.0","2022-12-13","23:54:58"
"1036","Vídeo de","2022-12-13 23:55:32","1415835708.0","2022-12-13","23:55:32"
"1037","Outra vagaba","2022-12-13 23:55:33","1558126353.0","2022-12-13","23:55:33"
"1040","Não sei p/ que postar essa bosta. Parem selecionem","2022-12-13 23:56:41","1558126353.0","2022-12-13","23:56:41"
"1041","Vídeo de","2022-12-13 23:57:20","1415835708.0","2022-12-13","23:57:20"
"1042","Urgente repassem","2022-12-13 23:57:31","1415835708.0","2022-12-13","23:57:31"
"673","Povo deve continuar lá pedindo Intervenção Militar","2022-12-13 14:46:38","","2022-12-13","14:46:38"
"436","Fake , ele foi preso agora anoite","2022-12-13 00:03:05","1176891773.0","2022-12-13","00:03:05"
"437","72h?","2022-12-13 00:14:35","142524065.0","2022-12-13","00:14:35"
"451","Chat de voz","2022-12-13 00:39:32","1995506008.0","2022-12-13","00:39:32"
"452","Não não esplanada foi outra Quest

Me refiro ao tema diplomação","2022-12-13 00:39:35","","2022-12-13","00:39:35"
"453","O caos via tomar conta do país","2022-12-13 00:40:10","1995506008.0","2022-12-13","00:40:10"
"454","Chat liberado pessoal...","2022-12-13 00:40:11","","2022-12-13","00:40:11"
"693","PESSOAL é muito malandro na lábia","2022-12-13 15:19:27","","2022-12-13","15:19:27"
"483","🚨TODOS PARA O QG URGENTE🚨","2022-12-13 01:12:46","5471697431.0","2022-12-13","01:12:46"
"496","Deixa se foder","2022-12-13 02:23:03","5608818384.0","2022-12-13","02:23:03"
"497","Talvez seja proposital","2022-12-13 02:23:44","1199579908.0","2022-12-13","02:23:44"
"543","Bando de traidores Fizeram o que fizeram e depois querem ser salvos!","2022-12-13 10:42:45","1137243074.0","2022-12-13","10:42:45"
"504","Não confio nessa vagabundo do jornalista que acha que é Moisés","2022-12-13 02:29:22","5608818384.0","2022-12-13","02:29:22"
"578","Neto não precisa isso meu Nobre","2022-12-13 12:19:08","","2022-12-13","12:19:08"
"579","@dono","2022-12-13 12:19:20","5471697431.0","2022-12-13","12:19:20"
"506","Aí que tô articulando pra saber qual a desses

Pois o Eustáquio estavam convidando o povo para a Esplanada","2022-12-13 02:29:56","","2022-12-13","02:29:56"
"520","Kkkkkk","2022-12-13 03:49:23","82743550.0","2022-12-13","03:49:23"
"644","Verdade, acredito que é só forçar os caminhões de petróleo parar e não sair","2022-12-13 14:25:39","762836919.0","2022-12-13","14:25:39"
"580","É  só cruzar no meu caminho que resolvo para vc , vc é tão cagao que só faz isso por meio de rede social","2022-12-13 12:20:18","5471697431.0","2022-12-13","12:20:18"
"581","Calma que chega seu dia , na boa","2022-12-13 12:20:48","5471697431.0","2022-12-13","12:20:48"
"588","Bom dia","2022-12-13 13:36:50","762836919.0","2022-12-13","13:36:50"
"589","Bom dia a todos","2022-12-13 13:38:05","","2022-12-13","13:38:05"
"591","B. Dia","2022-12-13 13:38:40","1558126353.0","2022-12-13","13:38:40"
"645","Na minha opinião, só vai surtir efeito de fechar as estradas... Desabastecimento de tudo... Exceto para a saúde.","2022-12-13 14:25:52","924733255.0","2022-12-13","14:25:52"
"646","Isso ai","2022-12-13 14:26:15","937453321.0","2022-12-13","14:26:15"
"888","Alguém viu se saiu no Diário Oficial o pedido de cancelamento da DIPLOMAÇÃO do VAGABUNDO pelo Presidente  ? Ia sair as 17:30hs","2022-12-13 20:41:28","901317765.0","2022-12-13","20:41:28"
"896","🇧🇷GRUPO PATRIOTAS CABO FRIO E REGIÃO 🇧🇷 https://t.me/+aFK5PjkRj6dhZDkx","2022-12-13 20:49:18","1470297524.0","2022-12-13","20:49:18"
"694","Esse dia era para o povo pedi para salvar o Brasil, ficaram aplaudido e tirando foto, ao invés de exigir providências. Talvez fosse isso que ele queria para pode agir","2022-12-13 15:21:39","937453321.0","2022-12-13","15:21:39"
"695","Isso mesmo.","2022-12-13 15:27:54","1465102602.0","2022-12-13","15:27:54"
"754","Não vai estão firmes lá!","2022-12-13 17:14:53","5548330776.0","2022-12-13","17:14:53"
"755","Vamos ficar espertos, lembrem-se o Eustáquio e o hipócritas foram convidados a entrar no palácio.","2022-12-13 17:23:58","1330325965.0","2022-12-13","17:23:58"
"780","Parece que os criminosos somos nós trabalhadores","2022-12-13 18:26:11","1819027269.0","2022-12-13","18:26:11"
"781","Qual vídeo pf?","2022-12-13 18:26:24","1819027269.0","2022-12-13","18:26:24"
"782","Esse do Tarcísio que acabei de postar","2022-12-13 18:27:04","5273950100.0","2022-12-13","18:27:04"
"783","Obg","2022-12-13 18:27:10","1819027269.0","2022-12-13","18:27:10"
"786","Boa","2022-12-13 18:38:50","","2022-12-13","18:38:50"
"787","Povo continua gado  isso me revolta a ignorância do povo não perceber","2022-12-13 18:38:50","","2022-12-13","18:38:50"
"804","Meu Deus o q é isso???","2022-12-13 18:44:54","5977344340.0","2022-12-13","18:44:54"
"901","Venceremos sim. Esteja certa. Venceremos. Várias etapas já foram vencidas. É só avaliarmos de como éramos e como somos hoje.","2022-12-13 21:00:12","5629543497.0","2022-12-13","21:00:12"
"902","Não é  é brm será um único homem. Somos nós todos.","2022-12-13 21:00:58","5629543497.0","2022-12-13","21:00:58"
"903","Eu tb sou do Paraná.  Estou em Ilhéus-BA e não posso estar em Brasília.  Contudo, estou junto com todos.","2022-12-13 21:01:49","5629543497.0","2022-12-13","21:01:49"
"905","Já somos vencedores. Vencemos inúmeras etapas. Ontem mesmo, em Brasília, ganhamos mais uma. As cenas foram gravadas. Tudo  vídeo. Somos vencedores, eim.","2022-12-13 21:03:25","5629543497.0","2022-12-13","21:03:25"
"912","Revista oeste jovem pan todos são falsa direita....","2022-12-13 21:13:22","","2022-12-13","21:13:22"
"922","Sim.....porém não é a primeira dama","2022-12-13 21:21:39","","2022-12-13","21:21:39"
"931","Eles só estão esperando uma ordem","2022-12-13 21:26:37","548970790.0","2022-12-13","21:26:37"
"964","Está ligado","2022-12-13 22:19:13","1207904247.0","2022-12-13","22:19:13"
"965","Eu sempre falei a prova será quando ele assumir. Colar no Bolsonaro todo mundo cola.","2022-12-13 22:19:24","1137243074.0","2022-12-13","22:19:24"
"976","Eles não escondem mais!","2022-12-13 22:32:27","1590700814.0","2022-12-13","22:32:27"
"978","Eles foram lá levar um pito do presidente.... é isso que acredito","2022-12-13 22:34:00","2071611904.0","2022-12-13","22:34:00"
"979","Flávio Dino: ""sou comunista graças a DEUS"".

Como um comunista pode agradecer a Deus, se o comunismo é uma ideologia MATERIALISTA, que nega a existência de Deus? 

Incoerência é marca da esquerda. 😏

Instale o Telegram e junte se a nós na distribuição de informações e verdades! 🇧🇷📖🙌🏼
t.me/averdadeaqualquerpreco","2022-12-13 22:34:37","1590700814.0","2022-12-13","22:34:37"
"438","Pode ser que eu esteja enganada, mas acho que tudo isso foi o Eustaquio que provocou. Foi conduzindo, aos poucos...até acontecer.","2022-12-13 00:14:48","1884964595.0","2022-12-13","00:14:48"
"439","Muito afobados","2022-12-13 00:15:31","","2022-12-13","00:15:31"
"440","Povo deu ouvidos aos Infiltrados e a esse povo da Zambelli","2022-12-13 00:16:02","","2022-12-13","00:16:02"
"441","Mas apague de um farsante sempre sai mentiras

Paulo Figueiredo é outro que é falsa direita","2022-12-13 00:16:57","","2022-12-13","00:16:57"
"442","Povo precisa aprender que pior que a esquerda 1000vezes é o câncer da falsa direita","2022-12-13 00:17:25","","2022-12-13","00:17:25"
"443","No meio do povo","2022-12-13 00:17:32","","2022-12-13","00:17:32"
"445","Eu quero","2022-12-13 00:21:15","1995506008.0","2022-12-13","00:21:15"
