"message_id","message","message_utc","from_id","date","time"
"446","⚠️⚠️ ATENÇÃO! ATENÇÃO! ⚠️⚠️
VOCÊS ESTÃO CAINDO NA ARMADILHA DO X4ND4O

ELE SABE QUE TEM POUCOS DIAS PARA REAGIR.
ESTÁ APELANDO A TUDO QUE PODE.
👀 PRECISA FAZER CAPLT0Ll0 ACONTECER.
PRENDE ALGUMAS PESSOAS PARA INFLAMAR O POVO A INV4D1R QUALQUER UMA DAS INSTITUIÇÕES.

QUER PROTESTAR?
FAZ G1R3V3 G3R4L, SEM OBS1TRUIR AS ESTRADAS.

👇👇👇
NÃO CAIAM NA CILADA DE INV4D1R.
É EXATAMENTE ISSO, QUE ELE PRECISA PARA CONCRETIZAR  O PLANO DELES.
1. PRENDER O PR BOLSONARO E PERSERGUIR TODA A DIREITA.
2. MOLUSCO SOBE A RAMPA E SUA TURMA DOMINA TUDO.
👆👆👆

LOGO, MANTENHAMOS A CALMA E AGIR COM INTELIGÊNCIA.
O MAIS IMPORTANTE: PERMANEÇAM NOS QUARTEIS PARA DAR RETAGUARDA (LEGITIMIDADE PARA AGIR) AO PR BOLSONARO.

COPIE E COMPARTILHEM!!!","2022-12-13 00:25:53","1249172665.0","2022-12-13","00:25:53"
"448","Mas o povo foi para Alvorada","2022-12-13 00:30:47","1207904247.0","2022-12-13","00:30:47"
"449","Não foi isso","2022-12-13 00:30:50","1207904247.0","2022-12-13","00:30:50"
"450","Eles chamaram para Explanada?","2022-12-13 00:31:03","1207904247.0","2022-12-13","00:31:03"
"456","Sim e talvez esse seja o necessário pra que tudo se desenrole","2022-12-13 00:40:44","","2022-12-13","00:40:44"
"458","Haa","2022-12-13 00:45:55","1207904247.0","2022-12-13","00:45:55"
"459","Acredito. Sempre foi assim","2022-12-13 00:46:09","1207904247.0","2022-12-13","00:46:09"
"486","🚨ATENÇÃO TODOS PARA O QG URGENTE , FOI SÓ OS PETISTAS APARECEREM EM BRASÍLIA QUE O CAOS ACONTECEU 🚨","2022-12-13 01:19:05","5471697431.0","2022-12-13","01:19:05"
"488","Cuidado que pode ser os petistas que estão armando isso, são maquiavélicos","2022-12-13 01:28:43","1193864953.0","2022-12-13","01:28:43"
"492","Mauricio Rocha no Twitter: ""Como se alguém tivesse levado isso na mochila!!! https://t.co/vwmOBFsgXN"" / Twitter
https://twitter.com/misteriouspavao/status/1602398534879350789","2022-12-13 02:16:45","5700956615.0","2022-12-13","02:16:45"
"494","🚨🚨URGENTE🚨🚨

A pedido do Presidente Bolsonaro, o pessoal do Hipócritas e o Jornalista Oswaldo Eustáquio foram convidados a entrar no Palácio do Alvorada, depois que o Índio Cerere foi preso pelo PF a pedido do Alexandre de Morais","2022-12-13 02:22:23","1249172665.0","2022-12-13","02:22:23"
"495","Solta o jornalista","2022-12-13 02:23:00","5608818384.0","2022-12-13","02:23:00"
"498","Quando vocês vão finalmente confiar no vosso presidente??????
Foi o Bolsonaro que o chamou para entrar, algum motivo para isso ele tem. 

Não cabe a nós tentar adivinhar. 


Ele nos pediu há 2 dias:. Não critiquem sem ter certeza.


Temos que fazer o nosso melhor, a nossa parte sem passar o dia fazendo suposições.","2022-12-13 02:24:55","5926262281.0","2022-12-13","02:24:55"
"499","Ele entrou andando ou na cadeira de rodas !?","2022-12-13 02:26:33","5608818384.0","2022-12-13","02:26:33"
"500","Na cadeira kkkkk","2022-12-13 02:27:20","5926262281.0","2022-12-13","02:27:20"
"501","Mas foi convidado a entrar. 

Confio demais no meu presidente e não me interessa o motivo do convite.

O Bolsonaro vai resolver essa merda","2022-12-13 02:28:02","5926262281.0","2022-12-13","02:28:02"
"502","Também confio no mito","2022-12-13 02:28:46","5548330776.0","2022-12-13","02:28:46"
"503","Tbm confio","2022-12-13 02:28:55","5608818384.0","2022-12-13","02:28:55"
"507","Ele não terá dificuldade pq ele não vai governar nada, simples","2022-12-13 02:30:33","5608818384.0","2022-12-13","02:30:33"
"509","☝️☝️☝️ AÍ ELE EXPLICA DA PRISÃO QUE FALAM POR DROGAS. PRESO ANTES !!","2022-12-13 02:39:09","5700956615.0","2022-12-13","02:39:09"
"510","Descansem, a semana promete","2022-12-13 02:42:14","5608818384.0","2022-12-13","02:42:14"
"511","O Dr Marcelo Frazão disse q ele tem certeza q o JB os chamou pra dar uma bronca.","2022-12-13 02:43:02","1465102602.0","2022-12-13","02:43:02"
"512","Não ai já não confio nisso
Vou esperar esses dias pra vê o desdobramento pra que rumo tá indo esse desfecho","2022-12-13 02:47:00","","2022-12-13","02:47:00"
"516","""Patriota"" agredindo outro por estar filmando? 🤔","2022-12-13 03:34:06","1249172665.0","2022-12-13","03:34:06"
"523","Vídeo de Marco Antonio","2022-12-13 03:52:23","207258228.0","2022-12-13","03:52:23"
"527","Ela vai sujar as mãos com sangue?","2022-12-13 04:36:29","82743550.0","2022-12-13","04:36:29"
"528","🌩

🇧🇷

👻🥶😳","2022-12-13 07:16:50","5858187266.0","2022-12-13","07:16:50"
"529","https://www.instagram.com/reel/CmF0XzjA2AZ/?igshid=MDJmNzVkMjY=","2022-12-13 08:32:27","1610165191.0","2022-12-13","08:32:27"
"530","Vão vendo a armação!! Que NINGUÉM siga a esses índios. Não sei se eles são vitimas da armação ou estão nela, de qq maneira, NÃO SIGAM A ESTES ÍNDIOS. 👇👆","2022-12-13 08:32:27","1610165191.0","2022-12-13","08:32:27"
"531","INFORMATIVO NÚMERO 12
DA RESISTÊNCIA CIVIL SOSFFAA 
OS AGENTES DO CAOS E O CAPITÓLIO BRASILEIRO.
REVELAÇÕES NADA AGRADÁVEIS. 

AS ARMAS FORJADAS CONTRA ESSA NAÇÃO NÃO PROSPERARAM GRAÇAS AOS ESFORÇOS EM CONJUNTO DE MILHÕES DE BRASILEIROS DESPERTOS DA MATRIX.","2022-12-13 08:45:38","1610165191.0","2022-12-13","08:45:38"
"534","""E conhecereis a verdade e a verdade vos libertará""
João 8:32

✅ Sigam nosso canal @nocentrodopoder e fiquem por dentro dos bastidores da política.","2022-12-13 08:57:46","1610165191.0","2022-12-13","08:57:46"
"541","Cintia Fiaes L.L  me perdoem por ontem sair

Minha filha acordou e tive que dá atenção a ela 🫡","2022-12-13 10:37:09","","2022-12-13","10:37:09"
"537","Se acalmem a verdade já está sendo revelada , tudo armação.","2022-12-13 09:18:46","1330325965.0","2022-12-13","09:18:46"
"538","Nada como um dia após o outro para esclarecermos as situações.

A diferença entre manifestações conservadoras e esquerdistas fica bem clara.

Nas conservadoras vemos crianças, famílias, bandeiras do Brasil, orações, elevação espiritual, sentimentos de esperança, paz, União e propósitos univocos, claros.

Nas manifestações esquerdistas sempre aparecem os mascarados, baderneiros, fogo, quebradeiras, enfrentamento de policiais, confusões, sentimentos de medo e desorientação. Sempre fica uma sensação de falsidade, mentira e manipulação.

No calor dos acontecimentos pode demorar um pouco para perceber.

Mas, sempre que sentir algum cheirinho de mentira, manipulação, desordem e violência, LIGUEM O ALERTA!

VOCÊ PODERÁ ESTAR SENDO USADO DE BUCHA PELA ESQUERDA!

🇧🇷❤🙏","2022-12-13 09:43:58","1610165191.0","2022-12-13","09:43:58"
"539","Encontrem esse verme ele está aí no meio de vocês","2022-12-13 10:18:06","1610165191.0","2022-12-13","10:18:06"
"544","O cadeirante de Taubate","2022-12-13 10:42:56","1137243074.0","2022-12-13","10:42:56"
"545","Muito complicada e estou preocupadíssima pq coloca em risco toda a nossa luta","2022-12-13 10:44:19","1610165191.0","2022-12-13","10:44:19"
"546","Por isso mais do que nunca vc devem espalhar e concientizar o povo a somente Qg","2022-12-13 10:52:25","","2022-12-13","10:52:25"
"547","Fora que lá nas QG tá cheio de Infiltrado","2022-12-13 10:52:38","","2022-12-13","10:52:38"
"548","Tem que tirar os carros sim de la e expulsar essa gente","2022-12-13 10:53:09","","2022-12-13","10:53:09"
"553","Bom dia. Já havíamos conversado que após a diplomação haveria um movimento orquestrado de desânimo e abandono entre pseudos patriotas. 

Eles já tentaram sem sucesso praticar isso na entrega do relatório das Forças Armadas. 
Conversamos sobre isso recentemente, eles fazem um ""corre, corre, corre"". 

Eles vão perceber que ninguém correu junto... então eles voltarão pra tentar outro corre, corre, corre. É assim que funciona, eles nunca desistem de nos fazer desistir. 

Sem titubear, só vão ficando os fortes. É a seleção natural. Não importa quando! Só vamos parar quando vencermos.","2022-12-13 11:01:01","","2022-12-13","11:01:01"
"560","Opa","2022-12-13 11:19:15","1995506008.0","2022-12-13","11:19:15"
"561","Exatamente!!!!","2022-12-13 11:20:45","1610165191.0","2022-12-13","11:20:45"
"562","Áudio de Maximiliano Cavalcanti
Amigo do Canal Primeiro Pelotão

CANAL PRIMEIRO PELOTÃO
https://t.me/canalprimeiropelotao","2022-12-13 11:31:03","1610165191.0","2022-12-13","11:31:03"
"573","Mr?","2022-12-13 12:07:57","","2022-12-13","12:07:57"
"564","A mesma coisa acontece nos grupos... Cheio de Infiltrado levantando pautas contrárias pra tumultuar e causar dúvida","2022-12-13 11:47:49","","2022-12-13","11:47:49"
"565","Fora os grupos que criam de ""patriotas"" em que os ADM não banem esse pessoal .... Deixam rolar a soltar a divisão lá dentro...

Povo ainda não percebeu","2022-12-13 11:48:46","","2022-12-13","11:48:46"
"567","Bom dia a todos","2022-12-13 11:50:32","480076994.0","2022-12-13","11:50:32"
"572","Mr ??","2022-12-13 12:05:38","5471697431.0","2022-12-13","12:05:38"
"592","INFORMATIVO NÚMERO 12
DA RESISTÊNCIA CIVIL SOSFFAA 
OS AGENTES DO CAOS E O CAPITÓLIO BRASILEIRO.
REVELAÇÕES NADA AGRADÁVEIS. 

AS ARMAS FORJADAS CONTRA ESSA NAÇÃO NÃO PROSPERARAM GRAÇAS AOS ESFORÇOS EM CONJUNTO DE MILHÕES DE BRASILEIROS DESPERTOS DA MATRIX.","2022-12-13 13:38:40","1262565021.0","2022-12-13","13:38:40"
"593","O Brasil. Precisa parar, não adianta a gente na frente dos quartéis se os caminhoneiros não ajudar.","2022-12-13 13:39:29","762836919.0","2022-12-13","13:39:29"
"594","Sim tem que ser conjunto

Qg +caminhoneiros","2022-12-13 13:41:17","","2022-12-13","13:41:17"
"597","não escutem essa Ana","2022-12-13 13:46:47","5608818384.0","2022-12-13","13:46:47"
"598","outra infiltrada","2022-12-13 13:46:51","5608818384.0","2022-12-13","13:46:51"
"600","esta tentando cavar uma vaguinha","2022-12-13 13:47:02","5608818384.0","2022-12-13","13:47:02"
"601","#GenFreireGomessalveoBrasil","2022-12-13 13:47:08","1552686578.0","2022-12-13","13:47:08"
"604","informação agora é uma só","2022-12-13 13:47:32","5608818384.0","2022-12-13","13:47:32"
"606","entender os movimentos do presidente","2022-12-13 13:47:43","5608818384.0","2022-12-13","13:47:43"
"608","QGs e rezar","2022-12-13 13:47:57","5608818384.0","2022-12-13","13:47:57"
"609","deixou de ser política tem tempo","2022-12-13 13:48:05","5608818384.0","2022-12-13","13:48:05"
"610","bem contra o mal pesado","2022-12-13 13:48:10","5608818384.0","2022-12-13","13:48:10"
"612","Que ana?","2022-12-13 13:53:07","","2022-12-13","13:53:07"
"616","#GenfreireGomesSalveoBrasil","2022-12-13 13:55:56","1552686578.0","2022-12-13","13:55:56"
"618","Se for a tal da Ana Priscila ela é intervencionista. É furada caiam fora","2022-12-13 13:56:42","1558126353.0","2022-12-13","13:56:42"
"619","Sempre esconderam do povo... Sempre suprimiram...

E pior a falsa direita que sempre fez isso","2022-12-13 14:00:13","","2022-12-13","14:00:13"
"620","Tranquilo","2022-12-13 14:01:30","1207904247.0","2022-12-13","14:01:30"
"621","Assistam...","2022-12-13 14:06:12","","2022-12-13","14:06:12"
"623","Eu escuto. Tem um palavreado terrivel mas fala muitas verdades. Só filtrar.","2022-12-13 14:11:10","1610165191.0","2022-12-13","14:11:10"
"637","SOSFFA","2022-12-13 14:20:44","5718572739.0","2022-12-13","14:20:44"
"624","A Ana tem avisado há muito tempo que estas coisas aconteceriam. Sim, ela fala palavrão mas está cheio de limpinhos por aí que não tem caráter. Então isto é o que menos importa. Atentem-se ao que ela tem pra passar.","2022-12-13 14:13:42","160142614.0","2022-12-13","14:13:42"
"625","GENTE, NAS PALAVRAS DO PRESIDENTE,  QUANDO ELE DISSE ""NÃO É EU AUTORIZO, É O QUE EU POSSO FAZER PELA MINHA PÁTRIA"", ELE QUIS DIZER PARA PARARMOS O PAÍS . NÓS QUE JÁ ESTAMOS NOS QUARTÉIS, CONTINUEMOS, O RESTO TEM QUE PARAR O PAÍS!","2022-12-13 14:14:41","1497774926.0","2022-12-13","14:14:41"
"626","Concordo! Temos que parar o país. É o que podemos fazer. E apoiar as FA e o PR.","2022-12-13 14:15:56","160142614.0","2022-12-13","14:15:56"
"627","Sim,mas como fazer?","2022-12-13 14:16:55","924733255.0","2022-12-13","14:16:55"
"629","Gente os caminhoneiros vão ajudar muito.","2022-12-13 14:17:38","762836919.0","2022-12-13","14:17:38"
"630","problema não são os palavrões, problema é querer lacrar sobre uma coisa que ela não tem a mínima ideia do que ela ta falando. Outro dia mesmo ela soltou um audio imenso falando vencemos, toda eufórica. Não, não vencemos. Ela soltou falando que a prisão estava decretada, não, não está decretada. Existem processos, ela quer contar a notícia antes para depois falar que ela soltou em primeira mão. Não é a ordem correta de se fazerem as coisas, principalmente nesses momentos.","2022-12-13 14:18:15","5608818384.0","2022-12-13","14:18:15"
"632","Sim","2022-12-13 14:18:25","","2022-12-13","14:18:25"
"633","Intervencionista não é confiável","2022-12-13 14:18:56","1558126353.0","2022-12-13","14:18:56"
"635","É errado trancar as estradas?","2022-12-13 14:20:12","924733255.0","2022-12-13","14:20:12"
"638","Esta é uma opinião sua. Poderia ao invés de atacar ouvir e absorver o que considera ser bom. Quando vc ataca vc fala mais sobre vc do que sobre quem é atacado.","2022-12-13 14:20:56","160142614.0","2022-12-13","14:20:56"
"639","Eu tb entendi exatamente isso mas o povo entendeu que era pra gritar o nome dele nas portas dos quartéis affff. Tem que parar tudo, pacíficamente, caminhoneiros fiquem em casa, lojas grandes ou pequenas fechadas, empresas e fábricas fechadas. Abertos só hospitais e nada mais. Tres ou quatro dias ÚTEIS tudo parado resolve a questão rapidinho.","2022-12-13 14:21:03","1610165191.0","2022-12-13","14:21:03"
"640","Sim, exato!","2022-12-13 14:21:23","1610165191.0","2022-12-13","14:21:23"
"643","Bom dia. Não precisa trancar as estradas é só para tudo","2022-12-13 14:23:30","937453321.0","2022-12-13","14:23:30"
"648","Muita gente não para.","2022-12-13 14:27:37","924733255.0","2022-12-13","14:27:37"
"649","Parar o país. Os caminhoneiros, as empresas,  tudo.","2022-12-13 14:28:47","1497774926.0","2022-12-13","14:28:47"
"650","Se parar por 2 duas acho que resolve","2022-12-13 14:29:22","937453321.0","2022-12-13","14:29:22"
"663","Áudio de Calaza","2022-12-13 14:38:57","986947133.0","2022-12-13","14:38:57"
"653","Exatamente.... Eu tento alertar as pessoas mais lá fora nós grupos é muito tumulto

Por causa dos Infiltrados que dividem opiniões o dia todo","2022-12-13 14:32:46","","2022-12-13","14:32:46"
"655","O que tem que parar é a logística da cadeia de suprimentos do país...

Os empresários pararem

E o restante nas QGs","2022-12-13 14:34:10","","2022-12-13","14:34:10"
"656","Cada um tem que fazer sua parte","2022-12-13 14:34:37","","2022-12-13","14:34:37"
"664","Também,acho, precisamos ir p tudo ou nada... Precisamos bloquear as estradas, sim , pacificamente não está resolvendo","2022-12-13 14:43:03","762836919.0","2022-12-13","14:43:03"
"657","NÃO SIGNIFICA TRANCAR ESTRADAS, E SIM PARAR DE FUNCIONAR TUDO.  CAMINHONEIROS PAREM O CAMINHÃO EM CASA, OU NO ACOSTAMENTO. EMPRESAS, FECHEM AS PORTAS, SE NÃO PARAREM AGORA, VÃO FALIR DEPOIS, PORQUE O MOLUSCO ESTÁ COM SANGUE NOS OLHOS PARA DESTRUIR O BRASIL. COMO? É FÁCIL,  TIRA O DINHEIRO DAS PESSOAS,  ESTAS NÃO COMPRAM. SEM CLIENTES, AS EMPRESAS MANDAM O FORNECEDOR SEGURAR . O FABRICANTE PARA A PRODUÇÃO, DEMITE.. A INDÚSTRIA MANDA O FORNECEDOR DE MATÉRIA PRIMA SEGURAR, ASSIM QUEBRA TUDO EM CADEIA. FOI ASSIM NA VENEZUELA E NOS PAÍSES ONDE A ESQUERDA ENTROU. ENTÃO EMPRESÁRIOS ACORDEM.","2022-12-13 14:35:51","1497774926.0","2022-12-13","14:35:51"
"658","Esse vídeo dele ele tinha acabado de assumir
Tem duas coisas erradas aí

1° que não se pede artigo nenhum
Isso é atribuição do presidente
Povo se quiser tem que pedir intervenção apenas

2° com pedir uma intervenção se o presidente acabara de assumir
Tá errado","2022-12-13 14:36:07","","2022-12-13","14:36:07"
"659","Se os caminhoneiros pararem, o Brasil para.","2022-12-13 14:36:23","937453321.0","2022-12-13","14:36:23"
"660","E se os empresários pararem 
Acelera tudo","2022-12-13 14:36:55","","2022-12-13","14:36:55"
"661","Isso mesmo. Penso dessa forma tbm.
Precisamos apertar o pulso, pq se for pra parar 2-3-4 dias e ficar nesse lenga lenga o negócio não vai acontecer. Tem que parar TUDO, é alimentação, gasolina, tudo… e segurar até o balão estourar","2022-12-13 14:37:38","1167224169.0","2022-12-13","14:37:38"
"662","💣💣URGENTE!!!!🚨🚨
PADRE GENÉSIO, QUE REZOU NA FRENTE DO PALÁCIO DA ALVORADA HOJE, COM O PRESIDENTE, DEIXA CLARÍSSIMO QUE O LUGAR DO POVO PATRIOTA É NA FRENTE DOS QUARTÉIS! É ÓBVIO QUE O BOLSONARO O ENVIOU LÁ SUTILMENTE PARA DAR O RECADO CLARÍSSIMO!!!
ELE CITA BEM SOBRE MANIFESTAÇÃO DEMOCRÁTICA. 
IR AO ALVORADA PONTUALMENTE PRESTAR APOIO AO PRESIDENTE PODE E DEVE SER FEITO SEMPRE QUE CONVOCADO PORÉM A BASE É SEMPRE O QG DE BRASÍLIA. SEM MAIS!!! FECHA A CONTA E PASSA A RÉGUA!

PRA FRENTE DOS QUARTÉIS PESSOAL.","2022-12-13 14:38:11","","2022-12-13","14:38:11"
"666","Agora que o jogo começou de verdade gente... Afobação numa guerra leva a ruína","2022-12-13 14:44:04","","2022-12-13","14:44:04"
"667","Tudo armação. Só Deus","2022-12-13 14:44:08","1610165191.0","2022-12-13","14:44:08"
"669","Vamos manter a posição se acaso não for  conforme os dias não sair nada .... Aí sim","2022-12-13 14:44:35","","2022-12-13","14:44:35"
"670","#GenfreireGomesSalveoBrasil","2022-12-13 14:45:49","1552686578.0","2022-12-13","14:45:49"
"671","Engraçado os ADM nos grupos nunca banirem o pessoal que tava convocando pra ir pra Esplanada","2022-12-13 14:45:55","","2022-12-13","14:45:55"
"672","#GenfreireGomesSalveoBrasil","2022-12-13 14:46:08","1552686578.0","2022-12-13","14:46:08"
"674","Aliás só pelo fato de tá lá já mostra que o pedido é para os militares","2022-12-13 14:46:56","","2022-12-13","14:46:56"
"677","Fico me perguntando
Porque não fez esse vídeo antes...

Porque só sai depois da merda","2022-12-13 14:48:10","","2022-12-13","14:48:10"
"679","https://youtu.be/MeR4OKycZJY","2022-12-13 14:48:37","1149478372.0","2022-12-13","14:48:37"
"680","Povo ainda não entendeu que as Forças Armadas

São o povo armado....

Forças armadas são o povo e o povo é as forças Armadas

Militares não são políticos","2022-12-13 14:49:08","","2022-12-13","14:49:08"
"681","Vídeo de Souza Títulos Numismáticos","2022-12-13 14:49:42","959554279.0","2022-12-13","14:49:42"
"682","Fica Bolsonaro 💪🇧🇷","2022-12-13 14:53:25","","2022-12-13","14:53:25"
"683","Ao invés de ir em uma só voz pedir intervenção o povo vai bater selfie e sai frustrado... E não entendem porque","2022-12-13 14:54:14","","2022-12-13","14:54:14"
"685","Né? A coisa tá dificil, estamos naquela de que tudo pode ser verdade e tudo pode ser mentira.","2022-12-13 15:01:42","1610165191.0","2022-12-13","15:01:42"
"687","Bom tarde Tmj👊","2022-12-13 15:03:01","1435728938.0","2022-12-13","15:03:01"
"691","E outra coisa, ela quer a intervenção militar desde q o Bolsonaro não seja o chefe da intervenção. Isso já mostra quem ela é.","2022-12-13 15:11:07","1465102602.0","2022-12-13","15:11:07"
"692","Oxe.... Ela quer quem.... Um general alinhado com os comuna?!

Então ela tá insatisfeita com Bolsonaro bê quer que ele saia?

Oxe.","2022-12-13 15:19:16","","2022-12-13","15:19:16"
"697","Concordo com vc. Ao invés de gritarem: acione as FA preferiram bater palmas, cantar hino nacional etc. E não foi por falta de aviso. Não foi. Todo dia tinha aviso no grupo. Eu mesmo enviei mensagem no privado pra eles não esquecerem de gritar: acione as FA.","2022-12-13 15:29:31","1465102602.0","2022-12-13","15:29:31"
"703","Na porta dos quarteis tem de Monte os Infiltrados

Twm que eliminar esses carros de la ...

Os militares já disseram que se tiver carro som... Descaracteriza o movimento

Nem risinhos.... Não é passeio","2022-12-13 15:38:44","","2022-12-13","15:38:44"
"710","Daqui a pouco libero o chat pra quem quiser...","2022-12-13 15:44:40","","2022-12-13","15:44:40"
"714","👏👏👏👏","2022-12-13 15:50:28","","2022-12-13","15:50:28"
"715","Só em Brasília que ainda não conseguiram gritar a pauta","2022-12-13 15:50:39","","2022-12-13","15:50:39"
"718","O vídeo ficou incompleto, pena.","2022-12-13 15:56:07","1124721837.0","2022-12-13","15:56:07"
"720","Não precisa trancar estradas. É só parar os trabalhos.","2022-12-13 16:00:18","1497774926.0","2022-12-13","16:00:18"
"721","É claro.","2022-12-13 16:01:02","1497774926.0","2022-12-13","16:01:02"
"722","Uma ótima tarde para todos,  uma especialista muito bom meus parabéns,  algo que vale apenas compartilhar informações muito importantes para a nossa nação brasileira...","2022-12-13 16:01:39","959554279.0","2022-12-13","16:01:39"
"723","PARAR OS TRABALHOS É EFICIENTE.","2022-12-13 16:02:16","1497774926.0","2022-12-13","16:02:16"
"724","Se os empresários se juntarem é coisa de 3 dias para ficar insuportável","2022-12-13 16:03:18","","2022-12-13","16:03:18"
"729","Safados","2022-12-13 16:05:05","","2022-12-13","16:05:05"
"730","Caiu a máscara deles","2022-12-13 16:05:13","","2022-12-13","16:05:13"
"738","Áudio 01

Se inscreva no Canal Thami Gasparetto 🎥
youtu.be/8cSw6y4AgDQ


👉🏻 Twitter: https://twitter.com/Tha_Gasparetto?t=l6IBDmmRnieZFFtepzjxwQ&s=09","2022-12-13 16:27:48","548970790.0","2022-12-13","16:27:48"
"739","Áudio 02

Bolsonaro salvou muitos patriotas! 

Se inscreva no Canal Thami Gasparetto 🎥
youtu.be/8cSw6y4AgDQ


👉🏻 Twitter: https://twitter.com/Tha_Gasparetto?t=l6IBDmmRnieZFFtepzjxwQ&s=09","2022-12-13 16:27:48","548970790.0","2022-12-13","16:27:48"
"745","Verdade falou tudo","2022-12-13 16:45:26","2034596508.0","2022-12-13","16:45:26"
"748","O povo vai se cansar. A situação vai sair do controle. PR BOLSONARO, que ainda tem apoio popular, vai perdê-lo. FFAA tem de agir antes do Brasil virar de ponta cabeça. Risco é eminente.
Poucos conseguem ficar em frente aos qgs por tanto tempo.","2022-12-13 16:51:03","1352760311.0","2022-12-13","16:51:03"
"749","https://mobile.twitter.com/CarlosBolsonaro","2022-12-13 16:51:58","986947133.0","2022-12-13","16:51:58"
"750","https://www.in.gov.br/en/web/dou/-/portaria-gm-md-n-5.938-de-7-de-dezembro-de-2022-450057655

*PUBLICADO HOJE NO DOU 13/12/22*

*Decreto de cadastro para empresas que vão dar suporte para a FFAA, ou seja na parte de mantimentos!*
*Em caso de emergência*","2022-12-13 16:57:29","548970790.0","2022-12-13","16:57:29"
"751","Considera-se EIMOB aquela empresa que, em caso de Mobilização Nacional, tenha capacidade técnica e estrutural de fornecer produtos, serviços, instalações ou pessoal, necessários ao atendimento das necessidades logísticas das FA ou adaptar-se para suprir suas carências.
A Mobilização Nacional o conjunto de atividades planejadas, orientadas e empreendidas pelo Estado, complementando a Logística Nacional, destinadas a capacitar o País a realizar ações estratégicas, no campo da Defesa Nacional, diante de agressão estrangeira.","2022-12-13 16:57:29","548970790.0","2022-12-13","16:57:29"
"756","Versão Whatsapp","2022-12-13 17:23:59","1330325965.0","2022-12-13","17:23:59"
"757","https://t.me/GideoesDoBrasil","2022-12-13 17:35:08","1330325965.0","2022-12-13","17:35:08"
"758","https://t.me/GideoesDoBrasil","2022-12-13 17:35:09","1330325965.0","2022-12-13","17:35:09"
"759","Os vagabundos parlamentares em geral, não nos representam mais. Temos que deixar isso bem claro, nós não queremos saber de CPI, ou de impeachment, o diabo que for. Temos que EXIGIR das FFAA a queda completa do ""Sistema"".
Essa classe política está podre, ninguém alí representa mais ninguém. 😤","2022-12-13 17:36:40","1578765948.0","2022-12-13","17:36:40"
"760","Áudio de Dorival","2022-12-13 17:41:15","1578765948.0","2022-12-13","17:41:15"
"761","Vídeo de adailton rodrigo","2022-12-13 17:42:05","5700956615.0","2022-12-13","17:42:05"
"762","https://www.instagram.com/p/CmHMHnauJE6/?igshid=MDJmNzVkMjY=","2022-12-13 17:44:14","1149478372.0","2022-12-13","17:44:14"
"763","https://youtu.be/qFmI51NzpK0","2022-12-13 17:45:18","1593084676.0","2022-12-13","17:45:18"
"764","https://www.instagram.com/reel/CmF1lxnAgZl/?igshid=MDJmNzVkMjY=","2022-12-13 17:59:55","1149478372.0","2022-12-13","17:59:55"
"765","Vídeo de Rogerio Tales","2022-12-13 18:01:03","1593084676.0","2022-12-13","18:01:03"
"768","Fragatas Brasileiras Salvador Ba","2022-12-13 18:03:31","1593084676.0","2022-12-13","18:03:31"
