"message_id","message","message_utc","from_id","date","time"
"769","URGENTE ‼️‼️

PATRIOTAS ACORDEEEEM‼️

Não caiam nas armadilhas da esquerda.
Isso é uma armação
Com policiais comprados e militantes esquerdistas junto com os marginais do MST.

Nós os Patriotas temos o dever de continuarmos resistindo nos QGs onde estamos seguros e nenhum otario ousa mexer com agente.

A diplomação do vagabundo foi necessária para validar o crime e ser dado a sentença dos criminosos.

 Era tudo o que os militares queriam. Povo, estejam calmos e serenos.

Esse teatrinho grotesco da globo lixo junto com a esquerda maldita não vai nos intimidar.

EIIII
ACORDAAAAA‼️‼️

Eles estão se borrando de medo.
Não vamos nos intimidar com isso.

Chega!!!!

É o nosso futuro que está em jogo‼️‼️

Ninguém aqui está disposto a comer cachorro e viver com a consciência pesada de não termos chegado até o fim!

ACORDA‼️‼️‼️‼️

Não é hora de nos acovardamos!

Não vamos nadar pra morrer na praia!

Não somos frouxos.

Vamos mostrar pra eles que os manés resistirão até o fim‼️

Precisamos de ser fortes e deixar eles lá se pegarem entre si.

Nada está perdido.  Não está  mesmo!

 ACORDAAAAAAA‼️

Não entregue sua liberdade por medo.

Não tem mais volta
Vamos ficar firmes pra pisar na cabeça dessa serpente.

Não vandalizem! Não criem tumulto! Nao interfiram!
Consolem uns aos outros!
Somos fortes acreditem!!!!
 Deixem acontecer: é  a nosso favor!

Ainda não é  hora de perder as esperanças só porque muitos de vocês  não entendem das leis, dos poderes. Confiem! Estudem.

Está tudo ocorrendo perfeitamente. 

Essa eleição será nula. O vagabundo não assumirá dia 1 de janeiro não. É  fato!  E isso só  é  fato, porque estamos resistindo, estamos na frente dos quartéis * legitimando internacionalmente *  o que o Bolsonaro e os militares estão fazendo sem o conhecimento do povo. Estamos há mais de um mês,  cansados, exaustos, angustiados, passando privações, muitos longe das famílias, perderam empregos, largaram....Eu sou uma de vocês! Tem dia para chorar sim, mas HOJE NÃO  É  UM DESSES DIAS!! 

A hora é essa! A mensagem é clara! Só não entende quem não quer!

 CONTINUEM NOS QUARTÉIS! Por mais um pouco..... temos que resistir e estar preparados para esses teatros! 

Por quanto tempo for preciso‼️‼️

A nós, POVO, cabe resistir e criar legitimidade internacional! Para que eles possam fazer o que é  necessário . Não está  demorando muito não, está no tempo certo. Estão se esgotando as 4 linhas, estamos quase lá.  

Ontem as manifestações aconteceram no Brasil todo, em milhões,  milhões  de pessoas! Será  que nós temos consciência  do poder disso!? A mídia  corrupta, aqui do Brasil, não mostra, mas os militares filmaram tudooooo, a mídia internacional falou, mostrou.

Essa semana que se inicia hoje, a mídia  internacional INTEIRA está  voltada para nós. 

▶️ NÓS VAMOS RESISTIR!!  Não sairemos da rua e dos quartéis!! Ai de quem disser no futuro histórico que o povo brasileiro era frouxo! Não somos não! 👊👊👊

Deixa a esquerda espernear, gritar, xingar, deturpar,fazer guerra,fingir que estão atacando patriotas nas ruas, e tentar nos desanimar....deixa eles! Que venham!! 

""As forças armadas são a última barreira contra o socialismo!"", disse o presidente. Então, é na frente dos quartéis!!! Sempre!!! Sempreeee!  Não importa o que a esquerda diga, qual é a narrativa, se na Jovem Pan dizem que a transição está ocorrendo, quem são os ministros escolhidos do Lula, o que o “novo”governo fará! Dane-se!!!

Paremos de nos preocupar com isso! Essa parte não é a nossa.

Estamos quase lá, não coloquem tudo a perder... esqueçam de prisões, índios,falsas guerrilhas... esqueçam!!!

Ninguém ousou tocar em nós quando iniciamos nossas manifestações no QG não é agora que vão tocar‼️‼️

Vamos continuar
Até os bandidos serem presos ‼️‼️

#compartilhe","2022-12-13 18:10:56","1610165191.0","2022-12-13","18:10:56"
"770","Confio em Deus e no presidente!","2022-12-13 18:11:21","5739692216.0","2022-12-13","18:11:21"
"771","Eles abriram uma caixinha de pergunta.... BORA responder 🇧🇷🇧🇷🇧🇷🫡🫡","2022-12-13 18:12:42","1415835708.0","2022-12-13","18:12:42"
"773","🌩

🇧🇷⚠️⚠️⚠️⚠️💥💥

Ouçam 👂👂","2022-12-13 18:16:45","1610165191.0","2022-12-13","18:16:45"
"774","SOS INTERVENÇÃO MILITAR - *LOTEEEEMMM*","2022-12-13 18:19:40","5608818384.0","2022-12-13","18:19:40"
"775","Os verdadeiros não vou desistir.","2022-12-13 18:19:41","5739692216.0","2022-12-13","18:19:41"
"777","https://youtu.be/_YnnkX_GvZQ","2022-12-13 18:24:30","5273950100.0","2022-12-13","18:24:30"
"778","Pessoal mas vcs acreditam que as forças armadas vão nos defender de tudo que está ocorrendo?","2022-12-13 18:25:19","1819027269.0","2022-12-13","18:25:19"
"779","Assista o vídeo lá estão as respostas","2022-12-13 18:25:56","5273950100.0","2022-12-13","18:25:56"
