"message_id","message","message_utc","from_id","date","time"
"26167","https://www.youtube.com/watch?v=7ErETL5CaxY&ab_channel=PaulaMarisaLive","2022-10-30 20:14:32","163580497","2022-10-30","20:14:32"
"26168","👆Convocação👆

Para saber qual é a DIFERENÇA da Contagem Secreta dos Votos (Escrutínio Secreto) que existe hoje e que é inconstitucional e anti-democrático PARA a Contagem (apuração) Pública dos Votos (Escrutínio Público) que por ser um ato administrativo deve ser público, veja as lives dos links abaixo com o Procurador do Estado do Mato Grosso do Sul, Doutor Felipe Marcelo Gimenez, um dos maiores especialistas em eleição com urnas eletrônicas do Brasil e quiçá do mundo. Ele afirma que não há democracia no Brasil desde a implantação das urnas eletrônicas em 1996 em que a apuração dos votos passou a ser eletrônica, portanto, secreta.

Live com Dr. Felipe Gimenez em 27/10/22: https://youtu.be/w0dKb5aKIg4

Live com Dr. Felipe Gimenez em 25/10/22: https://youtu.be/oas5SIkA3Cw

Live com Dr. Felipe Gimenez em 05/10/22: https://rumble.com/v1msyy0-quem-decide-o-voto-live-com-dr.-felipe-gimenez.html

Live de um ano atrás do Eduardo Bolsonaro com o Dr. Gimenez: https://youtu.be/0OQfzPh1p9s","2022-10-30 23:04:55","987976156","2022-10-30","23:04:55"
