"message_id","message","message_utc","from_id","date","time"
"6627","👍","2023-01-03 21:10:14","5061614003.0","2023-01-03","21:10:14"
"6518","SBT, Band, Record, globo, REDETV, Jovem pan, CNN etc. o que tem elas em comum?
Todas foram treinadas e bem pagas para o controle da percepção das pessoas e usadas para o propósito dos globalistas","2023-01-03 00:23:58","1044541547.0","2023-01-03","00:23:58"
"6519","Marca da besta","2023-01-03 00:25:36","1044541547.0","2023-01-03","00:25:36"
"6520","Obrigado.","2023-01-03 00:35:01","553279510.0","2023-01-03","00:35:01"
"6527","Boa noite. Admin reveja a empresa Perdigão. Que eu saiba ela é marca da BR foods que também detém a Sadia e que hj tem como controlar o Molina, dono da Marfrig","2023-01-03 03:29:23","1621016956.0","2023-01-03","03:29:23"
"6528","Perdigão tem a Ivete como garota propaganda 
Endossa o L","2023-01-03 03:31:45","214690294.0","2023-01-03","03:31:45"
"6529","Compreendido... Gostaria de sugerir que começasse fazer lista de empresas de direita para darmos preferência.

Tipo, direita compra de direita...","2023-01-03 03:34:45","1621016956.0","2023-01-03","03:34:45"
"6533","Isto está com cheiro de esquerdista, cara de esquerdista, roupa de esquerdista, texto de esquerdista. Será que é um patriota!?","2023-01-03 04:00:19","553279510.0","2023-01-03","04:00:19"
"6534","Todos nós sabemos que não há nenhum ""Comando Central"". De onde esta criatura retirou isto?","2023-01-03 04:05:15","553279510.0","2023-01-03","04:05:15"
"6535","Está na cara que é um maldito comunista!","2023-01-03 04:07:42","553279510.0","2023-01-03","04:07:42"
"6536","Também acho, o único lugar seguro é na porta dos quartéis","2023-01-03 04:20:00","903669300.0","2023-01-03","04:20:00"
"6539","Tô tá ficando maluco ou continuas PeTralha?","2023-01-03 04:37:54","1157208431.0","2023-01-03","04:37:54"
"6540","Vai tú.....","2023-01-03 04:39:54","1148466756.0","2023-01-03","04:39:54"
"6541","#ComunismoNuncaMais","2023-01-03 04:40:26","1148466756.0","2023-01-03","04:40:26"
"6542","#ParalisaçãoCivilGeral","2023-01-03 04:41:03","1148466756.0","2023-01-03","04:41:03"
"6547","Texto estranho, começou com 2 de dezembro de 22 e termina com 2 de janeiro de 23....","2023-01-03 04:52:27","1160630637.0","2023-01-03","04:52:27"
"6548","Amigo Basta ler a frase que diz: ""Ordem dada é ordem cumprida."" Bem linguajar de malandro. 😉","2023-01-03 04:56:28","1637017751.0","2023-01-03","04:56:28"
"6549","👆","2023-01-03 04:57:02","1637017751.0","2023-01-03","04:57:02"
"6550","Mais um filhote do mula.","2023-01-03 05:03:33","553279510.0","2023-01-03","05:03:33"
"6551","Me respeita palhaço. Primeiro que sou mulher e segundo que meu pai era de extrema direita me deu excelente educação, coisa que parece que você não tem chamando outra pessoa de mula.","2023-01-03 05:13:49","1637017751.0","2023-01-03","05:13:49"
"6552","@adm petista encubado, dá ban aí","2023-01-03 07:14:13","860090869.0","2023-01-03","07:14:13"
"6553","Eu não estava me referindo a você. Eu me referí ao comunista que compartilhou o texto que estávamos analisando.","2023-01-03 07:23:36","553279510.0","2023-01-03","07:23:36"
"6554","O criatura me respeita que eu não sou petista!","2023-01-03 07:27:43","1637017751.0","2023-01-03","07:27:43"
"6557","A frase que utilizei está muito clara. Tanto que você mesma percebeu que eu me dirigí a um homem.","2023-01-03 08:13:41","553279510.0","2023-01-03","08:13:41"
"6558","Mas como estou vendo que você é muito educada, irei finalizar aqui este assunto.","2023-01-03 08:14:20","553279510.0","2023-01-03","08:14:20"
"6559","https://youtu.be/jqtTc_CMlJg","2023-01-03 08:17:36","791421370.0","2023-01-03","08:17:36"
"6560","Vídeo muito importante ☝️","2023-01-03 08:18:37","791421370.0","2023-01-03","08:18:37"
"6561","Aqui está o livro completo de GENE SHARP ""Da ditadura a liberdade"" para LER por em pratica  HOJE. COMPARTILHE - PRECISAMOS LUTAR COM ESTRATÉGIAS CONSCIENTES. chrome-extension://efaidnbmnnnibpcajpcglclefindmkaj/https://www.aeinstein.org/wp-content/uploads/2016/02/Da-Ditadura-%C3%A0-Democracia_PAGfinal.pdf","2023-01-03 08:19:07","791421370.0","2023-01-03","08:19:07"
"6563","Falou extrema direita ė com certeza COMUNISTA. Nao existe direita extrema,  nao existe certo extremo, certo ė certo, errado é errado  e é extremo...mas a esquerda é com certeza extrema. Toda DESGRAÇA que  existe neste PLANETA tem uma unica responsavel por tras: A MALDITA, PORCA, BURRA, INCOMPTENTE E TOTALMENTE INUTIL esquerda.","2023-01-03 09:36:26","297494860.0","2023-01-03","09:36:26"
"6564","https://www.bitchute.com/video/zH17mYnZvNvo/

Catherine Austin Fitts explica que se não fizermos algo para defender nossa liberdade sanitária e todas as outras, não conseguiremos impedir o que estão fazendo para prejudicar nossos filhos, pois estão desenvolvendo um processo de controle político e econômico cada vez mais centralizado","2023-01-03 09:44:26","1231614665.0","2023-01-03","09:44:26"
"6565","Pra ajudar a direita, quem quiser investir o 13o em mídias de direita estará ajudando muito o movimento: Revista Oeste, Jornal Brasil sem medo, Jornal da cidade online, Terra Brasil Noticias... pague a anuidade que tem desconto.","2023-01-03 10:03:47","1332893822.0","2023-01-03","10:03:47"
"6566","Ela faz campanha pra todos usarem cash as sextas-feiras pra não deixar o dinheiro físico morrer.","2023-01-03 10:05:09","1332893822.0","2023-01-03","10:05:09"
"6567","Ele vai desfazer tudo o que o Bolsonaro fez. Enquanto o povo espera por um milagre.
Isso desestimula muito as pessoas.
Tenham um plano B.
O plano A não deu certo porque colocamos todas as nossas expectativas em uma instituição que se corrompeu.","2023-01-03 10:11:24","5153054022.0","2023-01-03","10:11:24"
"6568","O plano B é a partir de 1 de fevereiro, com novos parlamentares empossados, todos na frente da esplanada pedindo impeachment do cabeça de ovo e do Carniça. Antes disso,só se for greve ou manifestações pacificas pra mostrar nosso  número.","2023-01-03 10:14:38","1332893822.0","2023-01-03","10:14:38"
"6569","Pessoal, penso que Bolsonaro disse que o exército vai aonde o povo pedir, devemos fazer uma última convocação para porta dos quartéis... Agora não teria como dizerem que é por Bolsonaro e sim pelo país e se caso não der certo aí subimos o nível...o presidente disse na alvorada muitas coisas e isso estava incluído...o exército vai aonde o povo mandar e agora temos que mandar sem o Bolsonaro no poder...se não ouvirem aí subimos o nível...acho ser a situação certa a se fazer pelo momento sem ele no poder","2023-01-03 10:16:44","1940900813.0","2023-01-03","10:16:44"
"6572","Já falei isso tbm. Estamos sem saber de quem comprar.","2023-01-03 11:05:40","950051189.0","2023-01-03","11:05:40"
"6573","Só consigo pensar na Havan🙈","2023-01-03 11:08:22","950051189.0","2023-01-03","11:08:22"
"6575","Aaah tá bom, vocês nem me conhecem. E ficam aí me jugando dizendo que sou infiltrada. Só estou pedindo que me respeitem. Mas nem vocês merecem respeito. Não bastar boicotar marcas que patrocinaram a campanha dos corruptos se vocês mesmos boicotam uns aos outros. Pedem uma coisa e fazem outra. Será mesmo que vocês são tão dignos de julgar alguém sem conhecer??? Vocês são os verdadeiros JUDAS! A partir do momento que querem boicotar empresas, vocês mesmos fazem com que o país se quebre e a massa de empregos que foram abertas nos últimos 4 anos se desmorone. Vocês mesmos que querem instalar uma Venezuela no Brasil, boicotando empregos da nação! Esse grupo é um lixo, pois os membros dele são hipócritas. Duvido que nenhum de vocês tem em casa os produtos citados aqui no grupo. DUVIDO! VOCÊS SÃOS OS VERDADEIROS JUDAS, HIPÓCRITAS. 
Tenho certeza que quando o meu presidente JAIR MESSIAS BOLSONARO voltar para  ser  empossado como o verdadeiro presidente dessa nação e  receber apoio de uma ou algumas dessas marcas que vocês estão boicotando, vocês vão enfiar o rabinho de vocês entre as pernas e vão retornar a usá-los! Eu não sou infiltrada, sou Patriota assim como vocês. Fui enganada como vocês, tive o meu voto roubado e tb meu pai assassinado por políticos de esquerda. Minha luta é por um país onde possamos andar nas ruas com segurança e sem medo. Eu não sou de esquerda. E eu não tenho foto no meu perfil pq assim como todos nós a qualquer momento podemos perder a nossa liberdade de expressão e pq que eu vou ficar mostrando a minha face pra bandido me ver e guardar a minha face. Tenham um bom dia e uma excelente luta para vocês, pois eu não desejo o mal para ninguém!   🇧🇷🕊️🙏","2023-01-03 12:10:29","1637017751.0","2023-01-03","12:10:29"
"6576","relaxa mulher, tudo isso só por um mal entendido em uma mensagem...","2023-01-03 12:16:22","1086439306.0","2023-01-03","12:16:22"
"6579","Bom dia patriotas, eu vejo que a grande mensagem do presidente foi sair da frente e entregar ao povo. E estamos fortes e em um momento único, onde somos o rolo compressor que pode desmontar este golpe. No 1º dia começou a destruição de tudo que foi feito. Não podemos retroceder, mas sim acelerar e apertar a cabeça da cobra até ele ficar sem ar. Força e fé. Selva! Deus no comando.","2023-01-03 12:24:24","697310299.0","2023-01-03","12:24:24"
"6580","Ta preocupada se empresa que APOIA o crime vai quebrar??? Acabou de confessar que é esquerda, sai daqui papo furado. Todos aqui querem ė que quem apoia a esquerda seja enjaulado ou que no minimo seja obrigado a viver onde o regime que defendem ja foi implantado, Venezuela fica proximo...","2023-01-03 12:38:47","297494860.0","2023-01-03","12:38:47"
"6581","Bom dia, um link para quem precisa de ânimo.","2023-01-03 12:45:11","950051189.0","2023-01-03","12:45:11"
"6582","https://youtu.be/kzFeOOAq0V0","2023-01-03 12:45:43","950051189.0","2023-01-03","12:45:43"
"6586","Se existisse justica deveria ser obrigado so quem vota na esquerda viver sob o DESgoverno de esquerda, perfeito seria obrigado todos que votam  na esquerda a viver apenas 1 ano na Venezuela, Cuba ou Coreia do Norte","2023-01-03 13:15:09","297494860.0","2023-01-03","13:15:09"
"6607","Sinto cheiro de comuna no grupo de longe🙊🧐🤫","2023-01-03 16:05:54","1618208097.0","2023-01-03","16:05:54"
"6588","O presidente em exercício era Bolsonaro, vamos pensar sem emoção... agora a esquerda vai culpar quem???? Se Bolsonaro não está mais no poder...reflitam","2023-01-03 13:19:23","1940900813.0","2023-01-03","13:19:23"
"6589","A VERDADE SEMPRE APARECE:
Pensem aqui comigo só uma coisinha...pelo amor de Deus...usando a lei...quem pode pedir apoio das forças armadas se caso entrar um KOS....

Os 3 poderes

O único poder que tirou o socialismo em todos os países adivinha quem foi ?????

Ou acham que lotando a esplanada o Lula vai sair ou vai ligar se tiver milhões de pessoas nas ruas??? Já fizemos isso e nada...temos que lotar os quartéis e exigir de forma enfática que eles se movimentem...as forças armadas não são só alguns generais e em 64 foi um de 2 repitooooo 2 estrelas que começou tudo

Pesquisem

Porque as forças armadas estão de prontidão??? Porque as forças armadas foram sucateadas pelo PT... É PORQUE ELES SABEM QUE SOMENTE ELES TEM O PODER

Não podemos ficar na inércia

Temos que fazer algo

E tem que ser em conjunto

Parar os caminhões

E ir as forças armadas

3 coisas podemos fazer

Sem desordem

Não precisamos parar vias isso é crime e vamos se fuder

Não vamos por o nosso na reta mas fazer direito

Caminhoneiros parar
Agro parar
E porta dos quartéis e pedir direito

Dar nomes aos bois

Em casa QG fazer grupos e ter audiência com os que tem o poder

Lotar QGS

E falar teti a teti com o 4 estrelas

Pedir uma agenda do povo com cada um desses e ver no que dá...e quando for aceito essa audiência, LOTAR O LUGAR...TEMOS QUE FORÇAR ELES A AGIR COM DADOS E MOSTRAR TUDO QUE ELES JÁ SABEM","2023-01-03 13:36:31","1940900813.0","2023-01-03","13:36:31"
"6590","Empresa de direita
YPE","2023-01-03 13:37:57","2093791884.0","2023-01-03","13:37:57"
"6591","Boicotar :
Natura
Renner
Boticario
Magasine Luiza","2023-01-03 13:38:35","2093791884.0","2023-01-03","13:38:35"
"6594","Ouvi opiniões de cientistas políticos que dizem que isso não procede, a posse pode ser fake mas o General Heleno não está no comando de nada, no momento. Vamos confiar que possa haver algum levante para derrubar esses canalhas.","2023-01-03 13:46:49","1919325689.0","2023-01-03","13:46:49"
"6610","https://t.me/TudoEhEnergia?livestream","2023-01-03 16:13:23","5518601515.0","2023-01-03","16:13:23"
"6596","Exatamente!
É que como queremos muito alguma coisa a gente acaba acreditando naquilo que quer. Tenho esperança e fé que vamos ter algo bom, mas precisaremos lutar contra o que está aí, não foi suficiente a resistência desses mais de 60 dias. Será preciso algo maior, pelo que tudo indica. Sem dinheiro entrando nos cofres públicos eles vão ""morrer de fome"" antes do povo","2023-01-03 14:02:43","1919325689.0","2023-01-03","14:02:43"
"6597","https://t.me/TudoEhEnergia?livestream","2023-01-03 14:55:51","5518601515.0","2023-01-03","14:55:51"
"6598","https://t.me/TudoEhEnergia?livestream","2023-01-03 15:07:31","5518601515.0","2023-01-03","15:07:31"
"6602","https://t.me/TudoEhEnergia?livestream","2023-01-03 15:35:21","5518601515.0","2023-01-03","15:35:21"
"6603","https://t.me/TudoEhEnergia?livestream","2023-01-03 15:46:44","5518601515.0","2023-01-03","15:46:44"
"6604","Isso é fake. Quem tá no poder é os demônios comunistas mesmo. Ninguém normal acredita mais nisso.","2023-01-03 15:48:29","530356917.0","2023-01-03","15:48:29"
"6605","Ele está nos EUA pela segurança dele","2023-01-03 15:50:29","1096859749.0","2023-01-03","15:50:29"
"6611","https://www.instagram.com/reel/Cm9JnoxhN8p/?igshid=MDJmNzVkMjY=","2023-01-03 16:13:37","1530071146.0","2023-01-03","16:13:37"
"6612","https://www.instagram.com/reel/Cm7pqFYhD0w/?igshid=MDJmNzVkMjY=","2023-01-03 16:24:42","1530071146.0","2023-01-03","16:24:42"
"6613","Sugestão em tempos sombrios:
1. Importante dolarizar parte do patrimônio e ficar atento aos gastos pessoais, podemos ter um tempo muito tempestuoso, que pode se estender por anos e anos;
2. Mais cuidado ainda com textos e postagens que possam configurar crime - estão criando um órgão para aprofundar a perseguição já existente;
3. Focar só em informar os amigos sobre coisas importantes, de preferência enviando junto links (no Foice Book, Instagram, WhatsApp e Youtube) - diminuir ao máximo a parte lúdica nessas redes vermelhas conspiradoras e censuradoras;
4. Dar toda atenção ao Twitter. Agora o Musk quer dar mais espaço aos conservadores e está sendo boicotado pelos lacradores - podemos e devemos ajudar. Seria bom, ter mais inscritos, curtidas, compartilhamentos, comentários...;
5. Entrar em outras redes como o Telegram, Gttr... também é recomendável;
6. Apoiar patriotas como o Hang e boicotar comunistas também é interessante.
7. Quem achar importante, favor repassar para as pessoas que gostem, pode fazer a diferença para ela.","2023-01-03 17:39:05","5061614003.0","2023-01-03","17:39:05"
"6614","Tentei enviar uns áudios sobre isso pra ca e n consegui. Isso é desinformação da esquerda pra manter o povo calmo. Aconteceu o mesmo nos EUA. Igualzinho... e tem gente lá até hj achando que a tal operação storm vai acontecer... 😓","2023-01-03 18:35:28","1332893822.0","2023-01-03","18:35:28"
"6615","Nah, quem nos dera.","2023-01-03 18:36:53","1332893822.0","2023-01-03","18:36:53"
"6616","Em alguns grupos, o plano é greve geral até novas eleições.","2023-01-03 18:37:40","1332893822.0","2023-01-03","18:37:40"
"6620","E 72 horas começa","2023-01-03 19:18:35","1013368885.0","2023-01-03","19:18:35"
"6621","https://www.bitchute.com/video/eKB2Rj29LeU0/

AQUI HÁ O NOSSO MAIOR PERIGO!!! NÃO PODEMOS RELAXAR, DEVEMOS VIGIAR

Eles querem implementar um tratado da OMS sobre pandemias, que usurpa a soberania constitucional e derruba o poder das nações. É uma tomada de controle comunista globalista. A OMS poderia impor lockdowns, mandados de vacinação, quarentenas... Os bancos centrais não concederão créditos na carteira digital se a pessoa não cumprir os mandados de vacinação.","2023-01-03 19:35:06","1760840683.0","2023-01-03","19:35:06"
"6622","Assista a ""Tarde de terça-feira patriótica em Brasília (03/01) - 65° dia de resistência civil!"" no YouTube
https://youtube.com/watch?v=9aAoxFc4krc&si=EnSIkaIECMiOmarE","2023-01-03 19:35:46","5518601515.0","2023-01-03","19:35:46"
"6623","https://t.me/+IEVCFQq6Tx0zYmYx","2023-01-03 20:17:27","5616094867.0","2023-01-03","20:17:27"
"6624","Assista a ""FFAA, mentiras, traições e mais! A trama vai além do que você imagina!"" no YouTube
https://youtube.com/watch?v=z60TBMblHCg&si=EnSIkaIECMiOmarE","2023-01-03 20:27:17","5518601515.0","2023-01-03","20:27:17"
"6625","Bom saber, gosto dessa marca.","2023-01-03 21:05:13","580278963.0","2023-01-03","21:05:13"
"6626","Gostei. Vou sugerir também o Bom Perfil, brasileiro e conservador: https://bomperfil.com/","2023-01-03 21:09:51","580278963.0","2023-01-03","21:09:51"
"6628","Seria bom também fazer uma lista dos que são de direita","2023-01-03 21:13:21","1107348047.0","2023-01-03","21:13:21"
"6629","https://www.instagram.com/reel/Cl572RKruE0/?igshid=MDJmNzVkMjY=","2023-01-03 22:31:09","1530071146.0","2023-01-03","22:31:09"
"6630","https://youtu.be/gKs51JeoWrY","2023-01-03 22:34:09","1919325689.0","2023-01-03","22:34:09"
"6631","Um movimento de desobediência civil está surgindo. Que orgulho do povo brasileiro, que não desistiu de fazer justiça!  https://twitter.com/tucabr54/status/1610404920699617281?s=20&t=bHuno__YeOI9_wqZ9KfhHA","2023-01-03 22:49:22","1332893822.0","2023-01-03","22:49:22"
"6633","Me.erra,infeliz!","2023-01-03 23:02:20","1332893822.0","2023-01-03","23:02:20"
"6640","Se as coisas fossem sérias ,justas, transparentes ,certamente ele estaria presente como o real presidente após a sua posse do qual foi eleito legitimamente e foi fraudado descaradamente.lamentavel estarmos passando por este golpe esquerdista tenebroso. E não sei como a família do atleta do século passado permitiu um larápio  entrar por lá.","2023-01-03 23:11:38","1096859749.0","2023-01-03","23:11:38"
"6647","Só se for ovos podres ,ovos cenográficos. Não desperdiçam alimentos","2023-01-03 23:53:20","1096859749.0","2023-01-03","23:53:20"
"6648","O foco aqui é listar empresas sem amor a pátria brasileira q merecem boicote","2023-01-03 23:54:19","1096859749.0","2023-01-03","23:54:19"
