"message_id","message","message_utc","from_id","date","time"
"236233","E se tiver uma bandeira em casa vai ser crime","2023-01-02 01:09:08","1938348988.0","2023-01-02","01:09:08"
"236234","Vamos chegar nesse ponto","2023-01-02 01:09:15","1938348988.0","2023-01-02","01:09:15"
"236235","Chip","2023-01-02 01:09:25","1938348988.0","2023-01-02","01:09:25"
"236236","Estão vamos ser chipados","2023-01-02 01:09:38","1938348988.0","2023-01-02","01:09:38"
"236237","Se é que já não fomos com a vacina","2023-01-02 01:09:49","1938348988.0","2023-01-02","01:09:49"
"236238","fomos nao, eu nao tomei e nem vou tomar, e quero ver quem me obrigue","2023-01-02 01:10:17","5181473836.0","2023-01-02","01:10:17"
"236239","O bom que a esquerda não tem do dos petistas então eles vão s3 ferrar tanbem","2023-01-02 01:10:21","1938348988.0","2023-01-02","01:10:21"
"236240","Eu tomei","2023-01-02 01:10:29","1938348988.0","2023-01-02","01:10:29"
"236241","Porque fui obrigada no trabalho","2023-01-02 01:10:36","1938348988.0","2023-01-02","01:10:36"
"236242","A administração me pedio a carteira","2023-01-02 01:10:51","1938348988.0","2023-01-02","01:10:51"
"236243","Tomei 2 neguei a 3","2023-01-02 01:10:59","1938348988.0","2023-01-02","01:10:59"
"236244","Mas agora vamos ser literalmente obrigados","2023-01-02 01:11:13","1938348988.0","2023-01-02","01:11:13"
"236245","eu dizia isso no face, o que me deixava menos triste era saber que quem votou nos 9 dedos tb ia se fuder igual, bando de pobre pau no cu do caralho","2023-01-02 01:11:18","5181473836.0","2023-01-02","01:11:18"
"236246","Vão tentar prender presidente","2023-01-02 01:11:21","1938348988.0","2023-01-02","01:11:21"
"236247","O que vamos fazer vamos ficar parados","2023-01-02 01:11:35","1938348988.0","2023-01-02","01:11:35"
"236248","Vão se ferrar do mesmo jeito","2023-01-02 01:11:57","1938348988.0","2023-01-02","01:11:57"
"236249","Porque pra eles independente","2023-01-02 01:12:06","1938348988.0","2023-01-02","01:12:06"
"236250","obrigados porque, ninguem vai aplicar nada que eu nao queira","2023-01-02 01:13:01","5181473836.0","2023-01-02","01:13:01"
"236251","🤣🤣🤣nossa até as mentes brilhantes deu tilte","2023-01-02 01:13:08","1106971957.0","2023-01-02","01:13:08"
"236252","eles podem fazer lei pra nao viajar etc de nao estudar","2023-01-02 01:13:24","5181473836.0","2023-01-02","01:13:24"
"236253","de nao entrar em locais publicos","2023-01-02 01:13:31","5181473836.0","2023-01-02","01:13:31"
"236254","Sim e de não comprar comida","2023-01-02 01:13:50","1938348988.0","2023-01-02","01:13:50"
"236255","De não usar hospital publicos","2023-01-02 01:14:10","1938348988.0","2023-01-02","01:14:10"
"236256","ai vou ser ladrao, no brasil nao da mais cadeia mesmo, vou deixar de falar a verdade, pq falar a verdade que é crime","2023-01-02 01:14:32","5181473836.0","2023-01-02","01:14:32"
"236257","Tudo eles vão te sufocar até tomar","2023-01-02 01:14:32","1938348988.0","2023-01-02","01:14:32"
"236258","vamos fazer a balburdia kkkk","2023-01-02 01:14:42","5181473836.0","2023-01-02","01:14:42"
"236259","Sim jeito e roubar e matar e destruir","2023-01-02 01:14:51","1938348988.0","2023-01-02","01:14:51"
"236260","Aí vc tem paz ✌️","2023-01-02 01:14:58","1938348988.0","2023-01-02","01:14:58"
"236261","E não é perseguido e vítima da sociedade","2023-01-02 01:15:18","1938348988.0","2023-01-02","01:15:18"
"236262","Vamos pegar 10 placas e evadir mercado","2023-01-02 01:15:43","1938348988.0","2023-01-02","01:15:43"
"236263","Evadir propriedades não vamos mas pagar aluguel","2023-01-02 01:16:01","1938348988.0","2023-01-02","01:16:01"
"236264","🤔","2023-01-02 01:16:17","1938348988.0","2023-01-02","01:16:17"
"236265","😃","2023-01-02 01:16:31","2044831983.0","2023-01-02","01:16:31"
"236267","Vamos nas casas banhia sai com tv de 70 polegadas","2023-01-02 01:17:09","1938348988.0","2023-01-02","01:17:09"
"236268","Vamos sim somos vítimas da sociedade","2023-01-02 01:17:32","1938348988.0","2023-01-02","01:17:32"
"236269","Parece mentira né mas é que tá acontecendo","2023-01-02 01:18:57","1938348988.0","2023-01-02","01:18:57"
"236270","😂","2023-01-02 01:19:05","1938348988.0","2023-01-02","01:19:05"
"236271","🌩

🤣🤣🤣🤣🤣🤣","2023-01-02 01:19:18","1482262322.0","2023-01-02","01:19:18"
"236285","Esse rapaz tá na droga pesada","2023-01-02 01:43:47","1341039192.0","2023-01-02","01:43:47"
"236274","🌩

🤣🤣🤣🤣🤣🤣🤣","2023-01-02 01:20:05","1482262322.0","2023-01-02","01:20:05"
"236275","Bom eu não acredito","2023-01-02 01:22:13","1938348988.0","2023-01-02","01:22:13"
"236276","Nessas coisas mas","2023-01-02 01:22:18","1938348988.0","2023-01-02","01:22:18"
"236277","Parece brincadeira","2023-01-02 01:22:29","1938348988.0","2023-01-02","01:22:29"
"236278","Primeiro brotou um dedo mula morreu","2023-01-02 01:22:43","1938348988.0","2023-01-02","01:22:43"
"236298","Amanhã nosso presidente é general Heleno","2023-01-02 02:36:21","674846621.0","2023-01-02","02:36:21"
"236279","Agora não sobe a rampa certo ✔️ agora a faixa não é verdadeira","2023-01-02 01:23:05","1938348988.0","2023-01-02","01:23:05"
"236280","Agora isso","2023-01-02 01:23:09","1938348988.0","2023-01-02","01:23:09"
"236282","Bora pessoal entra em baixo","2023-01-02 01:23:47","1938348988.0","2023-01-02","01:23:47"
"236284","Parabéns nosso novo presidente general Heleno","2023-01-02 01:43:01","674846621.0","2023-01-02","01:43:01"
"236287","Go","2023-01-02 01:50:46","674846621.0","2023-01-02","01:50:46"
"236288","Já deixei de seguir","2023-01-02 01:50:48","5095331389.0","2023-01-02","01:50:48"
"236292","Cara para de usar suas drogas estragada sua cocaína misturada com pó Royal, volta pra terra vc tá em Marte...","2023-01-02 02:17:02","5695691110.0","2023-01-02","02:17:02"
"236293","Isso mesmo sou todo de acordo com essa postagem","2023-01-02 02:18:58","5695691110.0","2023-01-02","02:18:58"
"236294","O Valdemar NÃO morreu!!!!","2023-01-02 02:31:11","1040838608.0","2023-01-02","02:31:11"
"236296","Este vídeo explica toda a verdade","2023-01-02 02:35:02","","2023-01-02","02:35:02"
"236299","Cobra vai fumar no STM","2023-01-02 02:36:35","674846621.0","2023-01-02","02:36:35"
"236300","Código fonte","2023-01-02 02:36:41","674846621.0","2023-01-02","02:36:41"
"236301","Cadê vc","2023-01-02 02:36:45","674846621.0","2023-01-02","02:36:45"
"236302","https://www.infomoney.com.br/politica/faixa-presidencial-de-r-55-mil-some-do-palacio-do-planalto-e-governo-abre-sindicancia/","2023-01-02 02:39:35","146087463.0","2023-01-02","02:39:35"
"236304","Esquece tribunal internacional olha a África 90% ou toda é ditadura mais feroz que a Venezuela e não acontece nada","2023-01-02 02:43:32","1407369014.0","2023-01-02","02:43:32"
"236305","Stm nosso tribunal militar","2023-01-02 02:44:01","674846621.0","2023-01-02","02:44:01"
"236306","Tinha que ser em esfera militar pra ser julgado lá","2023-01-02 02:44:24","674846621.0","2023-01-02","02:44:24"
"236307","E apartir de hj Heleno assumiu comando do Brasil em esfera militar","2023-01-02 02:44:54","674846621.0","2023-01-02","02:44:54"
"236308","Agora militar por militar","2023-01-02 02:45:12","674846621.0","2023-01-02","02:45:12"
"236309","Em caráter de glo","2023-01-02 02:45:21","674846621.0","2023-01-02","02:45:21"
"236310","Gente e a dilma alguém viu","2023-01-02 02:46:06","1938348988.0","2023-01-02","02:46:06"
"236311","Ela tanbem esta sumida","2023-01-02 02:46:14","1938348988.0","2023-01-02","02:46:14"
"236313","Ela estava lá","2023-01-02 02:46:46","","2023-01-02","02:46:46"
"236315","Então tá","2023-01-02 02:47:20","674846621.0","2023-01-02","02:47:20"
"236316","Amanhã daqui a pouco vamos ver","2023-01-02 02:47:28","674846621.0","2023-01-02","02:47:28"
"236317","Só assim resolve","2023-01-02 02:47:32","","2023-01-02","02:47:32"
"236318","Eu não reconheço lula como meu presidente","2023-01-02 02:48:30","674846621.0","2023-01-02","02:48:30"
"236320","Brasil tem que fazer isso","2023-01-02 02:49:18","1121263831.0","2023-01-02","02:49:18"
"236321","Vídeo de Dra. Sanara Lopes","2023-01-02 02:55:35","1027244452.0","2023-01-02","02:55:35"
"236322","Agora eu acredito que não terminou!","2023-01-02 02:59:15","","2023-01-02","02:59:15"
"236326","🙏🙏🙏🙏🙏🙏🇧🇷🇧🇷🇧🇷🇧🇷🇧🇷","2023-01-02 03:02:35","928289598.0","2023-01-02","03:02:35"
"236328","Não dá pra botar fé nesse povo doido","2023-01-02 03:07:32","","2023-01-02","03:07:32"
"236330","Ok vc está certo. Eu cometi um erro. Não tem outra forma","2023-01-02 03:10:09","674846621.0","2023-01-02","03:10:09"
"236331","Responsabilidade é de cada um é nossa. Vamos arrancar esses povo de lá","2023-01-02 03:10:58","674846621.0","2023-01-02","03:10:58"
"236332","*☝️Esse arquivo dos anos 80 foi ""enterrado"" pela Rede Globo a pedido do PT que pagou uma grana para enterrarem. Porém,havia uma cópia que vazou e temos que divulgar a todos os brasileiros. Não esconda essa sujeira.*","2023-01-02 03:18:54","942041637.0","2023-01-02","03:18:54"
"236333","👏","2023-01-02 03:19:39","1439098111.0","2023-01-02","03:19:39"
"236334","https://youtu.be/odsEl5rnDp8","2023-01-02 03:25:17","1372584255.0","2023-01-02","03:25:17"
"236335","Áudio de Claudete De Souza

✅ Sigam nosso canal @nocentrodopoder e fiquem por dentro dos bastidores da política.","2023-01-02 03:46:05","1835182149.0","2023-01-02","03:46:05"
"236336","SEGUIMOS O GRANDE BAILE E AS MINISSÉRIES 🇧🇷👊🏼

✅ Sigam nosso canal @nocentrodopoder e fiquem por dentro dos bastidores da política.","2023-01-02 03:50:29","1835182149.0","2023-01-02","03:50:29"
"236338","lembro como se fosse hoje bem antes do bolsonaro fazer sua live, eu disse uma vez, ele nao vai fazer nada e quando sair vai dizer, agora é com vcs, eu fiz a minha parte e nao posso fazer mais nada... ai veio um monte de gente pedindo pra me excluir que eu era petista infiltrado, ta ai, eu uso a psicologia pura que as pessoas me dao ao expressar qualquer tipo de palavra, nelas eu sei quando o cara tem coragem e vai fazer alguma coisa, eu sentia que nao iam fazer nada pela gente, tanto pela segurança nas palavras do cabeça de piroca e quanto as movimentações dos ministros do STM, quando vi que tinha uns idiotas la dentro, e ai tive a certeza quando na diplomação do Ladrao o presidente do STM esta naquele show de horror, foi ai que tive a absoluta certeza que ja tinha tudo acabado, mas mesmo assim queria nutrir alguma esperança, fui criticado quando falei que nos de direita estavamos fazendo fogo amigo, enquanto a esquerda se une e atira na direita e nunca neles mesmo, muita gente preocupado com aqueles que falavam que tinha que invadir tudo, era um ponto de vista de outro angulo mas de gente nossa, e o que deu errado foi isso, muita gente criticando a propria direita, ai muitos desanimaram e voltaram pra casa, como  pode eu ser um jogador dentro de campo onde só eu dou o sangue pelo meu time, com certeza a derrota é certa, mas enfim, se o povo em massa nao tiver medo do sistema, cada eleitou que votou no bolsonaro saissem as ruas e lutassem pelos seus direitos, mas nao tem animo e nem coragem, tudo querem na paz, e na paz nunca terão. só se faz omeltes quebrando os ovos...","2023-01-02 04:21:53","5181473836.0","2023-01-02","04:21:53"
"236339","RECADO: Mandem nos grupos!","2023-01-02 04:28:58","1407369014.0","2023-01-02","04:28:58"
"236343","gente eu nao acredito que o Brasil vai parar, quando foi pedido pra para a primeira vez muitos pararam e se fuderam, exemplo sao os caminhoneiros, e vcs acreditam que isso vai resolver agora que nao temos mais o governo do nosso lado?  espero estar errado","2023-01-02 04:34:49","5181473836.0","2023-01-02","04:34:49"
"236344","Se atentem a isso 🤣🤣🤣 mais fake impossível 🙅‍♀️","2023-01-02 04:37:34","1407369014.0","2023-01-02","04:37:34"
"236345","Agora Agora a água já batendo na bunda ou vai ou racha","2023-01-02 04:39:15","1407369014.0","2023-01-02","04:39:15"
"236346","gente prestem atenção nesse video que o cara disse sobre a glo estar funcionando e que o STM deu ao Xandão prazo pra responder, gente nao caiam nesse, parem de viver de esperanças vazias, isso só esta fazendo mau ao país, vamos juntar nossas forças e sair todos e parar o país, só assim poderemos ter esperança de algo, mas temos que levantar até os covardes, temos que dar animos que só nossa luta sem depender mais de ninguem, vamos cobrar o que a constituição nos garante, o poder emana do povo","2023-01-02 04:41:04","5181473836.0","2023-01-02","04:41:04"
"236347","Pq o ladrão não assinou no livro em de umas folhas?","2023-01-02 04:41:12","1407369014.0","2023-01-02","04:41:12"
"236348","SUJEIRA E IMUNDÍCIE - A CARA DA ESQUERDA..

🇨🇳🐀🐀🐀👺🇨🇳🔥

Gente feia, com aparência suja e mal educada. Os parasitas sujaram tudo por onde passaram. Por onde a esquerda passa, sempre há um rastro de imundície. 

🐀🐀🐀🇨🇳👺🔥","2023-01-02 04:41:18","1104071748.0","2023-01-02","04:41:18"
"236349","https://youtu.be/FLW-twS0jVM","2023-01-02 04:44:30","1101305340.0","2023-01-02","04:44:30"
"236350","eu tenho tanto odio de petista que se o pais virar uma cuba eu vou amar demais....","2023-01-02 04:45:03","5181473836.0","2023-01-02","04:45:03"
"236351","POSSE FAKE 

🇨🇳🐀🐀🐀👺🔥

Lula não subiu a rampa do palácio do Alvorada. Subiu a rampa do congresso; A faixa presidencial também foi uma cópia nada original. Não teve a presença dos comandantes das Forcas Armadas. Haviam  apenas oficiais aspirantes. Os tradicionais tiros de canhão também não aconteceram e Lula fingiu ignorar os militares, parecia assustado. Lula não foi para a residência presidencial, voltou para o hotel onde estava hospedado. Posse nada tradicional.

🇨🇳🐀🐀🐀👺🔥","2023-01-02 04:50:44","1104071748.0","2023-01-02","04:50:44"
"236352","https://twitter.com/Silvana76152511/status/1609709088845500416?t=uTIaQ_yGLrx22DjicwNylg&s=35","2023-01-02 04:58:12","1372584255.0","2023-01-02","04:58:12"
"236354","gente a posse foi real, a faixa era real, e tudo é mera simbologia, nao existe a rampa certa protocolada e nem a faixa protocolada, tudo mera simbologia, e aconteceu aos olhos de todos, em toda rede nacional de televisao pro Brasil e alguns teles jornais do mundo, parem de achar que foi tudo fantasia porque nao foi, agora dizer que ele tem o direito de ser presidente ja é outra coisa, ele nao foi eleito pelo povo e sim pela minoria odiosa e pelo TSE e o STF que faziam parte do time do larapio, tem gente dizendo que essa semana o STM vai intervir, balela, gente nao vai acontecer mais nada, só a tora vai entrar no nosso rabo direitinho, a gente tem que ser soldados da nação, ja os que tem a arma nao deram conta, agora temos que ser soldados com sangue nos olhos, deixar as crianças, os idosos e as mulheres em casa e sair pra guerra, pra vencer ou vencer. Temos que mostrar pra esses bandidos quem é que manda no Brasil","2023-01-02 04:59:26","5181473836.0","2023-01-02","04:59:26"
"236359","RECADO: Mandem nos grupos!","2023-01-02 06:20:51","5695691110.0","2023-01-02","06:20:51"
"236360","SELVA BRASIL OFICIAL
https://t.me/selvabrasiloficial","2023-01-02 07:52:27","1482262322.0","2023-01-02","07:52:27"
"236361","V","2023-01-02 09:15:08","869334105.0","2023-01-02","09:15:08"
"236362","👏👏👏👏👏👏👏","2023-01-02 09:22:38","879754668.0","2023-01-02","09:22:38"
"236364","Tem guru para tudo","2023-01-02 09:36:47","1985974744.0","2023-01-02","09:36:47"
"236365","https://horabrasilia.com.br/lula-ignora-continencia-das-forcas-armadas-em-cerimonia-de-posse/","2023-01-02 09:49:43","971558196.0","2023-01-02","09:49:43"
"236366","A FORTE REVELAÇÃO DE CARLOS BOLSONARO...
https://www.jornaldacidadeonline.com.br/noticias/45023/a-forte-revelacao-de-carlos-bolsonaro
Coisas que precisam ser ditas...","2023-01-02 10:33:35","1482262322.0","2023-01-02","10:33:35"
"236367","Isso é sua opinião. O cara ladrão não subiu na alvorada...tem simbolismo melhor que esse? O cidadão tá proibido de entrar no Alvorada. A coisa tá sinistra....
Compactuo com o mesmo esforço de luta seu, se for preciso que lutemos.

A verdade é que ninguém sabe de nada, a manobra é na surdina. O Júlio é gente boa e tá na luta também, mas diversas vezes entra em desespero e diz que tá tudo acabado...quem puder vai embora do Brasil etc...depois chega junto e se enche de esperança. É um ser humano igual a todos nós.

A esperança está findando...mas é a última que morre.","2023-01-02 10:36:04","1304299618.0","2023-01-02","10:36:04"
"236369","Bha meu vocês está brincando intelectual das pessoas , onde que aconteceu?","2023-01-02 10:47:09","1985974744.0","2023-01-02","10:47:09"
"236370","Onça já bebeu tanta água que está com a barriga inchada","2023-01-02 11:17:57","900411207.0","2023-01-02","11:17:57"
"236373","👆 *01/01/23 - A VERDADE APARECENDO! CONFIEM NO PRESIDENTE E NAS FA !* *POR ISSO TODO ESSE TEATRO NA POSSE DO LADRÃO,  PRECISAVA CONSUMAR O CRIME...* 👍😉😉","2023-01-02 11:21:55","871708172.0","2023-01-02","11:21:55"
"236375","Lembra da foto dos caixões de Bergamo, na Itália, em março de 2020, que aterrorizou o mundo e contribuiu para o Lockdown? Também era falso:


Visitem nosso canal: @cristaospelapatria","2023-01-02 11:45:02","871708172.0","2023-01-02","11:45:02"
"236376","Nem quero me iludir mais, a tristeza é grande demais, só peço à Deus pra nós socorrer 😥","2023-01-02 12:11:26","1121263831.0","2023-01-02","12:11:26"
"236377","Tem que atacar o coração","2023-01-02 12:19:40","1240626374.0","2023-01-02","12:19:40"
"236378","Preço dos combustíveis sendo atualizados com sucesso. Daqui pra frente tudo vai aumentar vertiginosamente! 

Que comece o retrocesso no Brasil… faz o “L”.","2023-01-02 12:27:06","1330622206.0","2023-01-02","12:27:06"
"236379","Ainda há esperança. Um restinho na panela, mas tem","2023-01-02 12:30:12","1004286695.0","2023-01-02","12:30:12"
"236380","A manipulação do jornazismo.","2023-01-02 12:30:54","1330622206.0","2023-01-02","12:30:54"
"236382","👍","2023-01-02 12:30:55","1004286695.0","2023-01-02","12:30:55"
"236383","#meme","2023-01-02 12:35:12","1330622206.0","2023-01-02","12:35:12"
"236384","Se atentem nesses detalhes! Nada que foi feito até agora,foi em vão! NÃO ESQUEÇAM QUE NOSSO PRESIDENTE É ESTRATEGISTA!!!!","2023-01-02 12:37:03","1210228155.0","2023-01-02","12:37:03"
"236386","Vídeo de Imperial Modas","2023-01-02 12:46:10","1630937017.0","2023-01-02","12:46:10"
"236392","Errado a Vitória já é nossa gel Heleno que esta governando o Brasil apartir do 01 de janeiro , a posse do ladrão foi uma farsa,feke","2023-01-02 13:54:13","970391972.0","2023-01-02","13:54:13"
"236387","Pior que aguentar alguém dizer que a esquerda é astuta, é ver gente de direita permitir que zombem da nossa inteligência !
Juntos somos gigantes!","2023-01-02 13:08:08","1263401726.0","2023-01-02","13:08:08"
"236388","Falta União, pensamento único, mesma direção de nós de DIREITA","2023-01-02 13:10:50","2064286223.0","2023-01-02","13:10:50"
"236389","Melhor está por vir ele disse
Melhor está por vir ele disse
Melhor está por vir ele disse
Melhor está por vir ele disse","2023-01-02 13:25:11","1482262322.0","2023-01-02","13:25:11"
"236390","Para de iludir","2023-01-02 13:45:34","1985974744.0","2023-01-02","13:45:34"
"236391","Vamos para ação","2023-01-02 13:45:44","1985974744.0","2023-01-02","13:45:44"
"236410","Digo isso pois foi homologado enquanto bolsonaro era presidente, e nesse processo estão detalhado todos os crimes","2023-01-02 15:26:05","5250117936.0","2023-01-02","15:26:05"
"236393","Temos que acreditar até o final, pq o presidente nos honrou em todos os momentos,não seria agora que ele iria lavar as mãos...vamos parar nos atentar aos detalhes....","2023-01-02 13:56:52","928289598.0","2023-01-02","13:56:52"
"236394","🇧🇷🤔🇧🇷🤔

Magnífico! Não sei quem criou este vídeo mas posso dizer que é um gênio. Para os que ainda não entenderam o ""SISTEMA"", prestem atenção e assistam até o fim. Depois ajam com inteligência para se posicionar e lutar pelo nosso País.

@GeFazioBreakingNews🇧🇷","2023-01-02 14:12:52","970391972.0","2023-01-02","14:12:52"
"236395","Ele avisou 🚫🖕⚒","2023-01-02 14:18:44","796861959.0","2023-01-02","14:18:44"
"236396","Para não irem para o paredão como traição eles aceitaram esse teatro","2023-01-02 14:22:47","2064286223.0","2023-01-02","14:22:47"
"236399","Alguém  acredita ainda ???","2023-01-02 14:23:26","1522381634.0","2023-01-02","14:23:26"
"236400","Tudo farinha do mesmo saco","2023-01-02 14:23:41","5617419970.0","2023-01-02","14:23:41"
"236401","Esse é maçon 
Rasgaram as calças e depois o toba dele","2023-01-02 14:27:23","5617419970.0","2023-01-02","14:27:23"
"236402","Sim acreditamos porque já vencemos é questão de horas, dias é preciso Crer para ver e não ver para crer","2023-01-02 14:28:10","970391972.0","2023-01-02","14:28:10"
"236403","Porquê eles ainda não soltaram uma nota sobre isso? Tinham que ter respeito pelo povo sofrendo em frente aos quartéis. Têm muitos, milhões que ficam no conforto de suas casas, publicando para ficar em frente aos QGS e não foram nem um dia. Por mim, é partir pra bloquear estradas a cada 5 km, travar tudo! Aí, dúvido não ter INTERVENÇÃO FEDERAL para manter a lei e a ordem. 🇧🇷🇧🇷🇧🇷🇧🇷🇧🇷🙏👆","2023-01-02 14:28:20","1855305452.0","2023-01-02","14:28:20"
"236404","Todos jogos da seleção, fiquei em frente aos QGS, familiares e colegas alienados na distração ficaram com a decepção da eliminação. Porém, minha alegria era de ver o povo lutando conta o comunismo e socialismo. Más, quando o bicho pegar! Quem tiver condições vão se mudar, e 90% da população que não têm condições, sofrerá.","2023-01-02 14:40:17","1855305452.0","2023-01-02","14:40:17"
"236405","Não precisa queimar pneus, só alguns caminhões levarem entulho e despejar nas vias a cada 5 km. Sei que vai prejudicar e até causar mortes, porém numa guerra, se tiver confronto, sempre haverá vítimas inocentes. Faz parte.🇧🇷🇧🇷🇧🇷🇧🇷🇧🇷🙏👆","2023-01-02 14:50:07","1855305452.0","2023-01-02","14:50:07"
"236406","Tomará que seja isso de fato!","2023-01-02 14:57:20","973524861.0","2023-01-02","14:57:20"
"236407","Será que existe alguma forma de recorrer dessa decisão? Já que eles seguem as 4 linhas da constituição","2023-01-02 15:23:12","5250117936.0","2023-01-02","15:23:12"
"236408","Deve ter pois nas cíveis existe","2023-01-02 15:23:57","5250117936.0","2023-01-02","15:23:57"
"236409","01/01/2023 – QG de Brasília

Escute com atenção, este vídeo. Ele está nos passando uma mensagem, cujas palavras foram elaboradas pelo próprio General Heleno.

Ouçam o que ele está dizendo:
O nosso General Augusto Heleno tinha que ser exonerado do vínculo do GSI. Isto para poder assumir o cargo de maior competência. E assim, continuando a estratégia necessária, estando no cargo de Ministro Chefe do Ministério da Defesa. E isto está valendo a partir de hoje, dia 01 de janeiro.

A explicação para isto é porque em Direito Administrativo, não se pode acumular cargos públicos, como o próprio Mourão relatou que estamos sob Novo Regime.

Então Patriotas valentes, não parar, não precipitar, não retroceder, isso é tudo. Com advertência suplementar de que precipitar é retroceder.

Deus, Pátria, Família e Liberdade! Selva!
Nossa Vitória Está a Caminho!

Finalizando, o General Augusto Heleno é o Ministro Chefe do Estado da Defesa.

Assista ao vídeo e conheça o nosso Canal Telegram BUSCADOR DE VERDADE
Clique Aqui Para Assistir ao Vídeo","2023-01-02 15:24:03","971457906.0","2023-01-02","15:24:03"
"236411","Se desse certo, esse seria um bom caminho para o exército se reparar pelo que fizeram","2023-01-02 15:27:57","5250117936.0","2023-01-02","15:27:57"
"236413","ALEXANDRE DE MORAES DE PRAZO DE 24 HORAS PARA ENTREGAR O CÓDIGO FONTE .... NO SUPREMO TRIBUNAL MILITAR. - ATÉ SEGUNDA FEIRA AS 23H59","2023-01-02 15:50:17","1482262322.0","2023-01-02","15:50:17"
"236415","É um enigma pra resolver","2023-01-02 15:53:52","5617419970.0","2023-01-02","15:53:52"
"236416","🍆👌🇧🇷 decifra esse aqui","2023-01-02 15:54:23","5617419970.0","2023-01-02","15:54:23"
"236417","Mas como saber que é sobre o código fonte?","2023-01-02 16:00:08","5250117936.0","2023-01-02","16:00:08"
"236418","Força armadas só pintar meio fio me prove acontrario","2023-01-02 16:06:10","1985974744.0","2023-01-02","16:06:10"
"236419","não tem prazo nenhum gente, acabou, perdemos, nós somos manés, a esquerda maldita venceu a guerra, temos que nos fortalecer agora e fazer como a esquerda, se unir, e nao ficar tendo varias direitas, onde uma ataca a outra por divergencia de pensamentos... infelizmente é isso, se tivesse que mudar algo, isso teria ja acontecido depois da posse do ladrão, ja se passa do meio dia subsequente a posso e nada ocorreu, vamos esperar agora até quando, qual será o proximo enigma, eu sempre achei quando se deixa pro final as coisas ficam muito mais dificeis de se concretizar, o time errado, as ações teriam que ter começado a muito tempo, e todo mundo pensando que tinha estratégia, que o jogo de xadrez e o cheque mate viria, veio a rola grossa pra entrar nos nossos tobas isso sim.... vivi esse tempo todo segundo a segundo atento a toda e qualquer movimentação da direita, da esquerda, do judiciario, dos politicos e só tenho essa analise mesmo, perdemos manés","2023-01-02 16:09:51","5181473836.0","2023-01-02","16:09:51"
"236420","Tenho sugestões para isso","2023-01-02 16:12:06","1985974744.0","2023-01-02","16:12:06"
"236421","Papo estranho parece esquerdista","2023-01-02 16:19:07","233020832.0","2023-01-02","16:19:07"
