"message_id","message","message_utc","from_id","date","time"
"5064","Though manipulation with color. 
Ukraine flag colors everwhere on all media and signs. 
Even health facilities. 
This is nothing new.","2022-11-17 01:21:43","1514603086","2022-11-17","01:21:43"
"5065","They are fucking with you.
Pay attention to backdrops and the color..its all to manipulate thought..ever wonder why taxis are yellow..its an inviting color..they figured this shit out along time ago..it is science in itself..many rapes but taxi drivers..tech changes with cameras and barriers..dont pay the fare and you ain't getting out. 
So every taxi is a mini prison now with alert light and panic buttons.  .
Normality is a myth.","2022-11-17 01:29:44","1514603086","2022-11-17","01:29:44"
"5066","The fox scumbags censored vaccine savior trumps speech 
Of his declaration of running again..news max aired it in its entirety..
No one should be censored 
Speech suppression can not be tolerated. Everything is fake as  we know anyway. 
Take everything with a grain salt.
It's all for entertainment purposes. Internal detainment of you thoughts..we know the end goal..they know all their shit will fail..its to save us from eating ourselves..
Literally. 
Unfortunately the human meat shit is again, nothing new .
I'm going to make finger sandwiches now.","2022-11-17 01:41:41","1514603086","2022-11-17","01:41:41"
"5067","You can order children from Walmart..easy peasy.","2022-11-17 01:43:29","1514603086","2022-11-17","01:43:29"
"5068","THE ETHICS OF THE WALVAX-2 CELL STRAIN « Nebraska Coalition for Ethical Research. Human Baby Cell In Childhood and Adult Vaccines.","2022-11-17 02:37:56","1623367056","2022-11-17","02:37:56"
