"message_id","message","message_utc","from_id","date","time"
"4993","What has Daylight Saving got to do with Freemasonry? – Camden Place Lodge No.3042
https://camdenplacelodge.org/2021/04/26/what-has-daylight-saving-got-to-do-with-freemasonry/","2022-11-08 03:32:43","1514603086","2022-11-08","03:32:43"
"4994","MY SUCCESS IN THE OPTION MARKET WASN'T PLANNED, BUT TODAY I""M A TRUE DEFINITION OF GRACE,, HAS NEVER FAILED ME, YOU CAN FEEL FREE TO CONTACT @Claude_Markson 

https://t.me/+0dKhQam-1OQxY2E0","2022-11-08 04:46:01","5450029123","2022-11-08","04:46:01"
"4995","Awesome, I have audio! Would love to PROVE its true!","2022-11-08 17:26:58","1266248240","2022-11-08","17:26:58"
