"message_id","message","message_utc","from_id","date","time"
"5050","Diphtheria, tetanus & pertussis – Sudden death. TEXT COPIED FROM  VACCINE SCIENCE REVISITED, FULL DOCUMENT OF VACCINE SCIENCE REVISITED IS AVAILABLE ON THIS CHANNEL.","2022-11-15 19:33:14","1623367056","2022-11-15","19:33:14"
"5048","Politicians have it easy now. Twenty years ago, When Bush and Gore colluded for 9/11, we called coup d'etat, treason. Now people call election fraud and forget that we're dropping the charges from treason.","2022-11-15 13:05:49","1552113836","2022-11-15","13:05:49"
"5051","Live Now
https://youtu.be/M-Ea1hoXk3E
Another cheap harbinger of the New World Order, McKay worked for the Herst Syndicate and romanticized living in fantastic and scary dreams, discouraged lucid and wakeful perception.
He could draw quick, whatever his puppet masters told him to draw. All his creative drive was bent on scheming for the new world order, from Rare Bit Fiends, comic strips about nightmares from eating bread and cheese cooked in beer and named after the pagan hare goddess, rare bit or rabbit, all the way to the sinking of the Lusitania, another New World Order false flag operation fomenting and inciting war like 9/11, Gulf of Tonkin, and Pearl Harbor, all orchestrated if not outright staged by the US government. The German embassy was censored from NYC newspapers, placed giant advertisements warning travelers not to take passage on the Lusitania because it would be bringing weapons through waters in dispute by the war, and none of those advertisements was printed; decades later, the Lusitania was dredged and indeed there were weapons in the hold. The Hearst Syndicate both blocked German warnings AND promoted McKay's animation of the false narrative, beyond yellow journalism and into espionage and treason, deceiving the American people and Congress to war!
A modern examples of a cartoonist similar to McKay's political leanings would be Ernie Colon, a career cartoonist for Marvel/Disney who illustrated an entire graphic novel portraying the government's false narrative on 9/11.","2022-11-15 23:59:18","1552113836","2022-11-15","23:59:18"
