"message_id","message","message_utc","from_id","date","time"
"793","Bilhões de pessoas irão usar Blockchain em breve, diz CEO do Pantera Capital

Dan Morehead – chefe do gerente de ativos institucionais Pantera Capital – acredita que muitos setores financeiros estarão em dificuldades nos próximos anos, mas a indústria de ativos digitais não estará entre eles.

Semelhante a suas declarações anteriores, o executivo argumentou que um bull market das criptomoedas está a caminho,…

https://gazetalibertaria.news/bilhoes-de-pessoas-irao-usar-blockchain-em-breve-diz-ceo-do-pantera-capital/","2022-09-26 00:35:32","572665388","2022-09-26","00:35:32"
"794","A Importância de Ludwig von Mises para a Ciência Econômica

Para começar este texto, antes considero necessária a leitura da seguinte frase:

“Eu li Mises pela primeira vez quando era sênior da CalTech, na graduação de engenharia elétrica. Essa foi uma das principais razões para eu subsequentemente migrar para economia. Lendo Mises depois de 50 anos, fico impressionado com o…

https://gazetalibertaria.news/a-importancia-de-ludwig-von-mises-para-a-ciencia-economica/","2022-09-26 21:01:34","572665388","2022-09-26","21:01:34"
