"message_id","message","message_utc","from_id","date","time"
"223072","Quem aqui sabe fazer audiobook de pdf?","2022-10-23 01:42:42","957689848","2022-10-23","01:42:42"
"223073","Qualquer um com cordas vocais","2022-10-23 01:44:28","898408832","2022-10-23","01:44:28"
"223074","Ou nem isso","2022-10-23 01:44:33","898408832","2022-10-23","01:44:33"
"223075","Dá pra fazer audiobook com voz do tradutor","2022-10-23 01:44:49","898408832","2022-10-23","01:44:49"
"223076","sim","2022-10-23 01:51:24","957689848","2022-10-23","01:51:24"
"223077","Quem aqui sabe fazer audiobook de pdf? Eu passei OCR no pdf.","2022-10-23 01:51:27","957689848","2022-10-23","01:51:27"
"223078","URGENTE: REVISTA OESTE É CENSURADA E NÃO PODERÁ PUBLICAR VÍDEOS NO YOUTUBE POR 7 DIAS.","2022-10-23 05:10:51","1296937683","2022-10-23","05:10:51"
"223079","Foda-se?","2022-10-23 05:11:51","898408832","2022-10-23","05:11:51"
"223080","https://twitter.com/thebias_news/status/1583780928001753088","2022-10-23 06:13:23","108661688","2022-10-23","06:13:23"
"223081","https://twitter.com/rodrigodasilva/status/1583950381763420166","2022-10-23 06:13:24","108661688","2022-10-23","06:13:24"
"223083","Vídeo Censurado pelo STF","2022-10-23 07:33:43","839798010","2022-10-23","07:33:43"
"223086","O CUMPANHERO CAGOU PELA BOCA NESSE VIDEO","2022-10-23 14:23:15","5258502934","2022-10-23","14:23:15"
"223095","Puta que pariu","2022-10-23 16:43:48","552699367","2022-10-23","16:43:48"
"223096","Liguei a tv e vi essa merda","2022-10-23 16:44:09","552699367","2022-10-23","16:44:09"
"223097","Isso vai atrapalhar muito a campanha","2022-10-23 16:44:24","552699367","2022-10-23","16:44:24"
"223098","O frouxo já se manifestou tirando o dele fora kkkk","2022-10-23 16:45:02","351719678","2022-10-23","16:45:02"
"223112","Ué e o que ele tem a ver com isso","2022-10-23 17:13:22","1296937683","2022-10-23","17:13:22"
"223113","Fodase?","2022-10-23 17:13:37","1296937683","2022-10-23","17:13:37"
"223115","Precisamos de mais 1141363 assinaturas. Você pode assinar? ✍️
https://chng.it/77d8gFRc","2022-10-23 17:38:17","108661688","2022-10-23","17:38:17"
"223116","Se tivessem feito a Cpi da lava toga nada disso estaria ocorrendo","2022-10-23 17:41:44","351719678","2022-10-23","17:41:44"
"223118","Se ele não fala nada é 1000 vezes pior","2022-10-23 17:43:21","552699367","2022-10-23","17:43:21"
"223119","Que venha a luta armada","2022-10-23 19:00:15","839798010","2022-10-23","19:00:15"
"223120","Aqui a polícia só sobe com caveirão ou tanque de guerra","2022-10-23 19:00:46","839798010","2022-10-23","19:00:46"
"223121","O BOPE está lá nesse momento","2022-10-23 19:02:07","351719678","2022-10-23","19:02:07"
"223122","Acho q vai dar ruim kk","2022-10-23 19:02:16","351719678","2022-10-23","19:02:16"
"223123","Tá fazendo igual o Tarcisio fez c o Douglas Garcia","2022-10-23 19:05:09","351719678","2022-10-23","19:05:09"
"223124","🔗 “Não tem uma foto dele comigo”, diz Bolsonaro sobre Roberto Jefferson 23.10.22 15:56
...","2022-10-23 19:05:09","351719678","2022-10-23","19:05:09"
"223139","Pelo menos assim eles são retratados nos desenhos","2022-10-23 19:14:13","898408832","2022-10-23","19:14:13"
"223125","Lucas Cezar banido por 3 dias","2022-10-23 19:07:11","969101062","2022-10-23","19:07:11"
"223126","do meu grupo","2022-10-23 19:07:15","969101062","2022-10-23","19:07:15"
"223127","por trollagem","2022-10-23 19:07:20","969101062","2022-10-23","19:07:20"
"223128","Pra quê divulgar isso aqui?","2022-10-23 19:08:53","898408832","2022-10-23","19:08:53"
"223129","Pra todo mundo ver que tipo de pessoas você é","2022-10-23 19:09:09","969101062","2022-10-23","19:09:09"
"223130","Divulga isso na Globo também","2022-10-23 19:09:25","898408832","2022-10-23","19:09:25"
"223140","Ele e outra raça","2022-10-23 19:14:18","969101062","2022-10-23","19:14:18"
"223131","A BOPE acaba de chegar na residência de Roberto Jefferson: https://twitter.com/disangermano/status/1584251809748512768?s=20&t=UgRQQ1N6eb87FlD6hu2ijw

Além disso são 10 viaturas da PF e 10 da PM, além de um helicóptero do corpo de bombeiros","2022-10-23 19:09:26","351719678","2022-10-23","19:09:26"
"223132","E no canal do Felipe Neto","2022-10-23 19:09:35","898408832","2022-10-23","19:09:35"
"223133","Tem o numero da Globo ?","2022-10-23 19:09:37","969101062","2022-10-23","19:09:37"
"223134","Não","2022-10-23 19:09:47","898408832","2022-10-23","19:09:47"
"223135","nao curto aquele mala","2022-10-23 19:09:52","969101062","2022-10-23","19:09:52"
"223137","Aquele cabelo de marciano dele","2022-10-23 19:11:18","969101062","2022-10-23","19:11:18"
"223138","Achei que marcianos fossem carecas","2022-10-23 19:13:50","898408832","2022-10-23","19:13:50"
"223141","Nunca ouviu falar de Boris o menino que veio de Marte ele tem cabelo","2022-10-23 19:14:49","969101062","2022-10-23","19:14:49"
"223142","vou defazer seu bam","2022-10-23 19:15:22","969101062","2022-10-23","19:15:22"
"223143","mas se volta a trollar nao vou mais perdoar","2022-10-23 19:15:33","969101062","2022-10-23","19:15:33"
"223144","Não","2022-10-23 19:15:38","898408832","2022-10-23","19:15:38"
"223146","Olha ai","2022-10-23 19:16:15","969101062","2022-10-23","19:16:15"
"223149","https://noticias.uol.com.br/ultimas-noticias/agencia-estado/2022/10/23/bolsonaro-sobre-roberto-jefferson-nao-tem-uma-foto-dele-comigo.htm","2022-10-23 19:38:25","126906048","2022-10-23","19:38:25"
"223151","NAO ROLA","2022-10-23 19:53:20","904428339","2022-10-23","19:53:20"
"223152","NEM SE TIVER MAIORIA SENADO DIREITA","2022-10-23 19:53:27","904428339","2022-10-23","19:53:27"
"223154","🔗 PF informa que Roberto Jefferson está cercado 23.10.22 16:48
...","2022-10-23 20:08:56","351719678","2022-10-23","20:08:56"
"223156","Golpe de mestre desses caras em","2022-10-23 20:40:31","438685547","2022-10-23","20:40:31"
"223157","A coisa está feia","2022-10-23 20:40:39","438685547","2022-10-23","20:40:39"
"223158","Essa nem é a primeira bomba que vai surgir","2022-10-23 20:40:46","438685547","2022-10-23","20:40:46"
"223159","Espere","2022-10-23 20:40:47","438685547","2022-10-23","20:40:47"
"223160","Que vai ter muita coisa ai surgindo e acontecendo","2022-10-23 20:40:57","438685547","2022-10-23","20:40:57"
"223161","https://noticias.uol.com.br/eleicoes/2022/10/23/padre-kelmon-chega-a-casa-de-roberto-jefferson-no-rj.htm","2022-10-23 20:47:19","351719678","2022-10-23","20:47:19"
"223165","Ah isso daí pode ser pirotecnia pura pode n ser nada esse Danone n da pra confiar","2022-10-23 20:52:19","351719678","2022-10-23","20:52:19"
"223170","Vamos jejuar","2022-10-23 20:59:05","351719678","2022-10-23","20:59:05"
"223173","Pode não. Mas é fake News?","2022-10-23 21:07:19","108546803","2022-10-23","21:07:19"
"223175","Olha, vários jornais tão notícia do como verdade, e tem links pro ministério público, aqui:","2022-10-23 21:09:32","108546803","2022-10-23","21:09:32"
"223192","O site do governo que tem coleta de dados não diz o motivo de não ter aviso a distribuição de leite, só diz que houve redução.","2022-10-23 21:15:10","108546803","2022-10-23","21:15:10"
"223176","https://aplicacoes.cidadania.gov.br/vis/data3/v.php?q[]=oNOhlMHqwJOsuqSe9XGDymipx92g5m9jj6x6ZG11ZWu0a32AaVqHmWCabq%2FTtIBkd66WpuyeiLSYmcrGbqWjlMnusm93u6qnnK%2BGgWhovcKf3aJuw9y5p6GDcKDapcCzcmjK1qCNs2yQrYianbSon7SfrrqqkpKcmcuppsK2iKextbF74Ku2sayZy9Clz7BTw9y6naixlqzerG20pp%2FFxpbPoaLP4MBUoLdViuuotMCYmriBdNamoMLpwZVciqeb7KK5cYmSutal3aymfeG2op22mJ%2Fiq7zBV524yKLdXZTM7m2Vo7qene6lwb2pksqBmcuqnMnkrqahu1Wg6Ku7s5qSu9Clz7BTwepthK63nKzapq5ueJnAzpjYsZR9vb%2BVr7GhXcqurryrlrvCl89dl8KbuZ2wuqStmZ2ybqOSwNWYip6XzvC2pqWspK31qYg%3D","2022-10-23 21:09:39","108546803","2022-10-23","21:09:39"
"223177","Comprovando a queda.","2022-10-23 21:09:46","108546803","2022-10-23","21:09:46"
"223178","Com gráficos do próprio governo:","2022-10-23 21:10:31","108546803","2022-10-23","21:10:31"
"223180","Fake news sobre ser fake News da esquerda. :)","2022-10-23 21:10:52","108546803","2022-10-23","21:10:52"
"223186","Resumo da história, houve redução de mais de 80% da distribuição de leite pra pessoas de baixa renda.","2022-10-23 21:13:12","108546803","2022-10-23","21:13:12"
"223194","Então, não tem fake News da esquerda nisso. Se o governo quiser colocar explicação, seria ótimo.","2022-10-23 21:15:32","108546803","2022-10-23","21:15:32"
"223196","Aqui o gráfico do período","2022-10-23 21:15:49","108546803","2022-10-23","21:15:49"
"223197","A sim como se eles só censurasem notícias falsas né ?","2022-10-23 21:16:08","438685547","2022-10-23","21:16:08"
"223201","Já to até vendo","2022-10-23 21:17:21","438685547","2022-10-23","21:17:21"
"223203","Só postei para ver a reação hurr durr","2022-10-23 21:17:31","438685547","2022-10-23","21:17:31"
"223204","Olha, a primeira coisa que eu vi de censura no governo atual foi uma peça de teatro e um museu em sp.","2022-10-23 21:17:34","108546803","2022-10-23","21:17:34"
"223208","A que tinha um trenzinho de caras enfiando o dedo no cu do outro e era permitido a entrada de crianças ?","2022-10-23 21:18:20","438685547","2022-10-23","21:18:20"
"223209","Sendo que estavam todos nus ?","2022-10-23 21:18:27","438685547","2022-10-23","21:18:27"
"223210","Engraçado que todos os documentários do Brasil Paralelo foram tirados do ar, tudo que associava os esquemas de corrupção ao Lula também, várias contas foram derrubadas sem nenhuma explicação","2022-10-23 21:19:12","438685547","2022-10-23","21:19:12"
"223211","Não. Você está confundindo coisas, ou só falando o que te repassaram, normal também.","2022-10-23 21:19:15","108546803","2022-10-23","21:19:15"
"223212","Enquanto a do Janones divulgando fake news absurdas como foi o caso do Bolsonaro maçom","2022-10-23 21:19:30","438685547","2022-10-23","21:19:30"
"223213","A exposição de arte de drag queen.","2022-10-23 21:19:52","108546803","2022-10-23","21:19:52"
"223218","Acha mesmo normal crianças interagirem com homens nus ?","2022-10-23 21:20:21","438685547","2022-10-23","21:20:21"
"223219","Por favor especifique a peça de teatro por favor","2022-10-23 21:20:29","438685547","2022-10-23","21:20:29"
"223220","Com prazer, segundo:","2022-10-23 21:20:41","108546803","2022-10-23","21:20:41"
"223222","https://g1.globo.com/google/amp/sp/sao-paulo/noticia/2022/04/30/museu-da-diversidade-sexual-alega-decisao-judicial-e-fecha-no-lancamento-de-exposicao-com-drag-queens-paulistanas.ghtml","2022-10-23 21:21:20","108546803","2022-10-23","21:21:20"
"223225","Existe diferença de censura agora?","2022-10-23 21:21:49","108546803","2022-10-23","21:21:49"
"223233","E prótese peniana.","2022-10-23 21:24:23","108546803","2022-10-23","21:24:23"
"223234","Véi, maluco lá tá jogando granada na polícia federal.","2022-10-23 21:24:54","108546803","2022-10-23","21:24:54"
"223235","Ces tão acompanhando isso com a pipoca que eu tou?","2022-10-23 21:25:04","108546803","2022-10-23","21:25:04"
"223237","Mais que certo","2022-10-23 21:25:29","438685547","2022-10-23","21:25:29"
"223240","Patriota","2022-10-23 21:25:42","351719678","2022-10-23","21:25:42"
"223241","Usando verba pública","2022-10-23 21:25:45","438685547","2022-10-23","21:25:45"
"223248","Não Tomaz credo","2022-10-23 21:27:10","438685547","2022-10-23","21:27:10"
"223250","30 milhões tu faz uma escola maravilhosa","2022-10-23 21:27:31","438685547","2022-10-23","21:27:31"
"223251","E usar isso para um museu de diversidade sexual","2022-10-23 21:27:39","438685547","2022-10-23","21:27:39"
"223252","A vá pra puta que o pariu","2022-10-23 21:27:43","438685547","2022-10-23","21:27:43"
"223263","E Rússia","2022-10-23 21:38:21","5309552782","2022-10-23","21:38:21"
"223258","O CUMPANHERO","2022-10-23 21:38:11","5258502934","2022-10-23","21:38:11"
"223260","OQUE QUE DEU O B.O DO ROBERTO JEFFERSON?","2022-10-23 21:38:11","5258502934","2022-10-23","21:38:11"
"223261","Bolsonaro aqui é liberdade","2022-10-23 21:38:12","5309552782","2022-10-23","21:38:12"
"223262","Mas ele faz negócio com a china","2022-10-23 21:38:18","5309552782","2022-10-23","21:38:18"
"223264","Quero só ver aonde isso vai parar","2022-10-23 21:38:29","5309552782","2022-10-23","21:38:29"
"223266","O ROBERTO JEFFERSON PASSOU CHUMBO NOS GAMBÉ","2022-10-23 21:38:46","5258502934","2022-10-23","21:38:46"
"223268","Por em quanto","2022-10-23 21:39:12","5309552782","2022-10-23","21:39:12"
"223269","A china tá aí pra isso","2022-10-23 21:39:19","5309552782","2022-10-23","21:39:19"
"223279","Como assim cara ? Brasil é pato pra eles lá fora","2022-10-23 22:01:08","5309552782","2022-10-23","22:01:08"
"223280","Oq aconteceu com esse Bob ?","2022-10-23 22:01:33","5309552782","2022-10-23","22:01:33"
"223283","Atirou assim de graça, do nada ?","2022-10-23 22:02:24","5309552782","2022-10-23","22:02:24"
"223285","O cú dele","2022-10-23 22:02:44","5309552782","2022-10-23","22:02:44"
"223286","Depois Bolsonaro resolve isso","2022-10-23 22:02:51","5309552782","2022-10-23","22:02:51"
"223287","É proposital pra prejudicar a campanha","2022-10-23 22:03:02","5309552782","2022-10-23","22:03:02"
"223289","Eh eles foram lá pra prende ló aí ele recebeu na bala e na granada","2022-10-23 22:03:39","351719678","2022-10-23","22:03:39"
"223291","Tá certo","2022-10-23 22:04:11","5309552782","2022-10-23","22:04:11"
"223294","Uma hora os caras vão entrar com armamento pesado e matar esse coroa","2022-10-23 22:05:50","5309552782","2022-10-23","22:05:50"
"223295","https://youtube.com/shorts/9kObkoDP13o?feature=share","2022-10-23 22:10:15","5309552782","2022-10-23","22:10:15"
"223301","Como assim gente?","2022-10-23 22:22:54","5309552782","2022-10-23","22:22:54"
"223303","N tô entendendo nada , o Jeferson é apoiador do Bolsonaro ??","2022-10-23 22:23:15","5309552782","2022-10-23","22:23:15"
"223307","Bolsonaro?","2022-10-23 22:23:53","5309552782","2022-10-23","22:23:53"
"223311","Se Bolsonaro rejeita o bobe , e a esquerda vai apoiar, isso é bom para o bolsonaro","2022-10-23 22:24:20","5309552782","2022-10-23","22:24:20"
"223317","Tá tudo muito confuso","2022-10-23 22:25:30","5309552782","2022-10-23","22:25:30"
"223318","Bolsonaro falou isso pra não se prejudicar","2022-10-23 22:25:42","5309552782","2022-10-23","22:25:42"
"223329","Política

Roberto Jefferson se entrega e é preso no Rio de Janeiro após horas de resistência","2022-10-23 22:32:47","130331858","2022-10-23","22:32:47"
"223330","Vish chamou Bob Jeff de bandido","2022-10-23 22:38:46","351719678","2022-10-23","22:38:46"
