"message_id","message","message_utc","from_id","date","time"
"37049","#vaga https://www.instagram.com/p/CkgikwYrr9k/?igshid=MDJmNzVkMjY=","2022-11-04 00:24:26","1369428778","2022-11-04","00:24:26"
"37059","Pessoal, para quem interessar estou vendendo um Monitor Dell Tela led de 23.8"". (Semi novo)
Tem uma resolução de 2560px-1440px.
Proporção da tela de 16:9.
Painel IPS.
Seu brilho é de 300cd/m².
Tipos de conexões: DisplayPort, HDMI, VGA, USB.
Conforto visual em todos os momentos

BAIXEI O PREÇO R$900,00

Informações whatsapp 8498888-0088","2022-11-04 14:27:46","98714984","2022-11-04","14:27:46"
"37060","ATENÇÃO: ALTERAÇÃO NA GRADE
Palestra Integração do Nextcloud com OnlyOffice - Dia 04/11 às 13h00 no Espaço Colômbia. Para quem não está em Foz do Iguaçu, segue o link - https://www.youtube.com/watch?v=N_r_xv-hvak","2022-11-04 14:38:33","56367642","2022-11-04","14:38:33"
