"message_id","message","message_utc","from_id","date","time"
"25734","Goebels como sempre, com jornalismo PARCIAL, em defesa do que é errado do lado OPOSTO.","2022-09-30 13:27:11","1306084376","2022-09-30","13:27:11"
"25735","Entenderam?
TODO PODER EMANA DO POVO e nós somos MAIORIA, nós MANDAMOS nesse país, alguns queiram ou não.","2022-09-30 13:29:27","1306084376","2022-09-30","13:29:27"
"25738","https://youtu.be/Igo0juCXN9Q","2022-09-30 15:52:03","1158955319","2022-09-30","15:52:03"
"25739","https://youtu.be/Fv0OXEag7l0","2022-09-30 19:44:17","972996667","2022-09-30","19:44:17"
"25740","Xandão cria núcleo de serviço secreto para CUIDAR das eleições. O lobo cuidando dos cordeiros.","2022-09-30 23:16:23","1306084376","2022-09-30","23:16:23"
"25742","Mas... O esquema está rolando para não acontecer. Assista o vídeo acima do Alexandre de Moraes.","2022-09-30 23:49:57","1306084376","2022-09-30","23:49:57"
"25743","Acima do Jean willis.","2022-09-30 23:50:19","1306084376","2022-09-30","23:50:19"
