"message_id","message","message_utc","from_id","date","time"
"10862","Lula se recusa a apresentar seu plano de governo porque sabe que se o fizer NÃO SERÁ ELEITO.

A pauta do aborto SEMPRE fez parte dos planos de governo do Lula e da esquerda. 

O LULA SEMPRE APOIOU O ABORTO.

Nas eleições presidenciais contra o candidato Fernando Collor, o Lula perdeu por causa da divulgação desse vídeo. Espero que o brasileiro não tenha mudado.","2022-10-11 13:21:27","","2022-10-11","13:21:27"
"10863","Apesar de não desejar o seu nascimento e não registrá-la como filha, o tempo e a fama fizeram com que Lula finalmente assumisse sua filha, afinal, essa mancha do passado poderia prejudicar suas ambições políticas.

Luriel então é educada e colocada nos mesmos esquemas dos filhos de Lula com a Mariza e seu enteado - que Lula também assumiu.","2022-10-11 13:21:27","","2022-10-11","13:21:27"
