"message_id","message","message_utc","from_id","date","time"
"790","Gente alguém sabe onde tem ponto de entrega de adesivos do bolsonaro em são Paulo!!","2022-10-25 01:18:09","1891907485.0","2022-10-25","01:18:09"
"791","Eu queria também mas nunca vi ninguém distribuindo","2022-10-25 01:18:59","1995864841.0","2022-10-25","01:18:59"
"805","Certo e nesse momento as pessoas estão reinvindicando o que?","2022-10-25 23:56:24","","2022-10-25","23:56:24"
"800","Você está na paulista?","2022-10-25 23:53:32","","2022-10-25","23:53:32"
"801","Sim!","2022-10-25 23:53:53","1995864841.0","2022-10-25","23:53:53"
"803","Estão em frente a Jovem Pan?","2022-10-25 23:54:40","","2022-10-25","23:54:40"
"804","Em frente ao masp!","2022-10-25 23:55:00","1995864841.0","2022-10-25","23:55:00"
