"message_id","message","message_utc","from_id","date","time"
"411","Compartilhe essa imagem e texto com seus contatos","2022-10-16 11:20:18","","2022-10-16","11:20:18"
"414","Vídeo de Dete Magri","2022-10-16 12:08:28","1769486067.0","2022-10-16","12:08:28"
"416","🟢 O livro A LIBERTADORA - UMA CONSTITUIÇÃO PARA O BRASIL foi escrito por Luiz Philippe de Orléans e Bragança, Tetraneto de Dom Pedro II como saída para a atual constituição que rege nosso país, caso assim o povo queira.

É um livro que cita o nosso eventual futuro regimento nacional e os impactos diretos em nosso povo como sociedade desenvolvida. 🇧🇷
 
inscreva-se em @e_livros para muito livros mais.","2022-10-16 13:17:47","","2022-10-16","13:17:47"
"405","Crie um grupo no Whatsapp e adicione pessoas influentes assim como você para multiplicar o nosso movimento pelo Brasil e eleger o nosso capitão 22 no dia 30 de Outubro.","2022-10-16 10:53:11","","2022-10-16","10:53:11"
"410","Excelente","2022-10-16 11:20:01","","2022-10-16","11:20:01"
