"message_id","message","message_utc","from_id","date","time"
"4042","FIDEL CASTRO ESTÁ CHAMANDO MOLUSCO 👹

Vai logo demônio, o inferno te espera.","2022-11-12 23:55:28","730989819.0","2022-11-12","23:55:28"
"4041","Compartilhem esta oração especial, feita exatamente para estes momentos atuais - para fortalecer a Destra de nossas Forças Armadas e a todos os Patriotas, diante a este combate frontal contra as forças mal!

Orem e compartilhem - compareçam nas manifestação!

Oração ao Senhor dos Exércitos de Deus

Avante Soldados de Cristo!

Nesta guerra espiritual, no fim das contas, a luz sempre vence o mal. Não nos omitiremos diante o perigo, não desistiremos de lutar por Justiça e Liberdade - na defesa da família, do evangelho de Cristo e de nossa amada nação brasileira....

Deus é mais

T.ME/SOLDADOS","2022-11-12 21:06:15","293309946.0","2022-11-12","21:06:15"
