"message_id","message","message_utc","from_id","date","time"
"4351","""É a nossa última semana"" 

Mãe da menina que visitou o Presidente alega que ele falou que é preciso que as pessoas se manifestem para com isso pressionar os que ainda estão contrários...

AGORA É TODOS NAS RUAS - AOS MILHÕES! RETA FINAL! É TUDO OU NADA!","2022-12-26 11:32:53","161215470.0","2022-12-26","11:32:53"
"4353","⚠️ PESSOAL, dia 25/12/22, haviam alguns manifestantes no Alvorada, o Presidente chamou algumas crianças acompanhadas de seus pais lá para dentro e quando voltaram uma mãe falou que o Presidente precisa de uma multidão nas ruas essa semana, o *Brasil* *precisa parar*, todos precisamos estar nas ruas. Não sei de onde cada um deverá tirar força, mas, tem que dar um jeito. Vamos, gente, tem que ser agora. A principio nos quartéis e Alvorada se vierem orientações.
Compartilhem o chamado! 🙏🏼","2022-12-26 11:39:22","161215470.0","2022-12-26","11:39:22"
