"message_id","message","message_utc","from_id","date","time"
"11792","*FERNANDO HENRIQUE CARDOSO PAGARÁ POR MUITO TEMPO TODO O MAL COLETIVO QUE ELE FEZ A TODOS OS BRASILEIROS.*

- FHC, ONGS, ROTHSCHILDS E O ROUBO DE OURO NA AMAZÔNIA.



Fernando Henrique Cardoso é 
o maior ladrão e entreguista do Brasil,  é um dos cabeças das inúmeras quadrilhas de criminosos que garimpam, roubam e contrabandeiam ouro, diamantes, nióbio, esmeraldas, madeiras nobres, urânio, grafeno, zinco e outros minérios da Amazônia.

Foi FHC quem criou a Lei de deu origem as Reservas indígenas. Estas reservas foram demarcadas propositalmente sobre as áreas mais ricas da Amazônia. Óbvio!

Membro do Clube de Roma, à convite de David Rockffellers, o maçom Grau 33, cabeça da quadrilha do PSDB e ex-presidente do Brasil, foi também autor da Lei que proibia o ingresso do Exército e da Polícia Federal nas reservas indígenas, facilitando deste modo, que quadrilhas de mercenários, mineradoras e garimpeiros ilegais, se instalassem nestas regiões. 

O objetivo de FHC era facilitar que a família Rothschilds e suas exploradoras, pudessem se instalar nestas reservas. Obviamente sem se incomodarem com a presença da polícia ou do Exército.

Um General do Exército Brasileiro, Durval Nery denunciou este crime cometido na gestão de FHC. Nery disse que um comando de soldados brasileiros faziam uma ronda na fronteira das reservas. Os militares navegavam por um rio e de repente se depararam com um garimpo ilegal.

O local estava cercado de soldados mercenários. Todos armados. Havia uma bandeira inglesa hasteada em um mastro e os soldados mercenários protegiam um garimpo ilegal de uma das mineradoras da familia Rothschilds.

Nery denuncia que haviam várias mineradoras da família Rothschilds operando clandestinamente nas reservas indígenas.

FHC teve vários encontros na Inglaterra com Jacob e Natanael Rothschilds. Na certa se reunia para receber as milionárias comissões pelo roubo e pelo contrabando. As cifras podiam chegar à 600 bilhões de dólares por ano.

Foi também na gestão de FHC que várias ONGs receberam carta branca de seu governo para operarem na Amazônia. Mas seus crimes não pararam por aí.

FHC também tentou cometer um crime de lesa pátria contra o povo brasileiro. O comunista do PSDB tentou vender uma jazida de nióbio na Reserva Raposa do Sol avaliada em mais de 10 trilhões de dólares, pela medíocre bagatela de 600 milhões de dólares à família Rothschilds.

Por sorte o ex-senador Luiz Eduardo Magalhães impediu a venda. Meses depois Magalhães morreu de forma misteriosa. Foi envenenado por um tipo de veneno usado por agentes da KGB.

O comunista e golpista FHC foi o responsável pela organização das ""Diretas Já"", movimento que trouxe de volta ao Brasil, todas as quadrilhas terroristas, que nos anos 60 e 70, tentaram transformar o Brasil em uma Cuba tupiniquim. FHC criou o ""Bolsa Terrorista"" ao qual ele e Lula se beneficiaram durante mais de 20 anos com pensões ilegais acima de 20 mil. FHC nem foi caçado ou exilado. Mesmo assim se beneficiou da bolsa. Até parentes de Fidel Castro recebiam gordas indenizações às custas do suor do brasileiro. 

FHC também tentou desmembrar a Amazônia em 216 micro Nações indígenas. Um crime de lesa pátria que entregaria de vez, toda a Amazônia para exploração internacional. A OIT 169.

FHC cometeu diversos crimes como ministro da economia do governo Itamar Franco e principalmente como presidente. Crimes que somam mais de 8 trilhões de reais aos cofres públicos e nunca foi investigado.

Também foi um dos mandantes dos assassinatos de Sérgio Motta, PC Farias, Enéas Carneiro, Clodovil, Luis Eduardo Magalhães, Ulysses Guimarães, Tancredo Neves, Antonio C. Magalhães entre outros.

FHC é o pai do socialismo brasileiro e principal financiador do Foro de SP, mentor da URSAL, e um dos cabeças do tráfico de drogas e do contrabando na Amazônia.

Professor medíocre de sociologia, dava aulas subvertendo alunos ao comunismo e os arrigementava. Tem um patrimônio que incluí fazenda, cabeças de gado e diversos imóveis de luxo no Brasil e no exterior, avaliados em mais de 1 bilhão.

COMPARTILHE COM FORÇA!","2022-12-19 06:12:25","5410394008.0","2022-12-19","06:12:25"
"11794","THE AMAZON RULERS 

🇧🇷

FHC created the Indigenous Reserves not to favor the Indians, but to facilitate the looting and theft of all mineral resources in the Amazon. FHC allowed hundreds of foreign NGOs to settle in regions rich and abundant in gold, diamonds, niobium, plants and other valuable resources found in the Amazonian soil.

Since then the Amazon has been looted year after year. There are 60 billion dollars in diamonds alone and approximately 100 billion dollars in gold.

Each year, FHC and Foro de SP partners steal more than 400 billion dollars from the country, money that would allow the people to live in abundance and wealth.

FHC and Lula receive large monthly contributions from what is looted from the Amazon. Bolsonaro with great commitment reduced this crime by almost 70% and the goal is to reach 100%.

That's why the media and the entire damn left attack the government with inferences and lies. This has to end. Brazil's traitors must pay for their crimes on the wall.","2022-12-19 06:26:59","1106044660.0","2022-12-19","06:26:59"
"11797","https://gay.blog.br/direitos/novo-livro-de-tiago-pavinatto-aborda-direitos-da-pessoa-fo","2022-12-19 07:21:50","5787947266.0","2022-12-19","07:21:50"
"11798","Gay.blog 🤡","2022-12-19 07:54:46","1106044660.0","2022-12-19","07:54:46"
"11801","https://t.me/HackerOficial_bot?start=r03335030294","2022-12-19 08:09:25","5839496242.0","2022-12-19","08:09:25"
"11803","https://t.me/tiktok_dinheiro_bot?start=5839496242","2022-12-19 08:59:04","5839496242.0","2022-12-19","08:59:04"
"11804","Isso é o que eu falo. Os vacinados são os que são inbecis. Pq eles conseguem controlar essa massa que corre pra tomar no rabo","2022-12-19 09:18:00","1029414221.0","2022-12-19","09:18:00"
"11805","👏👏👏👏","2022-12-19 09:23:32","1029414221.0","2022-12-19","09:23:32"
"11807","https://twitter.com/elonmusk/status/1604617643973124097?t=RxQPsVMiPNDlCX0bl7GdFQ&s=19

VOTE ""NÃO""","2022-12-19 10:24:51","580745087.0","2022-12-19","10:24:51"
"11808","https://www.youtube.com/live/mlCKBSJAgEo?feature=share","2022-12-19 10:46:49","5826292137.0","2022-12-19","10:46:49"
"11809","Votei sim. Não gosto dele, bloqueou o kanye west novamente","2022-12-19 10:49:09","5530740241.0","2022-12-19","10:49:09"
"11815","BUMMMM 💥💥💥
@GeFazioBreakingNews 🇺🇸🇧🇷","2022-12-19 11:43:01","331878663.0","2022-12-19","11:43:01"
"11816","BOM DIA ATODOS. ÓTIMÁ SEMANA COM SAÚDE É PAZ.","2022-12-19 11:52:49","5416356082.0","2022-12-19","11:52:49"
"11817","Bom Dia  a todos !!!! PAX ET LVX💥🦉","2022-12-19 11:59:03","5219376679.0","2022-12-19","11:59:03"
"11818","Otoni de Paula traidor !☝️","2022-12-19 12:01:56","331878663.0","2022-12-19","12:01:56"
"11837","Bom dia Brasil acorda Brasil","2022-12-19 12:22:25","331878663.0","2022-12-19","12:22:25"
"11821","⚠️⚠️⚠️⚠️ NESSA MADRUGADA DO DIA 19, A POLÍCIA FEDERAL, A MANDO DO DITADOR AJUDANTE DE ORDENS DO PCC, PRENDE O PASTOR FABIANO, LÁ DO ESPÍRITO SANTO!!!
AGUENTA FIRME AÍ PASTOR, É POR POUQUINHO TEMPO!
ISSO SÓ ARREMATA O ESTADO DE EXCEÇÃO PRECONIZADO PELO GENERAL MOURÃO! E A SOLUÇÃO IMEDIATA PARA ESTADO DE EXCEÇÃO É INTERVENÇÃO MILITAR!","2022-12-19 12:06:35","1106044660.0","2022-12-19","12:06:35"
"11828","Vc realmente não entende o q está acontecendo mesmo com eu escrevendo com todas as letras","2022-12-19 12:14:41","1106044660.0","2022-12-19","12:14:41"
"11824","Saiu decreto colocando sob o ministério da defesa basicamente toda a infraestrutura do Brasil. Tudo sendo centralizado. https://www.in.gov.br/en/web/dou/-/resolucao-creden/gsi-pr-n-23-de-16-de-dezembro-de-2022-451601637","2022-12-19 12:11:22","1106044660.0","2022-12-19","12:11:22"
"11825","Mais um deixado sozinho","2022-12-19 12:12:47","1029414221.0","2022-12-19","12:12:47"
"11826","Canal
Frente Agorista

Grupos
Anarcocapitalismo
Agorismo","2022-12-19 12:13:46","5965816661.0","2022-12-19","12:13:46"
"11827","O povo diz que vai fazer e acontecer, e tem deixado os aliados na mão","2022-12-19 12:13:52","1029414221.0","2022-12-19","12:13:52"
"11838","Você é cristão ?","2022-12-19 12:22:44","1849277605.0","2022-12-19","12:22:44"
"11831","video antigo","2022-12-19 12:18:14","1798425978.0","2022-12-19","12:18:14"
"11832","Você quer um Brasil melhor ?
Você acha que toda raiva que guarda dentro de você , vai se resolver matando alguém meu amigo ?","2022-12-19 12:19:27","1849277605.0","2022-12-19","12:19:27"
"11833","Sim","2022-12-19 12:19:41","1106044660.0","2022-12-19","12:19:41"
"11834","Entendo e respeito seu modo de pensar.
Mas fala para min quando a violência solucionou alguma coisa ?","2022-12-19 12:20:36","1849277605.0","2022-12-19","12:20:36"
"11839","https://noticias.uol.com.br/politica/ultimas-noticias/2022/12/18/raio-acampamento-bolsonarista-df.htm","2022-12-19 12:23:02","5219376679.0","2022-12-19","12:23:02"
"11840","Depois do dia 30 me considero cristão sim","2022-12-19 12:23:14","1106044660.0","2022-12-19","12:23:14"
"11841","E bandido bom é bandido morto","2022-12-19 12:23:30","1106044660.0","2022-12-19","12:23:30"
"11842","Então você acredita na blibia ?","2022-12-19 12:23:30","1849277605.0","2022-12-19","12:23:30"
"11843","Eu acredito em Deus porque bolsonaro juntou o povo e vamos ter uma intervenção militar e vamos matar bandido","2022-12-19 12:24:20","1106044660.0","2022-12-19","12:24:20"
"11844","Só por isso","2022-12-19 12:24:30","1106044660.0","2022-12-19","12:24:30"
"11846","Sobre isso ninguém fala !","2022-12-19 12:25:02","5219376679.0","2022-12-19","12:25:02"
"11847","Eu era agnóstico até antes das eleições","2022-12-19 12:25:10","1106044660.0","2022-12-19","12:25:10"
"11848","Eu creio no SENHOR DOS EXERCITOS","2022-12-19 12:25:33","1106044660.0","2022-12-19","12:25:33"
"11849",""" Amar o próximo como a si mesmo ""
Está afirmação te lembra algo ?","2022-12-19 12:25:40","1849277605.0","2022-12-19","12:25:40"
"11850","Você acha que afirmação matar está ligado a ser cristão ?","2022-12-19 12:26:02","1849277605.0","2022-12-19","12:26:02"
"11851","Eu quero da biblia é parte da guerra so","2022-12-19 12:26:17","1106044660.0","2022-12-19","12:26:17"
"11852","Então você não é cristão meu amigo","2022-12-19 12:26:31","1849277605.0","2022-12-19","12:26:31"
"11853","Tem muita morte na Bíblia voce deveria ler mais","2022-12-19 12:26:37","1106044660.0","2022-12-19","12:26:37"
"11854","Meu amigo vou te explicar uma coisa.
Você acha que já não senti raiva ?
Você acha que as vezes não tenho pico de ansiedade ?
Mas não posso deixar esses sentimentos tomar conta do meu ser.
Jamais vamos solucionar este mundo com ódio e raiva .
 Está narrativa foi criada para dividir a população e tirar o poder de todos","2022-12-19 12:28:13","1849277605.0","2022-12-19","12:28:13"
"11855","O atual sistema político é todo corrompido.
No brasil atualmente não existe nenhum partido de direita","2022-12-19 12:28:41","1849277605.0","2022-12-19","12:28:41"
"11856","vc ta usando muita droga, filho... rsrs","2022-12-19 12:29:03","1798425978.0","2022-12-19","12:29:03"
"11857","Amigo, vc precisa de ajuda psiquiatrica urgentemente... rsrs","2022-12-19 12:30:34","1798425978.0","2022-12-19","12:30:34"
"11858","Drogas ?
Por que quando alguém fala algo fora da caixa a maioria do povo acha que a pessoa é louca ou usa droga ?
Você atualmente está doutrinado com uma narrativa de divisão e não se da conta meu amigo","2022-12-19 12:30:42","1849277605.0","2022-12-19","12:30:42"
"11860","Qual o sentindo de me classificar com algo ruim ?
Não a sentindo e não vou cair nesta narrativa para usar o mesmo contra você","2022-12-19 12:31:30","1849277605.0","2022-12-19","12:31:30"
"11861","rsrsrs, foi essa a geração que Bolsonaro deixou...","2022-12-19 12:31:38","1798425978.0","2022-12-19","12:31:38"
"11875","Então você não está lutando pela verdadeira democracia.","2022-12-19 12:35:32","1849277605.0","2022-12-19","12:35:32"
"11864","Eu não apoio Político  nenhum meu amigo","2022-12-19 12:32:03","1849277605.0","2022-12-19","12:32:03"
"11865","Eu nao falei contigo, sobre as drogas... Eu falei direcionado ao Navarro","2022-12-19 12:32:19","1798425978.0","2022-12-19","12:32:19"
"11866","Ok , perdão","2022-12-19 12:32:30","1849277605.0","2022-12-19","12:32:30"
"11867","de boa","2022-12-19 12:32:34","1798425978.0","2022-12-19","12:32:34"
"11868","3 E dize à terra de Israel: Assim diz o SENHOR: Eis que sou contra ti, e tirarei a minha espada da bainha, e exterminarei do meio de ti o justo e o ímpio. 4 Por isso que hei de exterminar do meio de ti o justo e o ímpio, a minha espada sairá da bainha contra toda carne, desde o Sul até ao Norte.","2022-12-19 12:33:19","1106044660.0","2022-12-19","12:33:19"
"11869","E disse-lhe o Senhor: Passa pelo meio da cidade, pelo meio de Jerusalém, e marca com um sinal as testas dos homens que suspiram e que gemem por causa de todas as abominações que se cometem no meio dela.
E aos outros disse ele, ouvindo eu: Passai pela cidade após ele, e feri; não poupe o vosso olho, nem vos compadeçais.
Matai velhos, jovens, virgens, meninos e mulheres, até exterminá-los; mas a todo o homem que tiver o sinal não vos chegueis; e começai pelo meu santuário. E começaram pelos homens mais velhos que estavam diante da casa.

Ezequiel 9:4-6","2022-12-19 12:33:30","1106044660.0","2022-12-19","12:33:30"
"11870","Não vamos usar o discurso de odio não .
Eu sei que ta difícil.
Eu sei que da raiva .
Eu sei que a vontade muitos era mete uma bala em algo ou em alguém.
Mas isso não vai mudar nada.
Se estamos aqui é por que tem um sentindo .
E vamos ser diferentes.
Vamos mudar este pais de uma modo diferente","2022-12-19 12:33:41","1849277605.0","2022-12-19","12:33:41"
"11871","Ezequiel 23:25 NTLH

Deixarei que eles a tratem com ódio, pois estou irado com você. Eles cortarão o seu nariz e as suas orelhas e matarão os seus filhos. Sim! Eles tirarão de você os seus filhos e filhas e os queimarão vivos.","2022-12-19 12:34:37","1106044660.0","2022-12-19","12:34:37"
"11872","ta praticamente impossivel, e sinceramente tem discursos bolsonaristas, que mais parecem coisa de louco de hospício do que de pessoas normais... Onde vamos parar meu Deus do ceu","2022-12-19 12:34:41","1798425978.0","2022-12-19","12:34:41"
"11873","Eu entendo e respeito.
Meu amigo pegar pontos da blibia para justificar uma agressão não tem sentido .
Você viu jesus pegando um flexa para matar alguém ?","2022-12-19 12:34:45","1849277605.0","2022-12-19","12:34:45"
"11874","Comunista pra mim nem é gente","2022-12-19 12:35:11","1106044660.0","2022-12-19","12:35:11"
"11876","Eu não concordo com comunista, mas não posso querer matar","2022-12-19 12:35:57","1849277605.0","2022-12-19","12:35:57"
"11877","Vc quer levar como verdade absoluta e modelo de ""vida"" um livro escrito a milhares de anos atrás, antiquado, cheio de erros, cheio de controversas... Vc realmente, é louco!","2022-12-19 12:36:11","1798425978.0","2022-12-19","12:36:11"
"11878","🤯🇺🇦Zelensky insinuou em uma frase que a Ucrânia está à beira de um desastre, aponta Foreign Policy

O pedido do presidente ucraniano Vladimir Zelensky para que os refugiados não retornem ao seu país de origem aponta para a situação difícil da economia e que sua infraestrutura está em condições críticas, de acordo com economista.

© Foto: AP Photo / Assessoria de Imprensa Presidencial Ucraniana

👉 Leia mais aqui

Siga a @sputnikbrasil para acompanhar todas as notícias envolvendo as tensões na Ucrânia","2022-12-19 12:36:24","5453071939.0","2022-12-19","12:36:24"
"11879","se vc for seguir a biblia, vc sai matando pessoas, crianças, mulheres","2022-12-19 12:36:29","1798425978.0","2022-12-19","12:36:29"
"11880","pra que ficar colocando religião onde ela nao esta?","2022-12-19 12:36:39","1798425978.0","2022-12-19","12:36:39"
"11882","Rsrsrsrzr sonha mane","2022-12-19 12:37:40","331878663.0","2022-12-19","12:37:40"
"11883","Tem que matar os criminosos pra mostar pra os comunistas que se eles não mudarem de ideia vão morrer tambem","2022-12-19 12:37:41","1106044660.0","2022-12-19","12:37:41"
"11891","Acorda povo","2022-12-19 12:39:01","331878663.0","2022-12-19","12:39:01"
"11884","A Bíblia esta repleta de histórias de pessoas, que matavam em nome de Deus... Será mesmo, que Deus, é tão desgraçado assim como é narrado na Bíblia ou sera que o povo que é maluco?","2022-12-19 12:37:48","1798425978.0","2022-12-19","12:37:48"
"11885","Você quer deixa criminos vivo?","2022-12-19 12:38:05","1106044660.0","2022-12-19","12:38:05"
"11886","Eles podem ser presos irmão.","2022-12-19 12:38:18","1849277605.0","2022-12-19","12:38:18"
"11887","Mano é morte morter","2022-12-19 12:38:33","1106044660.0","2022-12-19","12:38:33"
"11888","Faz alguma coisa entao amigo","2022-12-19 12:38:34","1798425978.0","2022-12-19","12:38:34"
"11889","🔫🔫🔫🔫🔫🔫🔫","2022-12-19 12:38:52","1798425978.0","2022-12-19","12:38:52"
"11890","A gente tá em guerra","2022-12-19 12:38:55","1106044660.0","2022-12-19","12:38:55"
"11892","KKKKKKKKKKKKKKKKKKKKKKKKKKKKKKKKKKKKKKKKKKKKKKKKKKKKKKKKKKKKKKKKKKKKKKKKKKKKKKKKKKKKKKKKKKKKKKKKKKKKKKKKKKKKKKKKKKKKKKKKKKKKKKKKKKKKKKKKKKKKKKKKKKKKKKKKKKKKKKKKKKKKKKKKKKKKKKKKKKKKKKKKKKKKKKKKKKKKKKKKKKKKKKKKKKKKKKKKKKKKKKKKKKKKKKKKKKKKKKKKKKKKKKKKKKKKKKKKKKKKKKKKKKKKKKKKKKKKKKKKKKKKKKKKKKKKKKKKKKKKKKKKKKKKKKKKKKKKKKKKKKKKKKKKKKKKKKKKKKKKKKKKKKKKKKKKKKKKKKKKKKKKKKKKKKKKKKKKKKKKKKKKKKKKKKKKKKKKKKKKKKKKKKKKKKKKKKKKKKKKKKKKKKKKKKKKKKKKKKKKKKKKKKKKKKKKKKKKKKKKKKKKKKKKKKKKKKKKKKKKKKKKKKKKKKKKKKKKKKKKKKKKKKKKKKKKKKKKKKKKKKKKKKKKKKKKKKKKKKKKKKKKKKKKKKKKKKKKKKKKKKKKKKKKKKKKKKKKKKKKKKKKKKKKKKKKKKKKKKKKKKKKKKKKKKKKKKKKKKKKKKKKKKKKKKKKKKKKKKKKKKKKKKKKKKKKKKKKKK","2022-12-19 12:39:04","1798425978.0","2022-12-19","12:39:04"
"11893","Acorda","2022-12-19 12:39:05","1106044660.0","2022-12-19","12:39:05"
"11894","MEU DEUS","2022-12-19 12:39:15","1798425978.0","2022-12-19","12:39:15"
"11895","eita vontade de querer ser hein? kkkkkkkkkkk","2022-12-19 12:39:36","1798425978.0","2022-12-19","12:39:36"
"11897","ta doidinho, pra usar um uniforme militar e pagar de POLICIA","2022-12-19 12:39:46","1798425978.0","2022-12-19","12:39:46"
"11898","kkkkkkkkkkkkkkkkkkkkkkkkkkkkkkkkkkkkkkkkkkkkkkkkkkkkkkk vc deve ser aqueles que aparece na manifestação, de farda sem ser nada","2022-12-19 12:40:00","1798425978.0","2022-12-19","12:40:00"
"11899","Ta na lei","2022-12-19 12:40:01","1106044660.0","2022-12-19","12:40:01"
"11900","A prisão do Pastor Fabiano foi feita de surpresa no meio da madrugada, enquanto o Pastor dormia no acampamento.","2022-12-19 12:40:01","2128894062.0","2022-12-19","12:40:01"
"11901","Não irmão","2022-12-19 12:40:08","1849277605.0","2022-12-19","12:40:08"
"11902","Com violência não da certo.
Pq você não tenta fazer as coisas de forma diferente ?","2022-12-19 12:40:32","1849277605.0","2022-12-19","12:40:32"
"11904","Qual sua ideia?","2022-12-19 12:40:45","1106044660.0","2022-12-19","12:40:45"
"11905","Deu eu perguntar, como o povo da manifestação ta pagando energia, agua, aluguel/radia? Contas de modo geral? Tao parado desde 30 de outubro","2022-12-19 12:40:49","1798425978.0","2022-12-19","12:40:49"
"11906","ces nao tao trabalhando nao?","2022-12-19 12:40:59","1798425978.0","2022-12-19","12:40:59"
"11907","Não tem","2022-12-19 12:41:31","1106044660.0","2022-12-19","12:41:31"
"11908","hein ces tem emprego gente?","2022-12-19 12:41:37","1798425978.0","2022-12-19","12:41:37"
"11909","pq nao é possivel nao...","2022-12-19 12:41:47","1798425978.0","2022-12-19","12:41:47"
"11910","A primeira coisa e conseguir chamar o maximo de pessoas.
E obvio que vai levar um tempo.
O objetivo será a união como foi conversado no grupo aqui ontem.","2022-12-19 12:41:51","1849277605.0","2022-12-19","12:41:51"
"11911","Eu trabalho em casa","2022-12-19 12:42:09","1849277605.0","2022-12-19","12:42:09"
"11912","https://youtube.com/watch?v=IGXYQQ6H6mE&feature=shares","2022-12-19 12:42:39","703689059.0","2022-12-19","12:42:39"
"11913","https://youtube.com/watch?v=6ee7V-mwGI0&feature=shares","2022-12-19 12:42:57","703689059.0","2022-12-19","12:42:57"
"11914","Vamos tentar ser mais unidos","2022-12-19 12:44:02","1849277605.0","2022-12-19","12:44:02"
"11915","Sem confusão","2022-12-19 12:44:13","1849277605.0","2022-12-19","12:44:13"
"11917","Amigo, fala a verdade pra mim: Vc acredita mesmo, do fundo do seu coração que vai acontecer alguma coisa? Que o exercito vai intervir? Que vai ter intervenção com bolsonaro no poder?","2022-12-19 12:44:45","1798425978.0","2022-12-19","12:44:45"
"11920","Vc eh aqueles BLACK-BLOCS?","2022-12-19 12:46:54","1798425978.0","2022-12-19","12:46:54"
"11921","Se o pastor tivesse umas dessa duvido ir preso","2022-12-19 12:47:10","331878663.0","2022-12-19","12:47:10"
"11924","vc quer convocar um ""exercito"" pra atacar porra?","2022-12-19 12:50:43","1798425978.0","2022-12-19","12:50:43"
"11929","Eu nao acredito que va acontecer nada! Pq na real mesmo? So acontece, se houver isso que vc ta falando","2022-12-19 12:53:54","1798425978.0","2022-12-19","12:53:54"
"11930","Enquanto for pacifico... Nao vai dar nada","2022-12-19 12:54:10","1798425978.0","2022-12-19","12:54:10"
"11933","Essa bosta armadas não vai fazer nada não. Eles vai botar é o povo pra casa","2022-12-19 12:55:08","2128894062.0","2022-12-19","12:55:08"
"11935","Brasil tem pena de morte sim","2022-12-19 12:56:03","331878663.0","2022-12-19","12:56:03"
"11936","Quem disse que não","2022-12-19 12:56:14","331878663.0","2022-12-19","12:56:14"
"11937","Bom dia!
Tem que ser muito gado para acreditar que o covarde do Bolsonaro e das forças mamadas vão fazer algo.","2022-12-19 12:56:48","582034653.0","2022-12-19","12:56:48"
"11939","Isso.","2022-12-19 12:56:59","582034653.0","2022-12-19","12:56:59"
"11943","Exatamente","2022-12-19 13:00:37","1849277605.0","2022-12-19","13:00:37"
"11944","Concordo irmão.
O poder tem que vir do povo","2022-12-19 13:01:01","1849277605.0","2022-12-19","13:01:01"
"11947","Vc acredito nisso mesmo ?","2022-12-19 13:03:29","331878663.0","2022-12-19","13:03:29"
"11949","Irmão no dia 7 de setembro de 2021 , o Bolsonaro simplesmente abandonou a população","2022-12-19 13:03:50","1849277605.0","2022-12-19","13:03:50"
"11950","Ele pediu desculpas para o stf","2022-12-19 13:04:00","1849277605.0","2022-12-19","13:04:00"
"11951","Tem que acordar amigao","2022-12-19 13:04:11","1849277605.0","2022-12-19","13:04:11"
"11952","Eu também, sempre viagem todo Brasil, essas movimentação nunca existiram igual nós dias de hoje.","2022-12-19 13:04:23","1092389707.0","2022-12-19","13:04:23"
"11953","Tanka kkk","2022-12-19 13:04:51","1023435169.0","2022-12-19","13:04:51"
"11956","Estou coçando o saco para vc","2022-12-19 13:06:06","331878663.0","2022-12-19","13:06:06"
"11957","Não de moral para esse petista @jardineirodoeden","2022-12-19 13:06:15","1092389707.0","2022-12-19","13:06:15"
"11958","Vamos ficar brigando ou vamos nos unir para melhorar o Pais ?","2022-12-19 13:06:20","1849277605.0","2022-12-19","13:06:20"
"11960","E por que ele fechou com pfizer e ganhou milhões ?","2022-12-19 13:07:37","1849277605.0","2022-12-19","13:07:37"
"11961","Acorda irmão todos eles são iguais","2022-12-19 13:07:50","1849277605.0","2022-12-19","13:07:50"
"11962","Nenhum politico está com povo","2022-12-19 13:08:00","1849277605.0","2022-12-19","13:08:00"
"11963","Fala até eu falo.
Eu quero ver na prática","2022-12-19 13:08:30","1849277605.0","2022-12-19","13:08:30"
"11969","https://vxtwitter.com/tucabr54/status/1604807520476082176?t=rFG-ZhbRKtwv-qL9bcX8jg&s=19","2022-12-19 13:11:56","1106044660.0","2022-12-19","13:11:56"
"11972","Kkkkkkk. Que nível de demência é esse?","2022-12-19 13:17:40","582034653.0","2022-12-19","13:17:40"
"11974","Todo político é culpado de genocídio nesse país!

Os que não praticam, cometem o crime de prevaricação, logo tbm são culpados.

Inclusive, todo braço armado e justiça, dessa República fake.

Enquanto o povo não entender isso, vão ser reduzidos como ovelhas!","2022-12-19 13:18:28","5963773834.0","2022-12-19","13:18:28"
"11976","Não a político honesto","2022-12-19 13:20:47","1849277605.0","2022-12-19","13:20:47"
"11977","São todos da mesma forma","2022-12-19 13:20:56","1849277605.0","2022-12-19","13:20:56"
"11978","Exatamente","2022-12-19 13:21:12","1849277605.0","2022-12-19","13:21:12"
"11985","Bom dia gata","2022-12-19 13:23:09","5648547234.0","2022-12-19","13:23:09"
"11979","hsuahushausahusahsuahushausahusahsuahushausahusahsuahushausahusahsuahushausahusahsuahushausahusahsuahushausahusahsuahushausahusahsuahushausahusahsuahushausahusahsuahushausahusa","2022-12-19 13:21:36","1798425978.0","2022-12-19","13:21:36"
"11980","Me prometeram que o Lula não iria assumir","2022-12-19 13:21:58","5312712944.0","2022-12-19","13:21:58"
"11981","Nem perco mais meu tempo debatendo com um cara desse, profeta.

É muito fácil entender...

Faça a pergunta para essa pessoa:

Quantas doses ele tomou?

Só quem tem consciência disso, tem capacidade intelectual de entrar num debate político à altura desse tempo. Infelizmente.","2022-12-19 13:22:11","5963773834.0","2022-12-19","13:22:11"
"11982","O lula , Bolsonaro etc...
Eles são todos da mesma forma.
São todos ladrões que estão a pensar no interesse próprio","2022-12-19 13:22:34","1849277605.0","2022-12-19","13:22:34"
"11984","Todos!","2022-12-19 13:22:54","5963773834.0","2022-12-19","13:22:54"
"11986","Grupo errado para vc.","2022-12-19 13:23:38","5963773834.0","2022-12-19","13:23:38"
