"message_id","message","message_utc","from_id","date","time"
"11646","Entra no chat","2022-12-19 00:05:58","1029414221.0","2022-12-19","00:05:58"
"12331","Não entendi","2022-12-19 16:15:34","1591709786.0","2022-12-19","16:15:34"
"11644","Meu amigo ninguém aqui apoia político","2022-12-19 00:05:21","1849277605.0","2022-12-19","00:05:21"
"11635","Vdd","2022-12-19 00:00:33","5963773834.0","2022-12-19","00:00:33"
"11636","A maioria da população está cega","2022-12-19 00:00:40","5595380989.0","2022-12-19","00:00:40"
"11637","Na verdade a única solução está na união","2022-12-19 00:02:20","1849277605.0","2022-12-19","00:02:20"
"11639","Enquanto o povo usar o discurso de divisão ( ideologia pré moldada ) nada vai melhorar.
Temos que aprender a colocar nossas ideias de forma respeitosa.
E não ofender a nada e ninguém.","2022-12-19 00:03:04","1849277605.0","2022-12-19","00:03:04"
"11641","Todo o cenário do País está corrompido.
Atualmente não a político honesto.
É preciso uma reformulação no cenário político","2022-12-19 00:03:58","1849277605.0","2022-12-19","00:03:58"
"11647","Eu não apoio .
Por que está tudo corrompido","2022-12-19 00:06:01","1849277605.0","2022-12-19","00:06:01"
"11648","Pra poder entender o projeto","2022-12-19 00:06:12","1029414221.0","2022-12-19","00:06:12"
"11649","Não apoiamos nenhum politico","2022-12-19 00:06:34","1029414221.0","2022-12-19","00:06:34"
"11652","Irmão eu entrei neste grupo a alguns minutos e estou junto com vocês","2022-12-19 00:06:55","1849277605.0","2022-12-19","00:06:55"
"11654","Solução é acabar com todos esses bandos de políticos safados.","2022-12-19 00:07:29","1849277605.0","2022-12-19","00:07:29"
"11656","Estamos falando no chat","2022-12-19 00:08:15","1029414221.0","2022-12-19","00:08:15"
"11658","Solução está a ser discutido aqui meu amigo.
Cada vez mais grupos desta mesma forma vão continuar a crescer","2022-12-19 00:08:49","1849277605.0","2022-12-19","00:08:49"
"11660","As pessoas estão acordando para a realidade","2022-12-19 00:09:00","1849277605.0","2022-12-19","00:09:00"
"11662","Meu amigo esqueça todos esses políticos","2022-12-19 00:10:11","1849277605.0","2022-12-19","00:10:11"
"11663","Apenas tenha o foco em seu conhecimento","2022-12-19 00:10:36","1849277605.0","2022-12-19","00:10:36"
"11664","BOA ideia!!
MAS o  povo bolsonarista não vai aderir.....","2022-12-19 00:10:52","1166124464.0","2022-12-19","00:10:52"
"11666","Vai adiantar você ficar reclamando?","2022-12-19 00:11:56","1849277605.0","2022-12-19","00:11:56"
"11667","Ficar si divido carga vez mais aí pior ainda estratégia antiga divide e conquista","2022-12-19 00:12:14","5595380989.0","2022-12-19","00:12:14"
"12213","Que loucura!","2022-12-19 15:42:25","5852090402.0","2022-12-19","15:42:25"
"11669","A velha doutrinação de uma salvador de mentira","2022-12-19 00:13:00","1849277605.0","2022-12-19","00:13:00"
"11672","Lembro desse vídeo...!
Legítima defesa...!","2022-12-19 00:13:21","5740076974.0","2022-12-19","00:13:21"
"11673","BOLSONARO CUMPRIU TODA A AGENDA QUE OS COMUNISTAS TENTAVAM A DÉCADA E NÃO CONSEGUIAM POR CAUSA DOS PROTESTOS DO ELEITORADO DE ESQUERDISTAS CLASSE C e D UMA VEZ QUE ERA NÍTIDO ATÉ PRA UM JUMENTO SEREM PREJUDICIAL AOS TRABALHADORES.

IMPOSSIBILITOU A APOSENTADORIA

CRIOU UMA CARTEIRA DE TRABALHO SEM DIREITOS TRABALHISTAS

CRIOU SUB EMPREGOS POSSIBILITANDO AS TERCEIRIZAÇÕES

VENDEU ESTATAIS ESTRATÉGICAS 

DINHEIRO ÚNICO NA AMERICA LATRINA 
DEU O CRUZAMENTO PRO LULA FAZER O GOL 

ACERTOU COM A CHINA A NEGOCIAÇÃO DE MONITORAMENTO TOTAL DA POPULAÇÃO COM CÂMERAS DE CONTROLE TOTAL E O LULA AGORA SÓ TEM TOCAR PRO GOL

BOLSONARO É A ESQUERDA DA ESQUERDA
BOLSONARO É CRIAÇÃO DO LULA.","2022-12-19 00:13:53","1029414221.0","2022-12-19","00:13:53"
"11677","Exato.","2022-12-19 00:22:14","582034653.0","2022-12-19","00:22:14"
"11680","Siga  👉  t.me/gadodesperto","2022-12-19 00:30:34","1075320067.0","2022-12-19","00:30:34"
"11681","@CHAD_MAN","2022-12-19 00:35:25","1425585321.0","2022-12-19","00:35:25"
"11682","Quanto custa uma caixa de munição?","2022-12-19 00:36:27","1029414221.0","2022-12-19","00:36:27"
"11684","Depende,mas com 400 reais vc compra uma caixa com 50 balas ogival 124 grains da marca Federal..","2022-12-19 00:37:15","1425585321.0","2022-12-19","00:37:15"
"11685","600 reais a caixa com 20 Federal Punch 135 grains, padrão do FBI","2022-12-19 00:37:40","1425585321.0","2022-12-19","00:37:40"
"11686","9mm que tô dizendo","2022-12-19 00:37:52","1425585321.0","2022-12-19","00:37:52"
"11687","Entendi","2022-12-19 00:38:03","1029414221.0","2022-12-19","00:38:03"
"11688","Blister com 10 balas da cbc é uns 70 reais.. mas cbc a qualidade é inferior as importadas,blazer,fiocchi, federal..","2022-12-19 00:39:00","1425585321.0","2022-12-19","00:39:00"
"11689","Aproveita que o Alex tá na call e pergunta algo pra ele","2022-12-19 00:39:32","1601364718.0","2022-12-19","00:39:32"
"11690","Obrigado","2022-12-19 00:40:38","1029414221.0","2022-12-19","00:40:38"
"11692","Dizem que a ts9 é o melhor projeto da Taurus, só tem que tomar cuidado com a limpeza, pois como ela é mais fechada que uma g3 da vida qualquer 50 tiros já suja bastante por dentro.","2022-12-19 00:42:15","739955956.0","2022-12-19","00:42:15"
"11693","https://t.me/tupireport","2022-12-19 00:44:10","1601364718.0","2022-12-19","00:44:10"
"11694","Acho a ts9 em termos de funcionalidade melhor que a glock,gatilho mais leve,reset menor.. só perde na qualidade do polímero,sem duvidas a ts9 é o melhor projeto da taurus. Meu amigo dono de clube de tiro tem uma ts9 com 300mil tiros,só troca agulha que quebra por volta dos 50 a 100 mil tiros..","2022-12-19 00:44:29","1425585321.0","2022-12-19","00:44:29"
"11695","Parece que eles pegaram sugestões das forças policiais pro desenvolvimento dela. É muito boa. Ainda tenho vontade de ter uma.","2022-12-19 00:46:36","739955956.0","2022-12-19","00:46:36"
"11696","Além de ser boa não é cara em relação às outras.","2022-12-19 00:46:59","739955956.0","2022-12-19","00:46:59"
"11697","https://www.youtube.com/live/AsgQrqhnF6w?feature=share","2022-12-19 00:47:11","5826292137.0","2022-12-19","00:47:11"
"11698","Compra logo,ano que vem vai ser muito difícil, ts9 é excelente custo benefício","2022-12-19 00:47:18","1425585321.0","2022-12-19","00:47:18"
"11699","Infelizmente já comprei o que dava neste ano. Agora estou sem dinheiro nem limite no momento.","2022-12-19 00:48:17","739955956.0","2022-12-19","00:48:17"
"11701","🇧🇷","2022-12-19 00:49:55","1601364718.0","2022-12-19","00:49:55"
"11702","Manifestação Comando Militar do Nordeste Recife PE 18/12/22
https://youtu.be/N_sVv21xUgk","2022-12-19 00:50:39","1476324989.0","2022-12-19","00:50:39"
"11703","🇺🇦","2022-12-19 00:50:41","1601364718.0","2022-12-19","00:50:41"
"11704","O Brasil precisa de uma RevoluÇÃO, mas poucos estão dispostos a encarar uma guerra civil,só matando a corja que irá começar a resolver o problema.","2022-12-19 00:51:16","1425585321.0","2022-12-19","00:51:16"
"11705","Manifestação QG Belém do Pará 18/12/22 20:47 h
https://youtu.be/Ie7nSSpVhik","2022-12-19 00:52:13","1476324989.0","2022-12-19","00:52:13"
"11706","Resultado das manifestações até a presente data de 15 de dezembro. 

1- Lula não conseguiu definir ministros de outros Partidos mostrando isolamento total.

2 - Dos 40 ministérios apenas 7 foram definidos. 

- Casa Civil com ex  Governador da Bahia pelo PT Rui Costa. 

- Fazenda com Fernando Haddad. 

- Ministério da Cultura  com uma  cantora sem nenhuma expressão. 

Ministério do Trabalho com Camilo Santana ex Governador do Ceará pelo PT. 

Ministério de Minas Energia com Renan Filho ex Governador de Alagoas. 

Ministério da Justiça com  Flávio Dino PSB ex Governador do Ceará. 

*perceba o consórcio nordeste*

Relações Exteriores um diplomata de carreira e no Ministério da defesa um ex deputado muito ligado a Bolsonaro para acalmar forças armadas. 

Meio Ambiente Marina Silva do Rede sustentabilidade. 

Nas Forças Armadas foram anunciados generais pelo critério de antiguidade. 


O PT não tem indicações do PDT, PV , PC do B , PSOL. 

O PT não tem indicações para o PSDB , PSD , PP , UNIÃO BRASIL. 


O que tá ocorrendo?


Até agora o orçamento não foi definido. 

Não há ministros em áreas essenciais como saúde. 

A mudança da lei das Estatais aprovada na Câmara não vai ser aprovada no Senado; pois hoje o Rodrigo Pacheco disse que não colocaria em votação. 

Logo, o Aloísio Mercadante terá dificuldades de permanecer no BNDS. 

Banco Central afirma que vai manter política e seu Presidente liberal  afirma que vai permanecer. 

Bolsa de valores perdeu mais de 700 bilhões em valores de mercado.

19 processos contra Alexandre de Moraes abertos no STM. 

CPI para investigar STF aprovada na Câmara. 

CÂMARA DOS DEPUTADOS NÃO VOTOU A PEC DO FURA TERO APROVADA NO SENADO 

DIA 22 O CONGRESSO ENTRA EM RECESSO.   

O STF AO JULGAR O ORÇAMENTO SECRETO, VOLTOU ATRÁS. 

Bolsonaro por lei tinha até 15 dias antes da posse de Lula para deixar a residência e não deixou. 

Os Comandantes do Exército, Aeronáutica e Marinha não deixaram os seus respectivos cargos. 

As manifestações seguem em todo o Brasil. 

STJ decide pela compra dos tanques. 

Forças Armadas iniciam diversos treinamentos em todo o país e baixa regulamento de Mobilização Nacional …

Ministério da Defesa chama reservistas e investe na reserva pró ativa. 

Bolsonaro realiza  remanejamento em 300 cargos da Presidência. 

Bolsonaro indica 12 diplomatas e Senado aprova. 

Bolsonaro realiza  remanejamento de diversos Generais e realiza promoções. 

Bolsonaro libera milhões para compras de combustível em quantidade anormal. 

Ministério da Defesa desapropria área destinada a energia nuclear. 

Ministerio da Defesa cadastra empresas em diversas áreas inclusive indústrias para um suposto Estado de Mobilização para Guerra. 

*Você acha que realmente nada aconteceu por causa das manifestações ?*

Este é só um resumo. 

Próxima semana é crucial. 

19  Segunda-feira ocorre a diplomação de todos os os eleitos e o TSE não poderá mais usar tal moeda de troca para silenciar os eleitos.

Dia 20  Terça-feira retorna o julgamento no STF do orçamento secreto. 

21 e 22 a Câmara encerra suas atividades com a votação da PEC e a lei das Estatais o Senado não vai votar. 

O Lula tem poucos dias para dizer aos partidos como PSD, PSDB , MDB ( Simone Tebet ), UNIÃO BRASIL e PP o que será dado a eles.

Vale lembrar que Kassab do PSD já é secretário de Tarcísio.  

Vale lembrar que em Minas Gerais vários aliados do centro já estão com cargos...

Vale lembrar que até mesmo o governador do Rio Grande do Sul rompeu nesta semana com Lula.

E para não dizer que não falei das flores o SBT teve a sua concessão renovada. 

Já a Globo que venceu antes do SBT, ainda não.


Estes dois próximos finais se semanas serão cruciais. 

Não se engane que muita coisa está acontecendo.


BRASIL ACIMA DE TUDO! 
DEUS ACIMA DE TODOS!

SELVA ! AÇO ! 

🇧🇷🐆","2022-12-19 00:53:33","1425585321.0","2022-12-19","00:53:33"
"11707","Manifestação Joinville 21:12 h hoje 18/12
https://youtu.be/rbTRLWHMB-k","2022-12-19 00:54:31","1476324989.0","2022-12-19","00:54:31"
"11708","Manifestação Maringá PR 18/12/22
https://youtu.be/tJ5ympg23Z4","2022-12-19 00:55:53","1476324989.0","2022-12-19","00:55:53"
"11709","queria poder iniciar uma revelação mas no momento nao me vejo nessa posição,  estou estudando programação pra poder começar algo na internet","2022-12-19 00:56:37","5075836514.0","2022-12-19","00:56:37"
"11710","Revolução****","2022-12-19 00:56:51","5075836514.0","2022-12-19","00:56:51"
"11711","Manifestação Campinas SP agora a noite 18/12
https://youtube.com/shorts/qiYmErlZ-Ck?feature=share","2022-12-19 00:57:36","1476324989.0","2022-12-19","00:57:36"
"11712","Sinto que eu terei algum papel fundamental para ajudar a todos, desde sempre senti que faria a mudança","2022-12-19 00:57:44","5075836514.0","2022-12-19","00:57:44"
"11713","Brasileiro na maioria não tem peito pra RevoluÇÃO, estão apenas vendo as coisas piorarem, sempre que surge um grupo pro revolucao a direita os chama de bravatas, tinha que matar a corja,seja com drone kamikaze carregado de bomba, seja com armas ,mas a corja tem que morrer,os traidores devem ir a forca em praça pública!!!!!","2022-12-19 00:58:50","1425585321.0","2022-12-19","00:58:50"
"11714","Amen","2022-12-19 01:00:36","5075836514.0","2022-12-19","01:00:36"
"11715","Amem*","2022-12-19 01:00:47","5075836514.0","2022-12-19","01:00:47"
"11716","Não esperem nada das forças armadas,os generais são todos bundoes sem culhões, infelizmente o stf que manda no Brasil,enquanto não exterminar os 11 ministros, nada mudará","2022-12-19 01:00:49","1425585321.0","2022-12-19","01:00:49"
"11717","Manifestação 2º Batalhão de Infantaria Leve em São Vicente 18/12/22
https://youtube.com/shorts/SL6QXwHleoY?feature=share","2022-12-19 01:01:03","1476324989.0","2022-12-19","01:01:03"
"11718","Isso que tem que fazer com os 11 ministros. Olha eles aí, ardendo no 🔥","2022-12-19 01:02:35","1425585321.0","2022-12-19","01:02:35"
"11721","Olha aí o que o Cabeça de ovo estragado pretende fazer a todos os não vacinados até a posse de lula.
Miserável, anjo caído dos infernos....
https://t.me/AseitadoNazareno","2022-12-19 01:06:42","2037587735.0","2022-12-19","01:06:42"
"11766","Está é a mesma sensação que eu sinto .
Todos que estão aqui também sente está a mesma coisa.
Nada acontece por acaso.
Somos compostos da mesma matéria.( Atomos = Energia ).
Toda materia está em constante expansão e movimento.
A energia trabalha de forma sincronizada.
Então as energias estão se atraindo a todo momento.
 Se estamos aqui neste grupo do agora é por que estamos todos a ressoar a mesma energia.
Mesmo que os pensamentos sejam diferente.
Então se você tem um sentindo e sabe que deve fazer algo para ajudar a todos , então vá e faça.
Não peça opiniões a ninguém , a unica pessoa que sabe do seu potencial é você mesmo.
A muitas pessoas que ainda estão pressas a ideologias pré moldadas .
E afirmar que você pode tazer algo para mudar a vida de muitos é uma afirmação muito forte para os que estão  dormindo ainda.
Eu tenho certeza que  este mundo vai ser um lugar melhor.
Eu afirmo por que  eu sempre acreditei e vou continuar acreditando.
Toda crença é uma impulso de energia .
O impulso move a matéria.
Já que somos todos compostos por energia , então podemos mudar basta crer.","2022-12-19 03:16:35","1849277605.0","2022-12-19","03:16:35"
"11726","Meus filhos sao meu controle se não ja teria feito uma merda grande para iniciar uma guerra mas em compensação eles me fazem ter que pensar bastante e estudar muito pra fazer tudo muito bem estudado pra poder viver em paz com eles","2022-12-19 01:07:42","5075836514.0","2022-12-19","01:07:42"
"11767","Boa noite a todos.","2022-12-19 03:17:31","1849277605.0","2022-12-19","03:17:31"
"11782","Grande novidade isso censura de merda","2022-12-19 05:12:09","5595380989.0","2022-12-19","05:12:09"
"11741","Enviei alguns PDF sobre construção de armas caseiras e manuais de explosivos","2022-12-19 01:11:43","1425585321.0","2022-12-19","01:11:43"
"11742","Pessoal cortaram a internet do RJ do centro","2022-12-19 01:19:55","5595380989.0","2022-12-19","01:19:55"
"11743","Qual lugar?","2022-12-19 01:20:43","5589358448.0","2022-12-19","01:20:43"
"11744","“Se for preciso a gente acampa, mas o ladrão não sobe a rampa”
https://youtube.com/shorts/aAx7rz7WXGA?feature=share","2022-12-19 01:22:01","1476324989.0","2022-12-19","01:22:01"
"11745","Motociata em frente ao Comando Militar do Sul em Porto Alegre 18/12/22
https://youtu.be/jLyC_NqAEtw","2022-12-19 01:24:19","1476324989.0","2022-12-19","01:24:19"
"11747","🚨🚨🚨 LIBERDADE PARA OS BRASILEIROS🚨🚨🚨

Nosso objetivo é a Bandeira do BRASIL ser a bandeira de uma nação livre e soberana.","2022-12-19 01:24:38","1029414221.0","2022-12-19","01:24:38"
"11748","Amigo, todo nosso talento pode ser usado nesse momento!

O mais importante é vc estar intelectualmente fora do sistema. Agora, ensine outros o que vc sabe.

Ajude as pessoas entenderem que enquanto elas dão legitimidade para esse sistema, seja em qualquer campo; político, econômico e etc... Nunca nada irá mudar.

Na eleição, a única maneira é não votar!

Assim, o sistema cai!

Traga pessoas para esse grupo. Faça as pessoas entrarem no chat para aprender.

Assista e faça conhecido os vídeos do Alex, viralise-os. Faça o mesmo com o filme Winter on fire!

Abraço!","2022-12-19 01:26:39","5963773834.0","2022-12-19","01:26:39"
"11783","Mano quem quer saber de voto essa altura do campeonato quero é mete bala em petista porra","2022-12-19 05:12:26","1106044660.0","2022-12-19","05:12:26"
"11750","Sempre fiz isso e continuo fazendo","2022-12-19 01:36:15","5075836514.0","2022-12-19","01:36:15"
"11752","Manifestação Belém PA agora a noite 21:30 h 18/12/22
https://youtu.be/7w4fcXMAbMs","2022-12-19 01:48:23","1476324989.0","2022-12-19","01:48:23"
"11762","Vamos mudar o sistema.
Mas não podemos esquecer de respeitar.
Não vamos ofender aquele que pensa de forma diferente.
É preciso explicar e esperar , até o momento que a pessoa vai aceitar a verdade.
 Que a solução esta na união.
Podemos crescer está ideia para algo sem limites.","2022-12-19 03:02:06","1849277605.0","2022-12-19","03:02:06"
"11763","🇧🇷-GRUPO PARA CRISTÃOS PATRIOTAS--ENTRE-🔰

CRISTÃO 
https://t.me/cristaospatriotas1

CATÓLICO 
https://t.me/catolicospatriotas

EVANGÉLICO
https://t.me/evangelicospatriotas","2022-12-19 03:08:02","5965816661.0","2022-12-19","03:08:02"
"11764","Irmão não devemos pensar de forma negativa.
Tudo vai da certo.
Nada nesta realidade acontece por acaso.","2022-12-19 03:08:18","1849277605.0","2022-12-19","03:08:18"
"11765","Estão divulgando s verdade agora,depois do estrago.","2022-12-19 03:15:03","865816249.0","2022-12-19","03:15:03"
"11769","🇧🇷-𝗚𝗥𝗨𝗣𝗢𝗦 𝗖𝗢𝗠 𝗖𝗛𝗔𝗧 𝗔𝗕𝗘𝗥𝗧𝗢 | 𝗣𝗔𝗥𝗔 𝗧𝗥𝗢𝗖𝗔𝗥 𝗠𝗘𝗡𝗦𝗔𝗚𝗘𝗡𝗦 𝗔 𝗩𝗢𝗡𝗧𝗔𝗗𝗘 

https://t.me/+TjWY4AZR1aA4MmE5

https://t.me/+WeVov9K8qK42NDdh

https://t.me/+4PFLhD8jkjw5MjRh

🔰-NÃO PERCA!!! ENTRE AGORA MESMO

https://t.me/+6AVXJA65CJE0ZmIx

https://t.me/+jyKqqe5R_M4xNTk5

https://t.me/+BzBiWxVEB3QyMzFh

𝙀𝙉𝙏𝙍𝙀 𝙉𝙊 𝙈𝘼𝙓𝙄𝙈𝙊 𝘿𝙀 𝙂𝙍𝙐𝙋𝙊𝙎!! 🇧🇷🇧🇷","2022-12-19 03:35:20","5965816661.0","2022-12-19","03:35:20"
"11770","Nasci em 1964 , não tinha Internet,  e quando as pessoas foram as ruas ninguém pensou em si, mas no Brasil. 
Minha geração foi ensinada a amar o seu país acima de tudo, amar ao ponto de fazer sacrifios para que o Brasil não fosse usurpado por terroristas. 
Ficaram em casa quietinhos por causa da pandemia e ninguém reclamou, agora vamos fazer isso pelo país. 🇧🇷🇧🇷🇧🇷🇧🇷
Quando foi pra obedecer globalista todo mundo aceitou,  porque agora estão questionando?","2022-12-19 03:38:51","1106044660.0","2022-12-19","03:38:51"
"11771","Já era o gado não quer nada não.","2022-12-19 04:00:49","2128894062.0","2022-12-19","04:00:49"
"11774","Não deve pensar de forma negativa irmão.
E não devemos ofender aqueles que pensam de forma diferente.
Você também estava dormindo em algum ponto de sua vida.
Não devemos chamar ninguém de gado .
Vamos fazer as coisas de forma correta","2022-12-19 04:20:50","1849277605.0","2022-12-19","04:20:50"
"11775","Eu não  estou aqui para apontar o erro de ninguém.
Até por que ainda tenho muitos.
Mas vamos fazer esse grupo crescer de forma correta e podemos sim mudar este país.
Toda mudança começa com uma ideia .","2022-12-19 04:22:37","1849277605.0","2022-12-19","04:22:37"
"11777","""Previsão legal da pena de morte
O inciso XLVII, do artigo 5º, da Constituição Federal - CF diz que em nossa nação não haverá penas de morte, salvo em caso de guerra declarada (alínea “a”).14 de jan. de 2021
https://jus.com.br › artigos › no-bra...
No Brasil ainda existe a previsão de pena de morte? - Jus.com.br
""
https://www.google.com/search?q=pena+de+morte+no+brasil&oq=pena+de+morte+no+Brasil+&aqs=chrome.0.0i271j69i57j0i512l8.8475j0j7&client=ms-android-motorola-rvo3&sourceid=chrome-mobile&ie=UTF-8&safe=active&ssui=on#:~:text=Previs%C3%A3o%20legal%20da%20pena,morte%3F%20%2D%20Jus.com.br","2022-12-19 04:40:39","1106044660.0","2022-12-19","04:40:39"
"11799","Que merda","2022-12-19 07:55:05","1425585321.0","2022-12-19","07:55:05"
"11779","https://twitter.com/elonmusk/status/1604617643973124097?t=IzbCYafTW-FnfRXMU6uTVw&s=35","2022-12-19 04:43:20","907665053.0","2022-12-19","04:43:20"
"11781","https://twitter.com/elonmusk/status/1604617643973124097?t=IzbCYafTW-FnfRXMU6uTVw&s=35","2022-12-19 04:47:35","907665053.0","2022-12-19","04:47:35"
"11784","https://vxtwitter.com/ProfMarcioBand/status/1604495591819673602?t=sA1-NPV8F9fEMdGJXuXYmw&s=19","2022-12-19 05:12:50","1106044660.0","2022-12-19","05:12:50"
"11785","Pois eh coisa inútil isso negócio de idiota de voto velho","2022-12-19 05:13:22","5595380989.0","2022-12-19","05:13:22"
"11787","É galera, se sair uma guerra entre Servia e Kosovo, a coisa vai esquentar na Europa

Kosovo abriga a maior base militar externa dos EUA","2022-12-19 05:23:23","1425585321.0","2022-12-19","05:23:23"
"11788","Entre na política! Pq sem política nada vai se resolver. O q precisamos é melhorar a política","2022-12-19 05:30:57","5852090402.0","2022-12-19","05:30:57"
"11789","Eu viajo o Brasil inteiro. Estas movimentações sempre existiram, prezado!","2022-12-19 05:35:22","5852090402.0","2022-12-19","05:35:22"
"11790","https://twitter.com/EdRaposoBrasil/status/1604228871720771585?t=TICnvlNFqR7i-JQgLhRG1A&s=19","2022-12-19 05:37:46","1106044660.0","2022-12-19","05:37:46"
"11791","https://youtu.be/owMe53g5QRA","2022-12-19 05:37:59","1106044660.0","2022-12-19","05:37:59"
