"message_id","message","message_utc","from_id","date","time"
"12485","Ele avisou.","2022-12-19 18:16:02","1290823452.0","2022-12-19","18:16:02"
"12515","Depois acha ruim de ser chamado de petista. Olha o que você está dizendo","2022-12-19 18:29:12","1092389707.0","2022-12-19","18:29:12"
"12486","https://www.docdroid.net/bWJkr74/resolucao-creden-gsi-pr-no-23-de-16-de-dezembro-de-2022-resolucao-creden-gsi-pr-no-23-de-16-de-dezembro-de-2022-dou-imprensa-nacional-pdf","2022-12-19 18:16:54","1106044660.0","2022-12-19","18:16:54"
"12488","Esperem sentados alienados.","2022-12-19 18:17:24","1290823452.0","2022-12-19","18:17:24"
"12489","amigo, mandei este texto para meu amigo comandante da fab, ele gostou bastante, está mandando um audio neste momento","2022-12-19 18:18:34","5413993109.0","2022-12-19","18:18:34"
"12492","Vocês amam passar a perna nos outros.","2022-12-19 18:20:56","582034653.0","2022-12-19","18:20:56"
"12493","Exato mano, a evolução da espécie humana depende disso, ou o regresso se nada for feito","2022-12-19 18:21:22","5075836514.0","2022-12-19","18:21:22"
"12496","Bostil.","2022-12-19 18:22:22","1290823452.0","2022-12-19","18:22:22"
"12497","Petistas tenham orgulho apareçam assim fica mais facil de matá-los","2022-12-19 18:22:25","1106044660.0","2022-12-19","18:22:25"
"12498","É sim. Bolsonarista = petista.","2022-12-19 18:22:59","582034653.0","2022-12-19","18:22:59"
"12499","Você de novo com está narrativa irmão.","2022-12-19 18:23:04","1849277605.0","2022-12-19","18:23:04"
"12503","Ficar brigando em pelo mesmo coisa não resolve nada","2022-12-19 18:23:39","5595380989.0","2022-12-19","18:23:39"
"12504","Tão um como outra trabalha por mesmo fim destruição da nação","2022-12-19 18:24:16","5595380989.0","2022-12-19","18:24:16"
"12505","A lenda","2022-12-19 18:24:30","1092389707.0","2022-12-19","18:24:30"
"12506","Tem uns petista doente aqui. Choram de mais","2022-12-19 18:24:55","1092389707.0","2022-12-19","18:24:55"
"12508","Todo mundo que não lambe o meu mico é petista. Vai tomar no cu.","2022-12-19 18:26:26","582034653.0","2022-12-19","18:26:26"
"12509","Petistas lambedor de saco tem em todas partes","2022-12-19 18:26:38","961798442.0","2022-12-19","18:26:38"
"12510","Esses doente mesmo não tem jeito não","2022-12-19 18:26:51","5595380989.0","2022-12-19","18:26:51"
"12512","Poxa sem ofender rapaziada","2022-12-19 18:28:06","1849277605.0","2022-12-19","18:28:06"
"12514","Vamos falar de forma educada po.
Se por acaso entrar alguém aqui que apoia o Lula , temos que ter uma educação , explicar o cenario.
E mesmo que a pessoa não mude em alguns pontos , sera mais uma para melhorar nosso país.
Com a divisão não vamos chegar a lugar nenhum","2022-12-19 18:29:09","1849277605.0","2022-12-19","18:29:09"
"12516","Jalin Habey é maluco Irmão...!kkkkkk","2022-12-19 18:30:17","5740076974.0","2022-12-19","18:30:17"
"12517","Vídeo de Jorge","2022-12-19 18:30:25","1516782674.0","2022-12-19","18:30:25"
"12521","Petista é gente da sua laia,rapaz.
Sai de 2018 e para de acusar os outros do que você é.","2022-12-19 18:31:04","582034653.0","2022-12-19","18:31:04"
"12522","Quer levar uma cutucada?","2022-12-19 18:31:22","582034653.0","2022-12-19","18:31:22"
"12523","Jalin, boa tarde. Estou vendo que você gosta de dialogar, para tal a crescente influência da mídia estimula a padronização das formas de ação. Todavia, o desenvolvimento contínuo de distintas formas de atuação faz parte de um processo de gerenciamento do sistema de participação geral.","2022-12-19 18:31:48","1155751177.0","2022-12-19","18:31:48"
"12524","Verdade.","2022-12-19 18:32:43","582034653.0","2022-12-19","18:32:43"
"12525","Sai fora doidão...","2022-12-19 18:33:14","5740076974.0","2022-12-19","18:33:14"
"12526","É o que eu falo, o desafiador cenário globalizado assume importantes posições no estabelecimento das direções preferenciais no sentido do progresso. No entanto, não podemos esquecer que a percepção das dificuldades prepara-nos para enfrentar situações atípicas decorrentes das regras de conduta normativas. O que temos que ter sempre em mente é que a expansão dos mercados mundiais é uma das consequências dos índices pretendidos.","2022-12-19 18:33:39","1155751177.0","2022-12-19","18:33:39"
"12527","Estou curioso pra ouvir. Manda ai","2022-12-19 18:35:12","5852090402.0","2022-12-19","18:35:12"
"12528","Não seja assim.","2022-12-19 18:37:14","582034653.0","2022-12-19","18:37:14"
"12529","Eu sou totalmente a favor do que é antigo, essas novidades não me animam em nada.","2022-12-19 18:38:16","582034653.0","2022-12-19","18:38:16"
"12530","Valentão de telegram. Babaca, criminoso. Vai queimar a rosca na barraca na frente do quartel, broxa miserável. Chupador de rola! Vai a merda, facista!","2022-12-19 18:38:43","5852090402.0","2022-12-19","18:38:43"
"12531","Este Navarro vai ser preso!","2022-12-19 18:39:09","5852090402.0","2022-12-19","18:39:09"
"12532","É o próximo.","2022-12-19 18:39:20","5852090402.0","2022-12-19","18:39:20"
"12533","Nunca se mente tanto quanto, durante as guerras, antes das eleições e, depois da caça...!!!

É complicado mesmo...!!!","2022-12-19 18:39:27","5740076974.0","2022-12-19","18:39:27"
"12534","Navarro é tchutchuca de pastor","2022-12-19 18:39:54","5852090402.0","2022-12-19","18:39:54"
"12535","Eu também, essa questão tecnológica considerando que temos bons administradores de rede, o comprometimento entre as equipes de implantação é um ativo de TI dos requisitos mínimos de hardware exigidos. A implantação, na prática, prova que a consulta aos diversos sistemas faz parte de um processo de gerenciamento de memória avançado da rede privada. Não obstante, a valorização de fatores subjetivos exige o upgrade e a atualização do tempo de down-time que deve ser mínimo.","2022-12-19 18:39:57","1155751177.0","2022-12-19","18:39:57"
"12536","Chamou o cara de facista, já sei que é babaca.","2022-12-19 18:40:35","582034653.0","2022-12-19","18:40:35"
"12537","Vai junto com ele, vc tbem","2022-12-19 18:41:16","5852090402.0","2022-12-19","18:41:16"
"12538","Frustrado de merda","2022-12-19 18:41:32","5852090402.0","2022-12-19","18:41:32"
"12539","Tudo isso só nos leva a uma destruição da sociedade, pois faz com que fiquemos robóticos e controláveis.","2022-12-19 18:42:36","582034653.0","2022-12-19","18:42:36"
"12540","Melhor ser facista do que comunista, monte de bosta.","2022-12-19 18:43:05","582034653.0","2022-12-19","18:43:05"
"12541","Vem fazer glu glu.","2022-12-19 18:43:20","582034653.0","2022-12-19","18:43:20"
"12542","VOCÊ VIU?

Video: PM debocha de bolsonarista: 'Suma, patriotário! Gravação que circula nas redes sociais mostra policial dispersando manifestantes na segunda-feira (12/12), durante atos de vandalismo e tentativa de invasão à sede da PF

https://www.em.com.br/app/noticia/politica/2022/12/18","2022-12-19 18:43:51","1290823452.0","2022-12-19","18:43:51"
"12544","https://youtu.be/TnwDrBalndw","2022-12-19 18:45:43","1064240218.0","2022-12-19","18:45:43"
"12548","É muito esculacho...! Foi banido...!","2022-12-19 18:48:28","5740076974.0","2022-12-19","18:48:28"
"12550","Rato petista","2022-12-19 18:49:28","1106044660.0","2022-12-19","18:49:28"
"12552","Irmão, os traidores da pátria, já existem...!","2022-12-19 18:51:12","5740076974.0","2022-12-19","18:51:12"
"12553","Cara e jeito de fakenews.","2022-12-19 18:51:46","1290823452.0","2022-12-19","18:51:46"
"12554","Pede pra executar","2022-12-19 18:52:57","1106044660.0","2022-12-19","18:52:57"
"12556","Esse sobrenome, te lembra alguma coisa...!
(Comte)","2022-12-19 18:54:18","5740076974.0","2022-12-19","18:54:18"
"12559","Mais merda saindo pela boca","2022-12-19 18:55:13","5852090402.0","2022-12-19","18:55:13"
"12560","Quem controla o passado, controla o presente, quem controla o presente, controla o, futuro...! (George Orwell)","2022-12-19 18:56:02","5740076974.0","2022-12-19","18:56:02"
"12562","Sejam escravos ai se fode ai","2022-12-19 18:56:31","1106044660.0","2022-12-19","18:56:31"
"12563","Essa praga não vai vir pra cá","2022-12-19 18:56:50","1106044660.0","2022-12-19","18:56:50"
"12564","Tira isso do plural...!","2022-12-19 18:57:23","5740076974.0","2022-12-19","18:57:23"
"12565","Irmão, depende de quem, pra isso não chegar aqui...?","2022-12-19 18:59:40","5740076974.0","2022-12-19","18:59:40"
"12567","Navarro deve ser da turma do Zé Trovao, o caminhoneiro que não tem caminhão","2022-12-19 19:01:42","5852090402.0","2022-12-19","19:01:42"
"12568","Kkkkkk","2022-12-19 19:02:21","1029414221.0","2022-12-19","19:02:21"
"12569","Caraca, até rimou...!!! Rsrs","2022-12-19 19:02:34","5740076974.0","2022-12-19","19:02:34"
"12571","A paz, queremos com fervor, a guerra, só nos causa dor, e quando a pátria amada, for um dia ultrajada, lutaremos sem temor...!!!! A pátria está sendo ultrajada Irmão...!!!!","2022-12-19 19:04:47","5740076974.0","2022-12-19","19:04:47"
"12574","Vcs que tomaram a picada do cão para mim vcs são doido","2022-12-19 19:07:14","331878663.0","2022-12-19","19:07:14"
"12576","carta do game Steve Jacaon INWO","2022-12-19 19:08:20","331878663.0","2022-12-19","19:08:20"
"12577","Quel foi a intenção disso...? Caraca...","2022-12-19 19:08:22","5740076974.0","2022-12-19","19:08:22"
"12578","A AUTO COMBUSTÃO HUMANA!

Algo foi colocado dentro das pessoas que, com a ativação de frequência adequada, as frita de dentro para fora.","2022-12-19 19:09:19","331878663.0","2022-12-19","19:09:19"
"12579","Caraca...","2022-12-19 19:10:09","5740076974.0","2022-12-19","19:10:09"
"12580","Caraca maluco...!!!!","2022-12-19 19:10:55","5740076974.0","2022-12-19","19:10:55"
"12581","Satânico...! Que Isso...","2022-12-19 19:11:45","5740076974.0","2022-12-19","19:11:45"
"12582","O cão","2022-12-19 19:12:24","331878663.0","2022-12-19","19:12:24"
"12583","Eu nem tenho medo fogo","2022-12-19 19:12:52","5648547234.0","2022-12-19","19:12:52"
"12584","Esses caras são psicopatas...","2022-12-19 19:13:09","5740076974.0","2022-12-19","19:13:09"
"12586","alvorada 19/12/22","2022-12-19 19:20:52","2128894062.0","2022-12-19","19:20:52"
"12588","Gol quadrado lindão, anda igual notícia ruim...!(carro)","2022-12-19 19:22:45","5740076974.0","2022-12-19","19:22:45"
"12590","https://youtu.be/TnwDrBalndw","2022-12-19 19:23:49","1064240218.0","2022-12-19","19:23:49"
"12591","Brasil paralelo, é bacana...!","2022-12-19 19:25:41","5740076974.0","2022-12-19","19:25:41"
"12594","Patriotas, no Alvorada","2022-12-19 19:28:51","1092389707.0","2022-12-19","19:28:51"
"12597","…..msg com erros de ortografia são na sua grande maioria FAKE NEWS ! 
ACORDEM !","2022-12-19 19:30:25","1564306389.0","2022-12-19","19:30:25"
"12598","Os burraldos comunopetistas, nem escola tem…..portanto….","2022-12-19 19:31:21","1564306389.0","2022-12-19","19:31:21"
"12599","Fonte: arial 12.","2022-12-19 19:31:52","582034653.0","2022-12-19","19:31:52"
"12600","https://www.docdroid.net/bWJkr74/resolucao-creden-gsi-pr-no-23-de-16-de-dezembro-de-2022-resolucao-creden-gsi-pr-no-23-de-16-de-dezembro-de-2022-dou-imprensa-nacional-pdf","2022-12-19 19:33:29","1106044660.0","2022-12-19","19:33:29"
"12601","https://instagram.com/rafaelsatie?igshid=YmMyMTA2M2Y=

Esse rapaz, está transmitindo AO VIVO, todos os Patriotas no Alvorada.","2022-12-19 19:34:08","1092389707.0","2022-12-19","19:34:08"
"12602","Em breve você vai acordar irmão","2022-12-19 19:34:11","1849277605.0","2022-12-19","19:34:11"
"12604","Assim como todos os outros vão","2022-12-19 19:34:22","1849277605.0","2022-12-19","19:34:22"
"12605","Vou la vê","2022-12-19 19:34:49","2128894062.0","2022-12-19","19:34:49"
"12606","E só uma coisa.
Espero que você tenha educação com as pessoas aqui","2022-12-19 19:35:40","1849277605.0","2022-12-19","19:35:40"
"12608","Não fique ofendendo as pessoas por não concordar com sua opinião","2022-12-19 19:36:00","1849277605.0","2022-12-19","19:36:00"
"12609","Vocês irão pagar pra Deus tudo o que estão fazendo com a população brasileira.","2022-12-19 19:36:13","582034653.0","2022-12-19","19:36:13"
"12624","Poxa como vamos mudar algo se ninguém respeita , ninguém","2022-12-19 19:39:33","1849277605.0","2022-12-19","19:39:33"
"12611","Então cai fora","2022-12-19 19:36:14","1564306389.0","2022-12-19","19:36:14"
"12612","Até que enfim encontro um irmão esclarecido por aqui... afff! Estava achando que só eu tinha essa interpretação.","2022-12-19 19:36:26","1575408277.0","2022-12-19","19:36:26"
"12613","Ok irmão , então sai","2022-12-19 19:36:35","1849277605.0","2022-12-19","19:36:35"
"12614","….vc tem o primário completo ?","2022-12-19 19:36:57","1564306389.0","2022-12-19","19:36:57"
"12615","Já que você não consegue tratar alguém com respeito , como quer um mundo melhor","2022-12-19 19:37:00","1849277605.0","2022-12-19","19:37:00"
"12632","PETISTA É O TEU CU, FILHO DA PUTA.","2022-12-19 19:41:57","582034653.0","2022-12-19","19:41:57"
"12617","Você acha que só você é provido de conhecimento irmão ?
 Você acha que ninguém aqui sabe ler ?","2022-12-19 19:37:46","1849277605.0","2022-12-19","19:37:46"
"12618","Você precisa respeitar a opiniões cara","2022-12-19 19:37:58","1849277605.0","2022-12-19","19:37:58"
"12620","Meus ovos","2022-12-19 19:38:19","5755057101.0","2022-12-19","19:38:19"
"12621","Pelo visto não tem….
Ñ consegue escrever uma linha sequer….","2022-12-19 19:38:30","1564306389.0","2022-12-19","19:38:30"
"12622","Desinformação - O que é?","2022-12-19 19:38:32","568808508.0","2022-12-19","19:38:32"
"12623","Quem e você para falar de Deus, petista. Chora quetinho","2022-12-19 19:39:25","1092389707.0","2022-12-19","19:39:25"
"12625","🟩 CHORA PETISTA BOLIVARIANO 
A ROUBALHEIRA DO PT DA ACABANDO .. 🎵","2022-12-19 19:40:14","1092389707.0","2022-12-19","19:40:14"
"12626","É uma briga de ego maior que outra poxa","2022-12-19 19:40:21","1849277605.0","2022-12-19","19:40:21"
"12628","É um querendo saber mais que outro.
No final vamos todos afundar juntos","2022-12-19 19:40:39","1849277605.0","2022-12-19","19:40:39"
"12629","@Luiz104 chora petista","2022-12-19 19:40:43","1092389707.0","2022-12-19","19:40:43"
"12631","Eu sou alguém que não engana os outros.","2022-12-19 19:41:21","582034653.0","2022-12-19","19:41:21"
"12633","Por que vocês ficam brigando ?","2022-12-19 19:42:23","1849277605.0","2022-12-19","19:42:23"
"12634","Qual o sentindo em brigar ? Responde alguem ai","2022-12-19 19:42:34","1849277605.0","2022-12-19","19:42:34"
"12635","Você diz, que não e petista. Mas porque suas AÇÕES e igual dos PETISTAS??","2022-12-19 19:42:57","1092389707.0","2022-12-19","19:42:57"
"12636","Parece que as pessoas estão com 4 anos poxa.
O país todo afundando e povo brigando entre si e os políticos roubando todo mundo","2022-12-19 19:43:00","1849277605.0","2022-12-19","19:43:00"
"12637","Telegram vai banir de novo","2022-12-19 19:43:15","5648547234.0","2022-12-19","19:43:15"
"12638","Parabéns vamos melhorar o nosso país assim","2022-12-19 19:43:19","1849277605.0","2022-12-19","19:43:19"
"12639","Eles querem controlar tudo","2022-12-19 19:44:15","1849277605.0","2022-12-19","19:44:15"
"12640","Mas eles não vão vencer","2022-12-19 19:44:25","1849277605.0","2022-12-19","19:44:25"
"12641","Olhei mensagem TSE TELEGRAM VAI BANIR","2022-12-19 19:45:39","5648547234.0","2022-12-19","19:45:39"
"12643","As pessoas estão acordando.
Não apenas no Brasil.
As pessoas estão cansadas de viver na mesma.
Eu sei que vamos vencer no final.
Apesar de tudo parecer uma bagunça.
Mas o ser humano tem um botão de alarme.
Quando a agua bater na bunda de todos , não vai haver mais para onde correr ou seguir.
E nesta hora vamos nos unir","2022-12-19 19:45:51","1849277605.0","2022-12-19","19:45:51"
"12644","Manifestação Belém PA 19/12/22
https://youtube.com/shorts/KZkUbc55bw4?feature=share","2022-12-19 19:45:51","1476324989.0","2022-12-19","19:45:51"
"12645","Tem pessoas que são tão doutrinadas, que não conseguem ler o Diário Oficial.","2022-12-19 19:47:10","1092389707.0","2022-12-19","19:47:10"
"12646","Amigo toda e qualquer crença em qualquer político é uma doutrinação","2022-12-19 19:47:29","1849277605.0","2022-12-19","19:47:29"
"12647","Manifestação Brasília 10:15 h 19/12/22
https://youtu.be/KoRPsPIV1vU","2022-12-19 19:47:43","1476324989.0","2022-12-19","19:47:43"
"12648","Entenda que não político honesto.
 Em breve até você vai ver","2022-12-19 19:47:44","1849277605.0","2022-12-19","19:47:44"
"12649","Revolução cultural - Antonio Gramsci","2022-12-19 19:48:29","568808508.0","2022-12-19","19:48:29"
"12650","Vocês que estão apoiar Bolsonaro vão entender em breve , por que não se deve confiar em político.","2022-12-19 19:48:30","1849277605.0","2022-12-19","19:48:30"
"12652","Alvorada agora!
https://youtube.com/shorts/h4NGl_DPap4?feature=share","2022-12-19 19:48:53","1476324989.0","2022-12-19","19:48:53"
"12653","De ração de gato 🐈 nesse natal para petistas","2022-12-19 19:51:09","961798442.0","2022-12-19","19:51:09"
"12654","Estou me retirando do grupo.
Muitos ainda vão acordar.
Existe muita coisa envolvida neste começo de revolução que vai ocorrer.
Eu espero que Deus abençoe a todos.
E não deixe de respeitar o próximo.
Este momento é crucial não apenas para nosso país , mais também para nosso planeta.
Eu entendo o odio e raiva de muitos.
Mas neste momento , não e hora para ofender aquele que também é seu irmão.
Muita força a todos.","2022-12-19 19:53:23","1849277605.0","2022-12-19","19:53:23"
"12655","Bolsonaro postou hoje https://youtube.com/watch?v=TnwDrBalndw&feature=shares","2022-12-19 19:54:03","5399420490.0","2022-12-19","19:54:03"
"12658","Gente quando é que o Lula ladrão e o careca do pcc vão ser fuzilados?","2022-12-19 19:56:37","2128894062.0","2022-12-19","19:56:37"
"12661","Seu idiota, quem ações igual aos petistas são justamente vocês os bolsonaristas.","2022-12-19 19:58:37","582034653.0","2022-12-19","19:58:37"
"12663","Foram principalmente o Bolsonaro e o bolsonarismo que trouxeram o pt novamente a cena do crime.","2022-12-19 19:59:38","582034653.0","2022-12-19","19:59:38"
"12666","O Bolsonaro realmente não gosta de trabalhar.","2022-12-19 20:02:16","582034653.0","2022-12-19","20:02:16"
"12667","Exatamente...!","2022-12-19 20:02:21","5740076974.0","2022-12-19","20:02:21"
"12668","Qual o problema de ter uma sociedade hierárquica?","2022-12-19 20:04:58","582034653.0","2022-12-19","20:04:58"
"12670","Alvorada agora mesmo 19/12/22
https://youtu.be/Hs24F9scbdk","2022-12-19 20:05:44","1476324989.0","2022-12-19","20:05:44"
"12672","Nenhum, desde que, não tenham coisas fora do padrão...!","2022-12-19 20:06:35","5740076974.0","2022-12-19","20:06:35"
"12704","Botei em enquete para vez opinião povo grupo","2022-12-19 20:22:45","5648547234.0","2022-12-19","20:22:45"
"12673","O Foro de São Paulo","2022-12-19 20:07:05","568808508.0","2022-12-19","20:07:05"
"12674","Tu leu tudo...?","2022-12-19 20:07:17","5740076974.0","2022-12-19","20:07:17"
"12678","É tipo assim...!","2022-12-19 20:10:30","5740076974.0","2022-12-19","20:10:30"
"12679","Kkkkkkkk 
Boa !
….no aguardo !","2022-12-19 20:10:31","1564306389.0","2022-12-19","20:10:31"
"12682","PALÁCIO DA ALVORA
19/12/22 🇧🇷❤️‍🔥🤝🦾👍","2022-12-19 20:12:15","1092389707.0","2022-12-19","20:12:15"
"12683","https://youtu.be/o2cakpCPHb4","2022-12-19 20:12:40","5826292137.0","2022-12-19","20:12:40"
"12684","(((O BOATEIRO))) 

Durante o mês de agosto de 1932, foram distribuídos inúmeros folhetos acima para a população civil Paulista, incentivando a denúncia e prisão dos responsáveis por espalhar negativos relatos sobre São Paulo e a guerra que se travou.

🔥⛓️  🇾🇪🇾🇪🇾🇪  ⛓️🔥","2022-12-19 20:12:48","5696939756.0","2022-12-19","20:12:48"
"12685","Parecem zumbis cambaleando , impressionante","2022-12-19 20:13:20","5964024638.0","2022-12-19","20:13:20"
"12686","Pobres diabos","2022-12-19 20:13:32","5964024638.0","2022-12-19","20:13:32"
"12688","Pô Irmão, é até bacana, mas, esse cara tocando o berrante, ficou estranho...!","2022-12-19 20:14:29","5740076974.0","2022-12-19","20:14:29"
"12689","Contra fatos, não tem argumentos. Qual e o problema de você ser petista?

Não minha opinião, nem uma. Acho que você está no grupo Errado.","2022-12-19 20:14:33","1092389707.0","2022-12-19","20:14:33"
"12691","Berrante pra manter o gado ordeiro em fila indiana 🤣🤣🤣","2022-12-19 20:16:58","582872281.0","2022-12-19","20:16:58"
"12692","@admin","2022-12-19 20:17:34","5577384417.0","2022-12-19","20:17:34"
"12693","Pô cara, eles sabem que as pessoas ficam rolando, mas, a idolatria é tão grande, que nem conseguem pensar...!!","2022-12-19 20:18:24","5740076974.0","2022-12-19","20:18:24"
"12694","Descordo, uma parcela pode ser assim , a maior parte são pessoas de bem, 

Sua colocação é de infiltrado !!!","2022-12-19 20:18:25","5786562087.0","2022-12-19","20:18:25"
"12713","Acabou porque...?","2022-12-19 20:25:46","5740076974.0","2022-12-19","20:25:46"
"12696","https://youtube.com/live/mnBDBXmAJpM","2022-12-19 20:19:06","5083029753.0","2022-12-19","20:19:06"
"12697","Que infiltrado irmão, sai dessa... Tudo agora termina em rótulos...!","2022-12-19 20:19:35","5740076974.0","2022-12-19","20:19:35"
"12698","Tia do zap detected 🤣🤣🤣","2022-12-19 20:19:48","582872281.0","2022-12-19","20:19:48"
"12699","Desnecessário esse berrante, muito oba oba, a situação é grave!!!

O povo padece por falta de conhecimento!!!","2022-12-19 20:20:20","5786562087.0","2022-12-19","20:20:20"
"12701","Vocês ficam aí, o tempo inteiro, direita e, esquerda, isso não dá em nada...!","2022-12-19 20:21:01","5740076974.0","2022-12-19","20:21:01"
"12703","Kkkkk tu acabou de me chamar de infiltrado, agora são eles que não tem conhecimento...! Tá vendo, é isso que dá, essa divisão maldita...!","2022-12-19 20:22:38","5740076974.0","2022-12-19","20:22:38"
"12705","Então o que você está fazendo aqui ? 

Use seu tempo para algo que você acredite que seja útil, 

Talvez esteja usando, tentando desmotivar o povo Guerreiro que está aqui, 

E com todo respeito não tenho tempo para pessoas iguais a você","2022-12-19 20:22:48","5786562087.0","2022-12-19","20:22:48"
"12706","conheço muito bem pessoas iguais à você !!!","2022-12-19 20:23:30","5786562087.0","2022-12-19","20:23:30"
"12707","Amén...","2022-12-19 20:23:41","5740076974.0","2022-12-19","20:23:41"
"12709","Fica com Deus Irmão...!","2022-12-19 20:24:51","5740076974.0","2022-12-19","20:24:51"
"12710","Foi justamente quando acabou a hierarquia que durou até o início do século vinte, que o mundo virou essa merda.","2022-12-19 20:25:12","582034653.0","2022-12-19","20:25:12"
"12711","Num bate papo Alex disse que se viesse ao Brasil numa eventual revolução; ele disse que se essas tias chatas do zap atravessassem ele, que elas virariam adubo 🤣🤣🤣","2022-12-19 20:25:16","582872281.0","2022-12-19","20:25:16"
"12712","Sim.","2022-12-19 20:25:22","582034653.0","2022-12-19","20:25:22"
"12714","Essas tias só ficam tachando os outros de esquerdista, pq não somos idólatras de demônios. Chatas pra p*","2022-12-19 20:26:41","582872281.0","2022-12-19","20:26:41"
"12715","Vai a merda, moleque. Por imbecis iguais a você que não existe diferença entre o petismo e o bolsonarismo. 
Você que está no grupo errado, lambedor de frouxo.","2022-12-19 20:27:11","582034653.0","2022-12-19","20:27:11"
"12716","Isso, é uma parte desse livro...!","2022-12-19 20:27:27","5740076974.0","2022-12-19","20:27:27"
"12718","Por inúmeros fatores.","2022-12-19 20:27:55","582034653.0","2022-12-19","20:27:55"
"12719","Sim.","2022-12-19 20:28:09","582034653.0","2022-12-19","20:28:09"
"12720","Então, coisas erradas ou, contrárias...!","2022-12-19 20:28:39","5740076974.0","2022-12-19","20:28:39"
"12721","Que não seja vermelha mesmo...! Bacana Irmão...!!!!","2022-12-19 20:34:09","5740076974.0","2022-12-19","20:34:09"
"12725","Revolução francesa, revolução industrial, revolução liberal, comunismo/socialismo, primeira guerra mundial, Vaticano ii, etc.","2022-12-19 20:44:28","582034653.0","2022-12-19","20:44:28"
"12726","Irmão, o pior de tudo aí, foi a revolução francesa...!!!!","2022-12-19 20:45:14","5740076974.0","2022-12-19","20:45:14"
"12727","Ninguém saiu ganhando, depois saíram inventando tudo que podiam, até a direita e, a esquerda...!","2022-12-19 20:46:22","5740076974.0","2022-12-19","20:46:22"
"12728","Sim, foi aí que a esquerda e direita foram criadas nominalmente, entre outras coisas.","2022-12-19 20:47:20","582034653.0","2022-12-19","20:47:20"
"12729","Isso.","2022-12-19 20:47:31","582034653.0","2022-12-19","20:47:31"
"12731","https://www.youtube.com/watch?v=Q3_fqW9eVz8","2022-12-19 20:49:56","1185526411.0","2022-12-19","20:49:56"
"12734","https://youtu.be/Q3_fqW9eVz8","2022-12-19 20:53:41","1050683184.0","2022-12-19","20:53:41"
"12735","Canções da teologia da libertação.","2022-12-19 20:55:00","568808508.0","2022-12-19","20:55:00"
"12759","posso falar mal do Lula aqui???","2022-12-19 21:40:59","2043277310.0","2022-12-19","21:40:59"
"12739","“Isso aqui é um teatro, quem manda no Brasil é o STF” disse hoje o deputado federal Gustavo Gayer
https://youtube.com/shorts/PCpWBnRY8A8?feature=share","2022-12-19 21:06:19","1476324989.0","2022-12-19","21:06:19"
"12775","Kkkkk. Triste.","2022-12-19 21:47:48","582034653.0","2022-12-19","21:47:48"
"12740","Relembrando: “PT é capaz de tudo, até de fraudar uma eleição?” segundo Gilmar Mendes
https://youtu.be/dq6bCr0jfMg","2022-12-19 21:08:33","1476324989.0","2022-12-19","21:08:33"
"12742","Opaa !  QAP aqui...  na mira, comandante!","2022-12-19 21:13:56","1575408277.0","2022-12-19","21:13:56"
