"message_id","message","message_utc","from_id","date","time"
"11987","Mode aqui","2022-12-19 13:24:29","5648547234.0","2022-12-19","13:24:29"
"11988","🤮🤮","2022-12-19 13:24:33","5963773834.0","2022-12-19","13:24:33"
"11989","Isso.","2022-12-19 13:24:41","582034653.0","2022-12-19","13:24:41"
"11990","@BALDOINOIV","2022-12-19 13:24:47","5963773834.0","2022-12-19","13:24:47"
"11991","Gata para ser otária chegar depende político","2022-12-19 13:25:11","5648547234.0","2022-12-19","13:25:11"
"11992","Dependo da misericórdia de Deus, e da minha capacidade em sobreviver, idiota!","2022-12-19 13:26:12","5963773834.0","2022-12-19","13:26:12"
"12000","Respondido...

🤮🤮🤮🤮","2022-12-19 13:28:37","5963773834.0","2022-12-19","13:28:37"
"11994","Não fica assim gata tudo vai da certo","2022-12-19 13:26:39","5648547234.0","2022-12-19","13:26:39"
"11995","Quantas doses vc tomou?","2022-12-19 13:26:58","5963773834.0","2022-12-19","13:26:58"
"11996","Questão vacina tomei uma vez","2022-12-19 13:27:14","5648547234.0","2022-12-19","13:27:14"
"11998","Meu amigo você é muito inocente","2022-12-19 13:28:22","1849277605.0","2022-12-19","13:28:22"
"11999","Sinto muito","2022-12-19 13:28:33","1849277605.0","2022-12-19","13:28:33"
"12001","Você já tomou","2022-12-19 13:29:11","5648547234.0","2022-12-19","13:29:11"
"12003","https://www.gov.br/planalto/pt-br/acompanhe-o-planalto/noticias/2020/08/presidente-bolsonaro-assina-mp-que-garante-producao-de-vacina-contra-a-covid-19","2022-12-19 13:30:06","1849277605.0","2022-12-19","13:30:06"
"12004","Bolsonaro é contra vacina ?
Por favor né.
Vamos acordar.
Todos os políticos são iguais","2022-12-19 13:30:37","1849277605.0","2022-12-19","13:30:37"
"12006","Vc não tem condições intelectuais para esse grupo, filho... Segundo o próprio criador e dono de tal!","2022-12-19 13:30:56","5963773834.0","2022-12-19","13:30:56"
"12007","Você acredita nas urnas amigao ?","2022-12-19 13:31:19","1849277605.0","2022-12-19","13:31:19"
"12008","Para mimi garotinha assim mesmo","2022-12-19 13:31:39","5648547234.0","2022-12-19","13:31:39"
"12010","Você nunca vai se valente como você pirralha","2022-12-19 13:32:02","5648547234.0","2022-12-19","13:32:02"
"12014","São todos vermes.","2022-12-19 13:32:40","582034653.0","2022-12-19","13:32:40"
"12015","Meu amigo e o dinheiro que o governo dele ganhou ?
Você é inocente de mais","2022-12-19 13:32:43","1849277605.0","2022-12-19","13:32:43"
"12029","Você acredita que o exército vai salva o povo ?","2022-12-19 13:39:39","1849277605.0","2022-12-19","13:39:39"
"12017","Então como ele entrou no poder ?","2022-12-19 13:33:07","1849277605.0","2022-12-19","13:33:07"
"12018","Você um milagre de Deus ?","2022-12-19 13:33:19","1849277605.0","2022-12-19","13:33:19"
"12019","Judiação, não consegue exprimir num simples texto o que se passa subjetivamente🤦‍♂🤦‍♂","2022-12-19 13:33:19","5963773834.0","2022-12-19","13:33:19"
"12021","😂😂😂😂😂","2022-12-19 13:33:38","5648547234.0","2022-12-19","13:33:38"
"12022","Calma gata","2022-12-19 13:34:12","5648547234.0","2022-12-19","13:34:12"
"12024","Ninguém estava imaginando.
Então você confia nas urnas ?","2022-12-19 13:35:13","1849277605.0","2022-12-19","13:35:13"
"12025","https://t.me/UnidadNacional_ESPchat/285957

Sobre a inoculação...!","2022-12-19 13:35:28","5740076974.0","2022-12-19","13:35:28"
"12026","Então ele conseguiu controlar as urnas naquele momento sem ninguém perceber ?
Meu amigo vamos acordar né","2022-12-19 13:35:59","1849277605.0","2022-12-19","13:35:59"
"12027","Como eu falei , tudo é controlado por interesse.
Bolsonaro é apenas uma fantoche , assim como é Lula e o restantes dos políticos","2022-12-19 13:36:45","1849277605.0","2022-12-19","13:36:45"
"12030","Como vc perde tempo em debater com petista?","2022-12-19 13:39:45","1821430838.0","2022-12-19","13:39:45"
"12032","Foda né verdade","2022-12-19 13:40:05","1106044660.0","2022-12-19","13:40:05"
"12033","https://vxtwitter.com/GrazielaPoli/status/1604814817860124673?t=UyPF95dwZ6th3NalWTlFBQ&s=19","2022-12-19 13:40:15","1106044660.0","2022-12-19","13:40:15"
"12034","Tem q banir","2022-12-19 13:40:21","1821430838.0","2022-12-19","13:40:21"
"12035","E agora você foi doutrinado pela narrativa de um salvador","2022-12-19 13:40:24","1849277605.0","2022-12-19","13:40:24"
"12077","Salvador da patria ?","2022-12-19 13:59:26","1849277605.0","2022-12-19","13:59:26"
"12038","Rapaz a doutrinação ta forte","2022-12-19 13:41:04","1849277605.0","2022-12-19","13:41:04"
"12040","Você acredita ni Mourao ?","2022-12-19 13:41:23","1849277605.0","2022-12-19","13:41:23"
"12078","OK !
E……","2022-12-19 13:59:37","1564306389.0","2022-12-19","13:59:37"
"12043","Ha meu amigo.
Apenas aguarde e verá.","2022-12-19 13:42:08","1849277605.0","2022-12-19","13:42:08"
"12044","Ainda bem que a grande maioria está acordando","2022-12-19 13:42:25","1849277605.0","2022-12-19","13:42:25"
"12045","Não a político que pensa na população atualmente","2022-12-19 13:42:48","1849277605.0","2022-12-19","13:42:48"
"12046","Começa pelo zelensky então","2022-12-19 13:46:40","1106044660.0","2022-12-19","13:46:40"
"12047","Pergunta honesta","2022-12-19 13:47:00","26960304.0","2022-12-19","13:47:00"
"12079","Eu sei que povo está acordando a cada dia que passa.
E eu tenho esperança.
E sei quem em breve vamos mudar este país.
Estou cansado de tento conflito entre esquerda e direita.
Eu apoio a união seja você quem for","2022-12-19 14:00:37","1849277605.0","2022-12-19","14:00:37"
"12048","Mourão Grau 33 da Maçonaria.
General do exército brasileiro.
Relaxa que ele vai salvar o povo","2022-12-19 13:47:04","1849277605.0","2022-12-19","13:47:04"
"12050","Em que mês ira acontecer Algo?","2022-12-19 13:47:11","26960304.0","2022-12-19","13:47:11"
"12051","Confiaaaaaa....","2022-12-19 13:47:19","1849277605.0","2022-12-19","13:47:19"
"12052","Pra cara….","2022-12-19 13:47:44","1564306389.0","2022-12-19","13:47:44"
"12053","Qual mes?","2022-12-19 13:47:49","26960304.0","2022-12-19","13:47:49"
"12056","2999","2022-12-19 13:48:03","1849277605.0","2022-12-19","13:48:03"
"12057","São nunca","2022-12-19 13:48:06","1564306389.0","2022-12-19","13:48:06"
"12058","ACORDEM","2022-12-19 13:48:28","1564306389.0","2022-12-19","13:48:28"
"12059","Ué mais seu exército salvador também faz parte da maçonaria amigão.
Me explica ai.","2022-12-19 13:48:59","1849277605.0","2022-12-19","13:48:59"
"12214","Oi","2022-12-19 15:42:33","5051003271.0","2022-12-19","15:42:33"
"12062","Exatamente.
É oq estou mostrando.
Nenhum político ou exército vai salvar o Brasil","2022-12-19 13:50:26","1849277605.0","2022-12-19","13:50:26"
"12064","Essa Eloisa disfarça apoiado bolsogado","2022-12-19 13:51:39","5648547234.0","2022-12-19","13:51:39"
"12080","Eu cria grupos motoqueiro vai demora anos fazer isso","2022-12-19 14:01:23","5648547234.0","2022-12-19","14:01:23"
"12106","Ficou ofendida, moça?","2022-12-19 14:29:09","5963773834.0","2022-12-19","14:29:09"
"12072","OK !
E…..","2022-12-19 13:54:06","1564306389.0","2022-12-19","13:54:06"
"12073","Esse senhor da ponta é o George Soros , você acha mesmo que ele só apoia a esquerda ?
Meu amigo esses tubarões da econômia estão a apoiar ambos os lados .","2022-12-19 13:56:15","1849277605.0","2022-12-19","13:56:15"
"12074","Está na hora de acordar","2022-12-19 13:56:38","1849277605.0","2022-12-19","13:56:38"
"12075","Meu amigo você é lunático","2022-12-19 13:57:43","2089132349.0","2022-12-19","13:57:43"
"12081","https://www.youtube.com/live/cds-Bu2RMQQ?feature=share","2022-12-19 14:03:45","5826292137.0","2022-12-19","14:03:45"
"12082","Como alguém pode acusar quem discorda de petista e ainda usar she her?","2022-12-19 14:03:47","582034653.0","2022-12-19","14:03:47"
"12083","Eu sei que a varias ideias diferentes neste grupo .
É sempre bom trocar informações.
Entrar em debate , mas sempre com educação.
Eu tenho certeza que podemos mudar este país.
Não vamos deixar de acreditar","2022-12-19 14:05:36","1849277605.0","2022-12-19","14:05:36"
"12084","Vamos compartilhar este grupo com pessoas que ja acordaram.
E para aqueles que não acordaram vamos ter paciência.
Sem ofensas","2022-12-19 14:06:08","1849277605.0","2022-12-19","14:06:08"
"12085","🇧🇷💪🇧🇷🧐@GeFazioBreakingNews🇧🇷","2022-12-19 14:07:10","1027244452.0","2022-12-19","14:07:10"
"12087","Bora chegar meta mil grupos povo acorda 🙌","2022-12-19 14:09:04","5648547234.0","2022-12-19","14:09:04"
"12088","Olha que interessante.
Neste video podemos ver "" Renato Gaucho "" afirmando que é Bolsonaro.
Não nada de errado nesta afirmação.
Mas o cara confirma que vai ser Bolsonaro até morrer .
Ele está tão doutrinado pela crença e ego que não admite que o candidado dele pode errar.
 E mesmo errando ele vai apoiar e acreditar que não a ninguém melhor.
Está é a mesma narrativa de um eleitor da esquerda.
Por este motivo estamos em conflitos todos os dias.","2022-12-19 14:11:47","1849277605.0","2022-12-19","14:11:47"
"12089","https://youtu.be/BU3OOAUVkeA","2022-12-19 14:12:13","5788752826.0","2022-12-19","14:12:13"
"12090","Nessa madrugada do dia 19, os capangas (""PF"") do criminoso Alexandre De Moraes invadiram a área militar do Exército e sequestraram o pastor Fabiano, isso foi no Espírito Santo.","2022-12-19 14:18:32","1749300915.0","2022-12-19","14:18:32"
"12091","Acesse este link para entrar no meu grupo do WhatsApp: https://chat.whatsapp.com/H3RYeT787kbF0PetPPcYM9","2022-12-19 14:19:20","1989038568.0","2022-12-19","14:19:20"
"12092","Gado bolsonarista cada vez mais burro","2022-12-19 14:22:18","5648547234.0","2022-12-19","14:22:18"
"12107","Poxa Anderson vamos deixa o orgulho de lado irmão.
Estamos sujeitos a errar.
Eu erro todo dia irmão.
Mas quando eu erro eu peço desculpas","2022-12-19 14:29:16","1849277605.0","2022-12-19","14:29:16"
"12094","Já salvou, né...

Quase 200 milhões de habitantes já se picaram nessa marquinha de besta, e o que ele fez? E o minto? 

Pelo povo, não sei... Fizeram por si e por seus filhos, né...","2022-12-19 14:23:02","5963773834.0","2022-12-19","14:23:02"
"12095","Verdade","2022-12-19 14:23:25","5648547234.0","2022-12-19","14:23:25"
"12097","Exatamente","2022-12-19 14:24:21","1849277605.0","2022-12-19","14:24:21"
"12098","Eu não tomei a picadinha e minha esposa também não.
Mas o restante de minha família , todos tomaram","2022-12-19 14:24:51","1849277605.0","2022-12-19","14:24:51"
"12099","Apenas um tio meu que não tomou","2022-12-19 14:25:00","1849277605.0","2022-12-19","14:25:00"
"12108","Foda ser","2022-12-19 14:29:21","5648547234.0","2022-12-19","14:29:21"
"12100","Stan Lee??? 😳","2022-12-19 14:26:59","5648547234.0","2022-12-19","14:26:59"
"12101","Cara, eu até de daria uma resposta a altura, problema é que vc não sabe se comunicar pela escrita...

O mais triste é que vc possui um título de eleitor, assim é o caso de 90% das pessoas nessa bosta de pais...","2022-12-19 14:27:24","5963773834.0","2022-12-19","14:27:24"
"12102","Deste quando eu apoio POLÍTICA","2022-12-19 14:27:54","5648547234.0","2022-12-19","14:27:54"
"12103","Galera sem briga.
Vocês 2  estão acordados.
Vamos nos unir.
Eloisa Anderson","2022-12-19 14:28:14","1849277605.0","2022-12-19","14:28:14"
"12104","Eu nunca minha vida sendo ignorante como você","2022-12-19 14:28:21","5648547234.0","2022-12-19","14:28:21"
"12105","Vou ser igual anjo caído","2022-12-19 14:28:56","5648547234.0","2022-12-19","14:28:56"
"12109","https://t.me/sobrevivendoamatrix","2022-12-19 14:29:27","2067849349.0","2022-12-19","14:29:27"
"12110","Desculpa amigo culpa foi Eloisa chata","2022-12-19 14:29:39","5648547234.0","2022-12-19","14:29:39"
"12111","Tchau","2022-12-19 14:29:51","5648547234.0","2022-12-19","14:29:51"
"12112","Não estudou português na escola, Biba?","2022-12-19 14:29:53","5963773834.0","2022-12-19","14:29:53"
"12113","Calado moça chata","2022-12-19 14:30:10","5648547234.0","2022-12-19","14:30:10"
"12114","Mas não vira ofender ninguém irmão.
Relaxa po.
Tem vezes que perco cabeça também.
Mas não podemos criar conflitos","2022-12-19 14:30:12","1849277605.0","2022-12-19","14:30:12"
"12116","Eloisa vamos manter calma.","2022-12-19 14:30:43","1849277605.0","2022-12-19","14:30:43"
"12117","Desculpa amigo mas não vou aliança com ela","2022-12-19 14:30:49","5648547234.0","2022-12-19","14:30:49"
"12118","Kkkkkkkkkk","2022-12-19 14:31:02","26960304.0","2022-12-19","14:31:02"
"12119","Poxa Anderson.","2022-12-19 14:31:02","1849277605.0","2022-12-19","14:31:02"
"12121","Vamos continuar irmão.
Relaxa.
As vezes temos que relevar as coisas.","2022-12-19 14:32:02","1849277605.0","2022-12-19","14:32:02"
"12122","Ele não sabe nem escrever, falta não fará","2022-12-19 14:32:12","26960304.0","2022-12-19","14:32:12"
"12123","Todos estamos certos e errados .
O importante é manter a união","2022-12-19 14:32:16","1849277605.0","2022-12-19","14:32:16"
"12124","Tu foto anime lixo","2022-12-19 14:32:31","5648547234.0","2022-12-19","14:32:31"
"12125","Sem ofender celso","2022-12-19 14:32:46","1849277605.0","2022-12-19","14:32:46"
"12126","Cada pessoa tem sua qualidade.
Todo ser humano é valido em algum ponto.
Ninguém é melhor que ninguém","2022-12-19 14:33:18","1849277605.0","2022-12-19","14:33:18"
"12127","Não ser preocupe amigo deixar eles fazer a vontade","2022-12-19 14:33:21","5648547234.0","2022-12-19","14:33:21"
"12128","Ofender? É a realidade, o rapaz não sabe nem escrever","2022-12-19 14:33:29","26960304.0","2022-12-19","14:33:29"
"12129","Eu nem ligo mesmo não só covade","2022-12-19 14:33:35","5648547234.0","2022-12-19","14:33:35"
"12130","i tu o que Deus","2022-12-19 14:33:52","5648547234.0","2022-12-19","14:33:52"
"12131","Vou dar um exemplo.
Eu entendo muito na area da economia.
Se você falar algo sem sentindo sobre economia.
Eu tenho direito de ofender você ?
 É obvio que não.
 Você é tão importante o quanto eu sou","2022-12-19 14:34:25","1849277605.0","2022-12-19","14:34:25"
"12132","Vamos parar de brigar por coisas bobas","2022-12-19 14:34:35","1849277605.0","2022-12-19","14:34:35"
"12133","Quer brigar, ofender e xingar.

Mas é um bronco, que não sabe se expressar nem escrever","2022-12-19 14:34:36","26960304.0","2022-12-19","14:34:36"
"12134","Você quer ter um país melhor ?","2022-12-19 14:34:56","1849277605.0","2022-12-19","14:34:56"
"12135","Eu xinga so ser for você","2022-12-19 14:34:57","5648547234.0","2022-12-19","14:34:57"
"12136","Amigo, você dizer que eu não seu falar de economia, não é uma ofensa","2022-12-19 14:34:58","26960304.0","2022-12-19","14:34:58"
"12137","Mas a modos de falar irmão","2022-12-19 14:35:11","1849277605.0","2022-12-19","14:35:11"
"12138","Celso aí não saber de nada","2022-12-19 14:35:19","5648547234.0","2022-12-19","14:35:19"
"12139","Ofensa seria você me chamar de filho da puta ou algo assim","2022-12-19 14:35:21","26960304.0","2022-12-19","14:35:21"
"12141","Estou falando de forma bem tranquila, mas estou dizendo a verdade","2022-12-19 14:35:40","26960304.0","2022-12-19","14:35:40"
"12142","Chamar o rapaz de Bronco ?","2022-12-19 14:35:53","1849277605.0","2022-12-19","14:35:53"
"12143","Ele é bronco, e não sabe escrever, e ofendendo a moça ali","2022-12-19 14:36:00","26960304.0","2022-12-19","14:36:00"
"12144","Poxa isso é chato irmão.","2022-12-19 14:36:03","1849277605.0","2022-12-19","14:36:03"
"12145","TUDO BEM DEIXAR TERRÁQUEO FAZER A VONTADE NÃO SÓ COVADE COMO OUTROS","2022-12-19 14:36:09","5648547234.0","2022-12-19","14:36:09"
"12146","Chato é ter alguem da maneira dele aqui","2022-12-19 14:36:15","26960304.0","2022-12-19","14:36:15"
"12147","Como disse, não faz falta","2022-12-19 14:36:26","26960304.0","2022-12-19","14:36:26"
"12156","DEIXA AMIGO","2022-12-19 14:38:22","5648547234.0","2022-12-19","14:38:22"
"12148","Mas tem formas de abordar o rapaz.
Ele ofendeu a moça e você o ofende.
Então acaba virando um ciclo infinito de conflitos","2022-12-19 14:36:31","1849277605.0","2022-12-19","14:36:31"
"12149","NEM VOCÊ","2022-12-19 14:36:33","5648547234.0","2022-12-19","14:36:33"
"12150","VOU VIRA ANJO CAÍDO","2022-12-19 14:36:52","5648547234.0","2022-12-19","14:36:52"
"12151","Apenas falei a verdade, se ofendeu ele, fica com deus.

Veja só, escrevendo em caps lock, como se tivesse gritando","2022-12-19 14:36:57","26960304.0","2022-12-19","14:36:57"
"12152","Ridiculo sabe","2022-12-19 14:37:08","26960304.0","2022-12-19","14:37:08"
"12153","Temos que manter paciência.
Como vamos mudar o país , entrando em conflitos como se todos aqui fosse criança.
Vamos acordar gente","2022-12-19 14:37:17","1849277605.0","2022-12-19","14:37:17"
"12154","Vamos com calma e respeito","2022-12-19 14:37:26","1849277605.0","2022-12-19","14:37:26"
"12157","Mas tenha paciência meu amigo.","2022-12-19 14:38:26","1849277605.0","2022-12-19","14:38:26"
"12158","Não devemos ofender irmão.","2022-12-19 14:38:38","1849277605.0","2022-12-19","14:38:38"
"12159","Em quais locais se encontram pessoas que apóiam o governo dos indesejáveis...?","2022-12-19 14:38:45","5740076974.0","2022-12-19","14:38:45"
"12160","Não entendi Frazão","2022-12-19 14:39:16","1849277605.0","2022-12-19","14:39:16"
"12161","TENHO AMIGO TENHO MINHA FAMÍLIA SÓ TRABALHO TODOS ME RESPEITA","2022-12-19 14:39:33","5648547234.0","2022-12-19","14:39:33"
"12162","AGORA NÃO ENTENDO SÓ ESSE GRUPO SÓ PORQUE FALEI VERDADE POVO BRASILEIRO DOENTIL","2022-12-19 14:40:05","5648547234.0","2022-12-19","14:40:05"
"12163","Ok.
Mas você concorda que passou um pouco do ponto quando falou com a eloisa né ?
Irmão nunca sinta vergonha de pedir desculpas se realmente errou.
Eu mesmo faço isso diariamente.
Isso não me faz ser menos homem","2022-12-19 14:40:46","1849277605.0","2022-12-19","14:40:46"
"12164","Devemos falar sempre com jeito e educação e assim vamos mudar este país","2022-12-19 14:41:13","1849277605.0","2022-12-19","14:41:13"
"12165","POISE NÉ AMIGO TÊM COSTUMA REALIDADE POVO IGNORANT HOJE EM DIA","2022-12-19 14:41:33","5648547234.0","2022-12-19","14:41:33"
"12166","A ironia","2022-12-19 14:42:01","26960304.0","2022-12-19","14:42:01"
"12167","NINGUÉM PERGUNTOU","2022-12-19 14:42:15","5648547234.0","2022-12-19","14:42:15"
"12168","Anderson aprenda a falar com paciência irmão","2022-12-19 14:42:29","1849277605.0","2022-12-19","14:42:29"
"12169","Não será com raiva que vai fazer as pessoas te escutar","2022-12-19 14:42:46","1849277605.0","2022-12-19","14:42:46"
"12170","Verdade","2022-12-19 14:42:50","5648547234.0","2022-12-19","14:42:50"
"12171","Paciência meu amigo.","2022-12-19 14:42:57","1849277605.0","2022-12-19","14:42:57"
"12173","SIM ESTA TUDO BEM JÁ TÔ CALMO","2022-12-19 14:43:22","5648547234.0","2022-12-19","14:43:22"
"12174","Vamos encerrar por aqui hoje pra não da poblema raiva ok","2022-12-19 14:44:01","5648547234.0","2022-12-19","14:44:01"
"12175","Ok.
É assim que devemos ser .
Vamos tentar poxa.
Vamos mudar este país.
Eu acredito em todos que estão aqui e os que já estão acordado em nosso país.","2022-12-19 14:44:08","1849277605.0","2022-12-19","14:44:08"
"12176","https://www.youtube.com/live/_qXNQZ-aNdk?feature=share","2022-12-19 14:44:17","5826292137.0","2022-12-19","14:44:17"
"12177","👍","2022-12-19 14:44:18","1849277605.0","2022-12-19","14:44:18"
"12178","👍","2022-12-19 14:44:38","5648547234.0","2022-12-19","14:44:38"
"12192","Eu falava, mas, era chamado de louco...","2022-12-19 15:21:39","5740076974.0","2022-12-19","15:21:39"
"12180","🚨 ATENÇÃO 🚨
O golpe tá aí cai quem quer 

Isso a GLOBO LIXO não mostra
@GeFazioBreakingNews 🇺🇸🇧🇷","2022-12-19 15:13:44","1166124464.0","2022-12-19","15:13:44"
"12182","🤦‍♂️😁","2022-12-19 15:16:16","1749300915.0","2022-12-19","15:16:16"
"12183","Óbvio e ululante….","2022-12-19 15:16:41","1564306389.0","2022-12-19","15:16:41"
"12184","Fico pensando na perseguição, com quem não foi inoculado...!","2022-12-19 15:16:43","5740076974.0","2022-12-19","15:16:43"
"12206","Não conversa mais essa mulher","2022-12-19 15:36:26","5648547234.0","2022-12-19","15:36:26"
"12187","Isso é claro que iria acontecer... Lembra da Gleice Hofman falando: cade o Hamas... Quando o deus dela foi preso...?","2022-12-19 15:19:14","5740076974.0","2022-12-19","15:19:14"
"12188","Dr Alessandro LOIOLA diz que apenas 10% morreram de COVID (( MORRERAM por Falta de tratamento e pq Foram Entubados )))***","2022-12-19 15:20:08","1166124464.0","2022-12-19","15:20:08"
"12189","SIM","2022-12-19 15:20:25","1166124464.0","2022-12-19","15:20:25"
"12191","Nesse época, quem fosse entubado, era pra ficar na pior...","2022-12-19 15:21:13","5740076974.0","2022-12-19","15:21:13"
"12194","ERA pra terminar de matar....
E  TBM envolvia muita grana na COMPRA dos tais respiradores (💲💲💲💲💲))","2022-12-19 15:22:19","1166124464.0","2022-12-19","15:22:19"
"12195","Eu sei pô, minha parte eu fiz, que foi de informar, mas, as pessoas não estão acostumadas com a verdade...","2022-12-19 15:23:26","5740076974.0","2022-12-19","15:23:26"
"12196","Obrigado pelos vídeos...!!!!","2022-12-19 15:23:40","5740076974.0","2022-12-19","15:23:40"
"12197","Faudemia de quinta só gado acredita nessas mentiras","2022-12-19 15:24:06","5595380989.0","2022-12-19","15:24:06"
"12202","Verdade tô fora eu odeio isso","2022-12-19 15:30:22","5595380989.0","2022-12-19","15:30:22"
"12204","Nem uma","2022-12-19 15:35:27","331878663.0","2022-12-19","15:35:27"
"12207","Ela comunistas não confia nela","2022-12-19 15:37:02","5648547234.0","2022-12-19","15:37:02"
"12209","Concordo com você","2022-12-19 15:38:08","5648547234.0","2022-12-19","15:38:08"
"12210","Manifestação QG Brasília 19/12/22
https://youtu.be/_iHChskffGQ","2022-12-19 15:39:18","1476324989.0","2022-12-19","15:39:18"
"12211","Este Navarro é um lunático ""rosca frouxa"". Olha o contexto, bundao. Espera 2026.","2022-12-19 15:41:23","5852090402.0","2022-12-19","15:41:23"
"12212","Enquanto crescemos essa ideia podemos ir juntando forcas e conhecimentos, podemos ir nos agrupando criando nucleos organizados pelo Brasil pra na hora certa agirmos de forma organizada e controlada para derrubarmos o sistema na base da porrada e muita porrada, vamos nos unirmos. Quem ta comigo? Quem sabe encontramos militares que queiram fazer parte da revolução e passar conhecimentos a todos os outros, nao só os militares mas sim todo tipo de conhecimento que agrega valor será muito util nessa guerra em prol a liberdade","2022-12-19 15:41:58","5075836514.0","2022-12-19","15:41:58"
"12217","👋oi","2022-12-19 15:43:29","5852090402.0","2022-12-19","15:43:29"
"12219","Igreja do Bolsonaro","2022-12-19 15:43:56","5852090402.0","2022-12-19","15:43:56"
"12222","Eu sou reacionário","2022-12-19 15:44:57","5051003271.0","2022-12-19","15:44:57"
"12223","Infelizmente vivemos em um sistema ""democrático"" que nao é tao democrático assim vamos lutar para colocar o povo no poder, o povo pelo povo","2022-12-19 15:44:59","5075836514.0","2022-12-19","15:44:59"
"12225","Mitooooo","2022-12-19 15:45:20","5051003271.0","2022-12-19","15:45:20"
"12226","Kkkk","2022-12-19 15:45:21","1023435169.0","2022-12-19","15:45:21"
"12227","Vc acredita em tudo que te passam em grupos... sobre armas e tals... e constrói tuas próprias narrativas. Vai acabar doente, cara.","2022-12-19 15:45:22","5852090402.0","2022-12-19","15:45:22"
"12228","Eu só adoro o mito","2022-12-19 15:45:31","5051003271.0","2022-12-19","15:45:31"
"12229","Mito acima de tudo, Deus acima de todos","2022-12-19 15:45:43","5051003271.0","2022-12-19","15:45:43"
"12240","Espero que seja ironia.","2022-12-19 15:50:50","582034653.0","2022-12-19","15:50:50"
"12234","Quem não votar é maçom","2022-12-19 15:48:02","5051003271.0","2022-12-19","15:48:02"
"12235","Vota aí @Navarro142","2022-12-19 15:48:16","5051003271.0","2022-12-19","15:48:16"
"12237","Escolhe uma opção e vota @Navarro142","2022-12-19 15:48:52","5051003271.0","2022-12-19","15:48:52"
"12238","Perpétua 528192929 anos","2022-12-19 15:49:05","5051003271.0","2022-12-19","15:49:05"
"12241","🇧🇷- *CHAT PATRIOTA > ENTRE NESSE GRUPO PARA MANDAR MENSAGEM E INTERAGIR COM PATRIOTAS*
 
 *Entre :* https://chat.whatsapp.com/G0F16rFRzgz5zxtl2f35eF","2022-12-19 15:51:19","5051003271.0","2022-12-19","15:51:19"
"12242","Enforcamento! Prisão custa para o cidadão!","2022-12-19 15:51:20","5607913984.0","2022-12-19","15:51:20"
"12243","O bolsonaro é meu mito, qual o problema?","2022-12-19 15:51:31","5051003271.0","2022-12-19","15:51:31"
"12244","Vai procurar ajuda psiquiátrica.","2022-12-19 15:52:02","582034653.0","2022-12-19","15:52:02"
"12246","Problema povo gado gostar mais BOLSONARO que jesus","2022-12-19 15:52:05","5648547234.0","2022-12-19","15:52:05"
"12247","Prisão perpétua ou pena de morte.","2022-12-19 15:52:22","582034653.0","2022-12-19","15:52:22"
"12248","Jesus começa com letra maiúscula.","2022-12-19 15:52:58","582034653.0","2022-12-19","15:52:58"
"12249","Vc deve ser carente","2022-12-19 15:53:00","5852090402.0","2022-12-19","15:53:00"
"12251","Edai escrevo eu quiser","2022-12-19 15:53:19","5648547234.0","2022-12-19","15:53:19"
"12253","Não escreve não.","2022-12-19 15:53:40","582034653.0","2022-12-19","15:53:40"
"12255","Respeite a religião dos outros.","2022-12-19 15:54:17","582034653.0","2022-12-19","15:54:17"
"12258","Vai a merda.","2022-12-19 15:54:46","582034653.0","2022-12-19","15:54:46"
"12259","Manifestação QG Salvador BA 19/12/22
https://youtu.be/cdHGS7_il2A","2022-12-19 15:54:48","1476324989.0","2022-12-19","15:54:48"
"12262","Os administradores vão ver a mensagem que você apagou.","2022-12-19 15:55:20","582034653.0","2022-12-19","15:55:20"
"12264","@admin","2022-12-19 15:55:43","582034653.0","2022-12-19","15:55:43"
"12265","Lorena tá magoada...kkk","2022-12-19 15:56:00","5852090402.0","2022-12-19","15:56:00"
