"message_id","message","message_utc","from_id","date","time"
"31958","Passava a mortadela nela sem dó hahaha","2023-01-03 00:07:27","5103985086.0","2023-01-03","00:07:27"
"31967","Concordo","2023-01-03 00:10:53","5034768841.0","2023-01-03","00:10:53"
"31979","povo apaixonado da desgraça por politico nunca vida","2023-01-03 00:27:55","1604104208.0","2023-01-03","00:27:55"
"31950","Alguém tem dúvida que o cachaceiro é......................","2023-01-03 00:03:21","1612901718.0","2023-01-03","00:03:21"
"31951","https://youtu.be/8YaBU1Dp8dw","2023-01-03 00:03:51","1425585321.0","2023-01-03","00:03:51"
"31952","Assistam esse vídeo","2023-01-03 00:04:01","1425585321.0","2023-01-03","00:04:01"
"31953","Tu voltaria ?
Fala de mais vc .
Tá no mesmo caminho da Venezuela bicho , eles vão perseguir a oposição pra deixar o caminho deles livre .
Vai começar pelo Bolsonaro e seus filhos , depois pelo congresso.
Quem eles não conseguir subornar, vão perseguir de toda forma","2023-01-03 00:04:06","5103985086.0","2023-01-03","00:04:06"
"31954","Exato","2023-01-03 00:05:31","1811581303.0","2023-01-03","00:05:31"
"31957","Olhem sempre o diário da União","2023-01-03 00:06:54","5034768841.0","2023-01-03","00:06:54"
"31959","🇺🇸🇧🇷💪🇧🇷🇺🇸🇧🇷🤔

NAO DESISTAM. NADA ACABOU.

@GeFazioBreakingNews🇧🇷","2023-01-03 00:08:23","1612901718.0","2023-01-03","00:08:23"
"31961","Espera pra ver oque eles vão fazer .
Vão começar a organizar milícias entre eles pra atacar o pessoal que tá nos protestos","2023-01-03 00:08:34","5103985086.0","2023-01-03","00:08:34"
"31962","Para que? Não temos apoio de ninguém lá dentro só nos mesmo","2023-01-03 00:08:57","1811581303.0","2023-01-03","00:08:57"
"31963","Eu sei. Mas pelo menos, essa bosta de midia não engana vcs","2023-01-03 00:09:34","5034768841.0","2023-01-03","00:09:34"
"31964","A midia lixo mente o tempo todo","2023-01-03 00:10:04","5034768841.0","2023-01-03","00:10:04"
"31965","Pelo menos pelo diário da União, vamos saber o que rolou de verdade","2023-01-03 00:10:31","5034768841.0","2023-01-03","00:10:31"
"31966","Todas as mídias mentem","2023-01-03 00:10:43","1811581303.0","2023-01-03","00:10:43"
"31968","Pode ser que tem um DOu falso","2023-01-03 00:11:05","1811581303.0","2023-01-03","00:11:05"
"31970","Sem dúvida  nenhuma","2023-01-03 00:11:45","872976818.0","2023-01-03","00:11:45"
"31971","⚖️STF VAI DECIDIR EM BREVE: ESTÁ PROIBIDO DEMITIR NO BR! 

Se você emprega no 🇧🇷, não importa o tamanho, demissões sem justa causa serão proibidas. Querem se meter até mesmo no seu RH!","2023-01-03 00:13:38","1612901718.0","2023-01-03","00:13:38"
"31972","Isso aqui foi forjado. Lula não foi oficialmente eleito. Olha, tudo escoteiros kkkkkk","2023-01-03 00:15:18","5034768841.0","2023-01-03","00:15:18"
"31975","Resumo pra quem ainda acha que Bolsonaro não presta, perto desse pt de merda","2023-01-03 00:22:46","1113578570.0","2023-01-03","00:22:46"
"31976","Então o Bolsonaro tomou a vacina?","2023-01-03 00:23:14","2065395019.0","2023-01-03","00:23:14"
"31977","azar o dele","2023-01-03 00:24:08","1029414221.0","2023-01-03","00:24:08"
"31980","bucado de retardado procurando coisa onde nao tem para acobertar um vagabundo que fugiu e outro que assumiu o poder no país","2023-01-03 00:28:35","1604104208.0","2023-01-03","00:28:35"
"31981","O povo tem que quebrar o pau","2023-01-03 00:29:20","5034768841.0","2023-01-03","00:29:20"
"31982","da agunhia esse povo imbecil vergonha de ser desse país","2023-01-03 00:29:27","1604104208.0","2023-01-03","00:29:27"
"31983","Amigos de infância e agora de trabalho.","2023-01-03 00:30:25","2067849349.0","2023-01-03","00:30:25"
"32039","Em qual...?","2023-01-03 01:23:34","5740076974.0","2023-01-03","01:23:34"
"31999","Isso é triste Irmão...!","2023-01-03 01:12:02","5740076974.0","2023-01-03","01:12:02"
"32007","Minha visão é essa","2023-01-03 01:17:21","1113578570.0","2023-01-03","01:17:21"
"32040","Porto Alegre","2023-01-03 01:23:58","776643243.0","2023-01-03","01:23:58"
"32041","N adiantou nada","2023-01-03 01:24:09","776643243.0","2023-01-03","01:24:09"
"32051","Será que é fake também???","2023-01-03 01:36:30","134354501.0","2023-01-03","01:36:30"
"32063","Já está acontecendo.","2023-01-03 01:50:08","1290823452.0","2023-01-03","01:50:08"
"32069","Sei","2023-01-03 01:54:56","5629336513.0","2023-01-03","01:54:56"
"32076","Só reclamam agir q e bom!","2023-01-03 01:58:20","1849859004.0","2023-01-03","01:58:20"
"32083","É a mulher do Lula?","2023-01-03 02:36:03","1841126601.0","2023-01-03","02:36:03"
"32008","Protegermos nossas liberdades, família etc","2023-01-03 01:17:36","1113578570.0","2023-01-03","01:17:36"
"32009","Muito além de Bolsonaro x Lula","2023-01-03 01:17:49","1113578570.0","2023-01-03","01:17:49"
"32018","Convocando pessoas e organizando","2023-01-03 01:19:27","1113578570.0","2023-01-03","01:19:27"
"32019","Aham....vai acontecer","2023-01-03 01:19:34","776643243.0","2023-01-03","01:19:34"
"32020","Não falando do que já passou, xingando, reclamando","2023-01-03 01:19:40","1113578570.0","2023-01-03","01:19:40"
"32021","Chama TALIBÃ","2023-01-03 01:19:43","5648547234.0","2023-01-03","01:19:43"
"32022","Enfim","2023-01-03 01:20:01","1113578570.0","2023-01-03","01:20:01"
"32023","Vou esperar, qdo tiver um perto eu vou","2023-01-03 01:20:03","776643243.0","2023-01-03","01:20:03"
"31987","Fiquei sabendo que nesse vídeo se trata de recrutas de 18 a 19 anos brincando.","2023-01-03 00:36:17","1805805779.0","2023-01-03","00:36:17"
"31984","So precisamos de uma guilhotina","2023-01-03 00:32:03","5034768841.0","2023-01-03","00:32:03"
"31986","Golpe militar em andamento. Selva Bostil!

#Meme

https://t.me/+uG8qUFBpga41ZjYx","2023-01-03 00:34:51","2067849349.0","2023-01-03","00:34:51"
"31988","Tinha que chamar a família deles no QG e, mostrar o vídeo, em seguida, expulsão...!","2023-01-03 00:39:08","5740076974.0","2023-01-03","00:39:08"
"31989","Né ? São sem noção.","2023-01-03 00:40:42","1805805779.0","2023-01-03","00:40:42"
"31990","SELVA BRASIL OFICIAL
https://t.me/selvabrasiloficial","2023-01-03 00:42:21","1612901718.0","2023-01-03","00:42:21"
"31992","Tá... E o que essa bandeira tá fazendo aí...!? ""USA tá um paraíso""...!","2023-01-03 00:46:32","5740076974.0","2023-01-03","00:46:32"
"31993","🗣️ - Saiba oque já ocorreu nesses dois primeiros dias de Governo Lula:

Nubank deve fechar capital no Brasil
Bolsa de valores abaixo do normal
Fim de eventos contra o aborto
Ibovespa fez o L em gráficos
Gasolina mais cara

❓ Mais eai? Preparado (a) para trabalhar em dobro? Afinal, vc agora tem que sustentar 37 ministros e outros países aliados de Lula.

Siga @gritodaliberdade 🥇✅","2023-01-03 00:55:27","5402326491.0","2023-01-03","00:55:27"
"31994","Vai porra nenhuma, essa galera do agita","2023-01-03 01:03:38","5112786210.0","2023-01-03","01:03:38"
"31995","⚖️STF VAI DECIDIR EM BREVE: ESTÁ PROIBIDO DEMITIR NO BR! 

Se você empregador no 🇧🇷, não importa o tamanho, demissões sem justa causa serão proibidas. Querem se meter até mesmo no seu RH!

Absurdo!!!

🔰👉https://t.me/mentessobreviventes","2023-01-03 01:07:05","5940116462.0","2023-01-03","01:07:05"
"31997","O amor venceu

Siga @BrasilRev","2023-01-03 01:09:03","1462733860.0","2023-01-03","01:09:03"
"31998","Siga @BrasilRev","2023-01-03 01:11:41","2067849349.0","2023-01-03","01:11:41"
"32000","O Bradesco tá apoiando o PT? Cheio de bandeira do Bradesco...
Tá parecendo alguma festa, e não no dia 01/01","2023-01-03 01:12:17","83712809.0","2023-01-03","01:12:17"
"32001","Ao inves de ter vergonha faça algo, mesmo sozinho você consegue destruir um gigante se souber o ponto do fraco, não podemos desistir nunca,  não queremos uma nação melhor apenas para o""EU"" queremos uma nação melhor para ""NÓS"".","2023-01-03 01:15:19","5075836514.0","2023-01-03","01:15:19"
"32002","Só maconheiros e ladrões presidiários acaba nisso mesmo","2023-01-03 01:15:30","2128894062.0","2023-01-03","01:15:30"
"32003","O Bradesco é comunista","2023-01-03 01:15:53","776643243.0","2023-01-03","01:15:53"
"32004","A mensagem é a que vale","2023-01-03 01:16:05","1113578570.0","2023-01-03","01:16:05"
"32005","Ignorem detalhes, todos pela mesma causa","2023-01-03 01:16:16","1113578570.0","2023-01-03","01:16:16"
"32006","Impedir essa nova ordem mundial DOENTIL e termos um país mais justo e sem bilhões desviados novamente para países comunistas e fora os roubos de políticos","2023-01-03 01:17:03","1113578570.0","2023-01-03","01:17:03"
"32010","E vai fazer o q?
Acordar cedo, trabalhar e pagar contas.....como sempre","2023-01-03 01:18:09","776643243.0","2023-01-03","01:18:09"
"32011","A ideia é que milhões façam pelo menos um dia","2023-01-03 01:18:30","1113578570.0","2023-01-03","01:18:30"
"32012","Façam o q?","2023-01-03 01:18:47","776643243.0","2023-01-03","01:18:47"
"32013","Parar o país","2023-01-03 01:18:53","1113578570.0","2023-01-03","01:18:53"
"32014","Eu vi essa imagrm,um  monte de gente endeusando essa moça que entregou a psudo faixa e taus é catadora e blábláblá aí foram atrás da vida dela.A avó era catadora a mãe dela era agora ela é. Ou seja Lula foi presidente outras vzs mas nunca tirou ninguém da pobreza não.Três gerações dessa coitada catam lixo ainda e eles ovacionam isso?Pra mim ela tá trabalhando aí botando essa faixa no lixo.O PT precisa do pobre cada vez mais pobre pra eles votarem sempre neles","2023-01-03 01:18:55","1612901718.0","2023-01-03","01:18:55"
"32015","Como?","2023-01-03 01:19:04","776643243.0","2023-01-03","01:19:04"
"32016","Pequenos grupos formando grandes grupos","2023-01-03 01:19:16","1113578570.0","2023-01-03","01:19:16"
"32017","Opa","2023-01-03 01:19:23","5648547234.0","2023-01-03","01:19:23"
"32024","Só mais 72 HORAS","2023-01-03 01:20:12","5648547234.0","2023-01-03","01:20:12"
"32025","Comece você criando um","2023-01-03 01:20:13","1113578570.0","2023-01-03","01:20:13"
"32026","Já deu né","2023-01-03 01:20:23","1113578570.0","2023-01-03","01:20:23"
"32027","Podemos dar início a algo muito maior","2023-01-03 01:20:30","5075836514.0","2023-01-03","01:20:30"
"32028","Eu n tenho tempo pra isso, acordo cedo pra trabalhar","2023-01-03 01:20:34","776643243.0","2023-01-03","01:20:34"
"32029","Exato","2023-01-03 01:20:47","5075836514.0","2023-01-03","01:20:47"
"32030","Vc tem tempo para vir aqui conversar? É o.suficiente","2023-01-03 01:21:09","5075836514.0","2023-01-03","01:21:09"
"32031","Eu também nesse momento tou féria volto mês 25 janeiro","2023-01-03 01:21:11","5648547234.0","2023-01-03","01:21:11"
"32032","Já fiquei 1 mês acampada em frente a um quartel e não adiantou nada","2023-01-03 01:21:21","776643243.0","2023-01-03","01:21:21"
"32033","Bem feito pra você","2023-01-03 01:21:32","5648547234.0","2023-01-03","01:21:32"
"32034","Ha bom.... conversar em grupos resolve, então sou muito atuante.","2023-01-03 01:22:03","776643243.0","2023-01-03","01:22:03"
"32035","Kkkkk cara pessimista...","2023-01-03 01:22:14","5740076974.0","2023-01-03","01:22:14"
"32036","Só mesmo","2023-01-03 01:22:23","5648547234.0","2023-01-03","01:22:23"
"32037","Nossa conversa aqui no momento está parando e mudando o Brasil.....sei","2023-01-03 01:22:43","776643243.0","2023-01-03","01:22:43"
"32038","Com gorveno Lula ai ferro","2023-01-03 01:23:25","5648547234.0","2023-01-03","01:23:25"
"32042","Banco comunista? É a primeira vez que ouço isso","2023-01-03 01:24:12","83712809.0","2023-01-03","01:24:12"
"32043","Mas conversar aqui no grupo vai adiantar","2023-01-03 01:24:21","776643243.0","2023-01-03","01:24:21"
"32045","Mas, tu foi...! Acreditou...!
Isso é bacana...","2023-01-03 01:24:57","5740076974.0","2023-01-03","01:24:57"
"32046","Kkkk q montagem horrível","2023-01-03 01:25:23","776643243.0","2023-01-03","01:25:23"
"32047","Tmb acho","2023-01-03 01:25:39","1612901718.0","2023-01-03","01:25:39"
"32052","Mentira que o cara tomou a vacina... 😂😂😂😂😂","2023-01-03 01:38:16","1798425978.0","2023-01-03","01:38:16"
"32054","Mais uma profecia do professor Olavo de Carvalho que se cumpre. Os milicos batendo continência para os comunas.","2023-01-03 01:42:48","1290823452.0","2023-01-03","01:42:48"
"32055","Professora de Filosofia Nova Acropole diz uma grande verdade.","2023-01-03 01:42:58","872976818.0","2023-01-03","01:42:58"
"32059","Profecia em curso👆👆👆","2023-01-03 01:46:54","1290823452.0","2023-01-03","01:46:54"
"32060","Exato","2023-01-03 01:47:12","1113578570.0","2023-01-03","01:47:12"
"32061","Duvido muito, mas caso o PT continue, aí sim teremos algo similar ao que existe hj na Venezuela, mas aqui somos muitos e é mais difícil acontecer","2023-01-03 01:49:10","1113578570.0","2023-01-03","01:49:10"
"32062","Mas se deixar...","2023-01-03 01:49:21","1113578570.0","2023-01-03","01:49:21"
"32064","Não é na posse isso.
Vi várias fotos e vídeos dos arrombad0s que foram 
A única área sem grama é o pedacinho da praça dos 3 poderes.
Não tem essa construção com madeirite preta também.
É algum show da vida","2023-01-03 01:50:11","1841126601.0","2023-01-03","01:50:11"
"32068","Eu nem tô acreditando que ela está dizendo essas palavras.
Será que tomou juízo mesmo e caiu na real? 
Se ela conseguiu, eu acredito que o restante conseguirá deixar de ser alucinado","2023-01-03 01:54:22","880741963.0","2023-01-03","01:54:22"
"32070","E desde quanto um show de Thiago Aquino tendo briga é novidade e sobre política? 😂😂😂","2023-01-03 01:55:17","880741963.0","2023-01-03","01:55:17"
"32071","Tenso 😔

✅ Sigam nosso canal @nocentrodopoder e fiquem por dentro dos bastidores da política.","2023-01-03 01:55:32","1612901718.0","2023-01-03","01:55:32"
"32072","Cabaré da luz vermelha","2023-01-03 01:56:11","872976818.0","2023-01-03","01:56:11"
"32073","ficou massa essa montagem no ceu","2023-01-03 01:56:51","5002303856.0","2023-01-03","01:56:51"
"32074","Isso é um show do cantor Thiago Aquino. Tudo agora o povo vai jogar na Internet e dizer que é política","2023-01-03 01:57:33","880741963.0","2023-01-03","01:57:33"
"32078","Eu joguei um áudio aí, falando sobre isso...!!","2023-01-03 02:02:46","5740076974.0","2023-01-03","02:02:46"
"32079","Tenso 😔

✅ Sigam nosso canal @nocentrodopoder e fiquem por dentro dos bastidores da política.","2023-01-03 02:03:49","1612901718.0","2023-01-03","02:03:49"
"32080","Democracia na prática.
Canal : https://t.me/comediaancap
Chat : https://t.me/grupocomediaancap","2023-01-03 02:20:51","5410394008.0","2023-01-03","02:20:51"
"32084","Se for, nunca iria reconhecer.","2023-01-03 02:36:22","1841126601.0","2023-01-03","02:36:22"
"32087","Seiiiiiiiiii nada contra vc irmão que postou mas os caras amarelaram lá atrás no 7 de setembro","2023-01-03 02:41:18","5629336513.0","2023-01-03","02:41:18"
"32088","Eu sei","2023-01-03 02:41:53","1798425978.0","2023-01-03","02:41:53"
"32089","UM POVO COM CORAGEM NÃO ESPERA O MAL ACONTECER.

👊👊👊

Não ficaram 60 dias sofrendo como covardes implorando para que alguém fizesse alguma coisa para salva-los.
Não são covardes, não esperaram o mal acontecer.  Não apostaram no azar. Foram decididos fazer o que lhes é de direito, pois supremo é o povo.

Não autorizaram ninguém, pois autoridade são eles, o povo.

Povo de Sri Lanka invade o Congresso, a Suprema Corte, o Palácio de Governo, derrubam o regime tirano e tomam o poder. As Forças Armadas do país acompanharam a invasão e deram proteção ao povo.

Os corruptos fugiram do país, emissoras de TV e as redações de jornais pró governo foram incendiadas. 

Quem sabe faz a hora, não espera acontecer...

Os covardes herdarão o inferno!

🇧🇷🇨🇳🧟‍♀🧟🧟‍♂🧠💩👺🔥","2023-01-03 02:42:08","1811581303.0","2023-01-03","02:42:08"
"32090","Mas esse Rafael aí do vídeo do canal filhos da pátria, achei que ele nunca iria dizer que perdeu","2023-01-03 02:42:21","1798425978.0","2023-01-03","02:42:21"
"32091","Eu até acho ele legal mas vc viu a falsa ilusão que uma par de canal posta botando novas datas ,tem gente que chapou já na minha opinião e melhor se preparar pro caos e para a batalha que vai ser foda porque achar que vai ter um salvador pelo menos humano kkkkkk vai ser difícil só a batalha do povo mesmo contra os vagabundos,mas entendi sim seu ponto de vista","2023-01-03 02:46:55","5629336513.0","2023-01-03","02:46:55"
"32092","E triste eu votei no PR não me arrependo mas esperava muito mais dele pois ele tinha a faca e queijo na mão era só fazer e que lasque","2023-01-03 02:48:19","5629336513.0","2023-01-03","02:48:19"
"32093","https://atrombetanews.com.br/2023/01/02/preco-da-gasolina-chega-a-r-840-no-primeiro-dia-do-governo-lula-petista-descumpriu-promessa/





Preço da gasolina chega a R$ 8,40 no primeiro dia do governo Lula… petista descumpriu promessa.","2023-01-03 02:48:44","1080107775.0","2023-01-03","02:48:44"
"32106","Só que lá precisou chegar ao fundo do poço para o povo acordar, aqui vai ter que chegar ao fundo primeiro infelizmente antes das coisas mudarem.","2023-01-03 03:16:14","1290823452.0","2023-01-03","03:16:14"
"32094","Recapitulando...","2023-01-03 02:51:10","5589358448.0","2023-01-03","02:51:10"
"32095","Bommmmm eu só acredito vendo!!!!","2023-01-03 02:55:23","5629336513.0","2023-01-03","02:55:23"
"32096","Eu também 😐","2023-01-03 02:57:25","5589358448.0","2023-01-03","02:57:25"
"32097","Cadê a foto escolha seu bandido de estimação","2023-01-03 02:58:01","5649763855.0","2023-01-03","02:58:01"
"32098","Um policial é um narcotráficantes?","2023-01-03 02:58:12","5649763855.0","2023-01-03","02:58:12"
"32100","Tem muito fake em alguns grupos iludindo as pessoas posso tá errado,mês se depender de uma resposta do PR ou exército tamo na roça ,mas com certeza a luta continua","2023-01-03 03:00:43","5629336513.0","2023-01-03","03:00:43"
"32103","Pior ou e mau carácter ou retardado desejo tudo de Ruim para petista","2023-01-03 03:05:35","5629336513.0","2023-01-03","03:05:35"
"32107","Opa pelo menos kkkkk","2023-01-03 03:16:54","5629336513.0","2023-01-03","03:16:54"
"32108","https://youtu.be/SJeZIlnp5X4","2023-01-03 03:17:42","823761841.0","2023-01-03","03:17:42"
"32109","Ciro Nogueira ex ministro voltou para o Senado, pesquisa!","2023-01-03 03:18:41","1342661761.0","2023-01-03","03:18:41"
"32112","ACABOU TUDO? EU TE RESPONDO! 👇 📢  Algumas pessoas perguntam pra mim. Está tudo perdido. Hum... Sabe qual e o próximo passo a ser feito? 
Eu não vou falar nada! 
Eu vou mostrar 👇 
A DICA TAI! 
EAI, você topa?"", Amauri Zanforlin https://youtu.be/XPijDNX4G28","2023-01-03 03:34:03","5970400166.0","2023-01-03","03:34:03"
"32116","VOCÊ QUER DIZER LADRÃO É ISSO","2023-01-03 03:47:10","5970400166.0","2023-01-03","03:47:10"
"32118","Democracia na prática, pena q os patridotas não conseguem nem se unir pra copiar.","2023-01-03 04:25:19","872976818.0","2023-01-03","04:25:19"
"32119","Quando pararem de acreditar em fake news e uma salvação do além, talvez, eles cheguem em um denominador comum e acreditem que somente o POVO pode fazer alguma coisa","2023-01-03 04:32:46","880741963.0","2023-01-03","04:32:46"
"32125","Agr as grandes empresas vão repassar ao consumidor.kkkkkk","2023-01-03 05:49:59","1048563306.0","2023-01-03","05:49:59"
"32121","Genial queria q a direita daqui fosse unida e ao invés de cair em narrativas, seguissem esse exemplo de democracia na prática.","2023-01-03 04:35:37","872976818.0","2023-01-03","04:35:37"
"32122","Vc foi assertivo, parabéns! Quem dera q a direita tivesse essa visão.","2023-01-03 04:36:45","872976818.0","2023-01-03","04:36:45"
"32123","Espalhar a ideia até os donos do  dos grupos de zap e canais de direita entenderem q não é esperando enigmas q não levam à nada. Os políticos e instituições nos abandonaram a sorte","2023-01-03 04:38:22","872976818.0","2023-01-03","04:38:22"
"32124","💸 - Lula revoga decreto que reduzia impostos de grandes empresas

O presidiário Luiz Inácio Lula da Silva (PT) revogou um decreto assinado no último dia do Governo Bolsonaro que reduzia pela metade a tributação sobre receitas financeiras de grandes empresas.

Siga @gritodaliberdade para mais informações.","2023-01-03 04:39:06","5402326491.0","2023-01-03","04:39:06"
"32126","Quem já atualizou o ciclo vacinal? Amém! 

#Igreja

https://t.me/+uG8qUFBpga41ZjYx","2023-01-03 06:07:30","2128894062.0","2023-01-03","06:07:30"
"32127","Na verdade quero dizer presidente mesmo, de acordo com as legalidades necessarias e o presidente goste  ou nao","2023-01-03 06:31:17","26960304.0","2023-01-03","06:31:17"
"32128","oq faremos sobre isso é oq importa, o fato é esse","2023-01-03 06:31:27","26960304.0","2023-01-03","06:31:27"
"32129","Não é como se não repassem antes rs","2023-01-03 06:32:09","26960304.0","2023-01-03","06:32:09"
"32130","É muito mais complexo, veja nos EUA que já aconteceu, cabe o povo agir agora","2023-01-03 06:38:29","1113578570.0","2023-01-03","06:38:29"
"32131","E parar de cobrar, xingar e esperar. Não tem outro jeito.","2023-01-03 06:38:42","1113578570.0","2023-01-03","06:38:42"
"32132","Milhões juntos, se não aceitem e vida que segue","2023-01-03 06:38:55","1113578570.0","2023-01-03","06:38:55"
"32133","Eu tentei avisar, mas era banido etc","2023-01-03 06:39:17","26960304.0","2023-01-03","06:39:17"
"32134","https://www.youtube.com/live/O3O7lnUibhg?feature=share","2023-01-03 06:42:05","5826292137.0","2023-01-03","06:42:05"
"32135","Provavelmente são grupos mascarados da esquerda","2023-01-03 06:46:01","1113578570.0","2023-01-03","06:46:01"
"32136","Onde ficam banindo por nada","2023-01-03 06:46:15","1113578570.0","2023-01-03","06:46:15"
"32137","Nop, todos os grupos bolsonaristas/direita tratava quem questionava como infiltrado/ptsita","2023-01-03 06:46:34","26960304.0","2023-01-03","06:46:34"
"32138","Abuso de negócio esquerda e direita saber que briga por isso e o maldito gado","2023-01-03 06:48:18","5595380989.0","2023-01-03","06:48:18"
"32152","Bom dia pra você também obrigada.👏🤝🇧🇷","2023-01-03 09:33:42","753950155.0","2023-01-03","09:33:42"
"32139","Faz o L....","2023-01-03 07:27:44","1601364718.0","2023-01-03","07:27:44"
"32140","📈 - Dólar sobe desparadamente após posse de Lula.

No governo Bolsonaro, o dólar conseguiu se estabilizar, mais agora, daqui pra frente e só pra trás...

#Retrocesso👍🤡","2023-01-03 08:37:41","5402326491.0","2023-01-03","08:37:41"
"32142","🇧🇷⏰VAMOS FECHAR AS REFINARIAS POR TODO O BRASIL ⏰🇧🇷
🇧🇷⏰VAMOS FECHAR AS REFINARIAS POR TODO O BRASIL ⏰🇧🇷
🇧🇷⏰VAMOS FECHAR AS REFINARIAS POR TODO O BRASIL ⏰🇧🇷
🇧🇷⏰VAMOS FECHAR AS REFINARIAS POR TODO O BRASIL ⏰🇧🇷
🇧🇷⏰VAMOS FECHAR AS REFINARIAS POR TODO O BRASIL ⏰🇧🇷
🇧🇷⏰VAMOS FECHAR AS REFINARIAS POR TODO O BRASIL ⏰🇧🇷
QUEM APOIA ENTRE NESSES GRUPOS : https://t.me/+86W4ywCh2gE3YTE5
🤝ADICIONE O LINK DO SEU GRUPO DE APOIO!!!! 🤝","2023-01-03 08:50:54","1612901718.0","2023-01-03","08:50:54"
"32144","Impostor","2023-01-03 09:20:06","1330968585.0","2023-01-03","09:20:06"
"32145","FALA PRA VOCÊS VAI DIA VEM DIA E NÃO ACONTECE NADA JA QUE NINGUÉM QUE PARA O BRASIL E RESOLVER VOU TRABALHAR NINGUÉM TA NEM AI SE O POVO NÃO ACORDA NÃO ADIANTA","2023-01-03 09:21:15","1612901718.0","2023-01-03","09:21:15"
"32146","Brasil o pais dos covardes manes pode esperar deitado","2023-01-03 09:22:24","5005801596.0","2023-01-03","09:22:24"
"32147","Verdade mesmo povo iludido","2023-01-03 09:26:41","1612901718.0","2023-01-03","09:26:41"
"32148","povo marcado e, povo feliz!","2023-01-03 09:27:43","5005801596.0","2023-01-03","09:27:43"
"32149","como diria zeremalho 🤦🏽‍♂️","2023-01-03 09:28:15","5005801596.0","2023-01-03","09:28:15"
"32150","BOM DIAAAAAA A TODOS DO GRUPO QUE ESSE DIA SEJA MUITO ABENÇOADA PARA TODOS NÓS.....👏✨💫🌻👏🤝🇧🇷💚🇧🇷","2023-01-03 09:31:30","753950155.0","2023-01-03","09:31:30"
"32151","Bom dia","2023-01-03 09:32:38","1770638298.0","2023-01-03","09:32:38"
"32153","A solução tá aí se vocês que fica iludido fica aí veno fake e se iludindo hora que vocês acordar já era 64 dias o Brasil não paro um dia você acha que vai acontecer alguma coisa nem o exército vai fazer nada porque não acontece nada se eles agi desse jeito e golpe o país tá normal rodando normal todo mundo trabalhando comendo fazendo festa lojas tudo normal","2023-01-03 09:38:17","1612901718.0","2023-01-03","09:38:17"
"32154","https://www.bitchute.com/video/zH17mYnZvNvo/

Catherine Austin Fitts explica que se não fizermos algo para defender nossa liberdade sanitária e todas as outras, não conseguiremos impedir o que estão fazendo para prejudicar nossos filhos, pois estão desenvolvendo um processo de controle político e econômico cada vez mais centralizado","2023-01-03 09:42:26","1231614665.0","2023-01-03","09:42:26"
"32155","Realmente, estamos tentando mostrar isso mais muita gente não apoia","2023-01-03 09:48:59","1811581303.0","2023-01-03","09:48:59"
"32156","Concordo","2023-01-03 09:50:35","1811581303.0","2023-01-03","09:50:35"
"32158","https://www.facebook.com/reel/8602201826519780/?app=fbl","2023-01-03 10:13:06","5608417672.0","2023-01-03","10:13:06"
"32159","https://www.youtube.com/live/kyaMozrX6pQ?feature=share","2023-01-03 10:37:42","5826292137.0","2023-01-03","10:37:42"
"32161","Acredito ser verdadeiro. Dr. Wilson koressawa entrou com os dois pés e vai vir o que o povo pediu","2023-01-03 10:45:13","5034768841.0","2023-01-03","10:45:13"
"32163","Bom Dia  a todos !!!! PAX ET LVX💥🦉","2023-01-03 10:48:46","5219376679.0","2023-01-03","10:48:46"
"32164","Bom dia professor Sérgio","2023-01-03 10:50:16","1029414221.0","2023-01-03","10:50:16"
