"message_id","message","message_utc","from_id","date","time"
"688307","Quer testar?","2022-12-22 15:53:23","846274888.0","2022-12-22","15:53:23"
"688308","Na realidade em 2014 houve um golpe de estado na Ucrânia financiado pela OTAN, a Rússia então invadiu a Crimeia e as populações do leste e do sul da Ucrânia pegaram em armas contra o governo pro OTAN de Kiev, e isso começou a guerra civil ucraniana que culminou na invasão russa em fevereiro de 2022","2022-12-22 15:53:48","1403337079.0","2022-12-22","15:53:48"
"688309","Ta feio, car a. Para vai","2022-12-22 15:53:49","406651357.0","2022-12-22","15:53:49"
"688310","Não me importo com seu senso de estética","2022-12-22 15:54:13","846274888.0","2022-12-22","15:54:13"
"688311","Ora se o Brasil quiser entrar em guerra com a Argentina, quem declarou que vá lá morrer.","2022-12-22 15:54:52","846274888.0","2022-12-22","15:54:52"
"688312","Eu sei. Nem combom senso vc se importa, quem dira a estetica","2022-12-22 15:55:42","406651357.0","2022-12-22","15:55:42"
"688314","O artista vai pro caralho....
Já te enumerei aí as mentiras do teu macho....mas argumento para ti deve ser medido em cm","2022-12-22 15:56:57","5687290451.0","2022-12-22","15:56:57"
"688315","Com bom senso, sim. Aliás não entendi seu ponto, somente vi um julgamento subjetivo.","2022-12-22 15:56:57","846274888.0","2022-12-22","15:56:57"
"688316","""Pelé com câncer no colo de útero"".

É a metástase do jornalismo brasileiro.","2022-12-22 15:57:23","867304090.0","2022-12-22","15:57:23"
"688317","Uma guerra é algo muito estranho. Muitas pessoas matam outras que elas não conhecem nem odeiam a mando de homens que se odeiam, mas não têm coragem de se matar eles mesmos.","2022-12-22 15:59:48","846274888.0","2022-12-22","15:59:48"
"688318","Mandou carta para mundo falando sobre o amor kkk,a filha dele sabe muito bem","2022-12-22 16:00:24","73752012.0","2022-12-22","16:00:24"
"688319","Jornalismo da Jovem Pan está indo ladeira abaixo. O nível dos apresentadores e comentaristas caiu abaixo do nível de crítica, tá péssimo. E o que sobrou da velha guarda tombou para a esquerda como o José Maria Trindade","2022-12-22 16:01:45","631941985.0","2022-12-22","16:01:45"
"688320"," O Diário Oficial da União publicou a aprovação do regimento interno da Consultoria Jurídica junto ao Ministério da Defesa, que passa a ter a atribuição de “fixar a interpretação da Constituição”.","2022-12-22 16:10:12","1587555802.0","2022-12-22","16:10:12"
"688321","Abriram as portas do inferno","2022-12-22 16:10:56","1587555802.0","2022-12-22","16:10:56"
"688322","Matarmos você de fome e serás feliz.","2022-12-22 16:18:13","278688112.0","2022-12-22","16:18:13"
"688323","ESG = Europas Sem Gás.","2022-12-22 16:19:00","278688112.0","2022-12-22","16:19:00"
"688324","https://www.conexaopolitica.com.br/politica/63-dos-brasileiros-sao-contra-bloqueio-de-perfis-que-defendem-intervencao-militar/","2022-12-22 16:21:07","5973867706.0","2022-12-22","16:21:07"
"688325","Matando petista ja ta bom, ruim é quando subir a piramide","2022-12-22 16:30:18","1941884372.0","2022-12-22","16:30:18"
"688326","https://twitter.com/pmesp/status/1605590302013661185?s=46&t=7yq5-kE8PLSxOJut787yOA","2022-12-22 16:35:06","5045239456.0","2022-12-22","16:35:06"
"688327","GRANDE QUANTIDADE DE MATERIAL BÉLICO, TERMINAL DO TIETÊ. VÃO TIRANDO AS CONCLUSÕES...","2022-12-22 16:35:53","1941884372.0","2022-12-22","16:35:53"
"688328","Democracia…o que seria de nós sem os homens de preto cumpridores de ordens ilegais ?","2022-12-22 16:37:08","5413659844.0","2022-12-22","16:37:08"
"688329","PF prende empresário que chamou Randolfe de ‘gazela’.

https://vistapatria.com.br/pf-prende-empresario-que-chamou-randolfe-de-gazela/","2022-12-22 16:37:08","5413659844.0","2022-12-22","16:37:08"
"688336","Aquele lá nunca me enganou.","2022-12-22 16:57:46","1238937928.0","2022-12-22","16:57:46"
"688340","Pode PEDIR AJUDA a ALIENÍGENA, mas NÃO PODE pedir ajuda às FORÇAS ARMADAS: A CENSURA vem com TUDO
@ ANCAPSU","2022-12-22 17:04:05","1103049455.0","2022-12-22","17:04:05"
"688331","Remete-se respeitosamente que V. Exa. recorda a suposta “rachadura” atribuída ao Sr. Flavio Bolsonaro, conforme relatado pelo Conselho de Controle de Atividades Financeiras (COAF), sobre a identificação de aproximadamente R$ 1,2 milhão em movimentação financeira suspeita.  O Sr. Bolsonaro foi classificado em décimo sétimo lugar na lista de indivíduos relevantes.  Alega-se ainda que o indivíduo classificado em primeiro lugar na referida lista teria aproximadamente R$ 50 milhões em atividades financeiras suspeitas.

Veja! 



https://twitter.com/rconstantino/status/1605585830566760448?s=52&t=-bvqzlAJjYZHJTHmuxLTpg","2022-12-22 16:45:01","124982804.0","2022-12-22","16:45:01"
"688332","Centrão cobra fatura da PEC para Lula e pede ministérios com orçamento de R$ 70,6 bilhões em 2023
https://www.terra.com.br/noticias/brasil/politica/centrao-cobra-fatura-da-pec-para-lula-e-pede-ministerios-com-orcamento-de-r-706-bilhoes-em-2023,ec0b0d330402928fd15dd8e98e3be482o19f98vr.html","2022-12-22 16:45:57","634223840.0","2022-12-22","16:45:57"
"688333","70 bi","2022-12-22 16:46:06","634223840.0","2022-12-22","16:46:06"
"688334","Esse foi o argumento do cara. Temos que respeitar as capacidade de cada individuo.","2022-12-22 16:53:02","1238937928.0","2022-12-22","16:53:02"
"688335","É só basta o Xandão dizer que não gosta de dividir o bolo e acabou","2022-12-22 16:54:27","1558897613.0","2022-12-22","16:54:27"
"688341","Será que ainda tem lugar no bote salva-vidas?","2022-12-22 17:05:54","5676856688.0","2022-12-22","17:05:54"
"688342","Tá pra nascer cara mais burro que o Peter. Delinquente se diz ancap mas tá aplaudindo o Estado usar o dinheiro das pessoas pra patrocinar guerra em outro pais. imbecil. pior que ele sao os éguas daqui que passam pano pa isso.","2022-12-22 17:05:54","630263566.0","2022-12-22","17:05:54"
"688343","Acredita Peter o impeachment sai kkkk","2022-12-22 17:11:33","742792602.0","2022-12-22","17:11:33"
"688344","Como ele não irá assumir, isso é irrelevante.","2022-12-22 17:14:27","1676627802.0","2022-12-22","17:14:27"
"688345","Depois da portaria que saiu hoje no dou, acho difícil o ladrão subir a rampa.","2022-12-22 17:15:49","2049410193.0","2022-12-22","17:15:49"
"688346","Quero ver se o xandao vai ter a coragem de mandar prender o ministro da defesa.","2022-12-22 17:17:34","2049410193.0","2022-12-22","17:17:34"
"688347","Por favor, mostre qual a portaria","2022-12-22 17:20:41","1445550597.0","2022-12-22","17:20:41"
"688348","ainda hoje Randolfe mete um louco e o STF acata... hoje mesmo derrubam isso","2022-12-22 17:20:55","1556218841.0","2022-12-22","17:20:55"
"688349","O Peter fala 24h por dia que Estados e governos são máfias, que guerras são lutas entre máfias e que os 2 lados estão errados, que imposto é roubo, mas quando o assunto é a guerra da Ucrânia ele desmente o próprio discurso: ele fala que o governo da Ucrânia é muito bom, temos que apoiar a Ucrânia e o seu governo nessa guerra e os governos de todos os países tem que usar o dinheiro dos impostos para financiar essa guerra","2022-12-22 17:21:47","1403337079.0","2022-12-22","17:21:47"
"688352","https://www.in.gov.br/en/web/dou/-/portaria-normativa-agu-n-74-de-16-de-dezembro-de-2022-452048783","2022-12-22 17:25:07","2049410193.0","2022-12-22","17:25:07"
"688353","https://oantagonista.uol.com.br/brasil/pcdob-deve-brigar-por-estatais-de-energia-nuclear-e-exploracao-da-amazonia/","2022-12-22 17:26:17","634223840.0","2022-12-22","17:26:17"
"688354","F Angra","2022-12-22 17:26:22","634223840.0","2022-12-22","17:26:22"
"688355","Vão já dizer que você é mama bolas do Putin. Fazer o que. Esse pessoal tá pior que petista.","2022-12-22 17:26:26","630263566.0","2022-12-22","17:26:26"
"688356","PcdoB vai explodir a usina pqp","2022-12-22 17:26:40","634223840.0","2022-12-22","17:26:40"
"688357","Bem por aí","2022-12-22 17:26:56","1403337079.0","2022-12-22","17:26:56"
"688358","Era um partido de esquerda que administrava o museu Nacional e deixou ele pegar fogo","2022-12-22 17:27:36","1403337079.0","2022-12-22","17:27:36"
"688359","Mas fica tranquilo, vamos protestar dia 1º e se mula não cair vamos tirá-lo em 2026; disse o inocente que errou tudo que previu e chama quem não concorda de “russete”","2022-12-22 17:27:38","5413659844.0","2022-12-22","17:27:38"
"688366","Vai sim! Os velhos sabem usar rumble, vpn, thor e etc","2022-12-22 17:53:05","5413659844.0","2022-12-22","17:53:05"
"688360","Fica tranquilo que a informação descentralizada vai derrubar o governo do nine kkkkklk","2022-12-22 17:29:42","2049410193.0","2022-12-22","17:29:42"
"688361","Ancap Troll","2022-12-22 17:35:17","647744837.0","2022-12-22","17:35:17"
"688362","🇧🇷🇧🇷🇧🇷🇧🇷🇧🇷🇧🇷🇧🇷

A reação do povo!!

https://t.me/jornalismoepolitica","2022-12-22 17:36:12","5371397948.0","2022-12-22","17:36:12"
"688363","Peter devia comprar meus bitcoin q comprei a 47k doletas por culpa dele...","2022-12-22 17:41:24","1556218841.0","2022-12-22","17:41:24"
"688364","Eu tenho respeito pela fé desse pessoal, mas tenho mais dó que respeito","2022-12-22 17:41:27","631941985.0","2022-12-22","17:41:27"
"688365","Crime, não. Mas burrice e ingenuidade, com certeza!","2022-12-22 17:53:03","1738185494.0","2022-12-22","17:53:03"
"688367","Vídeo de Ricardo Azevedo, pessoal uma coisa nunca vista aqui em Pernambuco região nordeste, chuva de granizo!","2022-12-22 17:53:16","251998304.0","2022-12-22","17:53:16"
"688368","“Você é contra que países envie bilhões para um dos países mais corruptos e disfuncionais do mundo! O que você é, pró-Rússia?!”

🤡🤡🤡🤡🤡🤡🤡🤡🤡","2022-12-22 17:54:08","5413659844.0","2022-12-22","17:54:08"
"688369","Então tem que deixar um pais mais corrupto e assassino ainda destruir a Ucrânia? Se vc é contra é russete sim","2022-12-22 17:55:57","887347636.0","2022-12-22","17:55:57"
"688370","Peter idiocracy. Golpe não! O golpe já foi dado, seu oportunista!","2022-12-22 17:56:23","778420325.0","2022-12-22","17:56:23"
"688371","Oi sou um robot russo, tudo bem Peter? Ganhando dinheirinho ai?","2022-12-22 17:58:03","778420325.0","2022-12-22","17:58:03"
"688409","Tudo bem, então continue a guerra até toda a população masculina adulta da Ucrânia ser morta. Bela solução! Você merece o prêmio Nobel! 👍","2022-12-22 18:47:48","1403337079.0","2022-12-22","18:47:48"
"688372","10 dias.

⏳","2022-12-22 17:59:04","867304090.0","2022-12-22","17:59:04"
"688373","“Você é contra que países envie bilhões para um dos países mais corruptos e disfuncionais do mundo! O que você é, pró-Rússia?!”

🤡🤡🤡🤡🤡🤡🤡🤡🤡","2022-12-22 17:59:19","867304090.0","2022-12-22","17:59:19"
"688374","Dia 1 de janeiro tô marcando manifestação na praia do Flamengo, que é pro Peter barriga de chope andar menos e dizer que o Bolsonaro vencerá no primeiro turno em 2026 😂😂😂","2022-12-22 18:00:53","778420325.0","2022-12-22","18:00:53"
"688376","0,36''…","2022-12-22 18:12:09","1197918638.0","2022-12-22","18:12:09"
"688377","Estamos nos encaminhando para o total colapso do Brasil. Isso aqui vai virar uma Iugoslávia. Parabéns aos completos retardados envolvidos","2022-12-22 18:16:59","5158818464.0","2022-12-22","18:16:59"
"688416","Só pode ser, as narrativas dele da guerra da Ucrânia não fazem o menor sentido","2022-12-22 18:55:27","1403337079.0","2022-12-22","18:55:27"
"688378","Me desculpe mas: 
1. A Ucrânia é muito mais corrupta do que a Rússia,
2  enviar armas para a Ucrânia só ajuda políticos corruptos e os fabricantes de armas,
3. Enviar armas para a Ucrânia ajuda a prolongar a guerra e aumentar o número de mortes e aumentar o volume de destruição 
4. Se a OTAN e o governo zelensky procurassem negociar não haveria guerra.","2022-12-22 18:18:28","1403337079.0","2022-12-22","18:18:28"
"688379","Pessoal, democracia é isso","2022-12-22 18:21:48","406651357.0","2022-12-22","18:21:48"
"688380","Bola pra frente","2022-12-22 18:22:07","406651357.0","2022-12-22","18:22:07"
"688381","#Cuie

Marmita com pena de vagabundo. Típica personagem que aparece no Cidade Alerta.","2022-12-22 18:24:27","5737870204.0","2022-12-22","18:24:27"
"688382","Zelensky é liberal? SQN
https://t.me/rljunior007/48866","2022-12-22 18:26:49","171002031.0","2022-12-22","18:26:49"
"688383","Sim fellas não é montagem kkkkkkkkkkkkkkkkkkkkkkkkkkkkkkkkkkkkkkkkkkkkkkkkkkkkkkkkkkkkkkk
@AuroraDeAco","2022-12-22 18:29:42","624451034.0","2022-12-22","18:29:42"
"688384","Pode ser.","2022-12-22 18:30:13","1068242909.0","2022-12-22","18:30:13"
"688386","A pagina esta dando como indisponivel","2022-12-22 18:30:40","1430201979.0","2022-12-22","18:30:40"
"688387","Sou ex-bolsonarista. Ja fiz o L","2022-12-22 18:32:39","2042549465.0","2022-12-22","18:32:39"
"688388","Tapa na cara dos esquerdopatas! Esse bicho é muito inteligente! Grande Bolsonaro! Minha eterna admiração!","2022-12-22 18:33:24","1478430930.0","2022-12-22","18:33:24"
"688389","Negociar? É sério isso? A Russia, um dos países que mais matou pessoas na história da humanidade, invade seu país e vc quer negociar?","2022-12-22 18:33:34","887347636.0","2022-12-22","18:33:34"
"688431","aqui no Amazonas o governador junto com os deputados (safados) tbm aumentaram!! 🤬","2022-12-22 19:28:03","1888224615.0","2022-12-22","19:28:03"
"688391","Função das mulheres na Guerra Cristera.

Canal
Frente Agorista

Grupos
Anarcocapitalismo
Agorismo","2022-12-22 18:35:22","193196103.0","2022-12-22","18:35:22"
"688392","O servidor deu pau kkkkkk","2022-12-22 18:35:57","2049410193.0","2022-12-22","18:35:57"
"688393","Muita gente acessando","2022-12-22 18:36:08","2049410193.0","2022-12-22","18:36:08"
"688395","ESTADOS já falam em SUBIR o ICMS porque estariam PERDENDO RECEITAS, mas ESSE é o SEU DINHEIRO
@ ANCAPSU","2022-12-22 18:37:06","1103049455.0","2022-12-22","18:37:06"
"688397","Deixa o Lula assumir… vai cair granito na cabeça de vcs.","2022-12-22 18:38:31","124982804.0","2022-12-22","18:38:31"
"688398","É o seguinte galera; analise a situação; o Brasil não tem políticos de Direita, Cássio Nunes trabalhou para Dilma, Tarcísio também, outros são do centro, quem se lembra de Moro? PSDB, e mais uma ruma de traíras,   o cara faz o que dá para fazer, de um limão faz uma limonada.","2022-12-22 18:38:49","1478430930.0","2022-12-22","18:38:49"
"688399","A Rússia sozinha contra a NOM.","2022-12-22 18:39:58","1478430930.0","2022-12-22","18:39:58"
"688403","Uma mãe não pode obrigar seu filho a pintar as unhas porque isso seria uma violação do direito fundamental da criança à autodeterminação e autonomia pessoal.  Segundo a lei, os menores têm certos direitos e proteções, incluindo o direito de tomar decisões sobre seus próprios corpos e aparência pessoal.  Forçar uma criança a pintar as unhas contra sua vontade infringiria seu direito à autonomia corporal e também pode ser considerado uma forma de abuso emocional ou psicológico.  É importante que os pais respeitem a autonomia de seus filhos e permitam que eles tomem decisões sobre seu próprio corpo e aparência, dentro do razoável.","2022-12-22 18:44:39","124982804.0","2022-12-22","18:44:39"
"688474","Porque nao faz porra do reator aqui ?","2022-12-22 20:55:52","1941884372.0","2022-12-22","20:55:52"
"688404","Funcionando normal por aqui.","2022-12-22 18:44:58","5045239456.0","2022-12-22","18:44:58"
"688405","Como dizem por aí :
Você é o carbono que eles querem eliminar.","2022-12-22 18:45:29","1400912404.0","2022-12-22","18:45:29"
"688406","Diálogo 🤑💰💸💵","2022-12-22 18:46:32","5413659844.0","2022-12-22","18:46:32"
"688407","""O diálogo venceu."" 🤡","2022-12-22 18:46:32","5413659844.0","2022-12-22","18:46:32"
"688408","Isso aqui? sério q isso q estamos vivendo é democracia? kkkkkkkkkkkkkkkkkkkkkkkkkkkkkkkkkkkkkkkkkkkkkkkkkkkkkkkkkkkkkkkkkkkkkkkkkkkkkkkkkkkkkkkkkkkkkkkkkkkkkkkkkkkkkkkkkkkkk","2022-12-22 18:46:44","1556218841.0","2022-12-22","18:46:44"
"688410","Mais de 50% dos europeus estão em situação de pobreza. A UE impôs restrições a Rússia, porém, deram tiro na nuca, o PIB cresceu, e  Putin só vende o gás a moeda local, estão fodidos! De nada adiantou!","2022-12-22 18:48:04","1478430930.0","2022-12-22","18:48:04"
"688411","Deixaram o ""Bolso"" para traz agora vai ficar com o ""Bolso"" vazio! Chorar vai ser pouco .... FAZUELI!!! NA PRÓXIMA ELEIÇÃO VOTA NO ""AMULAEDO"" ... GENTE FINÍSSIMA!","2022-12-22 18:48:47","1528480941.0","2022-12-22","18:48:47"
"688412","FDSPTS DA NOM,; Biden, Macron, Zelensky, Trudeau, e cia.","2022-12-22 18:50:31","1478430930.0","2022-12-22","18:50:31"
"688413","De acordo com o Peter as sanções são uma maravilha, destruiu a economia da Rússia e a economia da Europa está muito bem. O engraçado é que os dados a disposição demonstram exatamente o contrário.","2022-12-22 18:51:39","1403337079.0","2022-12-22","18:51:39"
"688414","Peter deve ter parentes na Ucrânia, kkkkkkkkk","2022-12-22 18:53:53","1478430930.0","2022-12-22","18:53:53"
"688415","142","2022-12-22 18:54:07","778420325.0","2022-12-22","18:54:07"
"688417","Peter batateiro, não acerta uma. É um ""web analyzer"". Conhecimento de Wikipedia, distributed information","2022-12-22 18:56:24","778420325.0","2022-12-22","18:56:24"
"688418","Hummm então é assim que ele está pagando","2022-12-22 18:56:50","1027503061.0","2022-12-22","18:56:50"
"688419","Tudo que ele fala, acontece o contrário. Pode ver. Mão de pântano. Macumbado.","2022-12-22 18:57:41","778420325.0","2022-12-22","18:57:41"
"688420","E mula","2022-12-22 18:58:23","5413659844.0","2022-12-22","18:58:23"
"688421","Com certeza, já observado isso lá no YouTube. É ele saber que; caso haja algum tipo de ameaça da UE ao Brasil, o único que pode nos socorrer é a velha e boa Rússia, é só ver o tamanho da mesa de negociações.","2022-12-22 18:58:49","1478430930.0","2022-12-22","18:58:49"
"688429","Com certeza. É um absurdo as pessoas ainda tirar base do Brasil lendo: G1, O Globo, UOL, CNN, Metrópoles. Se você querer desinformação leia isso.","2022-12-22 19:26:26","1676627802.0","2022-12-22","19:26:26"
"688423","Aqui no Pará o Barbalho fdp subiu já e foi tirar férias.","2022-12-22 19:03:22","2120556693.0","2022-12-22","19:03:22"
"688424","🤔😂 O negócio tá ficando bom entre Zelensky e Biden...","2022-12-22 19:07:45","867304090.0","2022-12-22","19:07:45"
"688425","A PF virou inspetor escolar para resolver problema de criança que não gosta de ser chamada como tal. 

PF prende empresário acusado de chamar Randolfe de ""gazela""

https://pleno.news/brasil/politica-nacional/pf-prende-empresario-acusado-de-chamar-randolfe-de-gazela.html","2022-12-22 19:08:22","867304090.0","2022-12-22","19:08:22"
"688426","Continue até expulsar os invasores","2022-12-22 19:10:27","887347636.0","2022-12-22","19:10:27"
"688427","Problema deles","2022-12-22 19:12:14","1027503061.0","2022-12-22","19:12:14"
"688428","Aquele repórter da globe ia chorar ao ver essa vítima da sociedade perecendo aos seus olhos","2022-12-22 19:13:24","1027503061.0","2022-12-22","19:13:24"
"688432","https://www.cnnbrasil.com.br/politica/salario-dos-parlamentares-brasileiros-e-15-vezes-maior-que-renda-da-populacao/","2022-12-22 19:32:43","634223840.0","2022-12-22","19:32:43"
"688433","Minas ainda não subiu","2022-12-22 19:33:03","634223840.0","2022-12-22","19:33:03"
"688434","link?","2022-12-22 19:34:47","2113866378.0","2022-12-22","19:34:47"
"688435","https://vistapatria.com.br/diario-oficial-da-uniao-publica-aprovacao-de-que-ministerio-da-defesa-passa-a-ser-o-orgao-que-interpreta-a-constituicao/","2022-12-22 19:35:33","5702418153.0","2022-12-22","19:35:33"
"688475","O eleitorado do lula sao todos macacos","2022-12-22 20:56:12","1941884372.0","2022-12-22","20:56:12"
"688438","Se você pesquisar um pouco vai verificar que a maior parte do armamento pesado da Ucrânia (tanques, blindados, artilharia, aviões, etc) foram destruídos, a maior parte da infraestrutura ucraniana está destruída, assim como sua estrutura de produção de energia, os estoques de munições da Ucrânia e da OTAN estão baixos, para cada 1 baixa que a Rússia sofre, os ucranianos sofrem 10, calcula-se que a Rússia sofreu 16 mil mortos (10 mil do exército russo, 5 mil das milícias de Donetsk e Lugansk, e 1 mil do Wagner Group) além de 50 mil feridos, já a Ucrânia sofreu mais de 100 mil mortos, além de 35 mil ucranianos desaparecidos que já são considerados como mortos, além de mais de 300 mil feridos o que faz cerca de 440 mil baixas ucranianas, os cálculos são de que a Ucrânia sofre mais de 750 baixas por dia só em Bakmut (150 mortos e 600 feridos), ao longo de toda a linha de frente são cerca de 2 mil baixas incluindo cerca de mais de 300 mortos diários.

A Ucrânia está sangrando e a perda de potencial humano é absurdo. Me diga: como os ucranianos vão expulsar os russos???????","2022-12-22 19:36:16","1403337079.0","2022-12-22","19:36:16"
"688439","isso pode ser derrubado?","2022-12-22 19:37:40","2113866378.0","2022-12-22","19:37:40"
"688440","como funciona","2022-12-22 19:37:49","2113866378.0","2022-12-22","19:37:49"
"688441","Sei lá...
Acho que vai precisar de um pouco de propelente (pólvora) para isso funcionar direito","2022-12-22 19:39:50","5702418153.0","2022-12-22","19:39:50"
"688444","De novo!!!","2022-12-22 19:44:24","5702418153.0","2022-12-22","19:44:24"
"688445","Esquerda e STF vão para o lugar deles, reservado ao que fazem o que eles fazem. Tá chegando a hora. Bagunça tem limites.","2022-12-22 19:45:40","235982449.0","2022-12-22","19:45:40"
"688446","Funciona quando o cabeça de piroca falar que e inconstitucional e antidemocrático kkkkkkkkk","2022-12-22 19:45:44","2049410193.0","2022-12-22","19:45:44"
"688447","kkkkkkkkkk","2022-12-22 19:46:17","2113866378.0","2022-12-22","19:46:17"
"688448","isso vai ser engraçado","2022-12-22 19:46:22","2113866378.0","2022-12-22","19:46:22"
"688449","ele falando que e inconstitucional e eles falando que nao","2022-12-22 19:47:06","2113866378.0","2022-12-22","19:47:06"
"688450","a diferença é que um lado tem força ne","2022-12-22 19:47:17","2113866378.0","2022-12-22","19:47:17"
"688451","Eles ainda não entenderam que se abaixar impostos vende mais e a arrecadação aumenta","2022-12-22 19:49:31","1364791624.0","2022-12-22","19:49:31"
"688452","É difícil desses fdp entender isso","2022-12-22 19:49:50","1364791624.0","2022-12-22","19:49:50"
"688453","MENOS IMPOSTOS SIGNIFICANDO MAIOR ARRECADAÇÃO:

Arrecadação federal de novembro é a maior em 9 anos, melhor resultado da história (R$ 172 bilhões).

A informação foi divulgada pela Secretaria da Receita Federal, nesta quarta-feira (21), com acréscimo real de 3,25% em relação a novembro de 2021.

Reduzimos impostos e com isso reduzimos a ineficiência econômica e aumentamos a produtividade. Resultado: No acumulado de jan-nov a arrecadação federal somou R$ 2 trilhões, o que representa alta real de 8,8% na comparação com o mesmo período do ano passado.","2022-12-22 19:51:05","1364791624.0","2022-12-22","19:51:05"
"688454","Eles devem achar inaceitável alguém fora do estado ganhar mais que eles.","2022-12-22 19:51:11","5702418153.0","2022-12-22","19:51:11"
"688455","Regiões Luso-Americanas que possuem o maior número de imigrantes Europeus e seus descendentes, marcadas nação por nação acima.","2022-12-22 19:52:05","5696939756.0","2022-12-22","19:52:05"
"688461","Habeas Corpus Criminal protocolado pelo PR Bolsonaro; MD Paulo Sérgio publicado no STM em 21/12/2022 18:09:08.","2022-12-22 20:07:06","5413659844.0","2022-12-22","20:07:06"
"688457","🧬🔥  🔴⚪⚫  🔥🧬","2022-12-22 19:52:05","5696939756.0","2022-12-22","19:52:05"
"688458","Que tal o Cerimedo ?","2022-12-22 19:53:23","246412672.0","2022-12-22","19:53:23"
"688459","Vamos lá, qual vai ser o próximo imposto:

CPMF do PIX
IOF do dólar
IOF Financiamento
Aumento da CS da gasolina
+4 anos sem reajuste na tabela do IRPF

Estamos lascados. Sem falar nas perseguições que vão ter. Estou aguardando o primeiro discurso na nova ministra da saúde para planejar a rota de fuga. Pois o lockdown vem aí","2022-12-22 20:01:22","694269070.0","2022-12-22","20:01:22"
"688460","Está se protegendo para não ser preso pelo stf e pelo mula ao sair da presidência ou se protegendo para dar o galope?","2022-12-22 20:07:06","5413659844.0","2022-12-22","20:07:06"
"688462","Como pode ser golpe algo que está na constituição? tem hora que eu acho que o Peter não tá bem da cabeça, quem quer paz vai para a guerra, ficar só com a bunda na cadeira na frente do PC não vai resolver p**** nenhuma mesmo","2022-12-22 20:19:08","1993147136.0","2022-12-22","20:19:08"
"688463","Ancap Troll 😎","2022-12-22 20:20:51","647744837.0","2022-12-22","20:20:51"
"688464","Ten days to...

The 31st is coming, what do the next few days before it hold? Are you still hopeful?

✍🇧🇷
O dia 31 está chegando, o que os próximos dias antes dele reservam? Você ainda está esperançoso?

Share it! 📢","2022-12-22 20:24:45","867304090.0","2022-12-22","20:24:45"
"688465","👏👏👏

https://t.me/jornalismoepolitica","2022-12-22 20:32:46","5371397948.0","2022-12-22","20:32:46"
"688466","EUROPA quer PIORAR o seu CELULAR só para POLÍTICO INÚTIL dizer que ESTÁ AJUDANDO em ALGUMA COISA
@ ANCAPSU","2022-12-22 20:35:27","1103049455.0","2022-12-22","20:35:27"
"688467","Deixa subir dançar com Pablo Bittar cantar hino da ursal festa completa com muita picanha e cerveja. Não aguenta 1 ano esse demônio.","2022-12-22 20:43:46","5523010702.0","2022-12-22","20:43:46"
