"message_id","message","message_utc","from_id","date","time"
"641170","kkkk  otan  boazinha ,, so se for na frança ,,kkkk ops,,","2022-11-07 19:00:56","2028813499.0","2022-11-07","19:00:56"
"641161","acho q o L não tem nem 20%. porque não foi só manipulação das urnas. também foi compra de votos e mesários votando pelos faltantes","2022-11-07 18:59:27","5750867496.0","2022-11-07","18:59:27"
"641163","Tipo esse cara aqui.","2022-11-07 18:59:39","153087617.0","2022-11-07","18:59:39"
"641164","Pessoal.
Alguem sabe me informar quem fechou o sexto andar do Sírio ? Vejam a live que o Pastor Sandro rocha fez.

É de cair o queixo

https://youtu.be/9WWFllnPOyQ","2022-11-07 18:59:49","1641705891.0","2022-11-07","18:59:49"
"641166","Não","2022-11-07 19:00:06","5189011877.0","2022-11-07","19:00:06"
"641167","Esse desgraçado aí quer é ser ele próprio o ditador, visto que Lula não vai durar para sempre (e nem ele).","2022-11-07 19:00:12","235982449.0","2022-11-07","19:00:12"
"641171","Nao sou evangélico, mas é impressionante. Explicou tudo usando metafora..","2022-11-07 19:01:44","1641705891.0","2022-11-07","19:01:44"
"641172","A fraude sem voto impresso já era admitida pela própria fabricante. E ainda é a Amanda que narra a notícia.","2022-11-07 19:01:45","165399610.0","2022-11-07","19:01:45"
"641175","https://www.poder360.com.br/congresso/aliados-sugerem-a-lula-acabar-com-principais-regras-fiscais/","2022-11-07 19:02:41","634223840.0","2022-11-07","19:02:41"
"641176","A pec do lula aí","2022-11-07 19:02:44","634223840.0","2022-11-07","19:02:44"
"641178","enquanto isso, o Luís Hamilton da Silva recebeu comenda na câmara. prioridades","2022-11-07 19:04:17","1349772743.0","2022-11-07","19:04:17"
"641179","o povo não precisa mais da validação desses vendilhões.","2022-11-07 19:04:39","165399610.0","2022-11-07","19:04:39"
"641180","Tá, depois eu vejo!","2022-11-07 19:04:47","5189011877.0","2022-11-07","19:04:47"
"641214","Kkkk","2022-11-07 19:15:22","1095521815.0","2022-11-07","19:15:22"
"641183","👀👀👀👀","2022-11-07 19:05:39","1328638661.0","2022-11-07","19:05:39"
"641185","O que esse cara tá fazendo em banânia?kkk","2022-11-07 19:06:14","1027503061.0","2022-11-07","19:06:14"
"641186","guerra civil meu irmão","2022-11-07 19:06:42","1424650826.0","2022-11-07","19:06:42"
"641187","Atiraram de fuzil na População...A merda ou solução tá começando...Dirceu.ministro da Defesa..","2022-11-07 19:06:43","5291086384.0","2022-11-07","19:06:43"
"641188","Fazzuelli","2022-11-07 19:08:24","1095521815.0","2022-11-07","19:08:24"
"641189","Cidadão honorário kkkkkkkk","2022-11-07 19:08:45","1027503061.0","2022-11-07","19:08:45"
"641644","Quarta","2022-11-07 22:18:26","165399610.0","2022-11-07","22:18:26"
"641190","agora me motivou a ir 💪🥕🥖🍆🍌👍🏻👆🏻🦾🙏🦵🏽","2022-11-07 19:09:05","5750867496.0","2022-11-07","19:09:05"
"641191","poderiam ter pedido para o Nelson Piquet fazer a entrega","2022-11-07 19:09:23","165399610.0","2022-11-07","19:09:23"
"641195","gp de interlagos, acho que é semana que vem","2022-11-07 19:09:45","1349772743.0","2022-11-07","19:09:45"
"641196","kkk acho que vai dar ruim","2022-11-07 19:09:59","165399610.0","2022-11-07","19:09:59"
"641197","Esse final de semana msm","2022-11-07 19:10:07","1998598133.0","2022-11-07","19:10:07"
"641198","Ovo ver para esquecer essas notícias ruins","2022-11-07 19:10:24","1027503061.0","2022-11-07","19:10:24"
"641199","Cara a cada dia está se tornando preocupante","2022-11-07 19:11:22","1027503061.0","2022-11-07","19:11:22"
"641200","ao que parece a infraestrutura da ferrari tinha ficado presa num dos bloqueios semana passada kkkkk","2022-11-07 19:11:43","1349772743.0","2022-11-07","19:11:43"
"641201","E esse negócio que falaram que o congresso está negociando para passar uma constituição parlamentarisma","2022-11-07 19:11:44","634223840.0","2022-11-07","19:11:44"
"641202","Em 2030","2022-11-07 19:11:47","634223840.0","2022-11-07","19:11:47"
"641203","nossa, em 2030 é muito tarde","2022-11-07 19:12:30","1349772743.0","2022-11-07","19:12:30"
"641204","Eita porra kkkk","2022-11-07 19:12:42","1027503061.0","2022-11-07","19:12:42"
"641205","parlamentarisma e bom para as empresas que fazem lobi, assim tem menos gente para pagare suborno, quero dizer fazer lobi","2022-11-07 19:12:45","246412672.0","2022-11-07","19:12:45"
"641206","Eu já fico vendo os filmes do Boyka pra ficar mais violento ainda kkkkkkkkkkkk","2022-11-07 19:12:45","2103264782.0","2022-11-07","19:12:45"
"641207","E tem “cristão” que votou na esquerda kkkkk","2022-11-07 19:12:50","5737870204.0","2022-11-07","19:12:50"
"641208","rola para o começo de 2022 uma pec ou algo assim sobre semipresidencialismo, é só organizar direitinho","2022-11-07 19:13:01","1349772743.0","2022-11-07","19:13:01"
"641209","Kkkkkkkkkkkkkkkkk pior que esses filmes lhe deixa com uma puta adrenalina","2022-11-07 19:13:22","1027503061.0","2022-11-07","19:13:22"
"641210","Haddad como ministro da Economia seria um merecido chute no traseiro da Faria Lima.","2022-11-07 19:13:29","1349772743.0","2022-11-07","19:13:29"
"641211","Semana GP em Interlagos...SP.....Marginais...Imprensa Internacionais...está aí o bolo...Final de semana...Se eu fosse em.uma manifestação...","2022-11-07 19:14:03","5291086384.0","2022-11-07","19:14:03"
"641213","Faz o L deixa arder","2022-11-07 19:15:20","1095521815.0","2022-11-07","19:15:20"
"641215","https://www.cnnbrasil.com.br/politica/grupo-da-camara-recomenda-adocao-do-semipresidencialismo-a-partir-de-2030/","2022-11-07 19:17:12","634223840.0","2022-11-07","19:17:12"
"641217","Jesus, o PTSE só fazendo mais lambança ....","2022-11-07 19:19:21","165399610.0","2022-11-07","19:19:21"
"641220","é um combo de bosta","2022-11-07 19:21:12","165399610.0","2022-11-07","19:21:12"
"641221","Já tô achando que é fake esse bglh","2022-11-07 19:21:33","1998598133.0","2022-11-07","19:21:33"
"641223","Confronto PRF e população em Novo Progresso - PA.

Supostamente a confusão iniciou porque uma criança teria morrido quando PRF jogou spray de pimenta nos manifestantes.

A guerra tá vindo, sigam esse canal para saber se defender nos protestos.

#aviso","2022-11-07 19:22:03","1565431785.0","2022-11-07","19:22:03"
"641225","Twitter já tá na merda faz tempo, o Elon tá é tentando consertar esse chorume","2022-11-07 19:22:03","1998598133.0","2022-11-07","19:22:03"
"641238","Sim, tá pouco se fudendo, mas era uma piada, ele é literalmente meio cego kk","2022-11-07 19:25:25","844720961.0","2022-11-07","19:25:25"
"641228","🤐

https://t.co/XgO4kCTtRo","2022-11-07 19:22:16","1203306952.0","2022-11-07","19:22:16"
"641229","Só pode tá meio cego pra não perceber a realidade","2022-11-07 19:22:22","844720961.0","2022-11-07","19:22:22"
"641231","Outro Monark da vida....Vive no mundo dos unicórnios..","2022-11-07 19:23:13","5291086384.0","2022-11-07","19:23:13"
"641235","Diferentes soluções para se livrar da contaminação de Spray de Pimenta

[IMAGEM]

Sempre irrigar a partir do canto interno do olho para fora, com a cabeça inclinada para trás e ligeiramente para o lado que está sendo lavado. Nunca esfregar a pele!!! Shampoo de bebê é bem melhor, pois não irrita os olhos.

É só questão de tempo até a polícia reagir contra a população pacífica. Repassem.

#defesa","2022-11-07 19:23:45","1565431785.0","2022-11-07","19:23:45"
"641236","sabe até o signo dos caras. que poha kkk","2022-11-07 19:24:18","165399610.0","2022-11-07","19:24:18"
"641241","Prf meteu tiro de fuzil na populaçao ?","2022-11-07 19:26:40","5243463294.0","2022-11-07","19:26:40"
"641243","Venho escrevendo...Está turma.do PT quer uma Venezuelacao rápida do Brasil...Junto com STF...Esquece congresso....Congresso vai ser assim...Ou tá com agente ou mandato cassado...Carla Zambelli,Nicolas,e os demais vão passar o rodo...E vão ser cassados pela turma do centrao vendidos e com o rabo preso no STF","2022-11-07 19:27:53","5291086384.0","2022-11-07","19:27:53"
"641244","Ainda esse meio que ele tá, pessoal que ainda gosta de filme da Marvel é progressista","2022-11-07 19:28:11","844720961.0","2022-11-07","19:28:11"
"641246","Essa é a manifestação pacífica que está por vir no Brasil!!!

Se preparem guerreiros, é assim que a gente derruba o sistema.

Vídeo sobre a revolta civil na Ucrânia em 2014

#aviso","2022-11-07 19:29:03","1565431785.0","2022-11-07","19:29:03"
"641255","Ouvir dizer que Briar funciona bem.","2022-11-07 19:36:32","1565431785.0","2022-11-07","19:36:32"
"641247","Mas o Peter está no mundo de Bob, e quer ver nos por lá para ganhar uns trocados.","2022-11-07 19:29:14","5702418153.0","2022-11-07","19:29:14"
"641248","Filmes da Marvel são mais fáceis de entender, feito para as massas.","2022-11-07 19:30:39","5702418153.0","2022-11-07","19:30:39"
"641251","vocês aí preocupado com a posse da esquerda kkk  me comovo","2022-11-07 19:32:58","165399610.0","2022-11-07","19:32:58"
"641252","Quem criou incitou os protestos na Ucrânia em 2014 está do lado do Lula em 2022.

""From the beginning, I was one of the organizers of the Maidan. My television channel—Channel 5—played a tremendously important role. ... On the 11th of December, when we had [U.S. Assistant Secretary of State] Victoria Nuland and [E.U. diplomat] Catherine Ashton in Kyiv, during the night they started to storm the Maidan.""

https://www.youtube.com/watch?v=ymi66ZPht_c","2022-11-07 19:33:11","1912761006.0","2022-11-07","19:33:11"
"641253","https://www.youtube.com/watch?v=6L-UCFAHejo&ab_channel=COMOENRIQUECER","2022-11-07 19:33:50","807363644.0","2022-11-07","19:33:50"
"641254","ha ai alguem de TI que queira ajudar a desenvolver uma rede descentralizada e gratuita, tipo esta do link  https://www.inkblok.io/blockchain-send-message/#start","2022-11-07 19:35:09","246412672.0","2022-11-07","19:35:09"
"641256","Claro, de fraude os democratas entendem","2022-11-07 19:37:15","1328638661.0","2022-11-07","19:37:15"
"641257","sim, mas esta e feita com blockchain cada maquina fica com um pedacinho das msg e nunca podem ser apagadas, o que tem de ruin e que nao da para vender publicidade, por que sera algo verdadeiramente aberto","2022-11-07 19:37:55","246412672.0","2022-11-07","19:37:55"
"641260","pega mal isso, galera tem que ser mais esperta. dar uma noticia dessas é tudo o que a imprensa quer","2022-11-07 19:40:11","1328638661.0","2022-11-07","19:40:11"
"641262","pessoal o que está acontecendo?","2022-11-07 19:41:15","1027503061.0","2022-11-07","19:41:15"
"641263","O negócio tá esquentando… estou cada dia mais convencida que vem um conflito civil não apenas no Brasil mas que vai se alastrar pra outros países americanos (norte e sul)… 

Lembremos todos de Matheus 24:6-13

OS CONTROLADORES DO MUNDO 50% OFF 🔥💣📚👉🏻 https://pay.kiwify.com.br/aKI9DQI","2022-11-07 19:41:16","1905734033.0","2022-11-07","19:41:16"
"641264","A situação no Brasil tá ficando muito louca sério não dá pra acreditar não é possível que a guerra vai começar aí ao invés de aqui 🤔🤔🤔","2022-11-07 19:41:27","1905734033.0","2022-11-07","19:41:27"
"641266","A SITUAÇÃO ESCALA NO PARÁ & MATO GROSSO
https://youtu.be/0T9qvWbvRs0","2022-11-07 19:41:39","1905734033.0","2022-11-07","19:41:39"
"641267","hoje de manhã real estava a 5,12","2022-11-07 19:41:47","1027503061.0","2022-11-07","19:41:47"
"641268","O negócio tá esquentando… estou cada dia mais convencida que vem um conflito civil não apenas no Brasil mas que vai se alastrar pra outros países americanos (norte e sul)… 

Lembremos todos de Matheus 24:6-13

OS CONTROLADORES DO MUNDO 50% OFF 🔥💣📚👉🏻 https://pay.kiwify.com.br/aKI9DQI","2022-11-07 19:41:47","1905734033.0","2022-11-07","19:41:47"
"641269","http://g1.globo.com/jornal-nacional/noticia/2017/03/fsuprema-corte-da-venezuela-assume-funcoes-do-congresso.html","2022-11-07 19:41:59","634223840.0","2022-11-07","19:41:59"
"641270","Isso em 2017","2022-11-07 19:42:02","634223840.0","2022-11-07","19:42:02"
"641271","Exército pede ajuda ao GDF para controlar bolsonaristas no QG | Metrópoles - Metrópoles
https://www.metropoles.com/brasil/exercito-pede-ajuda-ao-gdf-para-controlar-bolsonaristas-no-qg","2022-11-07 19:43:13","634223840.0","2022-11-07","19:43:13"
"641272","E tá tão grande assim ?","2022-11-07 19:43:20","634223840.0","2022-11-07","19:43:20"
"641273","Ó o Ancapistão instaurado!","2022-11-07 19:44:10","5514236800.0","2022-11-07","19:44:10"
"641274","Metrópoles é uma péssima fonte de notícias.","2022-11-07 19:44:29","1569913929.0","2022-11-07","19:44:29"
"641275","os exilados do Antagonista foram para lá ne?","2022-11-07 19:44:47","165399610.0","2022-11-07","19:44:47"
"641276","Pessoal, dei uma limpa nos russetes daqui","2022-11-07 19:45:12","","2022-11-07","19:45:12"
"641277","ah, tinha que ser a globo","2022-11-07 19:45:58","1349772743.0","2022-11-07","19:45:58"
"641278","No Brasil acho que é mais hein? Bota aí uns 60%.","2022-11-07 19:46:08","5514236800.0","2022-11-07","19:46:08"
"641279","Fudeu","2022-11-07 19:46:23","824010709.0","2022-11-07","19:46:23"
"641282","Quando a direita cair os próximos serão os insentões como Nando Moura, Diego Rox...","2022-11-07 19:47:56","5514236800.0","2022-11-07","19:47:56"
"641283","Problema q só um lado está armado kkkk","2022-11-07 19:47:57","1558892562.0","2022-11-07","19:47:57"
"641284","Compre bitcoin","2022-11-07 19:47:59","634223840.0","2022-11-07","19:47:59"
"641285","Jair Bravata Bolsonaro.....Fico imaginando se Dom Pedro.1,fosse bravateiro..Ainda seriamos colônia de.Portugal...Dom.Pedro com caganeira e tudo declarou a Independência. Este aí até o final de Janeiro o Alexandre de Moraes coloca ele em cana.","2022-11-07 19:48:26","5291086384.0","2022-11-07","19:48:26"
"641286","Verdade","2022-11-07 19:48:33","5514236800.0","2022-11-07","19:48:33"
"641287","Não é bala de borracha","2022-11-07 19:48:49","1749300915.0","2022-11-07","19:48:49"
"641288","Já fiz isso, mas vou fazer com o restante do dinheiro que ficou na poupança kkk","2022-11-07 19:49:03","1027503061.0","2022-11-07","19:49:03"
"641289","Pois é, eles acham q vao passar desapercebidos pela esquerda, não poderiam estar mais enganados , mbl morreu o Kim tá lá não sei como, mas tá sozinho, de vez enquanto vota com a esquerda para diminuir a solidão kkkk","2022-11-07 19:49:29","1558892562.0","2022-11-07","19:49:29"
"641290","4 linhas da nisso aí, ano que vem vai ser preso. Sai fora do país enquanto Nine não tomou posse.","2022-11-07 19:50:15","5514236800.0","2022-11-07","19:50:15"
"641291","Atiraram de fuzil 5.56....E só ver os estojos...Foi Deus que não morreu ninguém...","2022-11-07 19:50:17","5291086384.0","2022-11-07","19:50:17"
"641292","🚨 URGENTE: CAOS NO PARÁ

PRFs disparam tiros de borracha e espirram spray de pimenta contra manifestantes na BR-163, em Novo Progresso-PA, no começo da tarde dessa segunda-feira, 7/11.

Um homem apareceu correndo com uma criança no colo em meio aos disparos. Há relatos de que a criança morreu.

Informações iniciais dão conta que a PRF cumpre ordens do governador do Pará, Helder Barbalho.","2022-11-07 19:50:44","1510030941.0","2022-11-07","19:50:44"
"641306","kkkkkkkkkkkkkkkkkk","2022-11-07 19:54:52","656263791.0","2022-11-07","19:54:52"
"641294","Man tu vai ver o Kim vai fechar com a esquerda rapidamente não dou nem 6 meses.","2022-11-07 19:51:50","5514236800.0","2022-11-07","19:51:50"
"641295","Não.foram tiros de borracha.....A dezenas de estojos de municao de fuzil","2022-11-07 19:52:07","5291086384.0","2022-11-07","19:52:07"
"641296","aqui é BRASIL!!! KKKKKKKKKKKKK","2022-11-07 19:52:42","656263791.0","2022-11-07","19:52:42"
"641297","Pessoal Paraense botou pra fuder.","2022-11-07 19:52:46","5514236800.0","2022-11-07","19:52:46"
"641298","Tenho dó dos coitados que pensam que os 🐷 fardados ficarão ao lado do povo…eles só vão intervir se for para meter a porrada pelo bem dó establishment!
Um dos mals do brasileiro é essa sanha de endeusar polícia","2022-11-07 19:53:08","5413659844.0","2022-11-07","19:53:08"
"641299","Rio do Sul/SC","2022-11-07 19:53:20","1349772743.0","2022-11-07","19:53:20"
"641300","pau comendo solto na timeline","2022-11-07 19:53:24","1349772743.0","2022-11-07","19:53:24"
"641301","Irmão, da forma que estão as coisas, eu não duvido que cenas como essas comecem a acontecer","2022-11-07 19:54:06","656263791.0","2022-11-07","19:54:06"
"641303","Já fechou algumas vezes no passado","2022-11-07 19:54:07","1558892562.0","2022-11-07","19:54:07"
"641304","Espero q o novo não faça a mesma coisa agora q colocou o amoeba para andar","2022-11-07 19:54:37","1558892562.0","2022-11-07","19:54:37"
"641305","caralho no segundo 15, o prf manda a cadeirada no maluco e o maluco mete a paulada no prf","2022-11-07 19:54:51","656263791.0","2022-11-07","19:54:51"
"641307","Alguém sério confirmou essa história de ITA?","2022-11-07 19:54:56","1328638661.0","2022-11-07","19:54:56"
"641308","Dirceu ministro da defesa?","2022-11-07 19:55:20","5687290451.0","2022-11-07","19:55:20"
"641309","kkkkkkk quando o PRF manda a cadeirada é que todo mundo parte pra cima","2022-11-07 19:55:24","1349772743.0","2022-11-07","19:55:24"
"641310","policial folgado do caramba. já chega jogando a cadeira.","2022-11-07 19:55:37","165399610.0","2022-11-07","19:55:37"
"641312","foi assim que a dilma caiu, com essa coisa de policia ir pra cima, e a população se reovltando ainda mais, ai os caras pararam","2022-11-07 19:56:37","656263791.0","2022-11-07","19:56:37"
"641313","Verdade man, eles não irão intervir vão ficar aquartelados batendo continência para comunista Aldo Rebelo que o diga.","2022-11-07 19:56:57","5514236800.0","2022-11-07","19:56:57"
"641314","Por favor Lula, processe o Nando Moura","2022-11-07 19:59:05","1328638661.0","2022-11-07","19:59:05"
"641315","Por favor Nado, processe o Nando Moura","2022-11-07 20:00:32","165399610.0","2022-11-07","20:00:32"
"641316","Vai sobrar para o Nando Moura, hoje em dia ele está fora do Bolsonaro, mas a esquerda vai querer vingança por ele ter apoiado Bolsonaro em 2018","2022-11-07 20:01:06","5514236800.0","2022-11-07","20:01:06"
"641317","Mano essa porra tá subindo rápido demais","2022-11-07 20:01:14","1027503061.0","2022-11-07","20:01:14"
"641391","petista aqui ôh","2022-11-07 20:40:05","5750867496.0","2022-11-07","20:40:05"
"641319","kkkkkkkkkkkkkkkkkkkkkkkk","2022-11-07 20:01:22","2028813499.0","2022-11-07","20:01:22"
"641322","kkkkkkkkk","2022-11-07 20:01:44","1316957083.0","2022-11-07","20:01:44"
"641323","PFR joga spray de pimenta nos manifestantes em Rio do Sul, SC.

Aqui vemos um jeito bem comum da polícia agir.

Nesse caso, recomendados usar óculos que vendem os olhos e máscaras que tenham algum tipo de filtro.

Siga a #defesa e olhe mais pra cima do canal para saber as dicas que damos de Como se Vestir Corretamente numa Manifestação.","2022-11-07 20:02:00","1565431785.0","2022-11-07","20:02:00"
"641324","por enquanto está só no é amanhão, é amanhã, é amanhã uma hora galera perde a paciencia e pega pau e pedra e vai para cima","2022-11-07 20:02:25","159940265.0","2022-11-07","20:02:25"
"641325","Vou mandar no grupo da família cheio de petista kkkkkk","2022-11-07 20:03:05","1027503061.0","2022-11-07","20:03:05"
"641326","Manda aquela do pensamento positivo","2022-11-07 20:03:42","1328638661.0","2022-11-07","20:03:42"
"641327","Seria uma boa, mas vazo ruim não quebra é só vê a composição atual do supremo a maioria no bico do urubu e ninguém vai embora.","2022-11-07 20:03:48","5514236800.0","2022-11-07","20:03:48"
"641328","Kkkkkkk aí meu tio me expulsa do grupo kkkkkk","2022-11-07 20:03:57","1027503061.0","2022-11-07","20:03:57"
"641330","tbm achei uma boaa","2022-11-07 20:04:36","1328638661.0","2022-11-07","20:04:36"
"641331","se não tiver nada demais nesse relatório vai ser a maior brochada da história kkkkk","2022-11-07 20:05:01","1328638661.0","2022-11-07","20:05:01"
"641335","Verdade é capaz de dar mais munição ainda para esquerda agir.","2022-11-07 20:07:01","5514236800.0","2022-11-07","20:07:01"
"641361","tem que fazer uma conta no telegram com email","2022-11-07 20:25:40","177188922.0","2022-11-07","20:25:40"
"641336","""Limpeza do generalato"".

Isso é seríssimo. Um posicionamento voraz dos militares, agora, é uma questão de sobrevivência. Não se trata de possibilidade, mas de uma inexorável necessidade. Os malditos revolucionários destruirão as forças armadas, imediatamente, caso a aparente inércia perdure.","2022-11-07 20:07:42","168957060.0","2022-11-07","20:07:42"
"641337","fui conferir não tem mesmo, mas é apenas na listagem, escolher qlq um e mudar na url vai","2022-11-07 20:07:50","159940265.0","2022-11-07","20:07:50"
"641338","será que já comparam os policiais","2022-11-07 20:08:04","5117697194.0","2022-11-07","20:08:04"
"641339","foda-se, eu não. Mas eu conheço um que confia no TSE","2022-11-07 20:09:12","165399610.0","2022-11-07","20:09:12"
"641340","na vdd não... na tela mostra a 1231","2022-11-07 20:09:35","159940265.0","2022-11-07","20:09:35"
"641341","Quais são os moderadores aqui?","2022-11-07 20:10:29","165399610.0","2022-11-07","20:10:29"
"641370","Não","2022-11-07 20:30:42","634223840.0","2022-11-07","20:30:42"
"641342","Kkkkk no final, a polícia vai obdecer ao Estado.

Mas fiquei sabendo que PRF está obdecendo aos governadores. Realmente eles nao tem muito oq fazer, senão são punidos. Por isso a população tem que linchar esses caras","2022-11-07 20:12:10","1565431785.0","2022-11-07","20:12:10"
"641345","Os bananenses estão estocando dinheiro no colchão?","2022-11-07 20:16:11","1027503061.0","2022-11-07","20:16:11"
"641346","https://twitter.com/realpfigueiredo/status/1589707961458634752?cxt=HHwWgMDRtfy9448sAAAA","2022-11-07 20:17:15","168957060.0","2022-11-07","20:17:15"
"641347","FATOS E CASOS NOTICIADOS... CONFIRMEM POR SI MSM
D ABUSO DE CRIANÇAS.... PEDOFILÍA... ZOOFILÍA
 ENVOLVENDO  ESQUERDISTAS, PETISTA E PSOLISTA, POLÍTICOS
EXPLANEM..... ESPALHEM..... DIVULGUEM EM MAAAAAASSA SEM
PIEDADE....
SE ELES USAAREM MENTIRA TEMOS FATOS DE SOBRA SOBRE 
O COMPORTAMENTO E VÍCIOS DELES!!!!
https://www.e-farsas.com/casal-acusado-de-assassinar-brutalmente-o-pequeno-rhuan-e-militante-do-pt.html 
http://wwwriachueloemacao.blogspot.com/2019/06/petistas-lesbicas-assassinas-e-nao.html
https://divinews.com/2017/03/06/ex-candidato-a-vereador-em-divinopolis-pelo-psol-e-preso-por-estuprar-caes-zoofilia-e-porte-de-drogas/ 
https://ricmais.com.br/seguranca/candidato-a-vereador-do-pt-e-filmado-estuprando-cachorro-diz-policia/
https://veja.abril.com.br/brasil/ex-assessor-de-gleisi-e-condenado-por-estupro-de-menor/

https://www.facebook.com/watch/?v=341130904281215

￼

https://www.gazetadopovo.com.br/rodrigo-constantino/artigos/criancas-tocando-homem-nu-pela-arte-depois-esquerda-nao-entende-o-avanco-de-bolsonaro/

https://www.facebook.com/SomostodosJairMessiasBolsonaro/photos/a.433920920272866/841605936171027/?type=3

https://www.reddit.com/r/brasilivre/comments/le4bno/professora_acusa_bolsonaro_de_persegui%C3%A7%C3%A3o_%C3%A0/

LULA E A CABRITA
https://www.reddit.com/r/brasil/comments/6zkieg/lula_playboy_79_um_moleque_naquele_tempo_com_10/","2022-11-07 20:17:28","5457352565.0","2022-11-07","20:17:28"
"641371","A ideia da cripto moeda é descentralização","2022-11-07 20:31:11","634223840.0","2022-11-07","20:31:11"
"641350","Presente para os Eleitores de Lula ops: faltou a cervejinha","2022-11-07 20:21:22","5514236800.0","2022-11-07","20:21:22"
"641351","Sem querer ser pessimista mas... só mudou alguma coisa no Peru quando as coisas partiram pra ""agressão"". Colocando fogo nas coisas. 
Mesmo assim, ainda caiu nas mãos de um comuna.

Eu queria que tivesse chance de mudar algo... mas... a chance é pouca. Enquanto o braço armado do governo continuar a obedecer, não vai ter jeito.","2022-11-07 20:21:34","1430201979.0","2022-11-07","20:21:34"
"641352","🚨🚨IMPORTANTE 🚨🚨


Nossa postura define nosso objetivo. 

Tenhamos em mente: É  GUERRA 


Visitem nosso canal: @cristaospelapatria","2022-11-07 20:21:43","1526202408.0","2022-11-07","20:21:43"
"641354","Como falhar miseravelmente no easy kkkkk","2022-11-07 20:23:36","1316957083.0","2022-11-07","20:23:36"
"641355","É a voz dela sim.","2022-11-07 20:23:57","5399775460.0","2022-11-07","20:23:57"
"641356","Eu ainda acho que devemos ser pacíficos até um certo momento, que não deve estar tão longe assim","2022-11-07 20:24:02","844720961.0","2022-11-07","20:24:02"
"641357","PQP.....","2022-11-07 20:24:18","1316957083.0","2022-11-07","20:24:18"
"641358","São os embargos que começaram só em 2014","2022-11-07 20:24:29","1890023034.0","2022-11-07","20:24:29"
"641359","É mentira. Ele está super de boa na Bahia curtindo com a esposa.","2022-11-07 20:25:01","5399775460.0","2022-11-07","20:25:01"
"641360","Essa piada aqui não kkkkkkk","2022-11-07 20:25:38","1027503061.0","2022-11-07","20:25:38"
"641364","Belo Horizonte
Esquerdistas se passando por oficiais do exército e sendo presos pela PM.
Isso está acontecendo em outros lugares do Brasil.

Não confiem apenas em uniformes e conversa mole. Se chegar alguém nessas características, exijam identificação.","2022-11-07 20:27:10","165399610.0","2022-11-07","20:27:10"
"641367","This bot is unavailable due to copyright infringement.","2022-11-07 20:29:32","867304090.0","2022-11-07","20:29:32"
"641368","Ancap Troll -> Xandão está de olho em você.","2022-11-07 20:29:53","647744837.0","2022-11-07","20:29:53"
"641369","O FIM das CRIPTOMOEDAS: LBRY perde caso para SEC e TODAS as CRIPTO podem SER TRATADAS como AÇÕES
@ ANCAPSU","2022-11-07 20:30:22","1103049455.0","2022-11-07","20:30:22"
"641372","Compra um número de outro país","2022-11-07 20:31:13","1413417786.0","2022-11-07","20:31:13"
