"message_id","message","message_utc","from_id","date","time"
"688468","Desse jeito vou sentir saudades do faraó","2022-12-22 20:44:20","5702418153.0","2022-12-22","20:44:20"
"688469","Bitcoin fixes this","2022-12-22 20:44:53","5676856688.0","2022-12-22","20:44:53"
"688471","FAZ O L","2022-12-22 20:53:00","5062284989.0","2022-12-22","20:53:00"
"688472","Tá só começando a brincadeira","2022-12-22 20:55:10","1271925737.0","2022-12-22","20:55:10"
"688473","Esses desgraçados","2022-12-22 20:55:42","1941884372.0","2022-12-22","20:55:42"
"688476","É impossível que uma pessoa aceite isso","2022-12-22 20:56:22","1941884372.0","2022-12-22","20:56:22"
"688478","É inadmissível essa política de investimentos em outros países","2022-12-22 20:57:16","1941884372.0","2022-12-22","20:57:16"
"688479","É como se o Brasil fosse pais de primeiro mundo","2022-12-22 20:57:30","1941884372.0","2022-12-22","20:57:30"
"688480","A Alemanha ela ajuda alguém  ?","2022-12-22 20:57:37","1941884372.0","2022-12-22","20:57:37"
"688481","O alemão é socialista la entre eles, o resto ele quer é descer a pica","2022-12-22 20:58:04","1941884372.0","2022-12-22","20:58:04"
"688482","So a americana latina que vive nesse sonho infernal","2022-12-22 20:58:22","1941884372.0","2022-12-22","20:58:22"
"688483","O povo pra ser burro tmnc","2022-12-22 20:58:32","1941884372.0","2022-12-22","20:58:32"
"688487","Negócio é aeroporto","2022-12-22 21:01:25","1941884372.0","2022-12-22","21:01:25"
"688488","Esses proximos 2 anos, pq os cara ta botando pra fude na economia","2022-12-22 21:01:53","1941884372.0","2022-12-22","21:01:53"
"688489","É cara isso é uma tragédia","2022-12-22 21:07:39","1027503061.0","2022-12-22","21:07:39"
"688492","#app #info #infosec #dicas

Lista de Aplicativos Recomendados no F-Droid (Android)

(Atualizado em 22/12/2022)

Material Files - gerenciador de arquivos.
Mull - navegador web.
Telegram FOSS - cliente do Telegram com melhorias de segurança/desempenho.
croc - transferência de arquivos por Wi-Fi local.
Warpinator - transferência de arquivos por Wi-Fi local.
MuPDF - leitor de e-books.
KeePassDX - gerenciador de senhas.
KeyPass - gerenciador de senhas.
NewPipe - cliente/player de streaming para YouTube, SoundCloud, PeerTube e Bandicamp.
Neo Launcher - lançador customizável baseado no AOSP.
OpenBoard - teclado customizável baseado no AOSP.
Notally - bloco de notas customizável.
Screenshot Tile - atalho para capturas de tela a partir da barra de notificações ou botão inicial.

(Todos os apps são código aberto)

https://f-droid.org","2022-12-22 21:14:53","1068242909.0","2022-12-22","21:14:53"
"688493","Me parece que o socialismo cresce","2022-12-22 21:15:53","391457142.0","2022-12-22","21:15:53"
"688494","Daqui a 10 anos ele implode","2022-12-22 21:17:00","1027503061.0","2022-12-22","21:17:00"
"688495","Mais 72 h  patriota    vai ser 2026 ano de eleicao vao ta falando isso ainda kkk","2022-12-22 21:17:57","5243463294.0","2022-12-22","21:17:57"
"688496","https://fspbr.org","2022-12-22 21:18:35","1068242909.0","2022-12-22","21:18:35"
"688497","@Boltaxx olha isso.","2022-12-22 21:18:48","1068242909.0","2022-12-22","21:18:48"
"688498","hmm nao sei muito a respeito mas ja curto a ideia! mas como eles vao fazer pra n ter que pagar roubo pro Nine enfiar na cueca?","2022-12-22 21:20:45","391457142.0","2022-12-22","21:20:45"
"688499","Como os patriotas estão se mantendo a quase 2 meses na porta dos quartéis?","2022-12-22 21:21:00","1027503061.0","2022-12-22","21:21:00"
"688500","Vão eleger políticos libertários no município para reduzir impostos.","2022-12-22 21:21:13","1068242909.0","2022-12-22","21:21:13"
"688501","So playboy  ao inves de financiar 100 mil fuzil pra revolucao tao gastando dinheiro atoa","2022-12-22 21:22:29","5243463294.0","2022-12-22","21:22:29"
"688503","me pergunto o mesmo...da uma pena mano... o conservador brasileiro descobrindo que sua maior carta na manga sempre lembrada, mas nunca usada....na verdade nao passa de um pacote vazio de Derby","2022-12-22 21:22:36","391457142.0","2022-12-22","21:22:36"
"688504","ja foi mortal um dia, mas hj nem medo mais coloca, so a foto no verso do ministerio da saude mesmo kkkk","2022-12-22 21:23:27","391457142.0","2022-12-22","21:23:27"
"688505","@Boltaxx já que vão ter vários libertários no município, vai ser fácil fazer isso.","2022-12-22 21:23:43","1068242909.0","2022-12-22","21:23:43"
"688506","Será que uma REVOLUÇÃO NÃO VIOLENTA é a RESPOSTA que PRECISAMOS para SALVAR o BRASIL de LULA？
@ Visão Libertária","2022-12-22 21:24:04","1103049455.0","2022-12-22","21:24:04"
"688507","se o estado caisse sem retaliacao sim, mas....","2022-12-22 21:24:06","391457142.0","2022-12-22","21:24:06"
"688508","É que é apenas um município, poderia ser um município com uma cultura libertária. Eu não votaria mas ajudaria a divulgar as idéias para que as pessoas sonegacem e tal, sei lá.","2022-12-22 21:25:16","1068242909.0","2022-12-22","21:25:16"
"688509","Peter acha que todos seremos libertarios a-la carioca que ja nao leva porra nenhuma a serio ha anos e se contenta em pagar 2x por basicamente tudo. Voce nao eh livre do estado se voce continua bancando ele a forca","2022-12-22 21:25:21","391457142.0","2022-12-22","21:25:21"
"688510","Eu acho uma idéia interessante.","2022-12-22 21:26:00","1068242909.0","2022-12-22","21:26:00"
"688522","TV seria legal pq daria pra tocar desenhos e animes pra atrair a criancada. e BOOM, a gente metia uns Visao Libertaria nos comerciais","2022-12-22 21:30:17","391457142.0","2022-12-22","21:30:17"
"688511","Se é a resposta nao sabemos, mas que funcionou nos EUA e que esperar sentado sem fazer nada, com certeza nao é a resposta","2022-12-22 21:26:21","2028453520.0","2022-12-22","21:26:21"
"688512","Apesar que eu acho que o correto seria criar uma cidade do nada e resistir a força a agressão estatal.","2022-12-22 21:26:36","1068242909.0","2022-12-22","21:26:36"
"688513","parece legal. Eu curto muito isso! Mas ai vem a coisa....isso eh tudo o que o Estado nao quer, logo rapidamente alguma coisa dessa iniciativa constitui um crime em algum guardanapo sujo kkk teria q ser bem pensado, precisa de metodo pra contornar as barreiras do estado e do socialismo","2022-12-22 21:26:44","391457142.0","2022-12-22","21:26:44"
"688514","Pois é, por isso eu acho que o certo é resistir com armas mesmo e foda-se kk","2022-12-22 21:27:22","1068242909.0","2022-12-22","21:27:22"
"688515","o Antonio Conselheiro tentou isso cara, nem no sec XVII deu certo, imagina agora com arma automatica! eles tem muito mais forca que a gente","2022-12-22 21:27:24","391457142.0","2022-12-22","21:27:24"
"688523","Digo fazer armas de metal mesmo, até onde eu sei não é difícil. Claro que eu estou falando de achar pessoas inteligentes para criar armas nucleares entre outras armas mais complexas. Nós poderiamos juntar centenas de pessoas e fazer tanques de guerra.","2022-12-22 21:30:49","1068242909.0","2022-12-22","21:30:49"
"688516","Tudo que é fruto de fraude ou roubo como é o caso da nomeação do ladrão de nove dedos pelo togas vermelhas, não vai acabar bem. Um presidente ilegítimo odiado pelo povo com uma ficha corrida extensa, vai levar o país ao caos!","2022-12-22 21:27:27","1003073433.0","2022-12-22","21:27:27"
"688517","Nem cara, poderiamos criar nossas próprias armas. As armas estão descentralizadas, e se nós conseguissemos fazer uma bomba nuclear?","2022-12-22 21:28:15","1068242909.0","2022-12-22","21:28:15"
"688518","sobre o metodo. Eu ja pensei em criar uma estacao de TV pirata e tocar os videos do Peter na regiao onde eu moro. Se voce entende d eletronica, nao eh muito complicado e ja tem tudo na NET sobre como fazer uma emissora de TV","2022-12-22 21:28:21","391457142.0","2022-12-22","21:28:21"
"688519","imprimir arma ja foi procado que da, mas exige gente experiente nisso...arma militar eh um nivel que a gente esta muito atras pra alcancar, simplesmente pq os militares tem seculos fazendo somente isso da vida enquanto estavamos trabalhando pra comprar pao","2022-12-22 21:29:22","391457142.0","2022-12-22","21:29:22"
"688520","Muito legal. Já ouvi uma idéia parecida mas era para uma rádio.","2022-12-22 21:29:34","1068242909.0","2022-12-22","21:29:34"
"688521","arma atomica eh um desafio, ou paises como o Ira ja teriam uma","2022-12-22 21:29:44","391457142.0","2022-12-22","21:29:44"
"688524","tem uns canais no YT que ensinam eletronica pra criancas, eu meteria um monte desses programas no canal. Precisamos de tecnologia para nos defendermos","2022-12-22 21:30:51","391457142.0","2022-12-22","21:30:51"
"688525","eu entendo Renan. Mas pensa comigo. Uma arma que um engenheiro projetou e testou com o que ha de mais avancado para atirar com precisao, resistir a todo o tipo de condicao e ainda ser segura bagarai.....como tu pretende se equiparar a isso num quintal com uma solda de mecanico e um tutorial do Instructables? ahsudhua brinks. Pra se defender de ladrao da. Mas nao pra se defender do Exercito Brasileiro","2022-12-22 21:32:21","391457142.0","2022-12-22","21:32:21"
"688526","kk mas não é caro? Uma rádio já deve ser cara, imagina uma TV.","2022-12-22 21:32:26","1068242909.0","2022-12-22","21:32:26"
"688527","Muito legal.","2022-12-22 21:32:39","1068242909.0","2022-12-22","21:32:39"
"688528","caro pq? Tu monta os circuitinhos. liga no teu PC. Toca os videos que vc quiser e boom! tudo sendo streamado de forma descentralizada pra toda TV que tiver no canal 22 num raio de 2km","2022-12-22 21:33:16","391457142.0","2022-12-22","21:33:16"
"688529","Mas eu disse que precisamos estudar e achar pessoas que entendem dessas coisas.","2022-12-22 21:33:18","1068242909.0","2022-12-22","21:33:18"
"688530","se a gnte ainda combinar de ter mais gente fazendo igual, pensa nisso pelo brasola todo","2022-12-22 21:33:36","391457142.0","2022-12-22","21:33:36"
"688531","todo mundo se informando sobre libertarianismo, assistindo dragonball e aprendendo arduino! nuss q sonho","2022-12-22 21:33:57","391457142.0","2022-12-22","21:33:57"
"688532","Tu vai fazer?","2022-12-22 21:34:40","1068242909.0","2022-12-22","21:34:40"
"688533","Pois é, todo município ter no mínimo uma, ia ser brutal.","2022-12-22 21:34:59","1068242909.0","2022-12-22","21:34:59"
"688534","ia ser maneiro se fosse divulgado pra mais gente fazer","2022-12-22 21:35:13","391457142.0","2022-12-22","21:35:13"
"688535","xo catar aqui onde eu vi o projetinho de como montar a emissora","2022-12-22 21:35:23","391457142.0","2022-12-22","21:35:23"
"688536","KKKKKKKKKKKKKKKKKKKKKKKKKKKKKKKKKKKKKKKKKKKKKKKKKKKKKKKKKKKKKKKKKKKKKKKKKKKKKKKKKKK é uma utopia alcançavel kkkkkkkkkk","2022-12-22 21:35:53","1068242909.0","2022-12-22","21:35:53"
"688537","https://www.instructables.com/How-to-Make-a-Simple-but-effective-tv-transmitter-/","2022-12-22 21:36:20","391457142.0","2022-12-22","21:36:20"
"688538","tipo eh super dificil de pegarem voce transmitindo TV, pq demora pra saber de onde vem o sinal","2022-12-22 21:36:42","391457142.0","2022-12-22","21:36:42"
"688539","se tiver outras pessoas fazendo, fica impossivel pro governo impedir","2022-12-22 21:36:54","391457142.0","2022-12-22","21:36:54"
"688540","tipo loramesh.","2022-12-22 21:37:13","1068242909.0","2022-12-22","21:37:13"
"688542","mais ou menos. nao precisaria ser um mesmo canal pirata, se cada pessoa transmitisse videos como quisesse, as ideias seriam mais difundidas pelo interior pobre do pais","2022-12-22 21:37:56","391457142.0","2022-12-22","21:37:56"
"688543","fazer repetidores tb seria uma ideia, ai teria uma rede tipo loramesh pro canal pirata hehehe","2022-12-22 21:38:31","391457142.0","2022-12-22","21:38:31"
"688545","Na verdade, o primórdio do que conhecemos hj como bombeiros, teve início na Roma antiga","2022-12-22 21:40:07","1319326859.0","2022-12-22","21:40:07"
"688546","Poderia ter um canal na internet mesmo e os outros apenas retransmitir.","2022-12-22 21:40:09","1068242909.0","2022-12-22","21:40:09"
"688547","eh uma boa ideia!","2022-12-22 21:40:31","391457142.0","2022-12-22","21:40:31"
"688548","Cada um focaria em apenas uma coisa (se quisesse fazer os dois, também poderia)","2022-12-22 21:41:01","1068242909.0","2022-12-22","21:41:01"
"688549","isso. a parte de uma playlist do YT eh facil. O maior trabalho eh em montar e instalar os transmissores por ai","2022-12-22 21:41:38","391457142.0","2022-12-22","21:41:38"
"688572","eu colocaria uma programação variada","2022-12-22 21:45:24","1328638661.0","2022-12-22","21:45:24"
"688550","eles tem que ficar escondidos, entao geralmente teria que ser num telhado de predios resitenciais, sem ficar a vista","2022-12-22 21:42:04","391457142.0","2022-12-22","21:42:04"
"688551","antena eh facil de esconder, eh so um fio","2022-12-22 21:42:18","391457142.0","2022-12-22","21:42:18"
"688552","Eu desobedeceria no fodasse mesmo","2022-12-22 21:42:26","1068242909.0","2022-12-22","21:42:26"
"688553","Quanto custa fazer uma tv?","2022-12-22 21:42:44","1068242909.0","2022-12-22","21:42:44"
"688554","mas se pegarem, a policia ta a batida la e remove o transmissor saca?","2022-12-22 21:42:57","391457142.0","2022-12-22","21:42:57"
"688555","interessante isso","2022-12-22 21:42:59","1328638661.0","2022-12-22","21:42:59"
"688556","funciona mesmo?","2022-12-22 21:43:03","1328638661.0","2022-12-22","21:43:03"
"688557","ja ouvi falar que no nordeste tinha umas tvs piratas","2022-12-22 21:43:19","1328638661.0","2022-12-22","21:43:19"
"688558","funciona sim! e se esse tutorial n tiver bom, tu acha melhores por ai. Procurem gente!","2022-12-22 21:43:23","391457142.0","2022-12-22","21:43:23"
"688559","https://revistaoeste.com/politica/quase-38-mil-presos-serao-soltos-nas-ruas-de-sao-paulo/ ainda bem que não sou paulista","2022-12-22 21:43:32","1027503061.0","2022-12-22","21:43:32"
"688560","eu fiz uma em Salvador quando morei la anos atras","2022-12-22 21:43:36","391457142.0","2022-12-22","21:43:36"
"688561","Eu poderia ser um nomade.","2022-12-22 21:43:36","1068242909.0","2022-12-22","21:43:36"
"688562","Brutal. como foi?","2022-12-22 21:43:51","1068242909.0","2022-12-22","21:43:51"
"688563","seria daora colocar um canal passando filmes e séries o dia todo e no fim do dia botava um noticiario anti sistema kkkkkk","2022-12-22 21:43:57","1328638661.0","2022-12-22","21:43:57"
"688564","como foi? era daora?","2022-12-22 21:44:12","1328638661.0","2022-12-22","21:44:12"
"688565","eu coloquei o que eu achava legal e n passava mais na TV, anime, uns programas educativos pra criancada. O Mundo de Beakman eh supe divertido e educativo","2022-12-22 21:44:19","391457142.0","2022-12-22","21:44:19"
"688566","Eu falaria mal do estado 24/7","2022-12-22 21:44:30","1068242909.0","2022-12-22","21:44:30"
"688567","Nunca deu problema? Tinha audiencia?","2022-12-22 21:44:50","1068242909.0","2022-12-22","21:44:50"
"688568","colocava uns clips de metal kkk","2022-12-22 21:44:57","391457142.0","2022-12-22","21:44:57"
"688569","Bolsonaro falhou em fazer o que deveria ser feito. Agora esqueçam, todos vamos beijar o traseiro do nine ""dentro das 4 linhas"", satisfeitos ou não.","2022-12-22 21:45:03","1319326859.0","2022-12-22","21:45:03"
"688570","mas tem que ter o circo pra atrair o povo","2022-12-22 21:45:10","1328638661.0","2022-12-22","21:45:10"
"688571","esse eh o ponto. Voce nao sabe quem assiste ou se tem gente assistindo","2022-12-22 21:45:12","391457142.0","2022-12-22","21:45:12"
"688573","e como nunca coloquei nada que me identificava, nunca tive um canal pra receber feedback da audiencia se eh que teve alguma kkkkk","2022-12-22 21:45:49","391457142.0","2022-12-22","21:45:49"
"688574","so de fazer uma TV pirata ja constitui crime, tocar programas protegidos por direitos autorais, ja foderia minha vida tipo pra sempre kkkk","2022-12-22 21:46:19","391457142.0","2022-12-22","21:46:19"
"688575","Eu faria o que é bom e não o que dá mais audiencia. Colocaria só músicas boas como Raul Seixas, Cazuza, Ultraja a Rigor, e os caralhos.","2022-12-22 21:46:24","1068242909.0","2022-12-22","21:46:24"
"688576","entao fiz tudo na entoca","2022-12-22 21:46:30","391457142.0","2022-12-22","21:46:30"
"688577","mas não tem como rastrear a origem do sinal?","2022-12-22 21:46:51","1328638661.0","2022-12-22","21:46:51"
"688578","Podia fazer um email anonimo.","2022-12-22 21:46:53","1068242909.0","2022-12-22","21:46:53"
"688579","eh bem dificil","2022-12-22 21:47:09","391457142.0","2022-12-22","21:47:09"
"688580","pq eles precisam triangular pra achar de onde vem o sinal","2022-12-22 21:47:18","391457142.0","2022-12-22","21:47:18"
"688581","kkkkkkkkkkkkkkkkkkkkkkkkkkkkkkkkkkkkkkkkkkkkkkkkkkkkk melhor ato de desobediencia civil que ouvi esse mês.","2022-12-22 21:47:23","1068242909.0","2022-12-22","21:47:23"
"688582","voce tem que encomodar muuuuito o estado pra mandarem algum tecnico pra ir la te rastrear, a PM eh burra demais pra conseguir fazer isso","2022-12-22 21:47:44","391457142.0","2022-12-22","21:47:44"
"688583","Ah, isso se for fazer uma rádio Augusto Vieira","2022-12-22 21:48:05","1068242909.0","2022-12-22","21:48:05"
"688584","se eu tivesse mais tempo e grana ainda meteria uns repetidores nos predios perto que despistaria mais ainda e ampliaria o raio de alcance","2022-12-22 21:48:19","391457142.0","2022-12-22","21:48:19"
"688585","@Boltaxx quanto custa uma tv?","2022-12-22 21:48:51","1068242909.0","2022-12-22","21:48:51"
"688593","se vc comecar com algo que pega na esquina da tua casa ja eh legal pacas","2022-12-22 21:51:33","391457142.0","2022-12-22","21:51:33"
"688586","cara isso tudo depende muito! voce tem que olhar a lista de materiais que vai precisar e ir na rua da tua cidade que vende componentes eletronicos","2022-12-22 21:49:27","391457142.0","2022-12-22","21:49:27"
"688587","em SP e RJ tem umas avenidas so disso que sao sucesso de opcoes! da ate pra fazer umas mais potentes","2022-12-22 21:49:50","391457142.0","2022-12-22","21:49:50"
"688588","em Salvador tem a rua la perto do pelourinho que vendia na epoca oq eu precisava","2022-12-22 21:50:09","391457142.0","2022-12-22","21:50:09"
"688589","uma vez eu vi um documentario sobre videogames em cuba e os caras literalmente fizeram uma intranet que se estendia por varios bairros em havana","2022-12-22 21:50:24","1328638661.0","2022-12-22","21:50:24"
"688590","achei mto daora","2022-12-22 21:50:33","1328638661.0","2022-12-22","21:50:33"
"688591","eu sugiro comecar pesquisando melhor como fazer um trasmissor de Radio ou TV se vc tiver interesse","2022-12-22 21:50:50","391457142.0","2022-12-22","21:50:50"
"688592","tendo mais info sobre isso vc pode levantar a lista de materiais, comprar, montar e testar!","2022-12-22 21:51:19","391457142.0","2022-12-22","21:51:19"
"688594","mas + ou -, qual o custo?","2022-12-22 21:51:38","1068242909.0","2022-12-22","21:51:38"
"688595","faz 10 anos que montei a minha mano, na epoca torrei uns 200tao. Hoje os precos mudaram muito em um monte de coisa. Eu comprava arduino da china de 5 reais a unidade, hoje ta 50!","2022-12-22 21:52:23","391457142.0","2022-12-22","21:52:23"
"688596","foi um projetinho de ferias que fiz pra me animar kkkk","2022-12-22 21:52:45","391457142.0","2022-12-22","21:52:45"
"688597","O jogo só acaba quando termina.","2022-12-22 21:52:49","934778695.0","2022-12-22","21:52:49"
"688598","então deve ser uns 1000 reais a tv?","2022-12-22 21:53:21","1068242909.0","2022-12-22","21:53:21"
"688599","se vc mora em SP tem a Santa Efigenia","2022-12-22 21:53:34","391457142.0","2022-12-22","21:53:34"
"688600","nem faco ideia bro. Acho que seria uma ideia libertaria foda, mas eu to por fora mesmo disso faz um tempo. Nem moro mais em Salvador kkkk","2022-12-22 21:54:18","391457142.0","2022-12-22","21:54:18"
"688601","Acho que vou fazer uma rádio.","2022-12-22 21:56:27","1068242909.0","2022-12-22","21:56:27"
"688602","Dia 22 de dezembro:
Ou seja, está eternamente bloqueada. Não há decisão estatal temporária que não seja permanente.","2022-12-22 21:57:51","2101780287.0","2022-12-22","21:57:51"
"688603","boa mano!! eh mais simples pra fazer teste!","2022-12-22 22:00:36","391457142.0","2022-12-22","22:00:36"
"688604","e voce ainda pode tocar o audio dos videos do Visao Libertaria que ensinam valores libertarios","2022-12-22 22:01:00","391457142.0","2022-12-22","22:01:00"
"688605","pra te dar um apoio inicial na ideia:

https://www.youtube.com/watch?v=cvae16xc604&ab_channel=ValdemarGomes","2022-12-22 22:02:01","391457142.0","2022-12-22","22:02:01"
"688606","Dava pra criar um grupo no telegram, ai a gente cria varias estações pelo brasil e combina os conteudos. Outro conteúdo bom pra transmitir são os videos do olavo de carvalho","2022-12-22 22:03:53","1682320746.0","2022-12-22","22:03:53"
"688607","maneiro tb. Pessoalmente n sou o maior fa do Olavo, mas ele fez varias previsoes corretas sobre como a revolucao socialista viria como uma revolucao cultural primeiro","2022-12-22 22:04:48","391457142.0","2022-12-22","22:04:48"
"688610","Olavo é uma voz forte que tem facilidade para compreensão e gerar interesse no brasileiro medio","2022-12-22 22:05:50","1682320746.0","2022-12-22","22:05:50"
"688611","Booa","2022-12-22 22:06:00","1682320746.0","2022-12-22","22:06:00"
"688612","vou falar mal do Estado 24/7","2022-12-22 22:06:07","1068242909.0","2022-12-22","22:06:07"
"688613","FASSA ISSO AGORA","2022-12-22 22:06:36","1068242909.0","2022-12-22","22:06:36"
"688614","Boa Renan! Juntos venceremos pelo agorismo e pela iniciativa descentralizada!","2022-12-22 22:06:38","391457142.0","2022-12-22","22:06:38"
"688615","Enquanto eu não fosse preso, iria aumentar ainda mais a toxidade da minha rádio kkkkkkkkkk","2022-12-22 22:08:18","1068242909.0","2022-12-22","22:08:18"
"688624","Eu seria extremista mesmo, tentaria ser preso.","2022-12-22 22:11:42","1068242909.0","2022-12-22","22:11:42"
"688616","Kkkkkkkkkkkkkkkk Peter devia fazer um stand up","2022-12-22 22:09:31","1410863491.0","2022-12-22","22:09:31"
"688617","Essas manchetes são de dar risada","2022-12-22 22:09:42","1410863491.0","2022-12-22","22:09:42"
"688619","MÉDICOS chineses FAZEM novamente PREVISÕES CATASTRÓFICAS para CASOS de COVID na CHINA
@ Opinion Free Market","2022-12-22 22:10:38","1103049455.0","2022-12-22","22:10:38"
"688620","Brincadeiras a parte, alguém tinha que botar uma ricina no copo d'água do Alexandre","2022-12-22 22:10:39","1410863491.0","2022-12-22","22:10:39"
"688621","Artistas so são relevantes na sociedade com a perda de valor do dinheiro","2022-12-22 22:10:48","1941884372.0","2022-12-22","22:10:48"
"688622","toxicidade eh uma palavra ruim, Renan. Eu sei que voce ta de brincadeira.

Mas temos que parar de usar os temos que a esquerda chama a gente. Somos pessoas boas e queremos o bem de todos pelo libertarianismo. 

Toxica eh a teoria marxista, o Gramscianismo, e todo o lixo lacrador desses artistas ridiculos e politicos.

Se usarmos os termos ruins que eles chamam a gente, eles continuam no controle da narrativa. Vamos sempre deixar claro que eles sao os toxicos e manipuladores e querem SOCIALISMO sem admitir isso","2022-12-22 22:10:54","391457142.0","2022-12-22","22:10:54"
"688626","O primeiro objetivo da rádio seria ser preso.","2022-12-22 22:11:52","1068242909.0","2022-12-22","22:11:52"
"688627","tava na hora...comecou o antissemita. Coloquem seus chapeus de aluminio e vamos escutar um moleque que nunca viu um judeu na vida repetir um monte de terraplanismo que ele viu na internet","2022-12-22 22:12:59","391457142.0","2022-12-22","22:12:59"
"688629","voce pode ser um libertario extermista cara","2022-12-22 22:13:39","391457142.0","2022-12-22","22:13:39"
"688630","ainda assim nao teria nada de toxico nisso saca?","2022-12-22 22:13:51","391457142.0","2022-12-22","22:13:51"
"688639","kkkk eh engracado, mas isso eh tudo o que a esquerda quer! libertarios sao o oposto de fascistas. Na verdade o Socialismo e o Fascismo sao ambos coletivistas e pregam o estado maximo. Se brincarmos com os termos malignos que os sossas chamam a gente, eles continuam no controle da narrativa!","2022-12-22 22:16:33","391457142.0","2022-12-22","22:16:33"
"688632","Respeito mais os chapéus de aluminio que os anti-semitas.","2022-12-22 22:14:20","1068242909.0","2022-12-22","22:14:20"
"688633","sim, mas eu falaria ""sou fascista mesmo, e daí? venham me pegar parasitas"" kkkkkkkkkkkkkkkkkkkkkkkkkkkkkk","2022-12-22 22:14:52","1068242909.0","2022-12-22","22:14:52"
"688634","""num cenário de loquidaum e vacina$$$ só morrerão 537632736 bilhões de pessoas""","2022-12-22 22:15:15","167293888.0","2022-12-22","22:15:15"
"688637","mas eu também sou pró judeus, venha me pegar neonazi kkkkkkkkkkk","2022-12-22 22:16:05","1068242909.0","2022-12-22","22:16:05"
"688640","Tudo é verdade se trocar a palavra ""judeu"" por ""globalistas""","2022-12-22 22:16:51","1068242909.0","2022-12-22","22:16:51"
"688641","""isso! confiem em mim. esta tudo provado!"" kkkkk coxo bagarai esse papo","2022-12-22 22:17:04","391457142.0","2022-12-22","22:17:04"
"688642","aqui na cidade tem um terraplanista q todo dia levanta placas....ele tb diz q a culpa eh dos judeus hausdhausdhausdhas","2022-12-22 22:17:36","391457142.0","2022-12-22","22:17:36"
"688643","Acho que acontece o oposto. Eles trocam o significado das palavras, fascismo hoje em dia significa outra coisa, e para a definição atual, nós somos mesmo fascistas.","2022-12-22 22:17:45","1068242909.0","2022-12-22","22:17:45"
"688644","Só por que existem judeus sionistas, que são excessão, não quer dizer que todos os judeus são sionistas.

Isso é lógica básica Conde.","2022-12-22 22:17:55","5702418153.0","2022-12-22","22:17:55"
"688647","se voce usar esses novos significados que a esquerda inventou, voce estara no jogo deles. Nesse jogo deles eles sempre ganham ate quando eles perdem","2022-12-22 22:18:40","391457142.0","2022-12-22","22:18:40"
