"message_id","message","message_utc","from_id","date","time"
"688168","Eu acho até que toda a merda do século XX começou com uma idéia como: pq o governo não usa sua força pra resolver isso?","2022-12-22 03:29:38","846274888.0","2022-12-22","03:29:38"
"688169","Desisto de lutar pela liberdade do Bostil. Minha parte eu já fiz. Quero que o Bostil e sua população bitolada passe uma fome interminável, infinita e violenta e seja torturada com requintes de crueldade para aprender a lição, se arrepender de seus pecados e defender a liberdade com unhas e dentes!!!","2022-12-22 03:30:37","1878483689.0","2022-12-22","03:30:37"
"688170","Ministério ou secretaria para combater discurso de ódio e fake news na internet. Para combater extrema direita, ancaps, e coisas do tipo. Pode apostar.","2022-12-22 03:35:27","5046152833.0","2022-12-22","03:35:27"
"688171","Por mim podem até por 100% de imposto. Parar de financiar o leviatã significa não usar o real.","2022-12-22 03:35:59","846274888.0","2022-12-22","03:35:59"
"688187","Bolsonaro é tipo aquela mulher que apanha do marido, ai quando os vizinhos denunciam, ela vai lá e retira a queixa.","2022-12-22 10:44:59","111225015.0","2022-12-22","10:44:59"
"688172","Como acordar a manada","2022-12-22 04:11:31","904722206.0","2022-12-22","04:11:31"
"688176","Não acaba a lista de filho da puta não? Caralho tem petista infiltrado em tudo","2022-12-22 04:29:00","1268004268.0","2022-12-22","04:29:00"
"688177","Os governos autoritários geralmente procuram desarmar a população em geral para manter o controle e suprimir a dissidência.  Desarmar a população torna mais difícil para os indivíduos resistir ou derrubar o governo e permite que o governo exerça maior controle sobre a população.  Ao mesmo tempo, governos autoritários podem optar por permitir que o crime organizado seja armado para usá-lo como uma ferramenta para manter o controle e exercer influência.  Ao armar e apoiar grupos criminosos, o governo pode usá-los para intimidar e coagir a população, ou realizar tarefas às quais o governo não quer se associar.  Dessa forma, governos autoritários usam a ameaça de violência para manter seu poder e controle sobre a população, ao mesmo tempo em que usam grupos armados para cumprir suas ordens.","2022-12-22 04:32:57","124982804.0","2022-12-22","04:32:57"
"688178","Eu acho que tudo isso e pra gerar guerra, redução da taxa populacional, pois o COVID foi ineficiente.
Então vamos de boa e velha guerra. Essa mata mais rápido.","2022-12-22 04:36:49","2075058690.0","2022-12-22","04:36:49"
"688179","Sujestão vai treinando atirar, que o caldo vai entornar","2022-12-22 04:38:24","2075058690.0","2022-12-22","04:38:24"
"688181","O ministro da defesa está sendo chantageado","2022-12-22 09:06:45","1914253750.0","2022-12-22","09:06:45"
"688182","🧨🧨🧨🧨🧨 Super Urgente: Postem AGORA em todas as Redes Sociais e Grupos. 
SENADO tentando aprovar agora na calada da noite LEI que tira os poderes das Forças Armadas!!!
 ATENÇÃO! NÃO ASSINEM NADA. NÃO ENTREM EM SITE ALGUM. OS VERMELHOS ESTÃO DESESPERADOS E ESTÃO PLANTANDO ARMADILHAS.

Tem um FORMULÁRIO GOOGLE rodando,  falando que é pra apoiar a CARTA DE ADESÃO DOS MILITARES. *NÃO PREENCHAM!* 

Esse formulário pode ser modificado após preenchido! 

*ISSO É UMA ARMADILHA!*

*REPASSEM COM URGÊNCIA!!!*","2022-12-22 09:26:02","1914253750.0","2022-12-22","09:26:02"
"688183","A quadrilha do nine ta vindo firme","2022-12-22 09:49:54","1941884372.0","2022-12-22","09:49:54"
"688184","Perdemo","2022-12-22 09:51:22","1941884372.0","2022-12-22","09:51:22"
"688185","Se o filho do ministro está sendo chantageado é porque alguma coisa errada ele fez","2022-12-22 10:00:02","631941985.0","2022-12-22","10:00:02"
"688186","Ministério dos Sistemas Sistêmicos de Institucionalização","2022-12-22 10:33:13","51465038.0","2022-12-22","10:33:13"
"688188","village people estimulando violência?","2022-12-22 10:57:40","363433022.0","2022-12-22","10:57:40"
"688190","sobre homossexualismo nada","2022-12-22 10:59:48","363433022.0","2022-12-22","10:59:48"
"688192","Olha só gente, a impressora é só o começo.","2022-12-22 11:20:01","5189011877.0","2022-12-22","11:20:01"
"688193","O ladrão nem subiu a rampa e sua quadrilha já destruiu e estuprou o bostil, se subir de fato…já era, cabou-se tudo!","2022-12-22 11:53:52","5413659844.0","2022-12-22","11:53:52"
"688194","E a picanha?","2022-12-22 11:55:52","1027503061.0","2022-12-22","11:55:52"
"688195","As pernas fininhas kkkkk","2022-12-22 11:57:30","121406592.0","2022-12-22","11:57:30"
"688196","Homem velho cheio de frescura","2022-12-22 11:57:57","121406592.0","2022-12-22","11:57:57"
"688197","Aqui a picanha 🐶","2022-12-22 11:58:37","1243660968.0","2022-12-22","11:58:37"
"688198","Cadê o arpão pra caçar essa baleia de pernas finas?","2022-12-22 11:58:39","121406592.0","2022-12-22","11:58:39"
"688199","kkkkk","2022-12-22 11:58:41","121406592.0","2022-12-22","11:58:41"
"688200","Globo é organização criminosa","2022-12-22 12:28:59","887347636.0","2022-12-22","12:28:59"
"688201","A partir do momento em que viraram parceiros nas mentiras do STF e TSE, perderam o status de impressa pra virarem cumplices.","2022-12-22 12:30:25","887347636.0","2022-12-22","12:30:25"
"688202","Sem contar os crimes contra a humanidade cometidos durante a fraudemia, aterorizando o gado pra ceder suas liberdades","2022-12-22 12:32:19","887347636.0","2022-12-22","12:32:19"
"688203","EUROPA cria GENOCÍDIO de POBRES ao impor a TAXA de CARBONO para PAÍSES fora da COMUNIDADE EUROPÉIA
@ ANCAPSU","2022-12-22 12:34:07","1103049455.0","2022-12-22","12:34:07"
"688204","Foi só o Nine ser ""eleito"" que acabaram as contagens de mortos de Covid nos jornais da Grobo","2022-12-22 12:34:23","887347636.0","2022-12-22","12:34:23"
"688205","Igual lá nos EUA","2022-12-22 12:34:31","887347636.0","2022-12-22","12:34:31"
"688206","O froxonaro não da o gorpe logo","2022-12-22 12:41:48","1941884372.0","2022-12-22","12:41:48"
"688207","Bolsonaro ja se preparado pra trabalhar no eua","2022-12-22 12:43:59","1941884372.0","2022-12-22","12:43:59"
"688208","Argentina está considerando colocar Messi em suas notas.

Mal ganhou e já está sendo desvalorizado 😓
@RandomAnarchy","2022-12-22 12:44:52","193196103.0","2022-12-22","12:44:52"
"688209","Será q teve roubo mesmo, ou o Bolso estava cercado de fdp?","2022-12-22 12:53:31","1738185494.0","2022-12-22","12:53:31"
"688211","Agora é hora de não sairmos da frente dos Quartéis. 

Peguem suas famílias inteiras e mostrem a sua indignação!

Não sejam Judas e não traiam a Nação nem seus valores. Sua vida, liberdade e seus negócios ruirão se você não fizer nada. Ficar no celular não resolve. Natal é família e por ela que você deve lutar. Não é pelo projeto pessoal de uma ceia familiar neste ano, mas pela liberdade de ter uma ceia nos próximos anos. Quem decidirá pelos seus netos agora é você! Eles te cobrarão pela sua falta de coragem e pelo seu desamor para com eles. Eles não podem protestar, mas você pode ir lá e gritar por socorro no lugar deles! Pense nisto e venha para o quartel!
Nelma Barros Braga Perovani 
#OBrasilfoiroubado
#Brazilwasstolen

CANAL PRIMEIRO PELOTÃO
https://t.me/canalprimeiropelotao","2022-12-22 12:59:51","1682320746.0","2022-12-22","12:59:51"
"688212","Um pouco dos dois, o mais triste é saber que o ladrão teve muito.voto perdeu mas, teve uns 50milhões de voto","2022-12-22 13:00:12","881987643.0","2022-12-22","13:00:12"
"688213","ESG é agenda pra matar pobre","2022-12-22 13:07:08","1730291663.0","2022-12-22","13:07:08"
"688214","Anotem: Lula vai copiar isso para proteger a indústria nacional, querem ver?","2022-12-22 13:09:24","694269070.0","2022-12-22","13:09:24"
"688216","Mais um xadrez 5d do Bolsonaro... na cabeça dele, isso tira o poder de barganha do PT com a Globo mas só fez o povo tomar mais nojo dele!","2022-12-22 13:18:41","1556218841.0","2022-12-22","13:18:41"
"688217","Tarcísio de ""direita"" chama petistas pro seu governo, já o Mule chuta fora qualquer um que falou mal dele","2022-12-22 13:23:14","887347636.0","2022-12-22","13:23:14"
"688218","Sim, teve muito fazedor de L que apertou 13 na urna de verdade, esses mereciam uma surra","2022-12-22 13:24:04","887347636.0","2022-12-22","13:24:04"
"688230","Conversa pra boi dormir","2022-12-22 13:45:54","824010709.0","2022-12-22","13:45:54"
"688219","Eu quero ver não. 😅","2022-12-22 13:26:29","5153009130.0","2022-12-22","13:26:29"
"688220","https://www.in.gov.br/en/web/dou/-/portaria-normativa-agu-n-74-de-16-de-dezembro-de-2022-452048783","2022-12-22 13:30:12","881987643.0","2022-12-22","13:30:12"
"688222","Ranking global dos maiores investidores em 2021:                1- Estados Unidos lideraram - US$ 367 bilhões, ante US$ 151 bilhões em 2021.                                                                2-  China (US$ 181 bilhões), Hong Kong (US$ 141 bilhões),                                                                                  3 - Singapura (US$ 99 bilhões)                                            4 - Canadá (US$ 60 bilhões).                                                                                                                                  Ranking global dos maiores importadores em 2021:          1 - China  31,28% de participação - US$ 87,696 bilhões 
2 - Estados Unidos 11,09% de participação - US$ 31,104 bilhões  
4 - Argentina 4,24% de participação - US$ 11,881 bilhões 
*5 - Holanda 3,32% de participação - US$ 9,304 bilhões 5 - Chile 2,50% de participação - US$ 6,998 bilhões                         LIGA O ""FODA-SE"" (COMO DIRIA O JÁ SAUDOSO PAULO GUEDES) PARA A EUROPA","2022-12-22 13:33:52","1528480941.0","2022-12-22","13:33:52"
"688223","isso ta la msm?","2022-12-22 13:34:17","2113866378.0","2022-12-22","13:34:17"
"688224","vc conferiu?","2022-12-22 13:34:24","2113866378.0","2022-12-22","13:34:24"
"688231","Tem bastante boi ancap lol","2022-12-22 13:59:37","5676856688.0","2022-12-22","13:59:37"
"688225","q porha é essa","2022-12-22 13:36:52","1593822165.0","2022-12-22","13:36:52"
"688226","Olha do eu conferi mas é muita questão técnica de judiciário que não é minha praia, mas acredito que seja mais ou menos isso dai","2022-12-22 13:37:01","881987643.0","2022-12-22","13:37:01"
"688228","Essas políticas europeias vão criar inúmeras dificuldades para os países mais pobres exportarem seus produtos para a Europa, e isso só vai acelerar o processo de divisão que está ocorrendo entre o mundo ocidental (EUA, Europa e Austrália), do resto do mundo, isso cai fortalecer mais os BRICS e levar a América Latina, África e Ásia a aumentarem seus laços econômicos com a China, Rússia e Índia.","2022-12-22 13:38:53","1403337079.0","2022-12-22","13:38:53"
"688229","Esse ""urgente"" ja encheu  o saco","2022-12-22 13:42:53","5243463294.0","2022-12-22","13:42:53"
"688233","Interpreta pra continuar jogando dentro das 4 linhas kkkkk","2022-12-22 14:01:15","5714609162.0","2022-12-22","14:01:15"
"688234","Mais ou menos isso RSS","2022-12-22 14:11:04","881987643.0","2022-12-22","14:11:04"
"688235","O jornal esquerdista está preocupado.","2022-12-22 14:12:15","881987643.0","2022-12-22","14:12:15"
"688236","Como diria Ron Swanson: Ah o velho e fétido cheiro de socialismo europeu!","2022-12-22 14:15:21","835705439.0","2022-12-22","14:15:21"
"688237","ZELENSKY faz DISCURSO HISTÓRICO no CONGRESSO AMERICANO e GARANTE 45 BILHÕES em APOIO e ARMAS em 2023
@ ANCAPSU","2022-12-22 14:16:15","1103049455.0","2022-12-22","14:16:15"
"688238","Gordo fdp, se ama tanto o “zulinsky” pq não vai para a Ucrânia se sacrificar por ele?
Brasil em vias de ser destruído e ele com papo de ucrania, vai ter impeachment e bla bla bla","2022-12-22 14:17:30","5413659844.0","2022-12-22","14:17:30"
"688252","Não estou desmerecendo, mas a realidade infelizmente foi essa","2022-12-22 14:26:36","887347636.0","2022-12-22","14:26:36"
"688241","Zelensky ai fazendo na prática a mesma coisa que o putin faz, perseguindo e calando opositor, mas tudo bem pq ele é do bem né
Foda, não dá pra kevar a sério esses vídeos de Ucrânia e Rússia do peter","2022-12-22 14:18:45","983855561.0","2022-12-22","14:18:45"
"688242","Não é montagem.","2022-12-22 14:19:05","5727114148.0","2022-12-22","14:19:05"
"688243","Kkkkk 
não é ser russete, temos problemas maiores que o discurso de um globalista! Vocês chamando os outros de “russete” e bloqueando do grupo fazem tal como o Putin.","2022-12-22 14:19:24","5413659844.0","2022-12-22","14:19:24"
"688245","Histórico são os protestos brasileiros por mais de 50 dias, com milhões nas ruas contra o comunismo e corrupção.","2022-12-22 14:21:01","5134709402.0","2022-12-22","14:21:01"
"688246","Que não impediram nem uma coisa nem outra","2022-12-22 14:22:26","887347636.0","2022-12-22","14:22:26"
"688247","Preocupado não cara, o Peter não sabe de porra nenhuma. Toda análise que ele faz, acontece o contrário!!","2022-12-22 14:22:58","500679339.0","2022-12-22","14:22:58"
"688248","Não acabou ainda. Da mesma forma a guerra da Ucrânia. É de lascar quem desmerece a maior manifestação da história contra o comunismo.","2022-12-22 14:23:00","5134709402.0","2022-12-22","14:23:00"
"688250","No Maravilhoso Mundo do Peter todo dia a Ucrânia mata um milhão de russos, bitcoin vai disparar e vamos tirar o PT do poder usando a democracia... ele só errou a previsão q Bolsonaro ganhou do Lula fácil!","2022-12-22 14:25:27","1556218841.0","2022-12-22","14:25:27"
"688251","Qual o exame para medir?","2022-12-22 14:25:36","1682320746.0","2022-12-22","14:25:36"
"688275","https://www.bbc.com/portuguese/geral-64059355


Tem algum neste grupo? Hum...","2022-12-22 15:06:24","1728280924.0","2022-12-22","15:06:24"
"688253","Qualquer coisa que esse pau mandado do EUA fazer será histórico.
A Rússia merece o ferro que tá levando mas isso é uma guerra proxy, a Ucrânia está sendo usada pro Estados Unidos desde a queda do governo anterior.
Quem promoveu toda essa guerra foi o EUA com o objetivo governamental da globalização.","2022-12-22 14:27:16","1178623779.0","2022-12-22","14:27:16"
"688254","Não acabou! Desmereceu porque esta dizendo que não deu em nada.","2022-12-22 14:28:37","5134709402.0","2022-12-22","14:28:37"
"688255","Burros","2022-12-22 14:30:23","634223840.0","2022-12-22","14:30:23"
"688256","A Europa está se isolando cada vez mais","2022-12-22 14:30:46","634223840.0","2022-12-22","14:30:46"
"688257","Ir para a Ucrânia pegar em armas e lutar nada né?! Kkk","2022-12-22 14:33:52","5413659844.0","2022-12-22","14:33:52"
"688258","Nego andou comendo 😜 por fora é o que parece.... 🙈☺️","2022-12-22 14:38:37","1914253750.0","2022-12-22","14:38:37"
"688259","O lula vai governar para o pobres roubando eles","2022-12-22 14:39:57","634223840.0","2022-12-22","14:39:57"
"688260","Resumo do discurso de Zelensky:
1. Os contribuintes americanos vão pagar mais dezenas e dezenas de bilhões de dólares por esta guerra,
2. Não existe nenhuma possibilidade de paz a curto prazo,
3. A crise econômica europeia só vai aumentar,
4. A população masculina ucraniana vai continuar a ser massacrada.","2022-12-22 14:45:00","1403337079.0","2022-12-22","14:45:00"
"688261","Essa guerra tá muito lucrativa pro zelensky. Duvido que que vai deixar acabar.","2022-12-22 14:46:47","527797456.0","2022-12-22","14:46:47"
"688262","É fácil ficar dando dinheiro quando é dos outros.","2022-12-22 14:47:07","527797456.0","2022-12-22","14:47:07"
"688263","Para a guerra acabar basta o vosso Deus da algalia Putin mandar retirar a sua tropa","2022-12-22 14:48:02","5687290451.0","2022-12-22","14:48:02"
"688265","Isso é raciocínio de criança, para a guerra acabar um dos lados tem que vencer ou precisa haver um acordo, mas durante esses 10 meses de guerra só o putin aceitou negociar, zelensky e a OTAN se negam a procurar uma solução negociada.","2022-12-22 14:56:57","1403337079.0","2022-12-22","14:56:57"
"688266","Faltando 1 semana para o bandido assumir o poder isso vai resolver muita coisa 🤣 o Lula acaba com essa estória antes mesmo de ser implementada","2022-12-22 14:58:00","631941985.0","2022-12-22","14:58:00"
"688267","Ser libertário é uma coisa, mas ser alienado é outra","2022-12-22 14:58:21","1403337079.0","2022-12-22","14:58:21"
"688268","""Ucranianos devem pegar em armas para se defenderem e pá.... orcs russos morrendo, bem feito..."" e aqui no Brasil um movimento praticamente nazista aparecendo...""Ain... devemos agir democraticamente, sem violência! o Estado Malvadão vai cair de podre... devemos ser pacientes!""","2022-12-22 14:59:28","1556218841.0","2022-12-22","14:59:28"
"688269","Canal
Frente Agorista

Grupos
Anarcocapitalismo
Agorismo","2022-12-22 15:00:53","193196103.0","2022-12-22","15:00:53"
"688715","Responde ai vagabundo","2022-12-22 22:35:45","2053633092.0","2022-12-22","22:35:45"
"688270","Parece que a maioria dos Libertários vivem no mundo da Lua, não irão conseguir mudar nada na sociedade antes de morrer.","2022-12-22 15:01:37","5702418153.0","2022-12-22","15:01:37"
"688271","A Rutinha (estado) é má...","2022-12-22 15:04:03","5702418153.0","2022-12-22","15:04:03"
"688272","👆👆👆👆👆👆👆👆👆👆👆👆Como não fico pagando de falastrão sensacionalista de Tik Tok, prefiro aguardar e analisar somente os fatos!

E o maior fato até agora é: NINGUÉM SABE DE NADA! 

Mas se vc tá louco com isso...imagine os Comunas?

ANTES DA AÇÃO DE 1964 o Exercito era chamado de ""O GRANDE MUDO"".","2022-12-22 15:04:05","5045239456.0","2022-12-22","15:04:05"
"688273","Raciocínio de criança é levar nas bentas e ficar se
O vosso corno protetor da Amazônia ( dizem vocês arrombados)
Passou 2 anos procurando adversário para a sua "" guerra patriótica"" , inventando 1001 desculpas e mentiras....o acordo que ele quer é roubar o que é dos outros...","2022-12-22 15:04:07","5687290451.0","2022-12-22","15:04:07"
"688276","Além de raciocínio infantil agora vem com um texto horroroso, com frases mal formuladas, que tal tentar refutar lógica dos meus argumentos???","2022-12-22 15:19:59","1403337079.0","2022-12-22","15:19:59"
"688277","Ah esse mimadinhos","2022-12-22 15:21:14","5973867706.0","2022-12-22","15:21:14"
"688278","Não sabem oq é ver o pai ou a mãe desesperado em casa pq a fatura do cartão e as contas vão chegar","2022-12-22 15:22:14","5973867706.0","2022-12-22","15:22:14"
"688279","Em 1964 eua apoio tomada de poder  e exercito so saiu pq eua mandou tbm  ao contrario de 2022 que bolso nao tem apoio de nenhuma potencia chingou os chineses pra agradar militantes  eles poderiam dar ajuda agr","2022-12-22 15:22:57","5243463294.0","2022-12-22","15:22:57"
"688280","Por ai... o zelensky foi nos EUA falar em democracia, mas ele:
Fechou todos os jornais de oposição,
Censurou as TVS e as rádios,
Censurou a Internet 
Prendeu os opositores,
Baniu todos os partidos de oposição,
Está perseguindo as igrejas,
Manda prender, torturar e matar quem critica seu regime,

Mas ele luta pela liberdade e pela democracia!!!!","2022-12-22 15:23:39","1403337079.0","2022-12-22","15:23:39"
"688281","Pra isso você precisa apresentar seus argumentos, além da tese que você defende…","2022-12-22 15:26:23","846274888.0","2022-12-22","15:26:23"
"688752","A NTD e o Epoch Times, como as mídias oficiais do espetáculo, orgulhosamente apresentam o Shen Yun!

💞 Venha conhecer a magia e beleza que envolviam a China antiga antes do comunismo! 

Um espetáculo que realmente importa, para cada um de nós. Isso é o que você estava esperando. Veja pelo menos uma vez na vida.

Confira a agenda aqui no Brasil:
17 a 22 de março | Teatro Bradesco, São Paulo
24 e 25 de março | Teatro Guaíra, Curitiba

Ingressos à venda, acesse o link https://pt.shenyun.com/brazil","2022-12-22 22:53:59","637639689.0","2022-12-22","22:53:59"
"688282","Traduzindo : jovens que ja detem os monopólio de mercado não querem perde para a concorrência e apelam para o estado","2022-12-22 15:29:05","1941884372.0","2022-12-22","15:29:05"
"688283","Se essa desgraça fosse capitalismo mesmo, a sociedade estaria eras a frente desse lixo limitador","2022-12-22 15:29:51","1941884372.0","2022-12-22","15:29:51"
"688284","Quando alguém invadir sua casa vc vai negociar com ele? E se ele disser ""a sala, o quarto e a cozinha são meus e vc fica com o resto""; vai topar?","2022-12-22 15:31:35","143185415.0","2022-12-22","15:31:35"
"688286","https://atrombetanews.com.br/2022/12/22/salario-dos-parlamentares-brasileiros-e-15-vezes-maior-que-renda-da-populacao/","2022-12-22 15:33:10","301817880.0","2022-12-22","15:33:10"
"688304","Cada dia tem menos libertários nesse grupo. Haja robô russo","2022-12-22 15:52:40","143185415.0","2022-12-22","15:52:40"
"688287","Que tal ires para a puta que te pariu
O teu argumento deve ser a bimbada que o putin te deu! Putin estudou fazer a sua guerra patriótica  com Cazaquistão, Moldávia e Ucrânia....escolheu a última

Inventou os separatistas
Inventou os nazistas ( tem muitos na Rússia e não os vê) 
Ignorou os pontos dos acordos de Minsk
( Referendo sem tropas)
E engana uns tontos que nem voce","2022-12-22 15:33:58","5687290451.0","2022-12-22","15:33:58"
"688288","Zelensky não é certamente santo, ninguém o é , e muito menos um político o será....mas quando esta trapalhada começou , ele só tocava piano com a piroca","2022-12-22 15:35:22","5687290451.0","2022-12-22","15:35:22"
"688291","Já apresentei. Guerra via de regra terminam quando um dos lados vencem, ou quando ocorre um acordo, mas zelensky e a OTAN nesses 10 meses se recusam a negociar, isso limita a solução da guerra a uma opção militar, o que vai resultar em muito mais mortes","2022-12-22 15:41:46","1403337079.0","2022-12-22","15:41:46"
"688292","Pq líderes como Bolsonaro, Trump e agora DeSantis, estão sendo barrados e perseguidos a todo custo? 
Pq eles se tornaram barreiras e dificultaram os planos dos burocratas que visam instaurar o governo global.

Por exemplo: A OMS está finaliza do o novo tratado pandemico. Em resumo, os países que assinarem, perderão sua soberania assim que uma emergência de saúde for declarada e o caminho para a tirania estará aberto.
Bolsonaro não assinaria isso. E Lula? Vcs sabem!","2022-12-22 15:42:43","867304090.0","2022-12-22","15:42:43"
"688293","Tradução: A crise ucraniana foi deliberadamente provocada pelo estado profundo... para forçar o mundo a realizar as reformas do Great Reset, em particular a chamada 'transição tecnológica' e a 'mudança verde'. É a segunda etapa do golpe tecnocrata globalista, depois da farsa da pandemia.
--------

O arcebispo Vigano com certeza é um alvo. Ele vem há muito tempo alertando o mundo sobre a agenda em curso.","2022-12-22 15:43:05","867304090.0","2022-12-22","15:43:05"
"688294","Artista o teu macho quer metade da Ucrânia , e a outra metade debaixo da sua nota ( a la Hitler /Vichy) ....mas não tem unhas para isso!
Já lê ofereceram o controle da Crimeia e impunidade pelos seus crimes de guerra....mas no alto da sua soberba não acha razoável....pois muito bem, vai ser  até a última","2022-12-22 15:45:28","5687290451.0","2022-12-22","15:45:28"
"688295","Outro raciocínio infantil, você não pode tratar países com a mesma lógica que trata uma pessoa, se uma pessoa invade a sua casa você expulsa ela, chama a polícia ou aciona a justiça, com um pais é muito diferente, se a Ucrânia se recusar a negociar com o agressor (a Rússia), isso só garante que a guerra vai continuar e que muitos outros milhares de ucranianos serão mortos e que os prejuízos materiais serão ainda mais levados.","2022-12-22 15:45:29","1403337079.0","2022-12-22","15:45:29"
"688296","Não entendo como isso pode ser uma tese…, isso é uma verdade auto evidente. Ou seja, toda guerra acaba quando termina.","2022-12-22 15:49:00","846274888.0","2022-12-22","15:49:00"
"688297","Não tem argumentos então apela para as ofensas, você tem que ser um fanático torcedor da Ucrânia, porque se tentar analisar o conflito de forma minimamente isenta já classificam você como apoiador do Putin.","2022-12-22 15:49:04","1403337079.0","2022-12-22","15:49:04"
"688298","Se vc olhar a História, verá que em 2014/15 aconteceu exatamente a mesma coisa. Putin invadiu a Ucrânia e quando viu que ia levar uma surra, ameaçou a Europa com guerra total. A OTAN aceitou a chantagem, a Ucrânia teve o território mutilado e em 2022 Putin achou que a OTAN cairia na chantagem novamente.
Agora a guerra só irá acabar com a derrota da Rússia, porque os europeus se convenceram que Putin age igual Hitler antes da II GM. E os ucranianos só querem seu território: isto é legítima defesa.","2022-12-22 15:49:06","143185415.0","2022-12-22","15:49:06"
"688299","Ou pode acabar com a derrota da Ucrânia…","2022-12-22 15:50:25","846274888.0","2022-12-22","15:50:25"
"688300","É uma tese no aspecto de que muito embora seja algo auto evidente simplesmente muitas pessoas se recusam a aceitar qualquer alternativa possível para por fim ao conflito procurando poupar vidas humanas.","2022-12-22 15:50:54","1403337079.0","2022-12-22","15:50:54"
"688301","Certo","2022-12-22 15:51:21","846274888.0","2022-12-22","15:51:21"
"688302","Moço, vc que é infantil. Imagine de a Argentina invadisse o Sul do Brasil e depois que começasse a levar uma surra quisesse negociar: nós, argentinos, ficamos com RS e SC e fazemos a paz.
Tá bom assim?","2022-12-22 15:51:35","143185415.0","2022-12-22","15:51:35"
"688303","Eu aceitaria…, não gostaria de ter que defender um lugar que nunca fui.","2022-12-22 15:52:20","846274888.0","2022-12-22","15:52:20"
"688306","Mamma mia! Só pode ser robô","2022-12-22 15:53:10","143185415.0","2022-12-22","15:53:10"
