"message_id","message","message_utc","from_id","date","time"
"638782","E da Grendene","2022-11-07 02:09:25","5000923060.0","2022-11-07","02:09:25"
"639895","PIX >>> BITCOIN","2022-11-07 11:56:54","5751837163.0","2022-11-07","11:56:54"
"640224","Olha o que me lembrou KKKKKKKKKKKKKK","2022-11-07 13:23:18","165399610.0","2022-11-07","13:23:18"
"640226","acho que é montagem","2022-11-07 13:24:32","1890023034.0","2022-11-07","13:24:32"
"640232","muitas, desdobramentos do stf sobre op lava jato com semanas de antecedência, contraofensiva ucraniana meses antes","2022-11-07 13:33:22","363433022.0","2022-11-07","13:33:22"
"640235","Tio elon poderia banir o xandao, nelipe feto e danones ja estaria satisfeito","2022-11-07 13:37:22","5063059882.0","2022-11-07","13:37:22"
"640236","Mas é mais facil ele desbanir td mundo","2022-11-07 13:37:31","5063059882.0","2022-11-07","13:37:31"
"640237","a melhor forma desses caras se enterrarem é deixar eles falar","2022-11-07 13:38:27","106544730.0","2022-11-07","13:38:27"
"640238","não defendo censura pra ngm","2022-11-07 13:38:37","106544730.0","2022-11-07","13:38:37"
"640245","https://twitter.com/luidarlos/status/1588817779699773440?t=9Dj_grl2_zgiE7n1UHq1-g&s=35","2022-11-07 13:47:01","246412672.0","2022-11-07","13:47:01"
"640239","https://twitter.com/luidarlos/status/1588817779699773440?t=wPK4vBK-mFzo7psUfxQU6g&s=35","2022-11-07 13:40:16","5615507096.0","2022-11-07","13:40:16"
"640240","Vou rir tanto de quem votou no Lula tendo prejuízo com o pix kkkk. Cheio de gente otária que votou nele por burrice","2022-11-07 13:40:25","1572828001.0","2022-11-07","13:40:25"
"640242","Não será o único.","2022-11-07 13:42:11","1316957083.0","2022-11-07","13:42:11"
"640243","Também vou.
E quando vierem reclamar, direi ""Faz o L "" que passa.","2022-11-07 13:43:16","1271925737.0","2022-11-07","13:43:16"
"640246","O vídeo Que foi apagado sobre Alexandre de Moraes","2022-11-07 13:47:26","246412672.0","2022-11-07","13:47:26"
"640247","é cada palavra que as pessoas escolhem usar kkk","2022-11-07 13:49:10","5117697194.0","2022-11-07","13:49:10"
"640248","Olhem só isto.","2022-11-07 13:52:42","807363644.0","2022-11-07","13:52:42"
"640249","não vi isso não, eu tinha os dados antigos, baixei os novos e comparei, estão iguais... só atualizaram a página os arquivos com os dataset são os mesmos...","2022-11-07 13:53:16","159940265.0","2022-11-07","13:53:16"
"640254","Estas são as urnas de Pacaraima","2022-11-07 13:54:08","807363644.0","2022-11-07","13:54:08"
"640255","Em todos os modelos antigos o Lula vence em praticamente todas.","2022-11-07 13:54:28","807363644.0","2022-11-07","13:54:28"
"640256","No mesmo município, nas urnas novas, Bolsonaro vence em todas.","2022-11-07 13:54:50","807363644.0","2022-11-07","13:54:50"
"640258","#BrazilWasStolen


Se inscreva no Canal Thami Gasparetto 🎥
https://youtu.be/8cSw6y4AgDQ

👉🏻 Twitter: https://twitter.com/Tha_Gasparetto?t=l6IBDmmRnieZFFtepzjxwQ&s=09","2022-11-07 13:55:32","1269740476.0","2022-11-07","13:55:32"
"640261","eu tava lá pow","2022-11-07 13:56:41","5117697194.0","2022-11-07","13:56:41"
"640264","Canalhas! https://pt.euronews.com/2022/11/07/demonstracoes-a-favor-e-contra-a-vitoria-de-lula-da-silva-no-brasil","2022-11-07 13:57:08","1269740476.0","2022-11-07","13:57:08"
"640265","Pô, aí não tem como defender kkk","2022-11-07 13:59:00","1728280924.0","2022-11-07","13:59:00"
"640267","https://vm.tiktok.com/ZMFyXEaoM","2022-11-07 13:59:36","5750867496.0","2022-11-07","13:59:36"
"640270","https://tribunanacional.com.br/noticia/4604/brasil-uma-panela-de-pressao-greve-geral-marchas-continuam-e-censura-aumenta#.Y2j4nF3GOmQ.telegram
Brasil, uma panela de pressão: greve geral, marchas continuam e censura aumenta                                                                                                                                                                              📌 GETTR
📌 BOMPERFIL","2022-11-07 14:01:03","5024946675.0","2022-11-07","14:01:03"
"640271","Eu vou rir ao ver a chapa ""eleita"" q não subirá a rampa e sim em um camburão.","2022-11-07 14:01:32","165399610.0","2022-11-07","14:01:32"
"640272","seria interessante cruzar os dados de BU em zona/secao que bolsonaro zerou com dados de log de urna... ví vídeos que não sei da veracidade onde a pessoa mostra que a zona/secao que ela votou esta com 0 bolso ai a pessoa se manifestou dizendo que é impossível pq ela votou...","2022-11-07 14:03:57","159940265.0","2022-11-07","14:03:57"
"640273","Eu estava pensando. E se a cada 4 ou 5 votos do Bolsonaro, um for para o Lula? Precisaria de um matemático para testar essa possibilidade.","2022-11-07 14:06:11","1316957083.0","2022-11-07","14:06:11"
"640278","eu não estou conseguindo acessar os grupos bloqueados com vpn... porque detecta meu numero do brasil .. tentei usar celular virtual mas nenhum foi","2022-11-07 14:07:56","752745694.0","2022-11-07","14:07:56"
"640281","Depois dessas fraudes, não consigo em duvidar de mais nada.","2022-11-07 14:09:07","1316957083.0","2022-11-07","14:09:07"
"640282","Que is so?","2022-11-07 14:09:34","5783268175.0","2022-11-07","14:09:34"
"640283","Todo boicote é bem-vindo.","2022-11-07 14:09:40","1316957083.0","2022-11-07","14:09:40"
"640284","Dá um 3xemplo de grupo , eu estou na Europa e posso testar aqui","2022-11-07 14:09:40","246412672.0","2022-11-07","14:09:40"
"640286","Qual é a empresa dela","2022-11-07 14:09:44","5783268175.0","2022-11-07","14:09:44"
"640287","Que VPN está utilizando?","2022-11-07 14:09:50","1569913929.0","2022-11-07","14:09:50"
"640288","Não contrato nem advogado Petista mais tbm","2022-11-07 14:10:50","1569913929.0","2022-11-07","14:10:50"
"640292","Peter é um bom comentarista.  Demonstra conhecimento em várias áreas.  Acho-o comedido em suas palavras,  devido o momento que passamos.  Vamos aguardar . O Nine tem q primeiro subir a rampa para poder cair aos tombos. Como nosso País não adota o Recall para q o próprio povo possa depor um representante eleito, teremos q posteriormente exigir os eleitos façam o impeachment 🤷🏼‍♀️","2022-11-07 14:12:16","948526267.0","2022-11-07","14:12:16"
"640295","Tipo confia no TSE?","2022-11-07 14:12:32","5783268175.0","2022-11-07","14:12:32"
"640296","Eu estou confiante para isso.","2022-11-07 14:13:01","5691652034.0","2022-11-07","14:13:01"
"640297","Será 😂","2022-11-07 14:13:12","1203787813.0","2022-11-07","14:13:12"
"640319","Lula e Alckmin não subi a rampa? Impossível..","2022-11-07 14:22:13","1572828001.0","2022-11-07","14:22:13"
"640299","Povo armado jamais escravizado","2022-11-07 14:15:45","1203787813.0","2022-11-07","14:15:45"
"640303","E a Mia kaliffa puta fake News","2022-11-07 14:17:08","1793665710.0","2022-11-07","14:17:08"
"640304","Tomara que nao tenha  uma carla zambelli americana dando uma de policia na vespera de eleiçoes","2022-11-07 14:17:16","5243463294.0","2022-11-07","14:17:16"
"640328","Estes também foram corrompidos, é uma lástima.","2022-11-07 14:23:19","5691652034.0","2022-11-07","14:23:19"
"640305","Essa Folha de São Paulo já deveria ser extinta do Brasil.","2022-11-07 14:17:34","5691652034.0","2022-11-07","14:17:34"
"640306","Ou um roberto jeferson ...","2022-11-07 14:17:36","5243463294.0","2022-11-07","14:17:36"
"640308","Não vejo mais nada das mídias como Folha de São Paulo, uol, G1, R7.","2022-11-07 14:19:17","1316957083.0","2022-11-07","14:19:17"
"640310","#Cuie

Empreendedorismo feminino 🤷‍♂️","2022-11-07 14:20:21","5737870204.0","2022-11-07","14:20:21"
"640357","Pagar juros pra gente, pagam uma merreca, quando é a gente que deve pra eles, é pior que pegar dinheiro com agiota.","2022-11-07 14:30:11","860178634.0","2022-11-07","14:30:11"
"640311","Melhor decisão, eles pregam um jornalismo falacioso, são uns meros estúpidos.","2022-11-07 14:20:47","5691652034.0","2022-11-07","14:20:47"
"640312","o TSE baniu todos os grupos que o marsili criou https://linktr.ee/GruposDrItalo","2022-11-07 14:21:21","752745694.0","2022-11-07","14:21:21"
"640314","Jurista Tiago Pavinatto","2022-11-07 14:21:30","1749300915.0","2022-11-07","14:21:30"
"640315","eu ignoro totalmente essa gente estranha...","2022-11-07 14:21:42","752745694.0","2022-11-07","14:21:42"
"640316","ignora","2022-11-07 14:21:58","1268004268.0","2022-11-07","14:21:58"
"640318","É o certo a se fazer!","2022-11-07 14:22:08","5691652034.0","2022-11-07","14:22:08"
"640320","só falam um monte de bosta ...","2022-11-07 14:22:13","752745694.0","2022-11-07","14:22:13"
"640321","📣 Traição a Bolsonaro? Partido do presidente enfrenta divisão para declarar oposição a Lula, diz imprensa

Ao que tudo indica, o partido de Bolsonaro, o PL, está em negociações com o PT para indicar o futuro líder do governo no Senado, segundo publicou o jornal Correio Braziliense.

O PL foi o que saiu com as maiores bancadas tanto na Câmara quanto no Senado nas últimas eleições. Por outro lado, seu presidente, Valdemar Costa Neto, estaria sob pressão de bolsonaristas para declarar publicamente que o partido fará oposição a Lula a partir de 2023, publicou o portal Metrópoles. 

Vale destacar que uma ala majoritária do PL diverge da visão dos bolsonaristas e quer que o partido tenha um relacionamento diferente com o governo Lula. 

No passado, Valdemar já fez parte de bases aliadas do PT e possui boa relação pessoal com Lula.

Siga a @sputnikbrasil no Telegram e tenha acesso a temas não abordados pela grande mídia brasileira","2022-11-07 14:22:16","520921730.0","2022-11-07","14:22:16"
"640323","Diz Imprensa...","2022-11-07 14:22:17","520921730.0","2022-11-07","14:22:17"
"640324","Até mesmo portais regionais, não estou acreditando nas informações.","2022-11-07 14:22:20","1316957083.0","2022-11-07","14:22:20"
"640327","ufa, falta pouco...daí só uso o bradesco, mas to esperando terminar um empréstimo pra fechar a conta","2022-11-07 14:22:57","1268004268.0","2022-11-07","14:22:57"
"640331","cara... antes da eleição era: orçamento secreto e bolsolão... acabou a eleição voltou o nome certo que é emendas de relator... na boa.. nao tem a menor condição.. só quem é muito estúpido aguenta isso","2022-11-07 14:23:50","752745694.0","2022-11-07","14:23:50"
"640335","Faaaaaz o L","2022-11-07 14:26:11","1095521815.0","2022-11-07","14:26:11"
"640346","Concordo mas seria bom ver eles experimentando o q eles pregam","2022-11-07 14:28:29","5063059882.0","2022-11-07","14:28:29"
"640348","🙄","2022-11-07 14:28:44","860178634.0","2022-11-07","14:28:44"
"640351","O que me dizem do Banco Inter?","2022-11-07 14:29:02","860178634.0","2022-11-07","14:29:02"
"640360","🙄","2022-11-07 14:30:42","860178634.0","2022-11-07","14:30:42"
"640365","Banco nao tem mt pra onde correr","2022-11-07 14:31:45","5063059882.0","2022-11-07","14:31:45"
"640366","PCP para abater javali 


https://produto.mercadolivre.com.br/MLB-2635794731-carabina-pcp-custom-635-giii-abate-javali-preta-supressor-_JM#position=10&search_layout=stack&type=item&tracking_id=af2d5247-4c2a-40f2-a567-b9d55a0165e5","2022-11-07 14:31:46","1203787813.0","2022-11-07","14:31:46"
"640367","Infelizmente","2022-11-07 14:31:50","5063059882.0","2022-11-07","14:31:50"
"640370","Falo dos bancos em geral","2022-11-07 14:32:28","860178634.0","2022-11-07","14:32:28"
"640371","Só compro feira livre de pequeno produtor a partir do ano que vem. E ainda vou procurar saber em quem votou antes. Quanto a produtos embalados etc farei pesquisa antes. Se cada um fizer sua parte essa turma sangra","2022-11-07 14:32:50","1095521815.0","2022-11-07","14:32:50"
"640381","Gosto do Picpay porém não sei quais associações que eles tem","2022-11-07 14:35:53","1349772743.0","2022-11-07","14:35:53"
"640387","recentemente tá uma bosta mesmo. se vc envia um pix grande fica em analise por uma meia hora. isso nem existia antes (tipo ha 1 ano atrás), não sei o que houve","2022-11-07 14:36:48","1349772743.0","2022-11-07","14:36:48"
"640391","155a BRIGADA MARINE russa é DIZIMADA em PAVLIVKA perdendo 300 COMBATENTES e 50% dos VEÍCULOS
@ ANCAPSU","2022-11-07 14:38:03","1103049455.0","2022-11-07","14:38:03"
"640393","Nisso aí discordo um pouquinho. O Bonoro meteu os pés pelas mãos várias vezes, como quando ajudou a afundar a Lava Toga; na época que o Lula foi solto comemorou, fora quando se cagou em 7/9 do ano passado. Ele tava achando muito que ganharia por W.O, sendo que o Olavo o alertou várias vezes que não seria bem assim","2022-11-07 14:39:13","1349772743.0","2022-11-07","14:39:13"
"640395","Eu não duvido que o Lula tenha muitos votos, muitas pessoas são ignorantes, mas isso poderia ser parado pelo simples fato de ter se oposto diametralmente a sua soltura e peitado o STF","2022-11-07 14:39:51","1349772743.0","2022-11-07","14:39:51"
"640396","pelo menos uns dois momentos ele tinha timing suficiente para isso","2022-11-07 14:40:15","1349772743.0","2022-11-07","14:40:15"
"640398","Viva a estética","2022-11-07 14:40:26","844720961.0","2022-11-07","14:40:26"
"640400","Tô pra fazer isso... Bando de fdp
Taxa abusiva","2022-11-07 14:41:34","1268004268.0","2022-11-07","14:41:34"
"640401","Eu ligo.
🔥🔥🇷🇺🔥🔥
🔥🔥🔥🔥🔥","2022-11-07 14:41:39","5189287382.0","2022-11-07","14:41:39"
"640403","Slava Ukraine","2022-11-07 14:42:05","5189287382.0","2022-11-07","14:42:05"
"640407","Partido Novo Socialismo","2022-11-07 14:44:11","1382366565.0","2022-11-07","14:44:11"
"640408","Liberal 🤡","2022-11-07 14:44:22","844720961.0","2022-11-07","14:44:22"
"640410","Estariamos bem se nosso presidente tivesse só a metade da coragem do  ""comediante"" ucraniano para enfrentar o nosso supremo tribunal do crime","2022-11-07 14:45:24","5189287382.0","2022-11-07","14:45:24"
"640411","Se o Zema for pro PL perderam tudo","2022-11-07 14:45:39","844720961.0","2022-11-07","14:45:39"
"640412","Pelo jeito ele vai mesmo","2022-11-07 14:45:55","1328638661.0","2022-11-07","14:45:55"
"640415","Bem que ele podia colocar uma condição, de ir somente e se o PL ser oposição de fato ao governo mula...","2022-11-07 14:47:21","1268004268.0","2022-11-07","14:47:21"
"640417","Nordeste tá bom 👏👏","2022-11-07 14:47:41","844720961.0","2022-11-07","14:47:41"
"640419","#Cuie

Isso aí é uma procuradora de justiça.","2022-11-07 14:47:59","5737870204.0","2022-11-07","14:47:59"
"640420","impossível era o que falavam em 2014, 2015 e 2016 que a cabeça gorda não seria impichada.","2022-11-07 14:48:03","165399610.0","2022-11-07","14:48:03"
"640421","Violento lá, pelo visto","2022-11-07 14:48:25","844720961.0","2022-11-07","14:48:25"
"640424","Será que agora serão os ucranianos vão anexar a Rússia?","2022-11-07 14:49:09","860178634.0","2022-11-07","14:49:09"
"640440","Maluco parou de mexer com os foguetes para começar a lidar com os canhões kkkk","2022-11-07 14:53:03","165399610.0","2022-11-07","14:53:03"
"640441","Pior que a mina é bonita.
Mas já está toda estragada, não dá nem pra comer mais.","2022-11-07 14:54:31","1382366565.0","2022-11-07","14:54:31"
"640449","essa é outra sarna que o Titio Elon tá puxando.  Vai incorporar o onlyfans no tt","2022-11-07 14:57:16","165399610.0","2022-11-07","14:57:16"
"640451","Sem dúvida.
""Canhotagem"" é um tipo severo de lesão cerebral","2022-11-07 14:57:25","1271925737.0","2022-11-07","14:57:25"
"640453","https://www.youtube.com/watch?v=fOIkgDPV1Rc","2022-11-07 14:58:15","246412672.0","2022-11-07","14:58:15"
"640454","Aé tu acha que eles naõ assumem?","2022-11-07 14:58:43","5783268175.0","2022-11-07","14:58:43"
"640455","RECURSOS DO CIDADÃO DE BEM CASO PLAYBOYS FDP  COMEDORES DR CRIANCINHA  E METIDOS A SOCIALISTA TENTAM DESARMA-LO E ATENTAM  CONTRA SUA INTEGRIDADE:                                                                                  https://www.youtube.com/shorts/R592zvZ_r8o                                                           Como fazer um teaser com raquete elétrica
https://www.youtube.com/watch?v=4cY4YBzL9MY                              E FOGOS D ARTIFÍCIO.... https://www.youtube.com/watch?v=UQY_gwIEdbo                            BARRAS D METAL ENFERRUJADAS E DETERIORADAS AO LONGO... SUJAS COM ESTRUME PARA CAUSAR INFECÇÕES EFETIVAS E HORRÍVEIS
GARRAFAS D VIDRO
LAMINAS AFIADAS
GARRAFAS COM COMBUSTÍVEL E PAVIO D PANO","2022-11-07 14:59:02","5457352565.0","2022-11-07","14:59:02"
"640459","Ué não eram só para tirar a monetização de conteúdos com fake News ?","2022-11-07 14:59:53","634223840.0","2022-11-07","14:59:53"
"640460","Ele deveria conhecer a maravilhosa tecnologia da urna electrónica brasileira. Sentiria muita inveja de nós. 🤡","2022-11-07 14:59:58","860178634.0","2022-11-07","14:59:58"
"640462","Sigam Sleeping Zap.👍","2022-11-07 15:00:42","860178634.0","2022-11-07","15:00:42"
"640463","Alguém sabe o Instagram verdadeiro do argentino?","2022-11-07 15:00:49","5243256593.0","2022-11-07","15:00:49"
"640464","O do vídeo sobre as fraudes nas urnas?","2022-11-07 15:00:49","5243256593.0","2022-11-07","15:00:49"
"640467","🇧🇷Bom dia Brasil. Mídias abertas para as atualizações❗️❗️🔥","2022-11-07 15:01:16","660044083.0","2022-11-07","15:01:16"
"640469","Sabe o q acho, que nós como bons ancaps empreendedores que somos deveríamos fazer isso 
Jornais, revistas podcast
Pesquisas eleitorais","2022-11-07 15:01:18","5783268175.0","2022-11-07","15:01:18"
"640471","Se não vier de navio, uma menina magrinha vem deixar.","2022-11-07 15:01:25","1338295779.0","2022-11-07","15:01:25"
"640472","O grupo foi bloqueado geral, ou seja nao da acesso nem fora do Brasil","2022-11-07 15:01:31","246412672.0","2022-11-07","15:01:31"
"640473","Bom dia, segundo as redes: ""Hoje o BRASIL VAI PARAR! Parece que acendeu uma chama de revolta no Antagonista.","2022-11-07 15:01:32","660044083.0","2022-11-07","15:01:32"
"640474","PERFIL DO INIMIGO COMEDOR D CRIANCINHA METIDO À SOCIALISTA:                                      -SUSTENTADO PELOS PAIS ATÉ OS 30 E TANTO.....                             -DECOREBA INTELECTUAL....          -SUSTENTA BANDIDO ENQUANTO MORADOR D COMUNIDADE LEVA TIRO NO REGO....                                          -   -SE ESCORA EM BANDIDO P/  TENTAR INTIMIDAR.....                      -MAL PEGA SOL OU SAI DO CONDOMÍNIO E QUER POSAR D HUMANISTA.....                                  -É  BRABO SÓ  QND TÁ D GALERA.....                                         -ETC","2022-11-07 15:01:43","5457352565.0","2022-11-07","15:01:43"
"640480","Aja Elon, aja imediatamente!!","2022-11-07 15:04:58","1998598133.0","2022-11-07","15:04:58"
"640482","Cara, se esse país tivesse recall que nem nos EUA eu acho que TODA semana ia ter pedido de recall de alguém","2022-11-07 15:05:30","1453598070.0","2022-11-07","15:05:30"
"640484","Essa pagina deveria ter mais seguidores","2022-11-07 15:05:39","1328638661.0","2022-11-07","15:05:39"
"640486","1 em 4 europeus dizem estar em uma situação financeira precária. A matéria é de hoje do jornal de esquerda, the guardian. De acordo com a notícia mais de metade dos europeus estão preocupados (algo que posso confirmar como sendo verdade) e 80% já teve que diminuir despesas. Mais de metade (54%) das pessoas na França, Alemanha, Grécia, Itália, Polônia e Reino Unido já viram seu poder de compra cair nos últimos 3 anos e isso se deve a um aumento considerável no preço de combustível, comida, gás e eletricidade… 

isso tudo é só o começo 

OS CONTROLADORES DO MUNDO 50% OFF 🔥🔥🔥👉🏻 https://pay.kiwify.com.br/aKI9DQI","2022-11-07 15:07:52","1905734033.0","2022-11-07","15:07:52"
"640488","Tá osso","2022-11-07 15:08:15","1905734033.0","2022-11-07","15:08:15"
"640489","A censura os livra de passar vergonha quando tem que contestar uma ideia contraria; adotam chavões, e acham que isso serve de universo coguinitivo","2022-11-07 15:08:20","1271925737.0","2022-11-07","15:08:20"
"640491","Quer sair do Brasil?🖕","2022-11-07 15:09:27","1905734033.0","2022-11-07","15:09:27"
"640492","Logo no início da guerra Zelensky recusou a carona que o Biden ofereceu para fugir da Ucrânia e pediu mais munição. Os russos estavam bem próximos de Kiev. Se fosse o nosso presidente honesto porém banana pediria logo um ônibus para e a família dele","2022-11-07 15:09:27","5189287382.0","2022-11-07","15:09:27"
"640493","Meus amigos amantes da democracia já tão loucos com medo de outro lockdown mas com esperança de que n ocorra por conta da vacinação","2022-11-07 15:09:45","1211265513.0","2022-11-07","15:09:45"
"640494","Fique em casa a economia a gente vê depois","2022-11-07 15:09:55","5783268175.0","2022-11-07","15:09:55"
"640495","Mesmo o Boulos, que de pobre é carente nunca teve nada, foi amassado pelo Nikolas Ferreira; restou a ele, como sempre lembrou Olavao ,o risinho de puta","2022-11-07 15:09:59","1271925737.0","2022-11-07","15:09:59"
"640497","Tudo pra nath vender curso depois :v","2022-11-07 15:10:53","1211265513.0","2022-11-07","15:10:53"
"640498","VEJAM QUE EU ACABO DE RECEBER.....SIGILO COMPLETO","2022-11-07 15:11:13","1654431547.0","2022-11-07","15:11:13"
"640499","Talvez seja verdade....","2022-11-07 15:11:13","1654431547.0","2022-11-07","15:11:13"
"640500","ainda essa merda do Lula?","2022-11-07 15:11:29","165399610.0","2022-11-07","15:11:29"
"640501","Vou aguardar as notícias internacionais.","2022-11-07 15:11:34","1316957083.0","2022-11-07","15:11:34"
"640502","Como que é o governo no Uruguai? Eles não são tudo a favor de taxar naõ?","2022-11-07 15:11:47","5783268175.0","2022-11-07","15:11:47"
"640503","Será?","2022-11-07 15:11:49","1905734033.0","2022-11-07","15:11:49"
"640505","Vai ser igual cartão de crédito.  Vai a galera toda repassar pros cliente","2022-11-07 15:12:09","1211265513.0","2022-11-07","15:12:09"
"640507","Será??? Caramba","2022-11-07 15:12:30","1905734033.0","2022-11-07","15:12:30"
"640508","Essa retórica de "" ah vou embora do Brasil"" , além de covarde , é prova cabal de total falta de conhecimento do que se passa no mundo.
Alguns amigos nos EUA estão sem obras ( empreiteiras ) há 4 meses !","2022-11-07 15:12:44","1271925737.0","2022-11-07","15:12:44"
"640511","Lula é um dos problemas. o problema grande é quem faz parte da esquerda","2022-11-07 15:13:56","880955266.0","2022-11-07","15:13:56"
"640512","Para quem ele ira pedir munição?","2022-11-07 15:14:03","246633331.0","2022-11-07","15:14:03"
"640513","Verdade","2022-11-07 15:14:26","1905734033.0","2022-11-07","15:14:26"
"640549","Avá","2022-11-07 15:20:59","5751837163.0","2022-11-07","15:20:59"
"640514","Pera, é mesmo a Débora G. Barbosa? Se for, sem chance. Essa moça mente mais que Patrícia Lelis.","2022-11-07 15:14:40","1316957083.0","2022-11-07","15:14:40"
"640517","😅kkkk","2022-11-07 15:15:06","1905734033.0","2022-11-07","15:15:06"
"640518","Para o próprio Biden e europa em geral, pesquisa ai no google","2022-11-07 15:15:07","5189287382.0","2022-11-07","15:15:07"
"640519","Olavo estava certo.
Passei a adotar. 
Ñ discuto com canhoto","2022-11-07 15:15:12","1271925737.0","2022-11-07","15:15:12"
"640520","É o lance de n respeitar q o velho falava,  eu acho. Me lembrou dele falando com o Joel Pinheiro na pan kk","2022-11-07 15:15:17","1211265513.0","2022-11-07","15:15:17"
"640522","Bolsonaro..","2022-11-07 15:15:48","246633331.0","2022-11-07","15:15:48"
"640523","Meus Deus, pqp dps dessa vou começar a rezar.","2022-11-07 15:15:57","1027503061.0","2022-11-07","15:15:57"
"640550","Ameaça De Guerra Civil Nos EUA?
https://youtu.be/e21mMu9bVRA","2022-11-07 15:21:12","1905734033.0","2022-11-07","15:21:12"
"640526","Reparou que não há políticos ou partidos exaltados nas manifestações?  É porquê  são manifestações espontâneas pra valer.  Ninguém controla.

Notou também que ainda não vimos a “maioria” que elegeu o PCC?  

A mídia, os partidos de esquerda e os grandes empresários sabem disso.  Sabem que estão fracos e não têm legitimidade e maioria.  A estratégia deles é comprar deputados, senadores e opinião pública - como faziam antes.

Contate os deputados e senadores via as mídias sociais e exija serem de oposição.  Vamos impedir o plano do PCC antes que assumam.","2022-11-07 15:16:12","660044083.0","2022-11-07","15:16:12"
"640528","Um dia desse gravaram ele andando poar...claro q não morreu kkk","2022-11-07 15:16:30","1268004268.0","2022-11-07","15:16:30"
"640529","Mas ele vai ter... Não acho que seja por nada esse apoio dos partidos de centro esauerda","2022-11-07 15:16:47","1268004268.0","2022-11-07","15:16:47"
"640533","Lembrei daquela frase ""o petróleo é nosso""","2022-11-07 15:17:35","1027503061.0","2022-11-07","15:17:35"
"640534","Ahhh naõ fala assim que melhor do que passar fome né 

A questão é ninguém sabe o plano de governo do larápio, se ele começar a taxar demais o empresário vai ficar complicado po, ai ter a oportunidade de ficar um pouco melhor de vida em outro lugar é mais abraçada do que um futuro incerto","2022-11-07 15:17:40","5783268175.0","2022-11-07","15:17:40"
"640535","Dps da possível informação derrubar o PPI e reduzir os dividendos,então vai cair mesmo.","2022-11-07 15:17:44","660044083.0","2022-11-07","15:17:44"
"640538","Eu quero saber como é o Uruguai, será que vale a pena","2022-11-07 15:18:44","5783268175.0","2022-11-07","15:18:44"
