"message_id","message","message_utc","from_id","date","time"
"641921","sim, se organiza e geral denúncia pelo mesmo motivo","2022-11-07 23:17:32","5117697194.0","2022-11-07","23:17:32"
"641923","e pq acha daora pow, se fosse alta da inflação acho que geral aqui sabe como se proteger","2022-11-07 23:18:16","5117697194.0","2022-11-07","23:18:16"
"641925","Kkkkkkkkkkkkkkkkkkkkkkkkkkkkkkkkkkkkkkkkkkkkkkkkkkkkkkkkkkkkkkkkkkkkkkkkkkkkkkkkkkkkkkkkkkkkkkkkkkkkkkkkkkkkkkkkkkkkkkkkkkkkkkkkkkkkkkkkkkkkkkkkkkkkkkkkkkkkkkkkkkkkkkkkkkkkkkkkkkkkkkk","2022-11-07 23:18:36","1094699073.0","2022-11-07","23:18:36"
"641927","PT nao vai fazer nada se a força de segurança tiver com a direita, vamos sentar o pau na esquerda","2022-11-07 23:19:23","1432577238.0","2022-11-07","23:19:23"
"641928","Cara inteligente, já vazou antes","2022-11-07 23:19:30","5776942479.0","2022-11-07","23:19:30"
"641930","Vc tem parente aqui, né?","2022-11-07 23:19:47","5615868165.0","2022-11-07","23:19:47"
"641934","Vou te falar esse pessoal identitário está fodido se eles conseguirem implantar um regime igual ao chinês aqui","2022-11-07 23:20:28","1094699073.0","2022-11-07","23:20:28"
"641935","Kkkkkkkkkkkkkkkkkkkkkkkkkkkkkkkkkkkkk","2022-11-07 23:20:40","1998598133.0","2022-11-07","23:20:40"
"641936","Namorado do Janones","2022-11-07 23:20:45","1998598133.0","2022-11-07","23:20:45"
"641937","Afrontosa a menina","2022-11-07 23:20:54","1998598133.0","2022-11-07","23:20:54"
"641938","Eu acho da hora porque primeiro, é um belo choque de realidade para os que achavam que teriam picanha e cerveja de graça.
E em segundo lugar, ajuda a forçar as pessoas para fora do Estado.
O Ancapistão","2022-11-07 23:20:57","1271925737.0","2022-11-07","23:20:57"
"641939","Vídeo de hoje","2022-11-07 23:21:02","251998304.0","2022-11-07","23:21:02"
"641940","Pessoal não conhece o Lula de verdade, aquilo odeia viado e esses LGBTs ai...","2022-11-07 23:21:03","1094699073.0","2022-11-07","23:21:03"
"641941","Ele vai reprimir igual Putin faz, ele usa esse pessoal e ninguém procura pesquisar o passado do cara a fundo.","2022-11-07 23:21:37","1094699073.0","2022-11-07","23:21:37"
"641944","Tmb acho. Vão ligar o modo Che","2022-11-07 23:21:51","5615868165.0","2022-11-07","23:21:51"
"641946","Vcs vão ver o que é uma gay reivindicando seus direitos, mana","2022-11-07 23:21:59","1998598133.0","2022-11-07","23:21:59"
"641947","Com toda certeza, pior que eu não vejo futuro até tranquei meu curso depois que eu vi a descondenado voltando a ser elegível percebi que meu diploma não ia valer nada, aliás já não vale muito.","2022-11-07 23:22:00","1027503061.0","2022-11-07","23:22:00"
"641948","Faz o L","2022-11-07 23:22:25","28970104.0","2022-11-07","23:22:25"
"641950","Exatamente o que penso, tenho amigo gay, que ficou fazendo fotinha fazendo o L, mal sabe... Eu espero que ele não faça isso, mas na ditadura só ganha o pesssoal do alto escalão, o resto e escravo, só sei que eu nunca vi um regime comunista favorável à lgbts","2022-11-07 23:23:00","5615868165.0","2022-11-07","23:23:00"
"641951","Eu vi hein mano, belos peitos kkkkkkkk","2022-11-07 23:23:14","1998598133.0","2022-11-07","23:23:14"
"641954","Coloquei discurso extremista","2022-11-07 23:23:33","2103264782.0","2022-11-07","23:23:33"
"641958","acho que nem vale a pena ficar denunciando perfil, melhor é pegar os dados do cara, ameaçar usar ou espalhar....","2022-11-07 23:24:28","5117697194.0","2022-11-07","23:24:28"
"641961","Brother...
Em um País que temos uma piiiiiiii desse nível na suprema corte, tu quer o que?","2022-11-07 23:25:27","1271925737.0","2022-11-07","23:25:27"
"641964","💉💉 DIGA NÃO AS VACINAS 💉💉


Olá galera antivacx.. voltamos com tudo e com o serviço de excelência de sempre! 

Lançando com datas retroativas e respeitando o espaçamento entre as doses! 

🔒 Pague após conferir no app conectasus suas doses! 

👉 Documentos que precisamos para vacinar CPF ou CNS.

👉 Temos milhares de referências de familias inteiras que já utilizaram nosso serviço.

👉 Vacinamos todas as idades permitidas no programa nacional de vacinação.


𝑵𝒂𝒐 𝒄𝒉𝒂𝒎𝒆 𝒆𝒔𝒕𝒆 𝒏𝒖𝒎𝒆𝒓𝒐 𝒑𝒐𝒊𝒔 𝒖𝒔𝒂𝒎𝒐𝒔 𝒔𝒐𝒎𝒆𝒏𝒕𝒆 𝒑𝒓𝒂 𝒅𝒊𝒗𝒖𝒍𝒈𝒂𝒄𝒂𝒐.


🄲🄷🄰🄼🄴 👉👉 @certificadodevacina. 👈👈","2022-11-07 23:25:52","5519985642.0","2022-11-07","23:25:52"
"641965","Pessoal do STF estão nesse momento preocupados, os caras são foda, deixaram o relatório pra depois das eleições americanas isso significa que pode estar tudo armado com o Trump já para um apoio de eventual anulação das eleições e ruptura.","2022-11-07 23:26:29","1094699073.0","2022-11-07","23:26:29"
"641966","ué... quem mandou fraudar as eleições. agora sentirão o aço","2022-11-07 23:27:25","165399610.0","2022-11-07","23:27:25"
"641968","Deus te ouça","2022-11-07 23:27:45","844720961.0","2022-11-07","23:27:45"
"641969","""Ain morais só vai ser dessa vez ok""","2022-11-07 23:27:46","1027503061.0","2022-11-07","23:27:46"
"641970","ancapistao acho impossível, se o estado descobrir, vai taxar oq puder quem sabe até criminalizar....","2022-11-07 23:28:06","5117697194.0","2022-11-07","23:28:06"
"641971","muito obrigado, caue🤙🏾","2022-11-07 23:28:06","1820965869.0","2022-11-07","23:28:06"
"641972","isso já merecia um impeachment","2022-11-07 23:28:17","165399610.0","2022-11-07","23:28:17"
"641973","Também acho meio utópico a insistência total de Estado, porém pode servir para as pessoas se conscientizarem da necessidade de cada vez depender menos dele","2022-11-07 23:28:59","1271925737.0","2022-11-07","23:28:59"
"641974","Exatamente, isso dá um ódio enorme esse vermes de toga acham que são deuses.","2022-11-07 23:29:04","1027503061.0","2022-11-07","23:29:04"
"641975","Europa, Canadá e América do Sul podem sancionar caso haja mesmo ruptura, mas se os EUA não fizerem estamos bem, o Putin bloqueando qualquer sanção do conselho de da ONU está ótimo.","2022-11-07 23:29:26","1094699073.0","2022-11-07","23:29:26"
"641977","Vergonha","2022-11-07 23:29:44","1027503061.0","2022-11-07","23:29:44"
"641978","Eu comprei uma dose a um contato que achei aqui porém não me lembro qual foi, caiu em algumas hora no sistema do SUS","2022-11-07 23:30:35","1027503061.0","2022-11-07","23:30:35"
"641979","Olha o que me lembrou KKKKKKKKKKKKKK","2022-11-07 23:30:48","165399610.0","2022-11-07","23:30:48"
"641980","Comando Militar Sudeste SP - 07/11/2022 19h","2022-11-07 23:31:10","752745694.0","2022-11-07","23:31:10"
"641983","Não me lembro 😐","2022-11-07 23:32:32","1027503061.0","2022-11-07","23:32:32"
"641984","Havia formatado o Cell e acabei perdendo os ctts","2022-11-07 23:32:48","1027503061.0","2022-11-07","23:32:48"
"641987","É  revoltante essa polidez  forçada.","2022-11-07 23:34:35","373134596.0","2022-11-07","23:34:35"
"641988","Olha um ANCAP.
Será?","2022-11-07 23:35:10","1238937928.0","2022-11-07","23:35:10"
"641989","Aew, nos representando.","2022-11-07 23:35:26","1027503061.0","2022-11-07","23:35:26"
"641990","por isso mandei =)","2022-11-07 23:36:00","752745694.0","2022-11-07","23:36:00"
"641992","G Monteiro foi a preso, a consequência de peitar o sistema","2022-11-07 23:36:31","5413659844.0","2022-11-07","23:36:31"
"642033","exato","2022-11-07 23:49:18","165399610.0","2022-11-07","23:49:18"
"642003","Pra surpresa de zero pessoas","2022-11-07 23:37:00","369741261.0","2022-11-07","23:37:00"
"642004","Veja como a esquerda  é,  estão todos  unidos.","2022-11-07 23:37:03","373134596.0","2022-11-07","23:37:03"
"642006","Enquanto  tinha gente do lado de cá  pregando voto nulo.","2022-11-07 23:37:35","373134596.0","2022-11-07","23:37:35"
"642007","Boulos é  praticamente um sucessor  do Lula.","2022-11-07 23:38:17","373134596.0","2022-11-07","23:38:17"
"642008","Esse corno marcou de aparecer num buteco daqui de Brasília pra dialogar. Isso é um mal caráter da pior espécie.","2022-11-07 23:39:59","1095521815.0","2022-11-07","23:39:59"
"642009","Pior governo será o do Lulo, caso ele assuma na roubalheira","2022-11-07 23:40:42","5615868165.0","2022-11-07","23:40:42"
"642010","Pra eles sempre será o melhor","2022-11-07 23:41:36","1512300638.0","2022-11-07","23:41:36"
"642034","Por mim eles morram de fome","2022-11-07 23:49:18","1998598133.0","2022-11-07","23:49:18"
"642013","procede ou não?","2022-11-07 23:42:09","159940265.0","2022-11-07","23:42:09"
"642016","A ideia de taxar o pix diziam, a boca pequena, que era uma moeda de troca para os Farialimers...","2022-11-07 23:43:10","1271925737.0","2022-11-07","23:43:10"
"642018","Números dizem algo por traz principalmente o numero 33 por isso eles usam a todo tempo, basta assistir esse vídeo que irão entender o significado de alguns.","2022-11-07 23:44:09","1094699073.0","2022-11-07","23:44:09"
"642019","Fake né? Mas a ideia parece querer sair msm","2022-11-07 23:44:28","1268004268.0","2022-11-07","23:44:28"
"642020","A situação  agora  é  essa .","2022-11-07 23:44:31","373134596.0","2022-11-07","23:44:31"
"642022","e nada de refutarem o argentino","2022-11-07 23:45:24","165399610.0","2022-11-07","23:45:24"
"642024","Culpa da Constituição Antidemocrática de 1988 que prevê o direito à protesto.","2022-11-07 23:45:37","1271925737.0","2022-11-07","23:45:37"
"642025","https://www.dw.com/pt-br/tribunal-alem%C3%A3o-considera-urnas-eletr%C3%B4nicas-inconstitucionais/a-4070568","2022-11-07 23:45:45","165399610.0","2022-11-07","23:45:45"
"642026","estas urnas nunca mais devem ser utilizadas","2022-11-07 23:45:56","165399610.0","2022-11-07","23:45:56"
"642028","Não tem como refutar aquilo","2022-11-07 23:46:02","1271925737.0","2022-11-07","23:46:02"
"642029","olha o que o consórcio de bosta ficou fazendo esses dias","2022-11-07 23:46:29","165399610.0","2022-11-07","23:46:29"
"642030","Já era de se imaginar.
Até por que , a galerê do consórcio de qi 50 não faria nada melhor que isso","2022-11-07 23:48:47","1271925737.0","2022-11-07","23:48:47"
"642031","nem colocaram 1 puto miçangueiro deles da área de exatas para refutar","2022-11-07 23:49:13","165399610.0","2022-11-07","23:49:13"
"642032","Eu falo, eu falo todo dia que é pra parar de dar ibope pra esses bandidos","2022-11-07 23:49:13","1998598133.0","2022-11-07","23:49:13"
"642035","ficar batendo palma pra louco","2022-11-07 23:49:25","165399610.0","2022-11-07","23:49:25"
"642036","Concordo.","2022-11-07 23:49:37","1271925737.0","2022-11-07","23:49:37"
"642037","deixar falando sozinhos...","2022-11-07 23:49:46","752745694.0","2022-11-07","23:49:46"
"642038","Ainda não to convicta disso, só estarei se essa semana não tiver nenhuma novidade positiva e o povo desistir de protestar, caso contrário manterei as minhas esperanças.","2022-11-07 23:50:22","5615868165.0","2022-11-07","23:50:22"
"642039","Nos alimentamos eles.
As pessoas ficam usando aquela merda de maquininha do PagSeguro do UOL...
Ou assistindo BBB para ter o que criticar...
As pessoas NAO ACORDAM","2022-11-07 23:50:31","1271925737.0","2022-11-07","23:50:31"
"642040","man, ninguém tem a mínima ideia do que vai acontecer nos próximos dias. algo que será colocado em livros de história no futuro.","2022-11-07 23:50:52","165399610.0","2022-11-07","23:50:52"
"642041","Eu ESPERO que não falte coragem para ser feito o que tem que ser feito","2022-11-07 23:51:26","1271925737.0","2022-11-07","23:51:26"
"642042","não tem como retroceder mais","2022-11-07 23:52:02","165399610.0","2022-11-07","23:52:02"
"642044","Surreal o nível de canalhice. São tipo a imprensa estatal chinesa, 0 autonomia e as outras são sempre mais do mesmo.","2022-11-07 23:52:05","5615868165.0","2022-11-07","23:52:05"
"642045","Espero q sim e pro lado bom.","2022-11-07 23:52:09","5709350985.0","2022-11-07","23:52:09"
"642046","Que você esteja certo , meu caro
( sinceramente)","2022-11-07 23:52:23","1271925737.0","2022-11-07","23:52:23"
"642047","José Genuíno, revela:  ""Temos que controlar as igrejas sem eles perceberem pra não ficar parecendo perseguição religiosa.""","2022-11-07 23:52:31","942831895.0","2022-11-07","23:52:31"
"642048","Eles perderam há muito qualquer pudor","2022-11-07 23:52:42","1271925737.0","2022-11-07","23:52:42"
"642049","Dessa vez a gente que tem que escrever os livros para eles não distorceram a história.","2022-11-07 23:53:16","5615868165.0","2022-11-07","23:53:16"
"642050","Esse deveria ter sido proibido de entrar , como tantos outros, de volta ao Brasil.
Puta erro histórico","2022-11-07 23:53:17","1271925737.0","2022-11-07","23:53:17"
"642051","José Maria tá na mesma quadra que  o Peter. puta que pariu","2022-11-07 23:53:23","165399610.0","2022-11-07","23:53:23"
"642052","confundiram nossa benevolência com fraqueza. agora sentirão o gosto do aço.","2022-11-07 23:53:49","165399610.0","2022-11-07","23:53:49"
"642053","A questao é que ninguém quer perder a boquinha; foda se o País.","2022-11-07 23:54:01","1271925737.0","2022-11-07","23:54:01"
"642054","Que assim seja","2022-11-07 23:54:25","1271925737.0","2022-11-07","23:54:25"
"642055","quanto a isso, verão que o povo não retrocederá","2022-11-07 23:54:27","165399610.0","2022-11-07","23:54:27"
"642057","O José Maria sempre jogou assim, mas o Peter me surpreendeu","2022-11-07 23:55:04","5615868165.0","2022-11-07","23:55:04"
"642058","Sinceramente? 
A quantidade de crimes praticadas pela suprema corte é tão extensa que qualquer País minimamente decente já teria colocado todos na cadeia.
Ou no mínimo, afastado de suas funções","2022-11-07 23:55:18","1271925737.0","2022-11-07","23:55:18"
"642059","a beleza de tudo, que a ciência permite que o mesmo experimento científico seja reproduzido em qq lugar. estão fodidos","2022-11-07 23:55:19","165399610.0","2022-11-07","23:55:19"
"642062","os progressistas estão vindo forte, para tudo arrumam uma desculpa, nunca a culpa é do estado em si...","2022-11-07 23:55:59","5117697194.0","2022-11-07","23:55:59"
"642064","Aí vem uma galera dizer que o Brasil pode sofrer sanções internacionais e pi pi pó pó...
Caras...
Alimentanos 1/5 do planeta.
As pessoas não comem chips, nem carros, nem bagulho do Aliespress","2022-11-07 23:56:23","1271925737.0","2022-11-07","23:56:23"
"642065","Meio termo","2022-11-07 23:56:38","1349772743.0","2022-11-07","23:56:38"
"642066","Guerra civil é questão de tempo.","2022-11-07 23:56:55","5153009130.0","2022-11-07","23:56:55"
"642067","essa merda já tá valendo?","2022-11-07 23:56:57","5117697194.0","2022-11-07","23:56:57"
"642068","Claro.
Que não tem a coragem de assumir seus próprios erros","2022-11-07 23:57:02","1271925737.0","2022-11-07","23:57:02"
"642069","No fim, talvez seja uma ótima solução","2022-11-07 23:57:19","1271925737.0","2022-11-07","23:57:19"
"642070","Acho que não. 
Eles não assumiram ainda 
Mas não tenha dúvidas que vai ser implementado","2022-11-07 23:57:49","1271925737.0","2022-11-07","23:57:49"
"642072","Pois é, e ainda por cima parece que o pessoal no exterior, exceto uma parte da imprensa tendenciosa, já acredita em fraude, entao não tem como botar na conta da gente, a gente tá protestando por liberadade e contra a roubalheira, censura, dictatorship","2022-11-07 23:59:25","5615868165.0","2022-11-07","23:59:25"
"638320","tata volta pro fogo gratis","2022-11-07 00:02:17","5479009099.0","2022-11-07","00:02:17"
"638307","Boa noite família","2022-11-07 00:00:40","1543701104.0","2022-11-07","00:00:40"
"638303","Ignora. É um retardado de 16 anos do grupo.","2022-11-07 00:00:10","1565431785.0","2022-11-07","00:00:10"
"638306","Passa o dia batendo bronha ai fica burro desse jeito","2022-11-07 00:00:38","1565431785.0","2022-11-07","00:00:38"
"638641","*auto","2022-11-07 01:25:41","5629217560.0","2022-11-07","01:25:41"
"638308","Quem tem o link da live do argentino parte 2?","2022-11-07 00:00:56","1543701104.0","2022-11-07","00:00:56"
"638310","Mas é uma boa ideia acreditar no TSE, segundo Peter","2022-11-07 00:01:07","844720961.0","2022-11-07","00:01:07"
"638315","Segunda Live do Argentino sobre fraudes nas urnas brasileiras.

Compartilha antes que a gente seja censurado pelo TSE.

#aviso","2022-11-07 00:01:30","1565431785.0","2022-11-07","00:01:30"
"638316","Obrigado amigo, você é um amigo","2022-11-07 00:01:31","1543701104.0","2022-11-07","00:01:31"
"638317","Nao era de garotas de 10 anos que vc curte?  
Kkkkkkk","2022-11-07 00:01:45","1526499278.0","2022-11-07","00:01:45"
"638319","Nome do filme ""Ted"" 16+ 2012 ‧ Comédia/Fantasia ‧ 1h 46m.","2022-11-07 00:02:05","976404011.0","2022-11-07","00:02:05"
"638321","vc sabe que ele mandou aqui para nos denunciar ne ?","2022-11-07 00:02:23","1432577238.0","2022-11-07","00:02:23"
"638323","Esse o Alex já derrubou","2022-11-07 00:02:27","1543701104.0","2022-11-07","00:02:27"
"638324","🤫.","2022-11-07 00:02:43","5479009099.0","2022-11-07","00:02:43"
"638325","Mlk, sai do grupo, vc não é bem vindo aqui","2022-11-07 00:02:47","1565431785.0","2022-11-07","00:02:47"
"638327","duente","2022-11-07 00:03:17","5479009099.0","2022-11-07","00:03:17"
"638328","Quando a gasolina chagar a 12 pila e só chegar no frentista e falar, o amor venceu e fazer o L","2022-11-07 00:03:29","5272033339.0","2022-11-07","00:03:29"
"638332","Vou seguir e comprar deles kkkkk","2022-11-07 00:03:48","682262277.0","2022-11-07","00:03:48"
"638333","Cala a boca mlk, cai fora do grupo, ninguem te quer aqui","2022-11-07 00:04:03","1565431785.0","2022-11-07","00:04:03"
"638334","Confira ""Element - Mensageiro Seguro""
https://play.google.com/store/apps/details?id=im.vector.app","2022-11-07 00:04:17","634223840.0","2022-11-07","00:04:17"
"638335","vai se tratar home, ou cai fora","2022-11-07 00:04:24","1432577238.0","2022-11-07","00:04:24"
"638336","O TSE está banindo grupo atoa","2022-11-07 00:04:36","634223840.0","2022-11-07","00:04:36"
"638338","E forma muitos, até pessoas estão bloqueando no Brasil","2022-11-07 00:04:46","634223840.0","2022-11-07","00:04:46"
"638339","Tem uma galerinha organizada só pra denunciar grupos e canais. É engraçado eles discutindo sobre a gente.","2022-11-07 00:05:04","1565431785.0","2022-11-07","00:05:04"
"638344","O vpn não funciona mais","2022-11-07 00:06:05","634223840.0","2022-11-07","00:06:05"
"638345","O bloqueio é pelo número de celular","2022-11-07 00:06:13","634223840.0","2022-11-07","00:06:13"
"638346","Se for +55 não aparece","2022-11-07 00:06:19","634223840.0","2022-11-07","00:06:19"
"638347","infiltrado msm?","2022-11-07 00:06:30","5479009099.0","2022-11-07","00:06:30"
"638348","Alguem sabe como muda a localização de Brasil para outro país? Eles fazem isso lá na China, mas tô com preguiça de procurar tutorial","2022-11-07 00:06:51","1124212273.0","2022-11-07","00:06:51"
"638352","Vpn","2022-11-07 00:07:10","634223840.0","2022-11-07","00:07:10"
"638354","será que compensa pedir pra banir?","2022-11-07 00:07:20","5479009099.0","2022-11-07","00:07:20"
"638357","To no VPN e n adianta para ver canal bloqueado","2022-11-07 00:07:28","1124212273.0","2022-11-07","00:07:28"
"638359","Por que é pelo código do Brasil que estão bloqueando","2022-11-07 00:07:44","634223840.0","2022-11-07","00:07:44"
"638360","o jeito e comprar um número de fora..","2022-11-07 00:07:46","5479009099.0","2022-11-07","00:07:46"
"638361","O +55","2022-11-07 00:07:48","634223840.0","2022-11-07","00:07:48"
"638362","Se for número americanos funciona normal","2022-11-07 00:08:01","634223840.0","2022-11-07","00:08:01"
"638363","Nao, so ignora. Um cara foi banido injustamente e deixaram esse mlk aj","2022-11-07 00:08:05","1565431785.0","2022-11-07","00:08:05"
"638365","Nada, so pegar um numero gratis na net","2022-11-07 00:08:28","1565431785.0","2022-11-07","00:08:28"
"638366","Eu lembro que era fácil conseguir usso","2022-11-07 00:08:43","1565431785.0","2022-11-07","00:08:43"
"638367","mas compra um número e depois perder deve ser foda kk","2022-11-07 00:08:56","5479009099.0","2022-11-07","00:08:56"
"638369","Auditoria - 1 e 2","2022-11-07 00:09:10","165399610.0","2022-11-07","00:09:10"
"638372","Não é usado no Brasil né?","2022-11-07 00:09:44","656263791.0","2022-11-07","00:09:44"
"638374","Não, infelizmente","2022-11-07 00:10:01","1024326623.0","2022-11-07","00:10:01"
"638396","Me envia pelo privado?","2022-11-07 00:16:35","1124212273.0","2022-11-07","00:16:35"
"638380","https://matrix.to/#/#libertarianismobrasil:matrix.org","2022-11-07 00:11:09","634223840.0","2022-11-07","00:11:09"
"638381","Grupo libertario da rede Matrix","2022-11-07 00:11:16","634223840.0","2022-11-07","00:11:16"
"638385","Me arrumar 1 é humilde ein","2022-11-07 00:11:41","5117697194.0","2022-11-07","00:11:41"
"638388","Como faz isso?","2022-11-07 00:12:18","1124212273.0","2022-11-07","00:12:18"
"638401","Excelente, permitem a direita continuar ""disputando"" as eleições e perdendo pras urnas e não pro adversário","2022-11-07 00:18:56","541381854.0","2022-11-07","00:18:56"
"638403","Tem um vídeo do Visão Libertária falando que ela frequentou a Escolinha do Professor Schwab","2022-11-07 00:20:23","187882185.0","2022-11-07","00:20:23"
"638404","Deve ser bem antenada nessas merdas progrelixos mesmo","2022-11-07 00:21:05","187882185.0","2022-11-07","00:21:05"
"638405","https://twitter.com/JosianoPadovani/status/1589395235787808768?t=TqKm_DuHbMPTtoxD3uqinA&s=19","2022-11-07 00:22:22","5751837163.0","2022-11-07","00:22:22"
"638427","Kkkk","2022-11-07 00:36:30","1095521815.0","2022-11-07","00:36:30"
"638407","Elon musk respondeu a esse twitter vão lá","2022-11-07 00:22:39","5751837163.0","2022-11-07","00:22:39"
"638408","💉💉 DIGA NÃO AS VACINAS 💉💉


Olá galera antivacx.. voltamos com tudo e com o serviço de excelência de sempre! 

Lançando com datas retroativas e respeitando o espaçamento entre as doses! 

🔒 Pague após conferir no app conectasus suas doses! 

👉 Documentos que precisamos para vacinar CPF ou CNS.

👉 Temos milhares de referências de familias inteiras que já utilizaram nosso serviço.

👉 Vacinamos todas as idades permitidas no programa nacional de vacinação.


𝑵𝒂𝒐 𝒄𝒉𝒂𝒎𝒆 𝒆𝒔𝒕𝒆 𝒏𝒖𝒎𝒆𝒓𝒐 𝒑𝒐𝒊𝒔 𝒖𝒔𝒂𝒎𝒐𝒔 𝒔𝒐𝒎𝒆𝒏𝒕𝒆 𝒑𝒓𝒂 𝒅𝒊𝒗𝒖𝒍𝒈𝒂𝒄𝒂𝒐.


🄲🄷🄰🄼🄴 👉👉 @certificadodevacina. 👈👈","2022-11-07 00:23:06","5519985642.0","2022-11-07","00:23:06"
"638412","Alguém confia nesses serviços? N consigo confiar o CPF na mão de um estranho kkk","2022-11-07 00:25:43","5465063586.0","2022-11-07","00:25:43"
"638414","Não dá para discordar. Agora se arregarmos, acabou o pouco da liberdade que já tínhamos.","2022-11-07 00:26:11","1316957083.0","2022-11-07","00:26:11"
"638415","Só não fazer, mano... Já fiz de várias pessoas","2022-11-07 00:27:26","5519985642.0","2022-11-07","00:27:26"
"638429","😂😂😂😂😂","2022-11-07 00:38:03","768423015.0","2022-11-07","00:38:03"
"638416","2 doses de Pfizer PEDIÁTRICA, 300 reais cada dose.... 

Mais uma criança salva do genocídio da NOM!


#vacina #certificadodevacina #sus #conectesus","2022-11-07 00:27:37","5519985642.0","2022-11-07","00:27:37"
"638421","Alguém pode mandar os memes e videos de picanha e faz o L aí por favor? picanha metaforica picanha de mortadela etc... vou mandar pra um petista que acabou de ser demitido aqui.","2022-11-07 00:31:09","1095521815.0","2022-11-07","00:31:09"
"638422","Não acho, eu inclusive vou pedir 54 números pra ele de 0 a 60 e jogar os 6 que sobrarem na mega sena","2022-11-07 00:31:23","541381854.0","2022-11-07","00:31:23"
"638432","Esmagar a rata é muito engraçado","2022-11-07 00:41:26","844720961.0","2022-11-07","00:41:26"
"638433","🚨 OPORTUNIDADE DE OURO

Há pouco, Elon Musk pediu mais informações sobre a censura que vem ocorrendo no Brasil a um usuário do Twitter!

É HORA DE INUNDAR AS RESPOSTAS COM VÍDEOS DAS MANIFESTAÇÕES E TUDO MAIS QUE PUDEREM COMPARTILHAR SOBRE ESSE MOMENTO ESCANDALOSO QUE ESTAMOS VIVENDO!

COMPARTILHE EM TODOS OS GRUPOS E COM TODOS QUE PUDER! 

Quem não tiver Twitter, por favor, baixe o aplicativo, crie uma conta e ajude nessa corrente!

⬇️ LINK DO TWEET DE ELON
https://twitter.com/elonmusk/status/1589395363353743360","2022-11-07 00:41:53","844720961.0","2022-11-07","00:41:53"
"638436","Angolano também kk","2022-11-07 00:43:03","844720961.0","2022-11-07","00:43:03"
"638437","Por isso apenas chamo ele de Frouxonaro","2022-11-07 00:43:21","844720961.0","2022-11-07","00:43:21"
"638456","Adoro o Peter,mas ele tá estranho desde o começo da guerra","2022-11-07 00:49:37","5629217560.0","2022-11-07","00:49:37"
"638458","Pra compartilhar com amigo estrangeiro 5","2022-11-07 00:49:49","1269740476.0","2022-11-07","00:49:49"
"638461","Dificil saber a veracidade disso.. 😂","2022-11-07 00:50:22","1124212273.0","2022-11-07","00:50:22"
"638464","Pois é,isso me surpreendeu","2022-11-07 00:50:51","5629217560.0","2022-11-07","00:50:51"
"638469","Veja bem, confiar no TSE é uma boa ideia","2022-11-07 00:51:13","844720961.0","2022-11-07","00:51:13"
"638472","Abusando da boa fé das pessoas","2022-11-07 00:51:31","1203787813.0","2022-11-07","00:51:31"
"638474","E pintando sarjetas","2022-11-07 00:51:36","5629217560.0","2022-11-07","00:51:36"
"638477","https://twitter.com/elonmusk/status/1589419469020942336?t=2ul2SSG1Eh1SVJHGxceEsA&s=19","2022-11-07 00:51:53","5751837163.0","2022-11-07","00:51:53"
"638480","Elon tá com a gente","2022-11-07 00:52:07","5751837163.0","2022-11-07","00:52:07"
"638485","https://youtube.com/shorts/Ehnq_2yzT38?feature=share","2022-11-07 00:53:58","301817880.0","2022-11-07","00:53:58"
"638525","Bora Elon","2022-11-07 01:01:41","1003332464.0","2022-11-07","01:01:41"
