"message_id","message","message_utc","from_id","date","time"
"688608","https://tribunanacional.com.br/noticia/4735/papa-francisco-admite-que-um-demonio-elegante-esta-a-espreita-no-vaticano#.Y6TUNPoppjU.telegram
Papa Francisco admite que um 'demônio elegante' está à espreita no Vaticano

O Papa Francisco alertou os cardeais que trabalham nos escritórios do Vaticano de que um “demônio elegante” está à espreita entre eles.","2022-12-22 22:05:08","5024946675.0","2022-12-22","22:05:08"
"688232","🐂","2022-12-22 13:59:48","5676856688.0","2022-12-22","13:59:48"
"688305","Kkkkkkkkkk","2022-12-22 15:52:45","406651357.0","2022-12-22","15:52:45"
"688430","Vai nada","2022-12-22 19:26:29","1594279744.0","2022-12-22","19:26:29"
"688490","MT bom kkkk","2022-12-22 21:07:54","1027503061.0","2022-12-22","21:07:54"
"687984","*PESSOAL COM ESSE NOVO GOVERNO , A CERTEZA É  QUE VÃO QUERER EXIGIR TUDO ,INCLUSIVE  O DIREITO DE IR E VIR , COM ISSO VÃO  SE TORNAR OBRIGATÓRIO A PESSOA ENTRAR NOS LOCAIS E TER QUE APRESENTAR CERRIFICADO DE VACINA*

*SABEMOS TODOS OS RISCOS DESSA VACINA MATANDO MUITOS IRMÃOS,  ENTÃO  A FORMA DE ESCAPAR DISSO É  OBTER O CERTIFICADO DE VACINA SEM QUE ELA SEJA APLICADA EM SEU CORPO*


*COLOCAMOS AS DOSES NO SISTEMA DO CONECTE SUS (ENTRA NA HORA) E  VOCE SE LIVRA DISSO, AS DOSES SÃO LANÇADAS EM DATAS RETROATIVAS*

*APROVEITE PREÇOS ESPECIAIS PARA ESSAS DOSES*

TELEGRAM:     @certificadodevacina2
                           @certificadodevacina4","2022-12-22 00:07:23","5650509127.0","2022-12-22","00:07:23"
"687985","VACINAS NO CONECTESUS COM @certificadodevacina2 ou @certificadodevacina4","2022-12-22 00:07:23","5650509127.0","2022-12-22","00:07:23"
"687986","Vai apreender pra ele","2022-12-22 00:08:14","2103264782.0","2022-12-22","00:08:14"
"687987","E o STM é composto, em sua maioria, de militares das FFAA. E tem gente que acredita que esses aspones vão fazer alguma coisa... é um bando de velhinho que só quer aproveitar a vida boa... tem medo de papelzinho rabiscado","2022-12-22 00:08:33","187882185.0","2022-12-22","00:08:33"
"687988"," O delegado Rodrigo Morais Fernandes,que investigou a facada dada por Adélio Bispo em Jair Bolsonaro durante a campanha eleitoral de 2018, terá cargo chave na Polícia Federal na gestão Luiz Inácio Lula da Silva (PT).

O policial foi escolhido para liderar a diretoria de Inteligência da Polícia Federal. A participação do delegado no novo governo já era dada como certa","2022-12-22 00:16:24","1587555802.0","2022-12-22","00:16:24"
"687992","A maioria foi indicado lá pelo PT","2022-12-22 00:28:51","5413659844.0","2022-12-22","00:28:51"
"687993","Alguém tem dúvida de quem foi o mandante ?","2022-12-22 00:29:14","5413659844.0","2022-12-22","00:29:14"
"687994","BOLSONARO renova CONCESSÃO da GLOBO e de outras EMPRESAS: MAIS um VEZ, ele FEZ o que era CERTO
@ ANCAPSU","2022-12-22 00:33:58","1103049455.0","2022-12-22","00:33:58"
"687995","“Fez o que era certo” liberalzinho do caralho.

“Jogar nas 4 linhas”

Não fode, em festa de rola entra com o cu!  Trouxa!","2022-12-22 00:34:51","1163352532.0","2022-12-22","00:34:51"
"687996","Ancap o caralho, é liberal de sapatênis essa porra, só que com um malboro na mesa, aí acha que virou o rebelde. 

Pau no cu do estado e das letrinhas em papel","2022-12-22 00:36:13","1163352532.0","2022-12-22","00:36:13"
"687997","o que ia adiantar ele negar a concessão","2022-12-22 00:36:27","1328638661.0","2022-12-22","00:36:27"
"687998","o stf ia anular na mesma hora","2022-12-22 00:36:43","1328638661.0","2022-12-22","00:36:43"
"687999","Mas não seria censura não renovar?","2022-12-22 00:36:44","1068242909.0","2022-12-22","00:36:44"
"688021","Corre que o cara tá puto, eh briga de rua caraio","2022-12-22 00:42:33","410594166.0","2022-12-22","00:42:33"
"688000","Daniel Silveira votou sim. Taí, seu bando de trouxa que acredita em PTB.","2022-12-22 00:37:13","983236334.0","2022-12-22","00:37:13"
"688001","Nada, só bagunça a porra do coreto","2022-12-22 00:37:45","1163352532.0","2022-12-22","00:37:45"
"688002","Foda-se.

Você tava no país? Viu o que fizeram?","2022-12-22 00:38:01","1163352532.0","2022-12-22","00:38:01"
"688004","Foi uma pergunra honesta pô kk","2022-12-22 00:38:25","1068242909.0","2022-12-22","00:38:25"
"688005","Bolsonaro é um verme que rasteja pela terra, como qualquer outro político...","2022-12-22 00:38:26","121406592.0","2022-12-22","00:38:26"
"688006","É briga de rua, irmão.
Não é uma esgrima para ficar bonitão todo pimpão fazendo pose","2022-12-22 00:38:28","1163352532.0","2022-12-22","00:38:28"
"688007","É chute no saco e dedo no olho","2022-12-22 00:38:41","1163352532.0","2022-12-22","00:38:41"
"688008","Mas o outro era pior","2022-12-22 00:38:58","1163352532.0","2022-12-22","00:38:58"
"688009","Cara não teria efeito prático, não teria censura","2022-12-22 00:39:49","1163352532.0","2022-12-22","00:39:49"
"688010","Seria só uma forma de não dobrar joelho e causar dor de cabeça, da mesma forma que a esquerda faz com todo mundo que não é da gangue","2022-12-22 00:40:21","1163352532.0","2022-12-22","00:40:21"
"688011","Mas qual seria o motivo para não renovar? Não é indiferente?","2022-12-22 00:40:26","1068242909.0","2022-12-22","00:40:26"
"688035","Iniciativa Privada, Ucrani""ANCAP""Su","2022-12-22 01:02:50","1179669304.0","2022-12-22","01:02:50"
"688012","Bolsonaro é um agente do pt","2022-12-22 00:40:52","1941884372.0","2022-12-22","00:40:52"
"688013","Tipo, apenas para desrespeitar a máfia?","2022-12-22 00:40:55","1068242909.0","2022-12-22","00:40:55"
"688014","Precisa de algum outro motivo?","2022-12-22 00:41:45","1163352532.0","2022-12-22","00:41:45"
"688015","Discordo","2022-12-22 00:41:50","1163352532.0","2022-12-22","00:41:50"
"688016","Ele é de outra gangue","2022-12-22 00:41:55","1163352532.0","2022-12-22","00:41:55"
"688017","Mas de todas as gangues o PT é a pior","2022-12-22 00:42:11","1163352532.0","2022-12-22","00:42:11"
"688019","Missão dada, missão cumprida.","2022-12-22 00:42:31","5128277798.0","2022-12-22","00:42:31"
"688022","Boy  , o cara avançou agenda petista, so colocou esquerdista pra regular os cac, antes era mais facil ter fuzil do que hoje em dia","2022-12-22 00:44:46","1941884372.0","2022-12-22","00:44:46"
"688024","Mas então não é grande coisa ele ter renovado.","2022-12-22 00:45:42","1068242909.0","2022-12-22","00:45:42"
"688025","boa noite, alguem pode me ajudar? alguem ja teve problema pra iniciar a BISQ? sempre utlizei a plataforma mas agora ela nao abre mais","2022-12-22 00:45:46","713978752.0","2022-12-22","00:45:46"
"688027","Ja trocaram o gay?","2022-12-22 00:52:51","1587555802.0","2022-12-22","00:52:51"
"688041","Peter que vá pra uma ilha com o wilson aquela bola","2022-12-22 01:05:35","1533455799.0","2022-12-22","01:05:35"
"688028","Você tá viajando.
Era virtualmente impossível você ter um fuzil antes.","2022-12-22 00:56:42","1163352532.0","2022-12-22","00:56:42"
"688029","Agora só é proibitivo por conta dos preços, mas se vc tem bala na agulha consegue","2022-12-22 00:57:02","1163352532.0","2022-12-22","00:57:02"
"688030","Faz, ele arregou todas as vezes que pode!","2022-12-22 00:57:27","1163352532.0","2022-12-22","00:57:27"
"688031","É um frouxo","2022-12-22 00:57:31","1163352532.0","2022-12-22","00:57:31"
"688032","Frouxonaro","2022-12-22 00:58:00","1163352532.0","2022-12-22","00:58:00"
"688033","Tudo porquê o cabeça de roll-on tem um ""parça"" no comando","2022-12-22 01:00:57","1179669304.0","2022-12-22","01:00:57"
"688036","Bolsonaro indicar amigo ao comando da PF: Inconstitucional 
Flavio Dino indicar amigo comuna à chefia da Pf: Constitucional e belo
Quero ver se os 🐷 vão reclamar de “interferência política do executivo na PF” pelos próximos 4 anos","2022-12-22 01:02:52","5413659844.0","2022-12-22","01:02:52"
"688037","Pensei que era da CIA","2022-12-22 01:02:52","1679980294.0","2022-12-22","01:02:52"
"688038","Muito bem dito. Um boicote silencioso é a forma mais classuda e correta de não perder tempo com quem chega nesses extremos, e de também não recomendar que amigos vão lá. Simples! Cada um age da maneira que achar melhor nesses casos.","2022-12-22 01:04:15","1179669304.0","2022-12-22","01:04:15"
"688040","Bolsonaro arregou, virou putinha da Globo. Agora fudeu de vez, sorte tem o Peter que vai mudar para Portugal","2022-12-22 01:05:17","631941985.0","2022-12-22","01:05:17"
"688042","véio do saco do caralho","2022-12-22 01:05:48","1533455799.0","2022-12-22","01:05:48"
"688043","Ela é a ""dita cuja""?","2022-12-22 01:05:51","1179669304.0","2022-12-22","01:05:51"
"688044","nao serve nem pra natal","2022-12-22 01:05:53","1533455799.0","2022-12-22","01:05:53"
"688045","Ele meteu essa mesmo? Vai vazar para portugal?","2022-12-22 01:06:04","5413659844.0","2022-12-22","01:06:04"
"688046","O que vc acha que eram aqueles vídeos com o cara que tem uma empresa que consegue dupla nacionalidade 🤣 🤣 🤣 🤣 Peter trocou o passaporte português por propaganda","2022-12-22 01:12:32","631941985.0","2022-12-22","01:12:32"
"688048","Eu concordo com o Peter no que diz respeito a combater desinformação com mais informação","2022-12-22 01:18:06","5973867706.0","2022-12-22","01:18:06"
"688055","se colocar o pet e o pai do pet num teste de QI ...  🤣🤣🤣","2022-12-22 01:23:41","517416225.0","2022-12-22","01:23:41"
"688049","Bolsonaro eh frouxo. Renovou a poha... fala, fala e depois renova","2022-12-22 01:18:33","886161796.0","2022-12-22","01:18:33"
"688050","Principalmente com a informação do que poderia acontecer se fizessem fake news de nível criminoso, como a Globo fez com o Bolsonaro","2022-12-22 01:19:06","5973867706.0","2022-12-22","01:19:06"
"688051","Bolsonaro arregão","2022-12-22 01:19:29","886161796.0","2022-12-22","01:19:29"
"688052","Não iria ter renovação","2022-12-22 01:19:32","5973867706.0","2022-12-22","01:19:32"
"688053","Tirava o dinheiro... deixava o molusco se justificar para pagar...","2022-12-22 01:20:18","886161796.0","2022-12-22","01:20:18"
"688054","Bolsonaro arregão do caralho","2022-12-22 01:20:39","886161796.0","2022-12-22","01:20:39"
"688056","Gordo desgracado fdp!
Falou falou falou, que ia protestar…que não sairia do brasil, e no fim vai pikar a mula","2022-12-22 01:25:14","5413659844.0","2022-12-22","01:25:14"
"688057","Bolsonaro é italiano. Ele é infiltrado dos carabinero","2022-12-22 01:27:04","1679980294.0","2022-12-22","01:27:04"
"688058","Se eu tivesse essa oportunidade faria a mesma coisa","2022-12-22 01:28:10","631941985.0","2022-12-22","01:28:10"
"688060","E rapaziada, td dia uma bomba","2022-12-22 01:33:04","1593822165.0","2022-12-22","01:33:04"
"688061","Novo diretor da PRF....","2022-12-22 01:33:04","1593822165.0","2022-12-22","01:33:04"
"688062","Adelio Bispo vai ser ministro dos Direitos Humanos","2022-12-22 01:34:14","631941985.0","2022-12-22","01:34:14"
"688063","Que eles se lasquem e comam o pão que o diabo amassou, que o chefe dos homens de preto xandistas seja pior ainda","2022-12-22 01:39:42","5413659844.0","2022-12-22","01:39:42"
"688064","Kkkkkkkkkkk eu ainda to no br kkkk, vou vazar ano q vem kkkkk","2022-12-22 01:41:26","1593822165.0","2022-12-22","01:41:26"
"688065","Deixa pegar fogo","2022-12-22 01:41:35","1593822165.0","2022-12-22","01:41:35"
"688066","Mas ainda não foi dentro do mandato do Salnorabo?","2022-12-22 01:42:39","1179669304.0","2022-12-22","01:42:39"
"688067","Up","2022-12-22 01:42:50","1179669304.0","2022-12-22","01:42:50"
"688068","Sem comentários contra esse absurdo. Só um idiota completo para acreditar em uma história dessas.","2022-12-22 01:50:48","1238937928.0","2022-12-22","01:50:48"
"688069","Viram o que o Paulo Generoso e o Paulo Figueiredo disseram? Parece que o General lá não passa de um melancia covarde, Ffaa não vai fazer nada e estarão em continência ao mula dia 1º! E os trouxa ainda com esperança e fé nesses funça do EB","2022-12-22 01:52:05","5413659844.0","2022-12-22","01:52:05"
"688070","Milico so serve de colchao pra general e bater punheta continencia","2022-12-22 01:56:12","1533455799.0","2022-12-22","01:56:12"
"688071","os Generais irão cair e serao presos, aí vai se arrepender.","2022-12-22 01:58:13","1488867745.0","2022-12-22","01:58:13"
"688074","https://youtu.be/WUaa5KqtTvY","2022-12-22 02:05:59","301817880.0","2022-12-22","02:05:59"
"688076","A nova parte dos documentos vazados do Twitter mostram que a plataforma colaborou com um órgão do governo americano em propaganda para influenciar a opinião pública.   
 
Ainda sobre os documentos vazados do Twitter, a NTD conservou com Donald Trump Jr, o filho do ex-presidente americano para saber sua opinião sobre os arquivos que vem sendo divulgados. 
 
Confira também a entrevista com um chinês que divulgou em larga escala vídeos vazados da China durante os protestos que ocorreram no país.  
 
E na Alemanha uma criminosa de guerra de 97 anos que atuou na Segunda Guerra Mundial foi condenada à prisão.  
https://youtu.be/e1nzM5sOSIs","2022-12-22 02:17:47","520921730.0","2022-12-22","02:17:47"
"688077","Seria sim","2022-12-22 02:18:24","846274888.0","2022-12-22","02:18:24"
"688078","Geralmente na América as coisas costumam ter consequências. Isso não vai dar em nada mesmo ?","2022-12-22 02:21:56","245261993.0","2022-12-22","02:21:56"
"688079","Bolsonaro é o representante do estado, enquanto a globo é a empresa privada.","2022-12-22 02:24:16","846274888.0","2022-12-22","02:24:16"
"688080","É errado o governo ter o poder de conceder a exploração do espectro eletromagnético.","2022-12-22 02:25:00","846274888.0","2022-12-22","02:25:00"
"688081","E a onça que ñ para de beber água.","2022-12-22 02:31:53","240828231.0","2022-12-22","02:31:53"
"688082","🤭","2022-12-22 02:31:57","240828231.0","2022-12-22","02:31:57"
"688083","Liga na globo por 15 minutos e reflita.
Eles defendem todo o absurdo estatal levl 1000.

Se eu abro uma empresa que usa dinheiro público e tente limitar suas liberdades, vida-se se é empresa  privada.","2022-12-22 02:35:51","1163352532.0","2022-12-22","02:35:51"
"688084","Lógico que é, mas e daí? 
Se for pra lutar contra Hitler fofa-se as 4 linhas.

Até por que a lei do estado de nada vale, então, fora-se","2022-12-22 02:36:36","1163352532.0","2022-12-22","02:36:36"
"688085","Iiii tá igual ao bolsoanro “vou jogar nas 4 linhas” hahahaab","2022-12-22 02:37:50","1163352532.0","2022-12-22","02:37:50"
"688094","Tem valores que não vale a pena tipo 6 reais","2022-12-22 02:50:13","634223840.0","2022-12-22","02:50:13"
"688087","https://www.mercadolivre.com.br/ajuda/25008?ND=%3D FAZ O L PORRAAAAAAAAAAA FAAAAAAAAAZ O LLLLLLLLLLL","2022-12-22 02:42:12","1593822165.0","2022-12-22","02:42:12"
"688088","FAZ O L COM FORÇA","2022-12-22 02:42:19","1593822165.0","2022-12-22","02:42:19"
"688090","Concordo plenamente.","2022-12-22 02:47:01","5249301349.0","2022-12-22","02:47:01"
"688091","O mercado livre sempre forçou a venda acima de 129 reais","2022-12-22 02:47:22","634223840.0","2022-12-22","02:47:22"
"688093","Sempre teve esse custo","2022-12-22 02:49:53","634223840.0","2022-12-22","02:49:53"
"688095","Esse custo começou em 2017","2022-12-22 02:50:43","634223840.0","2022-12-22","02:50:43"
"688097","Tem algo muito errado com o seu raciocínio. Desde Getúlio Vargas os meios de comunicação estão sob o controle do estado. Você defende que o governo use esse poder… e se ele usá-lo contra uma outra empresa que defende seus valores? O jeito certo de combater a globo é não consumir seus produtos…","2022-12-22 03:03:14","846274888.0","2022-12-22","03:03:14"
"688098","Peraí, é certo fazer o errado? Essa relativização pode se virar contra você mesmo.","2022-12-22 03:05:00","846274888.0","2022-12-22","03:05:00"
"688099","Usar o poder do governo para resolver um problema é equivalente a fazer um acordo com o capeta.","2022-12-22 03:06:14","846274888.0","2022-12-22","03:06:14"
"688101","Jogar nas 4 linha nesse país não da não, é tipo ter polícia desmilitarizada enquandrando traficante com apenas um cassetete na mão.","2022-12-22 03:07:00","1926182890.0","2022-12-22","03:07:00"
"688102","Isso é o famoso fica em casa, deixe os bandidos te trancarem na sua casa enquanto eles saqueiam os cofres públicos.","2022-12-22 03:08:37","1926182890.0","2022-12-22","03:08:37"
"688103","E a globo usando dinheiro do estado, Concessão pública para defender que tua internet seja regulada tá fazendo o que? Malandrao","2022-12-22 03:08:54","1163352532.0","2022-12-22","03:08:54"
"688104","Comparado com a impressão de dinheiro que ele fez isso não é nada.","2022-12-22 03:08:58","1068242909.0","2022-12-22","03:08:58"
"688105","Da até agonia de ver essa merda","2022-12-22 03:09:40","916914339.0","2022-12-22","03:09:40"
"688106","A Globo é corporativista, então não sei se conta bem como censura, mas não vejo com bons olhos não renovar a conceção.","2022-12-22 03:09:46","1068242909.0","2022-12-22","03:09:46"
"688107","Você tem quantos anos?

Lembra do Lula presidente?
Ele tinha que ter vendido a alma do congresso inteiro para não deixar o Lula voltar.","2022-12-22 03:09:48","1163352532.0","2022-12-22","03:09:48"
"688108","Ora é isso que está errado. O governo controla os meios de comunicação pagando e determinando um monopólio. O certo é o governo parar com isso, não usar o seu poder cada vez mais","2022-12-22 03:10:08","846274888.0","2022-12-22","03:10:08"
"688109","Confia ... O papa é a voz de Deus","2022-12-22 03:10:16","916914339.0","2022-12-22","03:10:16"
"688110","Globo não é empresa.
Ela vive de concessão (simbiose) estatal","2022-12-22 03:10:20","1163352532.0","2022-12-22","03:10:20"
"688111","Vai dar bom ....","2022-12-22 03:10:21","916914339.0","2022-12-22","03:10:21"
"688112","Malandrinho","2022-12-22 03:10:21","846274888.0","2022-12-22","03:10:21"
"688113","20 a 30 (não quero falar)

Não faz diferença se é Lula ou Bolsonaro no poder, o que importa é a cultura.","2022-12-22 03:10:31","1068242909.0","2022-12-22","03:10:31"
"688114","O governo nem devia existir!!!","2022-12-22 03:10:33","1163352532.0","2022-12-22","03:10:33"
"688115","A Globo ganha dinheiro de forma ilegítima.","2022-12-22 03:11:03","1068242909.0","2022-12-22","03:11:03"
"688122","É estranho, mas o ideal seria não haver concessão 🤷‍♂","2022-12-22 03:12:19","1244515397.0","2022-12-22","03:12:19"
"688116","Você vai ser estuprado e não tem força para se defender.

Ou vai ser uma piroca de 10cm ou UMA ROLA AFRICANA DE MEIO METRO.","2022-12-22 03:11:12","1163352532.0","2022-12-22","03:11:12"
"688117","Censura por definição é o governo impedir que vc use sua propriedade para dizer o que você acredita.","2022-12-22 03:11:14","846274888.0","2022-12-22","03:11:14"
"688118","Nada melhor que um governo mais forte, maior e mais impiedoso para combater um governo q saiu do controle e começou a matar a todos. Foi oq pensaram quando fortaleceram o EUA para combater os Nazista 🤣🤣🤣🤣","2022-12-22 03:11:23","1244515397.0","2022-12-22","03:11:23"
"688119","Ainda assim foi melhor lidar com os EUA que com a Alemanha nazista","2022-12-22 03:11:51","1163352532.0","2022-12-22","03:11:51"
"688120","Então como que vc defende que algo que não deveria existir use sua força para fazer sua vontade?","2022-12-22 03:11:58","846274888.0","2022-12-22","03:11:58"
"688121","Prefiro tentar me defender do estupro do que ficar escolhendo a piroca menor.","2022-12-22 03:12:00","1068242909.0","2022-12-22","03:12:00"
"688123","A propriedade da Globo é ilegítima.","2022-12-22 03:12:21","1068242909.0","2022-12-22","03:12:21"
"688124","Também acho.","2022-12-22 03:12:34","1068242909.0","2022-12-22","03:12:34"
"688125","Você defende o que? Seguir uma bando de letrinha socialista no papel?

Defendo que se você não respeita minha liberdade eu te encho de porrada na primeira oportunidade 🤷‍♂️","2022-12-22 03:12:47","1163352532.0","2022-12-22","03:12:47"
"688126","Claro… vide Ucrânia, Afeganistão, Iraque…","2022-12-22 03:13:01","846274888.0","2022-12-22","03:13:01"
"688127","Pois é você não tem força para isso e tá deixando as pirocas escolherem qual entram em você","2022-12-22 03:13:29","1163352532.0","2022-12-22","03:13:29"
"688128","Sabe contar?","2022-12-22 03:13:37","1163352532.0","2022-12-22","03:13:37"
"688129","Então, se eu te falar que os EUA levou fome e miséria para o resto do mundo depois da segunda guerra mundial, vc concorda?","2022-12-22 03:13:37","1244515397.0","2022-12-22","03:13:37"
"688130","Conta do campo de concentração na Polônia","2022-12-22 03:13:57","1163352532.0","2022-12-22","03:13:57"
"688131","Só não foi pior que a união soviética","2022-12-22 03:14:08","1163352532.0","2022-12-22","03:14:08"
"688132","Bullshit… os estados todos fizeram isso","2022-12-22 03:14:34","1163352532.0","2022-12-22","03:14:34"
"688133","Eu já disse o certo, basta parar de financiar a globo e o governo","2022-12-22 03:14:55","846274888.0","2022-12-22","03:14:55"
"688134","O padrão ouro foi pro caralho e todo mundo adorou a ideia por que é bom para burocrata","2022-12-22 03:14:58","1163352532.0","2022-12-22","03:14:58"
"688135","Sim","2022-12-22 03:15:10","846274888.0","2022-12-22","03:15:10"
"688136","Enquanto isso os burocratas votam regular a imprensa","2022-12-22 03:15:35","1163352532.0","2022-12-22","03:15:35"
"688137","Decidem taxar o pix","2022-12-22 03:15:45","1163352532.0","2022-12-22","03:15:45"
"688138","Conta quantas pessoas foram assassinadas no Japão devido às bombas nucleares","2022-12-22 03:16:06","846274888.0","2022-12-22","03:16:06"
"688139","Se eu aceitar que uma das pirocas entre em mim eu não vou poder acusar o cara de estupro.","2022-12-22 03:16:10","1068242909.0","2022-12-22","03:16:10"
"688140","Sabe contar?","2022-12-22 03:16:20","1163352532.0","2022-12-22","03:16:20"
"688141","Refuta essa, liberal kkkkkkkkkkkkkkkkkkk","2022-12-22 03:16:29","1068242909.0","2022-12-22","03:16:29"
"688142","Qual a relação disso com o que eu falei?","2022-12-22 03:16:42","846274888.0","2022-12-22","03:16:42"
"688143","Se juntar as duas bombas não dá um campo","2022-12-22 03:16:48","1163352532.0","2022-12-22","03:16:48"
"688144","Sim","2022-12-22 03:17:12","846274888.0","2022-12-22","03:17:12"
"688145","Junta mais, todas as guerras em que inocentes morreram","2022-12-22 03:17:35","846274888.0","2022-12-22","03:17:35"
"688146","10 meses da pra o larápio fazer um empréstimo sem devoluçao para os companheiros da argentina fazer populismo","2022-12-22 03:17:41","1926182890.0","2022-12-22","03:17:41"
"688147","Não dá","2022-12-22 03:17:44","1163352532.0","2022-12-22","03:17:44"
"688148","Ordem de grandeza","2022-12-22 03:17:49","1163352532.0","2022-12-22","03:17:49"
"688149","Totalmente diferente","2022-12-22 03:17:58","1163352532.0","2022-12-22","03:17:58"
"688150","Só são comparáveis Hitler, stalin e Mao","2022-12-22 03:18:33","1163352532.0","2022-12-22","03:18:33"
"688151","🤷‍♂️ é aquela triste afirmação, não havia oq fazer, os nazi tinham q ser parado, mas q os EUA levaram fome e miséria pro resto do mundo, obrigando eles a usar o dólar, principalmente os produtores de petróleo, vendendo a reserva de ouro ""lastreada"" para fazer tank, e imprimindo mais dólar, isso eles fizeram","2022-12-22 03:18:55","1244515397.0","2022-12-22","03:18:55"
"688152","Sei… vc acha mesmo que nos campos de concentração da Polônia morreram mais pessoa que todo o resto do século XX E XXI?","2022-12-22 03:19:13","846274888.0","2022-12-22","03:19:13"
"688153","Jogaram o grosso da pobreza do país deles pro mundo","2022-12-22 03:19:20","1244515397.0","2022-12-22","03:19:20"
"688154","Não… na segunda guerra toda","2022-12-22 03:19:34","1163352532.0","2022-12-22","03:19:34"
"688155","Nos campos morreram mais que no Japão com as bombas","2022-12-22 03:19:45","1163352532.0","2022-12-22","03:19:45"
"688156","Vc disse Polônia","2022-12-22 03:19:48","846274888.0","2022-12-22","03:19:48"
"688157","Saiba que eu não tenho telepatia","2022-12-22 03:20:12","846274888.0","2022-12-22","03:20:12"
"688158","Isso foi em resposta a sua primeira assertiva","2022-12-22 03:20:29","1163352532.0","2022-12-22","03:20:29"
"688159","Exatamente","2022-12-22 03:20:41","846274888.0","2022-12-22","03:20:41"
"688180","Leia o resto da mensagem","2022-12-22 04:41:48","5973867706.0","2022-12-22","04:41:48"
"688160","A teoria da esquerda deveria estar certa, igual a que eles falaram que teria blindados em cada esquina quando o bulbassauro ganhasse, fim de ano e meu bairro está dominado por ratos roubando celulares e bolsas, faltou uma rota pra acabar com o problema de lotação carcerário","2022-12-22 03:20:55","1926182890.0","2022-12-22","03:20:55"
"688161","Foi 1Mi em Auschwitz +/-","2022-12-22 03:21:22","1163352532.0","2022-12-22","03:21:22"
"688162","Não tenho como adivinhar algo que vc não escreveu","2022-12-22 03:21:22","846274888.0","2022-12-22","03:21:22"
"688163","Só isso é mais que Afeganistão, iraque, duas bombas e Kuwait","2022-12-22 03:22:32","1163352532.0","2022-12-22","03:22:32"
"688164","Só as bombas mataram mais ou menos 600 mil pessoas","2022-12-22 03:23:49","846274888.0","2022-12-22","03:23:49"
"688165","Não é, pois os efeitos da radiação mataram ao longo dos anos, não dá pr quantificar exatamente","2022-12-22 03:24:36","846274888.0","2022-12-22","03:24:36"
"688166","Os danos da explosão nuclear foram incalculáveis","2022-12-22 03:24:55","846274888.0","2022-12-22","03:24:55"
"688167","Centrão vai abrir o olho do centrão como sempre, são ótimos pra atrasar o lado, e pra ajudar a fazer o que é certo só fazem na base do toma lá da cá.","2022-12-22 03:25:10","1926182890.0","2022-12-22","03:25:10"
