"message_id","message","message_utc","from_id","date","time"
"8","Bom dia a todos este e o aplicativo para fiscal voluntário de Urna. Vamos divulgar abaixo o vídeo de como funciona","2022-10-26 13:51:40","5142038724","2022-10-26","13:51:40"
"12","Olá, vamos divulgar. Só assim vamos comprovar a fraude.","2022-10-26 14:21:55","5142038724","2022-10-26","14:21:55"
"13","Bom dia a todos, estou divulgando um aplicativo que nos fizemos, se chama fiscal de Urna voluntário, este aplicativo ajudará a divulgar fraude na sessão eleitoral, caso tiver. Entre no grupo assista o vídeo e veja como funciona. https://t.me/FiscaisDeUrna","2022-10-26 14:41:38","5142038724","2022-10-26","14:41:38"
"19","Opa","2022-10-26 18:53:39","5181859319","2022-10-26","18:53:39"
"20","Vamos divulgar galera","2022-10-26 19:04:57","5142038724","2022-10-26","19:04:57"
