"message_id","message","message_utc","from_id","date","time"
"50516","eu vi esse link desse app ativo hj","2023-01-12 01:46:28","5193747664","2023-01-12","01:46:28"
"50523","Mandaram o app pra denuncia ?","2023-01-12 01:49:21","844154553","2023-01-12","01:49:21"
"50524","e falaram como ficará a situação do bolsonaro?","2023-01-12 01:49:27","5193747664","2023-01-12","01:49:27"
"50525","acabei de enviar","2023-01-12 01:49:36","5193747664","2023-01-12","01:49:36"
"50526","o que acho eu envio.","2023-01-12 01:49:40","5193747664","2023-01-12","01:49:40"
"50527","Ele tá maculado com Trump","2023-01-12 01:49:55","844154553","2023-01-12","01:49:55"
"50528","Aquilo ali de Biden é tudo armadilha de Trump","2023-01-12 01:50:18","844154553","2023-01-12","01:50:18"
"50529","não vejo a hora dele ser preso","2023-01-12 01:50:45","5193747664","2023-01-12","01:50:45"
"50530","caraca, estressada já com ele.","2023-01-12 01:50:52","5193747664","2023-01-12","01:50:52"
"50531","Eu vi uma coisa aqui no livro interessante","2023-01-12 01:51:09","844154553","2023-01-12","01:51:09"
"50552","É assim que a pessoa fica se n transar","2023-01-12 01:59:12","5349232431","2023-01-12","01:59:12"
"50553","Ta","2023-01-12 01:59:26","5349232431","2023-01-12","01:59:26"
"50554","kkkkkkkkkkk eu ia falar uma merda, como boa sagitariana, mas evitei kkkkkkkkkk","2023-01-12 01:59:34","5193747664","2023-01-12","01:59:34"
"50571","Não pode porno aqui Me","2023-01-12 02:03:31","2037277338","2023-01-12","02:03:31"
"50573","Algum adm aí bane","2023-01-12 02:03:38","5243341461","2023-01-12","02:03:38"
"50576","Deve ser algum macho adolescente","2023-01-12 02:03:52","5243341461","2023-01-12","02:03:52"
"50578","Ué","2023-01-12 02:03:59","5473925229","2023-01-12","02:03:59"
"50580","Kids","2023-01-12 02:04:23","5349232431","2023-01-12","02:04:23"
"50581","Kkkkkkkk morri","2023-01-12 02:04:40","5473925229","2023-01-12","02:04:40"
"50582","Confesso que fiquei bem confusa","2023-01-12 02:05:16","5473925229","2023-01-12","02:05:16"
"50607","Isso se chama intervenção militar com apoio do judiciário kk","2023-01-12 02:26:32","1691432860","2023-01-12","02:26:32"
"50609","Olá Livia, seja bem vindo(a) ao Movimento Brasil Comunista","2023-01-12 02:27:02","609517172","2023-01-12","02:27:02"
"50631","Tava tomando café gente desculpe","2023-01-12 02:38:41","844154553","2023-01-12","02:38:41"
"50638","🥂","2023-01-12 02:46:04","5473925229","2023-01-12","02:46:04"
"50652","Ética jornalística.","2023-01-12 04:07:03","1122853202","2023-01-12","04:07:03"
"50653","eita","2023-01-12 04:09:43","5193747664","2023-01-12","04:09:43"
"50654","bjs crianças, bom descanso a todos","2023-01-12 04:14:47","5193747664","2023-01-12","04:14:47"
"50663","Tinha que falar oq?","2023-01-12 04:56:22","1691432860","2023-01-12","04:56:22"
"50677","Acho que se expiraram no Brasil pra fazer gothan","2023-01-12 08:49:12","5349232431","2023-01-12","08:49:12"
"50678","O charada são os golpistas","2023-01-12 08:50:02","5349232431","2023-01-12","08:50:02"
"50512","Aí vão capturar ele","2023-01-12 01:41:14","844154553","2023-01-12","01:41:14"
"50513","Já derrubaram o app signal e matrix ?","2023-01-12 01:41:47","844154553","2023-01-12","01:41:47"
"50514","Amanhã é cena dos próximos capítulos 🔥😜","2023-01-12 01:43:58","844154553","2023-01-12","01:43:58"
"50515","Do Ozzie?","2023-01-12 01:45:23","5473925229","2023-01-12","01:45:23"
"50453","Tem que prender tudo","2023-01-12 00:21:53","5349232431","2023-01-12","00:21:53"
"50454","Toma troxa na cadeia ela não vai ter maquiagem e cílios feitos kkkk","2023-01-12 00:22:00","1798425978","2023-01-12","00:22:00"
"50472","Poxa vida!! Cortou o papo!!","2023-01-12 00:27:55","1286388854","2023-01-12","00:27:55"
"50486","Se não estiver presa","2023-01-12 01:07:01","785327752","2023-01-12","01:07:01"
"50487","Ela respondeu","2023-01-12 01:07:06","5349232431","2023-01-12","01:07:06"
"50488","Tá triste","2023-01-12 01:07:11","5349232431","2023-01-12","01:07:11"
"50489","Kkkkkk","2023-01-12 01:07:15","5349232431","2023-01-12","01:07:15"
"50490","Onde?","2023-01-12 01:07:17","5904961521","2023-01-12","01:07:17"
"50491","No pv","2023-01-12 01:07:21","5349232431","2023-01-12","01:07:21"
"50973","Branquinhos e alinhadinhos","2023-01-12 21:11:13","5473925229","2023-01-12","21:11:13"
"50740","Olá msousa, seja bem vindo(a) ao Movimento Brasil Comunista","2023-01-12 12:30:58","609517172","2023-01-12","12:30:58"
"50748","Bom dia povo","2023-01-12 13:00:09","1716199004","2023-01-12","13:00:09"
"50749","Ta de sacanagem","2023-01-12 13:01:09","1716199004","2023-01-12","13:01:09"
"50750","https://noticias.uol.com.br/politica/ultimas-noticias/2023/01/12/gastos-cartao-corporativo-jair-bolsonaro.htm?utm_source=twitter&utm_medium=social-media&utm_content=geral&utm_campaign=noticias","2023-01-12 13:09:15","5193747664","2023-01-12","13:09:15"
"50751","saiuuuuuuuuuuuuuuuu","2023-01-12 13:09:19","5193747664","2023-01-12","13:09:19"
"50773","Que raiva!","2023-01-12 13:40:25","5753285333","2023-01-12","13:40:25"
"50774","Parece que ele é um dos financiadores","2023-01-12 13:40:27","2037277338","2023-01-12","13:40:27"
"50775","ele não está preso, segundo cnn.","2023-01-12 13:40:43","5193747664","2023-01-12","13:40:43"
"50776","E nem se preocupe q esse tá lascado.","2023-01-12 13:42:58","5518687778","2023-01-12","13:42:58"
"50777","Real oficial?","2023-01-12 13:43:08","5518687778","2023-01-12","13:43:08"
"50778","A moça do post viu na globonews","2023-01-12 13:44:19","1349979565","2023-01-12","13:44:19"
"50779","A gente sabe, no final das contas, quem de fato financiou….","2023-01-12 13:45:54","5518687778","2023-01-12","13:45:54"
"50799","Queria saber o q o esgoto está comentando.","2023-01-12 14:07:02","5518687778","2023-01-12","14:07:02"
"50800","Fatão.","2023-01-12 14:07:16","5518687778","2023-01-12","14:07:16"
"50801","Não tinha visto este aínda","2023-01-12 14:07:23","442044682","2023-01-12","14:07:23"
"50802","numero redondinho ne","2023-01-12 14:07:24","5193747664","2023-01-12","14:07:24"
"50817","Eu tenho um fio do Twitter sobre a festa do frango do bolsonaro","2023-01-12 14:17:12","5739015078","2023-01-12","14:17:12"
"50818","Esse eh bem material","2023-01-12 14:17:19","5739015078","2023-01-12","14:17:19"
"50819","Não isso","2023-01-12 14:17:24","5739015078","2023-01-12","14:17:24"
"50820","alguem sabe o nome da padaria? ou eles não divulgaram?","2023-01-12 14:17:30","5860103043","2023-01-12","14:17:30"
"50870","Oq tanto o jair compra em mercadinho","2023-01-12 15:55:03","5349232431","2023-01-12","15:55:03"
"50878","Foi recebido duas vezes por Mourão em 19 e 20","2023-01-12 16:11:06","5906321492","2023-01-12","16:11:06"
"50879","Mourão inclusive gravou vídeos pra campanha dele em 18 e 22","2023-01-12 16:11:56","5906321492","2023-01-12","16:11:56"
"50891","Ué n era ele que só se hospedava em muquifo","2023-01-12 16:26:12","5349232431","2023-01-12","16:26:12"
"50892","E quarto de batalhão","2023-01-12 16:26:25","5349232431","2023-01-12","16:26:25"
"50752","Vagabundo","2023-01-12 13:14:58","1716199004","2023-01-12","13:14:58"
"50759","É cada uma viu 😂","2023-01-12 13:20:48","844154553","2023-01-12","13:20:48"
"50766","😂😂","2023-01-12 13:32:07","5753285333","2023-01-12","13:32:07"
"50767","sério? kkkkk","2023-01-12 13:32:10","5193747664","2023-01-12","13:32:10"
"50768","meu deus","2023-01-12 13:32:13","5193747664","2023-01-12","13:32:13"
"50974","🤭🤭🤭🤭","2023-01-12 21:11:20","5473925229","2023-01-12","21:11:20"
"50975","Os dentes são assim mesmo","2023-01-12 21:15:47","1716199004","2023-01-12","21:15:47"
"50976","N sei se o filtro deixa mais claro","2023-01-12 21:15:56","1716199004","2023-01-12","21:15:56"
"51008","Autogolpistas piram! 🔥🚨","2023-01-12 22:44:31","1402103934","2023-01-12","22:44:31"
"50705","Olá Lu, seja bem vindo(a) ao Movimento Brasil Comunista","2023-01-12 11:03:31","609517172","2023-01-12","11:03:31"
"50485","Ela é demais!","2023-01-12 01:06:48","785327752","2023-01-12","01:06:48"
"50432","É","2023-01-12 00:01:25","5349232431","2023-01-12","00:01:25"
"50423","Eles acham mesmo que empresário vai fechar, qdo os fazem do q eles sempre foram: gados.","2023-01-12 00:00:07","5518687778","2023-01-12","00:00:07"
"50424","Parece até grupo de direita","2023-01-12 00:00:09","5349232431","2023-01-12","00:00:09"
"50425","Em que mundo esse povo vive? Como não perceberam que só eles estão vivendo esse delírio e o resto do país tá seguindo a vida no pós eleição?","2023-01-12 00:00:22","5193747664","2023-01-12","00:00:22"
"50426","São geniais, é o aplaudir de pé!","2023-01-12 00:00:26","5518687778","2023-01-12","00:00:26"
"50427","Capitão kkkkkk","2023-01-12 00:00:31","5193747664","2023-01-12","00:00:31"
"50428","Eles estão sofrendo ataque desse grupo do censura","2023-01-12 00:00:52","5349232431","2023-01-12","00:00:52"
"50429","Não parou nada em 70 dias de quartel, eles JURAM q até quem votou em Bozo vai parar por causa deles?","2023-01-12 00:01:00","5518687778","2023-01-12","00:01:00"
"50430","É o grupo coisinhas do lula","2023-01-12 00:01:11","5349232431","2023-01-12","00:01:11"
"50431","Só faltam dizer q é classe
Operária.","2023-01-12 00:01:18","5518687778","2023-01-12","00:01:18"
"50433","Se tivessem lido moby Dick n tinha me banido kkkk","2023-01-12 00:01:54","5349232431","2023-01-12","00:01:54"
"50434","Como representante do Presidente Lula, Ministro da Justiça, Flávio Dino, dá um recado aos servidores da Polícia Federal, que serve para todos os servidores dos diversos órgãos públicos. “Não permitiremos que preferências eleitorais contaminem as instituições.” BRASIL SOB NOVA DIREÇÃO","2023-01-12 00:11:47","683063097","2023-01-12","00:11:47"
"50435","Tem mais grupos de bolsominios por aí?  Me tiraram de todos","2023-01-12 00:12:51","456129257","2023-01-12","00:12:51"
"50437","Vou denunciar também","2023-01-12 00:15:50","683063097","2023-01-12","00:15:50"
"50438","Gente alguém sabe se aquela bolsoloides daymuhammed foi presa? A que gravou o vídeo dizendo que quebrou tudo e que não havia sobrado nada","2023-01-12 00:18:19","1798425978","2023-01-12","00:18:19"
"50439","https://twitter.com/juliotavare/status/1613283018805858304?t=4k7sUqodGtQaDJifsqq4GQ&s=35","2023-01-12 00:18:52","5349232431","2023-01-12","00:18:52"
"50440","Gente tão comendo pão com mortadela todos os dias","2023-01-12 00:18:52","5349232431","2023-01-12","00:18:52"
"50441","Saved by @InstantMediaBot

Não te avisaram que terrorista é crime agora lamenta mas vc cometeu um crime grave contra democracia o pior está por vir .
-----------
@MsBraun7:
😂😂😂😂😂😂 https://t.co/lj9v1JwkAY","2023-01-12 00:18:57","1965706498","2023-01-12","00:18:57"
"50442","Kkkkkkkk","2023-01-12 00:19:03","1798425978","2023-01-12","00:19:03"
"50443","Com esse nome, não aparece pra mim.","2023-01-12 00:19:05","683063097","2023-01-12","00:19:05"
"50444","Ahahahahahahhahahha","2023-01-12 00:19:08","5349232431","2023-01-12","00:19:08"
"50452","N tem que ter mais","2023-01-12 00:21:44","5349232431","2023-01-12","00:21:44"
"50445","Quando será que eles vão fazer um novo protesto pra gente ver mais cenas de prisão de minions assim","2023-01-12 00:20:15","5349232431","2023-01-12","00:20:15"
"50446","https://t.me/+gINp6zseioozZGJh","2023-01-12 00:20:47","1077302985","2023-01-12","00:20:47"
"50447","Efeito colateral da cloroquina","2023-01-12 00:20:48","1798425978","2023-01-12","00:20:48"
"50448","Quando lula falou que o Brasil seria feliz de novo n tava brincado","2023-01-12 00:21:01","5349232431","2023-01-12","00:21:01"
"50449","Eu tô morrendo de rir","2023-01-12 00:21:08","5349232431","2023-01-12","00:21:08"
"50450","Tão com medo agora acho que acabou a manifestação","2023-01-12 00:21:22","1798425978","2023-01-12","00:21:22"
"50451","Vi no Instagram que está sendo procurada","2023-01-12 00:21:29","1077302985","2023-01-12","00:21:29"
"50455","Sem réu primário pra golpista","2023-01-12 00:22:10","5349232431","2023-01-12","00:22:10"
"50456","Ela ainda não foi presa","2023-01-12 00:23:11","1077302985","2023-01-12","00:23:11"
"50457","O grupo do chá é só o povo entrando, não tem mais postagens","2023-01-12 00:23:15","5906321492","2023-01-12","00:23:15"
"50458","Tem uma em Uberlândia dona de restaurantes no shopping","2023-01-12 00:23:16","1074023954","2023-01-12","00:23:16"
"50459","Flávia Carolina Andrade Eller. 
Denunciar essa terrorista e estava na destruição de Brasília","2023-01-12 00:23:21","683063097","2023-01-12","00:23:21"
"50460","Ela é prima de cassia eller","2023-01-12 00:23:21","683063097","2023-01-12","00:23:21"
"50465","Denúncia","2023-01-12 00:24:46","1077302985","2023-01-12","00:24:46"
"50461","denunciar a terrorista","2023-01-12 00:23:21","683063097","2023-01-12","00:23:21"
"50462","Pede Pix para fugir para os EUA","2023-01-12 00:23:21","683063097","2023-01-12","00:23:21"
"50463","Gente essa daqui já foi identificada???","2023-01-12 00:23:32","1942883485","2023-01-12","00:23:32"
"50464","Mas olha:

Mais um caindo!!!","2023-01-12 00:24:07","1286388854","2023-01-12","00:24:07"
"50466","Essa e de Uberlândia mg","2023-01-12 00:25:29","1074023954","2023-01-12","00:25:29"
"50467","https://revistaopera.com.br/2023/01/11/o-buraco-nas-investigacoes-sobre-o-ataque-golpista-e-o-papel-do-gsi-e-do-exercito/","2023-01-12 00:26:01","219378292","2023-01-12","00:26:01"
"50468","To fazendo um. Mone de denuncia nos grupos","2023-01-12 00:26:08","1074023954","2023-01-12","00:26:08"
"50469","É sério???","2023-01-12 00:26:14","5906321492","2023-01-12","00:26:14"
"50470","Vdd","2023-01-12 00:26:23","1074023954","2023-01-12","00:26:23"
"50471","Nome dessa e Mônica Mônica  no face estou bloqueada 30 dias","2023-01-12 00:27:28","1074023954","2023-01-12","00:27:28"
"50474","Vocês viram essa pesquisa","2023-01-12 00:28:59","1077302985","2023-01-12","00:28:59"
"50476","IDENTIFIQUE O FASCISTA

Homem branco, abordou o advogado de Lula, Cristiano Zanin, em um banheiro, lhe dirigindo insultos e ameaçando, ante qualquer reação do mesmo, a partir para agressões físicas. 

Se souber o nome e localização do mesmo ligue: 181

#ANTIFA #ALERTA #FASCISTA  #BrasilContraTerrorismo","2023-01-12 00:29:43","219378292","2023-01-12","00:29:43"
"50477","https://t.me/frontexercitodecristo","2023-01-12 00:32:24","1077302985","2023-01-12","00:32:24"
"50479","🔥 👀
Há 25 anos o governador bolsonarista Ibaneis Rocha era advogado e defendia com ardor os filhos fascistas da classe média brasiliense, que assassinaram com álcool e fogo num ponto de ônibus o índio pataxó Galdino. Galdino viajou para a capital federal para manifestação em defesa contra o massacre do seu povo pataxó e dormia sozinho, num ponto de ônibus, após ser impedido de entrar na pensão que estava.","2023-01-12 00:45:43","683063097","2023-01-12","00:45:43"
"50480","Qual deles???","2023-01-12 01:04:04","785327752","2023-01-12","01:04:04"
"50481","Entrei agora","2023-01-12 01:04:31","785327752","2023-01-12","01:04:31"
"50482","Gente, não é que ela ta la mesmo?","2023-01-12 01:05:46","785327752","2023-01-12","01:05:46"
"50483","Tá, mas nunca falou","2023-01-12 01:06:20","5904961521","2023-01-12","01:06:20"
"50484","Deve estar quase explodindo","2023-01-12 01:06:30","5904961521","2023-01-12","01:06:30"
"50493","Ah não","2023-01-12 01:07:34","5904961521","2023-01-12","01:07:34"
"50494","Dei as boas noticias","2023-01-12 01:07:45","5349232431","2023-01-12","01:07:45"
"50495","Que ela iria ganhar um chip chinês na rabichola","2023-01-12 01:07:58","5349232431","2023-01-12","01:07:58"
"50496","Queria ver o xilique 😔","2023-01-12 01:08:25","5904961521","2023-01-12","01:08:25"
"50497","1428 estão em presídio","2023-01-12 01:11:24","5349232431","2023-01-12","01:11:24"
"50498","😏","2023-01-12 01:11:35","5349232431","2023-01-12","01:11:35"
"50500","Pelo visto, estão no pasto.","2023-01-12 01:13:42","5473925229","2023-01-12","01:13:42"
"50501","Mato tem","2023-01-12 01:14:04","5349232431","2023-01-12","01:14:04"
"50502","isso é zoeira né, diz que eu to achando certo","2023-01-12 01:22:14","5193747664","2023-01-12","01:22:14"
"50503","Ela fala ali em pão com mortandela.","2023-01-12 01:23:11","981294923","2023-01-12","01:23:11"
"50504","É vídeo pra tik tok","2023-01-12 01:23:17","981294923","2023-01-12","01:23:17"
"50511","O cara que está fugindo vcs vão achar e denunciar pelo endereço ip","2023-01-12 01:41:02","844154553","2023-01-12","01:41:02"
"50506","foi agora a noite, olhei eram umas oito e ainda estava de pé, já estava na listinha pra denunciar de novo kkkk","2023-01-12 01:25:05","5193747664","2023-01-12","01:25:05"
"50507","então eu to bem segura das minhas convicções, pq eu achei que era zoeira kkk","2023-01-12 01:25:57","5193747664","2023-01-12","01:25:57"
"50508","Voltei gente","2023-01-12 01:35:28","844154553","2023-01-12","01:35:28"
"50509","Foi tudo bem , mas a situação lá de Brasília tá feia muita gente vai presa","2023-01-12 01:36:39","844154553","2023-01-12","01:36:39"
"50510","além dos que já estão presas? vi o Radde falando em policiais presos mas dps apagou o tt","2023-01-12 01:37:45","5193747664","2023-01-12","01:37:45"
"50518","Vcs vão achar o endereço IP dele","2023-01-12 01:47:48","844154553","2023-01-12","01:47:48"
"50520","vi esse aqui hoje","2023-01-12 01:48:11","5193747664","2023-01-12","01:48:11"
"50521","não sei como é esse sigma 🇧🇷- ALERTA MÁXIMO PATRIOTAS! URGENTE!

🔰- Baixe o Aplicativo Signal. Aplicativo seguro com grupos inibaniveis.

🚨- Após baixar o Aplicativo, Entre no Grupo Patriota

➡️ Baixe o Signal : https://play.google.com/store/apps/details?id=org.thoughtcrime.securesms

➡️ Entre no grupo : https://signal.group/#CjQKIOvhXoeiOg2LfXZigny0gTQcGLyzIerY1mz6Dm0ZWEvcEhBTL_j40UaNxCuKuB_TJSJx","2023-01-12 01:48:19","5193747664","2023-01-12","01:48:19"
"50522","Eu perguntei lá na gira aí a entidade descreveu que vai preso .","2023-01-12 01:48:50","844154553","2023-01-12","01:48:50"
"50532","A legenda eu deixo com vocês!","2023-01-12 01:51:25","1077302985","2023-01-12","01:51:25"
"50533","A teoria que eles cultuam chamada poder brando na diplomacia internacional.","2023-01-12 01:51:44","844154553","2023-01-12","01:51:44"
"50534","Agora a idade vale.","2023-01-12 01:52:10","981294923","2023-01-12","01:52:10"
"50535","Mas não valia na hora de transgredir a lei.","2023-01-12 01:52:18","981294923","2023-01-12","01:52:18"
"50536","https://t.me/bolosdoceseafins","2023-01-12 01:52:32","1077302985","2023-01-12","01:52:32"
"50543","Pra quem tava com saudades da nina","2023-01-12 01:56:54","5349232431","2023-01-12","01:56:54"
"50537","Vão acompanhar BBB camaradas?","2023-01-12 01:53:30","1122853202","2023-01-12","01:53:30"
"50538","Novo canal do Ozzi","2023-01-12 01:53:39","1077302985","2023-01-12","01:53:39"
"50539","Veia com cara de rica. Se fosse pessoa do bem estava em casa","2023-01-12 01:55:05","1077302985","2023-01-12","01:55:05"
"50540","As ideia","2023-01-12 01:55:27","5739015078","2023-01-12","01:55:27"
"50541","Eu não curto BBB","2023-01-12 01:55:53","844154553","2023-01-12","01:55:53"
"50545","nao entendi, desculpa","2023-01-12 01:57:46","5193747664","2023-01-12","01:57:46"
"50546","Sobre os políticos","2023-01-12 01:58:01","844154553","2023-01-12","01:58:01"
"50547","Políticos internacionais .","2023-01-12 01:58:15","844154553","2023-01-12","01:58:15"
"50548","Ela está na ativa vagabunda","2023-01-12 01:58:33","1077302985","2023-01-12","01:58:33"
"50549","preciso ficar por dentro, quero saber a historia dessa tão amada nina","2023-01-12 01:58:45","5193747664","2023-01-12","01:58:45"
"50550","Vou mandar o trecho do livro","2023-01-12 01:58:47","844154553","2023-01-12","01:58:47"
"50551","ta","2023-01-12 01:58:56","5193747664","2023-01-12","01:58:56"
"50555","O Exu disse lá que não adianta manda com os id e sim com endereço local ( endereço IP)","2023-01-12 01:59:48","844154553","2023-01-12","01:59:48"
"50556","Qual as novidades de agora a noite?","2023-01-12 02:00:35","844154553","2023-01-12","02:00:35"
"50557","Eu cheguei agora vou tomar café","2023-01-12 02:00:44","844154553","2023-01-12","02:00:44"
"50558","Não da para ver os grupos que ela tá né","2023-01-12 02:00:57","1077302985","2023-01-12","02:00:57"
"50559","Somando tem 1428 patriotas presos e eu tô com saudades da morena","2023-01-12 02:01:51","5349232431","2023-01-12","02:01:51"
"50561","Olá Me, seja bem vindo(a) ao Movimento Brasil Comunista","2023-01-12 02:02:28","609517172","2023-01-12","02:02:28"
"50564","Aqui nesse grupo tem elas Hem.","2023-01-12 02:03:03","5243341461","2023-01-12","02:03:03"
"50570","Bane logo","2023-01-12 02:03:28","5243341461","2023-01-12","02:03:28"
"50583","https://t.me/invictoexercitodecristo","2023-01-12 02:06:12","1077302985","2023-01-12","02:06:12"
"50584","Tô na missão de denunciar os canais golpitas","2023-01-12 02:06:45","1077302985","2023-01-12","02:06:45"
"50586","Olá Clube de Caça, seja bem vindo(a) ao Movimento Brasil Comunista","2023-01-12 02:08:25","609517172","2023-01-12","02:08:25"
"50587","👤 1674529958 changed name from K-mxpx to Clube de Caça","2023-01-12 02:08:26","300860929","2023-01-12","02:08:26"
"50589","Olá Raul, seja bem vindo(a) ao Movimento Brasil Comunista","2023-01-12 02:15:25","609517172","2023-01-12","02:15:25"
"50591","Olá John, seja bem vindo(a) ao Movimento Brasil Comunista","2023-01-12 02:15:56","609517172","2023-01-12","02:15:56"
"50598","Deve ser o efeito da vacina que tiveram que tomar pra nao infectarem os presos","2023-01-12 02:18:50","442044682","2023-01-12","02:18:50"
"50592","Me vê um cachorro bem passado por gentileza","2023-01-12 02:16:33","442044682","2023-01-12","02:16:33"
"50594","mas pra achar o ip que eu nao sei como fazer","2023-01-12 02:17:49","5193747664","2023-01-12","02:17:49"
"50595","Queria dizer que os minions mandaram o link desse grupo no grupo deles","2023-01-12 02:17:50","442044682","2023-01-12","02:17:50"
"50596","Esse aqui entra pra categoria 4 da escala alucinante","2023-01-12 02:18:11","5906321492","2023-01-12","02:18:11"
"50597","Acho que estão virando comunistas também","2023-01-12 02:18:22","442044682","2023-01-12","02:18:22"
"50599","Ele está no reserva agora OZZIE PENA
OZZIE PENA
https://t.me/institutovivagreta
https://t.me/bolosdoceseafins
https://t.me/AlborguettiVive","2023-01-12 02:18:51","967408202","2023-01-12","02:18:51"
"50601","Olá Albertty, seja bem vindo(a) ao Movimento Brasil Comunista","2023-01-12 02:23:00","609517172","2023-01-12","02:23:00"
"50602","Dilissa","2023-01-12 02:23:31","1691432860","2023-01-12","02:23:31"
"50603","Famoso cachorro quente 😂😂","2023-01-12 02:24:38","1691432860","2023-01-12","02:24:38"
"50605","Olá Sil, seja bem vindo(a) ao Movimento Brasil Comunista","2023-01-12 02:25:41","609517172","2023-01-12","02:25:41"
"50606","https://www.cartacapital.com.br/politica/superior-tribunal-militar-nega-habeas-corpus-a-bolsonaristas-presos-em-brasilia/","2023-01-12 02:26:01","844154553","2023-01-12","02:26:01"
"50610","👤 5860103043 changed name from Simone Esteves to Livia Corregio and username from (No Username) to @licorregio","2023-01-12 02:27:03","300860929","2023-01-12","02:27:03"
"50612","Olá Fernando, seja bem vindo(a) ao Movimento Brasil Comunista","2023-01-12 02:27:06","609517172","2023-01-12","02:27:06"
"50613","Nunca se viu na história de um país o judiciário vacinar o gado contra febre afitosa deste jeito kk","2023-01-12 02:27:22","1691432860","2023-01-12","02:27:22"
"50614","😂😂😂","2023-01-12 02:27:34","844154553","2023-01-12","02:27:34"
"50616","Olá Giovanna, seja bem vindo(a) ao Movimento Brasil Comunista","2023-01-12 02:27:38","609517172","2023-01-12","02:27:38"
"50630","Não aperta o botão de bloquear não kkk","2023-01-12 02:36:33","1691432860","2023-01-12","02:36:33"
"50619","OI Sil","2023-01-12 02:28:34","5193747664","2023-01-12","02:28:34"
"50620","Oi Irene _Machado","2023-01-12 02:28:52","1039445764","2023-01-12","02:28:52"
"50621","Como mando link de um grupo para cá ?","2023-01-12 02:29:28","1691432860","2023-01-12","02:29:28"
"50623","Aí vamos invadir o grupo sem anistia e com zueira","2023-01-12 02:29:46","1691432860","2023-01-12","02:29:46"
"50624","https://t.me/cerdadinho","2023-01-12 02:29:54","1855025353","2023-01-12","02:29:54"
"50625","https://t.me/patriaamandabrasil Grupo apenas para patriotas","2023-01-12 02:31:36","1691432860","2023-01-12","02:31:36"
"50626","E para cair matando","2023-01-12 02:31:45","1691432860","2023-01-12","02:31:45"
"50627","Pq apagam tudo","2023-01-12 02:31:51","1691432860","2023-01-12","02:31:51"
"50628","No Vale do Aço, o Frigorífico Paladar financiou golpistas fornecendo alimentação durante o acampamento no bairro Horto em Ipatinga.  O acampamento que durou 61 dias, custou cerca de R$ 40 mil.

Após os atos terroristas que destruíram prédios dos três poderes em Brasília, duas pessoas de Ipatinga foram presas. Jomar de Souza Andrade, dono do Frigorífico Paladar segue impune.

Em um dos vídeos recebidos, Jomar Souza conversa com o golpista André Ferreira, conhecido como André Caminhoneiro, que articulou o acampamento em Ipatinga, Vale do Aço: “o mínimo que eu posso fazer é estar com vocês aqui”, disse Jomar Souza à André Caminhoneiro. No outro, apoiadores agradecem as doações: “a Paladar tá patrocinando aqui. Hoje o churrasco é por conta deles”.

🔗Leia mais","2023-01-12 02:32:10","844154553","2023-01-12","02:32:10"
"50629","https://t.me/patriaamandabrasil Grupo apenas para patriotas","2023-01-12 02:36:24","1691432860","2023-01-12","02:36:24"
"50632","Vou mandar a parte do livro que li falando sobre o poder brando uma nova técnica usada para atrair poder .","2023-01-12 02:39:43","844154553","2023-01-12","02:39:43"
"50633","https://t.me/cerdadinho","2023-01-12 02:41:56","1855025353","2023-01-12","02:41:56"
