"message_id","message","message_utc","from_id","date","time"
"12377","Vídeo de Ivani Abreu","2022-10-01 01:14:22","1573914882.0","2022-10-01","01:14:22"
"12380","*LULA AGREDIU UM PADRE AO VIVO DURANTE O DEBATE*

Veja o vídeo proibido que a Globo não mostrou. 

Mostra todo o desprezo do ex-presidiário para com a Igreja.

- Abortista
- Defende a legalização das drogas 
- Desrespeita a fé alheia 

Lula é o mal que precisamos banir da vida pública.

Para isso, VOTE 22, BOLSONARO PRESIDENTE.","2022-10-01 02:46:43","","2022-10-01","02:46:43"
"12381","Acabou de sair: Pesquisa com 51 mil pessoas do Instituto Veritá 

Bolsonaro subiu com relação à pesquisa anterior.

Foi o instituto que mais se aproximou em 2018

Dá pra confiar numa pesquisa com 51 mil entrevistados?","2022-10-01 03:14:49","","2022-10-01","03:14:49"
