"message_id","message","message_utc","from_id","date","time"
"18418","https://www.youtube.com/watch?v=CC9lGcOHCSk","2022-09-26 20:41:00","850145064.0","2022-09-26","20:41:00"
"18416","https://youtu.be/pc2UufrG9ZE

Bem, se fosse o contrário?","2022-09-26 14:43:26","1686614434.0","2022-09-26","14:43:26"
"18417","Muito obrigado por conseguir 382 inscritos. Vocês sempre ajudam fortalecer o meu trabalho a favor da sigla MGTOW. Acho que devo melhorar a cada dia, para que os conteúdos tenham mais engajamento.

Boa tarde a todos os confrades! #400inscritos","2022-09-26 19:10:15","1686614434.0","2022-09-26","19:10:15"
