"message_id","message","message_utc","from_id","date","time"
"58462","Olha aí  um elu  pensando","2022-11-28 00:24:08","5984347795.0","2022-11-28","00:24:08"
"58463","Feminista fala língua de gênero  tem coisa mais deprimente que isso?","2022-11-28 00:24:50","5984347795.0","2022-11-28","00:24:50"
"58466","Vamos lá","2022-11-28 01:16:22","1438170283.0","2022-11-28","01:16:22"
"58467","Vamos parar tudo","2022-11-28 01:16:35","1438170283.0","2022-11-28","01:16:35"
"58475","Vamos passar com o barbeador no suvaco peludo de vcs","2022-11-28 02:11:37","5984347795.0","2022-11-28","02:11:37"
"58476","qual a mulher  que tenha 2 neurônios que  que vai deixar o suvaco parecendo as costa do Tony Ramos, e vai sair falando dili, elu, amiguis, companheiris , comunistis, Bolsonaris. tem que ser muito sem miolos mesmo.","2022-11-28 02:15:39","5984347795.0","2022-11-28","02:15:39"
"58574","https://youtu.be/dQVA3EZjXOI","2022-11-28 19:52:32","1751633003.0","2022-11-28","19:52:32"
"58609","Acho que é fake","2022-11-28 22:28:32","165008725.0","2022-11-28","22:28:32"
