"message_id","message","message_utc","from_id","date","time"
"19276","❤️❤️","2022-12-21 01:26:18","1305359116","2022-12-21","01:26:18"
"19275","ENXERGAR!!!
AHHHHH, COMO É BOM!
ENXERGAR COM O CORAÇÃO!
NÃO HESITE!
ACEITE A LENTE DA VERDADE!","2022-12-21 00:58:25","949245829","2022-12-21","00:58:25"
"19277","Da Amazônia para a França via ONGs com certeza já faz muitos anos que isso acontece todos dias   Você, que torce para que o Brasil dê certo, o mínimo que você pode fazer é repassar esse texto e o vídeo em anexo para todos os seus contatos. TODOS mesmo ... ,  sem preguiça, de cinco em cinco, já que este é o limite de envio no whatsApp, até completar o total da sua agenda. Faça isso pelo Brasil !!!","2022-12-21 03:22:59","1769705825","2022-12-21","03:22:59"
"19278","NEM PRECISA JUNTAR OS PARENTES PRA CALCULAR A RIQUEZA. Seleciona e compartilha, compartilha.","2022-12-21 13:18:44","949245829","2022-12-21","13:18:44"
"19279","TRAIDORES DA PATRIA

O que leva um brasileiro pedir a estrangeiros, para invadir o Brasil e fatiar a Amazônia?

Vejam os nomes ....

Traidores da pátria...

Prisão Perpétua neles...","2022-12-21 13:19:43","1472758682","2022-12-21","13:19:43"
"19280","*FERNANDO HENRIQUE CARDOSO PAGARÁ POR MUITO TEMPO TODO O MAL COLETIVO QUE ELE FEZ A TODOS OS BRASILEIROS.*

- FHC, ONGS, ROTHSCHILDS E O ROUBO DE OURO NA AMAZÔNIA.

🇧🇷✡6⃣6⃣6⃣😈💀

Fernando Henrique Cardoso é 
o maior ladrão e entreguista do Brasil,  é um dos cabeças das inúmeras quadrilhas de criminosos que garimpam, roubam e contrabandeiam ouro, diamantes, nióbio, esmeraldas, madeiras nobres, urânio, grafeno, zinco e outros minérios da Amazônia.

Foi FHC quem criou a Lei de deu origem as Reservas indígenas. Estas reservas foram demarcadas propositalmente sobre as áreas mais ricas da Amazônia. Óbvio!

Membro do Clube de Roma, à convite de David Rockffellers, o maçom Grau 33, cabeça da quadrilha do PSDB e ex-presidente do Brasil, foi também autor da Lei que proibia o ingresso do Exército e da Polícia Federal nas reservas indígenas, facilitando deste modo, que quadrilhas de mercenários, mineradoras e garimpeiros ilegais, se instalassem nestas regiões. 

O objetivo de FHC era facilitar que a família Rothschilds e suas exploradoras, pudessem se instalar nestas reservas. Obviamente sem se incomodarem com a presença da polícia ou do Exército.

Um General do Exército Brasileiro, Durval Nery denunciou este crime cometido na gestão de FHC. Nery disse que um comando de soldados brasileiros faziam uma ronda na fronteira das reservas. Os militares navegavam por um rio e de repente se depararam com um garimpo ilegal.

O local estava cercado de soldados mercenários. Todos armados. Havia uma bandeira inglesa hasteada em um mastro e os soldados mercenários protegiam um garimpo ilegal de uma das mineradoras da familia Rothschilds.

Nery denuncia que haviam várias mineradoras da família Rothschilds operando clandestinamente nas reservas indígenas.

FHC teve vários encontros na Inglaterra com Jacob e Natanael Rothschilds. Na certa se reunia para receber as milionárias comissões pelo roubo e pelo contrabando. As cifras podiam chegar à 600 bilhões de dólares por ano.

Foi também na gestão de FHC que várias ONGs receberam carta branca de seu governo para operarem na Amazônia. Mas seus crimes não pararam por aí.

FHC também tentou cometer um crime de lesa pátria contra o povo brasileiro. O comunista do PSDB tentou vender uma jazida de nióbio na Reserva Raposa do Sol avaliada em mais de 10 trilhões de dólares, pela medíocre bagatela de 600 milhões de dólares à família Rothschilds.

Por sorte o ex-senador Luiz Eduardo Magalhães impediu a venda. Meses depois Magalhães morreu de forma misteriosa. Foi envenenado por um tipo de veneno usado por agentes da KGB.

O comunista e golpista FHC foi o responsável pela organização das ""Diretas Já"", movimento que trouxe de volta ao Brasil, todas as quadrilhas terroristas, que nos anos 60 e 70, tentaram transformar o Brasil em uma Cuba tupiniquim. FHC criou o ""Bolsa Terrorista"" ao qual ele e Lula se beneficiaram durante mais de 20 anos com pensões ilegais acima de 20 mil. FHC nem foi caçado ou exilado. Mesmo assim se beneficiou da bolsa. Até parentes de Fidel Castro recebiam gordas indenizações às custas do suor do brasileiro. 

FHC também tentou desmembrar a Amazônia em 216 micro Nações indígenas. Um crime de lesa pátria que entregaria de vez, toda a Amazônia para exploração internacional. A OIT 169.

FHC cometeu diversos crimes como ministro da economia do governo Itamar Franco e principalmente como presidente. Crimes que somam mais de 8 trilhões de reais aos cofres públicos e nunca foi investigado.

Também foi um dos mandantes dos assassinatos de Sérgio Motta, PC Farias, Enéas Carneiro, Clodovil, Luis Eduardo Magalhães, Ulysses Guimarães, Tancredo Neves, Antonio C. Magalhães entre outros.

FHC é o pai do socialismo brasileiro e principal financiador do Foro de SP, mentor da URSAL, e um dos cabeças do tráfico de drogas e do contrabando na Amazônia.

Professor medíocre de sociologia, dava aulas subvertendo alunos ao comunismo e os arrigementava. Tem um patrimônio que incluí fazenda, cabeças de gado e diversos imóveis de luxo no Brasil e no exterior, avaliados em mais de 1 bilhão.

COMPARTILHE COM FORÇA!","2022-12-21 13:21:03","949245829","2022-12-21","13:21:03"
"19281","Eleições da mesa diretora, o que eu queria? 
- TRANSPARÊNCIA 

O papo furado de defesa das mulheres só funciona para aquela mulher que tá no cabresto, caso contrário ta permitido CENSURAR.

https://youtube.com/shorts/geD9Xu5V5wI?feature=share","2022-12-21 13:23:22","949245829","2022-12-21","13:23:22"
"19282","🇦🇷 AGORA: Autoridades argentinas estimam que QUATRO MILHÕES de pessoas estão nas ruas de Buenos Aires comemorando o título da Argentina na Copa do Mundo.

É praticamente 10% da população do país. Mas para lutar contra o comunismo fica todo mundo em casa, depois reclama que tá passando fome.","2022-12-21 13:24:44","949245829","2022-12-21","13:24:44"
"19283","Foto de jm parron68","2022-12-21 13:28:06","949245829","2022-12-21","13:28:06"
"19284","Parece montagem...","2022-12-21 13:29:00","949245829","2022-12-21","13:29:00"
"19288","Um povo idiotizado pelo futebol, enquanto isso a economia do país está uma bosta!","2022-12-21 17:05:23","1769705825","2022-12-21","17:05:23"
"19289","https://revistaoeste.com/mundo/ue-registra-mais-de-mil-casos-de-miocardite-em-criancas-vacinadas-contra-covid/","2022-12-21 17:08:17","949245829","2022-12-21","17:08:17"
"19290","Fake, invenção da CNN e #globolixo para tirar as pessoas das ruas e ajudar o randolfinho a vender os 130 milhões de teste fajutos de covid encalhados nas farmácias!","2022-12-21 17:10:33","1205957808","2022-12-21","17:10:33"
"19292","Ele esqueceu de falar do trabalhador que trabalha no chão de  fábrica para esses hipócritas e relevante comparar jogador e político... Mais quem leva o Brasil nas costas é o pobre trabalhador de fábrica...","2022-12-21 17:19:40","1769705825","2022-12-21","17:19:40"
"19293","Vagabundo","2022-12-21 17:28:06","466200028","2022-12-21","17:28:06"
"19294","🇧🇷 — URGENTE: Saiu no DOU - Diário Oficial da União, compra de munições para GLO - Garantia da Lei e da Ordem.

https://www.in.gov.br/en/web/dou/-/portaria-n-101-de-20-de-dezembro-de-2022-452405476

ACESSE: @economiabrasil","2022-12-21 17:48:59","5980918857","2022-12-21","17:48:59"
"19295","Será que procede","2022-12-21 17:49:31","5980918857","2022-12-21","17:49:31"
"19296","Sim","2022-12-21 20:36:02","1564829467","2022-12-21","20:36:02"
"19298","🔥🔥🔥🔥","2022-12-21 22:34:26","606409221","2022-12-21","22:34:26"
"19299","🇧🇷 — Alguns agentes da PF à paisana e infiltrados foram identificados na multidão,  expulsos do QG, e presos!

ACESSE: @economiabrasil","2022-12-21 22:44:31","5980918857","2022-12-21","22:44:31"
"19301","Ou o Bolsonaro está aproveitando os seus últimos dias com a caneta para munir as forças, mantendo um certo capital político com parte de sua base - comprou Jatos, Blindados etc.
Ou realmente ele está se preparando.

Como não sei...decido analisar os fatos com vcs! 
Vamos aguardar!","2022-12-21 22:44:43","1564829467","2022-12-21","22:44:43"
"19302","Esse texto inexiste !!","2022-12-21 22:46:23","463062257","2022-12-21","22:46:23"
"19303","Vi aqui e procede sim. O texto inexiste no link passado. O link correto : https://www.in.gov.br/en/web/dou/-/extratos-de-registro-de-precos-452072072","2022-12-21 22:49:42","463062257","2022-12-21","22:49:42"
"19304","Para dar entendimento a GLO mencionada no texto acima, segue o link do licitação aberta em Outubro: https://www.in.gov.br/web/dou/-/aviso-de-reabertura-de-prazo-435265217","2022-12-21 22:53:35","463062257","2022-12-21","22:53:35"
"19305","Munição não letal é para intimidar invasores (povo) seja tanto do lado A ou B. Coibir protestos violentos. Portanto já é um indício de que podem haver retaliações e assim estarem preparados para defender o espaço. Isso é claro, se alguma medida contundente for tomada.","2022-12-21 23:01:11","463062257","2022-12-21","23:01:11"
