"message_id","message","message_utc","from_id","date","time"
"55931","🎅 🇷🇺 Rússia lança vídeo de propaganda anti-ocidental retratando Putin como Papai Noel que substitui itens femininos por outros adequados para meninos, se livra de livros de propaganda LGBT e substitui uma foto dos dois pais dos meninos por uma foto de uma mãe e um pai .","2022-12-26 00:33:19","1422899489.0","2022-12-26","00:33:19"
"55933","Gorda","2022-12-26 00:56:06","5285523694.0","2022-12-26","00:56:06"
"55934","Sempre terão essas coisas em qualquer meio que seja da machosfera. 
Mas acredito que seja uma minoria barulhenta. 
O problema do mgtow do reside na sigla, quem segue mesmo o próprio caminho tá pouco se fodendo pra esse rótulo. 
A maioria nem sequer toca no nome, nem fala desses assuntos por aí. 
Concordo em muita coisa nessa filosofia de vida, e não veio problema algum do cara não querer se relacionar com mulheres em algum momento da vida ou não se  casar ,ter filhos,  coabitar , morar em casas separadas, que seja...
Há um fator, muito racional no que alguns caras dizem, àqueles que de fato todo o movimento das relações entre homens e mulheres na atualidade. 
O problema é uma parte se enveredar por caminhos obscuros, uma boa parte ainda de jovens, moleques que tiveram experiências ruins com mulheres, traumas de infância ou uma educação negligenciada, o que não justifica tais atos, e muito menos é a base de sustentação dessa ideia de vida.","2022-12-26 15:04:02","5725285814.0","2022-12-26","15:04:02"
"55936","Olá xará","2022-12-26 19:54:15","5759358078.0","2022-12-26","19:54:15"
"55937","Bem vindo","2022-12-26 19:54:18","5759358078.0","2022-12-26","19:54:18"
"55938","Vídeo filosófico de @RafaelAires","2022-12-26 20:54:50","1686614434.0","2022-12-26","20:54:50"
"55939","Esse é @sigmaredpill","2022-12-26 21:06:02","1703884766.0","2022-12-26","21:06:02"
"55941","O mlk é bravo 🏆","2022-12-26 21:11:51","2097386629.0","2022-12-26","21:11:51"
"55945","https://youtu.be/5I0LpDICdDs","2022-12-26 22:13:03","5074412516.0","2022-12-26","22:13:03"
