"message_id","message","message_utc","from_id","date","time"
"55724","Nossa,que maturidade...","2022-12-13 09:03:55","1444158278.0","2022-12-13","09:03:55"
"55725","E tem quem defenda essas vacas","2022-12-13 09:06:40","1444158278.0","2022-12-13","09:06:40"
"55726","Nem vem que até o Vegeta é casado","2022-12-13 09:09:34","1444158278.0","2022-12-13","09:09:34"
"55728","O redpill baixou a guarda e quase se fudeu 

https://youtu.be/3VtQE2phEYI","2022-12-13 15:39:54","5074412516.0","2022-12-13","15:39:54"
"55730","Que filho da puta kkkkkkkkkkkkkkkkk","2022-12-13 17:31:42","994638952.0","2022-12-13","17:31:42"
"55731","https://www.tecmundo.com.br/seguranca/256895-mulher-seduzia-homens-acessar-apps-bancarios-presa.htm","2022-12-13 22:24:49","1686614434.0","2022-12-13","22:24:49"
"55732","Algumas mulheres de extrema esquerda começaram a perceber que vender pack é algo REPUGNANTE, AVILTANTE!  

⭐️ @nofaprebirth","2022-12-13 22:50:52","1703884766.0","2022-12-13","22:50:52"
"55733","The Winter is coming","2022-12-13 23:01:06","5750998144.0","2022-12-13","23:01:06"
