"message_id","message","message_utc","from_id","date","time"
"55220","MGTOW É O NOVO GAY OU O NOVO FEMINISMO

O MGTOW MILITA POR NOVAS FORMAS DE SE RELACIONAR: 
WAIFUISMO, BONEQUISMO, VOLCEL, TRAVEQUISMO, GPZISMO... 
TAL QUAL O MOVIMENTO LGBT!!!! 

OS MGTOWS BRASILEIROS TEM SE CALCADO NO DISCURSO DA ISENTOSFERA POLITICA: 
MANIFESTAÇÃO PRA QUE? TODO POLITICO É IGUAL..... 
TAL QUAL OS ISENTOES, CENTRO ESQUERDA, MBL.... 

O MGTOW TRATA MULHERES QUASE COMO INIMIGAS. O QUASE É PQ MUITOS DELES SÓ QUERIAM TER UMA MULHERZINHA, MAS NAO CONSEGUEM OU TEM MEDO. 
É COMO UM FEMINISMO AO CONTRARIO. 

OS MGTOW ATUAIS QUEREM DESCONSTRUIR A SUA SEXUALIDADE, DIZEM QUE VOCÊ DEVE EXTRAVAZAR O INSTINTO COM FORMAS ARTIFICIAIS COMO WAIFUS. NÃO IRÃO MELHORAR A SUA VIDA EM NADA! 
- VOCÊ NÃO VAI CONSEGUIR MULHER, VAI BATER PUNHETA E JUNTAR GRANA PRA COMPRAR BONECAS OU PAGAR PUTAS. 
- VOCÊ NÃO TERÁ UM PAÍS MELHOR, BRASIL SE TORNARÁ VENEZUELA E VOCÊ COMERÁ CACHORRO PQ MGTOW DIZ PRA VC Q TODO POLITICO É IGUAL 

FALACIA DO ESPANTALHO? NÃO! 

FONTES: RACCON, CORUJA, KODAMA, TRICEL... 

MGTOW É UMA VIDA PATÉTICA E COVARDE!

PRA NAO SER INJUSTO AQUI, AS COISAS BOAS QUE ELES DIZEM: MALHAR, GANHAR GRANA E REDPILL. 

NAO CONFUNDA REDPILL COM MGTOW, SAO COISAS DIFERENTES. MGTOW É UMA TREMENDA DE UMA MERDA. UM DOS POUCOS AUTORES DO MGTOW DIZ QUE VOCÊ TEM Q FAZER BROTHERAGEM PRA SUBSTITITUIR MUIÉ.","2022-11-19 00:18:48","1703884766.0","2022-11-19","00:18:48"
"55241","Se esses seres do suvaco colorido estao reclamando é pq deve ser bom. 

Seja @sigmaredpill","2022-11-19 23:41:22","1703884766.0","2022-11-19","23:41:22"
