"message_id","message","message_utc","from_id","date","time"
"107687","Já que tavam no eixo","2022-11-19 16:52:11","762888746","2022-11-19","16:52:11"
"107688","ninguem liga para essas coisas","2022-11-19 16:52:29","918911833","2022-11-19","16:52:29"
"107704","Não quer dizer nda","2022-11-19 16:55:35","918911833","2022-11-19","16:55:35"
"107633","Você está certo.","2022-11-19 00:43:07","962946485","2022-11-19","00:43:07"
"107653","Bem bonitas","2022-11-19 01:05:16","5025399883","2022-11-19","01:05:16"
"107627","Exceedraft Amostra","2022-11-19 00:04:42","918911833","2022-11-19","00:04:42"
"107628","Se não vai compartilhar, não fica mostrando essas coisas pra deixar a gente babando. Estou brincando😀Faça o quiser.","2022-11-19 00:41:16","962946485","2022-11-19","00:41:16"
"107629","Faça o que quiser.","2022-11-19 00:41:44","962946485","2022-11-19","00:41:44"
"107630","todos esse ja esta compatolhado com o o dono do grupo, que é meu amigo","2022-11-19 00:42:14","918911833","2022-11-19","00:42:14"
"107631","Mas para vendedor eu não dou","2022-11-19 00:42:26","918911833","2022-11-19","00:42:26"
"107632","E nesse grupo esta cheio desses merdas","2022-11-19 00:42:47","918911833","2022-11-19","00:42:47"
"107634","Por isso fiz um grupo para pessoas que confio","2022-11-19 00:43:25","918911833","2022-11-19","00:43:25"
"107635","eles recebem sempre o melhor e tem coisa exclusiva que é bem melhor que esses","2022-11-19 00:43:51","918911833","2022-11-19","00:43:51"
"107636","e se eu postasse o povo iria ficar babando mais ainda","2022-11-19 00:44:13","918911833","2022-11-19","00:44:13"
"107637","robot keiji em HD em tela limpa","2022-11-19 00:44:33","918911833","2022-11-19","00:44:33"
"107638","Entre outros","2022-11-19 00:44:46","918911833","2022-11-19","00:44:46"
"107639","Assisti Adão Negro e é um filme muito bom... recomendo","2022-11-19 00:45:30","529191698","2022-11-19","00:45:30"
"107640","SH Figuarts querendo me levar à falência...","2022-11-19 01:00:22","529191698","2022-11-19","01:00:22"
"107641","Armaduras do Anime baseado no manga do Ultraman","2022-11-19 01:00:46","529191698","2022-11-19","01:00:46"
"107642","eu já tenho as Ultraman, Ultraseven e Ace do mangá","2022-11-19 01:01:03","529191698","2022-11-19","01:01:03"
"107643","mas terei que comprar a do Taro...","2022-11-19 01:01:23","529191698","2022-11-19","01:01:23"
"107644","do Jack","2022-11-19 01:01:35","529191698","2022-11-19","01:01:35"
"107646","e a zoffy","2022-11-19 01:02:05","529191698","2022-11-19","01:02:05"
"107654","pretendo ter todos que forem lançados","2022-11-19 01:31:26","529191698","2022-11-19","01:31:26"
"107647","e tem os riders do Geats, que tá uma série muito bacana","2022-11-19 01:02:21","529191698","2022-11-19","01:02:21"
"107649","foda demais","2022-11-19 01:02:35","529191698","2022-11-19","01:02:35"
"107650","So esse que eu compraria,","2022-11-19 01:03:20","918911833","2022-11-19","01:03:20"
"107651","O resto eu não acho tão interessante","2022-11-19 01:03:40","918911833","2022-11-19","01:03:40"
"107652","do geats achei bonito os Chibi tipo chaveiro","2022-11-19 01:04:16","918911833","2022-11-19","01:04:16"
"107657","comprava fácil esses dois tbm","2022-11-19 01:32:38","529191698","2022-11-19","01:32:38"
"107659","e como vc compram isso?","2022-11-19 03:12:40","1995154642","2022-11-19","03:12:40"
"107660","https://t.me/tokuplaycdseseries","2022-11-19 07:34:51","5425919916","2022-11-19","07:34:51"
"107661","Bom dia","2022-11-19 09:00:24","821765940","2022-11-19","09:00:24"
"107662","Para vc tambem","2022-11-19 09:00:37","918911833","2022-11-19","09:00:37"
"107663","Bundinha","2022-11-19 10:27:54","762888746","2022-11-19","10:27:54"
"107665","As vezes é um bundão..😂😂😂","2022-11-19 12:09:42","529191698","2022-11-19","12:09:42"
"107667","Oi td bem? Quer tc?","2022-11-19 13:07:10","529191698","2022-11-19","13:07:10"
"107668","Kkkkkkk","2022-11-19 13:30:57","762888746","2022-11-19","13:30:57"
"107669","o que é tc?","2022-11-19 13:48:41","918911833","2022-11-19","13:48:41"
"107670","Tc é bater papo, conversar","2022-11-19 14:26:40","821765940","2022-11-19","14:26:40"
"107671","""Tá chato""","2022-11-19 14:51:44","529191698","2022-11-19","14:51:44"
"107672","Essa é velha, é ""teclar"".
Usar um teclado de um computador pra conversar com outra pessoa pela internet.","2022-11-19 14:56:38","81951467","2022-11-19","14:56:38"
"107673","Poxa gente, assim vcs estragam a piada.. eu ia dar a deixa pro cara reclamar pela enesima vez dos vídeos que foram roubados...😂😂😂","2022-11-19 15:45:29","529191698","2022-11-19","15:45:29"
"107674","Review do quadrinhos na sarjeta sobre Black sun tá muito bom, resumiu o que eu sinto pela série e o quão nada a ver são esses canais emburrados por achar ""lacrador"" demais","2022-11-19 15:58:21","762888746","2022-11-19","15:58:21"
"107675","eu vou reclamar por que, so quero ferrar os vendedores que tem no grupo","2022-11-19 16:48:17","918911833","2022-11-19","16:48:17"
"107676","Eu tenho midias muito melhores","2022-11-19 16:48:29","918911833","2022-11-19","16:48:29"
"107677","Não é por nada não, mas as poses antigas dos kamen rider eram zuadas kkkk","2022-11-19 16:49:53","762888746","2022-11-19","16:49:53"
"107678","Digo, é por algo sim","2022-11-19 16:49:58","762888746","2022-11-19","16:49:58"
"107686","Japão provavelmente nao liga pra essas menções, não chegaram a sofrer tanto pra eles","2022-11-19 16:52:06","762888746","2022-11-19","16:52:06"
"107679","Puts","2022-11-19 16:50:13","762888746","2022-11-19","16:50:13"
"107680","A armadura do stronger nao deixa ele fazerKKKKKKKKKKK","2022-11-19 16:50:30","762888746","2022-11-19","16:50:30"
"107681","Era uma homenagem ao nazismo, tem varios simbolos nazistas em todas as obras, inclusive sentai","2022-11-19 16:51:03","918911833","2022-11-19","16:51:03"
"107682","so foram removidas a maioria por causa de ser nazismo","2022-11-19 16:51:27","918911833","2022-11-19","16:51:27"
"107683","Shocker é uma alusão ao nazismo tbm","2022-11-19 16:51:35","762888746","2022-11-19","16:51:35"
"107684","sim","2022-11-19 16:51:40","918911833","2022-11-19","16:51:40"
"107685","so olhar os simbolos e os simbolos nazistas","2022-11-19 16:52:00","918911833","2022-11-19","16:52:00"
"107689","Outra coisa que fui lembrar recentemente, é que Black sun é o nome de um símbolo nazista kkkk","2022-11-19 16:52:44","762888746","2022-11-19","16:52:44"
"107690","cada um tem suas crenças e ninguem esta nem ai com isso","2022-11-19 16:52:48","918911833","2022-11-19","16:52:48"
"107691","Ah, bastante gente","2022-11-19 16:52:59","762888746","2022-11-19","16:52:59"
"107692","la cada um é por si","2022-11-19 16:53:02","918911833","2022-11-19","16:53:02"
"107693","ninguem perde o tempo com conversas","2022-11-19 16:53:23","918911833","2022-11-19","16:53:23"
"107694","sobre essas coisas","2022-11-19 16:53:33","918911833","2022-11-19","16:53:33"
"107695","Vai por mim, segunda guerra é até meio recente, tá cheio de sobrevivente pra contar a história","2022-11-19 16:53:35","762888746","2022-11-19","16:53:35"
"107696","na realidade o japão hoje quase ninguem conversa","2022-11-19 16:53:46","918911833","2022-11-19","16:53:46"
"107697","sim","2022-11-19 16:53:57","918911833","2022-11-19","16:53:57"
"107698","Tirando os caras que se casam com roupa de nazista","2022-11-19 16:54:01","762888746","2022-11-19","16:54:01"
"107699","nunca vi nada disso no japão","2022-11-19 16:54:23","918911833","2022-11-19","16:54:23"
"107700","mas se casar ja é um milagre","2022-11-19 16:54:38","918911833","2022-11-19","16:54:38"
"107701","E la a gente casa com qualquer roupa","2022-11-19 16:54:55","918911833","2022-11-19","16:54:55"
"107702","Se quiser pode casar ate de cosplay","2022-11-19 16:55:15","918911833","2022-11-19","16:55:15"
"107703","que ninguem via ligar","2022-11-19 16:55:23","918911833","2022-11-19","16:55:23"
"107705","Já vi fotos de um cara que casou com cosplay de soldado da ss","2022-11-19 16:58:45","762888746","2022-11-19","16:58:45"
"107706","E tbm que vendem esse uniforme em lojas de cosplay em alguns lugares","2022-11-19 16:59:04","762888746","2022-11-19","16:59:04"
"107707","vende la roupa de tudo","2022-11-19 17:18:43","918911833","2022-11-19","17:18:43"
"107708","Em akihabara vende fantasia de tudo que vc pensar","2022-11-19 17:19:10","918911833","2022-11-19","17:19:10"
"107709","tudo mesmo","2022-11-19 17:19:18","918911833","2022-11-19","17:19:18"
"107710","https://youtu.be/UR1P4S50Zz0","2022-11-19 17:43:05","915169679","2022-11-19","17:43:05"
"107711","Acho que os amigos vão gostar.","2022-11-19 17:43:23","915169679","2022-11-19","17:43:23"
"107712","Como se eles ligassem pra vc🤣🤣🤣","2022-11-19 17:51:37","529191698","2022-11-19","17:51:37"
"107713","Lógico que não sofreram pros nazistas... eram amigos deles","2022-11-19 17:52:30","529191698","2022-11-19","17:52:30"
"107714","Nazismo é uma ideologia terrível e nojenta, dizer que não liga para algo mostra a falta total de empatia para com o próximo... na escala de filhadaputice nazista, pra mim, só perde pra pedófilo","2022-11-19 17:55:53","529191698","2022-11-19","17:55:53"
"107715","Mas ambos tem algo em comum... são melhores mortos","2022-11-19 17:56:15","529191698","2022-11-19","17:56:15"
"107716","Aqui onde eu moro acontecem coisas peculiares","2022-11-19 18:23:28","762888746","2022-11-19","18:23:28"
"107717","Um garoto da minha sala desenhou uma suástica num corretivo, e sempre que acontece algo relacionado à escuridão, sombras e tals, remetem à aparência dele.... Acho que deu pra sacar né","2022-11-19 18:24:47","762888746","2022-11-19","18:24:47"
"107718","Só acho que ele não combina com a ideologia kkkkk","2022-11-19 18:25:02","762888746","2022-11-19","18:25:02"
"107719","Meu deus mano kkkkkkk","2022-11-19 18:25:34","1393358031","2022-11-19","18:25:34"
"107720","Sei que foi uma analogia ruim, mas pra não perder o respeito kkkkk","2022-11-19 18:26:09","762888746","2022-11-19","18:26:09"
"107721","E sim, isso aconteceu","2022-11-19 18:26:14","762888746","2022-11-19","18:26:14"
"107722","Credo menor","2022-11-19 18:27:46","1393358031","2022-11-19","18:27:46"
"107723","Amazon e Ichigo os melhores","2022-11-19 18:28:13","1393358031","2022-11-19","18:28:13"
"107724","Aí já começa tudo errado... usar símbolo nazista, mesmo que sendo ""na brincadeira"" te marca como alguém do mal imediatamente... e tem que ser assim mesmo","2022-11-19 18:30:06","529191698","2022-11-19","18:30:06"
"107725","Mano, jovem tem que ser extinto mesmo, tem suástica em tudo que é mesa da minha sala","2022-11-19 18:30:44","762888746","2022-11-19","18:30:44"
"107726","Os famoso shitposters","2022-11-19 18:31:12","1393358031","2022-11-19","18:31:12"
"107727","Nem todos, apenas os mal encaminhados e com tendência a fazer merda","2022-11-19 18:32:28","529191698","2022-11-19","18:32:28"
"107728","Claro que nao iria desejar a morte de todos, afinal sou um kkkkk","2022-11-19 19:31:06","762888746","2022-11-19","19:31:06"
"107730","Quem tem o kamen rider black sun versão amazon prime por favor?","2022-11-19 22:59:14","444120892","2022-11-19","22:59:14"
"107731","não póde postar no grupo","2022-11-19 23:11:41","918911833","2022-11-19","23:11:41"
"107732","A new zect tem, vc pode abaixar de la e assistir","2022-11-19 23:12:09","918911833","2022-11-19","23:12:09"
"107733","Opa, desculpe, obrigado ✌🏻👍🏻","2022-11-19 23:12:48","444120892","2022-11-19","23:12:48"
"107734","GALERA, ALGUÉM AÍ TERIA A LEGENDA DE OHRANGER Vs. KAKURANGER?","2022-11-19 23:43:31","834820862","2022-11-19","23:43:31"
"107735","Curti um bocado esse mangá baseado na série dos anos 60 😁 Já na expectativa pra comprar o volume 2","2022-11-19 23:46:07","1230865260","2022-11-19","23:46:07"
