"message_id","message","message_utc","from_id","date","time"
"625","💚💛💙🤍🙏🙌CARO PATRIOTAS VENHO PEDIR DE TODO CORAÇÃO, QUE NA PASSAGEM DE ANO, EM VEZ DE VCS IREM VER QUEIMA DE FOGOS SEI LA O QUÊ, EM VEZ DISSO PASSEM ORANDO CLAMANDO PRIMEIRO A DEUS O CRIADOR DOS CÉUS E TERRA,E TUDO QUE HÁ,  POR SALVAÇÃO POR MISERICÓRDIA,
DEUS NÃO PODE USAR O SEU INSTRUMENTO DE SALVAÇÃO, SE O POVO NÃO CLAMAR À ELE.
SO SABEM PEDIR SÓ PEDIR À DEUS, SEM NADA RETRIBUIR,
QUAL RETRIBUIÇÃO?O SEU.AMOR VERDADEIRO POR ELE, NÃO SEJAM EGOÍSTAS, SO  PEDINDO.
SERÁ QUE É TÃO DIFICIL AMAR A DEUS A SUA BONDADE E MISERICÓRDIA ATÉ HOJE!?
ALGUNS PODEM ATÉ A PENSAR SE EU FOR.PARA FRENTE DOS QUARTEIS VOU MORRER.
VÃO ME PRENDER...
SÓ UM LEMBRENTE:
PIOR VAI SER CAIR NAS MÃOS DO COMUNISMO, MORTE NA CERTA,VÃO PERSEGUIR CAÇAR VCS DE TODO JEITO.
NÃO TEM PRA ONDE CORRER POVO BRASILEIRO ,SO PARA OS BRAÇOS DO SENHOR.
SE TIVER QUE MORRER OU SER PRESO QUE SEJA PELO MENOS COM HONRA..
E NÃO COMO UM(A)COVARDE.
SEJAM DIGNOS(AS) E TENHAM ORGULHO, DE DIZER ,EU PERTENÇO AO EXÉRCITO DO NOSSO SENHOR JESUS CRISTO.
CLAMEM A DEUS DE TODO CORAÇÃO, E ELE COMO PAI VAI OS OUVIR.
SO ESTÁ ESPERANDO O SEU CHAMADO.
AMÉM !?🙏🙌🇧🇷🇮🇱","2022-12-31 00:40:48","","2022-12-31","00:40:48"
"626","🌩

🇧🇷🇧🇷🇧🇷🪖🥾🪖🥾🪖🥾


Corrammmm vermelhinhos🏃🏿‍♀🏃‍♀🏃🏻🏃🏻🏃🏻🏃🏻🤣🤣🤣🤣🤣🤣","2022-12-31 14:48:13","","2022-12-31","14:48:13"
