"message_id","message","message_utc","from_id","date","time"
"37940","Eles mesmo fala, milhões e milhões","2023-01-12 20:59:12","1113578570.0","2023-01-12","20:59:12"
"38007","https://www.jornaldacidadeonline.com.br/noticias/45336/o-fortissimo-relato-de-um-policial-federal-sobre-o-que-viu-na-academia-da-pf-em-brasilia","2023-01-12 22:22:38","140114632.0","2023-01-12","22:22:38"
"37996","É isto que estou falando desde o início. Eu estou disposta a fazer, mas a maioria está preocupada com as contas. As contas a gente vê depois, ninguém vai morrer de fome. Vamos juntar as forças e vamos fazer.","2023-01-12 22:02:30","2021580715.0","2023-01-12","22:02:30"
"37998","Pessoal uma dica importante quem estava na manifestação do QG, no domingo e tirou fotos e colocou nas mídias sociais, APAGUEM....vi um vídeo de uma advogada q esta com cliente q foi preso por causa de uma foto ...as leis não estão sendo cumpridas...fica a dica aí!","2023-01-12 22:13:54","925930250.0","2023-01-12","22:13:54"
"38008","Essa culpa eu não carrego! 😉 Faz o L seus TROUXAS! 🤡","2023-01-12 22:22:54","1580554185.0","2023-01-12","22:22:54"
"38009","Vídeo de Roberto","2023-01-12 22:23:14","819516406.0","2023-01-12","22:23:14"
"38010","Desculpa não vou apagar, ainda estou marcando todos jornalista do exterior","2023-01-12 22:23:18","5606667824.0","2023-01-12","22:23:18"
"38011","O mundo precisa ver o que está acontecendo","2023-01-12 22:23:48","5606667824.0","2023-01-12","22:23:48"
"38012","Vídeo de Roberto","2023-01-12 22:24:09","819516406.0","2023-01-12","22:24:09"
"38014","Fake ñ divulga","2023-01-12 22:28:22","251310470.0","2023-01-12","22:28:22"
"38020","Não sabia que era Fake .. que merda hein . O povo perde tempo par fazer fake e agente não sabe , acaba compartilhando .Obrigada pur avisar","2023-01-12 22:31:02","5647842346.0","2023-01-12","22:31:02"
"38022","Nelson Nishiwaki, [12 de jan de 2023 às 19:29]
https://g1.globo.com/politica/noticia/2023/01/12/pf-encontra-na-casa-de-anderson-torres-minuta-de-decreto-para-instaurar-estado-de-defesa-no-tse-medida-e-inconstitucional.ghtml","2023-01-12 22:31:19","948277503.0","2023-01-12","22:31:19"
"38024","Tá um inferno este país","2023-01-12 22:38:12","1030902615.0","2023-01-12","22:38:12"
"38025","Vergonha","2023-01-12 22:39:23","5699921187.0","2023-01-12","22:39:23"
"38026","Alguém já consegue pensar em uma solução, já que não podemos mais nos manifestar? Não é fácil achar uma solução quando somos o mais forte e ao mesmo tempo mais fraco poder. Pensei em algumas alternativas 
- não pagar mais impostos ou só pagar no último dia do ano
- fazer um documento para algum país de confiança, passando o poder de tutela da nossa metade do Brasil 
- cavar até separar uma parte do país do continente
Ta difícil de achar solução….","2023-01-12 22:40:52","1862377614.0","2023-01-12","22:40:52"
"38027","😔","2023-01-12 22:41:07","5876952339.0","2023-01-12","22:41:07"
"38028","Não consigo nem raciocinar de tanta raiva","2023-01-12 22:41:48","1030902615.0","2023-01-12","22:41:48"
"38029","É real??","2023-01-12 22:42:11","5082699281.0","2023-01-12","22:42:11"
"38030","A que ponto chegamos","2023-01-12 22:42:30","5699921187.0","2023-01-12","22:42:30"
"38031","Ainda tem gente que acha que ta tudo normal","2023-01-12 22:42:46","5699921187.0","2023-01-12","22:42:46"
"38032","Verdade","2023-01-12 22:43:03","1030902615.0","2023-01-12","22:43:03"
"38063","⁣Relatório enviado⁣⁣⁣⁣⁣","2023-01-12 23:03:33","1636160384.0","2023-01-12","23:03:33"
"37798","Então essa aumento não chegou pq ?","2023-01-12 19:16:18","1987841540.0","2023-01-12","19:16:18"
"37851","Realmente só vi falando besteiras 🤡, jornal onde moro, falando sobre os hotéis que ele ficava nem chegavam a 400$, e os do lula de luxo porrada de dinheiro, nem assisto nem uma emissora muito menos Globolixo 🤮, só mostra oq convém a eles ,ou seja só mentiras","2023-01-12 19:41:40","5489193442.0","2023-01-12","19:41:40"
"37852","https://gazetabrasil.com.br/brasil/2023/01/12/dpdf-e-dpu-pedem-liberacao-de-criminosas-em-semiaberto-para-acomodar-manifestantes-presas/","2023-01-12 19:42:29","234690294.0","2023-01-12","19:42:29"
"37853","Em 2021 fiz um levantamento dos país que tem a liberação do aborto. 
No geral, os países  tem um aumento no primeiro ano de aborto. 
No segundo ano, quase todos os país deve uma queda de 92% de aborto. 
As clínicas não oferecem só o aborto, mas oferta psicólogo, assistência social e médica tem programa voltado para planejamento familiar dentre outro serviços de saúde oferecidos.","2023-01-12 19:43:29","1917399292.0","2023-01-12","19:43:29"
"37857","Bandido aguardando a chagada dos patriotas 👆🏽Aí é só pegar o bandido, vamos ajudar ele a ficar famoso no Brasil 👆🏽e diz q quem quebrou tudo forsm os patriotas do bem✌🏾 Cadê a polícia federal??? 🤔","2023-01-12 19:46:06","5264048481.0","2023-01-12","19:46:06"
"37858","Ops.","2023-01-12 19:47:20","5174384743.0","2023-01-12","19:47:20"
"37860","Qdo mãe e bebê são saudáveis não deixa de ser assassinato.","2023-01-12 19:49:24","5174384743.0","2023-01-12","19:49:24"
"37862","Dr. Enéas - Juros da Dívida Pública o principal problema do Brasil.","2023-01-12 19:59:33","1771755265.0","2023-01-12","19:59:33"
"37884","😳","2023-01-12 20:22:02","5876952339.0","2023-01-12","20:22:02"
"37865","O 3000 é pago.
So tem free período de teste.
Estou usando o proton vpn e nada a reclamar","2023-01-12 19:59:52","5722428801.0","2023-01-12","19:59:52"
"37866","A não ser o que salvo em lei, o Brasil não tem capacidade como os outros países para ter legalização.","2023-01-12 20:10:23","1917399292.0","2023-01-12","20:10:23"
"37867","Desculpa para mim aborto é crime, se a pessoa não quer ter  filho usa  camisinha, no posto de saúde da de graça, anticoncepcional da de graça…","2023-01-12 20:11:13","1987841540.0","2023-01-12","20:11:13"
"37868","Pessoal olha essa denuncia aqui !","2023-01-12 20:12:03","5722428801.0","2023-01-12","20:12:03"
"37885","Para fazer o aborto ela sabe ir para procurar se proteger não","2023-01-12 20:22:53","1987841540.0","2023-01-12","20:22:53"
"37869","Agora se for caso de estupro tudo bem infelizmente tenho que aceitar a decisão da mãe, mas isso já está legalizado no país","2023-01-12 20:12:21","1987841540.0","2023-01-12","20:12:21"
"37870","Eu penso assim se não quer criança use camisinha use anticoncepcional q como eu falei da de graça nos postos, agora ir buscar a camisinha no sus ninguém quer, mas ir fazer o aborto sim, não entendo a lógica das pessoas…","2023-01-12 20:14:05","1987841540.0","2023-01-12","20:14:05"
"37871","Sim. Mas acho que essa minuta do min Anderson pode acabar respingando no PR. O Xandão não vai aceitar isso quieto 😤😤😤","2023-01-12 20:14:45","638402288.0","2023-01-12","20:14:45"
"37872","Ministro dos direitos humanos, diz que manifestantes não merecem ser tratados com direitos humanos , mas se preocupa com outros tipos de presidiários !!!
#CEGNEWS 
@fabricioceg","2023-01-12 20:16:05","5700956615.0","2023-01-12","20:16:05"
"37873","Li que era um documento em rascunho, então subjugo que esse documento nem teve o conhecimento do presidente. E se teve ele não acatou por ser ilegal, já que ele estava tomando medidas dentro das 4 linhas.","2023-01-12 20:17:53","838454384.0","2023-01-12","20:17:53"
"37875","Seu pensamento é bem errado. Trabalhei na saúde, e agora estou na assistência social. 
E vejo todo o dia a realidade da pessoa. 
Um dos relatos diários, uma adolescente não sabia como a criança ia sair, isso foi na hora do parto. 
Como também muitas mulheres não conhece o próprio corpo. Não conhece os sinais do seu corpo e como funciona até mesmo um ciclo menstrual. 
Outra realidade do meu dia dia é ver pessoas quem nunca foram anum médico por que não sabia como ir. 

Muito fácil falar que tem tudo de graça no posto. Mas educar e ensinar ninguém quer. 
Aí fala que ninguém quer. Isso é fácil.","2023-01-12 20:19:06","1917399292.0","2023-01-12","20:19:06"
"37880","Acho que o povo vai parar o comércio quando pesar no bolso deles, aumentarem os preços, a inflação subir e os mais pobres sentirem o peso do comunismo, aí acredito até que muitos da esquerda saíram para as ruas... questão de tempo","2023-01-12 20:19:18","1396446576.0","2023-01-12","20:19:18"
"37882","Isso mesmo 👏👏👏só não entendi o que é esse subjugo","2023-01-12 20:21:21","638402288.0","2023-01-12","20:21:21"
"37883","Bem eu tive muita orientação em casa, e soube bem diferenciar as coisas, uma criança é totalmente diferente e ano está em discussão. Agora uma mulher não saber ir ao médico e como ela sabe chegar no médico para fazer um aborto ?","2023-01-12 20:21:44","1987841540.0","2023-01-12","20:21:44"
"37887","Um em um milhão, se você teve orientação. 
Quando eu disse que não sabe chegar a um médico.
Ela não sabe para nada. 
Falar é muito fácil. Mas a realidade é outra que ninguém quer saber. Apenas julgar.","2023-01-12 20:23:48","1917399292.0","2023-01-12","20:23:48"
"37888","Então estão entrando encontato para descobrir grupos q participamos. Se alguém desconhecido te no pv e te pedir algum grupo não informe a ninguem.","2023-01-12 20:24:06","5682270422.0","2023-01-12","20:24:06"
"37890","Como ela aprendeu a fazer sexo ?","2023-01-12 20:24:24","1987841540.0","2023-01-12","20:24:24"
"37891","Sabia que sexo é biológico? 
Puro instinto animal?
Pôs é, sexo é assim. 
O sexo não é uma construção social.","2023-01-12 20:25:18","1917399292.0","2023-01-12","20:25:18"
"37892","Pode até ser, mas as pessoas aprendem a fazer sexo com tanta facilidade e as coisas que precisam aprender q ir no médico não dar a mínima","2023-01-12 20:26:33","1987841540.0","2023-01-12","20:26:33"
"37893","Conheço mulheres q teve três filho e quer abortar o quatro q está vindo, essa mulher não sabe que sexo traz criança ?","2023-01-12 20:27:21","1987841540.0","2023-01-12","20:27:21"
"37894","Pilula ja foi inventada ha mais de 50 anos...
Camisinha é mais velha ainda...
E tem DIU , diafragma etc...
Sera que essas burras não sabem dissob?","2023-01-12 20:28:59","5696219860.0","2023-01-12","20:28:59"
