"message_id","message","message_utc","from_id","date","time"
"4548","Vídeo de Valdir Tj boi no rolete BOI NO ROLETE","2022-11-13 01:45:45","5428584228.0","2022-11-13","01:45:45"
"4568","A fraude eleitoral e a ilusão de liberdade  https://dunapress.org/2022/11/13/a-fraude-eleitoral-e-a-ilusao-de-liberdade/","2022-11-13 08:11:12","","2022-11-13","08:11:12"
"4569","Español: El fraude electoral y la ilusión de libertad https://dunapress.org/2022/11/13/a-fraude-eleitoral-e-a-ilusao-de-liberdade/","2022-11-13 08:11:12","104784211.0","2022-11-13","08:11:12"
"4570","English: Electoral fraud and the illusion of freedom https://dunapress.org/2022/11/13/a-fraude-eleitoral-e-a-ilusao-de-liberdade/","2022-11-13 08:11:13","104784211.0","2022-11-13","08:11:13"
"4571","Não gosto do Diogo mas ele tem toda razão neste caso. Fica aí o aviso","2022-11-13 08:17:27","","2022-11-13","08:17:27"
"4573","Español: No me gusta Diogo pero tiene toda la razón en este caso. Ahí está el aviso","2022-11-13 08:17:28","104784211.0","2022-11-13","08:17:28"
"4574","English: I don't like Diogo, but he's absolutely right about this. Here is the warning","2022-11-13 08:17:28","104784211.0","2022-11-13","08:17:28"
