"message_id","message","message_utc","from_id","date","time"
"48632","Se esse homem entrar no grupo que você faz parte denuncie ele é infiltrado. Desinformando as pessoas falando mal dos apoiadores do Bolsonaro.","2022-11-27 02:26:51","1525740896.0","2022-11-27","02:26:51"
"48689","*Lewandovsky*                           O primeiro a fugir do Brasil                      🤣🤣🤣🤣🤣🤣","2022-11-27 20:54:38","1525740896.0","2022-11-27","20:54:38"
"48626","https://youtu.be/sMw8CFQS-KQ","2022-11-27 00:45:53","1275978031.0","2022-11-27","00:45:53"
"48627","https://www.instagram.com/reel/Cklo5WfMOpu/?igshid=ZTA1ZTQyMGU=","2022-11-27 01:22:37","1003848304.0","2022-11-27","01:22:37"
"48628","https://youtu.be/sMw8CFQS-KQ","2022-11-27 01:55:24","1275978031.0","2022-11-27","01:55:24"
"48630","Tem que pegar esse safado e fazer ele tomar água com xixi tbem e prender ele. Safado","2022-11-27 02:12:15","1525740896.0","2022-11-27","02:12:15"
"48634","https://youtu.be/FsbQjK9PZmA","2022-11-27 02:29:37","1525740896.0","2022-11-27","02:29:37"
"48642","Guarujá, Hotel Casa Grande...eles estão  presos na própria armadilha que criaram!!!","2022-11-27 03:04:54","1525740896.0","2022-11-27","03:04:54"
"48646","https://youtu.be/Lv2zBGlWKOg","2022-11-27 03:05:50","1256381691.0","2022-11-27","03:05:50"
"48647","Bom dia amigos patriotas!!
Estamos precisando da ajuda de vocês com qualquer valor em dinheiro. Para mantermos os sanitários químicos do quartel em funcionamento precisamos esgotá-los. A empresa cobra 250 por cada um. Já estamos devendo 1500,00 reais. 
Contribua com a quantia que for possível.Ao contribuir mande o comprovante para mim ou Tereza. 

Segue o Pix do encarregado. Pessoa da nossa confiança.

Kayo Gustavo
098.118.844-39","2022-11-27 03:20:53","1525740896.0","2022-11-27","03:20:53"
"48650","https://youtu.be/6Kp_jMV0Yr4","2022-11-27 03:44:58","1525740896.0","2022-11-27","03:44:58"
"48652","https://twitter.com/MarceloCRedeTV/status/1596630876573822976?t=03apjR_X4ePlEvGUp5CDxw&s=35","2022-11-27 04:46:17","1032142230.0","2022-11-27","04:46:17"
"48654","Pessoal , precisamos encher as ruas amanhã, frente aos QG, não sei se é vdd que irão ver quantidade de manifestantes para oficializar , precisamos mostrar que nao desistimos, será o *DOMINGO DA LIBERDADE*
Ouçam esse áudio, não acredito em *informação privilegiada*, apenas dedução lógica que precisamos de volume e Constancia 👇","2022-11-27 04:51:32","1525740896.0","2022-11-27","04:51:32"
"48656","https://youtu.be/296zxAxdeSg

Importante!

Campanha oficial contra os abusos do atual stf

🇧🇷🇧🇷🇧🇷
🙏🙏🙏","2022-11-27 04:51:32","1525740896.0","2022-11-27","04:51:32"
"48664","Agora engrossa de vez as manifestações nas portas dos Quartéis do EB!   Anúncio do fim do ""bolsa família"" pelo picolé de chuchu vai revoltar o povão que fez o L e agora vão correr p/ os braços do tiozão Jair!  E o anúncio veio da boca do chuchu... escute bem! FAZ.     L","2022-11-27 04:54:27","1525740896.0","2022-11-27","04:54:27"
"48669","https://youtu.be/yngclaLK8Do","2022-11-27 07:21:56","1525740896.0","2022-11-27","07:21:56"
"48670","https://youtu.be/Pgyz5xbUJOshttps://youtu.be/Pgyz5xbUJOs","2022-11-27 07:34:25","1596386203.0","2022-11-27","07:34:25"
"48671","https://youtu.be/eUM49jB8bnwhttps://youtu.be/eUM49jB8bnw","2022-11-27 09:59:50","1596386203.0","2022-11-27","09:59:50"
"48672","https://youtu.be/sTR5uaHFTgc","2022-11-27 10:57:25","976062416.0","2022-11-27","10:57:25"
"48673","Entrevista espetacular do desembargador aposentado Sebastião Coelho ao programa Sem Filtro da revista Oeste.

Augusto Nunes, FIUZA, Ana Paula Henkel e Paula Leal fazem perguntas que nenhum outro veículo teria, e as respostas superam os níveis de coragem de muitas supostas autoridades do Brasil.

Inscreva-se no canal e compartilhe nas ruas para que outras pessoas conheçam este trabalho, precisamos furar a bolha da Internet já.



https://youtu.be/Ten0xtMGdR4","2022-11-27 11:25:15","655594504.0","2022-11-27","11:25:15"
"48674","https://youtu.be/j2A54xTo230","2022-11-27 14:35:46","976062416.0","2022-11-27","14:35:46"
"48675","Estive com meu pai nesses últimos dois dias!inclusive dormimos no mesmo quarto, ou melhor, não dormimos. E digo que sei interpretar grande parte de seu comportamento. Obrigação de filho e amigo. Estarei sempre aqui!","2022-11-27 15:20:12","1829581223.0","2022-11-27","15:20:12"
"48676","https://youtu.be/j2A54xTo230","2022-11-27 15:24:05","976062416.0","2022-11-27","15:24:05"
"48677","Vídeo de Waldevan Reis","2022-11-27 15:28:46","1829581223.0","2022-11-27","15:28:46"
"48679","Foto de .","2022-11-27 16:37:59","1275978031.0","2022-11-27","16:37:59"
"48685","https://youtu.be/Hj-pWPD9GBY","2022-11-27 19:34:57","1275978031.0","2022-11-27","19:34:57"
"48686","""Mais umas das mensagem Cifradas Emitidas pelo General Mourão... A Interpretação fica à Critério de cada um!""","2022-11-27 20:24:05","1592601949.0","2022-11-27","20:24:05"
"48691","👁️👨‍👩‍👦‍👦🇧🇷🤜🇨🇳⚖️
*Ricardo Lewandowski propõe desarmamento da população*

Em evento em SP, ministro ressaltou que a revisão da quantidade de armas nas mãos de civis é um dos desafios do próximo governo

https://www.folhadestra.com/ricardo-lewandowski-propoe-desarmamento-da-populacao/

*Nosso Canal no Whatsapp:*

4️⃣3️⃣3️⃣ https://chat.whatsapp.com/BqtJpwJFxnC56csNp7j8hh","2022-11-27 21:03:49","1525740896.0","2022-11-27","21:03:49"
"48692","A preocupação já não é mais sobre quando Bolsonaro tomará uma decisão.

A preocupação hoje é que, tomada a decisão, o tamanho da repercussão terá  uma magnitude mundial!

Quem pensa que é apenas realizar 02 ou 09 prisões está equivocado ou não tem a menor ideia do que isso significa além das fronteiras brasileiras.

Estamos falando de uma Organização de Ordem  Mundial que não temos conhecimento da abrangência. 

O Foro de São Paulo e seus componentes é um dos grupos que integram a ORCRIM e esses influenciadores venceram e calaram as eleições nos EUA. 

Some a tudo isso agora legendas como PCC, CV, HAMAS, Hezbollah, Unitas, MST, MTST, CNBB, FDN, Tríade, N'drangueta, Camorra, Máfia Russa, Agentes Venezuelanos, Cubanos, os interesses do magnata esquerdista Soros e os Iranianos (QUDS), ... que estão em solo pátrio e operam para a instalação de poder que a eles interessa.

Além disso, ainda há fatores como possíveis reações militares por parte de países vizinhos, embora isso seja o menos preocupante, pois todos eles juntos, não fazem frente às nossas Forças Armadas.

Neste sentido, quando for dada a ordem e saiam para restabelecer a ordem e a lei, existe muito em jogo de interesse mundial;  assim, não há que se falar em imediatismo ou precipitação. 

A operação será uma operação de guerra com estratégia e o devido planejamento para prender e neutralizar essas forças. 

Parece não restar dúvida que alguma reação aos desmandos e ilegalidades estabelecidas pela toga venha a ser executada. Afinal todo sacrifício que Bolsonaro vem passando, não pode ser em vão. 

O STF transformou Adélio Bispo, no criminoso mais protegido do Brasil,  e todas as ações tomadas durante o período eleitoral, estão  repletas de ilegalidades com o lado político definido e beneficiado.

 Contudo, mobilizar as tropas, reforçar as fronteiras, pôr  todas as embarcações para patrulhar a Amazônia Azul, lançar toda força do Exército, Marinha e  Aeronáutica, depois de a  esquerda ter aparelhado o estado brasileiro por 20 anos seguidos, não é simples, fácil e pragmático.

Para as Forças Especiais e os Comandantes das 03 forças chegarem a atuar com o devido sentido de reestabelecer a ordem e a legalidade, com vigilância dos principais alvos por parte dos setores de inteligência, há a  exigência de estratégia singular e planejamento,  até que a operação aconteça: esperar o 
 máximo de desgaste dos corruptos e seus apoiadores, com o devido conhecimento público nacional e internacional. 

Não estamos falando de uma operação complexa por parte da PF em cumprir mandados de prisões e de buscas e apreensões. As pessoas envolvidas formam a resistência em nome de forças mundiais. Isso foge à  qualquer referência na história de operações policiais internas. 

Entra numa Operação de Guerra contra Inimigos INTERNOS e EXTERNOS.
Toda situação é complexa e exige muito mais que nossa inocente e primitiva compreensão.

Que Deus ilumine e proteja o nosso Presidente, nosso Ministro da Defesa e nossos comandantes das Forças Armadas e todo povo que vem lutando heroicamente,  clamando por justiça, ordem, progresso e combate forte e definitivo contra todo tipo de corrupto e corrupção.
A luta tem que continuar, incansavelmente, por mais que fuja à  nossa compreensão.

*Não podemos parar ou retroceder*, pois isso será ENTREGAR O PAÍS AOS CORRUPTOS, DEIXÁ-LO SEM FUTURO PARA NOSSOS FILHOS.

*Deus Abençoe, Proteja e Salve o Brasil!* 🙏🏻🙏🏻🇧🇷🇧🇷

Se concorda, por favor REPASSE;

*Por favor, pela sua vida,  pela sua família, pelo Brasil copie e cole e envie essa mensagem para todos seus contatos.* 

*FAÇA ISSO DIARIAMENTE, E O PRINCIPAL FIQUE EM FRENTE AO QUARTEL DA SUA CIDADE.*","2022-11-27 21:04:43","1525740896.0","2022-11-27","21:04:43"
"48693","A preocupação já não é mais sobre quando Bolsonaro tomará uma decisão.

A preocupação hoje é que, tomada a decisão, o tamanho da repercussão terá  uma magnitude mundial!

Quem pensa que é apenas realizar 02 ou 09 prisões está equivocado ou não tem a menor ideia do que isso significa além das fronteiras brasileiras.

Estamos falando de uma Organização de Ordem  Mundial que não temos conhecimento da abrangência. 

O Foro de São Paulo e seus componentes é um dos grupos que integram a ORCRIM e esses influenciadores venceram e calaram as eleições nos EUA. 

Some a tudo isso agora legendas como PCC, CV, HAMAS, Hezbollah, Unitas, MST, MTST, CNBB, FDN, Tríade, N'drangueta, Camorra, Máfia Russa, Agentes Venezuelanos, Cubanos, os interesses do magnata esquerdista Soros e os Iranianos (QUDS), ... que estão em solo pátrio e operam para a instalação de poder que a eles interessa.

Além disso, ainda há fatores como possíveis reações militares por parte de países vizinhos, embora isso seja o menos preocupante, pois todos eles juntos, não fazem frente às nossas Forças Armadas.

Neste sentido, quando for dada a ordem e saiam para restabelecer a ordem e a lei, existe muito em jogo de interesse mundial;  assim, não há que se falar em imediatismo ou precipitação. 

A operação será uma operação de guerra com estratégia e o devido planejamento para prender e neutralizar essas forças. 

Parece não restar dúvida que alguma reação aos desmandos e ilegalidades estabelecidas pela toga venha a ser executada. Afinal todo sacrifício que Bolsonaro vem passando, não pode ser em vão. 

O STF transformou Adélio Bispo, no criminoso mais protegido do Brasil,  e todas as ações tomadas durante o período eleitoral, estão  repletas de ilegalidades com o lado político definido e beneficiado.

 Contudo, mobilizar as tropas, reforçar as fronteiras, pôr  todas as embarcações para patrulhar a Amazônia Azul, lançar toda força do Exército, Marinha e  Aeronáutica, depois de a  esquerda ter aparelhado o estado brasileiro por 20 anos seguidos, não é simples, fácil e pragmático.

Para as Forças Especiais e os Comandantes das 03 forças chegarem a atuar com o devido sentido de reestabelecer a ordem e a legalidade, com vigilância dos principais alvos por parte dos setores de inteligência, há a  exigência de estratégia singular e planejamento,  até que a operação aconteça: esperar o 
 máximo de desgaste dos corruptos e seus apoiadores, com o devido conhecimento público nacional e internacional. 

Não estamos falando de uma operação complexa por parte da PF em cumprir mandados de prisões e de buscas e apreensões. As pessoas envolvidas formam a resistência em nome de forças mundiais. Isso foge à  qualquer referência na história de operações policiais internas. 

Entra numa Operação de Guerra contra Inimigos INTERNOS e EXTERNOS.
Toda situação é complexa e exige muito mais que nossa inocente e primitiva compreensão.

Que Deus ilumine e proteja o nosso Presidente, nosso Ministro da Defesa e nossos comandantes das Forças Armadas e todo povo que vem lutando heroicamente,  clamando por justiça, ordem, progresso e combate forte e definitivo contra todo tipo de corrupto e corrupção.
A luta tem que continuar, incansavelmente, por mais que fuja à  nossa compreensão.

*Não podemos parar ou retroceder*, pois isso será ENTREGAR O PAÍS AOS CORRUPTOS, DEIXÁ-LO SEM FUTURO PARA NOSSOS FILHOS.

*Deus Abençoe, Proteja e Salve o Brasil!* 🙏🏻🙏🏻🇧🇷🇧🇷

Se concorda, por favor REPASSE;

*Por favor, pela sua vida,  pela sua família, pelo Brasil copie e cole e envie essa mensagem para todos seus contatos.* 

*FAÇA ISSO DIARIAMENTE, E O PRINCIPAL FIQUE EM FRENTE AO QUARTEL DA SUA CIDADE.*","2022-11-27 21:05:34","1525740896.0","2022-11-27","21:05:34"
"48695","General Mourão manda claro recado: “Comunistas não passarão!”

#COMPARTILHE

https://www.folhadapolitica.com/2022/11/general-mourao-manda-claro-recado.html","2022-11-27 22:50:00","818412250.0","2022-11-27","22:50:00"
"48696","É um engano achar que acabou

Assista e Compartilhe 👇
https://youtu.be/58kt-w1KINQ","2022-11-27 23:34:05","1277698803.0","2022-11-27","23:34:05"
