"message_id","message","message_utc","from_id","date","time"
"8546","This community was blocked in Brazil following a decision of the Superior Electoral Court (TSE).","2022-10-21 00:22:13","926560611","2022-10-21","00:22:13"
"8548","Pelo bem do Brasil Bolsonaro 22. Chegamos, Nordeste! #ViraBrasil","2022-10-21 05:22:37","1421795025","2022-10-21","05:22:37"
"8549","Como quase todos sabem a Jovem Pan, assim como outras veículos de comunicação, vem sofrendo duros ataques do TSE de cerceamento de opinião e do que podem ou não falar! Inclusive existem temas e palavras que nem podem ser mais tocados no assunto, e cada vez que forem proferidos, eles levam uma multa absurda.

Ontem o pânico de forma genial colocou um ator que supostamente seria um agente do TSE pra ficar rondando todos da mesa para verificar o que eles diriam ou não! Óbvio que não avisaram ninguém sobre isso. 

Muita gente achou que seria algo real, e ficou em choque, mas o que eles queriam mostrar é uma pequena amostra do que já está acontecendo e o que pode vir acontecer de uma forma mais paupável. Hoje são eles, nós nas redes sociais, mas essa conta chegará pra todos, inclusive para aqueles que comemoram isso hoje em dia, se vocês sabem quem chegar ao poder novamente…

@GDOM3M3S","2022-10-21 05:28:38","1421795025","2022-10-21","05:28:38"
"8550","O PRESIDENTE MAIS PATRIOTA DO QUE BOLSONARO NÃO EXISTE 🇧🇷💪","2022-10-21 05:31:38","1421795025","2022-10-21","05:31:38"
"8551","Oh, que pena! 😢","2022-10-21 10:29:51","926560611","2022-10-21","10:29:51"
"8553","https://www.jornaldacidadeonline.com.br/noticias/43178/no-maior-colegio-eleitoral-do-pais-bolsonaro-abre-larga-vantagem-e-vai-consolidando-o-caminho-da-vitoria","2022-10-21 22:43:13","926560611","2022-10-21","22:43:13"
"8554","Pessoal, descobri esse canal hoje. Ele é um excelente e importantíssimo banco de dados do período eleitoral republicano do país. Sem nenhuma narração em off contextualiza o mínimo possível o cenário eleitoral. Recomendo assinar o canal e explorar seus vídeos. Este é o mais recente:

https://youtu.be/q5kGAPWRIpk","2022-10-21 22:48:15","926560611","2022-10-21","22:48:15"
