"message_id","message","message_utc","from_id","date","time"
"6097","🇧🇷 | Presença de nazistas na internet do Brasil dobra em um ano

Em 2022, as células nazistas que se comunicam pela internet mais que dobraram no país, saltando de 530 em outubro do ano passado, para 1.117 este mês.

Geograficamente, esses grupos também se espalharam. Estavam presentes em 249 cidades e hoje estão em 298. O estado de Santa Catarina é o que concentra mais esse movimento. São 320 células. Estes são os dados revelados pela pesquisa da antropóloga Adriana Dias, aos quais o Terra teve acesso com exclusividade. 

Vale lembrar que o nazismo é crime no Brasil e que a liberdade de expressão não pode ser usada para acobertar crimes.

A presença dos movimentos nazistas foi identificada em 22 estados e no Distrito Federal. A Bahia tem quatro células. São Paulo tem 96 células. Em segundo lugar no ranking, vem Blumenau, com 63, seguido por Curitiba, com 50. 

Em aplicativos de mensagens como o Telegram,  Adriana Dias já chegou a monitorar a criação de até 40 grupos em um dia.

*Análise da colunista do Jornal O tempo Tathiane Farah  

Via • O Tempo • @FeedBrasil","2022-11-23 14:33:22","683063097","2022-11-23","14:33:22"
"6120","PL ignora Moraes e insiste em contestar resultado apenas do 2º turno

O PL vai insistir na contestação do resultado apenas do segundo turno das eleições, contrariando a determinação do ministro Alexandre de Moraes, presidente do TSE (Tribunal Superior Eleitoral), de que os questionamentos do partido sobre urnas contemplassem também o primeiro turno do pleito.

A estratégia foi anunciada nesta quarta-feira (23) pelo presidente da legenda, Valdemar Costa Neto.

A manifestação inicial do PL defendendo a invalidação de votos depositados em urnas de modelos anteriores a 2020 foi apresentado na terça (22). No entanto, o relatório utilizado pelo partido do presidente Jair Bolsonaro para fundamentar seu pedido tira conclusões incorretas a partir dos dados identificados, segundo especialistas em computação.

As urnas questionadas também foram utilizadas no primeiro turno, quando o PL elegeu a maior bancada de deputados federais da próxima legislatura —terá 99 cadeiras na Câmara.

Via Folha de S Paulo","2022-11-23 21:18:43","683063097","2022-11-23","21:18:43"
"6121","https://twitter.com/joaquimmonstrao/status/1595488249266552868?t=MctTwonXsGlbnk5Mot8UZw&s=35","2022-11-23 21:39:59","767659521","2022-11-23","21:39:59"
"6122","A musica do hexa ta pronta","2022-11-23 21:39:59","767659521","2022-11-23","21:39:59"
"6131","🇧🇷 | Pai é impedido por bloqueios dos golpistas bolsonaristas de levar filho cego para fazer cirurgia, no Mato Grosso. 

Um pai tentava levar seu filho da cidade de Sorriso até a capital Cuiabá, onde a criança faria uma cirurgia para reverter um quadro de perda de visão. Porém, foi impedido de passar de carro por bolsonaristas que bloqueiam a estrada. 

Um membro dos bloqueios chegou a dizer que não se importava se a criança fosse cega e os mandou ir a pé. 

@FeedBrasil | #Política","2022-11-23 23:44:33","683063097","2022-11-23","23:44:33"
"6107","VAMOS QUE VAMOS!!!!......","2022-11-23 20:52:12","505933650","2022-11-23","20:52:12"
"6108","https://www.youtube.com/watch?v=SJE96knY1pI","2022-11-23 20:52:56","505933650","2022-11-23","20:52:56"
"6109","https://www.youtube.com/watch?v=z8D136Lb9jM","2022-11-23 20:58:53","505933650","2022-11-23","20:58:53"
"6106","olá","2022-11-23 20:51:35","505933650","2022-11-23","20:51:35"
"6087","PL endossa golpismo de Bolsonaro e usa relatório sem provas para pedir invalidação de votos

O PL endossou nesta terça-feira (22) o discurso golpista do presidente Jair Bolsonaro e decidiu pedir ao TSE (Tribunal Superior Eleitoral), mesmo sem apresentar provas de fraude, a invalidação de votos depositados em urnas por ""mau funcionamento"".

De acordo com o partido, mais de 279,3 mil urnas eletrônicas utilizadas no segundo turno do pleito ""apresentaram problemas crônicos de desconformidade irreparável no seu funcionamento"". Para as atuais eleições, a Justiça Eleitoral disponibilizou cerca de 577 mil equipamentos.

As urnas questionadas também foram utilizadas no primeiro turno, quando o PL elegeu a maior bancada de deputados federais da próxima legislatura —terá 99 cadeiras na Câmara.

“Este relatório não expressa a opinião do Partido Liberal. Mas é o resultado de estudos elaborados por especialistas graduados em uma das universidades mais respeitadas do mundo e que, no nosso entendimento, deve ser analisado pelos especialistas do TSE"", disse Valdemar Costa Neto.

Na representação, a coligação aponta um suposto problema em parte dos modelos de urnas eletrônicas utilizados no pleito. Isso impediria a auditoria dos votos nelas depositados, tese que é refutada pelo TSE e por especialistas que participaram da validação do pleito.

Via Folha de S Paulo","2022-11-23 00:23:42","683063097","2022-11-23","00:23:42"
"6091","Nota del Ministerio de Cultura de Cuba.


A la edad de 79 años, falleció en España Pablo Milanés, gran trovador cubano, fundador del Movimiento de la Nueva Trova.

Nacido en Bayamo, en 1943, estudió música en el Conservatorio Municipal de La Habana. Grabó, en 1965, su primer disco, titulado Mis 22 años, considerado el puente entre el Feeling y la Nueva Trova. Integró varias formaciones musicales cubanas, entre las que destaca el Grupo de Experimentación Sonora del ICAIC.

Autor de una obra monumental, su legado musical constituye un referente ineludible de la identidad y la cultura cubanas y sus canciones y magistrales interpretaciones integran por derecho propio la banda sonora de la Revolución Cubana. 

Su extensa y fecunda carrera abarca más de cuarenta fonogramas e inolvidables colaboraciones con numerosos músicos cubanos y con varios de los más grandes artistas de Nuestra América y otras regiones.

Su deceso ocurre justo cuando celebramos el 50 aniversario de ese extraordinario hecho cultural que fue la Fundación del Movimiento de la Nueva Trova, del cual él es uno de los pilares fundamentales. Pablo fue un gran poeta, un gran cantor. Su obra musical es inmortal.

En nombre del Ministerio de Cultura de Cuba, ofrecemos a sus familiares, amigos y admiradores de todo el mundo, nuestras más sinceras condolencias.","2022-11-23 11:36:46","683063097","2022-11-23","11:36:46"
"6093","RACISMO TAMBÉM SE COMBATE COM POLÍTICAS PÚBLICAS! ✊🏾 

Nos governos PT foram criadas a Lei de Cotas nas universidades, Lei de Ensino da Cultura Afro-Brasileira, Estatuto da Igualdade Racial, Lei de Combate à Discriminação Racial e reconhecimento das terras quilombolas.

📌 Saiba mais: https://bit.ly/PT-LegadoRacismo","2022-11-23 13:10:44","683063097","2022-11-23","13:10:44"
"6094","Oi gente. Minha esposa faz esses lulinhas. Quem se interessar, só entrar em contato. Em Niterói combinamos a entrega pessoalmente. Em outros lugares do rio acrescentamos o valor do frete. 
PS: Não sei se pode postar esse tipo de coisa aqui. Se não puder podem excluir, sem problemas. Um abraço","2022-11-23 14:04:02","683063097","2022-11-23","14:04:02"
"6095","O nome do rapaz é Daniel Barros e acabei de ver num grupo aqui do Telegram.","2022-11-23 14:04:02","683063097","2022-11-23","14:04:02"
"6096","Zema mentiu para a população de MG sobre a COVID. Mentiras matam!!","2022-11-23 14:23:28","683063097","2022-11-23","14:23:28"
"6101","Paulo Coelho: fui torturado pela ditadura. É isso que Jair quer celebrar? – Partido dos Trabalhadores
https://pt.org.br/paulo-coelho-fui-torturado-pela-ditadura-e-isso-que-jair-quer-celebrar/","2022-11-23 15:44:24","683063097","2022-11-23","15:44:24"
"6102","Leia esse depoimento do escritor e compositor Paulo Coelho e compartilhe para que todos conheçam um dos aspectos da Ditadura Militar e saibam que pedindo intervenção militar, como estão fazendo, automaticamente, estão pedindo isso...
E saibam também que a tortura não se resume a isso, pois costumam colocar baratas e ratos nas vaginas das mulheres e outros tipos de atrocidades e levavam as crianças pequenas para assistirem à sessão de tortura dos pais. 
Na ditadura militar, o método principal utilizado para conseguir confissões é a tortura, crime hediondo, segundo a Lei 8.072/90, a Lei dos Crimes Hediondos.

Ninguém tem o direito de matar, nem de desejar a morte, nem de torturar!

A tortura é imperdoável! Aliás, sendo um crime hediondo, segundo a Lei 8.072/90, a consequência é (ou deveria ser) a cadeia.
Quem desrespeita um ser humano ou animal e o tortura é um ser desprezível, odioso e psicopata. Também o é quem a elogia e defende.
Só os psicopatas preferem a morte à vida, o sofrimento, ao prazer, a tortura ao bem estar.

Se você é um desses que prefere odiar a amar e é capaz de desejar a morte de alguém, procure tratamento.
E, se conhecer alguém desse jeito, denuncie porque, como vimos, tortura é crime.

#DitaduraNuncaMais
#TorturaCrimeHediondo","2022-11-23 15:44:24","683063097","2022-11-23","15:44:24"
"6103","A HIPOCRISIA BOLSONARISTA NÃO TEM LIMITES ‼️

Ontem o presidente do PL, partido de Bolsonaro, lançou um relatório que ""provaria"" que houve fraude nas eleições, e que 250 mil urnas não poderiam ser consideradas.

📌 Mas além do argumento usado no relatório ser completamente furado, o que chama atenção é o fato do PL ter IGNORADO o fato dessas mesmas urnas ""fraudadas"" terem elegido a maior parte dos parlamentares do seu próprio partido no primeiro turno. 🤦

🤔 Ou seja, a proposta brilhante de tão burra do partido de Bolsonaro é que as urnas deram defeito SOMENTE com os votos pra presidente. O desespero é tanto que eles não conseguem nem tentar fazer sentido.

Fonte: http://bit.ly/3EVJ8VO","2022-11-23 15:53:49","683063097","2022-11-23","15:53:49"
"6104","A amarelinha é nossa, vamos sem medo de vestir nossa camisa e entrar no clima da copa, queremos chapéu, peruca, vuvuzelas, cornetas e muita alegria, vai dar BRASIL! 🇧🇷⭐","2022-11-23 20:30:03","683063097","2022-11-23","20:30:03"
"6111","https://www.youtube.com/watch?v=rdDFQChRixc","2022-11-23 21:03:11","505933650","2022-11-23","21:03:11"
"6114","https://www.youtube.com/watch?v=sjBOm9ZaGl8","2022-11-23 21:08:43","505933650","2022-11-23","21:08:43"
"6116","Boa tarde","2022-11-23 21:10:43","5173898767","2022-11-23","21:10:43"
"6130","Eu autorizo Xandão","2022-11-23 23:39:05","767659521","2022-11-23","23:39:05"
"6123","https://twitter.com/LulaOficial/status/1595532988904775680?t=Uy-C4yoCMvglkhXHvfpCBw&s=35","2022-11-23 21:45:28","767659521","2022-11-23","21:45:28"
"6125","Cadê a tal da bivalente? 💉

O Brasil pode usar duas vacinas bivalentes contra a covid-19 para doses de reforço na população a partir dos 12 anos. 

Mas... o Ministério da Saúde ainda não tem data definida para começar a disponibilizar as novas vacinas pra população.

Te explicamos no Brasil de Fato 📲 https://bdf.sh/tg/h7x4h

==

📲 Recebeu esta mensagem de alguém e quer que as notícias do Brasil de Fato cheguem no seu WhatsApp?

Inscreva-se em nosso grupo: https://bdf.sh/tg/5ezxb","2022-11-23 22:15:00","683063097","2022-11-23","22:15:00"
"6126","https://twitter.com/GadoDecider/status/1595519799425130507?t=GXTxsgQGZvXIpgaEwWBXXg&s=35","2022-11-23 22:52:51","767659521","2022-11-23","22:52:51"
"6127","PQP","2022-11-23 22:52:51","767659521","2022-11-23","22:52:51"
"6128","SUSPEITO DE QUÊ? 
Do Insta do deputado estadual eleito pelo Paraná, Renato Freitas: 
“Fui tratado como bandido por Policiais Militares, dentro da própria Assembleia Legislativa do Paraná. Eu, Renato Freitas, deputado estadual eleito, chamado de suspeito e ameaçado no local para o qual fui eleito, isso é absurdo! Isso aconteceu agora à tarde, dentro da Assembleia Legislativa do Paraná, enquanto eu participava da mobilização contra a privatização da COPEL.”","2022-11-23 23:31:33","683063097","2022-11-23","23:31:33"
"6129","https://twitter.com/falamuka/status/1595561940134334464?t=AyQ_mkMet7ppC0pWPd-zCw&s=35","2022-11-23 23:39:05","767659521","2022-11-23","23:39:05"
