"message_id","message","message_utc","from_id","date","time"
"103091","Crônica de Paulo Briguet, editor-chefe do BSM.
https://brasilsemmedo.com/o-presidente-que-pede-perdao/","2022-10-30 19:50:24","799723433.0","2022-10-30","19:50:24"
"103092","TRUMP EXALTA BOLSONARO E CONCLAMA POVO BRASILEIRO A FAZER 'A ESCOLHA CERTA' (VEJA O VÍDEO)
https://www.jornaldacidadeonline.com.br/noticias/43414/trump-exalta-bolsonaro-e-conclama-povo-brasileiro-a-fazer-e39a-escolha-certae39-veja-o-video
""Vocês tem a chance de reeleger uma das melhores pessoas da política e um dos maiores líderes do mundo.""","2022-10-30 19:50:50","799723433.0","2022-10-30","19:50:50"
"103044","This community was blocked in Brazil following a decision of the Superior Electoral Court (TSE).","2022-10-30 17:48:49","799723433.0","2022-10-30","17:48:49"
"103117","Bolsonaro tá sendo roubado","2022-10-30 22:53:29","799723433.0","2022-10-30","22:53:29"
"103009","Lembrete importante!

Está a disposição o APP de Totalização Paralela do CMIND para ser usado neste segundo turno.
A função desse APP é permitir a fiscalização independente da etapa de Totalização dos Votos. 

Com ele se deve ler os Qrcodes impressos nos boletins de urna que são colados nas portas das Seções Eleitorais depois das 17h. 

O APP permite ler os qrcodes dos BUs, transmiti-los para uma central independente de totalização que posteriormente irá conferir se os resultados mostrados no BU impressos é o mesmo que foi recepcionado e totalizado pelo Administrador Eleitoral (TSE).

Não é necessário instalar o APP, basta acessar sua página em

https://app.totalizacaoparalela.com.br

e seguir as instruções (tem um tutorial explicando como proceder)

Quer quiser colaborar na Fiscalização Independente da Totalização deve comparecer em algum local de votação UM POUCO ANTES das 17h e aguardar o encerramento da votação e a publicação dos BUs impressos.","2022-10-30 09:56:42","1496610207.0","2022-10-30","09:56:42"
"102964","https://youtu.be/n8yoLKWDRN8","2022-10-30 00:43:46","799723433.0","2022-10-30","00:43:46"
"102965","Militantes de Lula e do PT cercaram e  agrediram a Deputada Carla Zambelli quando ela saía de um restaurante.","2022-10-30 00:44:26","799723433.0","2022-10-30","00:44:26"
"102966","O projeto é controle, controle, controle.","2022-10-30 00:44:26","799723433.0","2022-10-30","00:44:26"
"102967","Venezuela: de paraíso a inferno
https://youtu.be/9MxoSLxwKS0","2022-10-30 00:44:39","799723433.0","2022-10-30","00:44:39"
"102968","Dr Jandir Loureiro faz um apelo aos médicos brasileiros. Não votem em quem oprimiu os médicos. Votem em quem lutou pela liberdade e autonomia médica! @medicospelavida","2022-10-30 00:44:53","799723433.0","2022-10-30","00:44:53"
"102969","Esse fala VERDADES e quer o bem de todo o povo brasileiro. ATENÇÃO: AMANHÃ VÁ VOTAR EM JAIR BOLSONARO 22. #Bolsonaro22 #MEI","2022-10-30 00:45:21","799723433.0","2022-10-30","00:45:21"
"102970","AMANHÃ VÁ VOTAR EM JAIR BOLSONARO 22. #Bolsonaro22 #SalarioMinimo","2022-10-30 00:45:21","799723433.0","2022-10-30","00:45:21"
"102971","Você já decidiu seu voto? Tem certeza? AMANHÃ VÁ VOTAR EM JAIR BOLSONARO 22. #Bolsonaro22 #PTnuncamais #LulaNuncaMais","2022-10-30 00:45:21","799723433.0","2022-10-30","00:45:21"
"102972","Você quer um mentiroso ou um honesto para presidente do Brasil? AMANHÃ VÁ VOTAR EM JAIR BOLSONARO 22. #Bolsonaro22","2022-10-30 00:45:21","799723433.0","2022-10-30","00:45:21"
"102973","AMANHÃ VÁ VOTAR EM JAIR BOLSONARO 22. #Bolsonaro22","2022-10-30 00:45:22","799723433.0","2022-10-30","00:45:22"
"102974","Desde outubro de 2018 quando conheci Bolsonaro em sua casa venho ajudando-o VOLUNTARIAMENTE como posso. Mesmo completamente boicotado nas redes sociais, sem máquina (cargo político) na mão, ainda debilitado fisicamente, segui. Fiz minha parte com honestidade, honra e verdade. BOA SORTE PARA TODOS NÓS BRASILEIROS DE BEM. #Bolsonaro22","2022-10-30 00:45:22","799723433.0","2022-10-30","00:45:22"
"102975","A IMPRESSIONANTE ORAÇÃO POR BOLSONARO EM BRASÍLIA (VEJA O VÍDEO) 
https://www.jornaldacidadeonline.com.br/noticias/43392/a-impressionante-oracao-por-bolsonaro-em-brasilia-veja-o-video 
Fé!","2022-10-30 00:45:45","799723433.0","2022-10-30","00:45:45"
"102976","BOLSONARO CONVOCA O POVO, FAZ SUA ÚLTIMA MANIFESTAÇÃO ANTES DA ELEIÇÃO E DEIXA ""22 COMPROMISSOS"" 
https://www.jornaldacidadeonline.com.br/noticias/43397/bolsonaro-convoca-o-povo-faz-sua-ultima-manifestacao-antes-da-eleicao-e-deixa-equot22-compromissosequot 
Um país mais próspero, mais livre e mais seguro para todos...","2022-10-30 00:45:45","799723433.0","2022-10-30","00:45:45"
"102977","BOLSONARO REPUDIA ATAQUES DE LULA CONTRA 14 MILHÕES DE MEIS E PROMETE MANTER APOIO A EMPREENDEDORES (VEJA O VÍDEO) 
https://www.jornaldacidadeonline.com.br/noticias/43399/bolsonaro-repudia-ataques-de-lula-contra-14-milhoes-de-meis-e-promete-manter-apoio-a-empreendedores-veja-o-video 
Presidente garantiu a manutenção dos direitos já concedidos e prometeu liberdade para que o setor cresça e progrida ainda mais.","2022-10-30 00:45:45","799723433.0","2022-10-30","00:45:45"
"102978","NOVOS DETALHES E IMAGENS DE GRAVE ATAQUE CONTRA ZAMBELLI, QUE SACOU A ARMA PARA PROTEGER FILHO DE 14 ANOS (VEJA O VÍDEO) 
https://www.jornaldacidadeonline.com.br/noticias/43400/novos-detalhes-e-imagens-de-grave-ataque-contra-zambelli-que-sacou-a-arma-para-proteger-filho-de-14-anos-veja-o-video 
Ameaças de morte por militantes petistas nas redes, ligam sinal de alerta.","2022-10-30 00:45:45","799723433.0","2022-10-30","00:45:45"
"103059","This community was blocked in Brazil following a decision of the Superior Electoral Court (TSE).","2022-10-30 17:49:51","799723433.0","2022-10-30","17:49:51"
"102979","https://youtu.be/zSgMWd_3mUQ","2022-10-30 01:24:43","799723433.0","2022-10-30","01:24:43"
"102980","CARTA COMPROMISSO EXPOSTA ABAIXO ⬇️","2022-10-30 01:25:20","799723433.0","2022-10-30","01:25:20"
"102982","Bolsonaro divulga carta com 22 compromissos para 2º mandato.
“
- É preciso compreender aqueles que ainda não decidiram e lhes oferecer segurança para que façam a melhor escolha para o futuro da nossa nação. Mais do que promessas vazias e abstratas, o Brasil precisa de um caminho sólido, pautado em ações concretas e, sobretudo, em princípios.

- A partir de 2023, com um Congresso em sintonia com o nosso Governo, será possível avançar não apenas em novas propostas, mas naquelas boas medidas que foram travadas pelo caminho. Dito isso segue abaixo 22 COMPROMISSOS que farão do Brasil um país mais próspero, mais livre e mais seguro para todos os brasileiros:

1. Reduzir maioridade penal para crimes hediondos, como estupro, homicídio e latrocínio.

2. Acabar com a audiência de custódia, hoje um dos maiores estímulos à impunidade no país.

3. Endurecer penas para crimes violentos e os critérios para progressão de
regime.

4. Criar o Estatuto de Direitos das Vítimas, em contrapartida à crescente inversão de valores percebida nas últimas décadas, onde o bandido é a vítima e a polícia e os cidadãos são os vilões.

5. Garantir retaguarda jurídica e excludente de ilicitude para agentes de segurança, respaldando nossos policiais no combate ao crime.

6. Aumentar o Fundo Nacional de Segurança Pública para garantir a aparelhagem e a modernização das forças de segurança.

7. Com as medidas de combate à impunidade apresentadas acima, buscaremos reduzir em mais 20% os homicídios nos próximos 4 anos, chegando a uma queda de 50% do pico de mortes violentas atingido no último ano de governo do PT.

8. Implementar uma Política Nacional de Fortalecimento dos Laços Familiares, um conjunto de medidas e diretrizes que visam incentivar a criação e preservação das famílias, que são a base da sociedade.

9. Garantir o bônus de produtividade de 200 reais adicionais para beneficiários do Auxílio Brasil permanente de no mínimo 600 reais, para estimular o trabalho produtividade e a ascensão dos mais pobres.

10. Entregar no mínimo mais 2 milhões de moradias a famílias de baixa renda.

11. Democratizar os serviços digitais, por meio da isenção de impostos para compra de aparelhos celulares populares e do estabelecimento de uma tarifa social para planos de dados.

12. Aumentar o salário mínimo para 1400 reais em 2023 e acima da inflação todos os anos até 2026.

13. Seguir indicando de forma independente nomes técnicos e de Ficha Limpa para Ministérios, bancos públicos e estatais, impedindo que interesses escusos façam florescer a corrupção sistêmica no Governo.

14. Manter uma política econômica pautada no livre mercado e na responsabilidade fiscal, propiciando um ambiente favorável à atração de investimentos e à geração de pelo menos mais 6 milhões de empregos.

15. Criar e implementar o SUS Online: Modernização dos serviços de saúde pública, com agendamento, pré-triagem e prontuário digital, visando reduzir e zerar as filas nos hospitais (Zap da Saúde).

16. Promover a desoneração da folha de pagamento para profissionais de saúde e buscar a desoneração gradual para os demais profissionais.

17. Corrigir Tabela do IRPF; com isenção para quem ganha até cinco salários mínimos; e implementar o IRPF familiar, que permite um imposto de renda menor para quem realizar a declaração em família.

18. Fazer do Nordeste o centro mundial de geração de energia verde e converter os royalties em benefícios sociais para a população, como o Auxílio Brasil.

19. Implementar o FIES/TEC, para financiar cursos técnicos e profissionalizantes, permitindo aos brasileiros uma inserção maior no mercado de trabalho e um retorno financeiro mais rápido ao estudante.

20. Implementar o Programa Educação para o Futuro, que pretende, com base no sucesso que tivemos com os cursos de alfabetização, disponibilizar para a população também o ensino de Programação, Inglês e Educação Financeira, essenciais para o crescimento profissional.

21. Não controlar nem interferir na imprensa e preservar a liberdade de expressão, inclusive na Internet.

22.","2022-10-30 01:25:42","799723433.0","2022-10-30","01:25:42"
"102983","Não ampliar o número de ministros do Supremo Tribunal Federal; indicar ministros comprometidos com a Proteção da Vida desde a concepção e a Liberdade; e respeitar a independência entre os poderes e a Constituição Federal, a nossa Carta da Democracia.

- Existe muito mais além. Reconstruir um país continental e que foi abandonado por décadas demanda tempo e muito esforço. Mas hoje posso garantir que somos capazes de alcançar os nossos  objetivos e finalmente transformar o Brasil na nação que sempre sonhamos. Até a vitória!

- BRASIL ACIMA DE TUDO; DEUS ACIMA DE TODOS! 🇧🇷”

Jair Messias Bolsonaro","2022-10-30 01:25:42","799723433.0","2022-10-30","01:25:42"
"102986","This community was blocked in Brazil following a decision of the Superior Electoral Court (TSE).","2022-10-30 01:34:37","278066212.0","2022-10-30","01:34:37"
"102987","https://www.metropoles.com/brasil/eleicoes-2022/temer-apos-ser-chamado-de-golpista-por-lula-perdera-preciosos-votos","2022-10-30 01:43:19","799723433.0","2022-10-30","01:43:19"
"102988","Bora pra live!

Ótimas notícias! Finalmente chegou a hora! https://youtu.be/5pz5V3C9TEs","2022-10-30 01:43:31","799723433.0","2022-10-30","01:43:31"
"102989","https://youtu.be/DfYMCff2new","2022-10-30 01:50:48","799723433.0","2022-10-30","01:50:48"
"103041","22 Confirma

#PartiuMissa","2022-10-30 17:48:15","799723433.0","2022-10-30","17:48:15"
"102990","https://youtube.com/shorts/UKh3pS2Ul1k?feature=share","2022-10-30 01:52:39","1518944766.0","2022-10-30","01:52:39"
"102994","Foto de Francisco Brito#22#","2022-10-30 02:43:04","695069625.0","2022-10-30","02:43:04"
"103042","youtu.be/slsOZVagiTE","2022-10-30 17:48:30","799723433.0","2022-10-30","17:48:30"
"102998","https://www.horadoempregodf.com.br/mec-tem-mais-de-100-cursos-online-e-gratuitos-para-varias-areas-veja-como-faze-los/","2022-10-30 03:46:00","799723433.0","2022-10-30","03:46:00"
"102999","This community was blocked in Brazil following a decision of the Superior Electoral Court (TSE).","2022-10-30 03:46:14","799723433.0","2022-10-30","03:46:14"
"103000","Boa noite! #Bolsonaro22","2022-10-30 03:46:24","799723433.0","2022-10-30","03:46:24"
"103003","Jornalista foi testemunha,  das agressões  contra Carla Zambelli..","2022-10-30 08:03:51","1496610207.0","2022-10-30","08:03:51"
"103005","Unidos venceremos o SISTEMA.","2022-10-30 08:43:20","1496610207.0","2022-10-30","08:43:20"
"103011","Foto de Moisés Souza","2022-10-30 10:45:07","1140517410.0","2022-10-30","10:45:07"
"103012","Já votei super tranquilo,  é 22 e 10","2022-10-30 11:40:45","1496610207.0","2022-10-30","11:40:45"
"103016","O capitão já votou.","2022-10-30 12:21:44","1496610207.0","2022-10-30","12:21:44"
"103020","Será  que é Deus agindo?","2022-10-30 14:05:45","1496610207.0","2022-10-30","14:05:45"
"103022","Uma mulher passou mal na carreata do Presidente Jair Messias Bolsonaro ontem em BH e ele gentilmente foi lá dar uma força, Mito de verdade..","2022-10-30 15:47:29","1496610207.0","2022-10-30","15:47:29"
"103023","🌩

🇧🇷🗳 🙌

Antes do voto","2022-10-30 15:47:39","1496610207.0","2022-10-30","15:47:39"
"103043","This community was blocked in Brazil following a decision of the Superior Electoral Court (TSE).","2022-10-30 17:48:49","799723433.0","2022-10-30","17:48:49"
"103028","Foto de João Francisco","2022-10-30 15:48:31","278066212.0","2022-10-30","15:48:31"
"103029","Bolsonaro se encontra com os jogadores do Flamengo campeões da Libertadores no Rio de Janeiro.","2022-10-30 15:49:30","1496610207.0","2022-10-30","15:49:30"
"103031","Ela estava panfletando para o Bolsonaro.

Foi morta pelos traficantes!
É criminoso quem defende este tipo de gente. Senhor nos liberte do comunismo.","2022-10-30 16:53:43","1496610207.0","2022-10-30","16:53:43"
"103037","https://www.msn.com/pt-br/noticias/mundo/presidente-do-pt-pede-que-policiais-rodovi%C3%A1rios-sejam-presos/ar-AA13y41P?ocid=mmx&cvid=91ea63dee8394daab25c2f013e738018","2022-10-30 17:40:03","147647335.0","2022-10-30","17:40:03"
"103038","URGENTE: Bolsonaro tem quase dobro da votação na Nova Zelândia comparado com o primeiro turno; Veja números - Terra Brasil Notícias
https://terrabrasilnoticias.com/2022/10/urgente-bolsonaro-tem-quase-dobro-da-votacao-na-nova-zelandia-comparado-com-o-primeiro-turno-veja-numeros-1/","2022-10-30 17:46:28","799723433.0","2022-10-30","17:46:28"
"103039","Após grande repercussão negativa : PT apaga texto de resolução em que pedia tribunal de exceção - Terra Brasil Notícias
https://terrabrasilnoticias.com/2022/10/apos-grande-repercussao-negativa-pt-apaga-texto-de-resolucao-em-que-pedia-tribunal-de-excecao/","2022-10-30 17:47:00","799723433.0","2022-10-30","17:47:00"
"103040","Bomba: Bolsonaro tem crescimento “assustador” em votação no Japão comparando com o primeiro turno das eleições - Terra Brasil Notícias
https://terrabrasilnoticias.com/2022/10/bomba-bolsonaro-tem-crescimento-assustador-em-votacao-no-japao-comparando-com-o-primeiro-turno/","2022-10-30 17:47:49","799723433.0","2022-10-30","17:47:49"
"103046","Já cumpriu sua missão?
Poste nos comentários sua foto de verde e amarelo e diga de que estado está reelegendo nosso presidente. 
Deus, Pátria, Família, & Liberdade! 
🇧🇷👊🏼♥️","2022-10-30 17:48:49","799723433.0","2022-10-30","17:48:49"
"103048","Deus é conosco! Venceremos!","2022-10-30 17:49:14","799723433.0","2022-10-30","17:49:14"
"103049","Bom dia brasileiros de bem! Vamos votar cedo em Jair Bolsonaro 22. Faça sua parte, saia de casa e VÁ VOTAR. É o destino do Brasil que decidiremos hoje. #Bolsonaro22","2022-10-30 17:49:42","799723433.0","2022-10-30","17:49:42"
"103050","Faça a sua parte. SAIA DE CASA e vá votar em Jair Bolsonaro 22. Não se omita, não vote nulo nem anule seu voto e VOTE AGORA DE MANHÃ. Confio em você brasileiro de BEM para quem eu cantei músicas lindas e amorosas a vida inteira. #Bolsonaro22","2022-10-30 17:49:42","799723433.0","2022-10-30","17:49:42"
"103051","O campeão Flamengo pousa às 08h40 no Galeão/RJ. #Bolsonaro22","2022-10-30 17:49:42","799723433.0","2022-10-30","17:49:42"
"103052","VOTE NO QUE É CERTO. VOTE EM BOLSONARO 22. #Bolsonaro22","2022-10-30 17:49:42","799723433.0","2022-10-30","17:49:42"
"103053","VOTE NO QUE É CERTO. VOTE EM BOLSONARO 22. #Bolsonaro22","2022-10-30 17:49:42","799723433.0","2022-10-30","17:49:42"
"103088","https://youtu.be/beHQTcKeNY8","2022-10-30 19:43:50","799723433.0","2022-10-30","19:43:50"
"103054","VOTE NO QUE É CERTO. VOTE EM BOLSONARO 22. #Bolsonaro22 #MEI","2022-10-30 17:49:42","799723433.0","2022-10-30","17:49:42"
"103055","VOTE NO QUE É CERTO. VOTE EM BOLSONARO 22. #Bolsonaro22","2022-10-30 17:49:42","799723433.0","2022-10-30","17:49:42"
"103056","VOTE NO QUE É CERTO. VOTE EM BOLSONARO 22. #Bolsonaro22","2022-10-30 17:49:42","799723433.0","2022-10-30","17:49:42"
"103057","Nosso Presidente recebendo o campeão Flamengo hoje. #Bolsonaro22","2022-10-30 17:49:42","799723433.0","2022-10-30","17:49:42"
"103058","Feito. Aqui em Salvador o colégio onde votei no mesmo horário no primeiro turno, vazio. #Bolsonaro22","2022-10-30 17:49:42","799723433.0","2022-10-30","17:49:42"
"103060","DOIS CAMINHOS UMA ESCOLHA: O PODER EMANA DO POVO UNIDO, NÃO DO POVO DIVIDIDO 
https://www.jornaldacidadeonline.com.br/noticias/43401/dois-caminhos-uma-escolha-o-poder-emana-do-povo-unido-nao-do-povo-dividido 
Dois candidatos, duas cabeças, duas ideologias, mas, uma só sentença para definir os rumos do Brasil do futuro.","2022-10-30 17:50:47","799723433.0","2022-10-30","17:50:47"
"103061","EU ACREDITO!  
https://www.jornaldacidadeonline.com.br/noticias/43402/eu-acredito 
O BEM é paciente, fiel, resiliente, guerreiro. Como São Miguel Arcanjo ele nunca se entrega e nunca deixa de lutar.","2022-10-30 17:50:47","799723433.0","2022-10-30","17:50:47"
"103062","EM DECISÕES NA MADRUGADA, ZAMBELLI É 'CENSURADA' POR MORAES 
https://www.jornaldacidadeonline.com.br/noticias/43403/em-decisoes-na-madrugada-zambelli-e-censurada-por-moraes 
Multas pesadíssimas...","2022-10-30 17:50:47","799723433.0","2022-10-30","17:50:47"
"103063","NUM ATO LOUVÁVEL E PATRIÓTICO, GENERAL VILLAS BOAS FAZ ALERTA SOBRE OS GRAVES RISCOS DE RETORNO DO PT 
https://www.jornaldacidadeonline.com.br/noticias/43405/num-ato-louvavel-e-patriotico-general-villas-boas-faz-alerta-sobre-os-graves-riscos-de-retorno-do-pt 
A substituição da verdade pelas narrativas...","2022-10-30 17:50:47","799723433.0","2022-10-30","17:50:47"
"103089","https://youtu.be/bGM7AgCskfs","2022-10-30 19:50:03","799723433.0","2022-10-30","19:50:03"
"103064","LULA SE RECUSA A REVELAR QUEM SERIA SEU MINISTRO DA ECONOMIA E PODE ESTAR TRAMANDO ALGO GRAVÍSSIMO (VEJA O VÍDEO) 
https://www.jornaldacidadeonline.com.br/noticias/43381/lula-se-recusa-a-revelar-quem-seria-seu-ministro-da-economia-e-pode-estar-tramando-algo-gravissimo-veja-o-video 
O que Lula e seus cupinxas estão escondendo do povo brasileiro?","2022-10-30 17:50:47","799723433.0","2022-10-30","17:50:47"
"103065","GLOBO TEM UM ÚLTIMO BAQUE ANTES DO PLEITO: UMA DERROTA HISTÓRICA 
https://www.jornaldacidadeonline.com.br/noticias/43404/globo-tem-um-ultimo-baque-antes-do-pleito-uma-derrota-historica 
Será um prenúncio...","2022-10-30 17:50:47","799723433.0","2022-10-30","17:50:47"
"103066","ANITTA TENTA EXERCITAR SUA “LIBERDADE DE EXPRESSÃO” E É TRITURADA PELA ESQUERDA 
https://www.jornaldacidadeonline.com.br/noticias/43406/anitta-tenta-exercitar-sua-liberdade-de-expressao-e-e-triturada-pela-esquerda 
Como eles são intolerantes...","2022-10-30 17:50:47","799723433.0","2022-10-30","17:50:47"
"103067","RESGATAMOS A MATÉRIA QUE A REVISTA VEJA TIROU DO AR COM PESQUISA CATASTRÓFICA PARA O PT 
https://www.jornaldacidadeonline.com.br/noticias/43407/resgatamos-a-materia-que-a-revista-veja-tirou-do-ar-com-pesquisa-catastrofica-para-o-pt 
Caiu como uma bomba perante o ‘sistema’.","2022-10-30 17:50:47","799723433.0","2022-10-30","17:50:47"
"103068","CIDADÃO BAIANO MOSTRA A DIFERENÇA ENTRE BOLSA FAMÍLIA DE R$ 85 E AUXÍLIO BRASIL DE R$ 600 (VEJA O VÍDEO) 
https://www.jornaldacidadeonline.com.br/noticias/43390/cidadao-baiano-mostra-a-diferenca-entre-bolsa-familia-de-r-85-e-auxilio-brasil-de-r-600-veja-o-video 
""Gente, pelo amor de Deus, gente… nada de voltar para 85 reais""","2022-10-30 17:50:47","799723433.0","2022-10-30","17:50:47"
"103069","AO VIVO, LULA DEBOCHA DO POVO E RECONHECE QUE MENTIU SOBRE 'PICANHA' (VEJA O VÍDEO) 
https://www.jornaldacidadeonline.com.br/noticias/43379/ao-vivo-lula-debocha-do-povo-e-reconhece-que-mentiu-sobre-e39picanhae39-veja-o-video 
Descarado!","2022-10-30 17:50:47","799723433.0","2022-10-30","17:50:47"
"103070","JOGADORES DO FLAMENGO, CAMPEÃO DA LIBERTADORES, MANIFESTAM APOIO A BOLSONARO (VEJA O VÍDEO) 
https://www.jornaldacidadeonline.com.br/noticias/43408/jogadores-do-flamengo-campeao-da-libertadores-manifestam-apoio-a-bolsonaro-veja-o-video 
Um gesto significativo.","2022-10-30 17:50:47","799723433.0","2022-10-30","17:50:47"
"103071","JURISTA FAZ ALERTA: “QUANDO NOS DISTANCIAMOS DA CONSTITUIÇÃO, COLOCAMOS O BRASIL E A DEMOCRACIA EM PERIGO” (VEJA O VÍDEO)
https://www.jornaldacidadeonline.com.br/noticias/43418/jurista-faz-alerta-quando-nos-distanciamos-da-constituicao-colocamos-o-brasil-e-a-democracia-em-perigo-veja-o-video
“Nós não podemos permitir que ninguém fora do parlamento fragilize, rompa, viole nossa Constituição”","2022-10-30 17:50:47","799723433.0","2022-10-30","17:50:47"
"103072","NA VÉSPERA DA ELEIÇÃO, APRESENTADOR DA GLOBO ROMPE O SILÊNCIO E DIZ QUE CANAL ATACA BOLSONARO
https://www.jornaldacidadeonline.com.br/noticias/43417/na-vespera-da-eleicao-apresentador-da-globo-rompe-o-silencio-e-diz-que-canal-ataca-bolsonaro
A verdade pode até demorar, mas aparece...","2022-10-30 17:50:47","799723433.0","2022-10-30","17:50:47"
"103073","Bolsonaro vence na Grécia no segundo turno das eleições - Terra Brasil Notícias
https://terrabrasilnoticias.com/2022/10/bolsonaro-vence-na-grecia-no-segundo-turno-das-eleicoes/","2022-10-30 17:51:33","799723433.0","2022-10-30","17:51:33"
"103078","URGENTE: Presidente do PT, Gleisi Hoffmann pede que parlamentares da coligação de Lula “deem ordem de prisão” a agentes da PRF e PM que fazem operações na eleição

https://terrabrasilnoticias.com/2022/10/urgente-presidente-do-pt-gleisi-hoffmann-pede-que-parlamentares-da-coligacao-de-lula-deem-ordem-de-prisao-a-agentes-da-prf-e-pm-que-fazem-operacoes-na-eleicao/","2022-10-30 18:37:44","147647335.0","2022-10-30","18:37:44"
"103087","Vídeo de João Francisco","2022-10-30 19:39:39","278066212.0","2022-10-30","19:39:39"
"103090","This community was blocked in Brazil following a decision of the Superior Electoral Court (TSE).","2022-10-30 19:50:17","799723433.0","2022-10-30","19:50:17"
"103093","ATRIZ GLOBAL SE POSICIONA CONTRA A CENSURA ESQUERDOPATA E ANUNCIA VOTO EM BOLSONARO (VEJA O VÍDEO)
https://www.jornaldacidadeonline.com.br/noticias/43420/atriz-global-se-posiciona-contra-a-censura-esquerdopata-e-anuncia-voto-em-bolsonaro-veja-o-video
Um tapa na cara da hipocrisia da classe artística.","2022-10-30 19:50:50","799723433.0","2022-10-30","19:50:50"
"103094","FAMÍLIA DA PRESIDENTE DO CONGRESSO DOS EUA SOFRE ATAQUE
https://www.jornaldacidadeonline.com.br/noticias/43415/familia-da-presidente-do-congresso-dos-eua-sofre-ataque
Com a descriminalização de ‘pequenos’ furtos? A violência explodiu na Califórnia.","2022-10-30 19:50:50","799723433.0","2022-10-30","19:50:50"
"103095","Apuração da Eleição Ao Vivo https://youtu.be/d8qG7ta3jzg","2022-10-30 19:52:09","799723433.0","2022-10-30","19:52:09"
"103098","https://youtu.be/6i9qH1AMN6E","2022-10-30 20:49:43","799723433.0","2022-10-30","20:49:43"
"103099","This community was blocked in Brazil following a decision of the Superior Electoral Court (TSE).","2022-10-30 20:50:06","799723433.0","2022-10-30","20:50:06"
"103100","Amém 🙏","2022-10-30 20:51:44","1341810852.0","2022-10-30","20:51:44"
"103101","AO VIVO: ESPECIAL ELEIÇÃO 2022! CONTAGEM DE VOTOS NO 2º TURNO (VEJA O VÍDEO)
https://www.jornaldacidadeonline.com.br/noticias/43426/ao-vivo-especial-eleicao-2022-contagem-de-votos-no-20-turno-veja-o-video
Imperdível!","2022-10-30 20:52:01","799723433.0","2022-10-30","20:52:01"
"103103","https://youtu.be/6lk_loRWzr8","2022-10-30 21:32:52","799723433.0","2022-10-30","21:32:52"
"103104","https://youtu.be/sBcO2rZOBt4","2022-10-30 21:33:07","799723433.0","2022-10-30","21:33:07"
"103105","https://youtu.be/lE7Q998KWLs","2022-10-30 21:33:25","799723433.0","2022-10-30","21:33:25"
"103106","This community was blocked in Brazil following a decision of the Superior Electoral Court (TSE).","2022-10-30 21:33:42","799723433.0","2022-10-30","21:33:42"
"103107","This community was blocked in Brazil following a decision of the Superior Electoral Court (TSE).","2022-10-30 21:33:42","799723433.0","2022-10-30","21:33:42"
"103108","Tchau, inutilidade! #Tiktok","2022-10-30 21:33:58","799723433.0","2022-10-30","21:33:58"
"103109","Um dia, talvez, uma grande parcela do povo baiano vai descobrir que foi completamente enganada por gente que NUNCA representou a Bahia mas que elegeu. PARABÉNS a esses PMs baianos e aos de todo o Brasil que fizeram seu trabalho hoje com firmeza e coragem.","2022-10-30 21:33:58","799723433.0","2022-10-30","21:33:58"
"103110","https://youtu.be/lE7Q998KWLs","2022-10-30 21:34:21","799723433.0","2022-10-30","21:34:21"
"103111","https://youtu.be/m18v7OyAB0I","2022-10-30 21:34:34","799723433.0","2022-10-30","21:34:34"
"103112","Vídeo de João Francisco","2022-10-30 22:39:43","278066212.0","2022-10-30","22:39:43"
