"message_id","message","message_utc","from_id","date","time"
"17012","Não entendi.","2022-12-04 13:08:05","5445152088","2022-12-04","13:08:05"
"17010","Eles já sabiam de tudo...","2022-12-04 12:39:26","5690950872","2022-12-04","12:39:26"
"17011","só distorceram a verdade né","2022-12-04 12:42:09","5690950872","2022-12-04","12:42:09"
"16978","Acabei de encontrar uma transmissão ao vivo divertida! 
https://kwai-video.com/l/W6XSC6zk","2022-12-04 00:53:49","1378966387","2022-12-04","00:53:49"
"16979","Mesmo com os 700 bilhões desembolsados durante 2020/2021 (COVID ) e enviados para estados e municípios, o Governo Jair Bolsonaro conseguiu segurar a dívida pública.

É possível e necessário investir cada vez mais na agenda social e sem gerar um buraco nas contas públicas, mas desde que o Estado fique menor e mais eficiente.","2022-12-04 01:16:47","1179699974","2022-12-04","01:16:47"
"16980","não tenho certeza, mas acredito que este vídeo é super antigo, parece que já visualizei este vídeo no ano passado","2022-12-04 01:49:27","5690950872","2022-12-04","01:49:27"
"16981","PESSOAL OLHEM ESTE PERFIL 👇🏻👇🏻

Esta mulher faz varios posts zombando dos patriotas de Londrina.
Vamos fazer uns comentários bem legais pra ela saber que quem ri por último,ri melhor!!

https://www.facebook.com/malu.paltanin1/videos/1195875631337307/?mibextid=Nif5oz","2022-12-04 02:21:34","983301155","2022-12-04","02:21:34"
"16982","https://youtu.be/shMsnIQrlBQ","2022-12-04 02:26:42","1179699974","2022-12-04","02:26:42"
"16992","palhaçada 😆 as FFVA
não precisa de seguidores para agir e manter a proteção e a ordem do povo, indiferente de terem ou nao seguidores eles tem que obedecer ordens do presidente JB e manter a ordem...

PALHAÇADA ação mediante Seguidores

MENSAGEM FAKENEWS
SEGUE AS FFVA QUEM QUISER

ESTUDEM MAIS SOBRE AS FORÇAS ARMADAS E SUAS CONVOCAÇÕES

SEGUIDORES ELES TERÃO SIM
APÓS SUAS AÇÕES E ATOS CONSTITUCIONAIS QUE VEM DO CHEFE SUPREMO E DO POVO!

REOITO: SEGUE AS 3 FORÇAS DA FFVA QUEM QUISER...

MAS VIM FALAR QUE ELES ESTAO ESPERANDO SEGUIDORES PARA AGIR, ISSO É UM ABSURDO!","2022-12-04 11:57:36","5690950872","2022-12-04","11:57:36"
"16993","👆👆👆Nasce em Sinop/MT o João, cujo pais permaneceram os últimos 30 dias de gravidez acampados em uma manifestação pela LIBERDADE do Brasil. Fato justamente homenageado pelo senador Heinze na audiência, no senado, no dia 30/11/22. Bem vindo, João, Deus o abençoe. O país está fazendo SUA PARTE.   Presidente e Forças Armadas,   FAÇAM A VOSSA! Deus os abençoem a todos também.","2022-12-04 11:59:10","1179699974","2022-12-04","11:59:10"
"17008","Hironia","2022-12-04 12:27:03","1179699974","2022-12-04","12:27:03"
"16999","PESSOAL AS FFVA SÃO INSTITUIÇÕES DE DEFESA, E POSSUEM UM SISTEMA MILITAR SÉRIO E RÍGIDO

SEGUIR A MARINHA E AERONÁUTICA
PODEMOS SIM!

MAS NÃO PORQUE,

JÁ tem gente aí 
já falando e trazendo postagens incondicional
que aeronáutica e marinha está esperando seguidores PARA AGIR

ISSO É FALTA DE DESINFORMAÇÃO!","2022-12-04 12:04:49","5690950872","2022-12-04","12:04:49"
"17000","Kk","2022-12-04 12:07:19","1179699974","2022-12-04","12:07:19"
"17001","Não precisa ter bola de cristal para saber qual a ideia….","2022-12-04 12:07:39","1179699974","2022-12-04","12:07:39"
"17002","Viva o estado….. ops, a democracia! Enquanto isso não se vê um picanheiro de calça encravada, muito sofisticado, com prudência e sofisticação dando seus clássicos chiliques cheios de si. Por que será?","2022-12-04 12:07:39","1179699974","2022-12-04","12:07:39"
"17009","NOS GRUPOS ESTÁ CHEIOS DE ESPECIALISTAS E DE SERVIÇOS DE INTELIGÊNCIA 😆

TIRA sua bunda do sofá e VEM PARA AS RUAS, LUGAR DE ESPECIALISTAS É NA PORTA DOS QUARTÉIS 👍","2022-12-04 12:37:55","5690950872","2022-12-04","12:37:55"
"17003","https://youtu.be/den5KeQXpz4","2022-12-04 12:20:02","1179699974","2022-12-04","12:20:02"
"17004","Alguma notícia do nosso presidente?
Ainda tá vivo?","2022-12-04 12:20:55","5445152088","2022-12-04","12:20:55"
"17006","Ta nao ele morreu","2022-12-04 12:24:51","1179699974","2022-12-04","12:24:51"
"17007","O nine foi implantar um dedo e faleceu de teto infelizmente seu presidente Lula faleceu","2022-12-04 12:26:37","1179699974","2022-12-04","12:26:37"
"17013","A sala de transmissão ao vivo de Alexconfeiteiro_rs é muito popular! 
https://kwai-video.com/l/8jl52CNK","2022-12-04 13:28:43","1378966387","2022-12-04","13:28:43"
"17015","https://youtu.be/LC1z-zVo6PY","2022-12-04 14:30:27","1179699974","2022-12-04","14:30:27"
"17019","🚨URGENTE: Diante do silêncio, coube ao vice-presidente Hamilton Mourão revelar o que passa pela cabeça do Bolsonaro neste momento e quais são os seus próximos passos. 


➡️ VEJA: https://investorbr.com/mourao-revela-quais-os-planos-de-bolsonaro-daqui-pra-frente-sera-presidente-de-novo/


📢 Via: @InvestorBrazil

🔗 COMPARTILHEM‼️ ⬆️ Compartilhe nos grupos esta notícia. Só assim todas as pessoas vão ter acesso a tudo que está acontecendo no Brasil neste momento. A grande mídia não vai noticiar estes fatos.","2022-12-04 20:15:11","5978300888","2022-12-04","20:15:11"
"17020","Muita gente está falando sobre esta notícia! 
https://kwai-video.com/p/vjlk9CeC","2022-12-04 20:41:05","5519401622","2022-12-04","20:41:05"
"17025","FOGUETE SUL COREANO A CAMINHO PARA LANÇAMENTO DE ALCÂNTARA (BRASIL)!

O lançamento da empresa Innospace será um marco para nosso Programa Espacial.

Durante a gestão do Ministro Astronauta Marcos Pontes no Ministério da Ciência, Tecnologia e Inovações  no Governo Jair Bolsonaro obtivemos muitos avanços no setor espacial para o 🇧🇷.

Entre eles: 
1. A operação do Satélite SGDC, que atualme te leva internet para mais de 3.000.000 de alunos em escolas rurais e localidades remotas.
2. Lançamento de 4 satélites, incluindo o Amazônia 1 com tecnologia nacional.
3. Aumento da capacidade de monitoramento da Amazônia,
4. Autorização de centenas de milhões de reais do FNDCT para projetos do INPE, universidades e empresas do setor aeroespacial para desenvolvimento de foguetes e satélites.
5. Criação da olimpíada de satélites para preparar futuras gerações de engenheiros aeroespaciais.
6. Inclusão do Brasil no Programa Artemis da NASA, que permite participação de estudantes, startups e pesquisadores em missões para a Lua, Marte e espaço profundo. 

Entre outros avanços...

Quanto ao Centro Espacial de Alcântara (CEA), depois de 20 anos de atraso, logo no 1. semestre de nosso Governo aprovamos no Congresso o Acordo de Salvaguardas Tecnológicas com os EUA, essencial para a operação comercial para gerar mais de US$ 3 Bilhões por ano para nosso Programa Espacial.

Além disso, o Governo Jair Bolsonaro resolveu um problema de 36 anos para as agrovilas Quilombolas da região de Alcântara: titulação de terras!

Ainda, desenvolvemos em parceria com instituições de âmbito Federal, Estadual e Municipal, incluindo as comunidades quilombolas, o Plano de Desenvolvimento Integrado de Alcântara (PDI CEA), para o desenvolvimento sustentável e eficiente da região.

A AEB/MCTI já realizou edital para operação de empresas internacionais em Alcântara sob controle da FAB.

O lançamento da Innospace representa o primeiro foguete internacional no novo modo de operação do CEA.

Neste mês de Dezembro de 2022, graças a nossa gestão no MCTI, Alcântara decola para um novo futuro do Programa Espacial Brasileiro e para o desenvolvimento econômico e social de toda a região de Alcântara!","2022-12-04 21:53:23","1179699974","2022-12-04","21:53:23"
"17026","https://t.me/verdelouro","2022-12-04 22:33:00","5748197374","2022-12-04","22:33:00"
